,er_cool,er_date,er_freinds,er_funny,er_location,er_name,er_photos,er_rating,er_reviews,er_text,er_useful
39,1,10/21/2013,205,12,"Long Island, NY",Marisa D.,714,4.0,309,"Came here for a PRIVATE event! It's small inside but very homey. A little chilly too but well worth it. I had my coat on the whole time I was there. It looks like a great place to grab a few drinks when it's warmer since they have their own little garden/seating area out back. They also have a small place to sit in the front too.I forget what kind of Martinis we had but they were good. A little on the pricey side but good.Can't say anything about their food but the goodies that we ate from the guest chef were quite good. Just thinking about it is making my insides smile happily. The guest chef was a total sweetheart too and was very hospitable. The Guest Chef, his food, his friendliness all get a 5 from me. Cibar... I'll give you a 4. Maybe I'll come back once it's warmer out.",1
40,,5/11/2015,860,,"New York, NY",Molly T.,1415,4.0,443,"This place complete surprised me. I was expecting a tiny, intimate cocktail bar - speakeasy-esque, maybe. While there is a small back room here, the main part of the bar is actually quite spacious. While the drinks weren't mind-blowing, I loved the vibe here.The Gramercy area doesn't exactly scream nightlife. So this was certainly a find. Two things I love: dancing and swanky venues. The issue with these criteria is that they often are most found in clubs. I. Loathe. Clubs. Everything about them. So while Cibar wasn't  a club atmosphere, it had all of the features I long for - and never seem to find. Cibar is intimate (dark, comfy seating) yet crazy energetic. I wasn't here to dance on this particular occasion, but there was a mini dance party going on in the front of the bar while I was sitting closer to the back. We were there around 10/10:30, so it's quite possible that it gets rowdier here as the night goes on. But in this particular instance, the crazy was contained.If I'm remembering correctly, I ordered the Bare Back, which was so-so (my uncertainty was not due to intoxication - it was just a forgettable drink).  It was a whiskey kind of night for me, but in retrospect I should've went with one of their gin cocktails. I have an inkling that they're better, just looking at the menu. And I'm not saying this cocktail was bad, but for the price...mehhh.",4
41,2,8/24/2014,904,8,"New York, NY",Justin L.,34,4.0,988,"I remember looking up Cibar randomly because I needed a place to grab a drink with a friend by Union Square.  We actually decided to hit the Headless Horseman instead, to less than stellar results (see review).  Kind of annoyed after that, I wanted to end the night on a high note and suggested we grab 1 drink at Cibar.  As much as I love old ghost stories, this should've been the move all along.  First off, the place is pretty awesome and eclectic looking inside, with 2 fireplaces, dim but not dark lighting, an array of seating options (bar, tables, chairs/sofas), and an odd, gold theme.  There is also a backyard that we didn't get to check out.  Noise level was a few notches down from being loud.For drinks I got the 'coked up hedge fund guy' (cinnamon-infused Bulleit, fresh lemon juice and bourbon cherries) while my companion got the 'Ok Cupid Cosmo' (cranberry and orange-infused vodka and wildberry juices).  I'm normally not a Bulleit fan but this worked and was a very well made cocktail.  The bartender made the wrong drink at first, but realized her mistake before she even gave it to me.  Otherwise the service was friendly and efficient; that is kind of rare with mixology places.  I tried the other drink too which was good although too fruity to be my cup of tea.  Regardless, we were left to our devices had a nice time.Every time I've been back since, things have been the same.  Drinks have been great, service has been good, and myself and everyone I've been here with has had a nice time.  I know from friends that it does pack out, but I'm always coming at off-peak times so that works for me.  Cibar is a bit pricey, but unlike many cocktail bars you get what you pay for.  Actually, Cibar is pretty much everything you'd want a cocktail bar to be.PS: They also have the worst website know to man but don't judge them on it.  Sorry, advertising nerd in me coming out.",9
42,1,11/15/2014,44,2,"Seattle, WA",Yi H.,716,5.0,335,"Absolutely love this place! The first time I came here was because my girl friend and had to wait for a table at Dear Irving across the street, we came here for a quick drink but ended up staying here the whole night. Then I came back again on a Thursday night without knowing it was Bingo night. It was good fun!Cibar is very cozy and intimate, I love it because you can actually sit with your friend side by side instead of across the table. I love both the couch / sofa and bar counter area. Drink-wise they make delicious and strong drink, got to pace yourself! As far as bar food goes, they serve very good food, but it's not restaurant, so don't come here hungry. Cibar is surely one of my favourite in the Union Square area!",2
43,,9/16/2017,0,,"Hidden Hills, CA",Carly L.,0,1.0,5,"Horrible service. Music was uncomfortably loud. Even after asking multiple times to turn the music down, they refused.",
44,,8/6/2014,684,5,"Los Angeles, CA",Garry C.,69,5.0,101,"Service was impeccable, and the atmosphere is very homely & cozy. The decor is unshameably pink with hints of glamour from the lip chairs to the Asian influenced furniture on the other side. I really like what they did with the space, so it's perfect for gatherings that'll wow your friends in just how unlike the city the place is, or a great place to take a date.Happy hour runs from 5-8pm with a nice selection of cocktails with minor twists. Overall, the bar is perfect in service, ambiance, and drinks. They checked up on us regularly, as they did with other patrons to make sure everyone's happy. The venue is completely unpretentious and a nice home away from home. Did I mention they gave us a complimentary plate of blackberry chocolate cupcakes? That's some hospitality.",3
45,2,3/29/2014,732,12,"Brooklyn, NY",Krista J.,35,4.0,1177,"Cibar is a hidden gem on Irving Place...a really awesome place to take a date. The space takes up the basement floor of a brownstone, including some space in the backyard for those warm weather days. There is a large bar across the right side of the lounge, and more comfortable and eclectic seating (lip chairs, anyone) surrounding two fireplaces and a few leather banquettes on the left side of the lounge. There are some really cool décor features, including unusual but beautiful chandeliers...and the entire space just feels so intimate. The service is friendly and professional. The drinks are expensive, but it's Manhattan. And the food is delicious...$1 oysters during Happy Hour...amazing! I can't wait to go back!",2
46,,8/27/2015,212,,"Brooklyn, NY",michelle l.,60,5.0,59,Cibar is my place to go with good friends! Cute decor and backyard seating! Love their seasonal drinks and great service!,3
47,,2/13/2017,324,,"Manhattan, NY",Sam G.,0,5.0,12,How did I miss this place?!  Been hanging out in Union Square for over a decade and only recently discovered this gem. Such a unique and cool interior design which blends a homey layout with old word glamorous materials...think gold mosaic mirror walls next to park benches. Drinks were delicious and service was super friendly and attentive without being invasive. I will be back!,
48,,7/21/2015,1033,,"Malibu, CA",Graham P.,4,5.0,12,"Something about this discrete gem you can't miss! I walked by twice before discovering my new favorite lounge in the East Side NY! Every detail is handmade with care! Go, enjoy, relax, tell all about!",3
49,,4/1/2015,81,,"New York, NY",Billy M.,87,4.0,41,"We hosted our company Halloween Party here in 2014 and I have been a huge fan ever since. The staff were so accomodating. Management covered every detail and the event was a huge success. We wanted to go back for another go at it, but I think management did not want that ""party"" type atmosphere again?You see this bar lounge give new meaning to quiet, cozy, and intimate. I do not think you will find a place moreso anywhere in the city?So, THE SPOT for a quiet meetup for drinks nearby busy Union Square?Seek no more. Once you visit you'll be hooked!",
50,,8/20/2013,95,5,"Washington, DC",Madhu R.,27,1.0,640,"Cocktails are good~ but pricey. Atmosphere and location is nice.  You'll be able to get a nice drink AND be able to hear your friends.  Plus the patio is really nice in the summer.  The one big downside is that some of the waitresses aren't going to help you out if you don't already know what you want.  The last time I went, I tried to ask her about their  whiskey selection (which is 2 pages of their 6 page menu, so you'd think she'd know a little something), but this exercise was pointless.  Even though this was 5:30pm on a Thurs and the place was almost completely empty, she gave me a sortof a hurried/annoyed/rude look and didn't tell me anything other than ""[...annoyed sighhhh], people usually get Johnny Walker"" and then refused to answer any other questions.  My friend eventually had to step in to give me some insight into what I should get.  Maybe I should have tipped her instead?!Some of the staff is good, so I guess one bad experience isn't indicative.  The first time I went, the African American lady with the purple highlights was really friendly and awesome, so I guess seek her out if you can.",21
51,,6/8/2016,341,,"Manhattan, NY",Josh W.,20,5.0,41,Had a Vanilla & Coconut Mariette Mojito that was PHENOMENAL. Great vibe and outdoor space- perfect date spot. Definitely coming back!,3
52,,6/22/2017,0,,"Queens, NY",Thandi P.,0,2.0,5,"I went for happy hour which was advertised as 5-8pm. When I arrived at 5:30pm, they were wrapping up a kid party. - roughly 20 kids. I felt uncomfortable because I don't believe bars are for children no matter what. Also, there were 2 big dogs that frightened me. I understand now that they were dogs of parents/kids. Then a neighbor (an old lady in a nightie or house dress) stormed into the bar yelling expletives. She was apparently upset because of all the children and their noise. Though the decor is beautiful, my first time experience was less than impressive.",
53,,10/18/2016,367,1,"New York, NY",Brittany B.,3,4.0,24,"This place was absolutely adorable! It was a great spot for a girls night and the backyard is beautiful.  All together the interior design and also the happy hour makes for a good place to go anytime whether it's a date, friendly meeting or by yourself. The only thing is there's limited seating and everyones going to fight you for a spot in the glamorous place.",
54,4,"5/19/2011
            





Updated review",4999,6,"New York, NY",Phil H.,12684,4.0,3286,"About five suffering bastards, a blackberry martini, and a Brooklyn lager all I can remember is some drunk Scottish guy plopping down at our table and being the entertainment for the evening. After the Whitesnake concert at Irving Plaza, Stacey, me, and the uber-cool Amal were still in party mode so we walked across the street to Cibar for some drinks. Was not too crowded with a few couples strewn about and what seemed like a bachelorette party. About 8-10 of these girls were dancing and there were two of them really grinding away at each other basically having sex. Girl on girl action! But one of them was about 6 feet 8 and the other was about 5 foot 3. Looking closer I could swear the tall one was a dude. Was I really that drunk? She/it had women's clothes on. Whatever.The real fun was the drunk Scottish dude who just would not leave our table, even with Amal clowning him hard the whole time. We could not stop snickering and kicking each other under the table. The best is when he told Amal - ""I want to take you back to my sex pad in Tribeca and make Scottish love to you"". I almost peed my pants at that point! He finally got the hint and wandered away. The dude was totally clueless. Surprised Amal did not punch him, but he was harmless, if totally confused. This was my third time at Cibar. It actually is a nice place to hang out, weather with a group or an intimate evening for a couple. Dimly lit, large candles, flower arrangements, nice seating, great cocktails, cool music. Even a back patio to chill out on. A bit pricey, but good quality drinks. Appetizer food options on the menu to snack on also. Pigs in a blanket and nachos - oh yeah!Still, I keep thinking of the movie Braveheart today. That dudes name was William. Yup. WILLLIIIAAAAMMMMM!",6
55,,6/28/2015,74,1,"New York, NY",Jiho S.,127,4.0,528,"Not a bad lounge to grab a cocktail, chances are most people are doing so while waiting for a table at Dear Irving to open up. Nothing wrong with spillover customer traffic. Funky decor with strange chairs, almost like they are overdoing it with the style. Cocktails are standard $14 or so and they much like most places now have your standard fancy cocktail list which some creative names, and slightly different spin on some classic cocktails.",1
56,,4/29/2016,0,1,"Manhattan, NY",Eliza A.,0,5.0,2,Five Stars Given for TUI one of the bars best Bartenders! Cool person. (Sorry don't know the new bartenders) He makes Great Drinks! PLEASE BRING BACK THE LYCHEE MARTINIS!,2
57,,10/3/2016,102,,"Manhattan, NY",Joe H.,1046,4.0,262,"When I think of Manhattan. When I think of grabbing drinks. When I think of relaxing, decompressing, enjoying time with friends, going on a date, Cibar comes to mind. The ambience is amazing. When you walk In there is a low lite environment with comfortable seating and a fireplace. It also has outdoor space. The cocktails are great. You have a nice selection of items to go with your drinks. My favorite drink is the White/dark chocolate martini. I am not a vodka drinker and yet when I go there I order this martini. The presentation and taste is amazing.",
58,2,2/25/2016,409,1,"New York, NY",Holly C.,5,4.0,1256,"We stopped by when we found out the speakeasy we wanted to go to had a 45 minute wait. The atmosphere was interesting - it had a more trendy, lounge-y feel, but on the smaller side. The music was good, although there was only a handful of people. It was a good place for us the end our night, especially because it was the only place that made my old-fashioned well!",2
59,,10/24/2015,7,,"New York, NY",Shista C.,0,4.0,47,"Super cute lounge with great tunes!!  Awesome for intimate group outings or even for a date as there is plenty of seating available and even standing room if you prefer.  It is a little dark in there which can be a good thing I guess.  This spot is for you if want a night out where you can hold conversations rather than dodge spilled drinks or screaming people.I went on a Saturday night around 11 and although it was lively, definitely not packed to the point where you couldn't move.  Which is super important to me at this old age of mine ;)",
60,,8/4/2013,154,2,"Costa Mesa, CA",Tony W.,686,4.0,358,"Good place to get a Martini.  The chocolate martini is my favorite there (it's no longer on the menu but they still make it if you ask for it).It's extremely loud in here, so don't go here if you're looking to do business or are on a 1st date.",1
61,,6/17/2015,226,,"New York, NY",Monica T.,25,4.0,1878,Came here for an event.  Extremely nice ambiance & felt very low key/no pressure.  Not too cramped and there was an outdoor lounge area.  I'm not a drinker so couldn't tell you how the drinks are but no one was nasty to me for ordering water so I had no issues here.,
62,2,11/1/2014,193,2,"Brooklyn, NY",Marjorie W.,63,5.0,217,"Perhaps my new favorite bar in the Union Square area.  Fantastic sexy atmosphere... dim lighting, comfy couches, fireplaces. What's not to love????  PLUS on Halloween it was free champagne for ladies until 11pm.  Amazing!   I will definitely be back.",4
63,,3/12/2016,121,,"New York, NY",Aashish P.,3,4.0,43,"Cool place.  Small, cozy.  I'm guessing a local kind of place.  Cool snazzy feel.",1
64,,5/23/2014,1,11,"Mount Sinai, NY",Joseph S.,1,5.0,41,"Went here last night with a group of 4 for my girlfriend's 21st birthday. Atmosphere was perfect for what I was looking for (chill, laid back but with some good music playing) and the location of the bar is fantastic. Gramercy is a beautiful area as it is, but Cibar definitely finds a way to stand out and differentiate itself amongst numerous other bar/lounge/tavern options. The one thing I must note is the outstanding service/staff. I called ahead the previous day to reserve a table and explained that it was for a birthday. The girl I spoke to on the phone was polite and went the extra mile by reserving us a table right in front of the fire place. We also brough a surprise birthday cake for her, which the staff was more than happy to handle for us. We gave them the signal, and they came out, candles lit, singing happy birthday. I can't say enough how hard it is to find such an accomodating staff in NYC. Drinks are priced as you'd expect in the Gramercy area. $15 for a martini, but they're made well and poured for you right at your table. These are their specialty, so if you go, get one. Personally I suggest the VSOP, it was awesome. Anyway, we'll definitely be going back. Kudos to all the wait staff for making my girl's birthday a memorable one!",4
65,,6/20/2015,353,,"New York, NY",Gillian R.,23,3.0,82,"This is a cute bar on one of my favorite streets in the city. The decor is an interesting mix of colorful Moroccan prints and disco-ball covered furniture. The lip-shaped chairs and garden are also a nice touch. I came for happy hour and had a blood orange martini that wasn't quite up to par with the ambiance. It was kind of disappointing, but I'd be willing to go back and try another just for the vibe.",
66,,2/23/2014,474,3,"Queens, NY",Elizabeth B.,6,1.0,11,"Racists. A bunch of racists. Lonnie, the supervisor, called my friends a bunch of uneducated black women. He grabbed his crotch and called one of them the n word as they were walking out. Apparently, there was a problem because one of the ladies was wearing a turban. Do not patronize this bar. They are far from welcoming; plain discriminatory and stupid. This isn't the first complaint I have heard about this place. I will spread the word to all my friends who frequent supposed ""nice"" classy establishments like these.",61
67,,7/26/2014,71,4,"Manhattan, NY",Timika T.,75,4.0,67,A gem. Great drinks made with fresh juices and seasonal fruits. The watermelon martini and honey do me are two drinks that one should definitely try. There was a live Dj who played great music and the service was great!,2
68,,7/19/2014,133,4,"New York, NY",Naoko M.,0,4.0,404,"Amazing service, delicious martinis. What's not to love?Met up with a group here on a Friday evening. Very chill atmosphere and plenty of room for all of us to sit together. The back patio was closing as we arrived but I can see that area as a great place to be to enjoy the outdoors while sipping a martini.And oh how delicious the martinis are. The watermelon one comes with freshly pureed watermelon. It's got a nice tartness to is that's rather refreshing. The lychee martini was my go-to of the evening. It had the right balance of lychee flavor and delightful vodka. Very smooth and it was very easy to have 3 of these babies (@ $15 each)What makes Cibar so awesome though, was the service. We had a fairly large group of about 12 or so. The server came around at the beginning and wrote everyone's name and order down so that she could give us all separate checks at the end of the evening. Pretty badass. That kind of service goes very far.All-in-all, a fun place to be, and I enjoyed the old school hip hop jams they were playing. Didn't quite fit the decor of the venue, but really who cares? It was all a good time.",2
69,,11/1/2015,13,,"FOREST HILLS, NY",Kate H.,0,1.0,13,"If I could put zero, I would. Was in here for about ten minutes, stood at the bar the whole time, not once did anyone even acknowledge us, forget getting served. Three other people that arrived after us were served before. Left this place immediately. Horrible. It also smelled bad. Old liquor and smoke. Avoid if you can.",2
70,1,7/24/2012,1075,4,"Chinle, AZ",Vivian H.,46,3.0,1948,"The area around Union Square tends to be pretty blase. The problem is, I have already gone to all the cool places in the area. Yea, I'm a snob like that. No seriously, it is really hard to find a cool little bar in this area. You gotta go further South or East.I remember a nice backyard garden, but they make you vacate it around 11pm, because of the neighbors. Bummer, bummer. Service wasn't particularly good, and everything was very unmemorable. But, I do remember the story my friend told me about a trip to Texas. That was probably the highlight of the evening. Seriously, a Republican state being the highlight of my evening? No joke, I am so FUBAR.",1
71,,6/29/2012,758,,"Manhattan, NY",Sean S.,36,3.0,1660,"Cute little bar in Union Square area, with a backyard garden.  That's rare as hell in Manhattan, so enjoy it.I came here on a recent weekday with a friend to grab an early night drink.  My friend's cucumber martini was quite good, and my old fashioned wasn't bad either.  No Little Branch or Hotel Delmano, but still quite good for Manhattan.  LOL",3
72,,8/8/2015,75,,"New York, NY",Jin B.,1,5.0,18,Great place to start off the night. The patio is amazing in the summer time. Check it out!,5
73,,2/9/2014,8,12,"Sacramento, CA",Lee D.,5,4.0,43,"This is a wonderful place, unique seating with couches, sinking arm chairs and a wonderful fire place warming you up in he disgusting New York February cold and snow. We were swiftly greeted, sat and told about the favorites on the menu. We were sat by the fire, but did not get wonderful seating. The comfy arm chairs were busy holding others' scarfs, hats etc. so we had the chairs that made us look like the center of a live art class (with a table that was just above the height of the seat. It like sitting on a preschool class!)My fiancée ordered the Black and White Russian whilst I had the Suffering Bugger. Both were excellent cocktails - the bugger comes with a flaming shot of 151 in the bottom. The cocktail is then poured over the top. Wonderful presentation and very tasty too. We ordered pigs in blankets, which were ok. A good snack to go along side the cocktails.Just after our pigs in blankets, our server was moved on to a high rolling couple, who ordered a very expensive bottle of wine, to taste and send back, and the same again with the next bottle and so on. You know those folks... Anyway. The serving staff were busy attending to their needs and dislikes and we were left with a wonderful guy who seemed to have come out of the kitchen. He liked to try and take cocktails with drink still in them and, although it may have slipped, the bill was thrown on to my lap to pay up and get out!The service kind of sucked at the end which cost the 5th * however I do not think that'll be an issue given the amount of $$$ the other couple were spending!!! I would definitely come back and have more cocktails!!",5
74,1,2/28/2014,219,3,"New York, NY",Ryna D.,2289,5.0,1497,"I can't believe I've never stepped in to this wonderful little gem of a place. I was supposed to meet my friend at Bar Jamon but they were packed. Same story at Casa Mono so I looked at Yelp and realized I had bookmarked Cibar ages ago. So I decided to step in and see if it would suit our needs for the night. Well, as soon as I walked in I was like 'yup, we're staying here.' There is a fireplace. 2 of them. And love seat couches in front of said fireplaces. And dim lighting for romantic musings. Lol! Seriously though, with the charming decor and dim lighting this is definitely a great date spot! But also a great spot for girls night outings. Along with the romantic atmosphere the drink list is quite good. The martinis are lauded by other reviews but I went for a drink called Morgasm. Jack Daniels, fresh strawberry purée, balsamic vinegar. It was delicious! We also ordered some snacks and the sliders were really good. All in all this spot has pretty much everything I look for in a classy drinking spot. I'm definitely coming back again!",5
75,,8/27/2015,60,2,"Manhattan, NY",Shannon W.,73,5.0,360,"in an otherwise bogus (but aesthetically pleasing) part of town, i stumbled upon this place and was like FINE ill go inside. dude, for once in my life i actually made a good call. nachos are done right cause not a single one isn't covered in crap. the atmosphere is on point and dranks are bomb. pro tip: cool bartender rob serves a mean o'douls. good for a date if you're into that sort of thing ew gross cooties",2
