,er_cool,er_date,er_freinds,er_funny,er_location,er_name,er_photos,er_rating,er_reviews,er_text,er_useful
0,3,9/21/2018,342,1,"Union Square, Manhattan, NY",Deana B.,295,5.0,101,"Cibar is a great little cocktail bar tucked away on Irving. They make an amazing Old Fashioned here (sans sugar) and they are even better when enjoyed during their happy hour that goes until 8:00pm. During Happy Hour these are only $10 and they certainly sneak up on you.Cibar is perfect for a date or catching up with friends. I also see a good amount of small, intimate gatherings here. The bartenders are super nice here and know how to make a mean drink. Overall, come here for happy hour and stay until you've realized you had one too many Old Fashioneds : )",2
1,,10/26/2018,211,,"Jersey City, NJ",Jesse S.,96,3.0,109,"Dear Irving was closed for a special event, so we ventured across the street based on the good reviews. It was happy hour so we started ordering away. The happy hour cocktails were less than impressive. Tried both the gimlet and the old fashioned and forced my way through both. Couldn't decide if they were poorly mixed or bad quality alcohol. Based on those two, I didn't even bother trying anything else. I will say I had a sip of the beer of the day and it was decent. Service was slow. Had to flag down a server to get a refill of water or order more drinks. They did however make a point to come around just before happy hour ended, which was much appreciated.",
2,,10/19/2018,217,,"New York, NY",Frank W.,69,3.0,104,"If you want to avoid the crazy wait-time at Dear Irving (directly across the street from Cibar), then definitely consider checking out Cibar for a tamer atmosphere but equally delicious cocktails. Would highly recommend Cibar if you want to avoid Dear Irving.The bar tenders are much more social and provide the perfect personal touch to deliciously crafted cocktails. Although the menu isn't as creative or exhaustive as Dear Irving, you'll still find extremely unique drinks such as a frozen grape cocktail. Try to snag a spot on the plush couches across from the bar - it provides the best people watching while sipping a cocktail and catching-up with an old friend.",
3,,3/17/2018,113,,"New York, NY",Melville G.,593,4.0,326,"Cibar is great little lounge style bar! We stopped by for a couple of drinks before dinner, and we were pleasantly surprised by what we found here!The first thing you notice is the amazing decor. The place is done up in a middle-eastern, moorish sort of way which we thought was really elegant. It was a bit packed when we came since there was a private event going on. We got a seat near the entrance but they graciously accommodated our request to move a bit closer to the fireplace as the spot opened up a little later.Our server was really sweet and friendly and made sure we were well taken care of. The drinks here were a slight let down though, the cocktails though strong were a bit unbalanced with one flavor standing out over the others. Maybe we would have had better luck with some other drinks.Overall an above average cocktail bar in this area, I would be willing to stop by here again.",2
4,,7/23/2018,4,,"Queens, NY",Eli B.,69,4.0,59,"We came here over the weekend for drinks for a friend's birthday. It was pouring rain so the place was completely empty at 10pm on a Saturday night but definitely alright with us as we wanted low-key. They have a variety of different cocktails that cost $14/each but some were very good, others were O-K, depends on your preference. The food was quite pricey but we tried a couple of different appetizers to complement our cocktails. The lounge is very laid back and was a nice place to converse with friends over a few drinks.",
5,,2/25/2018,67,,"District of Columbia, DC",Juan-Luis P.,13,5.0,29,"Great bar between gramercy Park and LES. The cocktails are very well done, the service is great, the music and the ambiance in general is perfect to spend a fun night but still not too crowded. The crowd is in their 40s I guess. Try the Manhattans and order some appetizers, you won't regret.",1
6,4,11/5/2017,947,2,"New York, NY",Jackie S.,3018,5.0,751,"VERY impressed with Cibar! It's 1920's swanky meets Alice in Wonderland topsy-turvy, with an awesome cocktail menu and GREAT music. Who knew this was tucked away on Irving?! A hidden gem!It's beautiful inside, and despite the upscale feel, it's not snooty in any way. The vibe was excellent, as were the drinks. I had the Cognac French 75 which was great, and different. Service was really good too.I'll definitely be back.",7
7,,9/2/2018,118,,"Brooklyn, NY",Kay L.,10,5.0,22,Beautiful beautiful place! Happy hour was wonderful! Loved lounging with my close old time friends. Staff was friendly and the food was delightful! Looking forward to visiting this gem again soon!,
8,,5/24/2018,107,,"New York, NY",Melissa T.,104,4.0,110,"Taking a stroll through Madison Sq park, union Square, Gramercy, Irving area on a beautiful spring day. Seeking a cute spot for cocktails, we found Cibar. Adorable but sleek decor, happy hour, & good music. If you are in the area, check out this place for a different scene.",
9,1,2/18/2018,142,,"Los Angeles, CA",Alyssa H.,28,4.0,542,Came to this bar by accident but actually it was pretty rad. Irving street is a great location. Happy hour until 8 pm. When we came at 6 on Friday it was only empty and at first the decor seemed random (Moroccan + Asian + disco) but as it filled up it actually became fun and unique. The bartender was not overly friendly but the drinks were actually really good!,2
10,,8/2/2018,0,,"Manhattan, NY",Cindy C.,0,5.0,19,"This is my go-to place! I love the ambiance, service, and drinks! I always have a great time when I come here. You have to try the Gimlet! A MUST TRY!",
11,,3/12/2018,26,,"FLUSHING, NY",Kevin L.,174,1.0,109,I had a reservation at 8:45PM on Saturday and I really didn't need one. The place was empty. The bar was small with maybe 10 tables. A couple arrived 15 mins later sat next to us. He said the reason he was at cibar because Dear Irving the bar across the street didn't have any tables available. The service and drinks were average. They didn't have woodford bourbon for my old fashioned!! The place is between a regular bar lounge and a dive bar. The place was dark. The atmosphere was blah. No vibe to this place. Would I come back? I don't think so.,
12,,8/31/2017,134,,"Brooklyn, Brooklyn, NY",Sam K.,351,4.0,190,"Cibar's eclectic decor drew me in - mismatched chairs with decorative throw pillows, big comfy chairs, little tables for 2 and a mirror tiled bar lit with pink lights. It's a basement bar along Irving, pretty easy to miss and pleasantly surprised when I found it.They do have a happy hour with a few minimally discounted cocktails, but no bargain to rave about. Drinks we all about $10+ and they had a pretty all over the place assortment of snacks (price wise and food wise- no common theme or cuisine). Truffle Popcorn was an app standout- and the chips and guac (3x chips to guacamole ratio) were good but nothing special.Drinks wise I went classic here and ordered a margarita, then another, and maybe one more so you know it was good! I can't comment on the balance of the more specialty cocktail offerings, but there were a lot of pretty fruity pink drinks being served up so if I head back that way I'd dare to be more adventurous!",
13,,9/28/2017,0,,"Brooklyn, NY",M L.,61,4.0,40,"I came here for my birthday event and my friends and I had an amazing time. They have happy hour until 8pm, they have a food menu which was important as most of my friends just got out of work and were hungry. The place was spacious and non pretentious. The ambiance was great! It did get really busy around 8-9pm on a Friday night but it wasn't uncomfortably crowded. Our waitress was very attentive and nice. Overall, we had a great time, my friends came up to me and told me they really enjoyed Cibar. I would definitely come back again. It is low key and can be an intimate place for a date or just to catch up with a few friends too.The only reason why I took one star off is because they forgot to make note that all my friends will pay separately. So initially, everything that was ordered was on my tab. The waitress was nice enough to divide it up amongst my friends who needed to leave. But for some reason, at the end of the night, the whatever was left over was still a lot even though everyone paid their share. So In the end we had to still pay for it.I reserved 15 seats via email. The owner was very responsive and accommodating when we were communicating about the reservation. I did mention twice that everyone would be on separate tabs. So I don't know why it wasn't written down. Again, we had a great time. I really enjoyed everything Cibar had to offer and hope to go back. But if you're looking to reserve a table or something along with any special requests, make sure to double check with them when you arrive just in case.",2
14,,5/7/2016,526,1,"Los Angeles, CA",Bree M.,677,5.0,441,"Possibly the only thing I like about NYC so far. Came here for a shoot earlier in the day--the interior is beautiful and unique. Mirrored mosaic walls, comfy seating and they served us coffee in dainty tea cups with saucers. It's a quiet respite from the busy streets outside. Came back at night and tried a Smokehouse cocktail--SO GOOD. And still an oasis of chill compared to any other place I'd been on my working trip.",4
15,,4/23/2018,3,,"Brooklyn, NY",Bernadette P.,10,5.0,21,This was a very pleasant find in Gramercy. I was trying to find a laid back but classy bar/lounge for my friend's bachelorette party and this was one of the few that did not require a ridiculous minimum tab charge. Jennie was helpful in setting up a reservation for our group. We were able to reserve a couch area and it was so much fun! I really love the unique mosaic decor and the fact that this place is in a brownstone/townhouse. We ordered some drinks and a bunch of shots and had a great time. Bartenders were friendly and attentive. I definitely plan to come back to have drinks in the garden area now that the weather is getting nicer!,1
16,3,3/9/2016,815,2,"Brooklyn, NY",Ingrid S.,10936,4.0,1317,"I knew I would like this place when I saw outside the doors they had a complimentary doggy water bowl attached to their menu sign. Both adorable and really convenient. Though, I saw no dogs at the open bar event I went to a few months back in October. The space is chic and has both ample space, a nice lounge area, a disco ball-esque chandelier, and a back patio for warmer months. They had the twinkly lights going on. Cute little tables with a very funky decor. A chair in the shape of dark red lips, many clustered different tiny tables and petite chairs. It's whimsical and girly if anything in decoration. I imagine this would be a great place for a girly gathering or if you are caving into impressing your chic for the night on a date. At this particular event we were happily welcome to try any of their happy hour cocktails and wine on the house. The cocktails were honestly really really delicious. My favorites in particular were: The Hierarchy of Gifts: Prosecco, Lemon Oleo Saccharum, and Peychard's Bitters as well as some kind of special cucumber spicy margarita the bartender made that night off menu. Their old fashioned was good but a bit too strong. It will grow some hair on your chest. And the Ok Cupid's (something I can never wrap my head around and believe in) Cosmo was delicious but girl drink drunk in a cup. The bartender used quality ingredients and mixed all the drinks with excellent precision. Never got flustered with the amount of people and was quite sociable and friendly.A few sampler appetizers floated around. I mostly ate a lot of cheese and bits of brioche but they make seriously one of the best cheeseburger sliders I have ever had in my life. RANDOM. I remember this more than anything else at the event and how juicy and decadent they were. Salivating right now thinking about them. They also served a variety of squash flatbreads and mini wiener dog things. Pretty great place. A bit pricey but its nice for one of those special nights out. Cocktails are marked down from $14 to $9 during happy hour until 8pm. They also have a cocktail on their normal menu called the Ron Draper that I am incredibly tempted to come back and acquaintance myself with.",6
17,6,2/19/2016,950,5,"Astoria, Queens, NY",Stephanie P.,25541,4.0,1044,"Came here awhile back for a sponsored happy hour event. I really love the feel inside - beautiful interior that does a good job of being both funky and classy. Lots of worldly details that look like things brought together after a whirlwind of travels - I realize Cibar probably just worked with a good interior designer, but they did a great job of capturing that feeling of wanderlust and originality. I got to try several cocktails and food items here. I notably asked for an Old Fashioned (my favorite classic cocktail) and it wasn't bad - but it was very strong and missing the complex flavors I appreciate in an Old Fashioned.They had a fantastic cheese and meats selection and I kid you not, Cibar has some of the BEST beef mini-sliders I've ever had. Perfectly cooked medium-rare and wonderfully seasoned. I would totally recommend this place for a girls night out or date.",8
18,,8/15/2016,418,,"New York, NY",Jennifer R.,3232,3.0,354,"We came here for happy hour on a Monday. It was $7 house wine (Turkish blends) and $9 cocktails. I got the house white wine. It was similar to a Sauvignon Blanc, but nothing special. The space is super cool. There's a disco ball, long bars, pink tabletops, comfy chairs and an outdoor garden area.The service was really confusing. We weren't sure whether we were supposed to have a server or get drinks at the bar. Half of us got drinks at the bar. Half of us had our drinks delivered to the table. Only a few of us got water cups... So, honestly not sure if it's bar service or servers during happy hour.If you check in on Yelp you get 20% off, but not happy hour or specials. This is a cool spot, good for chatting intimately or in groups, but I wouldn't rush back here.",
19,,9/24/2017,566,,"Queens, NY",Corinna W.,406,3.0,236,"Cibar is a nice little place with some fancy, dark decor. I like the music. It's not a go-to for me, but I can see the draw for some people.",
20,,1/7/2016,139,,"New York, NY",Colleen D.,351,4.0,144,"I've been to Cibar quite a few times. They recently renovated. The cocktails have all been good, although I wish they'd bring back the chocolate martinis - those were the best! The music selection is always good. Atmosphere is great. Great place to meet up for cocktails. They also have an outdoor patio open in the warmer months.",1
21,,1/26/2018,462,,"San Francisco, CA",Kristin H.,37,4.0,52,"Great cozy little atmosphere. Good for a romantic date after a few drinks elsewhere ;-). Friendly bartenders, friendly bouncer, friendly crowd, lighting on point. Creative cocktails- I especially like the Trustfunder All Coked Up cocktail. I will be back",
22,,2/22/2018,0,,"Bronx, Bronx, NY",A R.,1,2.0,15,really not impressed with this place. I went to this place for my bday on a friday night. They must not have had an event that night because i didnt even hear any music. The location is physically nice but the ambiance i didnt like. My friends and i literally had 1 drink at the bar and started googling places we could go to nearby last minute to have fun and dance.  This would be a better place to go to if you are like on a date or with friends from work where you can sit down relax and talk.,
23,,9/23/2015,488,,"Hoboken, NJ",Michelle C.,4003,5.0,107,"Absolutely adore this bar! My friend and I randomly went to this place. The bouncer recommended us to order ""swipe right"" cocktail and said we would not regret it. He was totally right! We loved the cocktail. It was light in taste and refreshing while we slowly get tipsy. There is a small courtyard outback - it is pretty neat!  It's rare to find such a scene in NY.  Our new spot!",2
24,,12/4/2017,0,,"Upper East Side, Manhattan, NY",Sara W.,0,5.0,6,"I held my husbands 30th birthday party upstairs in the private tea room, and i cant tell you how amazing the evening went. Jennie and her team went above and beyond. The night was truly perfect. From start to finish she was a total delight to work with, and made sure we had everything we wanted. I would gladly hold another event there. Thank you Jennie and Cibar Lounge for an amazing evening!",1
25,6,5/27/2016,268,2,"New York, NY",Lisa F.,978,4.0,434,"Wonderful lounge with fabulously dimly lit cozy romantic ambiance inside and a quaint little outside garden patio great for meeting friends.My friend and I had both been here before at night - but was our first time sitting outside and it was a perfect spot for conversation starting our girls night.Outside patio has rustic lamps and lanterns, flowers, sweet floral tables. Very cozy. Seemed many of the women had the same idea to meet at an outside garden spot with friends as it was mostly pairs and groups of women, along w a few couples on dates.We had a Mezcel drink - which they modified from their drink specialty menu based on my request for less citrus more fruity preference  - the added spicy honey gave it a perfect kick. The small plates menu selection while the truffle popcorn smelled and looked amazing - could be more expansive ... We opted to have a drink then go elsewhere for food as we were hungry and the menu was limited. Highly recommend for drinks and amazing ambiance both inside and the charming outside patio- both great for meeting friends or a date.",7
26,1,5/8/2015,757,1,"Princeton, NJ",Kevin M.,1561,3.0,900,"This is a cool little place tucked away in the Flatiron/Gramercy area that you would probably never notice. Looking like a brownstone, it's a bar/lounge that is especially a good place to come in the warmer months.The inside is decked out in contemporary fashion and there is also a front deck and back patio. The back patio is especially nice as there are a handful of small tables and its shielded from the traffic and noise that comes with the front deck. The front deck is nice as well, but the back is definitely better. The place has an overall lounge vibe and it turns up a few notches after about 7pm.The drinks are just ok in my opinion. I had ""the bareback"" drink which was interesting but not memorable. I also tried a few others that were just ok. If the cocktails were a little better, this place would def get a higher rating from me.Overall it's a pretty cool place from an outside seating standpoint. Thus in the winter months I prob wouldn't venture here just for drinks or inside atmosphere. I'd pass by again if I'm in the area and want a glass of wine or something, but otherwise, I'd go elsewhere for better drinks.",5
27,1,5/27/2016,199,1,"Manhattan, NY",Michael O.,8,5.0,13,Music playing a fun bar to sit at or outside garden to sit at oh wait there is more creative decor inside like a fireplace with lip chairs and fun drinks. I mean legit date spot or just fun place to chill and get drinks. They have happy hours too.Highly recommend,3
28,,9/1/2016,495,,"Manhattan, NY",Alicia C.,740,4.0,794,"Been here twice and the staff is very accommodating at the drinks area great. I love the ambiance here too. It's mix of disco and Middle Eastern style. Lots of bright colors and Arabic gothic patterns but then mirror ball walls and lights. I love it since it's very eccentric. The happy hour is great 5-8PM with a good cocktail list. The vibe gets more loungey as the sun sets. DJ starts to pipe through the beats closer to 8PM and on. The waitress was super friendly and fit our group in a comfortable spot and moved us to an even better one opened up. I've only been for drinks so can't comment on the food, though some folks ordered the truffle popcorn and I got a nibble and that was delicious! I would 100% come back here another time, it's a great spot in a convenient location. A place that you can definitely fit into all parts of your evening. Deal Seeking Diva tip: Happy hour cuts the cocktail prices down $3-$4. Pretty good deal for specialty mixed drinks and it's for 3HRS (5-8PM).",1
29,,8/5/2016,163,,"Brooklyn, NY",Naomi Z.,331,5.0,293,"SOLID happy hour that lasts till 8! The decor is funky & fun and the crowd is never too much. Don't tell too many people about this because it's got too much character for the scenesters to spoil.Come here on a date, with coworkers or friends and enjoy the OK Cupid Cosmo. It's as perfect as the bar itself.Note: 2 single stall bathrooms are located at the back right of the bar. Took me a while to find them...",1
30,,3/3/2018,34,,"New York, NY",Mitra M.,36,4.0,63,"Just walked in while passing by. Really relaxed environment. Not very loud music playing, which was nice and we could talk. But I wish there was better music playing rather than typical music you hear on the radio. Service was really good and the ambience was really nice. I was very disappointed but the cocktail menu though! I thought there would be better choices , i personally didn't like what was on the cocktail menu. But I would go back another time.",1
31,,9/15/2017,523,,"Manhattan, NY",Mary-Sanford A.,2,4.0,10,"Very fun place for a happy hour! My $9 gimlet was delicious with just the right hint of almond syrup that made it interesting. I treated myself to a frozen aperol spritz from the full priced menu and was very pleased as well. It was dark, cozy and bumpin on a a Thursday night let me tell you. I would say if you and your party want a seat on a busier night make a reservation in advance. A big group was also there celebrating a birthday, and it looked like they were having a great time. Anyways, I would definitely check it out!",
32,,1/30/2017,9,,"Denver, CO",Kirsten C.,32,2.0,169,"Stumbled across this bar because dear Irving was closed. While they tried to jazz it up with chandeliers, loud music, and gold tile, it looks like they took a random empty retail space and planted a bar and some seating. THis place has the potential to be so much nicer. I get that you have miscellaneous chairs, but for crying out loud - don't get ones that look like they should be in my grandmothers backyard. Cocktails will run you $14 and they were pretty decent!",
33,,8/20/2015,153,1,"Lower East Side, Manhattan, NY",Anna G.,141,4.0,75,"This place is really a hidden gem in Gramercy. We decided to try it because of the access to a backyard patio, which didn't disappoint. We got there about 6pm on a weeknight and there were only about two people in the place. It's dark inside with exotic decor and the small outdoor patio was cozy and cute. The Happy Hour specials aren't bad with a glass of wine at about $7 and other cocktail specials, which lasted until 8pm. Win! We ordered some shishito peppers which were very well grilled and the serving size was quite large. We also had a nice cheese plate that was decent in size and selection. This is a good spot for catching up with some friends for a decent drink and a few small bites either before or after dinner. The place was packed by the time we left around 10pm. Go enjoy the patio while it's still warm!",5
34,,2/25/2016,75,,"Brooklyn, NY",Julissa A.,59,3.0,108,"I love the Decor of the place. Dark walls that become illuminated with glittering rose gold that give the ambiance a sultry morrocan vibe. I've never eaten here I just come over for martinis and neurons cocktail. The service does what they have to do and that's why they don't get the additional two stars. It seems the bartenders work separate. If I ordered a drink from one bartender and ask for the second one to make it for me, it wouldn't happen. I feel is they worked together customer service portion of this place would improve. The the decor is my favorite part of this place.",
35,1,11/3/2015,103,,"New York, NY",Molly S.,405,4.0,527,"Great find for the area! Right in the middle of Gramercy is a great little trendy bar. This place has a really interesting decor, with plushy couches/low tables and a big bar area...good for a big group or ~hot date~. The specialty drinks are pretty good, and on par with NYC ($10 - $15/drink), and the service was excellent. Would definitely recommend as a fun/chill place to ""go grab drinks"".",1
36,1,12/12/2016,88,,"Brooklyn, NY",Lauren W.,104,2.0,255,"I came here for happy hour on a weekday. The decor is funky: it's a mix of Mediterranean tile-work and 70's disco. Staff did their job but weren't friendly. I ordered a margarita and it was okay. I wanted to order food after looking at the food menu but was informed the chef did not come in that day so they would not be serving food. One employee told my friend that if we were hungry, we could bring in outside food. Two minutes later, another employee reprimanded a group for bringing in outside food. I don't think I'll be back.",
37,4,6/22/2016,5,,"Manhattan, NY",Larissa A.,5,4.0,18,Came for drinks last night. I love the vibe here. Like a Buda Bar feeling but on a nicer level. Others around us were very social and nicely dressed. Very cozy intimate setting. Perfect escape from the usual in the area.My new little getaway for me and my friends.,4
38,,4/10/2017,41,,"New York, NY",Matt R.,1,4.0,156,I went here for the first time in a while for a friends going away party and was not disappointed. The drinks were very strong and the scene was pretty good. I would say it started to die down around 1am. Only downer was the credit card machine died in the middle of the night which slowed service down quite a bit.,2
