,er_cool,er_date,er_freinds,er_funny,er_location,er_name,er_photos,er_rating,er_reviews,er_text,er_useful
155,1,4/5/2011,15,1,"Manhattan, NY",Veronica F.,0,4.0,22,"Went to Cibar last night for Yelp drinks, and LOVED it.I almost could not find it and walked up and down looking for Cibar because it was not marked- but I think that's part of the appeal. You wouldn't know to go there, which made it all the cooler.I had the Lemonicious, which was delightful, although it could have been a touch sweeter. The blackberry sangria was delicious, and would definitely be a favorite summer sangria for me, and I love my summer sangria. The prices normally are higher than what I'd like to pay, but it is worth the money.All in all- awesome. I want to come back.",1
156,4,7/21/2012,674,3,"London, United Kingdom",Julie G.,19,5.0,1000,"It seems to be a Golden Rule in my book that places on Irving can do no wrong and Cibar is just another example that proves my theory to be true.  I have walked past this lounge many times, and ended up here on a whim to see someone that I haven't seen in years.  It was early in the evening (around 6pm) so it was not very crowded, so we sat at the bar and there were more than enough open seats available.  The drink menu is pretty extensive if you're into martinis and specialty drinks.  I was in a wine mood, so we ordered a bottle of the Rioja.  There aren't very many wine choices (three reds, I believe), but what we were given was fine!  The ambiance was very sultry and warm, so makes it a great place for a date.  There is a cute little courtyard in the back but it was too chilly and rainy out last night to head out there.",4
157,1,4/9/2011,80,,"Manhattan, NY",Randy S.,3,3.0,288,"Nice bar, great ambience, a little on the dark side, dimly lit, but I like that. The drinks were pretty good, we enjoyed the suffering bastard and they make a great dirty martini.Minus a star because we dropped a few hundred dollars and the BT didn't even offer to buy us a round -- pretty lame in my book.Not sure if we'll be back...",1
158,2,7/10/2007,3467,,"Glencoe, IL",Andrea R.,1232,3.0,2619,"Wasn't much going on inside this swanky lounge last night, but then again my friends and I weren't looking for too much action on a Monday night. We made ourselves comfy in the middle of the bar and I was about to give this bar 5 stars because I noticed they had vanilla Manhattans on the menu. I have a thing for Manhattans and I love vanilla so this drink was practically made for me! Placed my order and a few minutes later received some disappointing news from the waitress that the bar was out of vanilla.  And so I ordered a glass of Sauvignon Blanc...a regular Manhattan wasn't doing it for me after knowing there could have been vanilla in mine.So that's my experience with Cibar...although can't judge a bar too much after a Monday night appearance. I have been told though that this is a hot date spot and I could see why so if you're looking for a spot to take your honey out in this area...you may want to try Cibar.  And make sure to have a vanilla Manhattan for me!",2
159,,5/7/2014,0,4,"New York, NY",Pearl W.,10,1.0,32,"Extremely loud and sleazy, with a rude staff. Oh yeah...can't wait to go back.",8
160,,12/26/2011,85,,"New York, NY",Malick C.,0,3.0,16,"A few friends and I decided to swing by Cibar for a few post dinner drinks on a Thursday evening last spring. We had anticipated a crowded lounge and were pleasantly surprised when we were able to secure a table for 5 within ten minutes of our arrival.I've been back to ci-bar quite a few times since then. The place is cozy, great for post dinner drinks with a group of friends or pre dinner drinks with a date.",
161,,6/24/2014,10,8,"Derwood, MD",Joshua H.,4,5.0,37,"This place is amazing, definitely one of my top 5 bars/lounges that I've been to.  The staff is great (and great looking haha) and they have some fantastic cocktails.  I love the watermelon margarita and cucumber mint martini!  Yes it's somewhat expensive, especially to someone who is from out of town, but in my eyes it's worth it.  The ambiance is very lounge like, dark but cozy, and there are couches that you can get comfortable on.  It's definitely worth a try!",3
162,,9/18/2011,453,,"Manhattan, NY",Gamal H.,0,3.0,312,"Cibar has a lot of things that a cocktail lounge needs to be good. It has a good location and a decor that gives you a chance to relax and enjoy your drink. It has a decent menu of cocktails and the service and the presentation are both very good (although at times the servers seem a bit confused and overwhelmed). At first glance, Cibar has a winning formula.But the longer I was there, the less comfortable I was. Unlike the best cocktail lounges, Cibar draws in a huge, unruly crowd of post frat revelers who probably don't even know its a cocktail lounge. They stand around drinking beer as if they were hanging out in any generic dive bar. The whole experience was wasted on them and they killed the mellow mood of the room. I'm all for equal opportunity drinking, but the doorman needs to be a little more discriminating.If you can avoid the post frat set, Cibar is a good place to go.Have fun.G",
163,1,2/18/2011,35,,"New York, NY",Victoria G.,21,4.0,136,"If only this dimly lit cocktail din was a bit quieter and a bit easier on the wallet, 5 stars would be a no-brainer.That being said, the martinis were top-notch and the service was excellent...that's really something to be said as numerous bar to server to table hand-offs are painfully slow.The cucumber martini was absolutely divine, though I had to fight the urge to put the cucumber on my eyes (come on, after a long week that sounds truly relaxing ;-)--I behaved myself and instead relished in the delicate spa-like flavors of this refresher.Similarly delicious was the elderflower lychee martini with an orange twist. Again, it's all too easy to find a poorly made lychee martini though I always try; this one was well-balanced and the addition of the lychee and warm orange rind made this worth the $15 price tag. (Well, almost.)All in all, a good flatiron/union squarish martini joint...and with a crowd of mostly 20-30 something good looking guys and gals, it's equally suitable for drinks with a girlfriend, a pre-dinner amuse or a date spot....similar to the vibe and feel of blue owl on the east side minus the snoody bartenders.",1
164,,11/10/2011,146,,"Brooklyn, NY",Michelle H.,2,4.0,26,"Love the crowd, drinks and atmosphere.Service sort of left something to be desired but than again it was crowded.Lot's of after workers in suits, I meet a lot of cool people!",
165,,10/12/2014,1,1,"Brooklyn, NY",Coco B.,5,5.0,26,"Loved this spot, perfect setting for a private small group event, drinks were on point, great music, enough space for a dance floor, great staff, clean bathrooms well stocked which is an a+++, would recommend this to anyone, may even do my own event there next!!",2
166,,4/6/2011,276,,"Staten Island, NY",Gerard P.,5,3.0,372,"Going to review this while the memory is still fresh, and hopefully do it justice. Went here for my first Yelp social event, which was fantastic BTW, last night. As for the bar itself, I thought it did a pretty good job accomodating us, although having never been to a Yelp event before, I can't really make a comparison to past venues. I enjoyed the pizza, as well as the drinks. However, I have to say that they are a bit on the pricey side. Another down side is the atmosphere. Specifically, the music. On the one hand, I want to congratulate them for not saturating their patrons with Lady Gaga and L'il Wayne mashups. On the other hand, blaring music, even music you happen to enjoy listening to, isn't all that conducive to lively conversations. Still, I enjoyed myself and would probably return, all things being equal. Caveat: when you're checking out for the evening, be aware that the gratuity is included in your tab. Kind of removes an incentive for good service, but on the plus side, our waitress was great that evening so I didn't really have a problem with it.",1
167,,6/24/2011,0,1,"New York, NY",Varun V.,4,4.0,493,I love the awesome atmosphere of this place. Seems like they have a backyard (didn't get to go).Do not love the fact the drinks are a total ripoff though.,
168,,9/2/2011,841,,"New York, NY",Cyrus P.,530,4.0,876,"What can I say? I have loved this place for years. The staff is always super friendly. I love that they specialize in Martini's and the special attention they pay to their Martini glasses. It's the attention to detail here that gets me every time. The decor makes it the perfect date or intimate spot to go to. Chic, warm, sexy, cozy, trendy, and just plain beautiful. Perfect in every imperfection, if it has any. My favorites here are the Chocolate Martini and the Raspberry Kamikaze Martini. Now I'm not much of a Martinisseur but whenever I do get to pay Cibar a casual visit, I HAVE to have one of these delicious love potions. You see, I'm convinced that these are love potions/aphrodisiacs made by angels disguised in form of their lovely staff in order to bring love to any first daters that happen to stumble inside this magical lounge. IA must-go-to in the cold winter months for the fireplace and the warmth; it feels very much like the type of lounge I would expect to find somewhere in Aspen during ski season. In the Spring, Summer, and Fall, it is equally as beautiful to be in there alongside someone you require a bit of populated intimacy with. I give this place 4 stars because I am extremely biased, but in my book, this place is a solid 5 hands down. They could do me no wrong and for that I will ALWAYS recommend Cibar for the lover in you, especially if you have never been. I promise you that somewhere down the line, you will be back. Cibar will live in me through my books to come. One word: sexy.Oh. and let's not tell too many people about this place. I like that I can always come in and get a seat.",
169,1,2/23/2011,152,2,"London, United Kingdom",Freya C.,30,4.0,377,"Bt has a date here tonight! Hmph. He actually found this place without my suggestion although if he had happened to ask - new date, U Sq? - I would have pointed him to this very Irving place den.He is super excited (this may be about the prospect of our Urban Rebounding class beforehand though). He is dancing - you know like that dance where you just do circles when you have a hoola-hoop on. Try not to embarrass him too much if you see him but definitely give him a little to blush about because he looks so cute that way. Personally Cibar's delicious Pink Lady cocktail does this for me when I am in need of a little healthy rouge.Garden out the back for that sneaky make-out sesh after your third appletini... or a consolation ciggie when all else fails.I also by complete chance happened to meet Josh here- the ex-boyfriend of my current roommates' ex-roommate... so guess what he's spent more nights in MY room that I have...",
170,1,6/12/2010,21,1,"New York, NY",Jen G.,1,5.0,80,"What a cute little gem we just discovered near Union Square! The lounge has a small open area out front that is very cute and cozy. They also have an open garden-patio out back that is also adorable and has HEAT LAMPS!!! Plus 5 stars for that. The inside is dimly lit with couches and tables and chairs low to the ground. We got there around 10:30pm and there were a few tables to sit at and a few chairs at the bar. Score! We saw lots of couples and also lots of groups of friends chatting it up. At 11pm the outdoor patio closes, so people began to move inside, and by 11:30 the place was packed!! The crowd was mainly mid-20's to early 30's.They have a huge selection of tasty martinis. We ordered a The Pink Lady and a Blackberry Cosmo. Both were pretty delicious, but the Pink Lady, which was ketel one citrus vodka with strawberry lemonade and rimmed with sugar, was the best drink I have ever drunk!!!! HIGHLY recommend it. I then ordered a Suffering Bastard, which was captain morgan's, malibu, ""exotic juices,"" and 151... which the server proceeded to light on fire!! SOO cool. And so delicious. The only downside was that these drinks were $15 each. But they were SOO worth it. This place has an awesome vibe. I will 100% go again!",4
171,,9/2/2011,327,,"Eugene, OR",Darcey H.,128,3.0,188,"Don't get me wrong - there was absolutely nothing wrong with my one and only visit (so far) to Cibar, but i can't comment on the overall food selection or the inside dining area so i don't feel i can give it more than 3 stars, YET. I will definitely go back. we spent a lovely evening in the small well furnished back patio having perfectly chilled and perfectly priced wine. we did have a couple of apps that were well done and tasty.  And our service was very good.",
172,3,3/9/2012,131,4,"Brooklyn, NY",Jeff T.,40,4.0,139,"I came here awhile back for a Yelp event. It's a very nice little candle-lit lounge tucked on the edge of Gramercy. Dare I say that it's romantic? Bringing a date here would not be a bad idea. The drinks are good, the staff is capable, and the music selection provides a decent mix that doesn't stale; it all leads to a great atmosphere that's sure to impress.",5
173,2,4/10/2011,370,,"Brooklyn, NY",DeShaun C.,30,4.0,245,"I came out here for a UYE (a first for me) and it was a good time. Dim lighting, an outdoor area in the back (one that was too cold to visit, unfortunately) and kind staff are all worth noting here. Also worth noting, is how inconspicuous it is. I walked right by at first, and had I not stopped to look at the menu outside, I wouldn't have known where I was.Cibar seems to excel at being dynamic in the way that it can accommodate different crowds in the same space. There was our slowly growing group of yelpers, a gaggle of girls off in a corner, a couple or two floating about, a few people just hanging out by their lonesome...you get the idea. There's no pretentiousness that permeates the air, which is something you come to expect when you enter a classy place in New York. What a pleasant surprise that this didn't exist.Oh yeah, you get kisses when you ask for your bill--Hershey's, of course. Kisses are always nice. As for alcohol, they have a menu that's comprised almost entirely of martinis. That doesn't mean you have to order a martini, though. I had the suffering bastard, which has the impressive distinction of being on fire when it arrives. I did expect a drink named suffering bastard to have a little more kick, but it was a smooth, pleasant drink. That's not a complaint, though.Drinks were half price for Yelp Drinks Week. With that said, they were 8 bucks each. For those of you who remember your multiplication tables, 8 x 2 is 16. That's 16 a pop for a martini--that's a lot, even if the thing has a fiery float of 151 in it.Overall, it was a good experience, good company, and in spite of the cost, I'd go back.",
174,,7/18/2013,81,,"North Haven, CT",A C.,358,3.0,257,Feelin' fancy?  Go to Cibar and hang with the Gramercy set.,
175,1,4/5/2011,131,,"Long Beach, CA",Julia B.,122,4.0,947,First stop on the Yelp Tri Boro Bus Tour!Any bar that lights up a drink with fire is my kind of place - it brings out the inner neanderthal in me! Loved that it's called the Suffering Bastard.,
176,,7/23/2011,167,,"New York, NY",David W.,0,4.0,834,"I agree with everyone else who says this is a nice little post work date spot.  I got to chill outside in the garden with my date as they gave away free margaritas (part of their learn how to make a margarita promotion) so that was definitely solid.  Then they brought out a watermelon martini that my date loved, which she was willing to get not once, twice, nor thrice times, but I think 4?  Ouch...that's a hit to the bill.  Then it started to drizzle so everyone went inside, but some of the employees came out and hooked it up for us by erecting an umbrella that my date and I sat and snuggled under while it began to rain harder.  We also ordered some appetizers, while they weren't memorable for their taste, their portions were huge.  One appetizer/person is definitely enough here, unless you and your date are a couple of fatties.  So yeah, that's my rundown, will probably come back if I need a date spot in this area.",
177,1,4/11/2013,20,,"Brooklyn, NY",Mercedes C.,5,4.0,11,Great date (almost fancy) place if you want to enjoy a cocktail.,
178,,7/30/2010,1062,,"New York, NY",Yuh-Line N.,251,5.0,167,"I dropped into the Cibar for my friend's birthday.  it was kind of dark on the inside but we walked in because the music was charmingly oldies and the staff were immediately friendly.  They made my friend's birthday amazing.  Their really friendly adorably accented DJ, Tommy, was willing to play ""happy birthday"" by stevie wonder for us on request and the pretty waitress was AMAZING and had the mini cupcakes timed TO THE SONG and brought to our table with a candle.  our friend was so surprised!  it was the nicest way to end a hellish week.  the drinks were good.  my friends and I ordered a ton of appetizers.  Nachos (a huge stack with cheese and homemade guacamole), edamame, mini burgers, and of course the mini cupcakes.  they were ALL good.  they made us feel so welcome, the staff were amazing, and the food was great.  oh...and when stevie wonder came on, half the bar started singing with us.  good vibes all around.will definitely be going back.",2
179,,1/26/2013,9,,"New York, NY",Jon C.,0,4.0,9,"Overall: Diggin it...I'd go back if I was in the area. The Good: The waitress was friendly and attentive. It wasn't overly crowded on a Friday night so finding a table wasn't a problem. The drinks were solidly above average. The food was actually really good. The Bad: The drinks were just a little more expensive than I think they were worth. These are $15 martinis and I'd say they're more like $12 quality. Also, the place was very loud. It wasn't crowded but people have to scream to hear each other. It got a little annoying.",1
180,,11/27/2012,36,,"Manhattan, NY",Carmel W.,0,4.0,99,"Came here on a first (and last) date. Took a second to find the place as its a step down from the street, but once I entered, my mood completely changed as I entered the dimly lit space. Although it was raining outside, the ambiance was warm and inviting. The cocktails were phenomenal. If you're in the mood for a dessert drink, like my date was, try the Key Lime cocktail with the sugar-graham cracker dusting around the rim. I stuck to whiskey-based concoctions and was pleasantly surprised. I'll definitely be back for some outdoor cocktails once summer rolls around again.",1
181,,7/30/2010,22,,"Manhattan, NY",Christopher G.,0,2.0,50,"I've walked by this place a billion times and it has good reviews so I decided to try it out.  The ambiance and the space is really nice and the outdoor area is very charming.  The biggest disappointment was in the drinks.  They seem to specialize in martinis but about one or two actually contain gin on the menu.  What is this vodka garbage?  That isn't a martini.  Ok, it comes in a cocktail glass, but that doesn't make it a martini.  Also, when me and my lady ordered the drinks, they were glasses full of sugary syrups with practically no alcohol in them.  We stayed for two drinks and honestly I would have had to have about 6 more before I even felt a buzz.  I don't mind paying $15 for a cocktail, but these are not well-balanced in the least bit.  Also, when I asked for a recommendation and that I like strong and not fruity drinks I was given what tasted like lemonade with ice in it.All in all a nice place to sit with people, but I don't like paying mixologist prices for fruit drinks.",2
182,,4/20/2010,143,,"New York, NY",Bethany P.,14,4.0,359,"I almost instantly fell in love with this place. Despite the fact that my friends and I walked right past it several times wondering how we could have missed it (the bouncer eventually flagged us down when he heard us shouting at each other about which way to go). It has a great vibe, it's a lounge but not it's not too crowded or pretentious. Love the dark lighting the varied furniture in plush fabric. The drinks were well mixed, too. Prices are about what you'd expect from a lounge in the city ($10-12 mixed drinks, $8 ish for beer).We had a good time, the crowd wasn't bad either. Some people were very dressed up, some about halfway so. I definitely want to go back to try the patio which was closed when we were there.",3
183,1,6/20/2010,117,2,"New York, NY",Opinionated B.,45,4.0,307,"It's all too often that I find myself stuck in union square, looking for a chic bar / lounge that is not overrun by college kids.  Oh Cibar, you are the answer to all these toils!  The drinks are a little expensive, but it's worth it since the ambiance is dark and sultry, the drinks are classy and interesting, and the service is really nice!  If you're into sweet drinks, I 100% recommend the pink lady.  It has a sugar rim, and is a delicious mixture of strawberry citrus-y goodness.  There was another drink there that comes in a glass that is on fire!  repeat: ON FIRE!This place is seriously great for any classy drinking occasion.  I came here for a girls night out, but there were plenty of couples enjoying themselves on their romantic dates!",1
184,,5/19/2011,1524,,"Bronx, NY",Jordan W.,3777,4.0,1242,"Cibar was a good spot. I was there for the Bour Tour Event and was about to go back for the UYE a few days later but didn't.  I was kind of confused with the Suffering Bastard.  I thought the name sounded coolbut it was not something with extreme alcohol content.  It seemed that it contained three different types of rum and did in fact taste good.  It was Yelp Drinks week so it was half price drinks though for pretty much everyone and actually for us we got to try a drink for free with the drink ticket right before the bus ride started. Lol, now i am having a flashback of that night, how I did not get on the crazy insane Team Three Way Bus...I stayed on Team Boring Bus, team Let's Do Our Taxes Here.I should've probably gotten the Sangria but at least I got to see the process of making that Suffering Bastard, you know the lighting it up show.  In general to me, $15 a drink is a bit much.  Sangria though might be worth checking out.",
185,,4/24/2011,314,,"Seattle, WA",Errynne B.,31,5.0,153,"This bar is a little hard to find... I don't remember even seeing a sign. If you do happen to find it though, you won't be disappointed.I went in here with a friend because we purchased two tickets to a Martini Making class that they were hosting at the bar. All of the bartenders I was in contact with were very nice and not as standoffish as I am used to.It was open bar for the time of the class... so of course we made sure we tried every martini. There wasn't a single one that we didn't love. The lychee one was AMAZINGly delicious.The catch... $15 for a martini. A little too steep for my taste. If they weren't free as part of the package, I would have had one and peaced out.Other than that, the atmosphere is dressy but laid back. It's so dimly lit that I lost track of the fact that it was still early until I stumbled out and realized it was still daylight.",
186,1,7/20/2010,75,,"Cranford, NJ",Trang N.,6,5.0,235,"Oh Alice, for whatever reason it was that possessed you to stick your head into a pitch black hole, where you just so happened to slip and tumble down to arrive at the mystical land of Wonderland, I think I understand what intrigued you to do so. Although running late I was in no rush to meet my fellow colleagues at Olives a block or so away. Like you I too stumbled but in front of this bar and not through a hole. Rabbit with pocket watch you say? Sorry not in this neighborhood, usually its rats or young college boys. It's like one of those semi close movie magic moments, instead of a beautiful man helping you up, its a beautiful waitress with very very WELL IN DOUBT assets in my face telling me ""after that fall you should come in for a drink."" Sure why not, this little place has no signs. You walk in and there's plenty of chairs and lounges to sit on, with a wonderful 25-35 crowd enjoying their happy hours. Cute little secret garden outside with some of the best cocktails you can have. It's a little haven to sit and a have wonderful conversation with great cocktails.",1
187,,6/15/2013,47,,"Los Angeles, CA",Brittany C.,10,4.0,59,"The cocktails were good but the ambiance left something to be desired, especially since it was a friday night and not at all crowded!",
188,4,11/10/2009,302,1,"New York, NY",Christina M.,52,4.0,483,"If you've ever wanted to impress someone with a dim, swank, slick pricey Martini, all at the convenience of a central location and non-crowded environs, then Cibar is the place for you.  This hip lounge on adorable Irving place Can be intimate and romantic for a first date.  There is also ample space (on a weeknight at least) to get comfortable and have a leisurely chat.  Couples can choose to cozy up next to each other on the plush couches or keep some distance across small cocktail tables.There are no substantial food options, just small portions of expensive dressed up bar food.  Specialty martinis are made with quality ingredients.  Check out their cool web site to read drink descriptions.I'm definitely glad my date took me here; it's a real lady pleaser.",4
