,er_name,er_location,er_freinds,er_reviews,er_photos,er_rating,er_date,er_text,er_useful,er_funny,er_cool
92,Rohenne L.,"San Francisco, CA",403,331,1188,5.0,5/18/2016,"Perfect place to bring your family for weekend brunch! I like it when better than Jean George which is just a few steps away from Nougatine.Nougatine has the casual but elegant look and feel. I love the sunlight that it gets and the open kitchen. My favorite dishes were basically everything we had! Their dishes are simple but done really really well. I loved the French toast - it's not too soggy, has a bit of crunch on the outside but the inside is nice and chewy. The fried calamari was also really yummy. Can't wait to be back again soon!",1,,
93,Sherry Qinxin H.,"New York, NY",5,11,1,5.0,5/5/2018,Went there for winter restaurant week. The service is very good for an upscale restaurant. Food overall is delicate and tasty. The foie gras is really worth trying even though it was not included in the restaurant week menu.,,,
94,Victoria E.,"San Francisco, CA",652,796,15475,5.0,"12/24/2016
            





Updated review","The name threw me off. I've only eaten at Jean-Georges (which is connected to this one) and not Nougatine. But that's not all of it. The girlfriend who made the reservation forwarded me the open table reservation and it says One Central Park West. I am on Central Park South. It's a 5 minute walk. How could things go wrong? Well? The Jean-Georges I ate at is of the same address. I was therefore confused, for one. For two, it shares the same address as the Trump Tower, and let me be clear, it's actually part of the Trump Tower, and being that I'm from the liberal land of San Francisco bay Area, imagine my surprise when I realized 1 Central Park West is synonymous to Trump Tower, but no one wants to just tell me that. Geez. That was a lot of work and unnecessary stress because those machine gun carrying police was not there to guard that building but the Christmas Market which is across from the restaurant. Berlin Christmas Market ripple effect. But I persevered. Everyone knows that I'm not there to see Trump. I'm there to eat. Which is exactly what I told to the lobby guard and they sent me left through the glass door.Once inside,  life was wonderful once again. You cannot go wrong with any JGs. Prix Fixe is a steal at $38. Appetizer, Entree and dessert. Note JG is a three Michelin. A three Michelin means $1400 for two in the Bay Area after wine pairing. My girlfriend ordered off the regular menu and her dishes were bigger but that's to be expected. I think the prix fixe was quite generous in size. I had the tuna tartare and hake. Both were work of art with amazing taste and presentation. Perfect in fact. I then shared the gluten free dessert with my girlfriend as I stole bunch of the mushroom off her steak plate which was the best mushroom I had ever had in my life. I think I need to learn to make mushroom that way. I've eaten at too many Michelin 3, 2 and 1 star places in New York, the most approachable place to me remains to JGs. Not only the service is impeccable, but also they understood their customers. My girlfriend is gluten free and when she said no to delicious bread they immediately offered her gluten free bread. See, not everything affiliated with Trump is bad, this restaurant breathes a sense of relief to fellow San Franciscans travelers. It certainly is a fail safe for me. I'll return, again and again.",5,4,4
95,William D.,"New York, NY",0,53,7,2.0,12/1/2017,"Breakfast yesterday with friend and my 3 year old. Pancakes for my son side of bacon for table. My friend had yogurt and fruit and avocado toast for myself . Food was fine ... unremarkable at best. Not much one can do to wreck these dishes. Avocado toast was served Open faced on a tiny slice of brown bread, one slice of bread cut in half ... $18. Which is fine as my choice to come here and know it is expensive. However the service was again just major disappointment...... basically snooty nasty and unwelcoming...... Check came to $91 for 2 adults and one child ...... did I mention my 3 year old loved the small jars of honey and small spoon. The busboy came out and took them back from him as we were leaving...... my child had pick them up off our table as we were leaving.......  a 2 ounce jar of honey ?You got it ..... last time .......",,,
96,I O.,"North Bergen, NJ",0,12,11,5.0,11/26/2017,"We love doing Thanksgiving at restaurants, so this year Nougatine at Jean-Gorges was up. We were a party of three and it was a unanimous agreement--five stars all the way around. Ryan was our server and he was attentive and courteous. The food was fantastic. Location is beautiful. Great night!",,,
97,Jenny S.,"Pasadena, CA",2102,2513,6849,4.0,12/29/2015,"RW dinner review only for this restaurant located on the bottom floor of the trump hotel--comp sourdough bread: was served cold, not a huge fan of that temperature --mushroom risotto: if you like mushrooms, you'll like this dish that's chock full of em! Loved the zing of the lemon zest--tuna tartare: wasn't too fond of the cold soup pour over--foie gras appetizer: nice bruleed top, but nothing amazing --wild flounder with ravioli: YUM, the ravioli was the ultimate comfort food with a potato filling and the sauce went perfect with the fish--Parmesan crusted chicken: juicy chicken with a zesty sauce--warm chocolate cake with Madagascar vanilla ice cream: can't go wrong with molten cake, pretty standard, although I wish there was more ice cream!!Awesome service even during RW!NOTE: they have a coat check",6,1,5
98,Leo O.,"Queens, NY",198,504,1567,4.0,"6/5/2016
            





Updated review","Came here recently with a group of 4 to try their lunch prix fixe menu. We had made reservations and we were immediately seated upon arrival. The restaurant is in the Trump Tower. They don't have a big name sign out in front so you can easily miss it.I ordered the shrimp salad, crispy black sea bass, and pavlova for dessert. I was able to try the tuna tartare, cheeseburger, roasted hake, and warm chocolate cake.Overall, my favorite dish was the cheeseburger. The meat was super flavorful. I think they add something to the beef before making it into a patty. The yuzu pickles added a different level of flavor profile that really complemented the other components of the burger. One issue I had was the bun. I thought there were too many sesame seeds and there could have been a better choice in bun used for the dish. Despite that, this is an excellent dish and worth the $38 prix fixe.I thought the tuna tartare and shrimp salad were good but nothing out of the extra ordinary. Everything was fairly spot on. I thought the shrimps were over cooked. They were dishes that work and they are very consistent at making these dishes excellent every time. The hake is definitely a meatier fish than the sea bass. Both were great dishes. There wasn't a fishy taste/smell to them. The skin on the sea bass was crispy and not soggy at all. I thought the cauliflower taste wasn't strong enough and overpowered by the other ingredients. Hats go off to the pastry chef that made the pavlova. It was super soft and light. It was contained in this crispy sugar shell (i don't know the fancy name for it) but everything was in harmony for this dish. The choice of sorbet matched the pavlova and the strawberries were fresh and sweet. To me, I thought this was a more complicated dish to make when compared to the chocolate cake. However, the chocolate cake was amazing as well. The chocolate literally oozed out of the cake once you cut into it. The cake was still warm when they brought it out. The cake was so soft and the chocolate was super rich. I initially the cake would be harder that it looked but boy was I surprised. Both were so delicious.The decor is really nice. The place is spacious with tons of natural sunlight. Everything is ""bright"" inside.Overall, great restaurant, definitely worth coming here for the prix fixe. Both of his restaurants are right next to each other and the food come out from the same kitchen. I just wonder if they have a different chef for the dinner menu. I'll come back here for dinner at Jean Georges to see if it's worth it. My suspicion is that you're getting the same chef that cooks for both restaurants. If that's the case, just go to Nougatine to get excellent food at a lower price point.",,,
99,Becky L.,"New York, NY",220,274,1256,5.0,1/4/2016,The restaurant is located in the Trump International Hotel (entrance across from Central Park). Walk in and speak to someone at the desk and he/she will direct you to the left for Nougatine or to the right for Jean George. You can have your coat checked. Nougatine is classy but more casual. Men do not have to wear a jacket or a tie. Some men wore sweaters and some wore dress shirts.Service was amazing. The two servers were attentive. They refilled our coffee and water when our cups were running low. Polite and professional. The main server always addressed us with a smile and good eye contact. Food:Tuna Tartare (2.5/5.0) - The fish was drowning in the pool of ginger sauce. The boldness of the sauce took focus away from the tuna. The dish was beautifully plated.Black Sea Bass (5.0/5.0) - The fish was cooked perfectly. The fish flaked off easily. The mustard sauce was a good contrast to the subtlety of the fish. Vegetables were good too. Chocolate Lava Cake (5.0/5.0) - Amazing.,5,,
100,Jennifer Y.,"Dallas, TX",274,454,2073,5.0,3/30/2016,"NOUGATINE IS SIMPLY FABULOUS!  From this evening on, this gem is my top choice to dine at prior to a Lincoln Center's concert!LOVELY INTERIOR:  stylish placemats, linen napkins, polished silverware, sparkling wine glasses ... fortunate to be seated in front of the picturesque glassed watching the chefs dancing from station to station in their bright and shiny kitchen ... NICEEXTRAORDINARY SERVICE:  wonderful for hostess to have inquired of time constraints of after-dinner activities with our early 5:15pm dinner reservation ... perfect wine pairings throughout the evening by their outstanding sommelier, Tali ... waiter honored my desire of courses to be served at a certain pace ... BRAVOINCREDIBLE DINNER: Crab & Avocado salad: their dressing highlighted the fullness and sweetness of the crabmeat ... Tuna Tartare:  perfect seasoning without masking the fresh tuna ... Foie gras brûlée: amazing ... Mushroom Pasta: al dente, full herb taste ... Dover Sole: will return over and over for this dish ... and, their Warm Chocolate Cake: to die for ... ENCORECheers!",1,,
101,Jake M.,"Washington, DC",2,98,16,5.0,7/25/2018,"Jean-Georges on Columbus Circle is a welcoming, sophisticated find on the edge of Hells Kitchen and the Upper West Side. Sitting in the basement of the Trump International hotel, Jean-George's serves modern cuisine with classical French technique. Diners can either sit on the side of the dining room overlooking the kitchen or on the other side of the French doors leading to the terrace, which itself looks over Central Park. To start, I had the gazpacho. A bowl with raspberries, herbs, and chopped tomatoes was brought to the table by the graceful staff. A waiter-soldier poured the fruity, chunky gazpacho over the garnish to provide for a gazpacho combining smoothness and chunkiness. Next, we ordered the calamari. The squid pieces were perfectly cooked and crispy and were served with a champagne vinegar-based sauce that balanced the saltiness of the fried calamari. Jean-Georges' only mistake in the first part of the meal was the bread. While the multigrain loaf itself was fine, it wasn't warmed and was served with chilled, difficult-to-spread butter, not exactly what one has in mind for a top restaurant. I also tried some of Chef Jean-Georges Vongerichten's famous shrimp salad. The salad is large, and the greens, tomatoes, and other assorted vegetables are dressed in a vinaigrette, while the warm prawns themselves are dressed in a champagne beurre blanc sauce. An amuse bouche of delicious ginger cucumber coconut soup was served somewhat awkwardly right as our appetizers were arriving, not before all the food or between courses as typically served. For my main course, I ordered the crispy Maine lobster. Large pieces of Maine lobster are fried in a mixture of potato starch and oil, compared, interestingly given the Asian (Thai) influences on Vongerichten's cooking, to Japanese tempura. The lobster itself was served over a bed of butter-sautéed cabbage and garnished with a pico de gallo of herbs, tomatoes, and ginger (again, Asian influences). For its price, the Maine lobster was a good deal and was surely delicious. Others I know ordered the steamed black sea bass and the lobster burger. The lobster, for those wondering, is not 24-karat lobster (and I mean karat, not carat, as in the purity of gold alloy, not the mass of a jewel), but rather a mixture of herbs, spices, lobster, and shrimp to bind it all together. It is served with shoestring French fries, a rarity in nouvelle cuisine restaurants. To finish, I ordered Vongerichten's famous warm chocolate cake: a chocolate dome filled with smooth semi-sweet chocolate ganache. On the side, vanilla bean ice cream and, since it was my birthday, a candle and the words ""happy birthday!"" spelled in hardened white chocolate were served. I recommend that you visit Jean-Georges no matter what you're doing... you'll be in for a treat!",,,
102,Jon L.,"Brooklyn, NY",172,125,310,5.0,10/7/2017,"Awesome experience. The salmon crisp with spicy mayo and mint leaves (forgot the menu name) appetizer was complex and delicious on levels I can't even explain. 15-30 seconds into the bite size piece you're still revealing new flavors and it's just literally unbelievable. The service was incredible, it's attached to the 3 Michelin star restaurant Jean Georges so you're getting a slightly toned down version of there. Prices were high but nothing outrageous, considering the food was top top. Although I came as a one time experience based on a recommendation of a friend, I'll definitely keep coming back because the menu had so much to offer and I didn't even scratch the surface of trying it all. Love love love this place, it's on my top favorites list for sure.",,,
103,Judy S.,"New York, NY",313,1107,1132,5.0,12/29/2015,"Absolutely incredible! I really recommend Nougatine for Restaurant Week! It was by far our best experience for Summer 2015. For Appetizers, both dishes were incredibly fresh and reminiscent of our Blue Hill experience. I'm not a salad person. I usually actively avoid salads since I think they're lazy. But both the tomato salad and the squash were very good! It tasted like it was just picked from a garden outside - the ingredients were fresh and tasty (and that's coming from someone who typically doesn't like salads!).1. Summer's Squash and Arugula Salad 2. Heirloom Tomatoes with BasilFor Entrees, the chicken was the star. It was probably the best chicken I've had. It was so tender and tasted almost pork-like in how juicy it was. This is what chicken should taste like! I also really enjoyed the salmon. But unfortunately, baked salmon is never as juicy and tender as poached salmon (We had the poached salmon at Aureole for RW Winter 2015 - so incredible!). Both entrees were fantastic and well worth the Restaurant Week price - highly recommend.1. Salmon Baked with Lemon Crumbs and Sweet Chili Glaze and Swiss Chard2. Free Range Chicken with Summer Radish Salad and Cucumber EmulsionFor Dessert, I really enjoyed the chocolate cake and my dining companion preferred the Parfait. Overall, both were good choices. The cake was what you'd expect of a good lava cake. The right consistency outside and gooey lava on the inside. The compote is less heavy and more of a cleaner option.1. Jean-Georges Warm Chocolate Cake with Vanilla Bean Ice Cream2. Frozen Lavender Parfait with Blueberry CompoteDefinitely do Nougatine for RW - you won't regret it!Update: Also tried the Cherry-Yuzu and Ginger Lemon non-alcoholic drinks - both were delicious! Highly recommend!",2,1,
104,John B.,"New York, NY",773,371,653,5.0,11/4/2015,Its all about the lunch lunch lunch.7 days a week 3 course lunch for 38 bucks sounds too good be true but it's the real deal. The service is tip top and food is fantastic.I woukd definitely recommend the duck confit or sea bass with cauliflower as entree and finish with the infamous chocolate molten cake.Even though its prix fix there are plenty of options and healthy portions.I can't wait to come back and do it all again.,27,11,22
105,Al C.,"Palos Verdes Peninsula, CA",115,327,92,5.0,4/8/2016,This place met all my expectations. Love the location and the vibe. Food was terrific. Not a bad deal at all for lunch and the three course prix fixe menu is just enough to get full. Service was also great.The veal milanese was superb. The tuna tartare is a must-do.,,,
106,Maria C.,"Denver, CO",163,172,4,2.0,7/27/2017,"Let me put it simply: you would get better service and comparable food at your local Chili's. First the server will take 5 minutes to greet you. Ok, not that big of a deal but not what you would expect at a fine dining restaurant. Then he will have zero personality and not make you feel welcome. He will take your order. And then deliver the food to the wrong people and then look offended when you start switching plates around so each person has their respective order in front of them. The food was definitely good, but nothing to really write home about. If you're at a place with such high esteem, you'd expect food you'd want to tell everyone about. Oh and the bottled water for the table is $10/bottle. Only giving two stars because the food was good; if I awarded stars solely on service I'd award 0.",,,
107,Rohan G.,"New York, NY",0,19,1,5.0,3/17/2018,"LUNCH REVIEWThis is my favorite place in the city for lunch. The only thing bad about it (sorry!) is that they have to rent space in trump tower. But onto what's great- the menu is amazing, beautifully seasoned and presented dishes, excellent price point, good service and a lovely ambience.I think for $38 you can't get a better experience. Please keep up the great food and service and bring back the lobster burger!",,,
108,Claire K.,"Rye, NY",5,157,399,3.0,2/18/2017,"I really wanted to love this restaurant (have been wanting to go here for over a year), but I just do not. I made reservations for this restaurant on Valentines Day and was disappointed. When we arrived, we had to wait for a table (despite making reservations more than two weeks in advance)  and our waiter did not even tell us where we should wait... Okay. The food was just OKAY and could have had more flavor.... Our drinks were mediocre and watered down (I had Spanish wine which was good but not great ). Furthermore, the service here was below mediocre. Our waiter could have been more attentive, but he was not. I get that this restaurant was super busy, but this is NYC and a high end restaurant...Good service goes a long way !The only reason why I am giving this restaurant four stars instead of three is because the chef Jean- George was Extremely friendly and took photos with us (thanks again !!!!!). I would love to come to this restaurant when it is not crowded to really judge weather or not this restaurant is worth the money.",,,
109,Eli L.,"Herndon, VA",486,189,5,1.0,1/8/2018,"The food is good. The service isn't. In fact, it's awful. Had lunch with several work colleagues. We arrived perhaps five minutes early for an 11:45 reservation and were seated. They took our orders (all getting the three course pre fixe) in a mostly empty dining room and we let them know we were on a tight schedule. Appetizers appeared relatively quickly--butternut squash soup was sweet, creamy and full of heart wintery flavors--and then we waited. And waited. And waited. People who arrived after us were served. Requests to our waiter and the manager were answered with assurances that our food was on the way had ""had already been plated."" The orders didn't appear. We let them know we wouldn't have time for desert. Still nothing. Finally the food appeared. Salmon crusted with poppy seeds was good but not great--likely flash frozen (which is not bad...better actually than day old fresh)--without the fresh notes you'd typically get from really good salmon. The waiter then delivered our check. No apology for bad service... just for it taking a long time. Nothing comped. (Not even a cup of coffee.) While the food was pretty good and the place may be worth visiting for people on a flexible schedule, the service we received was just sub par...and for no good reason.",,,
110,Henry Y.,"New York, NY",374,758,1,4.0,2/20/2018,"Not much to add here other than that the $37 prix fixe on weekends is worth it. Service is decent but won't blow you away. Food is good and will make up for this, however.",,,
111,Henali P.,"Manhattan, NY",153,210,66,4.0,1/16/2017,Wow! my first experience at a Jean-Georges restaurant and it was a memorable! We had made reservations but decided to arrive early and were seated 15 minutes before our time. This rarely happens in NYC! Very attentive and knowledgable staff. Loved everything that we ordered. The sauce in tuna tartare and black sea bass was amazingly flavorful! Drinks were very well made and exactly how I had suggested (more balanced). *Taking one star off for the seating arrangements that they have here...we were seated in a little box area covered so I couldn't really people watch and see the entire restaurant*,,,
112,Eda D.,"Manhattan, New York, NY",1,9,17,2.0,3/25/2018,It was a nice place but we didn't go for dinner. We got appetizers and drinks then we ate desert. The waitress make us rush. She was kind and kindly made us rush.,,,
113,Amit J.,"Jersey City, NJ",1601,197,543,5.0,10/2/2016,"Pro: Amazing food, friendly and personal service, great ambiance and atmosphere, perfect view of Central Park. Cons: No cons. I went here yesterday for a special occasion, and I'm really glad we went. There's nothing I have to say about this place, everything was impressive and perfect! We tried the pre-fixed lunch menu, which was reasonably priced and delicious. The three course food was amazing- I had the Creamy Tomato Soup as the Appetizer and Sesame Crusted Salmon for the main entree, both were great! For dessert, I had the mixed berry pastry with strawberry sorbet, which was a bit tart but unique. Red wine was also very delicious. Service was absolutely perfect, from checking in, to the hostess and especially the waitress who was very pleasant, informed, personable and attentive. I very much look forward to going back soon!",2,1,1
114,Ceecee Y.,"New York, NY",277,157,88,5.0,5/23/2017,"Nougatine is one of my favorite spots in New York City. It can be kind of hard to get a reservation at a normal time (especially during Restaurant Week), so I could plan ahead of time and make a reservation a week or two in advance. The restaurant offers a fairly affordable $38 three course pre-fix lunch with a lot of delicious options. I have yet to be disappointed by any dish that I've tried there. (If you do go for the pre-fix or feel hungry for dessert after a meal, I would highly recommend the warm chocolate cake).",1,,
115,Teresa S.,"Forest Hills, NY",307,1125,2882,4.0,8/31/2015,"My friend and I ate here for restaurant week and this was my dining choice. It's been bookmarked for me to try for years. We arrived on time and had to wait a short time before we were seated. The restaurant reminded me of an older traditional classy room. The colors were soft and the staff were amazing regarding customer service. I remember looking up and always seeing staff looking around to be available for guests. For my entrée, I had the Greek salad that tasted weird and had this sour taste that I kept saying omg what is in this? Duh, I was eating the olives that I don't like so once I got rid of them I was able to enjoy the rest of my salad. I remember at one point one of the waiters, Brian came over to ask if I was okay because of the face I made from the olives. He asked if I wanted to change my salad and I said no thank you and he was insistent it wouldn't be a problem which was very considerate.  I had the chicken for my entrée and it was good, you really can't mess up chicken, wait that's not true but the chicken here was moist and tasty. For dessert, I had the chocolate ganache cake which was really good since I am true chocoholic. Overall, we had a great experience here and the customer service was outstanding.",3,3,2
