,er_name,er_location,er_freinds,er_reviews,er_photos,er_rating,er_date,er_text,er_useful,er_funny,er_cool
146,Tian Z.,"Manhattan, NY",301,74,61,5.0,8/11/2016,"WOW! Joining a devoted army of New York foodies during restaurant month, I have say that Jean-Georges is undoubtedly the best one my boyfriend and I have tried- 5 stars well deserved! First of all, the ambiance of the restaurant is so elegant and serene, making you feel comfortable dining and wining there all day long. Making a reservation in advance is highly recommended if you are trying to make your way to splurge in what the restaurant has to offer during restaurant month. To start off the $42 prix dinner during restaurant week was the Arugula salad, I ordered salmon for the entree and hot chocolate cake as dessert. I need to scream out how good the salmon tasted because of its tender texture (medium rare) and special mixed coconut sauce complementing it. Hands down one of the best salmon dishes I've ever had at a restaurant!!! Salad was fresh and flavorful just as expected. Dessert was da BOMB- with hot chocolate immediately flowing out as you cut it. Last but not the least, I LOVE the staff here at Jean-Georges; they are super polite and friendly! Anyway, I would definitely come back again with my family :)",,,
147,Michelle L.,"Saint Louis, MO",171,1237,2112,5.0,1/3/2017,"My very good friend took me to lunch at Nougatine at Jean-Georges for my birthday. Yes she's a very good friend. We decided to share two appetizers and two entrees. I ordered the Burrata (Poached Mission Fig Vinaigrette and Arugula) and she ordered the Crab Cake (black pepper, Asian Pear, and Endive.) We each ate half then switched plates. The Buratta was amazing. It was soft on the inside and the fig vinaigrette gave it just the right amount of acid and sweetness. The best component of the crab cake plate was the black pepper sauce that sat next to it. It packed a sweet and peppery punch. For the entrees I ordered the Spaghetti (with Brussels Sprouts and Pistachio Pesto) and my friend ordered the Veal Milanese (with Parmesan, Escarole, and Lemon.) The Spaghetti was DELICIOUS. This was by far my favorite of the four dishes. The spaghetti was al dente, the Brussels sprouts were perfectly cooked, and the pistachio pesto was everything I wanted and more. It was so flavorful. If they sold this in a jar I'd line up to buy it. The Veal Milanese was great too but the spaghetti was the daily winner for me! Wow, what a great restaurant. The service was impeccable. When is my next birthday?",2,,2
148,J. Karim A.,"New York, NY",59,742,334,5.0,"6/23/2016
            





Updated review",I've been coming here for almost 10 years. It's still an impeccable lunch. And at $38 is a steal for the quality and quantity. The shrimp salad was very good and buttery. The hake was delicate and had a nice kick to it with the ginger. The legendary chocolate lava cake is still fantastic. Service is impeccable. Beautiful space. Try and sit by the Windows.,,,
149,Bibi M.,"Queens, NY",0,36,0,1.0,4/21/2018,"I am so disappointed to report a food poisoning incident. We enjoyed the food and the service, but about an hour later we both had food poisoning. :( Its so sad, we were really excited to eat here. Guess it goes to show that just because its an upscale restaurant doesn't mean they're doing things right in the kitchen.",,,
150,Demi Chuxuan R.,"San Diego, CA",30,18,37,3.0,8/7/2016,"We came here for restaurant week, but left with disappointment. The restaurant was really nice and modern, but its restaurant week menu doesn't worth to try. FOOD:Watermelon Gazpacho: it sounds fancy but it just tasted like some sour salty salad dressing. Not a fan. Seared Salmon: definitely good quality fish. The sauce was a little weird to me. It's super western sweet-salty flavor orange/carrot mixed sauce. Warm chocolate cake: it's from the 3-star Michelin kitchen. It's good but tbh it's just like any good lava cake, nothing surprise. I saw other table ordered from its regular menus and they all looked pretty good. Maybe I'll go try their food again after restaurant week.SERVICE:All the waiters/waitresses are very polite and friendly. Absolutely has a high level of service. AMBIENCE:It's very casual. Not serious as the 3-star Michelin restaurant next door. There's a full bar too. Pretty nice.",,,
151,Noriko S.,"Jersey City, NJ",0,83,1,4.0,10/19/2017,"5 stars for food. 4.5 stars for service.2 stars for the reservation/choice of seating.Prix fixe lunch (cream of tomato soup. Seared Salmon. Chocolate cake and a cup of coffee).It was a business meeting for a party of six. I made a reservation weeks in advance, and requested a private room or a table. I was told on arrival that it was ""not available."" We were seated at a table in the middle of the hall, so it made me feel a little uneasy. The guests were nice about it, and it was a relief for me. I suggest making a reservation well in advance (weeks was not enough) if you require a specific table or a private setting. Nonetheless, lunch was great and the wait staff were excellent (as many of the reviews of fellow Yelpers show). The dining hall is so bright and inviting. It faces the lush greenery and the Columbus Circle. A safe bet.",,,
152,Jennifer C.,"New York, NY",161,24,20,5.0,2/24/2016,"Simply aahhhhmazing! Went for my birthday out in the pouring rain and wind just to try this place. It had been on my yelp list for the longest time and getting reservations here was crazy especially for a 6pm. But my friend got one last minute so someone definitely cancelled and I am thankful to whom ever did because it made my birthday so special! When you first walk in there are people at the front desk that greet you and take your coat and purse and then two people open the grand door for you! Such great service right from the start. Now here comes the best part and that was the food, I ordered the tuna tartare which is a must, then the veal milanese and for dessert we had the caramelized apple pie! The tuna tartare was delicious! It was on top of really fresh avocados and the tartness and spice from the ginger soup that they poured in after serving the dish to you complimented so well the the avocado and the tuna tartare and the radish that were neatly placed on top. All the flavors were done with such finesse and just worked well together like a melodyNext was the veal milanese this dish was also tart but in a good way where it mixed well with the cooked cranberries and the thin piece of meat that had a great crispness to it where it was oily at all! Meat thats usually coated with like bread crumbs or other things tends to fry and burn too quickly but this one was cooked and pan fried perfectly with a golden crust and easy to cut. This veal was placed on top of a bed of salad as well  Everytime they served the food they would describe what your eating and I think that added to the experience cause you can understand what your actually tasting which I loved! For dessert since it was my birthday they added a little happy birthday note and gave me a candle and that was thoughtful of the restaurant and this is how you know they take care of their customers and make sure that the experience they have is everlasting and great! They even gave complimentary chocolate truffles and I am usually not a fan of truffles because of the texture but the taste of this truffle just melted in your mouth. I loved it here and definitely will go back again!",1,1,1
153,Cindy G.,"New York, NY",883,399,423,4.0,6/13/2016,"You enter both Nougatine at Jean Georges and the regular Jean Georges at the same entrance (located right inside the very hard to miss Trump Towers...), so don't be confused if you think you're accidentally walking into the Michelin 3-star restaurant rather than the more casual one for lunch. Both share the same drinks menu and the same kitchen, so this is a great option if you're looking to experience the world of Jean Georges without breaking the wallet. The ambiance was great. We were seated in the outdoor patio area, which could not have been more perfect for a 80-degree sunny Sunday. The tables are spacious, and the space between each table was ample. At no point did I feel overcrowded.Our group of 4 all chose to do the 3-course prie fixe for $38. After listening to the waiter's enthusiastic recommendations, I decided to go with the shrimp and avocado appetizer, the seared sea bass with tomato sauce for my main, and the strawberry pavlova for my dessert. Albeit a bit simple (so simple that I think I could whip this up at home), I thought the shrimp and avocado salad appetizer and the sea bass entree were both delicious. The dishes were light and refreshing, and the ingredients were very fresh. My sea bass was the perfect level of tenderness. If you like heavy flavors, these are probably not the right dishes to order, but if you like ingredients that speak for themselves without needing to hide behind a ton of spice, this is great. On the other hand, I completely regretted ordering the strawberry pavlova. It was far too sweet for my taste. I happily ate the strawberry and sorbet on the side but almost cringed at the taste of cream. Though the pavlova was disappointing, I luckily did get bites of the warm chocolate lava cake, which is by far the much better option, so definitely order that for your dessert!Because of the simple nature of the food here, I don't really see this as a place I would die to go back to. However, if I am ever looking for a place to bring parents or older folks to for a wholesome lunch with a nice ambiance, Nougatine would definitely be on the list.",,,
154,German M.,"Miami, FL",733,246,1489,4.0,1/2/2015,"Directly across from the SW corner of Central Park, you'll find Nougatine. The name isn't visible from the outside so it's a bit hard to spot but once inside, we were promptly taken to the bar area. We can't speak for the food because we only came for drinks. The menu has wines, sparkling and classic cocktails to meet anyone's taste.The JG 57, Paloma, Aviator, and Cucumber martini were delicious and strong. Nougatine isn't innovative with their cocktail presentation but they are well executed. The mixed drinks are around $18. The staff is professional yet somewhat aloof and the the restaurant has a minimalistic/modern decor.",3,1,1
155,Brett B.,"Bergen County, NJ",2,32,53,5.0,8/14/2016,"The lunch prix fixe is a great deal at only $38. It includes appetizer, entrée and dessert.AppetizerThe tuna tartar was amazing. The tuna stack was served over a bed of avocado. Once the dish is served in front of you they pour in the ginger marinade. The marinade ginger spice complimented the tuna/avocado combination very well. EntréeThe seabass was delicious. The skin was crispy but the meat of the fish was not overdone. It was accompanied by a pumpkin (?) puree and some lightly crisped veggies. DessertMixed berry sorbet over pavlova with fresh blue berries and raspberries.  I love it when you taste fruit in a sorbet and not loads of sugar. It was done extremely well. OverallThe food and service of at Jean George was outstanding. Will return!",,,
156,Pearl K.,"Saddle River, NJ",546,164,128,5.0,3/13/2015,"I came to Nougatine for a work dinner; our reservation was for 5:30, but apparently they don't start seating until 5:45. We waited at the bar for a little before they led us over to our table, which was right by the door. If you ever get seated there, try to request a different table, because every time the door would open, the cold air would sweep over our table. By the end of the meal, I had my coat back on. I can imagine how uncomfortable the table would be in the middle of winter.We received a complimentary amuse-bouche of parsnip soup topped with a crumbled crouton to begin with. The crouton gave the tiny soup a great crunch, but the soup itself is definitely an acquired taste.We started with 3 appetizers to share: the tuna tartare, the shrimp salad, and the calamari. All of them were extremely delicious and I highly recommend them all!For my main meal, I got the slowly-cooked salmon over spinach and potato crisps. It came out medium rare and beautifully-plated. There's a very good balance to the dish; the sweet sauce and the spinach go well together while the potatoes provide the salmon with a little bit of salt. I was extremely disappointed by how full I was; I didn't get to finish this amazing meal.For dessert, we got the chocolate cake and the butterscotch pudding. Both were delicious, but I suggest you eat the pudding carefully; it's topped with cream and salt. I made the mistake of taking a spoonful of only the cream and salt and my mouth screwed up from the extreme saltiness.Service was great; there was always someone ready to refill our glasses, clear plates, and answer questions.Nougatine was an amazing experience and I really can't wait to come back and try some more of their options!",1,,
157,Idy T.,"Boston, MA",415,392,2167,3.0,12/3/2014,"I had high expectations before dining at Nougatine at Jean-Georges. My experience was short from what I expected, which is why I am giving this a whopping 3 stars.I made reservations for the day of my visit. I was a little let for my reservation but I ended up waiting 20-30 minutes for my table. The hostess insisted I wait in the waiting area outside. It was mid 30 degrees weather. Although the waiting area was indoors, every time someone opens the door to go out, a gust of freezing cold breeze blows towards me. This is a bad set up for patrons, especially for a restaurant like this. Finally, I was seated! I ordered from the prix fixe menu which was 3 courses for $38. This is such a great pricing, especially because I am getting the Jean-Georges experience. The environment of the restaurant is really nice. It is part of the Trump Hotel and right across from the Central Park. So you get a great view if you are seated by the window. The complimentary bread that I was served was sad and boring. It was a cold and hard, which reminded me about my experience waiting in the cold to be seated! Also, I expected the butter that was served with the bread to be room temperature or whipped, but nope it was cold and hard as a rock! There was no way I could spread the butter on my bread. For my first course, I ordered the tuna tartare with avocado, spicy radish, and ginger marinade. The ginger marinade was way too acidic. I was puckering my lips every time I took a bite of my tuna tartare. Just talking about this is making me salivating to the max.For my second course, I ordered the caramelized hake with broccoli and ginger-chili vinaigrette. The hake was cooked perfectly. However the ginger chili vinaigrette was a little too citrusy for me. I expected more of a ginger spice vinaigrette but I ended up with a vinaigrette that tasted like fresh orange zest was blended in the sauce. Not really the flavors I look for in a savory seafood dish. This entree is served with ginger rice on the side. The rice was flavored well but it was underdone. The rice was hard and if I had more of it, it would have caused indigestion for me. For dessert, I ordered the Jean-Georges warm chocolate cake with vanilla cream. The dessert was probably the highlight of my meal. The warm molten cake was made perfectly. It was a great pair with the cold vanilla bean ice cream. It was like a match made in heaven! Overall, it was a good one time experience. Maybe it was because I went the the Nougatine at Jean-Georges instead of the actually Jean-Georges.",5,5,5
158,Zhe C.,"Columbia, MO",2,3,27,5.0,"4/12/2017
            





Updated review","Definitely one of the best restaurant you can find in the United States. I haven't yet figure out the differences between this one and the Jean-Georges, but this one is no worse than the other one IMO. The price is reasonable, which is not as high as I expect it to be. The service is world class, the food is fine and delicious.Dinning in here is definitely going to be a memorable experience for everyone. Make sure you reserve your space before you walk in, bc they prob don't want their elegant space to be crowded.Definitely recommending this place to everyone. Btw, Their tea with milk is fantastic, best I've ever have.",,,
159,Michelle W.,"Altamonte Springs, FL",0,28,3,5.0,4/23/2018,Wonderful food and service. We got the three course meal for $38 and it was delicious and fresh. I loved my sea bass and my husband loved the rigatoni with meatballs. The warm chocolate cake was to die for. Service was outstanding! Always had plenty of water and never wanted for anything. Highly recommend,,,
160,Paul S.,"New York, NY",111,13,23,5.0,8/1/2017,"What an experience!!! In this hostile NYC environment, we actually were treated like guests!  Staff are professionals...Busy bees but orderly!!! Place were buzzing but we were not rushed!  The best of all, the lunch were great tasting either the prefix or restaurant week special (which I usually hate because food and service in a few places during restaurant week were terrible [worst than Micky D's]).",,1,
161,Will V.,"Jersey City, NJ",35,257,84,3.0,11/26/2016,"I have been here for breakfast and for after work drinks. It is a nice place with above average food and terrific service. I will not be back, however, and will not set foot in Trump branded buildings in the future. I don't want my presence or my dollars to benefit a man who prospers from hate speech and divisiveness. There are many other places in NYC and elsewhere with forward thinking and tolerant owners; that's where I will prioritize my time and money in the future.",2,1,3
162,Melissa G.,"New York, NY",23,206,98,5.0,1/22/2016,"Came here with a foodie friend for restaurant week lunch. We arrived for our reservation at 2:45, but still had to wait a bit due to the higher volume of customers during restaurant week. However, as others have mentioned, the service is amazing. The environment in and of itself is an experience. Meal started with delicious sourdough bread, although I wish it had been served warm. There are two options for the appetizer, entree, and dessert, which was perfect. We got one of each and split everything. I was pleasantly surprised that I didn't prefer any option over the other. The appetizer tomato and cheddar soup was divine with a soft-yet-crispy-on-the-outside piece of parmesan bread. Although I'm normally not a fan of sashimi, the sea trout sashimi appetizer was perfect - no hint of a fishy flavor, and it had a tiny kick with the mint and lime. The flounder entree kept up the high standard set by the appetizers. Crispy on the outside, flaky and buttery on the inside. Served atop a bed of butternut squash, and sprinkled with pumpkin seeds. The ensemble is a masterpiece. The roasted chicken was equally as amazing, accompanied with broccoli, yogurt sauce, and breadcrumbs for dipping. Fun and delicious to eat.Dessert did not disappoint. Classic lava cake - rich, gooey, and served with magical Madagascar vanilla ice cream. The subtler almond cake with citrus sorbet provided a good balance. The cake was dense and moist, and the sorbet was just the right amount of tart. I had not been expecting too much from this lunch, as the menu items had appeared rather plain when I previewed the restaurant week menu. Although the dishes are simple - ie broccoli and chicken - they are cooked and presented to perfection and the flavors meld divinely.",1,,
163,Amy H.,"New York, NY",20,62,14,2.0,7/15/2018,"Came with my husband for a dinner reservation at 8:30 pm on a Saturday night. Sat on the terrace, which was only about 1/4 way full. We each ordered a glass of wine almost immediately after sitting down and then waited a good 10 mins before our waiter came back for our food order at which time we ordered an app to share and entree each. Our glasses of wine didn't arrive until partway through the appetizer and when my food finally came (roasted chicken), one of the two breasts was so overcooked I couldn't eat it. The second chicken breast was outstanding as was my husband's sea bass. Our waiter and the manager on duty hardly checked on us and certainly didn't apologize for the late drinks or even check on us after our meals arrived to know that my chicken wasn't edible. When the busser finally came at the very end, he asked how the chicken was because he saw was 1/2 was uneaten, I told him, and only then did the manager come by an apologize and said she'd take the drinks off the bill because she knew they were very late. Waited about 10 more minutes for the bill, gave my card, when the waiter dropped off the check to sign, he threw it down and finally said ""sorry for all your trouble tonight"" as he ran away. BAD SERVICE given the stature of the restaurant and very hit or miss food.",,,
164,Lori L.,"New York, NY",2242,603,6802,4.0,"8/26/2014
            





Updated review","I attribute my first fine dining experience in New York to a meal at JGV's Nougatine, the sister (and lesser) restaurant to Restaurant Jean Georges located next door in the Trump Tower. At the time, I wasn't aware of the dining room that was only a few yards away from me; after all, how could a just-transplanted Philadelphian know what three Michelin stars, four NY Times stars, and a 28 in Zagat meant? But it was the first step down the rabbit hole, and nearly two years later, with a respectable list of culinary conquests under my belt, there was something fitting about walking through the same doors - but this time, for Jean-Georges.Arriving earlier in the day or evening will afford a gorgeous view of Central Park West, as the floor-to-ceiling windows across the room let the remainder of sunlight filter in throughout the evening. The dining room, almost as iconic as the restaurant's name, consists of numerous curved banquette-style seats bordering a handful of perfectly-spaced tables. It's modern elegance at its best: comfortable, but still grand enough to let guests know they aren't in any ordinary dining room.For dinner, Jean Georges offers a three course prix-fixe as well as two tasting menus: the Signature and the Seasonal. Both are comprised of 7 courses, and despite multiple perusals of the menu, both had dishes so tempting that I couldn't decide between the two. Thankfully, our server was able to confirm that we could interchange courses between the two tastings, which solved my dilemma. A half-bottle of Zilliken 2011, a slightly dry Riesling, was brought out, and we were presented with a variety of light, summery amuses, signifying the start of the meal.To begin, the signature Egg Caviar. Even at first glance, it's a dichotomous dish; a simple egg shell almost comically topped with a generous spoonful of caviar. The hollowed egg shell is filled with a fluffy, almost airy soft scramble of eggs which is then finished off by whipped cream and caviar. Each spoonful is pure delight; the hints of cayenne in the scrambled egg are perfectly offset by the addition of lemon in the whipped cream, and the final punch is delivered by the brininess of caviar. My only regret was that there wasn't slightly more of it, but it served as a good segue into the second course. I was surprised at the size of the Sea Scallops as they were less than a centimeter in width, but they were lightly seared and served with caramelized cauliflower, a few strands of parsley, and a nutmeg-infused caper-raisin emulsion.  The Young Garlic Soup that followed was served in two parts: a small terrine for the soup and a side of sautéed frog legs, which I was encouraged to use my fingers to pick up and dip into the soup. I did appreciate the simplicity in the garlic soup, which was delightfully aromatic with the addition of thyme, curled watercress, and chive blossoms, but the discombobulated components threw me off. The Turbot that followed was perfectly poached and tender, but the pairing with a Château Chalon Sauce made it significantly less appetizing. The sauce, made from the rarer yellow Château Chalon wine, had a strong acidic edge that overpowered the fish.This was slightly ameliorated by the Lobster Tartine, which consisted of butter-poached lobster served with pea shoots and snap peas, finished tableside with a pour of the lemongrass and fenugreek broth. The presence of the butter toast at the bottom of the bowl was confusing at best, as it only become a soggy carbohydrate in short time, but the lobster was cooked to perfection, and the broth was startlingly simple and balanced meld of lobster stock, tomato, lemongrass, and fenugreek. The final savory course featured a perfectly-executed Lamb Chop, seared to a medium-rare and paired with a chili oil and cucumber yogurt. The protein was delicious, both fatty and lean, and the contrast of spice and coolness worked in tandem.Dessert is an essential ending to any good meal, and the tasting menus at JG offer a quartet of Dessert Tastings. The Strawberry Tasting was less than memorable, with a strawberry-red wine sorbet, over a vanilla crumble; a tasteless sponge cake, paired with a caramelized balsamic meringue; an effort at chantilly cream that clashed with the addition of shiso syrup; and a room-temperature Pâte à Choux, served with a side of Strawberry Jam. The better bet is to stick with the Chocolate tasting, which offers a miniature version of JGV's signature molten chocolate cake.I must caveat this review with the fact that: yes, I am biased, no, I am not a professional, and yes, this is based on just one experience out of many. But let the main takeaway be this: Jean Georges continues to deliver high quality food and service, in a remarkable ambiance. Is it the best of the best? In my opinion, no, but it's a worthy presence in the list of NYC's (and the nation's) best restaurants.--Review #101 of 2014: Complete.",13,4,7
