,er_name,er_location,er_freinds,er_reviews,er_photos,er_rating,er_date,er_text,er_useful,er_funny,er_cool
41,Deborah B.,"Dunedin, Tampa Bay, FL",5,68,85,4.0,2/4/2018,"I and three girlfriends had the pleasure of dining at Nougatine in early December 2017. I'm just getting to the review - apologies. Nougatine is a lovely restaurant with professional staff and service. The food is very good. This was my first visit to NYC although I've traveled much of the world eating my way through. Although Nougatine is a very good restaurant, IMHO, it did not live up to the hype. We all ordered from the 2-course prix fixe menu. We had the fish of the day and a veal dish. Fish was expertly cooked. My friends enjoyed their veal. Nothing in particular blew us away for the price.",,,
42,Michael L.,"Manhattan, NY",1032,172,59,5.0,1/30/2018,"tl;dr I had a wonderful dinner at Nougatine and would highly recommend you check it out (definitely go for restaurant week). APPETIZER: I got the trout sashimi with pistachios and lime and the textures and flavors were perfect. I loved how the crunch of the pistachios contrasted with the softer texture of the sashimi so it was already a great start to the meal. My one complaint here is that it was a pretty small portion compared to other appetizers I've eaten, but the flavors were delicious.ENTREE: This was probably one of my favorite entrees at any restaurant I've eaten at. I got the flounder with a soy yuzu broth and I loved this dish because the portion size was HUGE. I haven't seen that big of a portion at such a high end place so it was definitely worth the money. The broth was also great and didn't overpower the fish (they only poured a tiny bit of broth on so it was good that they did that) and the most surprising part was the spaghetti squash. I was not expecting spaghetti squash to have the crunch that this did and it was delicious and provided a nice contrast to the rest of the dish. Overall, fantastic.DESSERT: Of course I got the chocolate lava cake and salted caramel ice cream. I absolutely loved how the two parts worked together in terms of hot and cold and it was definitely a quality dessert. I'd say I've had better desserts at other restaurants, but it was definitely a great dessert.SERVICE: The service here was fantastic - the waiter came back to check on our courses, we never had to ask for more bread or water, and it was overall just quality service.Overall, I don't have many complaints and I was pretty blown away by the quality of the meal - definitely recommend it!",,,
43,Amrita A.,"New York, NY",180,220,726,5.0,1/26/2018,"My husband and I came here for dinner during restaurant week and we loved every bit of it. From the moment that we entered the door next to the main entrance of trump towers, it was smooth sailing with exceptional service and attentiveness. We had a reservation and were seated immediately By a hostess who was really warm and friendly. We ordered the following from the restaurant week dinner menu-For starters we both got the sashimi with pistachios and chili lime oil and it was nothing like what I imagined. All the flavors and textures were like a flavor bomb exploded in my mouth. What a start!For the main my husband got the chicken with winter vegetables and I got the flounder. While I loved the textures and flavors in my fish dish, my Husband's chicken had a weird smell/taste to it and our server upon hearing it happily suggested to change the dish. So my husband too ended up getting the flounder which was incredible. The yuzu broth balanced the flavors superbly.For dessert we got the molten chocolate cake with caramel ice cream which is Jean-Jeorges signature dessert and I can totally imagine why. It was flawless and perfectly molten in the center. We also got the poached pear with pecan praline which was realy nice too, especially paired with earl grey. All in all it was a meal worth remembering with an ambiance to match.",,,
44,Ariel B.,"Manhattan, NY",11,18,39,5.0,4/7/2018,"I love this place Always looking for a reason to comeThe food and atmosphere is amazing Jean george is so friendly He came to our table and greeted usI ordered the shrimp salad,  fluke and dessert Amazing value for the level of food Can't wait to come back",,,
45,D. L. J.,"Manhattan, New York, NY",1,100,541,4.0,"2/17/2018
            





Updated review","Tucked between the entrance and main dining room of Jean-Georges, Nougatine offers the culinary prowess of JG in a more relaxed environment. Make no mistake, though, it is still quite sumptuous and a treat to enjoy. The environment is unabashedly luxe, as are the clientele, and the space has a nice energy with the open kitchen close at hand. The food at Nougatine is clear in concept and executed with precision by the same team serving two Michelin star Jean-Georges and offers great value. If that's not enough to win you over, the cocktail and wine list should seal the deal - both are extensive and well done. Overall, a great place to dine and a reliable choice we can't help revisiting.Atmosphere- Clean and airy, with luxe finishes; open to the kitchen serving both Nougatine and Jean-Georges.- Generally well-dressed (and well-heeled) clientele in spite of the 'causal' descriptor.- Space is not very large, so expect most tables to be rather close together and tucked into various nooks and crannies.FoodOur experience at Nougatine over many visits has shown the food to be consistently high quality with superb execution and elegant flavor profiles befitting the season. It is prepared by the same kitchen as Jean-Georges, giving it great quality to value. The menu has good breadth across light/heavy and tastes, making it versatile to many groups/occasions. On this visit we had:- Foie Gras Brulé (Pineapple-Meyer Lemon Jam, Rose - $26): Just the right amount of decadance, bruleed foie atop pastry, the jam paired perfectly. Not too heavy.- Spaccatelli Pasta (Caramelized Brussel Sprouts, Basil-Pistachio Pesto - $25): One of our perennial favorites on the menu, great in the fall/winter; though woefully under-salted this time.- Sautéed Black Sea Bass (Broccoli Rabe, Sesame Vinaigrette, Lavender - $35): Perfectly cooked, the vinaigrette was an excellent complement. Great lighter option.- Soy Glazed Beef Short Ribs (Apple-Jalapeno Puree, Rosemary Crumbs - $41): Decadent and rich, but so comforting on a winter's eve.- Creme Fraiche Cheesecake (Cranberry-Orange Compote, Pistachio - $12): Loved the concept and taste, much lighter than normal cheesecake.BeverageThe bar at Nougatine is clearly one of the venue's strong suits, and reason enough to stop over, though seats disappear quickly. The bartenders always make an excellent martini ($24), and are great at listening to and adjusting for your preferences. The cocktail list is very well conceived, and my wife loves the Elderflower Paloma (Casamigos Blanco Tequila, Elderflower, Grapefruit, Soda - $18) which is quite refreshing without being too sweet. Nougatine offers a very extensive and well-selected wines by the glass list, with something for everyone, as well as the full wine list available in Jean Georges, if you care to splurge. I keep returning to the 2015 Ponzi Pinot Noir ($18).Service- Historically quite good and attentive.- This visit, our waiter wasn't representative of our typical experiences. He was rather awkward (asking as soon as we sat down if we were celebrating something?, seemed incapable of understanding we would share some early courses) and simply didn't listen to our requests (from pacing of courses, to removing items from the table, etc.). Detracted one star based on this.",,,
46,Ruth U.,"New York, NY",33,175,227,5.0,7/10/2018,Phenomenal service and stellar food. Very accommodating of my vegan diet and offered to bring me a dish from the Jean Georges menu. Service was excellent and the martini was nice and strong.,,,
47,Nora F.,"Columbus, Boston, MA",0,4,0,2.0,9/1/2018,"I was very disappointed by Nougatine (was outside on the terrace for diner).I've been to many restaurants in NY and must say, this is definitely not one I'd recommend. Food was simply not good, meat not well cooked, sauce kind of below standards etc. Service was also very approximative for a restaurant with that reputation or any good restaurant in NY for that matter. Definitely a no go for me, instead choose one of the many great places in NY!",,1,
48,Ida C.,"Manhattan, New York, NY",46,14,32,4.0,7/23/2018,"Girl friend's sister is visiting the Big Apple, asked me to join for lunch during the NY Restaurant Week at $26/ 2 course prefix.  Unfortunately, Restaurant Week won't start until next week; so, we ordered $38/ 3 course regular prefix instead. One of us had entree only, I am sure the Crispy lobster is inspired by tempura, fresh and delicious.  My prefix includes shrimp salad with lovely orange flowers, steam sea bass with plenty of greens, tasted like my Mom's Chinese cooking.  My dessert is out of the world, roasted peaches with pistachio ice-cream, it satisfied my sweet tooth with limited calories.  Coming to John-George's restaurant is always a treat.  I took one star off because we were charged 2 bottles of sparkling water when we only had one... you may want to double check your bill for $12 plus tax and tips might end up with $20 more....",,,
49,Kevin Z.,"Manhattan, NY",278,12,7,4.0,3/16/2018,"I had a satisfactory Michelin fine-dining experience for 3 dollar signs, which is fine by me. I called for a reservation that afternoon for an evening date, a relatively brazen, overstretching demand for a popularized Manhattan restaurant for which they graciously able to accommodate (although to be honest, it was a Sunday). When we entered, we were greeted by an amiable team of attendants who took our coat check and sat us down at our table briskly. While it is in a Trump building with a gaudy exterior, the interior on both the hotel side and the entrance was actually very elegant and posh.  While walking to our table, I glanced into a portal of white table cloths and superior lighting ornaments, of which I assumed the actual Jean Georges was situated. However, the large windows overlooking the Park and modern hotel getup of Nougatine was a force to be reckoned with in its own right. We sat down, had a fine red that waiter recommended and the overly decadent Foie Gras Brule appetizer (though I'll give it credit for its gumption and finely-executed caramelized shell). I ordered the soy-glazed short rib, which was tender of a modern with a non-traditional flavorful twang expected for an establishment that errs on the more adventurous side. Not for everyone.       Overall, great experience, acceptable pricing and pleasant service.",,,
50,Jan E.,"Manhattan, NY",0,3,0,2.0,6/21/2018,"Great prix-lunch. Good food, average service, great atmosphere, good price point, great location. 3.5 stars.Terrible dinner. Every single dish ordered by my companions and myself was either too salty, charred or otherwise inedible. Average service. 1 star.Pick another place for dinner. The are plenty others around the immediate vicinity.",,,
51,J. Grace K.,"Manhattan, NY",4,2,0,2.0,9/13/2018,"I do not typically write reviews, but must write one for this place.  Do not book the 10:45 brunch spot.  I had called in advance to ask whether I'd be able to dine comfortably knowing that lunch will likely begin at noon and kitchen might close.  The restaurant confirmed that I should be able to enjoy a leisure brunch.  Well .. As soon as I sat down, the waiter walked over, looked me in the eye and said in a demanding manner ""YOU HAVE TO PLACE ALL ORDERS BY 11 SHARP! AND PUT IN ORDERS FOR EVERYTHING BEFORE THEN!""  No greeting, no smiles, just annoyed that I sat down at that time, although yelp provides for reservations at that time.  So we rushed to order the food.  During our meal, they kept on coming to clear our plates (even while there was food on it) interrupting my conversation with my friend.  Every time a different person came by trying to clear my plate repeatedly.  As far as I can remember, more than six times.  A lady tried clearing a plate with more than half a plate of fruit left over.  And when we said we were working on it, the lady gave me a cold eye.  So weird.  Do they not train their employees?  We almost felt like they were trying to drive us out, so we ordered additional desserts so that we can sit for a little while longer.  Service really was not great at all and I did not feel welcomed. Food was okay, and I would not recommend brunch here if you are looking for good service with friendly staff.",,,
52,Bill S.,"Long Island, NY",638,2402,4793,4.0,"2/8/2017
            





Updated review","Once again, overthinking a restaurant is a terrible thing.Lemme ask you, when traveling by plane and walk thru First Class seating, are you upset that you're not getting the bigger seats and upscale meal? Or do you just walk thru and say, good luck suckas, enjoy that expensive up charge? If you're like me, I don't care. The difference between Nougatine at Jean-Georges & Jean-Georges is like First Class seating. Same wait staff, same chefs, same food. Its the same at Le Cirque. I don't like to wait and stand around. When I arrive, it's on. There's seating available in Nougatine at Jean-Georges? Cool. It's my wife's birthday in January. Without fail, when I plan something for her, the weather will muck up our plans. Not to fear, I rescheduled on a beautiful Sunday and made our brunch reservation work. We arrive and the front desk says my name properly. Man, kudos to you! They take our coats and seated not to far from the open kitchen. Don't like the open kitchen? Make a reservation for Jean-Georges. We're given brunch menus. The price fixe is calling me because of the warm, flourless chocolate cake with salted caramel ice cream.My wife always ordered better than me! She starts with a beet salad mixed with Gorgonzola. The beets were so sweet, very nice choice. I ordered the calamari starter. Cooked very well, it was a nice starter for me (I wanted the beets after tasting hers)She ordered a fish dish, another perfectly executed dish. The skin was crispy and the meat was buttery, Mmm mm, amazing.I ordered a lobster burger. It was a thick patty of lobster chucks and fillers, a very tasty treat. On a supermarket, sesame seeded bun? What the what?! Yep, the bun was straight from the bag. That will get you a start knocked off. Sorry Jean-Georges.Our desserts come out, we both ordered the warm, flourless chocolate cake with salted caramel ice cream. I poke at the cake and chocolate oozes out. OMG, this dish was so sinful. Simply an amazing ending. Our waiter was all over us, how is everything, is there anything I can do while I'm here? A total professional. There's a dude holding the door! Your job, if you choose to accept it is to hold the door for the guests. The front desk? Welcoming from start to finish. Want a great brunch experience in NYC? Find the Trump Building at Columbus Circle, there you'll find Jean-Georges. Anywhere you sit is fine in my humble opinion",12,6,9
53,Oliver L.,"San Francisco, CA",95,273,162,4.0,3/8/2017,"Had a great dinner here during a trip to New York. I opted for the ahi tuna tartare to start and the roasted Dover sole as my main course. The tartare was decent, although I thought the sauce was a bit ginger-forward. However, the sole was phenomenal - cooked perfectly with a brown butter sauce, and served with decadently rich potatoes. At this point I was stuffed, but managed to make room for a scoop of pistachio ice cream, which was good as well. Service was attentive, although a bit impersonal. Decor and ambiance were nice, but not as formal as the Jean Georges dining room - great place to grab a casual yet upscale dinner.",2,,
54,Hanna S.,"Midtown West, Manhattan, NY",9,13,8,5.0,9/23/2017,Best lunch experience ever. Service was impeccable and good amazing. We did the PF lunch as very hard to pass up on this amazing value. I did tuna tartare for starter - mind blowing! My husband had the calamaris that hands down was the best calamaris I've ever tried. Main I had bass that was really light and tasty fitting this hot summer day. Husband had the salmon that was even more delicious. Dessert everyone at my table had the chocolate cake while I did the strawberry pavlova that was right up my ally - Devine. Drinks we did rose wine from Provence all way through. To top off the experience I got to thank jean George in person for the meal. We will be back for sure!,1,,1
55,Hanna K.,"New York, NY",18,72,270,4.0,10/24/2017,"Great food, nice ambience, okay service.Jean Georges said hi to me when we made an eye contact. We asked the server if we could take a picture with him but the server  forgot to ask the chef before he left the restaurant...lol",,,
56,Martha H.,"Brooklyn, NY",8,47,63,3.0,3/4/2018,"We went here towards the end of restaurant week. They didn't publish the menu beforehand but I expected from what I'd heard about the restaurant that it would be good. We were severely disappointed with the choices, and my friend decided to get something off of the regular menu. I had the restaurant week menu of the shrimp appetizer, the bolognese pasta and then the chocolate lava cake with salted caramel ice cream. Let me start by saying the desert was ah-mazing! The lava cake was moist and delicious and served at just the right temperature, and the ice cream was excellent. But, the rest of the meal was very lacking. The appetizer was pretty bland and just nothing exciting and the bolognese has very little sauce on it and could have used more seasoning. My friend was also disappointed with her meal and as I mentioned she ordered off the regular menu. Her fries were extremely greasy and the burger was very difficult to eat the way it was put together. We also saw the table next to us cut into their chicken to find it was undercooked - and from our table it did look undercooked - but the waiter proceed to tell her ""oh, no that's just the way the chicken is prepared"" instead of taking it back.",1,,
57,G S.,"Manhattan, NY",6,162,2,2.0,5/6/2018,"I went for brunch/lunch on a Sunday. While the food was good (not great, just good) the service was really not good. I ordered the calamari, lobster burger and pavlova. All 3-4 star worth, if in my local restaurant but higher standards are given when at a JG. 3 star average for food. But the service. Wow. I'm not sure if they were trialing wait staff that day but it was really off putting and out of sync. Our first course came before our drinks (nothing fancy ordered - one smoothie, one soda). The second courses appeared (but not served) before our first course was finished (I'm not known as a terribly slow eater either). I saw them come to the table with the plates and turn around when they saw our plates had not been cleared. Or finished. The third course was timed well. As it was a business lunch, we wanted to talk a bit more but the waiter asked if there was anything else, we said no and the bill just appeared behind his back and popped onto our table. We felt very rushed. I mean even if it wasn't business, it was Sunday, we ordered 3 courses so it was a very casual, relaxed day... We then felt a bit better that the service was just terrible for everyone and not just us when the gentleman next to us only received his first *bottle* of wine half way through his second/main course!!! This is my second JG experience and while the other time the service was better, I had raw fish served to me - so I'm rating JG as an overall dud place to go.",,,
58,Ali G.,"Hialeah, FL",3,19,20,5.0,11/13/2017,Amazing food + Amazing service = win win One of the best innovative chef around Chef Jean Georges never fails to impress !!,,,
59,John S.,"Queens, NY",159,49,2,5.0,6/1/2018,"Absolutely superb at every opportunity.  Pleasant staff from the moment you walk in and someone is waiting to take your coat and check in your reservation. Pleasant bartenders who greet you with a water and a smile as soon as you sit downPleasant waitstaff who also greet you with a smile and a walk through the very well thought out variety of extremely tasty menu options.Pleasant food runners who make sure your dish arrives as ordered.The restaurant, the high ceilings, the decor, the linens, the plating and the out of this world dessert menu really combine to let you know that details dont go unnoticed at Jean Georges",,,
60,Shekina C.,"Maywood, NJ",40,112,0,4.0,8/3/2018,"I thought I would not walk out of here full, but I did!  My meal was outstanding, a pleasurable surprise!  I try the fancy restaurants on restaurant wk to see if I would come when it's not that time.  Absolutely I will.  I try to order things I typically wouldn't and glad I did. Get the watermelon salad with goat cheese, angel hair pasta and berry soup with ice cream dessert...yum, yum and yum again.  Missed the five point mark because of a few service hiccups but I'll be back!",,,
61,Nick D.,"Ocean City, NJ",0,42,114,5.0,11/11/2017,"What an awesome restaurant. Everything from the ambiance, to the service, to the most important thing--the quality and taste of the food. The portions aren't incredibly small, even though you would expect them to be small. The quality of the food is difficult to beat--even in NYC. The tuna tartare, salad with shrimp and champagne vinaigrette were beyond excellent. All the food here is 5 stars and does not disappoint. The only thing I noted was that if you stay too long after finishing your meal, someone in management comes over and asks you to leave your table. It happened to 2 tables that were sitting at their table after finishing their desserts and coffee.  A gentleman asked them to vacate the table so they could set it up for the next guest. I guess they want to seat customers at their appointed reservation time, but I could see how that would irk some people. I'm not one of those diners that sits around long after a meal, but I know plenty of people who do--especially if you're on a date!  Still though, this place is a solid 5 stars.",,,
62,Gab G.,"New York, NY",201,1479,4342,5.0,1/16/2017,"Had an amazing lunch here. I was not thrilled to step foot on a Trump property, but food wins in the end and I will say I'm glad I risked it. My friend and I each had the pre-fixe and shared:+ shrimp salad + tuna tartare+ hake+ sea bass?+ signature chocolate dessert* grapefruit pavlovaThe tartare and hake were definitely the standout dishes, but honestly everything was nearly perfect with the exception of the cake, which wasn't hot enough. It's a good deal for the pre fixe considering the quality, and it's definitely better food than Perry St though the menus are similar. Would come back.",1,2,2
63,Jessica K.,"New York, NY",177,340,1146,5.0,3/3/2017,"You can never go wrong with any Jean Georges' restaurant! Besides food, the customer service is impeccable! I've never been to the restaurant where so much attention is given to the customer. They were so attentive to the point where a waiter actually rushed over just to help me get seated. He was so fast I didn't even see him coming! Food's amazing as well! We had ordered the Black Sea bass, salmon and the fried calamari, and all were prepared to perfection. Absolutely loved it!Ambience was great, and the environment was very comfortable.Overall, highly recommended!",,,1
64,Shree W.,"Dayton, OH",4,16,9,1.0,8/5/2018,"Nice-looking dish, which helps them earn the one star. Raw rice served with ""Sichuan styled"" roasted chicken. Please use a rice cooker and please do not open the lid to check your rice until it is fully cooked. Please do not use the item of ""Sichuan styled"" unless you know what is authentic Sichuan food means. The chicken sauce is sweet and sour, tasting like Merlot with syrup. Good luck for next year's Michelin",,,
65,Anran S.,"New York, NY",7,5,24,4.0,4/16/2018,"Sea Bass is pretty good, environment is little noisy. The cocktail has limited choice but each has good flavor.",,,
66,E C.,"Great Neck, NY",4,222,0,5.0,3/17/2018,"I've been to Nougatine twice for lunch and loved every morsel and bite. Everything we ordered were perfectly cooked, seasoned, and presented.  My favorite is the hake dish. I also love their fruity sodas (passion fruit and cherry are awesome) It is not easy to score a razzi so plan ahead if you would like to dine here.  Service is also excellent, as expected.",,,
67,Alejandro S.,"San Diego, CA",260,22,39,5.0,1/9/2018,"Arrived at this restaurant after a really good friend's recommendation. Making reservations from my phone was a breeze. I loved everything about the restaurant, from the way they greet you when you arrive, to the table selection, the menu is spectacular, the service is phenomenal, the food beat my expectations. I would recommend it to anyone, a tourist or a local, to come to this place for special celebrations. The fixed menu for lunch is the best value for your money.",1,1,1
