,er_name,er_location,er_freinds,er_reviews,er_photos,er_rating,er_date,er_text,er_useful,er_funny,er_cool
0,Meat L.,"Manhattan, New York, NY",0,4,0.0,5.0,10/17/2018,Great brunch spot. We all got omelets with hash browns. Very filling. Best part was they definitely don't skimp on the mimosas. Those things are stiff.,,,
1,Greg O.,"New York, NY",22,3,8,1.0,11/8/2018,"Food was generously portioned and wait staff was nice and courteous. However, the owner is also present and is rude to the wait staff and patrons. I heard him yell at the customers in the adjacent table ""get to the point!"" when something was wrong with their order.I'm surprised that this kind of behavior would be acceptable on 9th Avenue, but I suspect that the proximity to Times Square is sufficient to keep fresh customers rolling in.Ultimately my food was ""fine"", but the experience was quite awful. Don't fuel this establishment.",,,
2,Eva R.,"Los Gatos, CA",13,122,79,4.0,9/20/2018,"I was absolutely hangry when I ordered from Georgio's; practically everything sounded delicious. I had Sonia's wrap, and let me tell you, she has damn good taste. It also came with so many gigantic onion rings I wanted to eat but couldn't come close to finishing.I even got a slice of cheesecake because1. I was in NYC, after all, and2. I could save it for later and not be tempted by the mini-bar.I have never had a slice of cheesecake with a thin base of sponge instead of a graham cracker crust, though I know it's a thing. In this case, the texture combination was extremely off-putting, tasting less like a thin strip of cake than a thin strip of actual yellow kitchen sponge. It arrived still frozen, and if I had eaten it in that state, I think it would have been better. Sigh.Still, overall I thought this was great, and I appreciated that they included condiments, napkins and utensils (since I was kicking myself for forgetting to ask for them).",,,
3,Sasha V.,"Chicago, IL",30,64,91,5.0,11/10/2018,"Had a very nice steak dinner. This place seems like a mashup of a few different themes/culinary traditions but I found the service and food very delightful. IWas able to relax and really enjoy my meal, including the fresh salad and bread basket. I was in the mood for steak and was not disappointed. The fresh veggies and potatoes hit the spot. Great little spot--glad I stumbled in.",,,
4,Debi R.,"Irvine, CA",310,183,76,4.0,7/27/2018,"Came here after a Broadway show because it was on our way back to our hotel. We were pleasantly surprised that they were able to accommodate our party of 14 without a reservation. Our server Manoj (sp?) was very patient with all of our questions, and helped us with our orders. He was even better at making sure our cocktails were on a constant rotation. :)I had the lobster raviolis. They were delicious! I sopped up the sauce with some bread. Soooo yummy! We had a great time and left with full bellies.",1,2,2
5,Angie V.,"Little Falls, NJ",1,32,84,3.0,10/16/2018,"Food was soooo good. I would given them a five but the service not only does it take forever for you to be served, the custome isn't really acknowledged. It's like we just wait and wait and just got past by . Over all food was great and they gave a great portion.",1,1,1
6,Long N.,"Philadelphia, PA",30,291,483,3.0,2/23/2018,"Your basic american restaurant. We came in during breakfast so had eggs, bacon, and toast. Nothing too special about the venue other than location. The place was clean and the service was good. Again, nothing to be wowed about, but may be because we were there for breakfast and their lunch or dinner selection may be better.There was plenty of seating for small and large groups. It was more a mexican vibe, but nothing hispanic about their breakfast menu. It was interesting. No complaints here. Will try again if in the area again.",,,
7,Cece J.,"New York, NY",4,59,99,5.0,5/22/2018,"Stumbled upon this place on a busy Friday night because it was one of the few restaurants in the area that had an open table. I was very impressed by the variety of cuisines and options they had on their menu- everything from Greek food to Mexican,  wine to health smoothies. We were cheerful greeted and quickly seated by their accommodating staff. Our waiter was super friendly and quick to take our order and make sure everything was going well. Their food was delicious and reasonably priced given it's NYC. Definitely a great find!",,,
8,Dan D.,"Huron, SD",88,3,2,5.0,10/26/2018,"Traveling from South Dakota. Fantastic omelettes, incredible food all around. Not a complaint from anyone in my group of 4 about the food. Only possible problem we could see was small location. Tightly packed into tables at brunch, but worth it for the food. Very nice service from staff despite high demand from packed location. Will definitely return upon our next trip.",,,
9,Myr S.,"Odenton, MD",3,59,6,4.0,5/15/2018,"Popped in for a pre-show dinner as a result of Leslie Odom Jr's name-dropping this place (albeit for brunch) in a 2015 Grubstreet article, and we were so glad we did! My companion enjoyed his burger, and I really liked my Rigatoni Bolognese - great flavor, and a filling portion without being too much food.  They had drink specials going on a Saturday early evening, which was nice - enjoyed a glass of sangria with my pasta for just $4.95.  Service was attentive, and the space has a lot of personality.  Cozy, without seeming claustrophobic.I'm so glad to have found this place; I drive up to NYC for shows fairly often and it's great to have an alternative to offer friends/family to my other usual dinner go to :)",,,
10,Eric T.,"Saratoga Springs, NY",104,56,127,4.0,"8/8/2018
            





Updated review","Reliable neighborhood diner. It can get very crowded, particularly for weekend brunch, as tourists seem to have discovered it's a better deal than what they're likely to find a block or two to the east. I'm a big fan of the breakfast specials, particularly the Denver omelette. Home fries have that special smooshed together texture I don't always get from diners.",,,
11,Jane M.,"Morris County, NJ",146,381,225,4.0,7/30/2017,"What a nice spot for breakfast! With all the overpriced breakfast places in New York City it is so nice to go to a clean, friendly and reasonably priced place. The breakfast menu had plenty to choose from along with some interesting breakfast specials too. Service was friendly and prompt always refilling water glasses and refreshing my hot tea. Very nice portion sizes as well. Open sliding doors with screens welcome in the breeze without bugs. We will be back. A great meal for all of us.",1,,
12,Darin B.,"The Village, Muncie, IN",31,3,0,5.0,10/9/2018,This was our second trip to this restaurant. It is a very nice restaurant with good food. It is a very cool older restaurant. Make sure you get the black and white shake. My son calls this his favorite shake of all time.,,,
13,Carol L.,"New York, NY",657,182,497,3.0,7/4/2017,"3.5 stars rounded down.Came with a bunch of friends and service was a bit slow in terms of getting us all menus, refilling our water, etc. I tried the Rigatoni Bolognese and a bit of the Lobster Ravioli. Both were really good! Their parmesan they scoop onto the pasta seems like it could be a bit fresher, some of it came out in chunks. But overall, the pasta was pretty good. I would say this is a great place for groups, but definitely not somewhere where the food is something I'd dream about.Pro-tip: They have sangria and mojitos for $5 during their Happy Hour!",,,
14,Kristina I.,"Forest Hills, Queens, NY",113,173,121,3.0,5/23/2018,"Definitely no frills.  The place was pretty empty when my two coworkers and I arrived around 8:30 AM on a Tuesday.  The service was quick and attentive.  All three of us had pretty basic breakfast foods (bacon, eggs, and home fries). No complaints.  The eggs were cooked how I wanted them.  Great coffee.",,,
15,Laura N.,"Sugar Hill, GA",6,7,10,4.0,9/3/2018,"I see this as being a local neighborhood favorite. It's not a fancy place but it's good and the portion sizes are plenty!! Service was quick, prices were average. I think it deserves more than 3 stars which is its current rating.",,,
16,Neal D.,"Fountain Valley, CA",0,66,29,3.0,6/30/2018,"Ate here for a post Broadway show. Ordered the regular burger, BBQ chicken, chicken noodle soup and pork chop dinner. Overall good tasting food, large portions and reasonable pricing. Noticed as you get furrther from the theater district the prices for meals get more reasonable. Worth coming back.",,,
17,Julio S.,"Manhattan, New York, NY",220,16,17,5.0,9/21/2018,I went there years ago had breakfast it was delicious and the service was great. I'm going there again on October 3rd for another big breakfast. Totally looking forward to it.,,,
18,Faith H.,"New York, NY",613,35,25,4.0,6/2/2018,"Got the Santa Monica omelette and it was delish! It was stuffed with avocado, mushroom, cheddar, tomato, and one or two other veggies I can't remember..but it also came with a heaping serving of home fries that were well seasoned and hit the spot for brunch. They come with an option of juice & tea or a coffee which I thought was a pretty good deal! I ordered grapefruit juice and an earl grey tea. Not crowded at all for around 1pm on a Saturday. The murrays omelette with lox sounded good too so will maybe try that next time!",,,
19,Daniel T.,"Allen, TX",0,3,0,4.0,10/19/2018,"What a great breakfast with a reasonable NYC price. Great service in a convenient location to Broadway attractions in a nice neighborhood. In NYC near Broadway hungry, come to Georgio's Country Grill.",,,
20,Cheryl P.,"New York, NY",127,78,10,5.0,3/27/2018,Stopped here for dinner and enjoyed the rib eye with garlic mashed potatoes. My husband had the angel hair margarita pasta with shrimp. The service was great and the food was good! Everything had a nice taste to it and the steak was good perfectly. I think we'll definitely be stopping here again!,,,
21,Karla M.,"Manhattan, New York, NY",30,54,68,5.0,5/26/2018,"I've ordered takeout from here so many times! They are quick and they are good deliveries! I usually don't like take out foods because they come all soggy and gross, but they way they package it up works out so well! I definitely would recommend.I've only ate physically in this restaurant once, but it was quick. They're service is amazing. I wouldn't say they are known for anything- just good American food and they have a wide variety of foods to chose from on the menu!",,,
22,Hayley M.,"Manhattan, New York, NY",261,17,17,1.0,6/11/2018,"We've tried this place out a couple of times, just toGive the benefit of the doubt. They always seem to try to nickel and dime you and the food is sub par for the money being charged. I've tried the grilled chicken and pasta twice, and each time the grilled chicken was burnt, and the tomato sauce made me sick. The chicken soup is awful, and the customer service is also somewhat subpar. I've called for a take out order before too and every time I go to get my food, the order is messed up in some way. This is way too much money to pay for subpar food and fickle service. Only good dish here is the French toast, and even when ordering turkey bacon (which usually comes with 4-5 slices), they try to scam you by only giving you 3.",,,
23,Javier M.,"La Joya, TX",6,80,35,5.0,11/4/2017,Breakfast is greatFresh orange juicePancakes are awesome French toast okayRestrooms cleanMy omelette was excellentService is very goodI would definitely recommend this restaurant I've satisfied my hunger the last 2 times I have come  to nyc,,,
24,Taina A.,"Brooklyn, NY",49,69,128,3.0,3/22/2018,"Well, the first spot I wanted to eat at had a line. The second didn't have a restroom. I ended up here because I really wanted a burger, I needed to sit and I had to use the restroom! (If you want the short version of my review, jump to the last paragraph.)THE SETTING:  It's a Thursday night, a little after 7.  I was greeted with a smile, seated promptly and the waiter arrived shortly after. Music is low and mellow. A few diners, not crowded. THE FOOD: I ordered a Kobe beef burger- medium with fries, a strawberry/ peach sangria and a water to start. The sangria looked nice, however it tasted like juice. Now I know sangria is a fruity drink, but I tasted No alcohol at all. There wasn't even any in the fruit itself and that's usually where the alcohol likes to settle! The burger was still a bit juicy even though it was overdone (medium- well instead of medium. ) I was too hungry to send it back and it Was still tasty after I added a touch of salt, pepper, mayo and ketchup. The fries were good as was the black and white milk shake I ordered after being disappointed by the sangria.THE SERVICE: As I stated  previously, the staff were smiling when looking at patrons. No one seemed upset. The ""water boy "" filled my cup when it was about half empty before I had a chance to ask. However, the waiter didn't come to check on me once. After my plate was cleared and the person at the next table was done with his food, the waiter did come by with an arm full of yummy looking desserts to show us. If I weren't full from the dinner I'd just eaten, I probably would have indulged! After getting my check, I asked for the rest of the milkshake to go, gave my credit card and informed the waiter I was going to the bathroom. When I got back to my table, the receipt book with my card was facing up. That wouldn't have been a problem for me if I weren't alone and the place wasn't getting more customers.  It's been a Very Long time since I gave a 10% tip and i hated doing it, but I felt that was the most he deserved this evening- being nice earned him SOMEthing.OVERALL: Though the service and the sangria were nothing to boast about, the food and milkshake were good! Oh! And the bathroom was clean and spacious.",,,
25,Karen L.,"Dayton, OH",1,66,69,3.0,7/2/2017,"We had breakfast at Georgios on a weekday. Husband ordered a build your own omelette, which is where you pick the items you want. He was happy with the taste, and it was filling. I did notice that his omelette wasslightly browned on the outside, which i thought was overdone. I usually like my ells yelloe, not browned. I ordered a scrambled egg, corned beef hash, fried potato plate. It was satisfying, but nothing special. The service was excellent.",1,,
26,Sherry S.,"Las Vegas, NV",0,60,103,5.0,10/10/2017,I've been eating here close to 18 years now and have never had a bad meal. For such a small place they have a big menu with a lot if variety. Great cocktails too. The last time I was in there I had the best fried fish I think I've ever had. And the prices are fair. Always great service.Breakfast anytime is wonderful! It's a New York gem for sure. I'll be there again on my next trip to the Big Apple!,,,
27,A T.,"San Jose, CA",0,25,55,5.0,4/17/2018,"I ordered aramando wrap and the portions are huge. This place Has a feel of a mom and pop place with the owner at the helm.  And if you want to see a coin operated telephone booth that nobody uses, there is one right here.",,,
28,Star S.,"Tucson, AZ",134,31,17,5.0,5/12/2018,"The Italian food does not disappoint!!  Wow! This is by far some of the best Italian food we have had in NYC! While reading the menu outside, we were greeted by a man with a heavy Italian accent who told us the specials. Turns out is was Georgio. The restaurant was packed. The service started a tad slow (to be expected with a restaurant so full). The bread was ok. A mix of different Rye and sour dough. The chicken soup was great! And then we got our meals. I ordered the chicken cutlet Parmesan with angel hair pasta and spaghetti sauce .....FANTASTIC! My husband ordered the Penne Napoli (penne noodles with a white sauce, sausage and peppers)....AMAZING!!!  Prices were very comparable to most Lunch places and we were far more satisfied with this meal than we have been for almost all of the other ""Italian meals.""We highly recommend!!!!!",1,,1
29,Devki P.,"New York, NY",299,72,33,3.0,5/14/2017,"This place was a decent breakfast in Hells Kitchen without having to sit down for a full brunch affair. The feel of the place reminded me a lot of the diners I used to frequent in Jersey. Service was a little slow but food was decent. Large portion sizes and reasonable prices for dishes. They give you all the condiments (syrup for pancakes, jam for toast) in these weird plastic containers which makes the whole place feel a little cheap which I thought was a little weird. If you're looking for a quick sit down breakfast though, this place wouldn't be a bad stop.",1,,
30,Naomi Z.,"Brooklyn, NY",163,293,331,3.0,12/10/2016,Good but not great. The avocado & chicken salad was pretty fresh but I've honestly had better. My bf got a burger and it was good (according to him).We got seated right away since it was 2pm on a Sunday and the food came out very quickly. The Christmas decor was pretty in point tho...so that definitely upped their game.,,,
31,Ally B.,"Manhattan, NY",13,210,482,5.0,"10/12/2017
            





Updated review","Georgio's has been a consistently good elevated diner-like restaurant for years.  From their reasonably-priced entrees to their breakfast all day menu, you really can't go wrong.  The best option is the breakfast burrito that comes with home fries for less than $9.  Their drinks are on point and sangria is definitely a highlight.  They usually take reservations on opentable, which is another plus.",2,2,2
32,Ginette P.,"New York, NY",517,988,6100,3.0,7/18/2016,"On our way out & wanted to get a bite to eat before the late night began ... Seems like unless it was a bar most of the food places were either closed or closing It was around 1130pm this place was open so we decided to give it a try. Came in & we were seated right away once seated we got some drinks I had a Cosmo not bad drink was good , my friend had a Brooklyn lager beer good as well.For a small restaurant they sure have a large menu .. Lots to choose from Food I had the personal Pizza cheese w fresh garlic comes with a salad or soup, I got the salad. Salad was not bad pretty tasty vinaigrette dressing. Pizza was good as well the garlic gave it a nice taste , decent size personal. My friend had a Burger & fries , good burger meat was tasty & the fries were good.Small restaurant , simple decor .. Service was good & prices were not bad.",6,1,3
33,Rob A.,"New York, NY",687,118,607,2.0,4/5/2018,"Didn't have any real expectations about Georgio's and glad I didn't.  Came here after playing a softball game on a weeknight and this place was packed.  Right when we walked in, we were greeted by the hostess which was nice.  Food portions were pretty friendly just like their service but sadly the food was really bland.  Went with the turkey burger with bacon with a side of sweet potato fries and was not impressed with the meal one bit.  My friend had salad which she enjoyed but then again... it's hard to mess up a salad.  Service was great, but I just couldn't get over how disappointing my food was.  Ambiance doesn't disappoint as it lives up to its name with farm items and animal figurines all around the restaurant.  With all the restaurants in the Hells Kitchen area I would recommend eating elsewhere, especially with the prices being what they are at Georgios. Maybe just maybe ill give this place another chance since I did enjoy their portions and service.",1,,1
34,Colleen P.,"Philadelphia, PA",194,6,0,5.0,3/24/2018,"I was walking through Hell's Kitchen restaurant row area when the owner of Georgio's greeted us. We were intrigued by the full service juice bar and the brunch menu seemed solid. We were seated right away and didn't wait at all for service, despite it being somewhat busy. Honestly we were super pleased with the fast and thoughtful service, great breakfast choices and the juice was pretty amazing. If you select one of the breakfast specials, coffee and juice are included! I would recommend Georgio's for anyone looking for an easy and delicious breakfast.",1,1,1
35,Dilanji D.,"Queens, Queens, NY",14,1,0,1.0,1/26/2018,One of the worst places. Never recommend this place There is is crap and service is very lousy,,,
36,Earl T.,"New York, NY",88,13,3,1.0,8/18/2017,"Had trouble with delivery so I decided to go in and have a meal. Will never enter this restaurant again. Ordered an omelette that came back brown meaning it was burnt! Just happened to look under my home fries and noticed a yellow stain on the plate, realizing it was yolk from a previous meal. I was grossed out immediately. Clearly my omelette was burnt and there was no place for yolk on the plate. Georgio's countrygrill is gross! Serving food on dirty plates",,,
37,K S.,"New York, NY",0,7,0,4.0,4/14/2018,"I order a lot of food for delivery & rely on Yelp ratings. I'm pretty good at weeding through reviews and judging which merit heeding. As a habit, I don't order from 3 star restaurants, but made an exception bc the menu fit my cravings. My breakfast was good! (And I ordered extra for lunch.) Everything was cooked how I asked. It came in pristine condition, i.e. it was obviously kept level for over 10 blocks (over easy eggs are usually a mess and these were like fresh out of the pan). Things were packaged logically, separated for maximum quality upon arrival. The food and drinks were much better than most places with higher ratings. This place is in a different league than 3 stars.",1,,
38,Symone Y.,"Trenton, NJ",137,1,0,5.0,6/24/2018,This place has AMAZING FOOD. This is the first review I have ever written although I have ordered from a TON of places. That's because I feel like the 3.5 stars they currently have is just not fair. This place has amazing food and so many options.,,,
39,Judith A.,"Northridge, CA",123,81,80,5.0,11/2/2017,Came here for a weekend breakfast.  Food was very good.  Service was food menu selection was ample. Enjoyed myself very much.  The omelettes were good. They had egg whites. I recommend.,,,
40,Devon C.,"New York, NY",225,173,151,3.0,2/26/2017,"Good breakfast. Fresh juice and good service. The seating is very cramped, so be prepared to dine with strangers. The menu is vast...I had the breakfast burrito.  Was $8 with no meat. Add the thimble full of juice ($3.75). Very pricey. But then again their rent in this area is very high I would assume.",,,
41,Emily C.,"San Diego, CA",0,23,17,5.0,4/19/2017,"Amazing flavors. I had the grilled salmon, some potatoes with a kick! Loved the veggies. Fresh salad and cherry lime sangria at happy hour only $5!Yes only $5 sangria and they are strong. OMG the bread with olives is a must. ENJOY!",,,
42,Latsyrk K.,"Flushing, NY",26,6,2,5.0,1/3/2018,Good solid diner spot.. nice big portions. Their sweet potato and fried calamari is good. We also love their bbq chicken wrap... it's pretty official.,1,,1
43,Becky G.,"Northport, NY",0,1,0,5.0,4/29/2018,"We were looking for a brunch spot and came here and loved it. Super cute cafe, amazing food and drinks at a great price. Loved it here can't wait to come back. Country kitchen style decor to enjoy a lovely meal",,,
44,Kat C.,"Roanoke, VA",79,23,8,5.0,5/17/2018,"We were looking for something a little less greasy for dinner last night, I got the grilled chicken wrap and my husband got the tuna salad. Service was a little slow, but food was great and came out in a timely manner. Wait staff was super friendly- very cozy atmosphere",,,
45,Gabi C.,"ASTORIA, NY",6,111,338,3.0,9/17/2017,It is a really nice place with average food. But the deserve is really good. They don't have sodas refills.,,,
46,Gianna A.,"Livingston, NJ",0,2,0,5.0,8/13/2018,We decided to eat here after walking by and seeing the large food selection on their menu. The servers were very nice and energetic. We ordered penne vodka (which came with salad or really good chicken noodle soup) and baby back ribs. We were extremely satisfied with all of our food and the mojitos/sangria we ordered. Will definitely go back and try some new things!,,,
47,Kelly C.,"Carlisle, MA",10,18,2,4.0,11/3/2017,"When I first walked in, I have to admit I thought we were going to turn right back around and leave. Just not a very warm welcome. But we are hungry...I'm glad we stayed. The service ended up being not that bad and the food was excellent. I had the whole wheat pancakes with bananas and pecans - yummmm!  Everyone else with me had something different and everyone eat leaving full.I would definitely recommend it and would go back.",,,
48,Sharon C.,"Suwanee, GA",0,7,0,5.0,8/10/2018,"Grabbed a table here on our way back from a show and made us wish we'd stopped in earlier in our visit! Right across the street from our airbnb, so super convenient, reasonably priced!! and both times we went, meal was delicious.  Huge menu with lots of choices, lots of tables squeezed in, but still comfortable.  Highly recommend you give them a try if you're in Hell's Kitchen.",,,
49,Isabel A.,"Houston, TX",2,29,44,4.0,8/26/2017,Every time I'm in Time Square my friend and I have brunch here. Hazelnut coffee is yummy. Prices are reasonable. I recommend it.,,,
50,Teresa R.,"Saint Louis, MO",3,56,187,3.0,12/11/2015,Decent place. Pancakes were great! Omelet was kinda strange. It was really just an over cooked egg scramble. French toast was bland. They have a juice bar and allJuices are fresh squeezed/pressed. Service was just okay.,,,
