,er_name,er_location,er_freinds,er_reviews,er_photos,er_rating,er_date,er_text,er_useful,er_funny,er_cool
51,Anna M.,"New York, NY",0,37,52,5.0,8/3/2017,I have ate here for years the  regular menu has everything from burgers (veggie also) to breakfast all day. They have a daily special menu that has wonderful diverse selection from hanger steak salad to octopus. Crab cakes with lemon sauce is one my favorite . I could go on but one of my favorite meals has been the Thanksgiving Meal  it is DIVINE . The staff is awesome and super attentive.  As you can tell I love this place a must have if you are ever in NYC,,,
52,Eszter H.,"Brooklyn, NY",62,64,35,4.0,6/9/2017,"My friend and I decided to stay in the city the day before Memorial Day - we had stayed at a hotel nearby and wanted to get some food. We originally picked a different place but we forgot to call and they were not open. Georgio's was next door, full of satisfied looking people and the food smelled good even from the outside. My friend ordered a steak while I ordered a salad and penne vodka. My salad was good - can't really mess it up - and while my pasta tasted good, it seemed more like it was made with marinara sauce than vodka sauce; but again, it tasted good. My friend ordered his steak medium rare and it was actually more well done than he would have liked. He asked the waitress if it could be remade and they did it with no fuss, no extra charge and the second time he said it was perfect. We expected the bill to be higher but surprisingly it was quite affordable. I would definitely visit this place again.",,,
53,Faith C.,"Manhattan, NY",3,54,41,5.0,11/28/2017,The best delivery place in town! I've been ordering from Georgio's for about two years and I always have special instructions and they always follow them!  The Restaurant is clean quick delivery delicious healthy food! I highly recommend Georgio's Country Grill!,,,
54,John B.,"Carmel, NY",218,14,1,5.0,2/5/2018,I own a local business in the community established in 1916. This is my go to place for breakfast  To Stay/To Go  and or lunch To Stay/To go. I have always had good experiences here. The food quality is great and the service is always great. I have tried other places and the food and service to not meet the levels of  those provided by  Georgio's.  I highly recommend this establishment!  John.,,,
55,Lori K.,"Tallahassee, FL",0,15,6,3.0,11/23/2017,"Atmosphere was comfortable and casual. Service was prompt and attentive. Food was average. We had a late breakfast: egg wrap, breakfast burrito, pancakes. Nothing special, just okay. With so many choices in the neighborhood, I don't think we'll eat there again the next time we're in the city.",,,
56,Ryan R.,"New York, NY",730,1659,149,3.0,7/7/2016,"I had a large group with me and we were looking for a place to grab a reasonably priced bite to eat in the area. Thankfully, Georgio's was able to accommodate us.For my main meal, I decided to go with the grilled chicken and a side of broccoli. This dish was pretty no frills, as it came with grilled chicken--no marinade or rub, just plain--and some steamed broccoli. Though the dish was pretty uneventful, it was pretty generous and definitely was more than enough food for me.Overall, the vibe of this place is a bit divey and the prices correlate. The service was friendly, but not super attentive. In addition, nothing looked super spectacular, but everyone seemed satisfied with their meals.",1,,
57,BW W.,"Manhattan, NY",0,21,4,5.0,1/28/2018,"When you come in you feel little tense because it's busy and has that congested chicken coupe feel however once  you sit down you feel better, the food tastes delicious and the staff was fast and friendly. Price point is great , my hot plate was around 9 bucks, can't beat that in hell's kitchen",,,
58,Sash S.,"New York, NY",108,66,25,4.0,8/18/2016,"Great place with reasonable pricing. Came here with a group of friends. We noticed the place as we were walking down the street and decided to give it a shot. Thankfully, we all enjoyed our meals. Food: to start I had the chicken noodle soup. The flavor was great and the chicken was tender. Very good soup. My entree was a special - bowtie pasta with Italian sausage (with shiitake mushrooms and sun-dried tomatoes). A gentleman also added some amazing cheese once the plate was served. The dish was well balanced and had great flavor. Overall very good. Also noticed some great looking cheesecakes but didn't get to try them.Service: Good but nothing memorableAmbience: Decent tavern like atmosphere.Overall: A good place to check out if you're in the neighborhood.",,,
59,Matt K.,"Manhattan, NY",0,12,8,1.0,1/2/2018,"Over cooked bacon on my blt with a giant portion of wet leafy lettuce, and the end cap of a plum tomato. Why do you charge for ice tea refills? Asked for 2 lemons and you served limes. Get your act together.",,,
60,Steve R.,"New York, NY",0,19,4,5.0,11/4/2017,"This is my favorite restaurant in NYC. The food is always tasty, the staff is nice and attentive, they do great delivery and Georgio always says hello personally. The grilled chicken avocado salad is my personal favorite and you always see at least 2 or 3 other diners enjoying it at their tables as well. Also a big fan of the Sonia's Wrap. Sometimes I get it with a side salad and dump the delicious contents of the wrap on top. Big dinners are great, too. Pasta specials are always new and intriguing and you can never go wrong with chicken parm. Only two downside is brunch items are overpriced. I guess they do great brunch biz! Can't fault them for taking advantage of what they do well.",,,
61,Tanya T.,"New Orleans, LA",15,3,5,5.0,6/11/2017,We are from New Orleans and loved the food at this establishment. The atmosphere is nice and quaint. The food was delicious on all 3 times visiting. We highly recommend and will definitely come back when visiting New York.,,,
62,Teofila R.,"San Antonio, TX",134,244,2769,4.0,7/1/2016,"Staff and a great dinner saved the night! Wine x 2, was settling and comforting. Bread and butter made me feel safe. Olives salty and oily and savoring! Salad good and crisp! Angel hair with heavenly mushrooms were the best I ever had!! Tender, light , creamy, seasoned to perfection! Duck breast tender and flavorful! Got to sit by window and people watch. Thank you for testing me so nice.",,,
63,John C.,"Elk Grove, CA",6,182,0,4.0,3/27/2016,"Decided to try this place for breakfast based in part to Yelp reviews and the fact that it was about 3 blocks from our hotel. Very busy on a Saturday morning. It's pretty cramped when busy!Food was solid. Nothing special, but solid breakfast favorites and the coffee was good. Couldn't beat the price just a few blocks from midtown.Overall, a great place to stop if you are looking for a quick casual ""sit down""  breakfast.",2,,
64,Julie J.,"Boston, MA",23,5,3,5.0,1/29/2017,"Love this place! Very kid friendly, good food and great value. Have been coming here for years with my family and he owners are so kind. I would definitely recommend for their brunch menu!",1,,
65,Chrissy R.,"Manhattan, NY",0,147,169,4.0,7/12/2016,"Above par diner food/neighborhood gem - huge menu (something for everyone), food is always fresh and prices are reasonable. The trifecta of a good resto! I love ordering brunch from here, but come in often because the omelettes come with fresh squeezed juice or coffee/tea and on a good day, the huge windows are open, letting a nice breeze in. Service is good - quick in and out. No frills. Takes reservations on opentable.",,,
66,Ray L.,"New York, NY",17,86,13,5.0,12/27/2016,"Love this place.Food is totally solid and a great value. The owner is really kind and welcoming. And the wait staff really friendly and professional.I've had steak and eggs, waffles and other various brunch foods and have always left very satisfied. All that said, people need to remember that this is a diner and not to expect red carpet treatment (which all of the negative reviewers seem not to know).",2,,1
67,Shannon M.,"Macon, GA",13,4,9,4.0,6/2/2017,"Very nice restaurant. Service was good and everyone was very accommodating. I had the Lox bagel, no lox, add ham on an everything bagel. Hubby had the Pancakes, bacon and cheese eggs. It was all very good. My bagel wasn't as crispy as I like it but it was still very good!",,,
68,Cornell S.,"Fontana, CA",3,26,6,4.0,3/21/2018,"The country kitchen part is definitely felt here. Country in the city. From the steak all the way to the 7 grain toast. Very intimate setting, not in the romantic sense but closeness to each other",,,
69,Pandora B.,"Brooklyn Heights, Brooklyn, NY",1,94,0,4.0,7/23/2017,"Georgio's is not a ""country grill"" -- whatever that means in the middle of Ninth Ave. in New York City.  It's a diner. But that's not necessarily a bad thing. Diners are a New York institution and we should support their existence because they fill an important dining niche when you're hungry, don't need a tablecloth and want a menu of seven thousand things to choose from. Georgio's is a long, narrow space, but they've prettied it up with bright plates, bright colors, and whimsical figurines of animals and birds on a shelf high up on the wall. This must be where the ""country"" in ""country grill"" comes from. The food was what one would expect in a good quality diner. I enjoyed my Mediterranean omelet with olives and other vegetables and feta cheese, a generous side of crispy-not-greasy home fries, pink grapefruit juice and a decent cup of coffee. My companion had a bowl of linguine with tomato sauce, of which she ate every bit (it was her first meal of the day). In other words, we had diner food.To sum up, good diner food, cute atmosphere, good service. Ninth Ave. has a 15-20 block stretch of a hundred or more restaurants, and if you're looking for a ""country grill"" rather than some other category of restaurant, Georgio's will do just fine.",,1,
70,Jose R.,"Manhattan, NY",1,13,1,4.0,9/28/2017,"I've been here three times. Recently my friend and I had brunch which is served all day  maybe everyday too? Not sure, the food is fresh, quick service and delicious. The place reminds me of a OG diner. Not with the decor just with the experience. Straight to the point type of place.",,,
71,Rachel L.,"Flushing, NY",0,3,0,4.0,11/5/2017,"Went for Sunday breakfast with my daughter today.  Great food, and friendly service.  I had the crab cakes Benedict and my daughter had a make your own omelette.  Delicious!",,,
72,Beth M.,"Boston, MA",115,138,169,4.0,12/13/2016,"Great breakfast, Great food! Small spot, only for those who don't mind close quarters with fellow breakfasters...this place has great food...got the Eggs Benedict and it was delicious!!! Cooked perfect! They fill your plates and are not shy on the hollandaise sauce! Home fries are some of the best I have had! Tried a banana walnut pancake and that was delicious too!! They take reservations and you need it! We will def be going back!",1,,
73,Christina G.,"Jersey City, NJ",4,16,5,1.0,7/29/2017,"Attempted to come here for brunch after making a reservation 5 days prior. I was told requesting a window seat would not be a problem. Get there today and of course they suddenly cannot put me at a window seat even though there were 4 open tables there. Then the manager or whoever it was gets in my face and tells me now I need to wait for all people in my party of 4 to arrive ""then we'll see what happens."" Really? For diner food??? Stood outside for 3 mins waiting for my party since Georgio's is so cramped and there's nowhere to stand. Luckily we noticed Alfie's across the street was just opening and went there instead. Such a good decision",,,
74,Jay H.,"Manhattan, New York, NY",0,9,0,5.0,10/3/2017,I love it here! Fast! Accommodating! Cheap! Pretty Good Food!I always tell people to come!,,,
75,Ben W.,"New York, NY",514,772,435,4.0,9/29/2014,"Surprisingly delicious plates coming from the kitchen.To be honest, my bar was set pretty low, as I expected typical diner food from an American pub kitchen. To my delight, portions were mighty and so was quality.My whole grain strawberry chocolate chip pancakes were tasty, although as soon as I got my coffee, I instantly craved savory. My bf's protein omelette came to the rescue. The humongous egg white mess came out piping hot and topped with a melty goodness. Home fries were not dry at all, and the chicken added a lot of unexpected flavor. A big plus was the free juice, which wasn't your run-of-the-mill OJ from concentrate. Our apple, lemon, ginger fresh squeezed juices were a great finish to the meal.If you're looking for simple, hearty breakfast food that doesn't suffer in quality, give Gerogio's a try!",1,,
76,Michael M.,"Hell's Kitchen, Manhattan, NY",92,18,1,5.0,7/18/2017,GREAT! I love this place. It is my go to breakfast spot when I have a visitor from out of town. My mother & father were in town for a little over a week and they had 4 of their breakfast' there. Its a family favorite! :-) Highly recommend.,,,
77,Tony L.,"Manhattan, NY",617,635,594,4.0,8/11/2015,"Hearty, good food with great service and a huge menu...Georgio's is a bistro-diner hybrid. I can't recommend the Angel Hair Primavera w/ Chicken enough. The dish is large enough for dinner and lunch the next day. It comes with a ton of julienne vegetables, pasta and chicken (and a side salad or soup of the day). I'll have to be back for some breakfast...that's the true test of a place like this' merit.",2,2,2
78,stacey c.,"New York, NY",61,32,49,4.0,1/8/2017,I just wanted some good ol' blueberry pancakes and these definitely satisfied my craving. The brunch option w my blueberry pancakes was bacon (cuz always choose bacon) and it came with coffee andd a juice. The freshly squeezed orange juice was great and the coffee came with limitless pours. The pancakes comes with a big piece of butter on the side and syrup. I heavily mixed both onto my pancakes because I'm gluttonous and proud.,,,
79,Casey K.,"Saint Louis, MO",231,37,22,5.0,1/8/2017,"Came here for lunch with a friend. The staff was excellent and very attentive and they accommodated our request to be seated away from the door even though the restaurant was very busy. I had the Sonja wrap which was delicious, very juicy and flavorful. My friend had the breakfast burrito and he said that it was very good (he is very picky so that is high praise). If you're looking for good service and good food, I would highly recommend Georgio's.",,,
80,Michelle R.,"North Bergen, NJ",3,6,0,5.0,2/11/2018,"This place is one of my favorite places to come eat!!!!! The food is always the same it's never changed and my husband and I've been coming here for 16 years. The costumer service is also very good the waiters and waitresses are very sweet. Our favorite meals are Chicken Parm with penne paste, Fettuccine Alfredo with grilled chicken, mozzarella sticks, and their Cobb salad with feta cheese...it comes with blue cheese but I hate blue cheese so I switch it to feta cheese. And their soups are very good too.",,,
81,Ken D.,"New York, NY",252,102,7,3.0,1/28/2016,"My wife and I stopped here one evening for dinner around 10:30 after got out of work. It took far too long for them to acknowledge us at the table. Beyond that, my fries were overlooked, her wrap tasted nothing like a caesar wrap and I had the smallest double decker grilled cheese I've ever seen. They were fairly attentive after the evening progressed, but I wouldn't waste my money again. The quality just wasn't there for a 9th Ave restaurant. To say the least, when we left, we were disappointed.",,,
82,Lois M.,"Manhattan, NY",5,43,50,2.0,12/4/2016,Really a waste of money ! Boring bland menu would only come for breakfast maybe They seem so desperate for money with the upsells the water had the best flavor at this country kitchen the meatloaf was like breadcrumb loaf and the 6 fries on the side like really ! My friend disliked her meal too couldn't wait to leave change that whole menu go to a Greek diner menu simplify it Your menu and cooks are your problem!!!!,,,
83,Naresh J.,"Alameda, CA",0,4,1,5.0,7/17/2017,"I agree with Raul C, I can't imagine why anyone wouldn't give this place 5 stars. I imagine it's something similar to people complaining about cars because the built-in wifi functionality didn't work while roaming in Mexico. I digress but trust me, if you're here for the food you're in for the RIGHT reasons!! We walked in to get breakfast food at 10 PM and boy were we impressed. Really wide spread and crazy options but the Eggs, Chicken Alfredo, Avacado soup, fries, shakes and toast we had were scrumptious!! Very home made, wholesome taste with big generous servings. Last but not the least, the service didn't have the NYC twist and was genuinely warm :)",,,
84,Terrance C.,"Manhattan, NY",2,72,242,4.0,10/13/2016,"I love the hazelnut health shake, Wow! The French toast and Belgian waffles are excellent. Burger are average and onion rings are frozen but good. The wait staff are always good to me. I always recommend this place to people looking for breakfast and I always look good doing so. My doctor loves the tuna on toast. I haven't had the lunch yet, the burger and onion rings I got in the morning. Yes they serve there dinner and lunch menu for breakfast. I wonder if that is due to frozen foods. Sorry no pictures!",,,
85,Kayla W.,"Rockville, MD",0,9,2,4.0,7/24/2017,Pretty popular little spot on the corner! I usually don't eat breakfast foods but their French toast was pretty good. They give you a good bit and the fresh squeezed apple juice was great! I now want to go buy a juicer. I'll have to visit for dinner on my next trip to NYC.,,,
86,Jason L.,"Nashville, TN",3,21,0,5.0,4/8/2017,"Amazing food and atmosphere.   Not sure why it has 3.5 stars, should be higher.  The Wisconsin cheese omelette was amazing.  My 11 year old son loved the pancakes.  They were perfect.  Really enjoyed this place.",1,,
87,David W.,"Philadelphia, PA",54,247,739,2.0,6/14/2016,"I stopped in for dinner with family and a few friends, and quite frankly I was disappointed, particularly after reading some of the glowing reviews on Yelp. Maybe the breakfast menu is better. I found the Mediterranean Salad to be really perfunctory in execution (mostly just some Romaine lettuce, some tomato and red pepper pieces, and feta cheese crumbled on top (see photo), with nothing else. Dressing on the side, which seemed like a factory-made dressing. The individual pizza was okay, but nothing to write home about, either - I had to wonder if it was previously frozen. The Cajun Salad got better reviews, however. The staff was competent, but seemed generally indifferent to us as customers. I didn't think anything on the menu was much of a bargain, in terms of pricing. ""Meh,"" sums it up. It is, however, a kid-friendly place, note the pizza, if you're bringing them. I might give them another try, and perhaps for breakfast, but for now, just 2 stars.",2,,
88,Erica L.,"Sharon, MA",0,6,5,4.0,7/14/2017,"This place is the best for a hangover brunch. Had amazing strawberry chocolate chip pancakes and an omelette with chicken and broccoli with melted mozzarella cheese and hash browns with my boyfriend for brunch. It is a very basic brunch diner feel with country animals around the restaurant. Was a bit loud, but overall a great meal and would definitely go again.",,,
89,Infaas N.,"Brooklyn, New York, NY",0,1,0,1.0,1/26/2018,The worst place to have a business meeting i regret taking my people here. The worst restaurant in new york city. I'm sure yelp will try to cover this up cos they get paid for advertising trust me pls don't waste your time going in here try a 99 cents pizza cos they will be way better lol,,,
90,Mark J.,"Arlington Heights, IL",73,473,313,4.0,8/9/2015,Stellar diner type of place! I've been coming here for years and it never disappoints. Clean and down to earth. One of my go to places for breakfast/brunch in Hell's Kitchen!Great omlettes and burgers. The wraps are also really tasty. They have fruit smoothies that are to die for! The portions are always good so you will NEVER leave hungry.The wait staff are all friendly here too.,,,1
91,Pattie L.,"Queens, NY",35,322,3879,5.0,1/18/2014,"Oh my GREAT brunch! Decor: yes a little cheesy almost like Cracker Barrel meets diner meets Italian restaurant?? But who cares because their food will make you forget about your surroundings Food: I'm drooling a little as I type this (TMI? Oh wells). Came with 3 other girlfriends and we all went with a brunch special2 orders of the crab cake with eggs Benedict and 1 order of waffles with a side of eggs and 1 order of the Georgio pancakes with a side of turkey bacon. Each of our specials came with out choice of juice and a coffee or tea.  The juice selection you can choose from was great! I recommend the apple lemon ginger one! The food portions are more than enough to keep you full! Crab cake eggs Benedict- comes with 2 crab cakes with 2 eggs Benedict's and a generous side of home fries. Waffle- comes with one huge waffle a pile of strawberries and whip cream georgio pancake- comes with 3 pancakes which have strawberries, huge chunks of walnuts and chocolate chips in it with whip cream on top Are you drooling yet? All of us fully enjoyed our meals and even had left overs! All in all we will be back! this place is affordable and delicious what more can you ask for?",1,,
92,Sarah A.,"New York, NY",37,77,83,5.0,9/25/2016,Me and friend came here  aug  15th. The service was magnificent. The food was awesome and so were the drinks. It was  maybe 10pm on a Monday. The place was clean and a bit busy. They checked to make sure everything was great in between meal and offered dessert. I would consider this place to be romantic.,,,
93,Cheyenne B.,"Brooklyn, NY",175,71,11,5.0,7/19/2016,"Great food and always great service! I work a few blocks away and always come here with my coworkers when we want to have dinner! The pasta is great and filling and it's also big so you get your bucks worth. And they never mind when a bunch of us are loud in the restaurant. Lol :) Good for groups, good service, good all around.",,1,
94,Raul C.,"Hialeah, FL",0,2,2,5.0,5/28/2017,Perfect this place was just perfect the service the food the employees everything anyone who doesnt give this place 5 stars was simply having a very bad day of their own the owner was very nice even gave us a free drink for no apparent reason i would reccomnd everyone eat here whether you live in the area or are just traveling if you go to new york and dont eat here you probably missed out on your best meal in the city id give it 100 stars if i could.,,,
95,Meg B.,"Moretown, VT",34,43,38,4.0,4/19/2017,"Attentive and warm service, small but comprehensive and comforting menu with all the breakfast standards (served all day long). Because when you have a hungry teenager in tow, food that sticks to the ribs is non-negotiable.  And bottomless mugs of coffee for mama. Best option for breakfast if staying in the touristy Theater District, simply veer a little off the beaten path.",,,
96,Regina D.,"San Francisco, CA",104,581,145,4.0,1/20/2014,"Try the eggs florentine. The ingredients were so fresh and healthy that I gorged as soon as the plate arrived. It was not greasy. And, came with a small juice! The coffee here is amazing too- being from the coffee capital of Seattle, that's saying a lot! Though not the cheapest place, the prices seem justified given the quality food that came out of the kitchen. Go for a healthy, fresh, home cooked breakfast / brunch. The plates come out relatively quickly. And the service was great.",,,
97,Zach B.,"Manhattan, NY",189,49,105,4.0,7/6/2016,"I went on Tuesday night here on a casual date - pretty solid choice! I was really impressed by the basket of bread and the olive oil. It tasted like there were literally pressing the olives themselves in the back.The menu is nothing eccentric or exotic, but they do have bison burger. Think wraps, salads, pasta, and a burger.",,,
98,Andrew D.,"Blackrock, Republic of Ireland",0,22,3,4.0,6/14/2017,Great food and service at a reasonable price! Came here for brunch today and really enjoyed some pancakes with fruit and bacon on the side. The waiter was very friendly and didn't have any problem with us sharing the pancakes. The overall experience was very pleasant! We would recommend this place for breakfast/brunch.,,,
99,Cat W.,"Flushing, NY",46,174,822,4.0,3/4/2017,"I love the pasta dishes here. The portions are huge! I usually end up splitting it with someone, or taking home large amounts of leftovers. The soups are delicious. Service has always been great. Give this place a try :)",,,
100,Jen K.,"Queens, NY",241,396,3,4.0,1/7/2016,"Fluffiest eggs ever and amazingly perfect hash browns (crispy, liberally salted and seasoned, etc.).  The restaurant can feel a little chaotic, but Georgio is the hardest working guy in Midtown, and the staff tries hard to keep things moving when things are busy. The portions are a little smaller than other places, but very delicious. If you come with a big group, make sure everyone is there - otherwise, they won't seat you!",1,1,1
