,er_name,er_location,er_freinds,er_reviews,er_photos,er_rating,er_date,er_text,er_useful,er_funny,er_cool
0,Joseph L.,"New York, NY",828,471,120,5.0,11/14/2018,"What. You want a pool hall smack dab in the middle of Manhattan with reasonable prices, good people, and late night service? Come here. Play a game or two or three with some friends and just enjoy the game of billiards that has been running worldwide for who knows how long.Sometimes an activity with the absurd amount of alcohol ktown consumes is a nice change of pace. So come clank some billiard balls and sticks and then if you're still up for it go down one floor to their karaoke rooms and sing you hearts out!",,,
1,David K.,"Woodmere, NY",17,38,0,2.0,11/15/2018,"Ripoff WarningLet me preface my review by saying I really like this place.  It has a dark vibe, good music, nice tables and good drink selection.  I have been here quite a number of times over the last several years.  However, the other night I felt completely ripped off.  They added a 20% tip to my entire bill for two people (no big group or anything like that), and charged the tip on the entire bill, including the cost of the pool tables.  Leaving aside that they should not be charging a service fee at all (tipping is optional and I have always tipped in the past), charging it on the pool table is a complete ripoff.  I think they did it because they thought they could get away with it.  Bad move because I was planning to come back with a group next week. The other observation is that the place has been getting progressively more expensive.  I have been coming here for at least 5 years and the prices are creeping up faster than they should be.  Definitely don't sit around.  Play your pool and get out or the charges grow, grow, grow.  Too bad because I otherwise really like this place.",,,
2,Marcia C.,"Long Island City, NY",164,18,31,4.0,11/13/2018,"Great space for groups that enjoy pool! They charge $25 an hour per table and lights are off on all unused tables.They have a call button for service & from my experience it comes in handy and they're very quick to come to you. Food may take a little while but since you're playing the wait didn't really matter. The space is extremely clean and you can tell they take care of the tables! Music wise you can change it upon request but in my opinion they have a good selection in shuffle (they had a mix of top 40, edm and some spanish).They have an open bar offer in the menu but the server said it is only for groups 40+ and they'll be given a section with tables if requested!",,,
3,Darya S.,"Manhattan, NY",918,1897,811,3.0,8/12/2018,"Fun place to kill an hour. Service is pretty much non-existent - had to ask for water multiple times for them to bring it, and it wasn't even busy - but if you're looking for an activity versus eating, this is fun. Decoration is trippy and fun to look at. It's got spacy, futuristic decor in addition to random wall stickers. Feels kinda hipster! $24 per hour gives you enough time to play 2-3 games. It's a cool vibe and a fun activity. They're not trying to be anything more.Apparently, you get free popcorn, but we never got any. Bleh.",,,1
4,Kim M.,"Manhattan, NY",408,29,1,4.0,11/12/2018,"Great little date spot! Stopped here on a Monday evening around 8:30pm. Plenty of tables open, so no wait. Loved the fun decor and great music selection. Played for about an hour an half, ordered  some cocktails. the spicy margarita was great, packed a nice punch! They have a button you can press for service so you don't have to go to the bar mid game. Decent pricing and will definitely be back next time I'm wanting to play some pool! Also note they automatically add gratuity to every check.",,,
5,Allen H.,"Arlington, MA",0,13,1,5.0,10/31/2018,"I stopped by to kill a few hours and shoot some pool at 3 in the afternoon. This place was extremely well maintained on the tables. You can tell that they actually care about the game. Yes, they have a space theme but it's not distracting and kinda grows on you quickly. But, that's ALL to do with the care given to the tables. The cloth was clearly maintained, no ""house leans"" to the tables, pockets are tight and they keep everything clean. Even the house cues are straight and the tips are maintained....rare! It's far to easy to have pool be a junky thing, not here. While not a high-end room by design, the tables felt that way. Look forward to shooting pool there again.",,,
6,Erc B.,"New York, NY",0,41,1,3.0,4/22/2018,"Cool billiards place in k-town. Tables are in good shape, decent music, and after work happy hour is a good deal.Only disappointment is that after 5+ visits realized I'd been double tipping because they auto include gratuity. Since it's dark by the register would've been nice if they would've mentioned it. I'll be back, but the 20% tip they would've received will now be the 15% auto.",1,,
7,Kevin N.,"Forest Park, IL",20,91,175,4.0,10/23/2017,"Went here while exploring around Koreatown and seeing what there was to do. This place looked good so I stopped by here with a friend. Wasn't disappointed.ATMOSPHERE/ARCHITECTURE: 8/10The cosmic style decor with the colors and dimly lit area really worked for me here. I like the overall atmosphere and most importantly it was clean and well kept. I don't really have any complaints about the design at all. I think it would make a great place for a party for a big group.SERVICE : N/A/10From what they told us, you hit a button and they come to your table so I assume it's good. I didn't use it at all though so I can't comment on this part.FOOD: N/A/10I didn't order any food or drinks.PROBABILITY OF RETURN: 9/10Supposedly $23 per hour on the weekends for a billiards place is pretty cheap. I'll take people's word for it. I enjoyed my time here and I would most certainly come back.OVERALL: 8/10",,,
8,RJ S.,"New Haven, CT",2,7,0,5.0,9/29/2018,This place is legitimately a fun place to hang out and sing my little hearts out in a private space. Our waitress/attendant was very fun. Shout out to Michelle H. in the kareoke lounge for taking care us,,,1
9,Sarah P.,"Princeton Junction, NJ",0,3,6,5.0,8/19/2018,"I loved Space Billiards! I've been here twice so far. This weekend was my second time. I got here on a Friday night and expected a long wait, but only waited 20 minutes although it was bustling with people. The wait also felt a lot shorter because there's a spacious bar area by the entrance you can sit at. The music was on point. The staff--security, waiters, bartenders--was incredibly nice and helpful. The decorations are very well done. There are a decent amount of pool tables, with abundant space, seating, and tables around each of them. The hourly rate when I went was $32 for my party of 4, so each of us only paid $8 for the hour we were there, which was very reasonable. The drinks are also delicious!",,,
10,Ina M.,"Hackensack, NJ",357,456,998,1.0,2/9/2017,"Man, this place was promising. Take note: WAS. It all turned sour towards half of our stay. My friend, fiancé and I wanted to do something fun. Our usual spot, Spin (cool ping pong spot) was full for a corporate event so we decided to head here. Space is located on the 12th floor. Up the elevator you go and there it is. We missed happy hour, but still asked for one hour for the three of us. They charge an extra $3 per person after two guests. I didn't mind it as it's understandable, plus they have it written so it wasn't a surprise charge. We got the large lychee soju and it was good. Half way through our time, I ordered a beer and nachos. I got the beer, but never got the nachos. So as time passed, I thought they just forgot to put the order in. Plus, I didn't see the server to ask where they were. Time was up (I was keeping track of time; we started at 8:30pm) and we went to the bar to close our tab. Upon seeing the check, I got charged for the nachos. Okay, we tell her we never got the nachos. She seemed confused, went to the back/kitchen and came back out. Then she was talking to another girl and guy... Time passed while waiting for them to take it off. I get the check for the second time. Great, I got charged $13 for ""half hour."" We asked her how we went over, and they said ""oh yeah, you were here for 11 more minutes."" I really don't understand because the pool table lights went off for the table next to us when their time was finished, but it so happens that we went to the bar to close out and yet the time was still running. The staff was literally talking to each other while voiding off the nachos, but I got charged for it. I had a feeling they wouldn't remind us about our time left, that's why I kept count. But to be charged for the time they were getting the check together, I just felt like this place was really, really shady. I wouldn't suggest coming to this place. There are way better billiards spots that have a better vibe and service.",10,2,2
11,Ashley N.,"New York, NY",381,334,634,4.0,12/17/2016,I usually like to play pool in bars but sometimes it gets super crowded and I find solace in space billiards! It's much cheaper than other billiard places in manhattan and the people there are super attentive. I've been here multiple times and I've never been disappointed. It's so conveniently located in k-town next to the B/D/F/M train or 6 if you want to walk a few avenues. They have happy hour before 8 which I always miss somehow! They take credit card but have 8% off if you pay in cash (they have an ATM machine). The music is always great and the billiard tables are well kept! Once getting a table they give you complimentary popcorn which they refill! I love getting the popcorn! The drinks are also at a reasonable price but the cocktails are a much better option because they are tasty! Try their flavored shots! I'm not usually a shot person but I found them very tasty. Theres a lot of space to play pool as well. I usually find when I play pool i knock into people or the pool stick knocks into the wall. Before leaving make sure to get their loyalty card! I love coming here and the people are so nice. I've only waited for a pool table once but the people working there are very friendly and the wait time is never long.,9,2,4
12,Leslie C.,"Ithaca, NY",317,12,4,4.0,7/22/2018,Pretty cool place! I went with a couple of friends. we had fun! I ordered the shrimp which was good but a bit pricy and took a long time haha! Check it out though! I wanna see more of these hidden places i never got to see in or around ktown,,,
13,Christine T.,"West Hempstead, NY",108,27,23,5.0,3/1/2018,"Love love love this low key spot. So this place is in the cut, and on the 9th floor of the building. Basically if u dont know about it u wont be going because its so low key. So we got there at 6 and that was happy hour. So it was 18 dollars for the two of us for an hour. The shots were five dollars and so were the beers. Great price. The decor is basic but futuristic. The staff was so nice from the second we walked in til we left. The guy even recommended a great spot to eat. It was pleasant, low key, and cool. Will def. go back and recommend for a date night with ur boo or just hanging with friends. Awesome spot cant wait to go back.",,,
14,Uwen M.,"Brooklyn, NY",0,2,1,5.0,8/2/2018,"Dope spot with a nice vibe, the ambience and overall aesthetic was . The customer service was incredible, really good people that took care of their customers and I can't wait to go back.",,,
15,Tracy C.,"Round Rock, TX",0,32,1,5.0,7/6/2018,"My husband and I had a great experience here! Great ambience,great drinks and pool tables were well kept! Music was poppin, and above all, the service was the best! We did not have to wait more than 3 min for a drink (while shooting pool...wasn't even sitting at the bar) and the waiter was extremely welcoming. Definitely coming back again!",,,
16,Piyush G.,"Alameda, CA",63,13,6,5.0,6/10/2018,"Cool vibe! Great location. Lots of fun. Good music, service was on point, great spot for groups.",,,
17,Deirdre L.,"Brooklyn, NY",313,530,179,5.0,2/24/2017,Great place for having fun with friends. Great drinks. Good atmosphere. I ordered the strawberry slushee and it came out pretty good. Ordering food soon so I hope that it will come out delicious. Hoping for some yum!!,2,,2
18,Emily W.,"New York, NY",215,98,80,5.0,9/27/2017,"This is such a cool-looking place! Without the pool tables, it could easily be a club. I'm not super familiar with pool halls, but I really enjoyed my time at this one. My company rented out the entire space for a party, and I appreciated how there was just as much space for people to play pool as there was for people to just sit and talk with their friends. The people working the bar were really nice and tried their best to get drinks out as quickly as possible, despite the high volume of people ordering. The drinks themselves are really good! They could be a little stronger, but I definitely don't mind not tasting the alcohol. Also, the staff was amazingly fast at clearly out any empty glasses, making sure the place looked neat at all times. I would definitely recommend Space Billiards!",,,
19,Molly S.,"New York, NY",103,527,405,3.0,12/14/2016,"Small Pool hall located in KTown... this is not in any way a nice place, but it certainly is fitting of the expectations for a divey pool hall... The service is super friendly and nice! They have about 10 tables that are paid for by the hour. They have a full bar and extensive cocktail listing. They have some bar like food, they order it from next door so usually takes about 30 mins.",4,1,1
20,Claire Q.,"Manhattan, New York, NY",0,1,0,5.0,8/16/2018,WOW! Popcorn and space. I wore a space helmet and played hand pool. No one kicked me out. The lights! If I could I would give this place A BILLION stars cause that's how many there are in the galaxy (or more?)! Fun fact: did you know there are more stars in the universe than grains of sand on earth?! #themoreyouknow #space #billiards #handpoolchamps,,,
21,C G.,"Dallas, TX",0,114,52,4.0,3/18/2018,"Went for a birthday celebration, they were on point with drinks being served quickly but they can't split the bill which makes paying for like 20ppl very difficult when people are coming and going over many hours. They should work on this, otherwise a good experience and the place was packed!",,,
22,Andy M.,"Manhattan, NY",5,6,0,5.0,7/26/2018,Space Billiards is coolest bar in Ktown. Sick Mysic setup most days u can play whatever you want. Cool atmosphere if you dont mind dark its got cool decor and a futuristic vibe. Cute helpful staff and a full selection of spirits! My local ktown go to!!,,,
23,Rajiv S.,"FOREST HILLS, NY",0,2,0,5.0,8/4/2018,Awesome place to hangout with friends and play billiards. Dont forget to check in cuz they give u free shot when u do.,,,
24,Ayessa S.,"East Harlem, Manhattan, NY",5,1,0,5.0,3/7/2018,Went on s rainy night but the drinks were good and so were the people. $30 for an hour of Pool and you get free popcorn,,,
25,AJ S.,"Sunland-Tujunga, Sunland-Tujunga, CA",0,4,0,5.0,4/10/2018,"Space is excellent, whether you're a regular to Manhattan or just touring. It's on the 12th floor of a non descript building. Excellent lighting. Attentive staff. Very clean. There were employees wiping dust from everything at the end of the night. Table tops are a bit worn and slick but professional size. Spacious space. Definitely recommend",,,
26,Laura F.,"Syracuse, NY",11,1,0,1.0,5/24/2018,I never leave reviews but I had to for this place. When we walked in we were barely greeted and given a set of pool balls and a menu with no further instructions. After picking a table we decided to go to the bar and get a drink. We sat at the bar that wasn't busy for at least 10 minutes as the staff completely ignored us. Finally an employee came up to us and told us we had to order from our table and left. When we got back to the group we had to ask the people next to us how they ordered because the staff wouldn't give us any other type of instructions. Throughout the night the staff would barge right in front of us to get to their back room and in one circumstance pushed past my friend without saying anything. The bathroom was dingy and had a pile of boxes. Their were also empty popcorn boxes piled underneath our table. Save your money and go somewhere where the staff actually cares about their customers.,2,1,
27,Jasmin A.,"Bronx, Bronx, NY",0,4,1,5.0,2/18/2018,"If you're looking for a chill spot to play some pool, darts or just enjoy the night this is the place to be. Awesome place! Service is on point! Shout out to Jenny the waitress, she's amazing! I'd give this place 10 stars if I could!",,,
28,Annette O.,"New York, NY",39,53,363,2.0,11/7/2016,As soon as I walked it smelled like bleach.  Rugs are old and dingy looking red tape all over the benchs to cover aging.  Didnt even want to get a drink everything looks old and worn.  Atmosphere was quiet music was ok.  I don't recommend it to any one.  Gross Gross Please don't waste your time or money,,2,
29,Kunal M.,"San Diego, CA",224,3,5,1.0,3/27/2017,"This is the most overrated place for pool in Manhattan. As vacationers, we came on a Sunday cause it was our last night looking for a fun place to hang out. The waitress greeted us saying that it was $29  FOR AN HOUR of pool. The place looked cool so I decided to pay for it. Aside from the fact that it is EXPENSIVE... the service was extremely rude and insulting. When I was getting ready to pay her she question me to say that we need to pay her before the game. I have never had such terrible service at a cool  place before. Please take your business elsewhere.Also as I left there was a sign saying leave a good review for a free shot. So this yelp rating is probably inflated because of that",2,,
30,Hoyuet L.,"New York, NY",33,11,6,5.0,5/30/2017,"The bartender here took care of us on a tuesday night, billiard here is affordable for an hour, quite quite on a tuesday night too",,,
31,Quandra T.,"New York, NY",81,112,21,5.0,3/18/2017,"Came last night for a friend's birthday get-together. We were hit by the ambience the second we walked off the elevator, and me and my friend OoOhed and Aaahed at the lights and decor like schoolchildren. The next thing to impress me was the drink menu. They were standard NYC pricey, but the FLAVORS. Their mixed drinks included Mango Man, Love Potions, and the unicorn JOLLY RANCHER. It's like these drinks were created with me in mind; sweet, tasty, enjoyable-to-drink mixes that pack a punch. I think I gulped through the Love Potion in like 5 minutes without realizing it because there was no cringey liquor-aftertaste.Impression #3: Free popcorn! :D I love it when bars provide free snacky things while you drink. It makes all the difference! They just handed us a bowl as we sat at the bar.I think pool might have been a bit pricey, but that's probably why you drink at the same time, lol, so it doesn't matter as much. I also felt comfortable enough to open a tab here, which says a lot (if you remember from a previous review :P)Impression #4: They gave us a round of shots on the house! And those who know me know I suck at shots. This one was nothing! They used whatever sweet-drink-mix magic they had up their sleeves to make it the most enjoyable shot I've ever taken.Bonus: Near our pool table was a door to a fire escape that people went out to take smoke breaks on. Thank you for not minding the fact that we all rushed out their to take pictures and such for fun. :P Staff and bartenders were all super friendly, and CUTE! I wanted that staff member's skirt!I just realized we didn't get a chance at the dart board! Next time though.Love discovering places I have a great time at, and would definitely return!",2,,
32,KiChan S.,"Woodside, NY",76,2,0,5.0,6/2/2017,This place is located in ktown where is known for late night karaoke and 24 hrs restaurants.This hidden pool bar is spotted 12th FL but you can easily excess via elevator from 1st floor so you don't have to worry about. The place is big and has lots of cocktails menu which is pretty cool for chill out or date. They also offer chess and darts. Pool tables are super clean and you can order drinks and foods from a table if you press a button on a table. Foods take some time but they also offer free popcorn too. I'd recommend this place if ur expecting fun night.,,,
33,Heejin H.,"New York, NY",0,2,1,5.0,6/2/2017,"I've been going to this place more than 10 times and i continue to be impressed with the quality of drinks, good vibes, friendly service and so on. This is definitely a hidden gem in k-town! Will be going back soon :D",,,
34,Eric T.,"Manhattan, NY",0,3,0,4.0,3/21/2017,"Cool/wacky K-town location, on an upper floor of some random building, way-decked out with a nice bar when you come in.  The pool tables are fine, the drinks are fine, but the food is NOT fine.  My buddy & I ordered two appetizers, & ~15"" later were told it would be ~an hour & a half.  ""Huh?"" They don't have their own kitchen, they use some other restaurant's kitchen next door, they were really backed up, yatta, yatta, yatta...  At that point, we were enjoying the pool, so we said ""Let it roll"".  While the apps came sooner than that (only about an hour!) the food was cold & no better than what you might expect from your local grocery's frozen foods section.  Still giving the place 4 stars, b/c who the hell goes to a pool hall expecting fine cuisine?",,2,
35,Tashana B.,"Brooklyn, NY",499,143,120,4.0,1/30/2016,"I love this place!This place is very easy to miss walking by. If Google Maps wasn't my homie, I would have blown by it. It is located in a tight, narrow building in Korea town labeled 34-36 in bold letters thank God. I came here last night with a group of friends intending to play pool, which is what this place is known for. We did not end up playing pool but we had a surprisingly great time anyway. Space Billiards is located on the 12th floor. Upon walking in, the mix of techno and hip hop music and flashing strobe lights hits you. I love the vibe of this place.There is a bar area, a tiny lounge section, and the pool table area. They have a good amount of pool tables so you don't have to wait long for one. We asked for pricing and they told us Fridays are $23 for a table for two people for one hour. An $29 for one hour for a table for 4. We sat and stayed in the tiny lounge section. We ordered the steamed vegetable dumplings (10 pcs) for $10. They were so delicious, we ended up ordering 3! They also come with 4 dipping sauces: soy, hot sauce, barbecue, and ketchup. They also gave us a complimentary bag of popcorn for the table. I also got the chicken tenders at $10 but I enjoyed the dumplings more. One of the orders of the dumplings came out half super cold. We had already eaten the majority of it but the latter 5 pieces were pretty cold. We told the staff and they apologized and gave us a fresh new full batch. They then gave us 3 SAKE shots on the house! Really cool. And good customer service! 5 cool points for that. For drinks, my sister got the Mai Tai for $11. It was beyond delicious! It made me regret ordering the $9 Cosmopolitan, which was not bad at all, but not as good as the Mai Tai. Keep in mind, we ordered these drinks before 8pm (happy hour). So I am not sure how much the drinks would cost after 8pm if there is a price change; it may only be by about $2 or $3 more.  I am so happy I found this hidden gem. I hadn't heard of it beforehand and am very pleased with the service and atmosphere. I can not wait to come back here and experience pool playing and mor of their amazing drinks and food!",14,8,10
36,José L.,"San Pablo, CA",32,1,2,5.0,6/4/2017,Came here with a couple of buddies to watch the Warriors game. Had a great time playing pool.,,,
37,Joshua K.,"Schaumburg, IL",0,2,0,5.0,5/31/2017,"I spotted this cool looking place and popped in for a quick drink. Awesome place to hang out with friends for an evening drink and play pool. The food was excellent along with a great atmosphere. The staff was very friendly and knowledgeable, and service was very efficient. I wanted to ensure that my cocktails were good. The clientele is more hipster than flapper and the music more 2017's than 2010's but the ice comes in chunks and the creative Soju flavor cocktails they serve are tops around K-town. Social and energetic, great place to hang our, Highly recommended.!! :)",,,
38,Anna Y.,"Sunnyside, NY",0,42,1,3.0,9/6/2017,"The place is very expensive, but the pool tables are very good. It has a young hip club feel to it. I wouldn't suggest this place if you're over 30. Also, if you order food be prepared to wait forever.",,1,
39,David T.,"Harrisburg, PA",148,6,2,1.0,11/4/2017,Worst martini ever.  Did not put alcohol in my drink.  A high school student has made a better drink.  That said the decor is on point.,,,
40,Zenda D.,"Canarsie, Brooklyn, NY",201,131,173,5.0,1/5/2017,"I love this spot the music is always on point, good vibes , cool environment, the crowd is chill...drinks are always good and the bathroom entrance is cool. My favorite part is definitely the ride up to the 12th floor in the elevator. It could be the big kid in me, but I always get excited hearing the turn up on all the different floors while going up. All in all the ambiance is loungey with a dash of too cool. Love this spot !",1,,
