,er_name,er_location,er_freinds,er_reviews,er_photos,er_rating,er_date,er_text,er_useful,er_funny,er_cool
41,Rb P.,"Bergenfield, NJ",53,10,25,4.0,1/16/2017,"A nice place with good and affordable appetizers and drinks. We tried to be there for the happy hour which is until 8pm and we were able to rent a billiard table for the 1st hour discounted for the happy hour. Good place to hang out with friends while playing at the same time eat and drink. The place is so good for pictures, kinda like on the space with its lights. We went there wednesday and the crowd is just right but the music is not just our genre, well it's midweek. I guess music is more trendy on weekends. So far so good.",1,,
42,Keming Y.,"Arlington, NY",58,3,0,1.0,3/12/2018,Bad service not worth the price if you are going here prepared for some offense from the bartender,,,
43,Bryan G.,"Westchester County, NY",68,101,1053,4.0,2/23/2015,"Its been a decade since the last time I played billiards and I wasnt disappointed trying out this place with my coworkers.I chose this place because our Friday happy hour bar is just a block away. And since its been awhile since I last played a pool, my game was a bit off. Space billiards is located on the 12th floor and the ambiance is kinda okay with all the laser lights. We didnt get a chance to try out the drinks they offer and the place wasn't crowded when we arrived (Fri. 4pm). We stayed for only an hour and it cost me $27 for 4 person playing on 1 table.I'm going to try other billiards place in the future and definitely would love to be back in here.",,,
44,Joanna T.,"Queens, NY",12,81,1921,5.0,11/16/2015,"I came here on a sunday night with 8 of my friends. It wasn't my first time here. We only stayed about 45 minutes but the bill came up to $30. I didn't really consider that to be a lot at all since we all played. I think they have a $21 for 2 people per hour pricing. I love the atmosphere. The neon lights and music makes the perfect environment. The tables are smaller though. Not sure if that is the only size they have. The drinks are strong apparently. The other times I came, the service was also quick and I could always find a table. The place is also right next to the herald square subway, good for commuters.",,,
45,Robert M.,"Brooklyn, NY",132,14,25,5.0,7/14/2016,"This is a fun place with nicely kept pool tables. I've never been on a weekend, so I can't comment on how packed or loud it gets. But on a Tuesday evening, it's usually not that crowded. I've always gotten a table, and it's a nice, relaxing spot to get some pool practice in.",2,1,1
46,Simon C.,"Brooklyn, NY",0,2,1,3.0,5/22/2016,"I went around midnight tonight and shot some pool for a couple of hours. Positives:Quite a few tables.Nice atmosphere. Mix of Hip Hop/Pop/Rap music. Not terrible.You can get an amazing view of the Empire State Building if you pop your head out the side windows. Wouldn't advise looking down though, if you're scared of heights (like I am lol).The attendants are very nice. Not too pushy, but they handle their business.Negatives:Prices seem a bit high I.e. $23 for 2 people for 1 hour on Saturday nights.Cues and felt on the tables were of questionable quality. They get the job done for a casual game though.Way too hot. This one is questionable, as I really get into the game and work up a sweat, so it may have just been that. I leave that up to you to decide.Cramped quarters. Tables are close to walls/seats as well as nearby tables. You will have to dodge around due to other players, and that can eat up a fair amount of playtime. It doesn't help that they assign you a table themselves when you buy a slot. Although I figure I could have just asked them for a distant one instead, so that last one may be on me.Overall:It's a nice, fun little place if you're already in the area and want to shoot around a bit. I'd say there are better options if you're looking for serious play.",3,,1
47,Erina E.,"East Harlem, Manhattan, NY",37,14,22,5.0,11/22/2016,"I don't really play billiards usually but this place has the feeling of club/lounge and I like it. They have happy hour till 8pm and it's $17 an hour during happy hour for 2ppl. It's pretty cheap, even places in Queens are more expensive than here. They have good happy hour drink deals too (I love happy hour cheap drinks, who doesn't??)I like the interior and music!! Oh my god they let you pick the songs you want to hear and play them.I would totally come back here :)",,,
48,Jimmy K.,"New Albany, OH",61,1,0,5.0,7/1/2017,Our server Jessica was very helpful and Josh the bartender was THE MAN!!! I will most definitely come back the next time I'm on 32nd!!,,,
49,Julie L.,"Upper West Side, Manhattan, NY",0,2,0,5.0,5/30/2017,This is a really fun place. Ashley and Tyler were awesome bartenders and I'd love to come again!,,,
50,PrincehAkeem A.,"Staten Island, NY",37,7,1,5.0,5/29/2017,"Great Spot to hangout and play billiards with friends. I went here on a Saturday night for a friends birthday as pregame spot, wasn't to crowded nor to empty. They have a great drink selection, and prices were reasonable. I would highly suggest trying the Midori !",,,
51,Rodolfo S.,"Manhattan, NY",151,2,0,5.0,6/19/2017,"Came here with my gf and Josh was extremely attentive. Definitely ask for him when you come, and don't play darts against your gf unless you want to lose hahah",,,
52,Kevin J.,"College Park, MD",0,1,0,5.0,5/30/2017,Ashley and Tyler were great. They helped me out all night and were receptive to advice. Would definitely come again :),,,
53,Ulysses R.,"Bronx, NY",1,1,0,5.0,6/16/2017,"Awesome spot! Really chill place to drink and just hang, if you can ask for Jessica, do so! Awesome chick",,,
54,Jaisy R.,"Manhattan, New York, NY",0,1,0,5.0,6/10/2017,This place is space-tastic. It's like the 90s version of the future with a modern taste in music and out of this world drinks (they're from this world),,,
55,Leah S.,"New York, NY",219,1,0,5.0,6/5/2017,"I love this place. Great music and the best staff. Erica is awesome, I love her. RECOMMEND.",,,
56,Vanni P.,"New York, NY",132,574,2,4.0,7/5/2016,"Great pool hall in K-Town, a hidden gem. If instead of beer your poison is soju, definitely recommended. Lots of space and table and cues all pass the (low) bar of amateur players like ourselves.",,,
57,Ismael L.,"Hialeah, FL",1,11,26,5.0,1/24/2017,"On my fifth trip to NYC the highlight of it was Space Billard. I am a traveler that is always on the hunt for local spots and man did I find a gem here. To start the building does not have an obnoxious sign to inform you that they are located here (like that of a luxury hoTel chain some love some hate). You walking into the lobby of the building and a gentleman asks you where you are going. You take an elevator to the 12th floor where the doors opens up to a dimly lit place whose brightest light source are those lamps above each pool table. Here you won't find tourist like you would in the time square area. This is more of a local spot. The ambience is super chilled and the music selection, for my opinion, was superb. I really can't wait to go back to NYC so that I can revisit this place. I was left with a profound infatuation for this place which I hope can flourish to something more.",1,1,1
58,Chris N.,"South Plainfield, NJ",117,54,15,5.0,3/27/2017,We got a table pretty quickly at 11pm on a Saturday. Love that there is table service for each table. Drinks came fast when ordered. There is enough room to move around. You're not waiting for someone to shoot because the tables are so close. Pricing not bad for NYC.,,,
59,Ron L.,"New York, NY",1080,409,2175,4.0,8/4/2014,"Came here primarily to drink but others come here for billiards. Who knew? Let's do both! I honestly can't remember the last time I shot pool though.As expected, a bouncer cards people upon entering at the elevator. To play pool, walk over to the bar to the left and ask for a table. Here's where you order drinks and they'll bring those along to you over at your table. We didn't have to wait long for a table even on a busy night fortunately, so that's a plus.Ordered enough for three carafes/bottles of flavored soju for 3-5 people and billiards became tons more fun (the same can be said of bowling too).  The servers do stop by from time to time to gather empty bottles and that's when you can order more or the alternative being to order again at the bar.  You pay upon closing the pool/bar tab.Mind you, they do charge extra the more folks you bring along but it's still a good place to bleed off time until you venture off to the next venue. Who ventures to ktown to do just one thing anyway, right? Go big or go home!All in all, it's one of several great places I'd like to hang out in a fun, smoke-free environment.",3,,1
60,J. R.,"New York, NY",73,39,0,4.0,11/26/2016,"The staff is very friendly, the food was fair. So far only things I didn't like was there was a cooking odor or some kind of odor in the air as soon as I walked in, plus it wasn't as classy as I thought it would be. Though I stretched it as far as I could and gave them 4 stars.",1,,
61,Kino A.,"Indianapolis, IN",79,185,251,3.0,1/23/2016,"A cool concept.  It was hard to find since you actually had to go inside a building and take an elevator to the 12th floor.  On the way up, the 9th floor opened up which was poppin as well with karaoke night.  The door closed for us to go to the top floor.  Once you enter, they check your ID and on the left is a very loungy bar.  Neon lights with bartenders making decent drinks.  We came here to play billiards which took up the other 75% of the venue.  For a pool/bar, the tables were really clean kept.  The balls were smooth and not dented and the table had good friction with no dips and dents - I was surprised.  It's a nice hangout spot to play pool and drink with music from the bar that wasn't too loud to affect your game.We ordered the chicken nuggets and it wasn't good.  It did satisfy the drinking crave but I wouldn't suggest buying those since it's typical bar food.  The servers were attentive and we played for an 1 hr while drinking beer and liquor.  I was just surprised that they kick you out of the table after an hour.  Apparently it's not a rolling time here, after one hour they stop you from playing which I didn't get.  We were going to stay there another hour but needless to say since they kicked us out we decided to leave.On a further note, it's a non-smoking bar but they have a balcony at the back for the smokers.",,,
62,Melissa R.,"Paterson, NJ",2,12,5,5.0,2/19/2016,"This is my favorite billiards spot! I think I'm becoming a regular here, driving in every other week from jersey because the attention is great, the music is always good, and the drinks are perfect. It's a semi small spot on what I believe is the 12th floor... Elevator opens up to a cute lounge area and about 12 pool tables. They apparently serve food but I haven't been there early enough. They close pretty late (I usually leave around 5 am on weekdays, oy vey). Zero complaints.",,,
63,Madan B.,"New York, NY",0,13,0,4.0,4/2/2016,"Great place for happy-hour drinks and billiards.  The staff is simply awesome.  Very accommodating and friendly.Some of the tables felt is a little abused but overall, majority of tables are in good shape.  If you don't bring your own cue, finding a straight cue can be a little challenging.  Saturday nights can take upwards of 20mins to get on a table but the bar can make the time fly by.  Grab a drink, attempt to play chess, play some Foosball and the wait will be over before you know it. The free popcorn is pretty sweet too.  Oh, they also have Spotify which you can go add songs for the never ending playlist.  This to me is a HUGE plus.",,,
64,Imani N.,"Bronx, NY",128,2,1,5.0,2/7/2017,Great bar good bar fun beer pong we had a lot of fun we also had nachos my sister loved it and are the hole thing something she doesn't do,,,
65,David K.,"Columbus, OH",0,1,0,5.0,7/1/2017,Josh and ocean were amazing. This is my go to spot when I'm in ktown. Love this place.,,,
66,Tommaso S.,"Upper West Side, Manhattan, NY",18,105,121,3.0,11/17/2015,"One of the adjectives Google uses to describe this place is ""upscale"". Hmm not exactly the first word that springs to mind...nothing says ""upscale"" like beaded door curtains to the toilets. The pros: it pretty much does what it says on the tin - it's a chilled place, spacious, with a decent number of pool tables and a bar. It's pretty quiet if you go mid afternoon and gets livelier and more fun as the evening progresses. Reasonable hourly rates for the tables.The cons: If you want to come here for a serious game of pool this is probably not the place for you - the queues are all a bit knackered (mostly straight but wonky tips); the felt on the tables i've played on is worn almost to the point of transparency, meaning you can pretty much forget about positioning/controlling the queue ball.",,,
67,Mercedes L.,"Bronx, NY",64,28,65,5.0,9/2/2016,"As a first timer, I was very happy with the atmosphere of this place. It had like a galaxy theme with the latest songs playing. There were many pool tables so I didn't have to wait. One thing I did noticed is they did ask for a card with a chip which they do keep until you are ready to head out. The drinks were good and the free popcorn was a great way to balance out the alcohol tastes.",,,1
68,Ashley M.,"Palisades Park, NJ",161,3,3,5.0,6/2/2017,Great place for a casual hangout and fun atmosphere. Probably the most hip lounge/billiards in mid town. The staffs are really nice,,,
69,Suzy V.,"New York, NY",5,24,0,1.0,4/30/2016,Horrible place. Beware of the female hostess. She physically attacks guests. Even the bouncer had to hold her off. That bitch has issues. Not to mention an entirely plastic face. That's true self hate.,1,3,
70,James K.,"Palisades Park, NJ",0,2,0,5.0,6/6/2017,"This is the best spot to shoot pool.  Be sure to ask for Yelina or Tyler.  Best service , attentive, and friendly.   Always the best part of the day when I visit.",,,
71,John S.,"Los Angeles, CA",1,17,0,1.0,5/13/2017,"At first this a very cool Billard hall. On the busy 34W 32nd street in Korea town, it's almost like a speakeasy in the sense that it's not easy to find because there are no visible signs. But when I finally made it to the 12th floor I felt like I was walking into a club  rather than a pool hall. It felt like a club because of the Loud hip hop music and it being very dimly lit. It is a great place to go on a date to impress someone you like a lot. First off, the tables are $23 an hour, and if you exceed the hour by a minute you get charged for an extra half hour. Once I got to my table I could tell it was best up a little, a few scratches and holes in the felt. Their selection of beer is limited and like the price for the pool table, pretty high. The cocktail Waitress had no personality whatsoever and was a bitch to us when we inquired what beer they had and asked her to repeat what she had said over the loud music, and the fact that English probably wasn't her first language and she had an accent so that made it difficult as well. After leaving I felt cheap and ripped off, it felt like I went into a strip club and asked for the champagne room and didn't get what paid for and originally expected. The icing on the cake was that they bill your pool play and drinks together, a way to boost up the gratuity. Another way they boost up the gratuity is by adding 15% to the bill and not point it out to you. Nice to see a place like this, but I rather play pool at Eastside billiards. More friendlier staff, happy hour prices, and better pool tables.",,,
72,Angela S.,"Las Vegas, NV",22,10,12,5.0,1/17/2015,"The reviews (4 or better) are on point! A group of us were in the city from NC, and we were looking for a place to hang out and shoot around for a while. This place is definitely worth checking out, if you enjoy a friendly game of pool with your homies. It's easy enough to find and get to. It's a regular neighborhood pool hall. That means the tables are decent, and if you want a perfectly straight stick...bring your own. Remember...this isn't an ESPN venue, so don't expect ""top 'o the line equipment"". But between the great music, late hours (open til 5 a.m.), nice crowd, helpful security staff (Hey Jay!), the hostesses/wait staff, and the Soju flowing like water, this place is a find, especially for an out-of-towner.Oh! And as for the people who were complaining or confused about the pricing, it works like this. $21/hour gets you a table for two people. If you have more people in your party, add $3/head, whether they play or not. You'll be charged a minimum of 1 hour. So I suggest you plan to shoot around for at least that, since you'll be paying for the time anyway. After the first hour, based on your party's size, the $21/hour + $3/additional person/hour is prorated by the minute. Party of 4 = $27 for the 1st hour and $0.45 each minute after. Simple. Thought I'd do the math for you, because once you get a couple of Soju shots under your belt...won't NOBODY have time for damn math. Hwanho! (Korean for Cheers!)",7,6,3
73,Janice F.,"Manhattan, NY",573,503,401,4.0,12/31/2014,"So post dinner, we were looking for a good place to hang out.  Yelp told us Space Billiards so we trusted the app and went in to the 12th floor of a high building in Koreatown.  And honestly, we could not have made a better decision because Space Billiards is a great place.  The staff greeted us kindly and directed us to a table immediately.  The price is also not bad ($45 for ~2 hours on an off-happy hour time for 5 people in one table, but they do have happy hour so highly recommend that).  Everything is clean and well-stocked.  There are seats and tables to just hang out which is nice.The only thing that I would say is that it does get crowded as in your cue may tap someone else from another table, but that's only because the place is a tad bit small because it's in Manhattan.",6,,2
74,Jason Z.,"Brooklyn, NY",0,3,0,1.0,11/26/2014,"Stay FAR away from this place. The tables are disgusting and not cleaned correctly and the sticks are warped out of shape. MOST EXPENSIVE billiards place I've ever been to in the Tri-State NYC. These people will take every penny they can get from you.If you have a friend at the table (even if they're not playing) they WILL charge you for having that extra person. If you're there alone and want to shoot with someone else... BAD MOVE. They will make up a price and you'll have to pay for it.I'm not going to argue with them because that's basic customer service. If that's how they conduct their business then that's on them. I'll just go on here to warn people and hope people take my word for it.If you want to shoot some pool with friends and actually have a decent time, I recommend Amsterdam.",4,1,1
75,Mario M.,"New York, NY",595,4,0,5.0,3/24/2016,One of my regular places to grab drinks in ktown. Very fun staff.  I like their new renovation !,1,,
76,Daniel G.,"Manhattan, NY",383,43,12,2.0,4/9/2016,"It was 3:40pm Saturday 4/9/16. Only 1 employee working (visible). Sees my father and I come in. 2 tables being used (1 by a group). Takes 3-4 mins to come over. Takes another 3 mins to assign us a table. He says ""table 3"". I politely request table 6. He says ""table 3"". I say ""ok"". Cues are in horrible shape (warped, scuffed, flat tips, tapered tips, etc.). Tables 6/10 dirty. Table spacing poor. How is this place rating so high? #2 rated billiards in NYC on Yelp! Amsterdam in last place! Come on guys! Can the we please start speaking up! Review guys! A billiard should be rated as a billiard. NOT a lounge/bar. May still even get food because father and I are hungry. Will update later.",,1,
77,Stephanie Q.,"Boston, MA",496,1574,1473,3.0,9/8/2012,"I learned to play pool during happy hour drinks in Hong Kong. A bartender actually taught me how to play pool- thank you!There are lots of pool tables here, its $19 per hour for 4 people, if you have more people, you need to pay a little more. They have reasonably priced drinks too.",1,4,1
78,David B.,"Astoria, NY",142,38,114,4.0,11/16/2015,"Nice spot to come to if you want to unwind and enjoy a few drinks with friends. The spot is a little hard to find considering the sign is easy to find but not the door. The place is lit with neon lights and there around 8 pool tables.  The lighting at the location is minimal and is somewhat cozy. The store is one that is clean and well managed in terms of the music. This is a nice spot to go to after a long day considering it is not too active, at least when i went . The bar has a wide range of options when asking for a drink and have chess as well if you choose to sit there. The bartenders are nice and well mannered also.",1,,2
79,Deniece L.,"Miami Beach, FL",100,248,2185,4.0,2/6/2013,"Thanks to Yelp, I found this gem in Koreatown.It's a little hard to find.  The entrance is actually 2 or 3 doors down from the listed address.  Cheap pool tables per hour.  Tons of pool tables.  As far as drinks, you have your choice of beer and mixed drinks using a Korean vodka-like drink.  Be careful...they'll sneak up on you.",,1,
80,Luis C.,"New York, NY",34,6,0,1.0,10/21/2016,"I went to this pool hall because I saw that the reviews were mostly positive and I was having a good time until I decided to pay my bill and leave the bar. It was pouring rain so I decided to go back to the bar and use the bathroom, the bouncer acted like an incompetent. He asked me if I had lost something because I was back at the bar and I told him no, that I had returned to use the bathroom and to wait for my taxi but he didn't want me to be in the bar. He told me that his supervisor didn't care the amount of money I had wasted in the bar before that I shouldn't be in the premises. I ended up having to leave and wait for my taxi downstairs. I will not be going to this pool hall again and I don't recommend other people to go there. They do not know how to deal with costumers and it is obvious that if you are not spending money you can't be there. Felt completely disrespect because the bouncer had the audacity to tell me that he was having a good night and that I was ruining it for him. Not cool! Completely unprofessional and rude.",2,,
81,Grace O.,"Chandler, AZ",524,172,172,4.0,8/9/2012,"A gem that I found through Yelp! We were at dinner at Shanghai-Mong, and wanted to do something quick afterwards. I searched what was nearby, and look at what showed up next door! We went about 9pm on a Thursday night, and it was not crowded. It was a large pool hall with about 12 tables, and only about 4 were occupied. It was $19/hr, with drinks around $6-$7 each. The ambiance was very fun! Lots of lights and lasers, and lots of electronic music (which my husband isn't too fond of, but it was fine for what we were doing...as long as he doesn't have to dance to it haha). The bartender was very friendly. We had a great time for the hour that we were there. It was a perfect spot to kick it for an hour before heading home.",2,,1
82,Rachel T.,"New York, NY",20,8,2,1.0,9/23/2016,"2nd time coming here, all going well until the end of the night. Went up to finalize our check. Finishing up our beers (half left) paid by card and was tipping in cash. The server rudely stood over me as I signed, then rudely asked for his tip - As I was reaching into my pocket for cash. Not sure what tip he was after as we went up to the bar ourselves, and he didn't do anything, in fact the bartender did the work. As the check was being signed he took our beers and threw them in the trash, half full, and we had paid for them. Safe to say, the end of the night annoyed me.",2,,
83,Misha T.,"San Francisco, CA",642,4075,105,4.0,12/25/2014,"Man was born on earth, but he was not meant to play billiards there. - Coop (probably)",,,
84,Steve L.,"Flushing, NY",0,3,11,5.0,4/26/2016,"The staffs are great, pool tables are neat and well taken care of. The best part is that we can SING!!!Like an open karaoke!!! PLUS an electrifying bar with lights and the seats in the back feels like we are in the SPACE! hence the name SPACE BILLIARD! It was definitely a fun time!!!",,,
85,Matthew K.,"New York, NY",629,129,1,4.0,12/7/2013,"Much to like about this billiard cafe (which mostly operates as a small billiard hall, with a small bar of a half dozen seats or so.)  This is one of the most generously populated spaces around when it comes to screens.  There must be a dozen or so TV's in what's probably a 30 by 60 space.  No shortage of viewing time here!There are a few food options--mostly hand food, ramen, and the sort.  Drinks are decently priced and if you come here regularly enough, you'll get a freshly made bag of popcorn with just about everything you order.  I'd recommend a soju mixture of some sort in a bottle, or the space shots (7 for an agreeable $22).  Prices are $19 for a pair each hour, $10 if you run solo.  $22 for three people on a table and $25 for four.  The tables and sticks are not outstanding but in decent enough condition.  Much more of a lounge-y feel than an old-school classy billiards hall feel given the clubby/top 40-heavy play list.  Feel free to bring your newbie pool friends here--there are always a few people turning heads for the wrong reasons.The staff is friendly and wiling to talk things through.  The process of getting a table is also very quick here--standing around for minutes watching the staff chat up with regulars may happen at other billiard halls but not here.   I usually see a rack of balls hit the table ready for me before I've even walked up to the bar.Don't forget to get a punch card!  10 hours = 1 free hour.",6,2,1
