,er_name,er_location,er_freinds,er_reviews,er_photos,er_rating,er_date,er_text,er_useful,er_funny,er_cool
128,Sean S.,"Manhattan, NY",758,1660,36,4.0,4/5/2009,"Are you in k-town and wondering what to do?  Bored of the usual lounges and too much drinking?  Head over to this building, and up to the 12th floor and you'll get your pool game on!There are plenty of tables here, I counted at least 12, but perhaps more.  They are all really brand new tables too.  If you're hungry for a late nite snack you can get instant ramen noodles, or other crackers and goodies.  You could also go downstairs to woorijip which is right nearby.I didn't find the place particularly cheap, but they are 24 hours, so they'll handle your late nite insomnia as well.  Full bar, and friendly staff.  Great place overall.",1,,1
129,Jonathan L.,"Manhattan, NY",23,65,0,4.0,4/17/2011,"Pretty good pool hall.. hours are convenient, the place is clean,the space is ample, and the cues and tables seem fairly new.I wouldn't say it's a hot spot, but when you're jonesing for a game of cut throat, it'll do quite nicely.  Also fairly cheap, relatively speaking.",1,,
130,Jesse R.,"Denver, CO",102,265,40,5.0,3/30/2011,"Space Billiards is a really great pool hall in midtown! Since I come from Jersey often, it's especially convenient as it's only about two blocks from Penn Station. The tables are well taken care of (vacuumed often, new felt, etc.), and in general the space itself is kept very clean and maintained. There are drinks at the bar, and also a menu in which to order outside food delivery (they'll come right up to deliver too which is great!).  Additionally, for all of you smokers out there, there's a back door that opens to a fire escape so you can take a cig break without riding the elevator twelve floors. Other amenities include large flat screen TVs, music requests, and comfortable banquet seats. Definitely try the complimentary sweet tea (ask for it), and enjoy a very affordable session of pool at Space Billiards.",1,,
131,Anna M.,"Brooklyn, NY",0,6,0,5.0,8/3/2015,"I always love coming here after grabbing dinner with friends. They're not too busy and the music and lights are a nice touch. The staff is very friendly and the pricing is pretty decent for Manhattan. It's something nice to do, especially if you have a large group of friends who want to hang out at night. We took up two tables and the pricing was very straightforward.",,,
132,Hank C.,"Jersey City, NJ",1700,2743,655,4.0,1/19/2009,"A fun billiards room in a building that isn't necessarily labeled well for those who aren't looking carefully (a blue sign turned out to be blue text on a white sign). Fun place for people to just chill, though, and rarely packed to the brim.Cheap, and can accomodate a decently large group, but there's no food here, and minimal things in the way of drinks, and a few random snack selections.",1,,
133,Garrett G.,"New York, NY",9,5,0,5.0,12/26/2013,Such a cute place. Highly recommended if you love the Korean spirit!! Very friendly bartenders. Cheap drinks and you get a bang for your buck. Recommend the soju cocktails!!!!,,,
134,Nicole E.,"New York, NY",114,205,47,5.0,8/4/2010,"Man, this is my favorite place in the world. I adore it. ADORE IT. I mean, where else can you get tasty Korean food delivered to you, beers on hand, music to dance to in the background and free tea?? And it's 24/7?? Space Billiards, will you marry me?",2,2,1
135,Rei L.,"Jersey City, NJ",16,10,22,4.0,4/29/2013,Nice and clean. No smelly. Serve beer and cocktail as well.,,,
136,Carlin Y.,"New York, NY",289,293,408,4.0,12/16/2012,"Not a bad spot if you come with people. $17 for an hour of pool for a table, up to four people to a table. Cues are ok -- some of the tips are kinda wrecked, but they all seem pretty straight -- open real late which is a bonus! They don't serve water unless you pay for it, which is kinda lame, but all in all not a bad place to shoot some pool right in Koreatown! Definitely coming back here on a late night.",,,
137,Marc I.,"Montville, NJ",67,287,60,4.0,1/7/2011,"Hidden up on the top floor, you would never find it unless you have the address and know where you are going. Take the elevator all the way up. The place does not have AC. I went in the summer and the heat wave was in full force. I met a internet date here and it was a great ice breaker, no pun intended. The tables are a bit pricey but well worth it. they only sell cheap beer, not much other things. they sell some snacks but that's it. I wanted to impress my date, she is almost a professional pool player and she was not impressed with the place but thank god I hit some shots and after the rounds of 9 ball, we had some dinner. So I think i made a good impression. Tables were clean. The place was not crowded but we did go on a tuesday night in the summer.Definitely go and have some fun. Just don't go on the hottest day of the year in Koreatown. (Stinky fish smells)",,,
138,Nairee D.,"New York, NY",0,3,0,5.0,4/9/2015,"I came here on a date about a week ago, and we were both impressed. It is on the 12th floor of a NYC building, but wasn't hard to find.For those who like the club scene/lights and dance music, this is definitely the place for you!There is a fair amount of pool tables and comfortable couches and chairs. The place is CLEAN and the equipment is in great condition. As soon as we walked in, it was obvious we were going to have a wonderful time. The music was ON POINT, the drinks were even more ON POINT, and there was a great ambiance. The employee was very nice. No complaints there.We were one of the only people there on a Tuesday afternoon, when they opened, but that was fine!! We couldn't help dancing as we were playing pool.Their rates are fair! The first hour is $17, and afterwards, it's $3 every 10 minutes. The third hour is free, but we didn't stay that long.We ordered drinks during the game, and might I say that the drinks justify the price. Rarely do you see an establishment in NYC charging $11 for a drink that isn't watered down. The guy who made our drinks brought us popcorn to accompany our drinks, because they were that strong. Wonderful.This place is conveniently located near Penn Station and Herald Square.Will I recommend this place to a friend? I already have.Will I come back again? Most definitely will!",,,
139,Stray K.,"Brooklyn, NY",0,11,0,4.0,2/25/2016,"This place was cute. Went here for my friend's birthday. The veggie dumplings were so good it comes out on this really long plate, makes you look like you're eating a lot but I wanted more even when I was done lol. The music they played was really good. My friend asked the bouncer to play 5 songs and he literally played those 5 songs. A bouncer who controls the music? Weird but I'll take it lol. The only thing that I didn't like was that it was a Karaoke bar/billiard fusion. I guess I was too drunk to know that before we arrived. There was a private karaoke party going on and this guy was literally singing Ordinary People by John Legend like he was trying out for The Voice. He sounded great but when you are trying to turn up Ordinary People is not a song of choice hahah. Also I wanted to look at the song selection and the bartender came up quick as shit like ""excuse me, this is private party"" I was like okay I can't even get a peak? It wasn't that serious I wasn't going to sing anyways. Overall I had a lot of fun. I love playing pool and while you play pool you can order drinks and food and they bring it to your area. Probably wouldn't go here again because Koreatown is far as hell for a little Brooklyn girl, but that was the middle area for me and my CT friend lol.",,,
140,Linda P.,"Iowa City, IA",78,24,20,5.0,4/1/2012,"Wow. I haven't been there for a long time, and now it looks great with renovation. Fun place. We played three games for about 1.5 hours and it costed $23. So cheap. Music was general pop songs, not much of our type but was ok. Had beer, all are $6 per bottle. They also serve Korean soju and soju cocktails.",1,,
141,Derman O.,"New York, NY",176,108,228,2.0,10/11/2012,Not bad. In korea town so definitely expect koreans to be there and doing their thing. Drink selection is limited. Im sure there is better,,,
142,Jeff G.,"Brooklyn, NY",15,55,6,4.0,9/1/2009,"This place is what I've been looking for in a pool hall. Pros: Spacious, open 24hrs, not known to be crowded, affordable beverages (especially at the NYC rate), very well maintained and efficient tables as well as pool sticks, very comfortable seating, good music (but everybody's taste differs, so..), nice lighting, great overhead televisions, decent prices, and most importantly to me - the atmosphere is not overwhelming nor intimidating at all. Finally, a black guy such as myself can get a brew and shoot pool in the city without everybody staring (far from racist, but that's how it can be in the city).Cons: No varieties of beverages/foods, the elevator you take to get there can be outright scary (shaky and slow as hell).Overall: 4 stars - This place is great for the billiard enthusiasts, welcoming enough for your group of friends, yet not intimidating for those who want to go solo and shoot around - all while enjoying a quick drink and a beautiful atmosphere.",3,1,1
143,Raquel F.,"Bronx, NY",0,1,0,1.0,11/14/2014,"PLEASE READ THIS !!!! The people there are selfish and theives. !!!It was a beatiful night me and my date go there for a night for the first time and those fuckers stole my purse with everything inside. I had to call 911 and the people there forced me and my date to pay after they have stole my bag. They are greedy and the service there are jips, DO NOT come here. Ladies if you do do not bring anything important with you. They threatened me and got violent and security there is noncholant about everything. When my date and I declared to play back the security cameras they acted oblivious as if they did not know how to look through the security cameras. DO NOT COME HERE !! One of the worst nights I have ever had ! !!!!!!!!!!",,,
144,Antonio M.,"Manhattan, NY",37,36,11,2.0,9/27/2011,"Went here with some friends when we were looking for something to do on a thursday night i believe. As a fan of billiards, i was dissapointed to say the least. they only serve beer and wine and the wine was cheap but still overpriced for what it was. the place was half empty (not half full) and so the ambience was lacking to say the least. its more a pool hall for people that dont know the game and just want to hit balls with sticks. i didnt see bridge cues and you cant masse or anything like that. the music is a weird mix and if you want them to play something itll cost you a dollar which would have been fine had i been able to hear my song but the sound system was so low and lacking quality that i heard a few words here and there when the hall got a bit quite at times. if it hadnt been for my friends who were there and frankly the only reason i enjoyed the place, it would have been the worse pool hall ive ever been to. it is not a place for people who really like pool, its more a hangout for people who want to give billiards a shot and have some good laughs with their friends...just make sure to bring your own music and your own ambience. i have to say they had some straight cues though. unfortunately they were fairly old and you couldnt read the weight on most of them",1,,
145,Dina L.,"New York, NY",104,19,5,4.0,2/2/2010,"I haven't been to a pool hall since moving to NYC from Arizona, so I can't compare prices. My friend and I played for about 2 hours on a cold, Saturday night. We got there (and there was no wait, yes!) and (the pool hall wasn't smelly or grimy, yes!). The majority of pool halls in AZ smelled like booze, smoke ( there's been a ban on smoking inside for a long time too) and who knows what.Back to the place - yes, k-pop was playing in the background. What else would you expect, it's k-town! They do have 3 LCD TVs playing different thing. Cheap-er beer specials ($4 beers) and some snacks. Total for two was 25. I was expecting more so I thought it was a good deal.",,,
146,Lucy H.,"Brooklyn, NY",369,851,16,3.0,4/8/2009,This place is A-OK. tables are new and it's something new you can do in k-town besides the standards.. ( drinking.. karaoke.. food) if you want to try something new.. go thereBut for somehow who doesn't live around the area.. I don't think it's worth a trip to go all the way there for pool.. Good thing is this place opens 24 hrs. If you still have energy after all night hangout.. be my guest!! My review for this place can be a little bit bias.. probably because I lost 9 out 10 gams to SOMEONE =(,2,1,1
147,Maria M.,"New York, NY",246,510,53,5.0,1/16/2008,"So there's no jukebox and there's Korean pop playing on repeat.  I am now officially a quarter Korean, so I can deal.There's no crowds, it is 24 hours, it's BYOB (at least until they get their liquor license), it's clean, and they serve free tea that hits the spot every time.  And it is in the same building as Seoul Garden.  Space on 12, Garden on two.  Yum.  You can also bring in food, so go to Koryodang or Woorjip and get treats....and go to Koryodang.....Also, outdated gossip magazines so you can absorb more mindless crap while others be strategizing their next shots.And our table is always ready, as if telling everyone else ""You can't play here."" (That's our table in the picture there!)Last, but so not least, it is CHEAP!  Fifteen dubloons an hour.  Beat that in Manhattan!I think I know where the next pool night will be (puts pinky to lips...)",7,5,6
148,roderick A.,"Jersey City, NY",188,768,308,5.0,1/28/2008,"Saturday night. 1am. I figured thats as good a time as any to goto sleep, right? Oh no. I get a phone call:A: so what are you doing?R: uhh, its 1am and I was about to goto sleep. Why, whats up?A: Well me and (Name omitted to protect the innocent) are still up and wanna do something. Wanna go shoot pool?10 seconds later, I'm out the door and jumping into my car. and we head here, to Space Billiard. What astounded me, besides the fact that the night was just starting at 1:30am, was that the place was empty. Completely empty on a Saturday night, and I was shocked.What shocked me even more was the place itself.  This was one of the most beautiful pool halls I have ever been in, just astounding. New pool and snooker tables, new pool cues, new chalk, new everything. TV Screens were also new as well. Did I mention that its $15 an hour? Doesn't matter how many people are playing, its $15 an hour. How awesome is that? And the host was also nice enough to give us free hot tea, which was delicious. They also serve instant ramen, if you're in the mood for that. And if you want to get your drunk on, its BYOB so you're good there. Oh yeah, they also have pictures of my girlfriend Jeanette Lee hanging too.I swear, with this place, Seoul Garden and Players II in the same building, its any wonder why people aren't just living here.",7,4,5
149,camilla c.,"New York, NY",171,336,1,4.0,1/15/2008,"Woah... flashback!  This place totally takes me back to my LA days when I used to frequent pool halls... ahhh... those days when I used to hustle for money and take advantage of unsuspecting hot-shot pool sharks.  Um... no, J/K.  I never hustled but I used to be decent at pool and though I still enjoy playing pool, I find it's something I rarely do (thus, my skill level has declined quite a bit).  This is probably b/c there is a total lack of decent pool halls to play at in this city.  Let's see... there's Amsterdam (cheesy clientele and a long wait), Slate (too expensive and too much of a scene), SOHO Billiards (um... i can't even think of one positive aspect of this place), and the random bars w/ pool tables in the back (not a fan of quarter-operated pint-sized tables).Well... all this has changed with the recent opening of Space Billiards!  Thanks to Julie and Joolie for the heads up on this spot.  I recently took a group here on a Fri night and we all were quite pleased... the place was clean, the tables were not scratched up, we had good sticks to shoot with, and excluding the price of beer we paid to bring in (still BYOB as of 1/11, but they told me this would change in a week), it ended up being a very economical night out.  There are a few oddities you should expect: as mentioned in a few Yelp reviews already, the wannabe croc slippers (Koreans like taking their shoes off indoors... so feel free to kick yours off, get comfortable, put on those bright yellow rubber shoes and get your game on!), the flat screen in the back paying homage to the Black Widow (Jeanette Lee, professional pool shark, revered amongst her fanbase), and the shelves lined with instant ramen bowls (trust me... if you're drunk and find yourself here, it's awesome that they have this in stock!).  And chances of ending up here after a few drinks may be high since this place is open 24 hours!  It's a good alternative to karaoke given that I have a few friends that are very much anti-karaoke (not sure what's wrong with them....).  The crowd was pretty random when I went... a table with an awkward lone pool player, a few tables with a group of Asian kids who looked no more than 18 yrs old, and the random tables like ours with a mixed crowd checking out the place.  There are your share of some serious players... you know, those that bring their own cue and wear those silly (but probably practical) gloves... very hard core.  Oh, out of the 15 or so tables here, only about 3 are pool tables; the rest are billiard tables.  In my opinion, the ratio is off... a few more pool tables would be nice.  Esp since I have a feeling this place is going to start to get crowded and the wait for a table will get pretty long very soon....",7,,4
150,Debra E.,"Brooklyn, NY",405,275,430,4.0,1/12/2011,"Take the elevator up and waaaaaalaaaaaaa a pool hall. They played the standard z-100 and KTU jams.. not my cup of tea. But they do give free refreshments. I'd go here to unwind, a fun date or a sunday funday.",2,2,2
151,Sean T.,"New York, NY",21,86,64,5.0,1/29/2008,"Recommended for:  Billiards, Snooker, hanging out with friends.Service 5, Ambiance 5, Fun 5!One night, my friends and I were sitting around, enjoying our desserts and not ready to call it a night.  Then the thought dawns on us to check out a possible ""night spot"" - yes, the credit goes to Joolie T.  Taking the ""scary"" elevator up to the 12th floor, shaking it a bit for giggles and moments of panic, suddenly we emerge into a vast Penthouse of Poolness!Yes folks, this isn't your grimy, smokey and gross pool-hall.  You're on the top floor of this building with vaulted ceilings, clean air, and hot sweet tea when you arrive!  They have a few billiard tables (pocket pool), and the rest are snooker.  They have salty and sweet snacks for you to munch on, and since they don't have a liquor license yet, its BYOB! Once your group settles they can ""choose"" to wear crocs, which I don't recall any of us doing, pick a cue and play some pool!  Bonus goes to them having an electric timer to make sure that you do not go over your time.  But at $15 an hour, who wouldn't mind playing over an hour, or two, or three!  K-pop plays in the background and there's a plasma to watch, but I'm sure the hilarity or seriousness of the game (depending on who you are playing with) will entertain you the most! And, whether its 6pm, 10pm, 2am, or 4am, they are open for business - yes folks, 24 hours!!!Fun, laid back and clean place (their bathrooms are super clean too!) that offers free hot tea, smiling service and never too crowded; this secret spot is bound to get a whole lot more attention.Sean Approved:  Absolutely Definitely Yes!",4,3,5
152,Rob L.,"Brooklyn, NY",158,173,18,4.0,12/20/2007,"Shhhhh...this place is a secret!Enter the discreet vestibule and proceed into the elevator to the 12th floor ""penthouse"" in natural K-town style.  The elevator doors open up to a clean expanse of billiard and snooker tables, cabinets of Crocs in various colors, and delicious hot tea served up and delivered to your table.The cues are straight and true. The tables are clean and fast. The felts are smooth and not abused. And the music is at a comfortable volume for conversation.There are only three pool tables in the joint, and maybe 15 or so snooker tables, so if snooker is your game, this is your joint.  Although its 24-hour with VERY reasonable rates for Manhattan, we were told its fairly busy during the day and ""happy-hour"" time during the week.The liquor license is expected by the end of January or so. In the mean time, its BYOB!!",3,2,3
153,Jihun K.,"Bronx, NY",0,1,0,5.0,6/27/2014,The place changed a bit from the last time for the better. Looks a lot nicer and the service was excellent.  I would definitely come back here.,,,
154,Hanna K.,"New York, NY",11,62,11,2.0,11/1/2013,went for halloween and the place was OK. not that great. it was spacious and there wasn't a lot of ppl but there was a man who was walking around just interfering with us when we were playing our game and the owner didn't even bother telling him to leave. It's $19/hr and extra $3 per person when you have maximum of 3 ppl per table. I mean I just wanted to play the game and not be bothered by a man who was constantly talking to us.  I thought that was a bit annoying. Idk if he's friends with the owner cuz no one did anything when he was talking to other ppl. it's a nit pricy for one hr but I would've liked it if we weren't bothered by someone who wasn't even there to play pool or drink.,,,
155,Katherine N.,"Washington, DC",14,33,1,4.0,4/4/2009,"I am a fan...of spacious, roomy loungin'  Love this place because there aren't any crowds, got a pool table for $17/hr  on Friday night and recaptured video game youth memories on their minimal selection of arcade games.  Great place to take friends.  Got hungry and took the elevator down to 2 for Seoul Garden.  Apparently there's Karaoke on 5 as well.  It is a largely Korean crowd, since your in the middle of K-town mind you.Just a great place to chill.  Take the elevator to 12 and relax.",1,,1
156,Katherine K.,"Woodmere, NY",1,11,0,5.0,5/15/2013,"I love this place! It's not packed all the time and it's fun. They play some really good music. Place is clean. Lots of couches, chairs, and tables so you can relax and play. I only come to this place to play pool. By the way, if you get enough stamps on the card they give you you get a free hour of pool free! ($19 per hour).",1,,
157,Zack H.,"New York, NY",6,63,0,5.0,4/18/2008,"----So here is my story part----This is a really interesting location for those of you who like to find ""hidden"" treasures in NY.  I was only introduced to the place after a friend of mine pointed it out to me when we were on our way back from getting food in K-Town.  Although it isn't strictly hidden as there is a small sign mostly in Korean with pictures that would indicate billiards exists on the 12th floor, it is not a place that I would have found on my own.  In fact, I might have walked by the small building entrance a hundred times before the sign appeared individually out of the crowd of chintzy restaurant advertisements.  Naturally, I had to give it a shot.  After finishing a short ride in a very dingy elevator, the doors to the elevator opened and I was blown away.The place is damned near spotless. There are dozens of tables, a snack bar, lounge-like seating, and it is crowded, but not full.  To be entirely honest, I felt a little out of place going there the first time because I am not Korean.  In fact, I'm the only white guy in the whole place (Actually, this is usually not the case, on later trips I've noticed that the crowd tends to be more diverse earlier in the night).  The rest of the clientele spans the spectrum from teeny-boppers to slightly thuggish asian gangster types to older businessmen taking their game very seriously.    We step up to the bar and order a table.Listen up, this part is important.They only have a few tables for American style Billiards.  Most of the tables are for a game called four-ball.  You cannot use four-ball tables for American Billiards, because the tables have no pockets.  The first time I went I was a little shy and just stuck to Billiards, but on subsequent trips I have learned to play four ball (the people  running the place are very friendly and even showed me how to play) and found it to be very entertaining.  In fact, that is mostly what I play when I go these days.  After playing for a few hours, my friend and I got ready to leave and grabbed the check.  It blew my mind.  It was so cheap. I did a double-take and payed  while in awe of this place's awesomeness.---Summary---*Nice pool tables*Really clean*Lounge like seating in some places*Snack/drink bar (only alcohol is beer)*Only a few American Billiard tables*Staff is really friendly*There is a door you can open to smoke out of*IT IS OPEN 24 HOURS*IT IS REALLLLLY INEXPENSIVE",2,1,2
158,Stephen C.,"New York, NY",127,339,1,3.0,1/13/2008,"I've had some of the best moments when some one has recommended an ""off the beaten path"" kind of place; the Space Billiards Cafe is one of those spots. A comfortable room with a dozen billiard and pool tables well lit and spaced for a ""players"" game.I went with some friends after dinner for some relaxation and casual conversation. The room was not quite half full so it was quiet. They serve coffee and tea but they allow you to BYOB. If you do not have anything, ask and they can help direct you for some ""liquid"" refreshment.The equipment is very well maintained, have plenty of cues and a couple of tables for the ""real games"". Find this room on the top floor, go any time (I was told it is open 24 hours a day, but double check) and ""play to your heart's content"".",2,,2
