,er_cool,er_date,er_freinds,er_funny,er_location,er_name,er_photos,er_rating,er_reviews,er_text,er_useful
30,10,9/18/2017,4932,7,"Manhattan, NY",Ruggy J.,5152,5.0,2413,"I gotta say, I expected nothing, but was blown away by Minnie's.I unfairly judged a book by the cover. My original sniff test of a 25 year old novice restauranteur funded by a nightclub-owner father was suspect at best. There was no way this was going to be anything but a privileged millennial with deep pockets and more focus on Instagram baiting than giving Clinton Street a great new restaurant. I was completely wrong, though the place certainly does make for a great Instagram photo op. Minnie's is as legit an operation as any, and deserves to be standing shoulder to shoulder with any other restaurant in LES. Their pork belly burger was an indulgent treat that sounded like a gut bomb on paper, but was well balanced for something so rich. On the opposite side of the spectrum, the fluke ceviche was light, crisp, and perfect for a warm night in the city. Paired with an inventive take on an old fashioned featuring aged Balsamic vinegar, it was one of my favorite meals of the month. I can't wait to go back and try the rest of the menu (including that cake you've seen all over the internet), and perhaps sometime soon they'll be open for lunch during the week. I have no clue if that's a goal of theirs, but something this good should be open more than five hours per day.",12
31,,9/16/2017,217,,"NoHo, Manhattan, NY",Daniel K.,55,4.0,43,"Stumbled upon this spot while looking for late night food. There was no wait and we were seated promptly. Food: ordered the salmon which was cooked perfectly - top half is crusted and seared while the bottom is raw.  Served with additional veggies, overall very delicious with citrus flavoring from the greens. The girlfriend ordered the 1/2 chicken - she enjoyed it, a bit dry but flavorful. Of note, the chicken takes at least 25 min to prepare, so beware. Buddy ordered the burger which was good and apparently 'did the job.' Fries were delicious. The drinks were great. Decor: cute little place, dimly lit, great date spot.  Excellent music.",2
32,,8/29/2018,263,,"Springfield, VA",Mallory J.,5,4.0,22,"The food was refreshing and delicious! The atmosphere was clean and bright, what a great brunch spot.",
33,1,8/7/2017,11,,"Manhattan, NY",Lucie P.,129,4.0,17,"My friend and I came here for dinner after reading about it and looking for a cute place to catch up over good food. We had high hopes for it and both came out a little underwhelmed but agree it's a solid spot in the neighborhood for a ""girl's night"" dinn. The good: vegetable and egg fried quinoa (we both agreed it's something we'd like to try to make on our own); hot and fresh out of the oven strawberry rhubarb crumble; v trendy decor and open windows make for a pleasant mealThe not so good: smoked cauliflower fritto (something about the flavor on this was a little off);  the price ended up being $50 each for three small plates, two cocktails, and one dessert, way more than either of us expected to spend for a casual Thursday dinner",2
34,,6/27/2018,42,1,"Elmhurst, NY",Gabby C.,13,1.0,25,"I gave this place a 1 star forIt's service. I'm a very bubbly person hit my server Charity was such a complete b***** (female dog). Can't curse because I also have to remember this will go public. I got invited here thru friends and we all met there it was a nice cool dim place the setting was spectacular. The server must I say was just rude I asked her what was good and what she would get on the menu. She first asked me if I was vegetarian, I told her I wasn't but I eat vegetarian dishes right away she was just rude. Maybe I cameOff arrogant but she definitely showed her arrogance. That's besides the point I thought I was crazy but my friends throughout the evening saw it too. I ordered a glass of red wine and I asked her if she had merlot she told me we only have this and that on the menu might I say with an attitude. I dontt play with people That are serving my food because it's the obvious they are serving my food. When she had went to get the drinks I noticed her say something to the bartender or wherever was at at the bar and they both looked at me. Made me feel stupid and uncomfortable.  We all ordered my friend ordered the zucchini and steak which was delicious and I really enjoyed my order which was the cauliflower and peppers which was great it was a fried Cauliflower with a pink sauce and some jalapeño red and green peppers it was interesting and delightful. My other friend had ordered the burger which was good I'm assuming because he ate it all. At the end of our dinner we asked for deserts and she told us the deserts my friend asked if he could add gelato to one of the desert she said sternly no. I mean I get it ,it's whatever on the menu you'd have to follow. But it's a matter of good service might I say it's at moderate pricing but people go there to enjoy food have good conversation joke a little just enjoy life. At the end of the evening she directly just placed the check in front of me when it should've been placed in the middle of all of us. Maybe this server Charity S. Didn't like me but we all felt it at the table or maybe she didn't like me because I asked if there was merlot and said the wrong thing. It doesn't matter!  Or maybe she didn't like us because we were Asian. That's besides the point. You guys have real good food but this server really disappointed me it sucks because I work in the hair industry and food and hair come hand in hand. Word of mouth also goes a long way. So if you do decide to go there just make sure your server isn't the bald headed girl with a tail in the back. She isn't a happy camper!",1
35,,3/24/2018,159,,"Boston, MA",Bobby B.,122,4.0,89,"I shared the steak and the quinoa appetizer with a friends, both were perfect! I've been thinking about the peppercorn steak all day.",
36,,3/30/2018,144,,"New York, NY",Amelia T.,2,3.0,16,"Pricey for mediocre food. The wait staff doesn't seem to understand food proportions when asked either. We ordered small plates due to a time constraint. These included the sheep and the pear, the smoked cauliflower fritto, and the lamb neck flatbread. The cauliflower fritto was probably the best of the three. However it did seem that the amount of yogurt was a bit too much as a compliment to the cauliflower. The sheep and the pear was disappointing. The ricotta was piled so high that it swallowed the flavor of the pear and pomegranate. The lamb neck flatbread was OK, but for $19, the price didn't make sense.",
37,,4/22/2018,0,,"New York, NY",Arkie T.,3,4.0,7,"Great food and cocktails. Been there for brunch and also dinner. The squash farro bowl was great. Banana pancakes delicious, however more consistent banana and some berries would have been better. Roast chicken and salmon were great for dinner and the cocktails were fantastic. Wish there was more seating. Also acoustics in the place aren't great. Very noisy. Service for brunch was a little slow, however they were very busy and perhaps understaffed. Overall. Love this place",
38,1,6/27/2017,91,,"New York, NY",Ainsley B.,108,5.0,134,"SO happy to have Minnie's in the neighborhood!  This place is definitely gonna be a hit, so GO!First off, the space itself is so adorable.  Super clean look with a lot of cutesy, hip accents.  But it doesn't look too pristine; it still def feels like you're in the LES which I love.Food was the perfect balance of unique and tasty AF.  I had the Octopus Salad which was really good...like REALLY good.  Salmon dish was also delish and literally looked like a piece of artwork.  Since it was opening night the dessert menu was limited, but the chocolate mousse was decadent as hell and well worth the calories.Also cocktail menu was short but had several great sounding options.  The Lila(?) was everything I love in a cocktail - fruity, fresh, and not too sweet.Staff was helpful and nice, too, and super stylish!Will DEF be back....maybe even within the next 5 days.",3
39,,7/11/2017,0,,"Manhattan, NY",Qinxue Y.,113,5.0,31,A cozy spot for good food.the sheep and the peach: a must-have! 5/5charred octopus salad: love the combination. 5/5lamb neck flatbread: the flatbread was like Chinese scallion pancake and was very good. The lamb neck was flavorful and went really well with their hot sauce. 5/5crispy pork belly: this dish was pretty but the skin was too hard and the meat needed more flavor. 3/5pink cake: it was a piece of vanilla cake with pink frosting. The cake was okay but the frosting was too sweet. I don't recommend you to get this cake. 2.5/5,2
40,,1/18/2018,579,,"Loir-et-Cher, France",Fiona L.,10,3.0,62,"Stopped by for dinner on a Thursday night. Minnie's is a great place to go with girl friends, because they serve lots of girl-friendly dishes, like half chicken, half salmon, quinoa fried rice, etc. The service was fast, but our food wasn't particularly memorable. I think I would come back for brunch, because the ambiance is perfect for instagram etc. The goat cheese and peach crostini is replaced by a goat cheese and pear crostini in the winter time, because the peach is seasonal.",1
41,,4/24/2018,0,,"New York, NY",Diana L.,0,5.0,1,"Absolutely love Minnie's! Their cocktails are creative and pair well with their food which really is the best! I've had almost everything on the menu from all the times I've visited. My favorites are:The lamb neck flatbreads, the sheep and the pear, roasted 1/2 chicken, John's burger & fries, and the steak.The atmosphere is very cozy and intimate so its definitely a great date spot or close gathering with friends!",
42,,6/3/2018,4,,"New York, NY",Joseph T.,1,1.0,1,"Would have loved to try this restaurant in my neighborhood, based on the good reviews. However, when we arrived early for our 1:45 reservation for 2, the hostess wouldn't seat us, saying that the (many) empty tables were reserved for later parties. We would be seated only if we gave up the table in 30 minutes. Baffled, we asked to speak to the manager, who had to be reached by phone after some more unpleasantries with the hostess. The manager, in all fairness, was nice on the phone, but at that point, we felt unwanted as customers by the on-site staff and didn't feel comfortable staying. Perhaps when the service improves, I will have a chance to try their food. In the meantime, there are many other great restaurants in the neighborhood that respects its customers.",1
43,,9/15/2018,0,,"Northampton, MA",Becky F.,0,3.0,8,"We had reservations at 6pm, right when they opened. Upon arriving about 5 minutes early, it was very disappointing that there was extremely loud construction happening right outside the restaurant. We opened the door at about 5:57 and were turned away. The rude worker who greeted us said they weren't open for 5 more minutes and we had to wait outside. She never came to get us outside and finally after 6, we left. We went to Sweet Chick and it was awesome.",
44,,12/21/2017,122,1,"Brooklyn, NY",Anna S.,6,4.0,31,"Loved it from start to finish!  A girlfriend and I got there right as it opened at 6pm and were seating in the corner which was nice and cozy.  Started with the earl drink, great for winter.Our order consisted of the cauliflower croquettes, charred octopus, faro salad, and pork belly.  All of the food was fresh and delicious.  The char on the octopus was so tender.  I was skeptical about the mint on the faro salad but it was so mild and really nice.  Overall a really nice experience.  At the end they gave us these amazing fresh chocolate chip cookies.  We stayed chatting for 2 hours and never felt rushed.  Highly recommend for a date or a catch up.",
45,,10/28/2017,12,,"New York, NY",Katrina A.,2,1.0,142,"We went to Minnie's for the first time a few months back and had a good experience - once you read the rest of this review, if you're willing to go there, I still vouch for the food.  We liked it so much that when friends were visiting from abroad, we made reservations for Friday night.  Right around noon on the day of our dinner reservations, Minnie's called to say they were closed for a wedding and were cancelling our reservation.  No explanation for how that could happen day of, but I won't be returning there given how little they seem to care about their customers.",2
46,,6/28/2018,0,,"Brooklyn, NY",Natalie D.,0,5.0,5,"Minnie's is my new go-to brunch spot! After experiencing insane wait times at Clinton St. Baking Co., my friend and I decided to stop by Minnie's and give it a try. Best decision ever! The menu, while on the small side, offered a good variety of choices. I settled on an iced coffee and banana pancakes. The iced coffee is the best iced coffee I've ever had; seriously, it's addictive. The pancakes? I still dream about them. Fluffy, filling, and contains the perfect amount of banana. If you're looking for a cute brunch spot with incredibly nice staff, Minnie's is your place!",
47,2,3/10/2018,7,,"New York, NY",Andie D.,0,5.0,3,"Minnie's, an adorable gem found on Clinton St, is  absolutely delicious. You'll find healthy, casual American food that is done very well. It makes makes for a great place to catch up friends or host a large group. Lighter fare highlights include the sheep and the peach and the cauliflower. Heartier favorites include the miso butter fish tea and the roasted chicken. Bonus points for the pancakes at brunch!",2
48,3,8/23/2017,35,1,"New Orleans, LA",Charles M.,3,5.0,22,"Minnie's is the best new restaurant I've eaten at in years. I was shocked to learn they've only been open for a month or two. Despite being in a trendy part of NYC the staff was very friendly and helpful. We called at the last minute for a large group that included four young children and the hostess told me she would have to check and get back to me about reserving a table. I assumed that was that and started thinking about another restaurant when my phone rang and it was the hostess telling me they'd be happy to put a few tables together for us, even going so far as to warn us that they had another large group. The other group turned out to be a wedding party which only added to the festive atmosphere of the small eclectic space on the LES. The waitstaff was equally friendly and very knowledgable about the small, but exciting menu. We started with a few salads, the cucumber and heirloom tomato being the best of the bunch. The dressing was light, with just the right amount of acidity. It tasted like I made it myself ( I am a vinegar snob and usually hate restaurant made salad dressings as they often use cheap, mass produced vinegars.)  The tomatoes were amazing! We  also had some fried cauliflower which is a much neglected treat. My only complaint was I wish it had been larger, but then again I was sharing with a large party.Often restaurants that offer excellent starters disappoint when the main courses appear. This was not the case at Minnie's. Every entree we had was perfectly cooked, well seasoned and unique in its flavor profiles. My favorite was the pork belly which was crispy with just a thin layer of melt in your mouth fat between the crust and the succulent meat. The sauce was also wonderful with a hint of sweet and sour. I regretted offering to share it among my fellow diners. Next time I will make sure to order one just for myself. The strangest menu item was the lamb neck flatbread. It turned out to be the best shwarma/gyro I have ever eaten. The meat was crispy, yet not dry and the slaw and sauce were flavorful without overwhelming the meat. Even the young children in our group were able to find selections on the menu that pleased. The burger was juicy and perfectly cooked as was the roasted chicken served with caramelized summer squash. The french fries were also a big hit with the kids and adults alike. For dessert we were offered a 'birthday cake' that was a huge hit with the kids and chocolate mousse that was passable, though not at the same level as the rest of the meal. Finally they brought us out some wedding cake for the kids from the wedding party that was just then winding down.  Minnie's is owned by a delightful young lady who watched over the dining room all night, as any good owner should. I can't wait to go back!",3
49,,10/2/2017,24,,"New York, NY",Cathy A.,88,4.0,73,"I was pleasantly surprised by our dinner experience here last night.  Great spacious corner venue, unique cocktails and food packed with flavor.  We started with The Sheep & The Peach. A crostini topped with ricotta, carmelized peaches and lots of other goodies.  I had the Lamb Flatbread which was a unique blend of flavors.  Rich, crispy lamb pieces on a delicious flaky type of pancake topped with pickled cabbage and tzatziki.  The John's Burger was cooked perfectly and extremely satisfying. The vegetable & egg fried quinoa was a perfect side dish.  I'm looking forward to coming back to try their brunch items.",1
50,,6/11/2018,1,,"Bronx, NY",Zoire M.,0,5.0,2,"Well I will start by saying that this place is excellent, clean, welcoming, cozy, and last but not least the waitress, and bartender are so professional, respectful, and fun. My husband and I went for drinks and we had a blast I loved everything about this place but what we appreciated the most were the way they treated us. We are looking forward to go back for brunch and interact again with them again. Triple high five for you guys keep up the good work. Hey girl hey!!!!!",
51,1,8/13/2017,94,1,"Reston, VA",Sunny S.,62,4.0,152,"Came here for dinner for our five year anniversary. To start off, liked the decor, ambiance, and music (although it was a tad on the loud side). We ordered a few cocktails but our favorite was the sunburn (although they were out of the edelweiss flower that is supposed to go in the drink). The sunburn was smooth, sweet delicious. The love potion cocktail was interesting - the tequila was a bit overpowering the drink and it was annoying to spit out the peppercorns that constantly entered my straw. The margarita was OK. We loved the sheep and peach - so many complementary textures and flavors - I could have gone back for more. The pork belly was also delicious and loved how there was definite crispiness to the skin. The salmon dish was fine, but nothing spectacular in comparison to other salmon dishes we have had elsewhere, and the octopus salad was a little overly fishy despite all the lemon/citrus and beans that were thrown in to neutralize/complement the fishiness. To end the evening, there were two small warm chocolate chip cookies that arrived with the bill. Service was kinda slow - we were tucked away in a corner so it wasn't the easiest to get the attention of the server. So overall 4/5.",2
52,,10/23/2017,3,,"New York, NY",Sandra H.,3,4.0,24,"Went there on a Sunday for brunch and it was exactly what I wanted: quiet atmosphere and good but healthy food!We had peach toasts,huevos rancheros and pancakes.The portions were smaller than usual but everything was really tasty!The staff was super nice!Will come back:)",
53,,10/21/2017,21,,"Stamford, CT",Aman M.,46,5.0,4,The photos speak for themselves. The food and drinks were amazing. So many signature drinks to chose from and great timely service. The owner is the host and the owners mother bakes the cakes so it really has the family touch. Enjoy!,
54,,4/15/2018,128,,"Albany, CA",Laura T.,0,5.0,10,"Excellent food, cute place and great service. Had their blood orange mimosas that were very delicious. Will return on our next visit to nyc.",
55,,9/18/2017,267,,"New York, NY",Kohl D.,87,4.0,123,"Their food is great! The toast and fluke poke is authentic, fresh, and crafted with intelligence. Their desert needs work no doubt--the crumble cake has some sort of yogurt cream on top, which was good but it should've been replaced with ice cream and more berries to combat dryness. The chicken and salmon were delicious, and the cocktails were amazing. I recommend checking this place out. It's a bit pricey for the portions, but you're paying for the experience of the unique food. Mmmmmm",
56,,8/25/2017,90,,"Ridgewood, NY",Rafael H.,3,5.0,3,The salmon dish is INSANE!! This place does everything right. Some crazy lady Sarah S. left a message so obnoxious crying about trust fund babies I had to try it & I thank her for her rent stabilized apartment that made her hate all of us with some money otherwise I wouldn't have tried it!,1
57,,11/5/2017,169,,"New York, NY",Kirsten L.,3,5.0,12,"Minnie's is a fantastic addition to the LES food scene!  It's delicious, and the atmosphere is fantastic.  I would highly recommend the farro, the cauliflower, the salmon, and the pink cake.  However, everything we tried was tasty!  The staff was wonderful; our server, Penelope, was attentive and lovely.  Two thumbs way up!",
58,,9/20/2017,4,,"New York, NY",Lillian W.,16,4.0,24,"Great restaurant with interesting decor (mainly that one painting - you'll know it when you stare at it). Service, food, drinks - all pluses. Went with a couple of friends for dinner and they kindly rearranged a table to fit a group of 5 - I swear, this alone is worth coming back.Tried the lamb neck flatbread and burger - both great. - Lamb neck flatbread is served like two tacos. V flavorful.- Burger had pork belly on it, so get in my belly.Cocktails list was short, but memorable. Top 2 are Sun Burn (sweet with aloe!) and Backyard (refreshing gin). For those who don't like cilantro, stay away from the margarita. It's crushed in the drink. Will be back - they give warm chocolate chip cookies with the bill. Never been happier to receive the check!",
59,,9/23/2017,1,,"Scarsdale, NY",Brandie B.,7,4.0,15,"Such a great gem to discover in LES. The atmosphere is intimate and the staff was very attentive. Our waitress recommended the vegetable and fried egg quinoa dish, which was delicious. It reminded me of a healthier version of Chinese fried rice. I am definitely going to attempt to replicate it at home. Our main dishes (pork belly and roasted half chicken) were bursting with flavor. The icing on the cake is a parting gift of complimentary chocolate chip cookies that melt in your mouth. I would've given the restaurant five stars, but we had to wait for our main dish much longer than I expected, especially since we had placed our order with very few patrons in the restaurant. Despite that hiccup, I would highly recommend visiting Minnie's.",
60,2,6/28/2017,95,,"Financial District, Manhattan, NY",Sam K.,2,5.0,7,"So happy this place finally opened. Was curious what was up since I saw they started construction. The restaurant is very cute and fits in perfectly with the LES vibe. It's very open and hospitable and inviting. Right away the decor indicated a very tight restaurant. I ordered the hamburger because I have no self control and was was NOT disappointed. Can't stress how delicious the burger was. (It comes with fries, something not listed on the menu.) The rest of the menu looks ambitious and delicious hitting all of the fan favorites. Next time I will get the octopus salad and the lamb neck flat bread. Cocktail menu is short but sweet and I hear the Minnies Margarita is spicy and tasty. Definitely coming back soon!",1
61,,9/5/2017,180,,"New York, NY",Amalia H.,0,4.0,10,"This place is really cute, and the food is quite tasty -- it's a great option for grabbing drinks and a few plates with some friends. The seating is cozy and the staff we interacted with were all very friendly and accommodating. Apart from the online menu, there is a short wine and cocktail list, and several dessert options.My friend and I split 'the sheep and the peach', since we'd seen the photos on Yelp, and I agree with previous reviewers that it is a must-order; the ricotta and caramelized peaches are a delicious combination. For our entrees, I ordered the salmon and my friend got the burger. The salmon was perfectly cooked and beautifully flaky, with a great combination of flavors, but might have benefited from more vegetables on the side to complete the dish -- if you're hungry, I recommend pairing it with a salad or small starter. We finished with a slice of the pink birthday cake, which was fine but not extraordinary -- one of the other desserts (fruit crumble, chocolate mousse) might have been a better choice. Of course, we gobbled it down anyway.Overall, this is a welcome addition to the neighborhood, and we will definitely be back.",
62,,4/2/2018,117,,"Queens, Queens, NY",Jack D.,6,5.0,10,"Came here last Saturday night, without a reservation, and the hostess Claudia was so accommodating and gave us the sweetest little table. Loved the food, the staff, and the Oh Honey cocktail! Great place, can't wait to come back!",
63,,8/31/2017,5,,"Manhattan, NY",Victoria T.,0,5.0,11,"Minnie's was absolutely delicious! Every dish we had was so fresh and bursting with flavor. It is not often that every bite your group takes ends in a moan! For desert, the strawberry rhubarb crumble is a must (coming from a chocolate lover)! Your check also comes with melt in your mouth cookies!The restaurant is also super cute, had great service & is in a prime location. Look no further, you will not be disappointed here!",
64,,3/3/2018,8,,"San Francisco, CA",Tom F.,0,4.0,6,"Friendly staff, nice atmosphere. Took a while to get a table but once we were in everything was great. Can recommend the pancakes. Some of the best I have ever had, and that is saying something.",
