,er_cool,er_date,er_freinds,er_funny,er_location,er_name,er_photos,er_rating,er_reviews,er_text,er_useful
0,,10/19/2018,446,,"New York, NY",Irene B.,94,5.0,55,"Step aside Clinton St.. found my new favorite pancake in the city. Fluff dreams all coming true. The syrup accompanied the pancake well and honestly it was like having cake for breakfast. Came here for brunch with some friends and only have good things to say about this place. I believe it is also relatively new. The food was very tasty, the interior was well decorated and cozy, and we were seated pretty quickly even tho we had 6 people. Along with the pancake I also ordered the c madame which incorporates Katz deli's pastrami. Very tasty. Everyone else loved their food too! Will be back.. in a week :)",
1,1,9/30/2018,318,,"Manhattan, NY",Krizia C.,190,4.0,311,"Yummy yummy yummy!!! Perfect little spot for brunch on a beautiful fall  Sunday. It's like walking into a cute cottage or summer home in France. Windows opened to get the outside breeze, fresh plants, and unique decor. Service is good, food even better! The menu is a perfect array of brunch items from juevos rancheros to pancakes. Anyone can find what they like here without being too overwhelmed with options. Dish sizes are perfectly portioned to share or for a main dish. Dishes I recommend are the juevos ranchero (tad spicy) and riccota crostini toast. Delicious!! I would securely order the two orders of the ceostini for the table. Also got the pancakes. Stack of three perfectly fluffy cake like pancakes. Very cute yummy spot. Excited to go back and try more.",1
2,2,9/21/2018,176,,"Brooklyn, NY",Jen D.,71,4.0,112,"Very cute corner restaurant in LES with delicious food!Came here with a girlfriend for dinner and was very impressed with the dishes.  We shared the charred octopus salad, farro pearls (my favorite), and the smoked cauliflower frito.  All were good portions and super flavorful and fresh.  At the end of the meal the check came with two warm chocolate chip cookies, yum!Will definitely be back to try some of the main dishes and brunch.",1
3,,10/7/2018,12,,"New York, NY",Karen H.,450,4.0,220,"Cute place, especially the seating by the windows with the little pillows. There was no wait on a Saturday afternoon. We had The Sheep & the peach- yummy ricotta on bread, and the Salmon Grain Bowl (my friend loved it but I thought it was just ok). Place was not too loud and good for conversation. Server could have been a bit more attentive by offering milk for our coffee or ketchup for our fries, but still had a lovely time.",
4,,8/8/2018,494,,"New York, NY",Elizabeth D.,110,4.0,47,"Love this place as far as atmosphere and location, and even food.Have come in twice and both times i was sat down quickly. I've ordered the heirloom and haloumi dish and also the ceviche.Both were delicious. The ceviche, although small, was honestly mind blowing as far as flavors.I've also gotten their blood orange mimosa which to me tasted just ok. I think it was pretty more than it was tasty. My biggest minus is the fact that they have few options for people with limiting diets (that's a lot of people in nyc!) such as gluten free or dairy free. Sure you can get a dish that has dairy or gluten and just ask for it without but then you lose a lot of the flavoring so it kinda defeats the purpose of going out to eat :(",
5,2,6/23/2018,344,1,"New York, NY",Janelle B.,409,4.0,87,"Minnie's was just too cute. I really loved it! I loved the atmosphere. I will have to say I wish they had more options to their menu, but other than that, I liked it. I got their huevos tostadas and it hit the spot. I probably will get something different next time. If you are looking for a quaint spot, you should come here.",1
6,,10/26/2018,18,,"Weinsberg, Germany",Mirjam G.,28,5.0,31,"I stumbled upon this place by accident and I really love it. It's. Very cute to sit, especially during the summer when all the windows are open. The food is also delicious, they have so many options, I always have a hard time deciding!",
7,,10/27/2018,1,,"New York, NY",Joshua G.,13,4.0,10,Fun brunch spot! Great for 2 people or a group of people. All the food is really good and very filling! Great spot during all seasons. During the summer they open all the windows. Have returned multiple times after my first visit.,
8,,6/15/2018,311,,"Manhattan, NY",Miriam M.,527,4.0,287,"Venue: simple and beautiful, white and blue accents. Window bench seats with large shutters that allow for a nice breeze on warm days. Service: Slow...took awhile to get a waiter to our table BUT all of our servers were super nice, offered to take our photo when we clearly were struggling with awkward selfie (groupie) pic. They also allowed us to push our reservation half an hour when we realized there was noFood: Everything was good, from presentation to quality of ingredients. We had the Heriloom and Haloumi plate, the Greens and Grains, and The LES Croque Madame. The highlight was definitely the Haloumi plate. Yum.Drinks: Nothing to extravagant on the cocktail list but my gf loved her spritz and their iced coffee is nitro cold brew, complete with stripey straw. Overall, Minnie's should not be overlooked for a start to a Sunday Funday in the LES or a quick brunch date.",
9,,8/20/2018,317,,"New York, NY",Lindsey S.,155,3.0,231,"We knew Clinton Street Baking Co. was going to have a long wait on a Sunday morning, but we walked passed Minnie's and thought to pop in. The atmosphere is cute and simple. It's a smaller restaurant, but the seats aren't crowded. We were sat right away and decided on the Pancakes and Huevos Rancheros. I'm surprised I've never seen Minnie's on any ""Best Pancakes NY"" list because their pancakes were phenomenal. If I could rate that alone, it would be 5 stars. The Huevos Rancheros was disappointing though; the ingredients were thrown together without any exciting flare or flavor. The service was fine and to the point. I'd come back for the pancakes.",
10,,"5/18/2018
            





Updated review",245,,"Brooklyn, NY",Brennen D.,106,5.0,122,"Minnie's serves one of my favorite dishes of all time! I fell in love at first bite with their delicious lamb neck hash. I honesty picked it because it sounded very interesting, but I was blown away by the flavor and mix of textures!First off, my first impressions was that it was a cute place! My girl friend and I were just walking around the neighborhood and we liked how they designed their restaurant. It is nice and cozy inside. Staff was really friendly and we were greeted with a smile. When we took our seat, I noticed a mirror. One wall had this slanted mirror which was cool. It was convenient when I needed to fix my hair.I feel like street parking would be difficult to find here, and unfortunately they do not have a parking lot. There are train stations close by which is how we got there.All in all, definitely worth checking out. I'm definitely going to revisit and try some other dishes on their menu!",
11,,4/22/2018,264,,"San Francisco, CA",Paul H.,25,4.0,72,"Loved this brunch spot. Right down from Clinton St and the line there is crazy so decided to come here instead. More than satisfied! French toast was amazing. At first glance it may look small, but it'll fill you up especially if you get another item to share. We got the tostadas and those two items between the two of us was enough for us. Tip: go to the bar and eat, don't wait to sit unless it's a reasonable time. Unless you reallllyyy want to sit at a table.",1
12,,4/30/2018,14,,"Toronto, Canada",Joy H.,298,5.0,92,"Really cute place with nice staff!The decor had an artsy nautical hipster vibe and was very brightly lit with all the windows. The staff were all super friendly and make great recommendations.We ordered the banana buttermilk pancakes with a side of scrambled eggs. The pancakes were amazing and fluffy--the bananas were slightly caramelized and made each pancake bite taste divine. You can also choose to have the fruits on the side if you like, instead of cooked into the pancakes. The eggs were cooked to perfection and very lightly salted, which suited my tastes but not my friend's (who really enjoys salt)--you can always add more salt but you can't take salt away.Very beautiful place to have a meal and chat with good food!",
13,3,1/28/2018,184,2,"Brooklyn, NY",Jenny C.,372,3.0,310,"My friend and I stopped by here since the restaurant we originally wanted to brunch at had technically difficulties with conedison and the next closest one we ventured to had a 2 hour wait time (INSANE for how hungry I was so heck no). This had a wait time of 25-30 minutes which was fine by my friend and I so we decided to wait outside and chat until they called us to come inside. The environment was very casual, the music sort of loud but since we were seated close to each other, it was fine. If you have a bigger party and you wanted to hear the person from across the table, it might be a bit of a problem (or maybe my hearing just sucks). Once seated, we were given water and menus. Due to it being a Sunday, they were probably (guessing here) busier than usual so it took a bit of time before they came to check if we wanted any drinks and (maybe a bit longer than usual) for our food after we declined drinks. However, the actual food to table was a decent wait time which was great (since I was starving!). My friend ordered the pancakes with some chocolate chips added in (that's an additional $2; you can add bananas too) with a side order of a sunny side egg ($3 - which, for an egg, is kind of pricey but meh). I had the huevos rancheros with a side order of fries. My friend thought her pancakes proportion was larger than what she had expected (which led her to doggybag one pancake home) and she said it was like eating a dessert for brunch (which is NOT a bad thing AT all) and the sunny side egg was nothing out of the ordinary. My huevos rancheros, aesthetically, I think it could look better but the taste is what counts in my humble opinion. It had a bit of spiciness and that's really all that I can remember (which means, it wasn't superbly memorable to me). It was good though. The fries were okay, some got soggy at the bottom. Overall, I felt that Minnie's was okay. If I was around the area and the wait time for everywhere was about 2 hours, I would probably come back. But I do not think I will go out of my way to come back for another brunch experience.",3
14,1,3/30/2018,394,,"San Francisco, CA",Ayumi W.,325,4.0,175,"A cute little restaurant that's perfect to catch up with a friend in the middle of the week. Interior is well designed and the place is not too crowded.They have a small menu and I wish they had options for side veggies for the entree. We split the ricotta and pear toast and each got the 1/2 cooked salmon. I liked both, but don't expect this place to be the meal of your lifetime or something that will change your life entirely. It's a good spot for a sit down place that's not too fancy but still intimate enough for a nice dinner.",
15,,4/15/2018,154,,"Brooklyn, NY",Frances T.,64,5.0,125,"Five stars go to the lamb neck hash and the amazing service. The lamb neck hash was a pleasant surprise. At first, I looked at the restaurant and expected the only thing they would have served is avocado on toast. But don't ever judge a book by its cover. This dish was the best pairing of lamb, sunny side up fried eggs, and crispy hash. The lamb was extremely tender. I loved the combination of spreading it on the sourdough with the egg yolk. The ambiance of this restaurant was also super cute. Despite the all white and pristine look, they played some ratchet music which I liked. Overall it was a great experience. Something I def would come back for.",
16,,7/9/2018,730,,"New York, NY",Ryan R.,149,4.0,1659,"Went here with a friend to grab a bite to eat on a weeknight. I made a reservation, but did not need it as there were several open tables when we arrived.After perusing the menu, we decided to split a few dishes:The sheep and the peach (3.5 stars): This appetizer was pretty good--though the peach was a bit understated in my opinion and I was hoping for a nice, juicy, refreshing peach.Lamb neck flatbread (3.5 stars): This appetizer was also decent--nothing that really blew me away, but tasty nonetheless.Burger (4 stars): Another good burger in the city--this one had pork belly on top and brisket that made it super juicy and flavorful--a good size as well.Salmon (4 stars): This dish was refreshingly light and fresh and was one of our favorites of the meal.Overall, this place serves up some decent food and has a nice vibe. It was not as crowded as you would expect for a place of this quality, but I felt that it may be due to being about $3-$5 more expensive per dish than it should be. Nonetheless, it's a nice spot in the neighborhood and perfect for a date or small gathering.",1
17,1,1/20/2018,28,,"New York, NY",Jackie L.,120,5.0,44,"OVERALL GOOD: my friend and I came to the area and Minnie's only had a 15mins wait so we decided to give it a try. I enjoyed my experience here! Definitely recommendENVIRONMENT: the restaurant has a nice aesthetic. The restaurant was full but if didn't feel crowded at all. The waitresses are very friendly as well!FOOD: this place is not your traditional American brunch. The food options are unique but tasty. I ordered the John's burger and my friend got the Sheep and Peach. We both loved it, plus the good arrived within 15mins of order.",
18,2,8/31/2017,627,,"New York, NY",Brianna E.,160,5.0,84,"Wow! This place is stellar! Super inviting from the outside, sitting perfectly on the corner for great people watching. Upon walking inside, you can see the designers took their time and created a perfect ambiance. Windows line the wall and open for an amazing breeze for your meal. Candles light the room and give the perfect chill vibe for a date, family dinner, celebratory experience or drinks at the their gorgeous bar.The drink menus give an array of selections, but I chose the Lola -- and man was it nice! The perfect blend of freshness that still tastes like summer but could be a perfect crisp drink year round.The food selections are out of this world! As a table we shared the vegetable egg quinoa, which was MY FAVORITE, and I think every table in the place had a bowl on as well. We also had the octopus and I could've literally eaten 2 more servings of it because it was so delicious. My two friends split the burger and fries, I don't eat meat, but it looked fantastic-- the fries and sweet pickles were very good.Our waitress was so helpful with our menu questions and selections and very attentive. All in all it was a wonderful experience and I will be back to get the salmon :)",3
19,,10/5/2017,792,,"New York, NY",Liz S.,1568,3.0,706,"I came a few weeks ago for dinner with friends. I reserved a couple days out for a 7:30 Friday evening spot, which I would recommend doing. All of the seats were taken, though it didn't seem like too many people were waiting outside.The atmosphere feels very ""girls night out."" The crowd skews female and late twenties, and it's a pre-party vibe. Don't know that the decor works entirely-- the aggressive photo portrait on the wall seems out of place. The seating is cramped. Very dark, with candles.They have a relatively short cocktail list, but there were  a couple of tequila options. I went with one that ended up being a slightly fruity, slightly spicy margarita, and I was fine with it. Must have been $15 or close to it. My friend had a negroni and liked it.I started with The Sheep and The Peach ($15). This is the must-get dish and it lives up to it. The peaches are caramelized and warm, the ricotta is creamy, the arugula adds some tartness, and there's enough dressing to make the crusty bread work. It's a bit difficult to eat, but I enjoyed it. Portion is substantial and it would be a lovely way to start your day.Where Minnie's lost me was the Fluke Ceviche ($16). It came in a minuscule dish, like one for pocket change or rings. It was about three bites. The flavors were fine, but not outstanding. You can't go around charging this much for this little. Double the portion, at least, or drop it.One friend had the charred octopus, which I thought good but not great; octopus was cooked well but sides didn't mesh. Another had the lamb neck flatbread, which I liked.Service was on the slow side, especially to pay our check, though everyone we interacted with was fine.I'm not sure why this place rubbed me the wrong way. Maybe it's that it doesn't seem to have a clear point of view-- Mediterranean-ish but also a burger and a half chicken? Too many buzzword ingredients? I left feeling like it was more expensive than what I got out of it, as well as not terribly unique. They're not doing anything wrong, but that doesn't mean I have to love it.This place would be great if you had to meet someone for brunch in LES, but I wouldn't go out of my way for dinner.",1
20,1,3/19/2018,144,,"Queens, NY",Jessica C.,151,4.0,243,The wait is quite long here like over an hour for brunch around 2pm long.I ordered the french toast which came nicely stacked like jenga. Two layers though so dont think youre getting an actual tower. lol Each piece of french toast had a cornflake crust on the outside that provided great texture. It also came with greek yogurt and fruit which gave acidity and tartness. Also get the syrup on the side to prevent the french toast from getting soggy. 100% would order again since it satisfied my sweet tooth without being too sweet.My friends got the huevos rancheros tostadas and the LES croque madame which they really enjoyed! So overall i think there is something on the menu for everyone.,1
21,,10/12/2018,1,,"Ardsley, NY",Dana P.,0,2.0,18,"Despite several open four-top tables with ample space around them, my party of four were sat at a four-top very, very squished between two other parties. Fine, but at that table there was almost no room whatsoever to squeeze past the other parties to sit on the banquette. The host did not offer to pull the table out and so my friends went to try and squeeze by the other tables to sit down and by doing so knocked over our neighbor's glass of water. It shattered to the floor and we apologized profusely, however, very weirdly, no one in the restaurant cleaned up the glass all over the floor (not to mention the puddle). In fact, when we instinctively stepped away to allow them to clean it up and then asked if they wanted to clean it up, the host said nothing, very awkwardly, so we sat down and ended up sitting with our feet on broken glass for our entire meal.We flagged it to the host again and then to our server and nothing was done. The glass breaking was so loud (in this tiny restaurant) that I find it pretty impossible that no employee knew what had happened. Luckily we were all wearing closed-toe shoes but really this was unacceptable.The food was fine. My food was prepared incorrectly so it wasn't a great meal for me but my friends all enjoyed their food: the huevos rancheros, pancakes, and french toast. I have worked in the food industry for many years, both FOH and BOH, and I give great leniency and understanding for service, but this was too weird and I will not be coming back.",
22,1,10/7/2017,37,,"Portland, OR",Shannon B.,37,5.0,81,"Came here on a Saturday afternoon and loved the vibe here - such a good spot for brunching on the weekend! Everything from the decor to the music is tastefully and artistically curated to create a hip yet casual atmosphere. The staff is extremely friendly and welcoming. The food was delicious too, and you can tell they use very fresh ingredients. Definitely recommend!",
23,1,7/23/2017,85,,"Manhattan, NY",Rose I.,3164,5.0,377,"Everything was perfect. Ambiance, decor, the crosswinds on a beautiful summer evening. The food was even better. What a nice surprise to find a blend of healthy and hearty offerings to satisfy the sophisticated yet indecisive palette in a casual setting. Started with the smoked cauliflower and fried quinoa. I haven't had fried rice in awhile because I'm picky about the grain used - quinoa was the perfect substitute. Filled with veggies and egg, the quinoa was enjoyable and could serve as a meal for some diners. Smoked cauliflower fritto was delicious thanks to the harissa yogurt Tried the salmon - it was delicious .  If that was the last thing we ate at the restaurant we would've already been satisfied. But then came the meats which blew us away and left this dish in the dust .. nothing wrong - it truly is a tasty way to get in protein and omega-3's. Just not as memorable as the following..The lamb flatbread and the brisket burger, which came with thin (not shoestring) fries, are must-have - they're amazing! The flatbread appears to be served on one or two soft tortillas (hence the dual pricing).  If you eat lamb, you're going to like this. If it's your first time eating lamb, you'll like it too. The dressing and hot sauce on the side work well together .. the star of the meal was the burger. Juicy is the first thought that comes to mind followed by hearty and flavorful. Succulent on a toasted brioche as well. I normally don't like brioche (I find them dry and stale-tasting) .. this brioche was extra laminated and moist to my liking For dessert got the homemade strawberry rhubarb crumble. I thought it was quite heavy/thick in the middle with a strong tart taste.. perhaps if the crumble was a little more crisp and chunky I would've enjoyed it more. I won't dwell on this weak point because the impression was quickly redeemed when the bill arrived with 2 chocolate chip cookies .. warm, a little crisp, and all chewy.. these were perfect .Bright and airy, this restaurant creates a comfortable atmosphere to enjoy really good food",2
24,5,6/27/2017,5000,6,"Forest Hills, NY",Mike C.,64780,5.0,1636,"Great new corner spot on Clinton, with some slightly different takes on some typical foods, like the Pork Belly Burger.The Fried Quinoa is great too, as is the Cauliflower Fritto. The space itself is really nice, with lots of light and a breezy atmosphere.Unfortunately they didn't have the Pink Cake dessert you may have read about, but I'll be back to try that.",11
25,1,"5/31/2018
            





Updated review",19,8,"San Francisco, CA",Anish S.,4,5.0,17,"Apologies to the Minnie's team. True story here.I'm sitting at the Ludlow Hotel with a friend. Two women nearby start talking to us and asking a bunch of questions. Then the more drunk of the two, seemingly out of left field, went on a mini-rant about how terrible Minnie's is. I've never been to or heard of Minnie's. So my assumption, understandably, is that someone working at Minnie's must have treated her poorly. Why else would someone hate a restaurant enough to bring it up in conversation with strangers? They must've done her dirty.In a yolo moment, I let her use my Yelp account to offer some revenge to the establishment that wronged her. Karma, really. I was typing, but she was dictating. This is why the review sounds like a 9-year old who just watched a PG-13 movie with 7 cuss words and feeling rebellious.We all had a quick laugh once I clicked send. Justice served.I: ""Lulz, so what did this place do to you anyways?""Her: ""My ex's girlfriend owns it. And she sucks.""I: ...So there you have it. I just trashed a small business owner near my new neighborhood who is likely a very lovely person, chef, and entrepreneur. And did it with the linguistic sophistication of that one kid trolling AIM chat rooms with ascii art (13 / M / []D[][]\/[][]D).",
26,,1/8/2018,58,,"New York, NY",Carolina N.,16,3.0,203,"My friends and I had an ok experience at Minnie's, but I'm not sure we'll be back. I emailed for a reservation, and they were very accommodating about giving me the time that I wanted. The space is very cute, and we were seated immediately.I had the LES croque madame and my friends had the huevos rancheros. The food was good, but not amazing. It also came out very fast. I think from the time we sat down to the time we finished eating, it was only half an hour. That was a bit weird for ambiance, but I it's definitely better than the alternative.",1
27,,9/23/2018,41,,"Marylebone, London, United Kingdom",Filemon G.,3,4.0,9,Nice breakfast place with cute setting. They also have choices of mimosa if you feel like kickin some alcohol for brunch. The bartender and host are nice and friendly,
28,,2/18/2018,3,,"New York, NY",Kelly M.,62,5.0,36,"Went to Minnie's for brunch and loved the atmosphere. Very disappointed to say, I ordered the burger and it was very average. It looks much better than it actually tasted. I experienced some serious food envy and regretted not ordering the pancakes, which I saw go by to almost every other table. I will definitely be trying them next time instead of the burger.",
29,,9/10/2018,6,,"New York, NY",Fanny H.,43,4.0,83,The food was delicious. I'm not much a fan of the vintage chairs doesn't make the eating experience  comfortable when your buttocks isn't happy.  They were alternate benches if you were lucky to get a seating by the wall where's there's a cushion for the tushin. I would return for the food.  I had the lamb neck rash and wanted to try the thick pancakes the other table had so we ordered it and shared it among the whole table.  I was in love when I took the first bite.  It wad amazing.,
