,er_cool,er_date,er_freinds,er_funny,er_location,er_name,er_photos,er_rating,er_reviews,er_text,er_useful
65,,7/15/2018,0,,"Springfield, NJ",Terry K.,1,4.0,31,"Best brunch I've had in a while. Charming setting, smallish, with super friendly servers. We had a child with us and they dug up glitter pens, paper and stickers that kept her entertained for an hour. (Don't worry--it's a grown-up place!) 5 of us ordered 6 dishes: loved the poached eggs with heirloom tomatoes; salmon bowl; huevos rancheros; ricotta and peach toast; and THE BEST buttermilk pancakes you've eaten. Brunch prices are decent - in the $18 range.  We are 100% going back.",
66,,1/22/2018,0,,"New York, NY",Odetta S.,6,5.0,34,"Came here on a Sunday right before they stopped serving brunch, but the hostess was more than happy to seat us if we could order in 10 minutes. We did and everything was delicious. I had the lamb neck hash with eggs and it was so rich and tasty. Others had the huevos rancheros and croque madame and were satisfied with their choices. Aperol spritzers to round out the meal and we ate and chatted while they slowly changed shifts, had a shift meal, and no one was pushing us to hurry up and get out. Such gracious and friendly service. I also loved the decor. The prettiest fabric on the banquet pillows (see photos). Highly recommend and will return.",
67,,3/8/2018,0,,"Manhattan, New York, NY",Karoline L.,0,3.0,5,"Stopped in this week for a steak and fries after getting home from work and had pretty high expectations based on the reviews I had read online. I have to say I was wildly disappointed by the quality in meat that they served. The steak was probably 65% fat and the fries tasted like they came right out of the frozen food section. Cute place, great location, and great serving staff. I will be back to try more, but I was turned off by my initial experience.",
68,,3/2/2018,0,,"Manhattan, New York, NY",Sam A.,0,3.0,13,"The food is escellent.  The lamb flatbread was my favorite dish of the night.  It had perfect spice, seasoning, and sauce.  The peach dish was also absolutely excellent.  The cookie at the end is a nice touch.The reason I docked two stars is because they once cancelled a long held reservation of mine with out of town friends. They had an event that night, but forgot to block out the times on their reservation system.  They called me on the day of at the last minite to cancel and I had to scramble on a Friday to find a new table.",
69,,11/3/2017,310,,"Queens, New York, NY",Michelle L.,114,3.0,131,"Minnie's is a cozy restaurant in the village that offers an array of dishes. I came here with a group of friends celebrating a birthday. We ordered the pork belly, salmon, octopus salad, and quinoa. The pork belly was delicious. It literally melts in your mouth! It is served on a bed of carrot and radish. My only wish was for the portion to be larger. The salmon was also wonderful. However, it is only the salmon. It is not served with a starch or carb. Just a small side of salad under it. The octopus salad was my least favorite. It was just not my style. The quinoa was the best dish I had here. It was a good size portion at a fair [rice. I was actually full after finishing the quinoa. My friends who did not order quinoa were left hungry after the meal. If you go to Minnie's, know that the portions are quite small. Definitely order the quinoa, especially for dinner. My friends and I actually went to grab pizza afterwards. Overall, good food and good service, but small portions.",1
70,,6/24/2018,0,,"New York, NY",Ayanda T.,0,5.0,1,"Made a yelp account just to write a review! Sat at the bar for brunch with friends and had a wonderful time. The food was great and what a wonderful bartender!! Great talking with him and even better drinks. I'll be back soon for sure. I highly recommend Minnie's for a comfortable, tasty and boozy Sunday brunch!",
71,,9/24/2017,0,,"Dorchester, Boston, MA",Mai F.,0,5.0,1,Everytime I come to this place the food just gets better and better. Complements to the chef for always banging out amazing food each and every time. The staff is so sweet and the owner Millie is the sweetest. Definitely recommend if you are in the LES area to stop by Minnie's.,2
72,,12/30/2017,363,,"Englishtown, NJ",Monika Z.,0,2.0,3,"Couldn't understand why this place always looked so empty each time I'd walk by. So we decided to go for brunch on a Saturday afternoon. We were seated right away. The food was delicious. However- Service was a bit slow, although everyone was polite. My coffee tasted like dirt, couldn't drink it. The decor is odd, chairs look uninviting/uncomfortable and the painting on the wall seems out of place. Drinks are wayyyy overpriced. $13 for a mimosa?! It cost the same amount as my entree. Seems unreasonable to me when so many places in the neighborhood offer bottomless brunches.",
73,,6/16/2018,11,,"Beacon Hill, Boston, MA",Zulfiya I.,0,5.0,1,"Great healthy and filling breakfast, very good coffee, quite place. The staff is super nice and friendly, no crazy waiting list.",
74,2,8/23/2017,1,,"Lower East Side, Manhattan, NY",Sarah S.,24,1.0,25,"Our hopes were high as residents on the block, but Minnie's is nobody's local. We gave it 3 shots to make good on obvious newbie mistakes. But no, Indifferent service quickly dropped to just plain rudeness, as the hostess chronically devotes herself to friends & family and staff have followed suit. This, on top of a twee, overpriced menu makes Minnie's just another short-lived trust fund baby's flash in the pan, the sort LES has suffered more than it's fair share of.",1
75,,1/15/2018,27,,"Manhattan, New York, NY",Melissa A.,0,5.0,61,What a fantastic little restaurant.  A wonderful addition to the neighborhood.  Some of the best salmon I've had and the atmosphere is cozy and comfortable.  Our server was a delight.  My friend had the croque madame and said it was great.  Recommended!,
76,,"4/26/2018
            





Updated review",0,,"Redwood City, CA",Robin A.,0,4.0,294,"Solid place for our dessert and drinks. The diners appeared to be very content, so we'll try to get here earlier next time and try dinner. Friendly staff.",
77,1,8/18/2017,1,,"New York, NY",King K.,0,4.0,198,Very good. Reasonably price. Nothing Mind-blowing though.,1
78,,11/11/2017,0,,"North Hollywood, CA",Sarah G.,0,5.0,8,"The food is amazing and the service was great. We got here before our friends and they actually sat us down even though the place was packed. We will definitely be coming back. The place is adorbs, the service is great, and the food is delicious.",
79,1,7/25/2017,0,1,"New York, NY",Natan F.,0,5.0,5,"I've lived in the lower east for several years. Minnie's is refreshing and one of the best new restaurants in 2017! Definitely give it a shot, you won't regret it.",1
80,3,6/30/2017,0,,"New York, NY",Marc V.,0,5.0,6,"I didn't know what to expect, but this place was an absolute delight. The space is gorgeous but not in a way that distracts from the meal. Very open yet intimate and works for either a group or a date. The staff was super attentive without being bothersome, everyone was chic but in a fun, unpretentious way.The food is superb and looks as good as it tastes, perfect blend of healthy and comfort - the salmon was beautifully cooked and I found myself raving about the ricotta & peach toast the next day. V excited to see how the menu evolves and changes with the seasons, looking forward to coming back.",2
81,1,8/17/2017,41,1,"New York, NY",Emmy M.,201,3.0,98,"Cute space.  Not much of a liquor choice.  Also had the pork belly, I would pass on this place.",
82,1,7/18/2017,39,,"East Village, Manhattan, NY",Nathaniel P.,24,5.0,51,"Seriously - This is the best new spot in LES. The food is super fresh, the staff is delightful, and the ambiance is relaxing.",1
83,,5/7/2018,0,,"Manhattan, New York, NY",Elizabeth S.,0,3.0,11,"The only reason this places gets 3 stars is for the food, which is usually the hardest part to get right. My hamburger was great so I would recommend ordering that if you are looking for an experience as follows - Thinking that a restaurant with 4.5 stars in the LES would be pretty busy on a Saturday night, my boyfriend and I made a reservation for 9:30pm. When we get there, we are surprised to see that the place was almost empty with only 3-4 other patrons in the restaurant. The hostess sits us down at our candle lit table and brings us menus. Intimate ambiance so we are thinking so far so good. We order our food and then it starts to go downhill. In a matter of minutes (around 10pm), Cardi B's new album was BLARING at an extremely inappropriate volume and the bartender starts vigorously prepping the bar for all of 0 people. There was not one person at the bar and she is prepping it like there is a line out the door. The table next to us got up and left, my boyfriend and I wishing we could do the same and however we unfortunately had already ordered food. My boyfriend and I are yelling across the table in utter disbelief that Cardi B was blasting like we were at a club in basically an empty small restaurant where people are (trying) to have a nice intimate meal. It truly couldn't have been at a more inappropriate level of volume. The blonde hostess with short hair came over to check on us on approximately 0 times. So if you are looking for bad service, blasting music and an empty restaurant then this is your place! We will most definitely not be back.",
84,,9/7/2017,7,,"New York, NY",Casey Z.,11,5.0,13,"Really great ambiance. Super cute and cozy place with great service. The burger was amazing and well cooked. The bun was buttery and unique. They gave us chocolate chip cookies at the end, which was the perfect ending. We went at 8 pm on a Wednesday night and did not have to wait for a table.",
85,1,6/30/2017,20,,"New York, NY",Pelin C.,88,5.0,121,"Love love love this place. I was a little skeptical because they are new but holy mother the food was divine. We got the burger which is incredibly delicious, the octopus was great and some peachy cheesy appetizer. Yum! Will definitely come back and i personally highly recommend this place",
86,,6/29/2017,0,,"New York, NY",Mack S.,2,5.0,4,"Been waiting for this place to open for a while, the windows looked very promising from the outside.  It's just as nice inside, too!  We got the lime and fun cocktail - delicious.  The pork belly was incredible, and everything else on the menu looked spectacular (the salmon, the ricotta and peach dish, the fried-rice quinoa situation, the ceviche - everything).  We'll be back!",
87,,7/13/2017,9,,"New York, NY",Greg K.,7,5.0,13,"This place is the perfect addition to the Lower East Side.  I live one block away and had the most amazing dinning experience tonight.  I dined with a friend that wasn't going to eat, we ended up sharing the grilled octopus with beans, quinoa with fresh veggies and burrata with grilled peaches.  It was all insane.  I'm so happy this is in my hood.  The music was perfect too.  This is my new favorite Manhattan restaurant.",
88,,7/12/2017,0,,"TriBeCa, Manhattan, NY",Madeline S.,0,5.0,5,"An excellent new neighborhood spot, that's worth making the walk a bit East any night of the week (except Monday!). A perfect dinner choice for Summer, thanks to wide open windows, fun printed pillow and gorgeous flower boxes -- all very appealing to the eye. Excited to see how it transforms throughout the seasons. I could stay at Minnie's for hours, beginning with light bites (typically start with the Octopus, Cucumber Salad or Ceviche) +  a glass of Minuty rosé or one of the delish cocktails, followed by some salmon, and ending with the delicious crumble and glass of red wine -- I always leave satisfied, but not too full, and very happy. This ""something for everyone"" spot is perfect for many occasions -- date night, din with the parents and group dinners. And by the way, the wine menu is extremely impressive!Minnie's attracts a chic crowd, wide age range and generally low key but bustling crowd. The friends and family vibe contributes to a fun, welcoming, charming and social atmosphere. Friendly, cute and extremely stylish Millie, owner and hostess of Minnie's, shines through as an exact representation of the amazing new NYC dining establishment she built!",
89,,7/8/2017,435,,"Milford, CT",Brittany G.,0,5.0,3,"Great vibes, a new neighborhood staple. Recommend ordering the octopus salad, cauliflower fritto, and sheep and the peach. Definitely returning soon.",
90,,11/4/2017,0,,"New York, NY",Tee D.,0,5.0,421,This may be the next best brunch in NYC. Food is amazing. People here are so nice. Love the atmosphere. It really does feel homey. If you love salmon then this is the best place to go,
91,,11/5/2017,0,,"Manhattan, NY",David H.,0,5.0,5,"I took my girlfriend here for our anniversary on a coworker's recommendation. The dinner was fabulous. We split the lamb neck flat bread and then I ordered the salmon and she ordered the octopus. We were both blown away by the variety of flavors and the general ambiance. We had plans to go to a cocktail bar after, but decided to move to the bar and order dessert while chatting with the wonderful bartender. The pink cake must be tasted to be believed!!",
92,,10/1/2017,0,,"Miami, FL",Lucie D.,0,5.0,5,"Great atmosphere, quaint, airy light.  Windows open with nice cool breeze. not a big menu but everything delicious; pancakes melt in your mouth, croque madame decadent.  Service great",
93,,9/11/2017,0,,"Brooklyn, NY",Giulio G.,0,5.0,19,"Love this place. It's quaint/cute, with a top notch menu. The owner is young and hungry(as in she's trying hard not she needs to eat more.) I honestly think new competitive businesses are exactly what that neighborhood needs to stay vibrant. Go check this spot out it's good vibes!",
94,,7/30/2017,0,,"Minneapolis, MN",Joan W.,0,5.0,2,"Incredible food experience; everything was outstanding, including food, wait staff, awesome chef, and drinks.  HIGHLY recommend.",
95,,7/25/2017,0,,"Washington, DC",Patrice M.,0,5.0,3,"A delightful spot with stellar food.  We loved the ambience and whimsy, friendly greeting by Minnie herself! and  corner location with open windows, and most importantly, delectable food. The ceviche is the best I have ever had - complex flavors creating a welcome twist on a favorite, delicious salmon and who doesn't love pink iced birthday cake.  Chef John exceeded our high expectations! This restaurant is a must!",
96,,6/29/2017,345,,"New York, NY",Roselyn M.,0,5.0,2,"Neighbor in the area and stumbled upon the restaurant...WOW. Waitresses are so kind and attentive, amazing service! The fried quinoa dish is a real crowd pleaser and the burger is maybe one of the best I have ever had. The owner has done an amazing job of integrating the space with the outside and is always bumping amazing music",
