,er_name,er_location,er_freinds,er_reviews,er_photos,er_rating,er_date,er_text,er_useful,er_funny,er_cool
141,John D.,"Manhasset, NY",0,23,6,2.0,1/31/2016,"Having dined at Daniel Boulud's flagship restaurant ""Daniel,"" I had high hopes for this restaurant. Sadly, it was mostly a disappointment. A friend and I attended DB Bistro for the restaurant week menu. Judging from the other tables, most customers had the same idea. The first thing I noticed was the restaurant week menu was different from what was listed on the website. Some appetizers and the desserts were the same, but the main courses were completely changed. I was about a half hour early for my reservation, and decided to take a seat at the bar/lounge area in the entrance of the restaurant. My beverage order was taken quickly, but it took 20 minutes for the drink to be brought to my table. By the time I received my drink, my friend had arrived and my table was ready. It would have been nice to have my drink shortly after it was ordered, as the bar area was not busy, and customers who sat directly at the bar, yet arrived after my order had been taken, were given their drinks first. Once we were seated, one of the first things I noticed was a lack of music. There was simply nothing to be heard other than the loud chatter of the patrons, and the footsteps of the wait staff throughout the cramped dining space. Our server was very attentive, and was possibly the highlight of the evening. I wish I could say the same about the food.Amuse-bouche: Cracker with goat cheese spread. It was fine. Nothing much to say. Simply fine.Appetizer: House Made Terrine. Underwhelming to say the least. Tasted like a cold slice of lunchables meat, with a bell pepper coulis hastily spread across the plate. a frisee separated the two slices on the plate, which combined were smaller than a post-it note. Main: Roasted Pork Loin with Bok Choy. The pork was incredibly well cooked and tender, the onion soubise was acceptable, albeit a bit salty. The Bok Choy was the best part of the course, and was perhaps the finest I've had. This was a hit, but resembled more of an above average home-cooked meal than one from a Daniel Boulud restaurant. Dessert: My friend got the grapefruit pavlova, which was delicious based on the one taste I had. I wish i ordered this, instead of the dark chocolate gateau. There was simply no texture to this dessert. Coffee mousse which had surely been sitting on the now soggy ""biscuit"" for some time. This exemplified the feel of the entire meal. Judging from the courses coming out to other tables, I would say the kitchen had been preparing and plating a lot of these meals ahead of time; the restaurant week menu being the kid brother to the ala cart. The whole service had the feel of a mediocre wedding reception, where each diner was presented with an uninspired version of what they believed to be ordering. We also received an assortment of petit fours after dessert. I was excited to see a macaroon, as they are my favorite French pastry. With disappointment, the macaroon fell apart before I could eat it. The filling  was not settled, and must have melted as the top half of the meringue slipped off the second i picked it up. It was also extremely chewy, and lacked flavor. My friend had the other two--some vanilla cake and citrus gummy-like cube. She said it was ""fine"" and ""very citrusy."" The final one was a chocolate candy filled with caramel, which was quite good. From beginning to end, this was just a lackluster experience from a DB restaurant. I was awe struck at the difference between the 2 michelin star flagship, and this midtown mediocrity. I will not be returning anytime soon.",,,
142,Chris Z.,"Manhattan, NY",30,17,5,3.0,4/21/2016,"Bistro is located on a very nice block 44th street between 5th Ave and Avenue of the Americas. Its close to corporate offices and some theaters, Food is good, I mean more then decent, but place is very noisy, and to because its full of people, i think it about room acoustics. By all means go for it if noise doesn't bother you. You may also try Triomphe, jest a few doors down.",1,1,1
143,Marqus R.,"Fort Lauderdale, FL",1512,3605,16316,4.0,7/26/2011,"DB Bistro is really a first rate totally French food, rather smallish bistro with top quality service, a delightful menu and, considering where it is located and what it offers, high but not totally unreasonable prices. It's a favorite of the New York law firms to take their guests and clients for lunch. So, if it can satisfy them and they consider it good enough to impress their clients, you can be assured that it will most likely do the same for you. One caution about the place is that it is small and your chances of getting in during the noon hour lunch rush without a reservation might be slim. The wine list is extensive and one of the most well thought out of wine lists that I have ever come across.I particularly enjoy the superb preparation of their fish, though the portions are on the small side.For what ever reason, maybe because this is America, you'll find a good number of patrons order hamburgers. Why anyone would go to a French restaurant to order a hamburger, I haven't the faintest. It could be just to cover the meat with mayonnaise and ketchup which would be sure to appall any true blooded Frenchmen.",1,2,1
144,Bleep S.,"Tucson, AZ",279,810,1109,5.0,4/15/2015,Foie gras burger.....astonishing....one of the top 5 burgers of my life. The place itself is cozy and comfortable.  Excellent sevice.  The fries are superb. I long to return.,1,,1
145,Joan H.,"New York, NY",208,484,3,3.0,3/9/2015,"All about business - good service, good food, good setting for a strong power-lunch type spot near Bryant Park.  Had the famed db burger - personally I'd rather one with foie gras only, the short ribs really takes away from it, and the whole thing altogether is just too difficult to eat gracefully (this is about business remember!).3 stars in my book, fyi, is not a bad thing - it means what it says ""A-OK"" - which means it did the trick and I could come back, though it's not on the top of my list.",2,,1
146,Waz W.,"Portland, OR",19,246,320,3.0,5/12/2014,"During Cassie's visit, we had brunch at Daniel Boulud's DB Bistro Moderne with Alice, one her close friends from Taiwan who also happened to be in NYC for work. DB Bistro offers a modern, masculine space with clean lines and chrome finishes. I really wanted to like this place, but it seemed caught somewhere between an approachable bistro and an upscale restaurant. It also doesn't help that it's in Midtown, and I got all grumpy as I was dodging people around the Times Square area. Ugh.DB Bistro has a prix fixe brunch menu with two courses for $26. However, we decided to order a la carte, which had a number of vegetarian options for me to choose from. I decided against a brunch cocktail as $16 for a drink seemed a bit steep. Our waiter brought out warm bread as soon as we had ordered our entrees. The black olive baguette was very good, especially with a little bit of butter.Alice ordered the Coq au Vin ($29), which included bacon, pearl onions, farfalle pasta. I assume it's homemade pasta. Don't know much about preparing Coq au Vin, nor can I remember the last time I've had it. Nicely plated, and Alice seemed to enjoy it.Cassie ordered The Original DB Burger, a $32 monster of a burger. Sirloin burger filled with braised short ribs, foie gras and black truffle. Served on a Parmesan bun with pomme frites on the side. I don't mind if someone around me want to order a burger. It's all about personal food choices, and I realize that vegetarianism or even flexitarianism isn't for everyone. That said, man, this was an intense burger. A meat eater's dream, perhaps? It was too rich for Cassie, and she even gave up on the bun. The pomme frites were great though. Quality potatoes, nice and crispy, very addictive. However, they were most likely fried in some kind of animal fat, which would make them not truly vegetarian. I ordered the Poached Eggs ""En Cocotte"" ($19) with creamy spinach and oyster mushrooms topped with toasted bread crumbs. The eggs were perfectly poached. The mushrooms were flavorful and the breadcrumbs were nice. Unfortunately, the spinach wasn't creamy at all, just some sad wilted spinach sitting in green water. When I was done with my meal, I had more bread and also helped Cassie finish her pomme frites. Overall, a decent brunch experience, especially if you want to catch up over a meal. You do have to brave the Midtown crowds to get here though. The service was good. My entree was a fairly tasty little dish (minus the spinach), but for this price tag, it just seemed somewhat underwhelming. Probably won't be back, especially as there is an abundance of brunch options in NYC.",,,
147,Sasha B.,"Manhattan, NY",191,898,45,4.0,12/21/2011,"Was headed to my local favorite, Five Napkin w my friend only to find a 45 min wait. Still being in the mood for a burger, I yelped the local spots. Having never tried DB, I opted to try it. I had no idea what, to expect, the reviews were very mixed and only 3.5 stars overall. I have to admit the burger was awesome! One of my favs in NYC! I'd go back to try some of the traditional French dishes which looked good on other tables. $32 is a bit high for a burger but I'd say it was worth it.",,1,
148,Caroline K.,"Los Angeles, CA",78,470,91,5.0,5/24/2013,"Daniel who? Oh, now I know why there's a DB in front of the Bistro. I'm really oblivious to who's who in the culinary world. But I was very excited/curious to try this place when a family friend was visiting. We shared the crab salad, which was fresh, light and zesty. Delicious. I ordered the Crispy Duck Confit, which many Yelpers seemed to rave about. It was well-cooked and perfectly seasoned. I must confess though that I didn't eat the crispy skin. Some people might say that that's the best part. But I always grew up taking off the skin even when eating fried chicken (my friend refuses to eat BonChon chicken with me for that reason).We tried the warm mini madeleines for dessert. Lemony goodness.",2,,2
149,Curtis B.,"Denver, CO",0,37,0,4.0,11/13/2016,Stopped in just before closing when we arrived in town. Staff was welcoming and friendly.Food was very good and exceeded our expectations for a late night meal.,,,
150,Cutie Patroller ..,"Manhattan, NY",1921,123,850,4.0,1/5/2015,"It's worth every penny!!!!! Sirloin Burger filled with Braised Short Ribs, Foie Gras & Black Truffle Parmesan Bun, Pommes Frites $35",23,3,11
151,Amanda L.,"San Francisco, CA",627,60,379,2.0,3/14/2013,"I'm honestly hard pressed to even give this place two stars, but because I really like the presentation and the taste of the food that made it our table, i'll begrudgingly give them two. reasons.... first the food, then the reasons. i had been excited about coming here primarily because, having come from Cali, i'd been foie gras deprived. We had ordered... ~foie gras torchon:super cute on the presentation, it was up to standards, but nothing to give me a mind blowing revelation about food. i'd have preferred to have gotten a nice fatty steak of foie gras, but.. ~legumes de (i'm assuming décembre since that is when i went) again, super loved the presentation, although this salad consisted of two mushroom shavings, two radish shavings, an inch of green bean that was cut in half, half a baby beet, quartered... you get the point. what made this salad awesome was the sauce-- i can't call it a dressing cuz it was so thick, but whatever the sauce and the crumbly stuff was in it, it was super delicious. (photo:: yelp.com/biz_photos/db-b…)~brussel sproutsthey were all tiny and came in this cute little pot ^_^ vbut otherwise.. nothing to write home about. we had actually ordered ~grilled escargot en cocotte as well, however, after waiting... and waiting... and waiting some more... it never came. and at that point, there was enough downs in the service that my date was fed up and just wanted to leave  ours was one of the small tall tables situated on the second tier, next to the host podium.  so we got to watch as ALL the other customers came in and had their jackets. scarves, coats, etc. offered to be hung (which we did not, and as a result, had one hell of time trying to fit all our stuff into the tiny space we were allotted... hell, it might have been a bit easier had ANYONE bothered clearing any of our finished plates.. ok ok, exaggeration. they cleared one or two after 15 minutes of trying to flag someone down.. which is funny when you think about since we're sitting in a prime foot traffic spot. it seemed as if though everyone would pass by our table walking sideways with their back towards us.  so basically we spent the time being ignored. took us minimum 15 minutes to get anyone's attention without being loud and rude, and they forgot one of our dishes. FREAKING AWESOME DINING EXPERIENCE... NOT!! ****i was trying to pin point the reason for the gross neglect from the staff:: my only observed differences between us and the rest of the patrons was our SKIN COLOR and our perceived AGE. === doesn't matter how good the food is, shit poor service will spoil and rot your entire meal.",4,2,3
152,Claudia P.,"Burlingame, CA",1,31,4,3.0,8/6/2015,"Came here for my 5th Restaurant Week Summer 2015 meal. My first Daniel Boulud restaurant.Things I ordered:- Beef tartare: not on RW menu, but it was okay. Not memorable- Soup du Jour: chilled corn soup - I never thought I would like chilled soup, but this was delicious- Cod: was good- Almond Dacquoise: was also delicious :)Overall: 4 stars for food. Docking 1 star because of service. That guy didn't even try to pretend he cares after we said we're not ordering drinks. Was expecting more for service.",,,
153,despina s.,"Harrison, NY",0,50,2,5.0,4/11/2017,"My cousin raved about the ""infamous DB burger"" and we decided to have brunch there before a matinee. The burger does have a lot of stuff in it, so be prepared! Put it all together and it makes for one amazing meal! And a fantastically prepared dessert that was a piece of art..prepare for a very decadent brunch...that is worth every single penny.",,,
154,CHRISTINE Z.,"New York, NY",73,276,32,4.0,11/24/2014,"I have been to one other DB place--DBGB Kitchen and Bar. But I've always wanted to try his other places--eventually I will go to Daniel, but for now, db Bistro Moderne it is. I was taken here for a pre-Broadway show dinner by my boyfriend, and it was a great experience overall. We arrived right on time for our 5pm dinner reservations, and the hostess greeted us courteously before showing us to the coat check woman. She took our coats and handed us a plastic ticket to pick it up later. I'm impressed at how she manages to keep everyone's coats in order, since she took two other couples' jackets at the same time. We were seated in a corner table, with one side being part of a long booth. We were right next to the door that leads to the labyrinth that takes you to the restrooms. Our waitress was professional and prompt. She allowed us ample time to decide what we wanted to eat and drink--no hovering, which I appreciated, even though we took a significant amount of time to choose. We started off with 8oz of Malbec each--$24/mini decanter. The wine was good quality, and I enjoyed it very much. Once we placed our orders, we were given a ""welcome"" dish from the chef--two tiny cubes of mushroom quiche. For appetizers, we got the bone marrow, pumpkin crostini, and tarte flambee. The bone marrow was served on the bone, with toasted bread on the side. The marrow was rich and delicious, but was difficult to pry off the bone. The pumpkin crostini was refreshing, not too pumpkin-y, and the perfect mouthful. The tarte flambee was sort of like a mini flatbread pizza and was also well done. For his main course, my boyfriend got the bacon-crusted halibut, and I got the mushroom risotto. Both choices were wonderful, though they took a while to prepare. Luckily, the wait staff was understanding when we asked them if they could push our orders up since we had a 7pm show to make. The halibut was cooked to perfection, as was the risotto. I've only had better risotto in France, where I think just about everything seems to taste better... But this risotto was creamy, and savory without being overwhelming or too heavy. I could have eaten another serving, easy. For dessert, they gave us three miniature pastries--a blueberry jelly, an orange macaroon, and a little cake. The space's décor was pleasant and offered a mix of contemporary chic (the ""moderne""), and traditional dining. The chic aspects included a triptych of close-up photographs of a bicycle in black and white with accents of bright red that matched the walls. The traditional was present in the carpeting and the mirrors everywhere. The layout of the place is intriguing. Once you walk through the 'exit' door that leads you to the bathroom, you can see through the glass to the tables on the other side of the hallway. But trying to get back to the side entrance is a doozy. I had to help another woman get back to the main part of the restaurant.",4,1,1
155,Kristina Q.,"New York, NY",42,21,2,4.0,7/21/2015,"I came here with my boyfriend during our weekly date night a few days ago. The decor is moderne with interesting photos on the walls. Unlike what some yelpers say, I didn't find it stuffy at all. The noise level was not too loud so my boyfriend and I could actually hold a good conversation. The service was great - very attentive but not overbearing. I appreciate the amuse bouche and petite fours that came with our meal - things I always look forward to when going to fancy french restaurants.Appetizer: We shared the artichoke dip which was good. They didn't skimp on the dip, which meant we could use the rest of the bread from our bread basket to polish it off.Entrees: I had the coq au vin and I'm a fan! It was so delicious and savory, and the meat fell off the bone. I would get it again. My boyfriend got their famous burger, which he said was ""good but it's not for people who like burgers"". I'm not quite sure what that means. I guess don't get it if you're a burger lover looking for a good burger. Dessert: We had previously been to Daniel Boulud's other restaurant, Boulud Sud, and I remember the desserts there being very good. DB must really like his desserts because our desserts here were equally delicious and beautifully presented. I got the raspberry and nectarine bellini: so light and refreshing! Not too sweet. Perfection. My boyfriend got what we joked was a fancy smore, toasted marshmallow with dark chocolate and graham ice cream. He liked it though. I liked my dessert better :pAfterward we joked that he got the fancy kid's menu. Still, it was overall a good choice for me and I would come back and stick to the traditional french items on the menu.",,,
156,Derick W.,"Burlington, VT",7,156,42,5.0,1/25/2016,"A local recommended DB before a show.  Had reservations at 5:30 just to be sure I would not miss my 8:00 show.  No worries as the staff is extremely accommodating, asking the time of the show and planning our dining experience accordingly.  However, by 6:30 the place was packed so it was very nice to have an hour when it was ""slow"".  Had the price fix dinner.  The beef short ribs are phenomenal!!   !.   Tasty w/o an ounce of fat showing.  My wife upcharged her dinner for the burger (extra $14).  That was also excellent.  The wine is on the pricey side (but it is NYC) but the wine specials with the price fix dinner was a good value.  Its my new favorite pre theater dinner place.",1,,1
157,Jason S.,"Morris Plains, NJ",8,51,12,4.0,1/23/2015,My wife and I were going to see Billy Joel and wanted a nice dinner beforehnad but also one that we didn't have to get super dressed up for. We had previously been to Bar Boulud and thought we would try this restaurant. It is small inside but we did not feel cramped at all. Because Billy would not take the stage until about 9 we could take our time even though we had an earlier reseravtion. This allowed for a nice unrushed pace and we could order of the full menu rather than just the pre-theater menu. Our service was very good. The waiter was present but not rushing at all. As for the food. We shared the bone marrow and charcuterie  then my wife had the white truffle raviolo and I had the veal cheeks. These course were very good however dessert was soso to the point that two weeks later I don't remember what we had.If you are in midtown/times square/theater district I would definitely hit this place up.,1,,1
158,Mike O.,"Iowa City, IA",4,105,0,4.0,5/20/2015,"Great food and alcohol that is pricey, but you get what you pay for.The bone marrow app was simply fantastic.  I haven't tried that very often, but will in the future, hoping that it's as good as it was here.Our drinks were all fantastic- good selection of wine and beer that tended towards the expensive side, but this is a nice place.I got the famous burger, and it lived up to the hype.  I was very happy.The fries that came with it were OK.  I was expecting more, but fries are fries.The service was mediocre.  The waitress was a little standoffish but attentive",,,
159,Bradley M.,"Romulus, MI",189,228,126,5.0,10/12/2015,"This bistro offers amazing selection of food, service's usually great, great wine and cocktail list, ambience's cool and chic (however- it's very busy most of the time, I'd always make a reservation), noise level's extremely loud in bar and moderate in formal sitting!!Foie gras burger's outstanding!!!",,,
160,Jennifer N.,"Houston, TX",232,394,916,4.0,6/23/2011,"We'll start from the great to the not-so-great.-Pomme Frites: yes, the frites were the best thing. Probably one of the best frites I've ever had - flavorful and crunchy and in a cone. Who wouldn't love that? We killed the frites!-Le Menage Trois (a trio of their 3 croques monsieurs - classique, moderne, provencal): the best of the three was the croque moderne: duck fonfit, goat cheese, figs, arugula salad. If I were to come back, this is definitely what I would order. -Lobster salad: fresh flavorful salad with pesto dressing. A must if you're in the mood for something light.-The Original DB Burger (Sirloin burger with truffle and foie gras): I was actually disappointed in this burger. The burger lacked flavor... even with the foie gras inside! The worst part of the lunch, the server. He was so snobby ever since we sat down and didnt order a glass of wine like the other patrons. He was probably upset because one couple split a plate. Never stopped by to see how we were doing either. Luckily we were satisfied with our meal... I was eager to put 3 stars due to his snobbery, but the food made up for it.",,,1
161,Ali M.,"New York, NY",31,234,245,4.0,11/22/2014,"IN SHORT: What happens when a superstar chef from the upper echelons of the culinary world tries his hand at a more informal dining experience? The answer is DB Bistro Moderne, and the result is a refined, high-class setting that nonetheless relishes in simple, rustic flavors.THE STORY: Amidst the shining towers of Midtown and just a few steps away from the heart of the Theater District lies Daniel Boulud's take on elevated French bistro classics, where a burger actually means the one and only Original DB Burger stuffed with foie gras on a black truffle parmesan bun. With ingredients like these, it quickly becomes clear that even as it tries to relax its airs, high-quality food and expert techniques are still the primary focus in this comfortably elegant space.For a pre-theater dinner, DB Bistro is the perfect experience to share with a date or with family (my own mother adores this place), and the 3-course prix-fixe for $48 is a steal, still exquisitely crafted to its clientele. The Kale Salad with honey crisp apples, walnuts, and maple vinaigrette is light, sweet, and absolutely not to be missed, and no matter the time before the show, the service will make sure that your lovely and tasteful meal is brought out in a timely, yet still restful and unhurried manner.",2,,1
162,Troy L.,"New York, NY",64,195,13863,3.0,8/19/2012,"Service: Great. Waiter was attentive. Refilled water when my glass was low. Folded the cloth napkin when i went to bathroom.Food: Provided free bread and cracker sticks. DB burger was good. I would say inbetween Five Napkin and Five Guys. Fries tasted like they came from McDonalds. Australian Rack of Lamb was new on their menu as of 8/18. They changed how they made the lamb. It use to be different. Lamb was okay but for $44, I expected more (there were only three pieces) and I barely tasted the spice. Try for yourself if you do not believe me. Waiter was nice and provided a small dessert at the end of dinner.Bathroom: Pretty clean but is out of the way and there was only two. You had to walk out of the restaurant and its inbetween the hotel and restaurant.Restaurant: Nice environment. Good to bring a date because they have two person seating and group.",13,5,8
163,Corey Yolie M.,"Corona, CA",50,222,373,5.0,5/6/2015,Went here with my husband on our first day in New York. We sat at the bar and I ordered a glass of the rose wine (which was amazingly delightful and sweet) and my husband got a beer. We also ordered a spinach dip appetizer which was very good and cheesy. We loved the giant window that looked out and we got to people watch and enjoy our food and drinks. Very nice atmosphere and a nice place to go. Our bar tender was very helpful and very nice.,,,
164,. ..,"Beverly Hills, CA",393,609,2648,5.0,8/14/2014,"The Original DB Burger - Sirloin Burger Filled with Braised Short Ribs, Foie Gras, and Black Truffle, Served on a Parmesan Bun with  Pommes Soufflées. LEGENDARY.",3,3,2
