,er_name,er_location,er_freinds,er_reviews,er_photos,er_rating,er_date,er_text,er_useful,er_funny,er_cool
93,Dana E.,"Chicago, IL",24,18,17,4.0,6/27/2015,"I don't understand how anyone can rate TheBox with anything less than 4 stars!  The shows were very artistic, and creative!  The ambience was  incredible! It was defiantly a unique place!!",2,2,
94,Sarah G.,"Brooklyn, NY",51,2,0,1.0,3/23/2016,"If you're desperate enough to be treated like shit to see a shitty show, go for it.",4,3,
95,Mitch E.,"Brooklyn, NY",836,1027,445,4.0,1/6/2013,"I don't think describing this place with words can do it any justice so let me just tell you what I saw.The first act was some guy pulling some Cirque Du Soleil stunts which were pretty amazing. The second was a male and female pair of fire eaters who wore little to the imagination. They acted quite naughty towards each other and put on a great show. The third act involved a clown. The clown came out wearing a diaper and a leather jacket. The clown was drinking a bottle of what appeared to be whiskey. The clown then took off the jacket to reveal they had breasts. Then took off the diaper to reveal they had a penis. The transsexual clown then proceeded to urinate on the people in the front. Interesting to say the least. The decor inside was beautiful. Girls swinging from chandeliers. Great time.It's a once in a lifetime experience, I think everyone should do. It's real hard to get in so don't expect to just show up and be allowed in. You either got to drop serious cash, come at the right time or know someone. The drinks are also really expensive. If you think $15 dollar drinks are expensive, you know nothing about this place.",16,6,6
96,Lihn N.,"New York, NY",0,18,3,1.0,3/17/2016,"Bouncer is 5' nothing and has a major Napoleon complex.  Unless you're willing to suck his methaphorical dck to make him feel good about himself, don't bother.  We managed to get in as girls, but not without his unnecessary attitude. Drinks are insanely expensive, which is fine, but the experience feels cheap and desperate when the bartender circles the 20% suggested gratuity on the receipt.  Show is interesting but not worth the drama if you're not absolutely DYING to see a freak show / something different in NYC.",5,,
97,Aaron W.,"Framingham, MA",0,3,0,1.0,10/7/2014,"I was defrauded hundreds of dollars by their waitstaffI booked a table and pre-paid tax & tip, when leaving the waitress was INSISTENT tip was NOT, and NEVER included in the bookings. I reluctantly provided a tip on what I assumed was the service total, and upon checking my receipts at home, discovered I had been fleeced for a 2nd tip on top of the original service+tip+tax amount!",52,2,
98,Heather C.,"West Palm Beach, FL",323,407,165,5.0,12/6/2014,"I think what this place has turned into is another club with a Studio 54 Vibe at the door and the vibe continues on the inside after midnight or so. This was my second time being there, and all I can say is each and every main show on the stage was different each time I went.This is like walking into a David Lynch film and witnessing an American horror story freak show, show. So, of course I LOVED the vibe.  It's out of this world. Think David Bowie, meets Elton John (before Disney) Meets David Lynch ALA Twin Peaks, meets Studio 54.My friend made a joke about how our drinks / bottle ONLY came to about $1, 400.00 but I was not sure if he was serious. He was actually acting like it was a good deal, being a private kind of club scene and all and there, right next to us was Mr. Wolves of Wallstreet.  For his privacy, I won't mention his name, but let's just say that he was laughing and having the best time, right along with everyone else.  You have to go in with an open mind, and expect NOTHING.  This way, everything you see, will be a huge surprise, because each night is completely different. I love Cirque performers and the shows they put on, and this place was a jaw dropping ...Beautiful bends and twists.  There are a few acts where you will hear yourself saying aloud....""OH MY GERD!!!  did they just do THAT?""?  Yes, it's that kind of place.  So of course, I was right in heaven.  I'm not going to give away spoilers of the great performers I saw, the beautiful fun costumes or even how the vibe in this place feels like you would see the owner Steve from Studio 54 peeking out over the DJ booth (I've heard from older friends that, that's what he used to do. Just smile down upon his 'Party'.)So Go. Just Goooooooooooooooo and don't look back. You're life will never be the same and think of all the stories you can tell your friends about this place and the things you saw, and think of all the stories you will be able to tell your grandchildren. I do suggest NOT dressing like a frumpy sow. Ladies, class it up a bit and wear some make-up and maybe some heels and do your hair. Don't expect to be allowed in wearing your yoga pants, your Birkenstock's combined with the infamous NYC faux Pas  ""Sex and the City 'scrunchie' .......that Burger wrote about, in an episode of that show. No no no no.  Also do not expect to be let into a night club wearing a t-shirt and low to your knees baggy ass  jeans. I'm sorry, but the nights I was there, NO ONE was wearing t-shirts, jeans or hats. The crowd was from every walk of life and all races, but they were dressed as if they actually spent some time choosing an outfit to go out on the town. Hair and clothing represented a 'night on the town'.   Because of the high demand to get into this club- the owner has a right to be selective about who he lets in.  There's no excuse for butt-head behavior at the front door, but some people just can not take the word 'NO' for an answer.  What they should do- is simply say ""I'm sorry but we're all booked for this evening""  not 'get lost' with the hand gesture to shoo away.  That's just rude.  Even at 54 there were no verbal insults at the rope, because I know of so many older people who actually went to Studio 54 (not just saw the movie like myself) and they said a simple shake of the head no, with eye contact was all that was needed. Then one was ignored.  There's no place for verbal abuse and degradation. It's just not good for the soul.  However, that being said, if you pay for a bottle and a table, there should be no attitude with you at the door.   Everyone IS the same, but that does not mean one can show up looking like a slob or some baggy jeaned , boxers hanging out hip hop hooray hooligan.  Dress nice and dress classy. That's all this club probably wants.  Inside is where the sloppy begins, not outside in front of the door. Just GO!  You won't regret it.",10,9,4
99,Zoe L.,"Manhattan, NY",0,2,0,4.0,9/19/2016,"It's so funny reading all these butthurt reviews about not being able to get in and the place being too pricey. I went with friends and had the BEST GODDAMNED TIME. The acts were varied and ranged from beautiful arial work to pseudo BDSM stuff to wtf-omg-my-jaw-has-dropped-to-the-floor-I-can't-believe-what's-happening-in-front-of-my-eyes. Though the acts change every week of so, keep in mind the show is not for the light of heart. Yeah, there may be bodily fluids, and yeah Ms. Rose Wood's performance is.... unexpected to say the least, but it's a fantastic place to go when you want to see something that would make a suburban Christian mom want to pray for your eternal soul. It's the place to go when you want to chuck the taboos and inhibitions of polite society out the window and over a cliff. If you don't want to see a girl fuck a Donald Trump doll 'till she squirts, that's up to you.Oh and be warned of the ""Splash Zone"" which is the chairs and benches directly in front of the stage. Try sitting in a side table to avoid... fluids.",,,
100,K. M.,"Los Angeles, CA",197,11,3,1.0,12/14/2016,"If I could give this place zero stars I would. Whoever runs the door here should be fired. Not only did they let rowdy drunk guys who were obviously his friends in but he made inappropriate comments to the women in front of us stating that they weren't welcome there. They stated multiple times their willingness to spend money on bottle service (like seriously what a fucking idiot, if I was the owner I would be pissed). But this was no good to the pig of a host who even went as far as stating he didn't want their business. What did these women do wrong? Nothing. This was probably the most disgusting way to handle business I've ever witnessed. He made misogynistic comments toward these women as well as refuse them entry. I felt so sick by this display that I left immediately. Who in their right mind hired this person to be on the door. I would never ever set foot in here. Not even if you paid me. People shouldn't be devalued because of a rouse to keep an air of exclusivity to some shitty overpriced piss hole.",7,,
101,Subilak K.,"Little Falls, NJ",27,55,92,1.0,12/31/2016,"Probably the worst experience going out in the city this year. First of all even though despite the fact we had a reservation made at least a week in advance we were still made to wait outside on line for over half an hour. The rude door staff and security were brutish and were letting people in ahead of us who were tipping them what seemed to be at least $100. Very unprofessional. When we finally got inside the place was quite packed and we  had to fight our way to follow the host to a table on the second floor which was very cramped and by the time we sat down and removed our coats, two separate patrons and knocked into the table. We all ordered drinks which came but with a almost nasty request from the waitress to ""purchase some type of bottle or your going to have to go downstairs and stand for the rest of the evening."" Now I dine and go out a lot and don't mind paying the price for decent wine and food but the list she gave us has basically bum juice starting at $490 a bottle with your average champagnes and Liquors that you can buy in a regular club for 40-120 being priced at 600-1800.  Overall it seems this place was likely once a hotspot on the artisan circuit but has become something quite undesirable.",5,,
102,Catherine C.,"Elmhurst, NY",721,255,952,2.0,1/17/2016,I gave this a chance. The show supposedly starts at 9pm but we waited maybe over an hour. We got bored and ended up leaving before the show even started.,4,2,
103,Alex R.,"Chicago, IL",29,22,0,1.0,9/25/2014,"In Order of Importance: 1) Good luck getting in. 2) Pushey mc-pusher-stein on the bottle service front. 3) Have a vagina or expect to know someone ... lest ye be judged. 4) Don't care how cool the show might be, no one deserves to be treated this way outside of Vegas.",9,5,2
104,ella k.,"Brooklyn, NY",21,103,20,5.0,11/5/2014,"Anyone that left a negative review only did so because they 1) could not get in or 2) are tourists. This place is the epitome of what a NYC club is and should be. Ok, door is strict - - -NYC is notorious for their strict door policies to maintain exclusivity of a venue, especially when it's such a small venue as this one. NYC is not your Vegas with it's ginormous clubs that let anyone in with a prepaid ticket or bottle purchase; it's also not your Cali with dingy little bars and clubs with no face control that shut down at 2 AM; nor is it your Miami with half-naked girls running around. In one word, I would describe this place as ""posh."" The ambiance is perfect, the drinks were strong, and the show was ridiculous. It's everything I had imagined and more. I loved the decor, with tons of mirrors at every angle you turn, chic chandeliers, and swanky lights. The music started off as deep house for more of a lounge feel and then became hip hop --- perfection! And there was something about the smell of matches and the candle lighting that really completed the whole ""feel"" of the place.I strongly recommend getting bottle service though. The show is hard to see from the crowd. A million percent coming back and convincing all of my friends to host their birthdays here!",6,1,4
105,Joshua R.,"Manhattan, NY",20,24,14,1.0,10/22/2015,"Rude, pretentious, not worth the attitude or the price. Find a better way to spend your money and night.",10,,1
106,Ruggy J.,"Manhattan, NY",4932,2413,5152,3.0,5/11/2012,"Wow.I'm not much of a math guy, but something tells me that four vodka sodas + two shots of well tequila shouldn't result in a bar tab of $132 (including auto gratuity... what?!). I get that I'm in New York, but seriously? Le sigh...Besides that absolutely astronomical cost of libations, The Box is a great little change of pace to the usual bar and restaurant routine in NYC. By no means is this a secret lair, so most anyone in LES knows what to expect when sauntering through their front doors. It's dinner theater with antics that will blow you away, so you sort of have to pretend you're paying for a ticket to Cirque du _____ (insert production). Strangely, the performance I witnessed was almost worth the triple-figure round of rotgut. Certainly a place I'd come back to if the time were right. Avoid this place like the plague on the weekends if you know what's good for you. But you already knew that, right?",34,18,12
107,Marie S.,"New York, NY",55,263,190,2.0,3/6/2016,"This place got progressively worse as the night went on. By 2 am the room was filled with cigarette smoke. Bad surprise! The performance art was truly bizarre, I shudder to share the details. It was so gross I think everyone should go here just to experience it. Bring a mask to filter out the smoke & conceal your identity. This place is one of NYC's most bizarre nightclubs. Zero stars for the smoking. Five stars for the authentic weirdness.",1,1,1
108,Tamara H.,"Manhattan, NY",121,353,373,3.0,1/12/2013,"So I've been looking to drop in here for quite some time. Finally, I was able to check this place out a few weeks ago on a friday.The shows are really fantastic, weird, eery, and great entertainment. I only saw the ""2nd show of the night"" as it was announced, around 2am. ""Slave master"" act was awesome.However, I did not come with a table, and the place is just too small. The crowd was eclectic (table full of transvestites in different wigs and fencing masks). If you don't have a table it's not worth it.",3,,1
109,Oyku S.,"New York, NY",57,12,4,4.0,5/20/2016,"Very cool vibe and great music (Dj Brooklyn Dawn). Loved it. Had no trouble getting in, experienced some of the weirdest shit haha. The bartenders were rude though.",,,
110,J K.,"Denver, CO",38,67,8,5.0,4/25/2014,"Love, love, love this place. This is not where you go if you want to stop by to see your local super friendly bartender and order cheap drinks while you listen to the jukebox. It's packed. It's hot, its sexy. Sometimes it's x-rated. Dress to impress, enjoy the lush ambiance, drop some cash, and expect to be thoroughly entertained (and even shocked). The music is great and the acts are like nothing you've seen before. Is it pricey? Yes. Is it over the top? Yes. Is it awesome? Oh yeah it is.Not for the close minded or inhibited.  Go. Just go.",10,4,4
111,Hadas N.,"Los Angeles, CA",233,23,29,1.0,11/19/2015,It's one thing to be exclusive and unique and a totally different thing to be snobby and rude.,4,,
112,Dee M.,"Los Angeles, CA",131,22,0,1.0,4/5/2017,"I have never been treated so disrespectfully anywhere else in my life than this place. We were in the area for dinner so decided to Google where to go to drink and dance. I was here on the night of my birthday - a Friday night. The bouncers treated us like dirt on their shoe. We waited at the top of the line for over an hour in the freezing cold, the bouncer knew we were there for my birthday, even still we stood outside for longer, while we watched TONS of people stroll in who either paid the bouncer off or knew them. When I politely asked several times how long it might be, or why other people were let in ahead of us I was greeted with nasty silence and a look up and down. They almost ruined my birthday night until we had an amazing night in a bar down the road. I would literally NEVER recommend this place unless you are in to scene-y bars where the bouncers play God. If you're not going to let people in fairly, then you should have the decency to let them know there is a possibility of that happening. Just the worst.",6,,
113,Laura M.,"ASTORIA, NY",285,107,84,2.0,6/29/2015,Not nearly as exciting as everyone made it out to be.  Drinks are way overpriced.  $19 for a vodka/soda?  Give me a break.  You're not that special.,9,1,1
114,William N.,"San Francisco, CA",2,113,1,1.0,5/11/2015,"The cheapest bottle service is about $1000, and goes up to over $25,000-   It is essentialy and old dirty garage theater.   I understand  that exclusivity feels  good, and supports our fragile human egos, but this place really is absurd.",16,4,
115,A G.,"Manhattan, NY",32,203,49,4.0,1/5/2014,"Like this place a lot. Ppl need to realize its a show and you have to pay to get in. You don't walk up to a theater and be like ""hey let me in for free"" so this isn't any different. Great crowd. Great acts. Drinks are obviously overpriced $19 for a vodka soda. They should really add a mixology component to the place, I think that would add a lot. My other complaint (not their fault) is that you're usually too f*cked up by the time the acts start (~1:30am) to enjoy them or know what's going on.",5,8,2
116,Paul S.,"New York, NY",31,60,8,3.0,9/2/2013,"So, I want to be much more clear than most of the reviewers of this place that I looked at prior to coming.  There is a very solid chance that during one or more of the 3 shows that go on between 1am and 3:30am you will see penis, breasts (sometimes on the same person),  vaginas and sex between men, women, and genders in between.  Now it is not Caligula at least I did not see any animals on stage... there was an alleged Leonardo DiCaprio sighting however.  Word of warning, do not sit in the front row or what I call the splash zone ;o)For the most part it is all in fun and the vibe is very cool.  The singing and legitimate dancing and rope / pole work are very well done.  There are some things that make you shake your head and seem to be clearly done for shock value.  I won't spoil it for anyone but you'll know those moments when you see them.  When the show is not going on it is a nice spot with good music and drinks.  Bring lots of money or bring someone who has it because these folks are reinventing the words mark-up and with absolutely no remorse about it whatsoever.  I can't say that this will be a regular habit for me but everyone should check this ""Box"" at least once.",16,10,3
117,Wendy V.,"Chicago, IL",11,64,0,2.0,7/1/2013,"We made a reservation for bottle service, one bottle (at a min of $600 btw), and we were told that would get us  reserved ""seats at the bar"". Having never been to the place, I assumed the bar was in view of the stage and that our seats would be looked after should we decide to get up and wander.  Wrong and wrong. We got in the door no problem, the hostess marched us to the bar, handed us the bottle menu and left us. The bartender looked at me like I was speaking in tongues when I asked her where our seats were...she pointed to two seats at the end of the bar with no view of the stage. When I asked her if she would ensure our seats would stay reserved if we got up to walk across the room to see the show, she said ""I'll do my best."" K. So for almost $800, you get barstools that I almost got into a fight over when a lovely gem of a gal told me after I got back from the bathroom that it was now HER stool, no offer of mixers besides cranberry juice and soda for my bottle, no view of the stage, and feeling like I had to genuflect every time I asked the bartender for more booze from OUR BOTTLE.   Oh and let's not forget the added 20% tip. Totally.Lets talk about the ""show"".  One very olde time burlesque erotic act, followed by extended hiatuses where drunk patrons were on the stage dancing. DJ was good, ill give em that. There were a total of about  I dunno, 5 acts over the course of 5 hours, and guess what... I couldn't see any of them, except for the swinging trapeze artist over the bar-- actually, I take that back, I could see about 30% of the stage as reflected in the mirror over the shoulders of some of the pushiest rudest people I've been around. I mean literally shoulder checking each other to get a view of the stage.  Use your words, people. There was one act that is for pure shock value, I won't reveal it, but it certainly was not worth the 5 hours and $$$. Upstairs is off limits. Don't know how you get up there but some of the other reviews made it sound like you could wander up there--wrong. Again, bottle service without a table gets you jack shit. Purported Dress code and cell phone rules: despite the numerous yelp reviews (dubious in nature IMO), there were people using their phones all night, everywhere and even taking pictures with flash. And the rumored dress code...? Uh, high tops, skinny jeans, cut off tanks, baseball hats, tshirts with sleeves cut off, there is no F'ing dress code.Unless you want to drop a min of $1600 and get a table, the barstool reservation is a sham, just go to forever 21, buy the entire look off of a mannequin and buy individual cocktails. And wear 5"" platforms. This advice is for guys too.",34,31,5
118,Aida D.,"Harlem, Manhattan, NY",1,2,1,1.0,12/22/2015,I had the wost experience here. Drinks where over price ambiance not existence and the bouncer where super rude. Service was incompetent and unprofessional. I will not recommend this place to even be an option in Nyc. If u want to do ur self a service please don't ever come here.,1,,
119,Meredith M.,"San Francisco, CA",638,543,175,4.0,8/12/2011,"You know all those ""hot clubs"" Stefon from SNL is always promoting? Well, these places actually exsist, and they exsist in The Box nbc.com/saturday-night-l… I hear the box is great on Tuesdays, however I went last night (Thursday) and had an amazing time. Surrounded by an attractive, outgoing and young crowd, The Box possesses a sort of taboo ""naughtiness"" that is only allowed in nightmares- ah I mean dreams.Go here with an open mind, and I guarantee you will not be disappointed. Think night club lounge meets burlesque show, mixed with a little bit of sideshow circus. Effing unbelievable. It's so weird and messed up that it's genius.Try to get a table down front (there are 2 levels of tables), preferably the ones with the couches. The hostess usually interacts with these tables and will pull you on stage,....or pee on you (....seriously, watch out for urine).There are 4 sets of shows, 1am, 2am 3am and 4am. Each show progressively becomes more and more bizarre, and more and more ""WHAT!? OMG EWWW WHAT!? I CAN'T WATCH! WHY AM I WATCHING!?!? OMG!!!"" Stay for the last show, take the following day off and allow yourself to get wild with all the others dancing on the couches around you. Good music, good fun and absolutely no morality. Loves it.",9,10,6
120,Dave G.,"New York, NY",55,233,0,2.0,12/20/2014,"The place itself was very unique. Cabaret show was entertaining and a little racy. Found the place to be way to warm and was sweating towards the end. Unfortunately, the reason why I gave this place such a low rating is that they scam you big time for drinks. Ordered 2 vodka sodas for my friend and I from the bar upstairs. Was expecting speed rack liquor since that was what I asked for...wasn't paying attention and noticed she was pouring Belvedere vodka into the 2nd drink...probably the highest premium they sell. I said whatever, how much more could it be...ahhh how wrong I was...19$ per drink! Ok fine, it's NYC and some places can charge these ridiculous amounts. problem was, when I gave my credit card and received the bill, it looked like every other standard check I've ever gotten. Found out the next day, they AUTOMATICALLY add 20% to your drink tab!! And the normal line for tips says, ""additional tip""!! Normally I would see this, but they keep this place so dark, you don't see it! So I ended up tipping an additional 2$ and ended up tipping her almost 10$ and spent 46$ for 2 vodka sodas...total scam!! My advice...buy beer...they were only 7$, and pay cash!! Just went to the website where they post this...A 'show fee' in the amount of 20% of your food & beverage costs will be added to your bill. This Show Fee is NOT a gratuity & is not distributed to the service staff as a gratuity. Rather, all service team members are paid a direct wage that is at least equal to the minimum wage. Tipping is not required or expected. The show fee is used to offset operational costs associated with the performances staged at The Box.What a joke...it says right on the receipt below this bogus charge, ""ADDITIONAL GRATUITY"". Therefore, it IS a gratuity! And they bang you a 23$ ticket fee...wouldn't that offset operational costs??",,,
121,Amir J.,"Manhattan, NY",9,25,4,4.0,7/29/2013,"The bartender was great and very accommodating. He took care of us all night long.I really liked the vibe at the venue. The shows were over the top but entertaining. The crowd was a good mix of quirky and good looking folks.Of course the ambiance was great but perhaps my favorite aspect of The Box was the fact that pretty much everyone was dancing between the shows. It was a great vibe and one of those NYC experiences that everyone should try once.I might not be running to the box every weekend, but I'm sure glad I went.",6,2,1
122,Michael G.,"New York, NY",114,18,2,1.0,6/5/2015,"Doesn't deserve even one star. Host was rude, doorman was rude and on a Thursday at 3:30 couldn't even get one drink. Worst spot in NYC",3,2,
