,er_name,er_location,er_freinds,er_reviews,er_photos,er_rating,er_date,er_text,er_useful,er_funny,er_cool
0,Ryan Z.,"Manhattan, NY",9,76,4,5.0,"8/12/2018
            





Updated review",wow... the box never gets old and my friends from out of town think im a weirdo for always bringing them here... this review is for the staff who is always the best! my friends diamond stud dropped out of her ear at the beach party last week... sand is everywhere i know theres noway we can ever find it... but some of the staff stood there with flash lights for 10 minutes and alas somehow some way i find it!... although i did take this girl her on a first date after eating at zzs clam bar and welll it didnt go well hahahaha ;),,,
1,Kristin Y.,"Brooklyn, NY",163,276,1,1.0,7/7/2018,"It's NYC and it's 2018 - how are there any racist establishments!!? As a white female, it is pretty rare for me to personally experience what I know a lot of my non-white friends go through. Last night my girl and I were out bar hopping and she wanted to go to The Box. My friend is a beautiful, intelligent, bad ass, couture wearing, lawyer - who is also really high up the corporate food chain at a major int'l bank. She can run circles mentally, physically, and financially around most people I know! Oh, but I shouldn't forget to mention the only detail The Box seems to care about - she's black. When we got there the guy running the door (who was dressed like a bad 80s Beetlejuice), was informing two white dudes it was $700 to come in. The two dudes quickly conferred and said no thanks. My girl stepped up to the rope and waited to be acknowledged. Ugly Beetlejuice looked around and pretended like nobody was waiting to get in. He says a few things quietly to one of the bouncers, who also happened to be black, before he eventually visually acknowledged my friend with a subtle eye roll. He walked over and she tells Poser Beetlejuice it's just the two of us and we'd like to come in. He made the subtle eye roll again and explained he's not the one who decides who can come in and another guy will be out shortly. With that, he took leave and went back inside. We're standing there another several or five minutes when three white people rolled up. They all shake hands with the black bouncer and are quickly shuffled inside. This was the point where I quietly started to suggest to my girl I didn't wanna hang out here. That had just confirmed exactly what I had been thinking - this place is racist and they're ignoring us because my girl is black. My girl still wanted to go inside so I quietly stood behind her and and continued watching. More white people kept rolling up, shaking hands with the black bouncers, and being let inside. Finally, I see a group of females, dressed in the most visually offensive way - and wearing things that honestly made me think ""I wonder how they're getting let into any bar dressed like that?!"" They all had sort of a gutter punk look but one was specifically only wearing a fishnet like top that left nothing to the imagination as her nipples, breasts, gut, and everything in between were on full display. She was also maybe not the most fit lady and I'm not hating, do you - but my thoughts were literally ""who's letting her in anywhere dressed like that?!"" It was then I realized they were also going to The Box. Needless to say, but I'm gonna say it, the gutter punk girls were all white. True to form, a couple smiles, a few handshakes, and boom - they were welcomed with open arms. Meanwhile, the bouncers and the door guy haven't looked in the slightest direction towards my girlfriend who had been quietly and politely waiting. At this point I was so furious - and I knew she had to be too - I told her ""I'm not going in a place like this. I don't wanna be around that kind of energy""! After having watched a dozen or more white people have zero issues entering - I was pissed! I grabbed my girl and walked away.What's also disgusting is this establishment uses black men as bouncers to not allow in other black people! That feels like some oppressive slave owning shit right there! It made me think of that scene in Knocked Up when Leslie Mann is trying to get into the club and is yelling at Craig Robinson. Finally, Craig tells Leslie that he's only allowed to let in a certain amount of black people. Gross. Gross. Gross.Here's how I see it. If you are one of these black bouncers reading these reviews about this racist establishment, it's time for you to respect yourself and get a new job at a place that treats people equally! There is no reason in my mind why you should be subjecting yourself to that sort of environment! If you are a person who has been to The Box and likes going to The Box, maybe you should consider going anywhere else! This also goes for you people reading this review looking to go to The Box for the first time! This is NYC! It's the greatest city on earth! There are hundreds upon hundreds of establishments that support equality and good vibes - who also apparently make better less expensive drinks!! By continuing to be a patron at The Box after reading these reviews about their very clear racist policies - you are supporting inequality and racism yourself! Be the change and spend your hard earned dollars somewhere that respects all people! This post isn't about a crappy bar that charges too much for drinks. This post is about systemic racist issues that continue to plague and stain our country! This post is a PSA that it will not be tolerated! And to the owners of The Box who I'm sure will eventually read this... karma is a mo fo and it's coming for you!",39,2,8
2,Rosemary P.,"Brooklyn, NY",9,31,14,1.0,"10/20/2018
            





Updated review","If you want to be scammed and mistreated, come here. Miserable, pathetic bouncers who hate their lives will greet you. After you get in there's just overpriced drinks and lots of nudity. Some of the workers here are really nice and there are some good performers. There are many places in Brooklyn (House of Yes, Bizarre Bar) where the atmosphere is relaxed, the prices are reasonable and the people aren't desperate for validation. Would love to see this place close.",2,,
3,Neelam M.,"Washington, DC",0,6,0,1.0,10/20/2018,"The rudest bouncers with the most backwards entrance process, they looked my gay black friend up and down and said ""no"" I am personally offended at the behavior of the staff, unbelievably and sad experience that a club in New York behaves this way.",4,,
4,Sha'velle D.,"Queens, NY",467,83,490,4.0,5/26/2018,To describe The Box I would just have to say it's a different experience very eclectic. I recorded a view videos and I wasn't aware that I wasn't suppose to until I was told I couldn't. My bad! Anywho it's a strange interesting show they have about three throughout the night. A great DJ and a lot of dancers some hanging from the ceiling. The shows were the most interesting of the night. This is definitely a fun place to go for a different experience. Would recommend for a birthday or even a date night. I'm unaware of cover for the place because I have a friend that promotes their so it was free entry. I did have glasses of wine but I didn't enjoy them because it was all warm. That would be my only complaint.,2,,
5,Oumy-Neferti D.,"Brooklyn, NY",0,3,11,1.0,10/26/2018,Racist establishment from what I read. Don't want to give my money to people that consider that a party is only a party if no blacks are in it. I pass.,1,,
6,Kennedy L.,"New York, NY",409,5,0,1.0,10/20/2018,I would give this place 0 stars if I could. Full of self entitled pricks who become a bouncer and think they are suddenly god. Their process on who they let in is dumb and they think they are the best thing since sliced bread. Beret guy is racist and homophobic.,1,,
7,Dan C.,"Manhattan, NY",0,4,0,1.0,11/4/2018,"If you want to have a miserable night, and be charged up the a** to do so, this is the place for you.I decided to go to the Box for my birthday and book a table for a group of friends.  The ""madam"" informed me of a minimum spend which was fairly pricey, but I figured I'd splurge for what was supposed to be a chic venue with unique performances.  She warned me to arrive early the night of because they can't reserve specific tables, as those are allocated on a first come first served basis.After a group dinner for 12, I rushed all my friends to finish up so that we could get to The Box and reserve our table.  Upon arrival, I was told that we were assigned to Table 4, ""which is a great VIP table.""  Table 4 was literally the last seat in the house, and the entire place was empty except for one other table.  I told the hostess that we'd like to move closer to the stage.  She told me that she would check with the manager and when she returned said that all the other tables were already reserved but if I wanted to pay a higher minimum she would see what she could do.  Not wanting to play their bait-and-switch extortion game, I went directly to the door person who seated us and also called the madam who made the original reservation. After they explained to me that I must have ""misunderstood"" because the tables are allocated on minimum spends, and apparently mine wasn't enough so they were reserving ALL other tables in the house for people who hadn't shown yet, they said that other than moving me to some inferior space on the mezzanine, there was nothing else they could do.  With the birthday group there and the Box in possession of my credit card, we tried to fit our 12 people in the ""VIP"" banquette designed for 4-6 people max.  Half of my friends had to stand. A 30 second opening act went on at 1am before we had to wait another hour for any other acts to come on.  In the meantime, waitresses enthusiastic to help us reach our minimum spend came over, letting us know they were out of this bottle, but had a similar bottle that was almost double the price and they'd see if they could do us a favor and get it for just 1.5 times the price. When the bill came, while the service was awful, the totals didn't reflect any of that - full minimum + show fee + tax + gratuity.For the amount I spent, I could have taken a trip to Europe, found the rudest venue possible, and then at least been treated like sh*t with some class.If you're looking for a place with fun shows, go to House Of Yes, Company XIV, the Slipper Room, Bartschland Follies, etc.If you're looking for a classy night where you might pay for it but get anything other than cheap, haggling nightlife, go literally anywhere else.The only thing redeeming about the night was the great friends I was with that I wish I had taken elsewhere.***Save yourself the frustration, money, and disappointment and find another place to have a fun night out or celebrate a special occasion.***",1,2,1
8,Jesse C.,"Staten Island, NY",36,46,15,3.0,2/12/2018,"This is the most New York place you'll go to. Everything about this place is New York City. I would say The Box is a place you go to 4-5x a year and you're never disappointed. It's expensive, but worth it... I mean the show is hilarious, impressive, talented and just WOW. Ashley, the MC, is beyond talented.More importantly, you could be Beyonce with Kim K and probably still wait for more than 5 minutes outside, it's tough and quite aggravating. Most people rate this place below 3 stars because they can't get in. The staff behavior is sketchy and the staff, themselves, are not the most friendly.  I think there is something to be noted that if you have a table during show time there is a show fee.. especially if it's what a gratuity costs aka 20% -- ridiculous. They don't care about their patrons.This place gets three stars because it's super New York... you love it, you hate it but why do you go back? Because it's a spot to not miss out on... it is worth the hype.",2,1,3
9,Alex E.,"Northampton, MA",283,2,0,1.0,9/29/2018,Horrible service. The bouncers has us waiting outside for a long time for no reason. They told me I was an asshole because I said there was an issue with letting everyone else in before us. Don't go here if you don't know someone there.,,,
10,Esther G.,"New York, NY",1,5,0,2.0,5/10/2018,Reason for the rating is not for the decor which is very cool or the performance by Fractured Atlas of Anecdoche which was amazing !!It was for the lack of communication of the pricing for cocktails purchased from the bar vs table service.  To be charged $15 per drink at the bar to $24 at a table including a tip on each for a glass of Prosecco? No reasoning just each person acting clueless.,3,,
11,Andre R.,"Brooklyn, NY",0,12,5,1.0,10/24/2018,"Don't go. You are not missing anything. Unfortunately there isn't much to see anymore. Way overpriced.  Treated like a second sort citizen, even after paying over 700 a person for a 20 minute show and cheap liquor. Place sucks. Sucks big time. Save your time and money. Avoid. PM me for more info.",1,,
12,Amanda A.,"New York, NY",562,153,14,2.0,6/19/2017,"I have been coming to the box for years now, and I used to enjoy coming here. But I find the behavior of the staff to be very sketchy. This review is not based on me coming here once by the way, but easily over a dozen times in the last few years. This review has nothing to do with the performers. I think the MC, Ashley is amazing, and so are the other people who take to the stage here. Also no complaints about any bartenders here either. The bathroom attendants have always been lovely too. It's the waitresses and bus staff that are my biggest complaint. 1. They never ask if you would like sparklers with your bottles and they just bring it out. They charge you ""a show fee"" which I would be fine with if they a) told you about it b) actually did some kind of ""show"". It at least used to be more theatrical or exciting. This last time she had the sparkler and just put it inside one of the glasses while she started opening the bottle while the sparkler was still going. 2. Meanwhile, the busser is jamming someone else's purse at me that was on the table he is setting up. But I don't know whose purse it is, and simply being polite and asking would have sufficed. 3. Later, I caught the busser grabbing full glasses of champagne and trying to walk away with them. I stopped him and took them back because I knew who they belonged to, and they were completely full and had just been poured. He also spilled champagne on me before I caught him with the glasses and he could have cared less.4. Beware, the waitresses will sometimes just start drinking without being invited to, and one of the other times, she invited 4 of her friends over to start taking shots without asking anyone if we would mind. My advice if coming here is to be wary of the staff, pay attention to them handling your bottles and glasses. Also specify if you want sparklers.",23,7,10
13,Tabitha K.,"WOODLAND HLS, CA",0,6,1,1.0,2/2/2018,Paid $2k came 2 hours early and they wanted more money for the weird people that come to their funk club. Never ever come to this club. Warning you!,5,1,1
14,Marielena F.,"Manhattan, NY",1,1,5,1.0,10/10/2017,"Horrible Place! Stood outside for more than 4 hours awaiting to see an artist that I adore. I am actually still here standing and after all this wait they are telling us that they are shutting down the event. In the four hours we never got information about how many people would be allowed in and then a crowd of people began to swarm the venue entrance and we got pushed back even though we were waiting for HOURS. This is heartbreaking. Terrible security, their organization methods had me shook. NEVER AGAIN!",1,1,
15,Gigi V.,"Manhattan, NY",80,14,0,4.0,3/27/2018,"This place can is the type of place you either love it or hate it.I love it though. its completely out of the box within the box.. get what I did there? Its burlesque meets circus with clubbing in between shows. They often give out popcorn at the beginning of each event which is fitting. They have a variation of shows from musical performances, magic shows, and some shows that can be bit vulgar for some. It also very crowded so its best if you find a promoter to attend with.",1,,1
16,Esther L.,"Pasadena, CA",318,8,4,2.0,1/12/2018,"Cool showbut not worth what we paid $1,200. Expect to pay twice as much (for a table, then what you person tells you to pay. This girl, Luna told us it was $640 for a table plus 20% tip) So we expected to pay around $700-$800 for the night. But surprise surprise we had a  upcharge die to hidden show fee on top of the 20% tip.Waiters were stuck up and weird. To be honest not worth it at all.",4,3,
17,Vick V.,"Fort Lee, NJ",4,139,25,1.0,5/12/2018,I have no idea how the fuck this place even exists. Completely overhyped. The show was not entertaining. Guy dances with a bear head on and an erect cock. Riveting. Bartenders don't give a fuck. $30 for a Negroni. If you want a table you're looking at a grand per person with hidden show fee tucked away - all to watch some girl flap her pussy lips to sing a song - it's really cheap thrills. Real fucking cool. Only assholes would go to this place. Go if you know someone dumb enough to drop the cash on a table just so you can write a shit review.,5,8,
18,Neo G.,"Alexandria, VA",0,2,0,1.0,11/24/2017,The place is managed very poorly.A group of six needs a $2500 table to get in. Not sure if they realize what kind of places have such policy. Definitely not coming back.,4,,
19,Jonarda B.,"Brooklyn, NY",76,57,81,2.0,6/19/2018,"The stars they get for the performers, they dis a great job. But the place was small, crowded, hot and uncomfortable. Even wene we adresses the temperature to the management, it was not adressed. Wont go back",1,,
20,Emery Y.,"Los Angeles, CA",538,81,25,5.0,11/25/2017,"Love. This. Spot. An eclectic and electric blend of party, people and pendejada . Don't be too quick to leave: the shows are the reason to hang around. Burlesque as it was meant to be.",2,,
21,Paris Jasmine M.,"Brooklyn, NY",292,3,1,5.0,2/9/2018,"If Moulin Rouge and porn had a baby that was raised in the circus. Expect to experience something you never have before. Sultry, Beautiful, Scary, Uncomfortable acts that will blow your mind honestly. I went on a Wednesday and nothing could have prepared me for that.",,,
22,Sarah B.,"Durango, CO",0,1,0,1.0,5/27/2018,"In short this place has had its day.  It is boring, over-priced and the service is dreadful. Do not waste your time nor your money.  There are much better places to go to.I was really looking forward to our night at The Box to celebrate my sisters birthday.  I reserved a table; expensive, but I thought it would be worth it.  It wasn't.  One guest in our party was not drinking the champagne that we had ordered via the table service.  The server brought one drink to her at the start of the evening.  After that she had to go to the bar and get her own drinks.We had a private table upstairs but constantly all night had to ask random people who kept appearing and sitting down in our seats to leave and stop drinking our drinks.The bathrooms are dilapidated.The intervals between the show were extended boredom.  The ""dancing"" bear became ridiculous.  The acts were good for the very short time they were on but did not make up for the dreadful service.If I could write this review with no stars I would.  We spoke to a manager while we were there.  Not what you want to be doing whilst celebrating a birthday.  He offered to reduce the bill.  To be honest though monetary compensation couldn't fix the disappointment in finding that The Box was so very far below my expectations. At point one guest was getting her own drink at the bar the server was on her phone and another guest was once again chasing random people away. I refused to pay the tip for obvious reasons and was met with shouts of ""Yeah thanks for a great Memorial Day weekend"" from one of the people working there.  Well right back at you because you didn't do your job and you didn't make ours great either",2,,
23,Chris U.,"Clinton Hill, Brooklyn, NY",166,4,0,1.0,10/10/2017,I'm only giving the box one star because no stars isn't possible. Went to go see the free Sza show and arrived at 11am for a call time of 6pm. The bouncers and security guards had no idea how to form a waiting crowd and persisted to cause confusion and anger as they changed the starting point of the line and rules on how to get in. The box needs to work on organization and customer service before trying anything else. Disappointed and unamused by the whole experience. I will never attempt to go back here.,4,,
24,Jonathan M.,"New York, NY",10,10,1,1.0,8/19/2017,"TL;DR: AVOID.There are way better burlesque shows (see: Slipper Room). The staff here is impolite, disinterested, impressed with themselves, and decidedly rude. They force you to stand in a line for standing in a line's sake (""look how popular we are!""), and while I (needlessly) waited to get in, I watched a bouncer in a tux (how fancy!) repeatedly manhandle both men and women for no reason. Once I was in (and months older), the show was mediocre at best. What a joke of a ""sexy night out"". Don't waste your time or discretionary income. AVOID.",9,1,4
25,Lenny V.,"Brooklyn, NY",71,6,0,1.0,6/14/2018,"I honestly don't know how this place is still open!They agreed for a set price per table, but at the end of the night the bill was triple the price! On top of this music and sound is horrible! My advice is STAY AWAY!",,,
26,Vanessa S.,"West Los Angeles, Los Angeles, CA",0,3,0,1.0,8/4/2017,"Pretentious, which I'm sure the doorman alone will find flattering. Being rude and racist in a city full of a 100+ clubs is nothing you should aim for, but this club hits their mark. There is no good business practice here. Staff and management have a complex that is laughable. You will be disappointed you are actually spending money for unprovoked negative attitudes. There is nothing andnobody you will see at this club that you wont  be able see anywhere else or on the streets of new york city. Guests are pretty basic, drinks are basic,festivitiesare meuw. If you want bad business,more judgment in America,and the usual ny drink prices.this is place for you.",8,,
27,Charity D.,"Manhattan, NY",280,12,14,1.0,10/10/2017,"This place is just awful. Please save yourself the time, money and anxiety of going here. They had a pop up show for SZA and had us line up for 6 hours. They told us we had to wait for a lady with a list and it would be 5 mins. Then they changed the age allowed in and turned people away. 3 hours later they said they would let us in. I am still outside and was one of the first 20 ppl in line. It is literally a mad house and I can move. Cops don't even know what's going on. All we want is communication! Save your 20$ on a cocktail for another bar.",1,,
28,Matthew L.,"Long Island City, NY",0,3,0,1.0,12/9/2017,"DISGRACEFUL PLACE ran by disgraceful staff. AVOID.Charged $1200 for a table which I was fine with.Not told about $300 show fee, compulsory $300 gratuity and the two additional taxes placed on top prior to entry. $2500 later...The manager Naned was rude, abrupt and unwavering in his attitude to rinse as much money as possible from me. Note to management, if you have hidden fees you should explain these in advance of patrons entering the premises.WILL NOT be going back and I advise anyone reading this to spend your money elsewhere and avoid the stress of being pickpocketed by wanna-be gangsters running a wanna-be, past-it cool spot.ZERO STARS if possible.",8,1,
29,Amy M.,"Brooklyn, NY",557,91,189,5.0,3/1/2018,"I love this place, secret, dancers aka show. It's small tight place but I had a great time.",1,,
30,cristina s.,"San Jose, CA",183,159,78,5.0,8/16/2017,"Loooove this place! Amazing attention to detail, all the acts were coordinated so well, great theater manager. So as you've read it's a club and then every 30 minutes the club stops and the show starts. Much risqué than a strip club i tell you that. Yes the acts are explicit. One act had a trans putting toys in his butt, and the other one a man was shocking his nipples and putting fire on them.The locale has 1 dumpster outside and trash bags as well, lol not very clean or classy but hey! It's NYC , guess that's how things go down",1,,
31,Ashlyn J.,"East Williamsburg, Brooklyn, NY",140,1,0,1.0,1/20/2018,Not worth it. Bounce made us wait an hour to tell us customer service starts inside. Terrible.,1,2,
32,Jenna D.,"Powell, OH",256,65,52,3.0,7/21/2017,"It was quite an experience. Certainly outside the norm of my usual evenings. The Dom was good, service was okay and friends had fun.",1,,
33,Kari M.,"Dublin, CA",0,15,0,1.0,3/22/2017,"This was one of the worst experiences my husband and I have ever had. We heard many great reviews and that you needed to buy a private table for the ultimate experience. When we made the reservation for a private table it seemed like a class act, upscale place. The Madam was very polite and accommodating. However, when we got there the ""cheapest"" bottle of champagne was  Vueve Clicquot"" priced at $620 a bottle. The show was unimpressive and our bottle service girl sat down and asked if it was okay to pour herself a glass of champagne. I did bottle service in college and none of our girls would have EVER asked that. If a party offers it, that's another story. Long story short- it was an absolute awful, ridiculously expensive experience for a shit time and shit show. We spent over $2300 for crap. Will never recommend to friends or family.",14,1,
