,er_name,er_location,er_freinds,er_reviews,er_photos,er_rating,er_date,er_text,er_useful,er_funny,er_cool
123,C L.,"West Village, Manhattan, NY",0,10,1,1.0,7/28/2016,Been here a couple time and it's fun. But I went at 11 on a Wednesday and the guys at the door pretended we weren't there as we asked them mulitple questions. Really saw the bad part of humanity there. Really really rude for just no reason.,2,,
124,Tory K.,"New York, NY",3,109,0,3.0,11/11/2014,"Disclaimer, went here for a work event when The Box was closed down on a Monday night. The show was good, 6 acts total I think. Some of them where really raunchy- like did they just really do that type of raunchiness and they got worse but in a good way as the night went on.Overall the place is designed well and if you can get a seat you can really enjoy yourself. We had seats and a private upstairs view. The cocktail waitress came around with champagne just the right amount of times and seemed very nice.Overall if I had a other event I'd go back, however I wouldn't pay to go based on other reviews and it not being worth the price.",,,
125,Rosie C.,"Fairview, NJ",42,4,3,5.0,5/3/2014,I absolutely love this place!!! I have so much fun Every time ... pulse it's always sexy night at THE BOX ;),1,1,1
126,Steph M.,"Manhattan, NY",142,26,4,1.0,1/2/2016,"Wish zero stars was an option.  Have never been treated worse than my group was here.  The ""owner"" and doormen at this place are horrible.  It was my birthday and our group agreed to pay $1,000 to just walk in the door but was then screamed at saying we were no longer welcome there because we didn't know the exact number of people with us off hand and had to pause to count them.  I told them it was my birthday and to please treat their customers with respect and got the response of ""I don't give a fck and you should leave.""",11,3,
127,Cris C.,"Old Westbury, NY",85,41,15,5.0,3/1/2013,"Firstly, The Box is a super-exclusive place (and for good reason), so don't expect to get in unless you know someone...The Box is an old itsy little theater that was converted into a club. I always love me some fine entertainment, and this place definitely provides.I will warn you, however, that most of the acts are reminiscent of a raunchy Cirque du Soleil I never saw. All the performers, however, have some real talent. The last time I went, a Jimi Hendrix look-alike in a white LED lit bellbottom pantsuit did a tap number in the dark. And what's even cooler about this place is that the performers (in costume) and club-goers become completely intermixed after the show.",5,2,4
128,Marci C.,"Dallas, TX",53,63,0,5.0,2/15/2015,"been twice, and both times AMAAAAAZINGBALLS!!! the reason that those guys outside might be assholes is because its supposed to be ""exclusive"". if they let any person in here then it would lose that luster. both times we didnt walk out with a bill less than 5k so don't expect to start a savings account at wells fargo after this ;-)the entertainment is unlike any show I've been to. a little bit of everything all rolled into one big fat cock getting shoved into an ass that may or may not be a woman. the performers are all very pleasing to the eye and so is the staff. also, the place starts its first show around 1am and lasts maybe 15-20 mins? i never timed it, but the rest of the time (in between the shows) its a regular night club which i wasn't aware of until that first time. HIGHLY RECOMMEND!!!!*we have always been on a thursday, so i can't vouch for any other night of the week!!",3,2,2
129,Jen D.,"Berlin, Germany",268,1481,274,3.0,10/21/2012,"This is just one of those places you have to see for yourself. Any review, good or bad, won't do it justice. Key things to know: - The door guys are picky. If you don't have a reservation, be prepared to be turned away for reasons you won't understand.- Drinks are abnormally expensive, even for NYC standards.- $500 gets you in the door and gets you a bottle, but it doesn't necessarily get you a table. It didn't get me one with my 6 friends. - You will see some freaky shit. Come here with an open mind. I would definitely come back, but only if I can get a table. Great place to take friends from out of town.",14,1,1
130,Danny S.,"Brooklyn, NY",567,1,0,1.0,1/29/2016,"I hope this place burns to the ground!  As a native New Yorker who frequents many bars and clubs, I was shocked by my experience here.  I came to see a performance by Amanda Lepore and stayed to witness a few other shows, one of which showed a man depicted as Hitler (in full garb) taking over the world, accompanied by dancers wearing bras donning swastikas.  At the shows conclusion, the emcee shouted ""I want to ride Hitler's mustache"" and ""I think Hitler's mustache is sexy and I don't give a fuck what anyone thinks!"" I'm shocked that they would allow such a performance, on the day after Holocaust Remembrance Day no less!  I approached a bartender, expressed my distaste at the performance, and requested to speak to a manager.  He went to look for a manager and returned assuring me that ""Alex"" would be with me shortly.  15 minutes pass, and a second attempt to ask him results in him ignoring me altogether.  I then asked a different bartender, and he said nothing could be done and that I was being a killjoy.  After that I asked the host who was standing by the entrance to speak with a manager and she said something to the affect of ""we offend everyone.""  I was left dissatisfied with the feedback, and not even one employee apologized on behalf of the club.  I was treated as if I was the one with the problem.  How dare I not be ok with the Holocaust being made a mockery of!  Never did I think I would witness such a brazen public display of antisemitism in a New York City club.  While The Box is notorious for it's risque performances, allowing a show that made a mockery of a very real and tragic moment in history was, at best, in poor taste.  There is a fine line between artistic and outright offensive. I will never come here again, and urge you strongly against doing so.  If none of the above offends you, just know that the drinks are overpriced, even by NYC standards ($19 for a mixed drink?!?!?), the staff are rude, the people are awful, and the place is hot and crowded.  I can't think of a more highly overrated venue in NYC.  There are so many other better places to enjoy your night.  You've been warned.",5,,
131,Jason T.,"Jersey City, NJ",41,27,46,1.0,3/22/2015,"Firstly just because you filled out reservations online doesnt mean u have reservations. They have to respond to you according to there ""availabity"", but when you go there and see the customer service from everyone, i mean the security guards, the front manager, the guest list woman. You know for sure that they never in a million years would check that reservation oline. Rude oblivious, they offered a few bar stools at bar because they didnt have anything available for a minimum of $580 a bottle. Are you stupid? The whole staff was stoned or mollied or both, smh we walked away stay away from this place.",3,,
132,Andrew P.,"Manhattan, NY",163,37,7,5.0,7/27/2015,Great show which is done in a few acts. I would in nightlife and this is something everyone should see once. Crazy show and different every time.,,,
133,Benny K.,"Manhattan, NY",0,1,0,1.0,5/17/2015,Have yet to go and I didn't have a good experience  all ready. I went online to make a reservation I also called and left a message to make a reservation. No one every responded to my online or voice mail reservation.  When I finally got in touch with some one she was very rude and hung up on me. So unprofessional.,1,1,
134,Dan S.,"Manhattan, NY",0,9,0,5.0,4/25/2014,"I went with a female friend of mine on a Thursday night around midnight. We were both reasonably well dressed, I've heard this is important. We stood behind some people for roughly 10 minutes before the bouncer waived us over and asked for our ID's. We went in, no cover charge. This was without any connections of any sort. So...apparently getting through the front door isn't a tough as you might believe. We didn't even say a word to the bouncer or the doorman. This might have been the key, don't annoy these people. They were even relatively polite.So....the door is probably the most annoying part of The Box, once you're through with that drama, it's pretty much a good time.I mean, I'm giving it 5 stars assuming you are aware that The Box is essentially a night club. If you don't have table service, or a friend with table service, or befriend someone with table service, you are not going to be able to sit down! But...again....if you've been to a club before, you should be well aware this fact.A lot of reviews discuss the prices....the concerns seem somewhat overblown. At the bar, we paid $8 for bottles of Stella and $18 for a Belvedere and soda. Both were a bit steep, but neither outside the realm of reason. There was a suggested 20% gratuity added, but it appeared you could remove it if you wanted. Also, the bartenders were quite responsive, I never really struggled to get a drink and didn't even struggle to get my bill at the end of the night. And that's it for the bar.The crowd, not sure how to say this politely, but the foreign population was heavily represented. Both men and women were relatively attractive and well dressed. They seem to have nearly as many bottle service girls as they do patrons and these girls seem like they spend most of their time hanging out at the bottle service tables. I guess I liked the crowd, save for a few rude members who thought standing directly in front of us while watching the show was a great idea. But every nightclub I've ever been to has its fair share of A-holes.The show, it's outrageous! The hype, however, might be a touch overstated. The acts are raunchy and often inappropriate, but ultimately relatively brief and approach the line of inappropriate with out ever actually crossing it. The show really is pretty close to one of a kind. It is mostly a combination of shock and comedy routines with a sexual component. BTW, it is not the same show 3 times over the night, it is actually three acts. So...if you really want to get the whole Box show, expect to stay up all night.I would definitely return to The Box. I happen to know that bottle service will run close to $700 a bottle all said and done and, for the right occasion, probably worth considering, if you are comparing it versus other night clubs and with a relatively large party.",,,
135,Stacey K.,"Brick, NJ",20,54,7,4.0,4/17/2015,"Went here for a bachelorette party last weekend.  We had a standing-room reservation at the bar that included a bottle.  We didn't experience any attitude from the staff and I actually found most of them (especially Myles the bartender and Diane(a?) one of the managers) to be very pleasant.  It was smaller inside than I expected.  My only complaint is that our standing room reservation didn't really get us a good view of the stage.  We had to walk into the main ""theater"" room with everyone else that was there.  The show didn't start until around 1:30am and they took a break shortly after they began.  We ended up leaving at around 2:15, so we missed the rest of it.  We might have to go back to see more!  The bathrooms.... interesting!",1,1,1
136,J. L.,"Las Vegas, NV",231,51,12,1.0,6/28/2014,"This place blows. The bouncers are on a power trip and the cocktail waitress need to get their heads out of their behinds. Hidden auto gratuity on drinks. Nothing here is that spectacular- but then again, I am from Vegas.",14,5,1
137,Ruth R.,"Milan, Italy",0,3,0,2.0,7/14/2016,"Hype about nothing. Very easy to get in. Inside you'll meet lots of too short out of towners and few cheap girls. Crowd's not pretty and not cool. Show is way over rated. Cocktails are not professional. If you have money and over 25, go someplace cooler. Let me save you the boredom",,,
138,Therran O.,"Manhattan, NY",34,34,1,4.0,8/6/2012,"This place is exactly what you expect, plus more. All of the other reviewers are correct, it is very exclusive and you need to know someone to get in. It's expensive but you get a show and there're no tickets. So, in the end it's not really that horrible. Luckily, someone in my party knew the doorman...or maybe it was my linen outfit? Nah! Anyway, I hadn't even heard of the place until that morning. However, I felt I had a good idea of what to expect.On to the depravity. First, the inside of the place is vaudevillian meets recently abandoned theatre in a horror movie. So put yourself in that mind frame. Once you get in, you're greeted by a bunch of people that have been out all night and are in the mood to party - cue the dancing and general revelry. Then, performers start showing up. These people look crazy in their street clothes. But, they're surprisingly friendly if you engage with them properly.My crew was going to get a table but decided against it. I'm actually glad we did. Being amongst the crowd was awesome. We met people and had an opportunity to cut loose with the masses.  Then, the show began. We saw some wild stuff. Little people having (what I think was) fake sex in a strange act; cirque du soleil over the bar; he/she action; a singer; a little naked blasphemy, strange things with dildos and butt beads...yeah use your imagination or just go! Seriously, get ready to drop some coin but have a ball if you're open and maybe a lil' nihilistic.",8,,4
139,Elizabeth R.,"Manhattan, NY",108,16,0,1.0,8/20/2014,The worst place in NYC. Not only do they think they are gods gift but they are rude. We are all the same and all trying to have a good time. They are very judge mental and not fun skip this place.  It's the worst,7,2,
140,Jerrica J.,"New York, NY",963,1360,221,5.0,2/22/2013,"I love The Box! Its always a good time, if you can manage to get past the strict door or have an invite. They always have some quirky shows. I remember watching a burlesque show here last year and the performances blew my mind! They really know how to entertain large crowds because I dont think there has ever been a night this place has not been packed!I dont drink anymore so I can't tell you if the drinks are worth it, but soley for the performances its definitely a place that will guarantee you to have a good time.",2,1,2
141,Jane H.,"New York, NY",2,16,0,5.0,5/6/2013,"My favorite Wed. night social hour. Thankfully exclusive.  The shows are ALWAYS jaw droppingly fabulous and risqué. There are absolutely no boundaries here. If you are sitting downstairs- expect to interact with the performers. You may even leave wet with liquids of sorts. This is artistic expressionism at it's finest. I highly recommend meeting someone who has hook ups to the mezz to really experience the lower east side - New York City in general. After seeing last week's raunchy, grotesque show, I can truly say I've seen it all. New York, I LOVE YOU and the drag queens you breed.",1,2,1
142,Alyx F.,"New York, NY",157,2,0,1.0,7/2/2016,"I wish I could give a review about the inside of this place, but unfortunately we never got in. Waited over 30 minutes on a night where it was completely DEAD inside. We even asked the bouncers about how long it would take to get in, first they said it would be an ""undetermined"" amount of time because we didn't have a reservation. Later, they told us we just needed to be okay with waiting and we might never get in. The line was over 25 people long - it was clear they were just looking for status and a crowd. I would never try to go here again!",,,
143,Justin A.,"Brooklyn, NY",469,10,4,3.0,1/16/2014,"I have mixed feelings on this place..  I'll start with what I loved about it: The performances are out of this world. Some very talented (and very sexy) acrobats engaging in a kind of mating ritual / the MC was hysterical and a great singer / aerialist circus performance above the bar / theatrical sadomasochistic lesbian duo etc...All very talented and exciting. Also, the sound system and the lighting are absolutely top notch.  They really do a good job of transporting you to another reality as soon as you walk in the door.The doorman / hard to get in / waiting in line / bad attitude kind of throw the vibe off for me personally though. And the drinks are like everyone has already said... the most expensive I've ever seen!All in all though, we had a blast and I would recommend the Box to anyone at least for a one time experience. Its unlike anything you might see anywhere else",,,
144,Katie T.,"Rochester, NY",0,2,2,1.0,4/13/2014,"Rude, rude, rude assholes at the door giving you the shoo away gesture and a few verbal insults to nice people wanting to enjoy an evening. The only thing going for this place is the show which is mostly just T & A and a few low end performers spinning around or singing on stage. Tacky and low end.  Is it worth dishing out thousands for bottle service? No way. The show here hasn't changed in years. I would rather go to see Sleep No More and sit at the amazing bar on the roof or inside. The cocktails are professionally made mixology quality and the people aren't rude and snobby.  You could choose any number of places in the city. Why did I stop by here? To show an out of town friend but for locals there are better places.I used to go to The Box back in the day but these days the guys at the front door are extremely rude and all they want are people buying tables. It's constantly a ""Private party"" inside. That is code for ""We want to sell tables."" Last night the door man told me I wasn't getting in and to get lost. He wagged his hand at me in a shoo away gesture which was intensely offensive.  I'm not even an unattractive girl and it seems like all they want inside is money or models.  Enjoy your power hungry ego trips, boys because I'm going home to my Mercedes and your enjoying your minimum wage job ruling a doorway.",15,6,7
145,P B.,"Manhattan, NY",0,48,0,4.0,5/14/2015,"This is a once in a lifetime experience. Some friends took me here a few years ago and we had the table right in front of the stage. I was not warned about the show at all so I was shocked by most of the acts. Some are insanely out there. I felt weird for days afterwards and to this day that remains one of the most surreal, disturbing and memorable shows/nights of my life. If you are close minded, polemic and negative then stay away from The Box. You have to be open minded and appreciate the uniqueness of the show.",,,
146,Mitch S.,"Stamford, CT",8,185,469,4.0,11/3/2010,"Hi All,If you are a normal person, you may not want to come here.  It is ODD! 1st of all, it is very exclusive and quite difficult to get in. I am surprised i got in...being a hippie type person- but i was witht he right people.   It is small with a southern/new orleans style of architecture (though I am no architect- but it reminds me of NOLA).  There are tables and a dance floor, and an upstairs to do whatever you want.  This is a very liberal place...so if you are easily offended by sex,drugs and language...don't go.  The bar is super expensive...i spent $30 for 1 drink...and $100 for 4 shots of decent alcohol.  I like top shelf  ....so get liquored up prior to coming.  And a table cost roughly $3000...so prepare to stand!Now the performances are mostly amazing burlesque style.  The performers the night i went were excellent.  Except one act i was very offended with, but at least i wasnt in the range to get hit by..what appeared to be a she-male peeing.  I would display pictures of the place, but they dont allow cameras.  Even though i have some pics, out of respect for the establishment, i will not post and just keep these private.I enjoyed the clientèle too... a nice cross section of the underbelly and weirdness of the new york city.  I highly recommend going there if you can.  Even just once, you'll understand why this place is a must see place to be.However, I don't think i need to go again, unless I know I am getting in.- MSZ",3,1,2
147,Sarah Rachael W.,"Manhattan, NY",180,100,106,4.0,7/10/2012,"The Box... where do you begin? Similar to other reviews I've read, The Box is the sort of place you have on your Life List. I knew I needed to go, I just don't know if I need to go back. I would never have been able to get in had I not known a promoter. With that being said, I got in past a line and a velvet rope with no problem; major confidence booster. As soon as we entered the club, we had to pass another check-point to get upstairs. We made our way to stage right and were dangling right over the performers.The first act wasn't announced by the MC, so he seemed to have some trouble clearing the stage from drunkards. Once the MC appeared I saw a handful of acts; a woman hanging in a Cirqu-du-soleil type hammock in her panties, a genetic male with implants spurting blood and liquor from his mouth (who later peed on the audience - fake urine I presume), a woman who removed something (a fetus?) from her lady-bits and then bit into it (yes, folks, full frontal), and an impressive magic duo.Honestly, at 25 years old, and someone who thinks of herself as very liberal, I was still shocked at some of the acts. The show doesn't move that quickly, but perhaps if you are drunker than I it does. The venue encourages drugs and drinks, so feel free to do what you wish, carefully.Overall it was a night to remember for sure.The space is small and unique. Go with no expectations and full pockets and you'll have a good time.",4,4,2
148,Ellen C.,"Manhattan, NY",30,103,5,5.0,6/15/2014,"I had an amazing night at The Box for my bachelorette party. The staff was accommodating and two bartenders were so sweet. The show starts around 1am but by then many people (including myself) are too inebriated to realize what's going on, it's as if you're having some sort of strange dream. The crowd is diverse and hip, good looking. I would definitely recommend going to The Box if you're looking for an experience MUCH more exciting than your average nightclub. Good music, good entertainment, and an unforgettable night to remember! It's hard to get in without a rsvp or knowing someone but well worth trying and spending the $$$$$",5,2,4
149,George D.,"Miami, FL",3,12,0,1.0,11/9/2015,"Do not bother with this tourist trap, We were referred to this place by Hannah from Queen of the Night. Which by the way its where you should go if you are looking for a fantastic, sensual experience and great food. While I understand the doorman culture and I am either intimidated or sensitive of their posturing. I was however taken aback by a little dweeb with a Napoleonic syndrome that right off the bat had a chip on his shoulder and a rude condescending attitude even to the people that he was letting in. I was there well dressed, with my wife a fitness queen considered beautiful by most, ready to spend money. instead this microbe approaches us and not only dismisses us entirely but has one of the bouncers remove us from the sidewalk unto the street. We stood there dumbfounded and while we waited for our car, we saw similar action to several good looking well dressed couples. I do not have a problem if you don't want my business, but there is no need to be unprofessional or disrespectful",4,,
150,Rebecca L.,"Orlando, FL",307,3,0,1.0,4/2/2015,"Denied at door, despite being the only people in line for 20 mins with few inside. Hey blonde chick - you're not that cool. Heard mixed reviews, will not be returning.  Good luck on your over the top, obnoxiously sexual performances and overpriced bottle services. That should work out well for you.........",1,,
151,Irm M.,"Manhattan, NY",750,319,21,4.0,1/29/2012,"Not for the easily offended! They should put that in bold print on their website. O Lord. I came here and was surprised even knowing it was going to be a freak show. Keep in mind that you will need to either A) know someone, B) be a hot girl, or C) be willing to drop A LOT of cash. The space is pretty tight, everything about it seems like it's been around for years. It has a really cool vaudeville/circus vibe inside. There's an aerial hoop artist swinging above the bar between shows. She was super flexible, the guys below definitely enjoyed the show. As you go towards the stage in the main room it gets crowded. I would suggest getting a table when coming here, and getting one upstairs. Of course that will probably mean spending a minimum of $1k though. I watched from below and it was packed and very hard to see the stage. The night I went.... there was a schoolgirl lap dance act, a yodeling little person  puppet duo, a contortionist/silk artist, and a man shaving his balls and flashing the audience with his breasts. Sooo yea. If you want a wild way to cap off an evening, come to The Box.One final note on the negative reviews.... Yes the doormen are assholes, that is a given at any hot spot in Manhattan. Saying management should ""fire them"" is laughable. They would just be happy to hear they're doing the job they hired them to do! The space inside is also very limited so they can't just let anyone in who is not buying a table. And finally, the drink prices are high, but when you factor in that you aren't paying a cover and seeing nudity/acrobatic acts, you are actually getting a pretty good deal for 20 bucks!",17,6,8
