,er_name,er_location,er_freinds,er_reviews,er_photos,er_rating,er_date,er_text,er_useful,er_funny,er_cool
37,Ebony J.,"Brooklyn, NY",9,129,7,3.0,1/20/2016,"I came here with my boss for lunch on Friday and I have mixed feelings about this place. The waitstaff were super friendly and professional. However, it took forever for our food to come. I order the lamb sandwich and my boss had the turkey club. I felt like the food was just okay to be so pricey. My boss mentioned that her turkey was very dry. We decided that we wanted to share a dessert so we chose the brownie with ice cream. We were expecting to see at least an actual square part of a brownie and when they brought out the dessert it was so small we could not share. Again, the restaurant was just okay nothing to be blown away with. P.S. be sure to make a reservation as this place is extremely small. I can't imagine having to stand around and wait to be seated as it is that cramped in the restaurant.",,,
38,Billy S.,"Staten Island, NY",3,68,0,1.0,12/28/2016,"I pass this place regularly being that it is by my office.  My girlfriend and I decided to stop in here after seeing a play and visiting the Christmas Village at Bryant Park. To be able to get a table on a weekend night during the height of Christmas season should have been a warning to the slop fest that was about to ensue.The place was decorated for the holidays, which was a nice touch.  A couple of empty tables scattered through the place.. With that said  the service was lacking.  I order a Manhattan, and it is fine.  My girlfriend asks for sangria. The waitress shows her that there are 3 types of Sangria available, Red, White, and a bourbon sangria.  She asks for the red.  About 2 sips into it, we realize that there is bourbon in it.  My girlfriend who is not a big drinker, just wanted their red sangria.  When we asked the waitress, she said both the red and the bourbon sangria have bourbon, but she can ""ask them to make one without bourbon""..  This is either piss poor menu design or a waitress who couldn't admit an oversight was made, and we had been given the wrong drink.  I respect honesty.  They replace it, and it is super carbonated and super sweet, unlike any sangria I have ever tasted... not in a good way.Next comes the food.  I get their burger which was tasty.  No complaints. Nothing ground breaking, but a burger rarely is.  My girlfriend asks for the beet and goat cheese salad with chicken.  Her salad comes out, missing beets and the goat cheese.  How can you leave out the 2 ingredients that are in the dishes name?They waitress apologizes, and then brings out a creamy goat cheese dressing.  When she asked about the beets, the waitress points to what appears to be radishes and says those are the beets.  We tasted them, and they were unlike any beet I have ever encountered in my 40 years on this planet. They had the consistency of a radish The waitress said they are ""ribbon beets"".  Fair enough.  Perhaps I do not know about ""ribbon beets"" and the eclectic offerings of this fine establishment, and how they are nothing like normal beets, in both taste and consistency.  But one would assume that if the restaurant  was going to put some type of oddball beet in the beet salad, they would mention that in the description.Moments later, the busboy comes and clears the plates and says to my lady, ""you didn't like the Cobb Salad?""  My reply was, ""I thought this was the beet and goat cheese salad.""  He shakes his head and brings over a manager who apologizes.  (Full disclosure this looked nothing like a cobb salad either)Being that my girlfriend has not eaten, we order some crab cakes.  The gentleman apologized again, and said ""we will give you the good ones"".  Are there 2 types of crab cakes?  Either way, they come out, seem okay.This place had a weird vibe from the moment we walked in.  My girlfriend and I eat out probably 2-3 a week, and over the course of many years, have never sent a dish back. I mean NEVER. My point is she is not picky and if you saw me, it would certainly be obvious I am not either.  Honestly, I should have come prepared and made a reservation at a Benjamin or even the Andaz's downstairs bar.  Hell, heartland brewery would have been a better choice.Pass. Run don't walk away from this place.",,,
39,Nikita K.,"New York, NY",30,224,34,3.0,6/25/2014,"Cute place close to Grand Central, but is quite noisy in the summer as 41St and Madison is a pretty busy corner. They have an extensive cocktail menu, I tried the name sake martini which was delicious; however, their beer list is a bit limited.We only stayed for appetizers, trying the mussels and the shrimp cocktail. Both were decent; however, the service was overly slow for cocktail hour (the food took over an hour to arrive). I would come back, but I recommend going to Bookmarks (upstairs) if you can get in.",,,
40,Grace Lee A.,"New York, NY",42,308,54,4.0,6/17/2016,"I am a fan of this restaurant, it is on Madison avenue at the corner of E 41st Street. The lunch crowd was LOUD and busy now that it is the summer and they have opened the out door seating (little table and chairs along the side walk). Service has always been really good and attentive every time I am here with coworkers or friends.  Their lunch time menu is nice and quite pricy (about $17 for a sandwich) but the quality is tops. I had my water refilled regularly without me having to ask, despite the busy-ness at the restaurant. I always recommend this place for anyone in the area who wants to meet for a nice lunch. Check it out!",,,1
41,Sumita S.,"Jersey City, NJ",47,12,2,3.0,8/24/2016,"Champagne happy hour is awesome! ! A bottle of veuve for $45 ! Ambiance is also nice, outdoor seating, apps are OK very overpriced",,,
42,Pat D.,"Manhattan, NY",4,345,6,4.0,2/26/2015,"Came here with a co-worker and sat at the bar to eat.  The bar is large so there are plenty of seats and the inside of the restaurant is medium size not large, but I am not sure if there are other rooms? The food and drink prices are fair for the location $12-$40.  Now for the food:  The Grilled Chicken with potatoes was delicious, the chicken was moist with a crispy outer skin, honestly I could have ordered another piece it was that good. My co-worker had the Mussels App in garlic &  wine sauce that she enjoyed.  The bread they served was also delicious, it was Italian with a crispy outer layer and soft inside, served with olive oil for dipping.   The staff could not be any nicer.  The Only problem I found was that the restrooms were downstairs.  I definitely will come back to Madison & Vine especially since they are located right up the block from were I work :-)*The only reason I am giving this place 4 Stars is because of were the restrooms are located.",,,
43,Cristina F.,"Weehawken, NJ",18,166,44,4.0,5/7/2015,"I like this place. Came here for dinner on a Wednesday night and it's one of those places where you always get the same quality of food and service. The ambiance is really nice and mature ( think dimly lit, low music so that you can hear yourself talk, outdoor seating, bar). The restaurant is part of the super cute library hotel. The hotel has a nice rooftop bar as well that you can go to after dinner if you fancy. We shared the mixed green salad and our entrees were the steak and organic roasted chicken. Though a little over cooked, the chicken was so flavorful and the portion size perfect. Madison and Vine offers a bit of downtown in midtown / grand central area and is also located off to the side on a more quiet street. If you need a good place for a date, catch up with a friend, business dinner or quick bite at the bar on your own, I think you would be happy with this choice.",,,
44,Jenn S.,"Point Lookout, NY",524,755,1299,3.0,5/17/2013,A bit overpriced for lunch.  It's not an upscale restaurant so paying average $12-$18 just for appetizers seemed a bit ridiculous.  had the crabcake app and it was delicious but not enough to be $18.  Had a side of their mac au gratin...a bit too runny for my taste and a little bland...wished they had a salt shaker or something on the table.  The service started out good and as the restaurant got fuller we seemed to have been forgotten.I may return just for the bar next time.,,,
45,Lisa V.,"New York, NY",0,3,0,2.0,8/21/2016,"All of the food we ordered was average. We went for brunch and I ordered the short rib hash browns. The first thing I noticed before I had a bite was these were not hash browns at all. It was a plate of pulled apart short ribs, with 5-6 very small stewed potatoes. The dish was so saucy it feel like a stew but served on a plate, with nothing to soak up the sauce. Definitely not the kind of dish you would want at 11:30 am.",,,
46,Stephanie W.,"Cleveland, OH",17,23,0,3.0,12/30/2015,Just what we needed. Nice ambiance. Cozy. Good meal.,,1,
47,Peter Q.,"Azle, TX",140,492,24,4.0,3/4/2015,"The food and the service were both very good for our quick visit. I had the steak and it was cooked as requested and very flavorful. And they had no problem with a substitution because I am doing the low carb thing so that was nice. All in all, a nice visit and I would definitely go back.",,,
48,Clammy M.,"Pasadena, CA",1,92,13,5.0,5/30/2016,This place has THE BEST burgers in midtown.   I always eat here when staying at the Grand Hyatt next to Grand Central Station.   Great place and not touristy. Yum.,,,
49,Marian B.,"Guttenberg, NJ",22,9,0,4.0,10/23/2015,"I had lunch here today with a coworker and was impressed. The service was great, and even though it was packed and we didn't have a reservation, we were seated right away. I had the trout and my friend had the salmon--both were excellent. It's a little pricey for lunch, but I would go there again for another special occasion.",1,,
50,Barbara T.,"New York, NY",25,74,70,2.0,10/11/2014,"Food was ok. Service was average. This place has a really nice setting but I think underperforms for the neighborhood. Typical midtown restaurant where the waiters all seem overwhelmed. They messed up 2 out of 6 dishes we ordered - just not attentive.I think this place is better for a drink at the bar, if you can get a seat, but tough for a full dinner because the noise level is so loud.",,,1
51,Kerry R.,"New York, NY",0,20,1,4.0,3/31/2016,"We had a great experience.  8 pm on Thursday night.  Sat outside on a beautiful warm evening.  Our server was great, took our order right away and food arrived within 10 minutes.  Tasty cobb salad and  roast chicken entrees.",,,
52,Michelle N.,"New York, NY",202,15,18,4.0,7/1/2014,"Went there with my friend tonight (Tuesday) and really enjoyed ourselves. I made a reservation a few hours before and requested a window seat and when we arrived were seated right at the window in a cute corner table! Their wine cocktails are delicious and went down way too easy! I had a peach one and it was great. A little pricey at $15 each. The atmosphere is classy and sophisticated. We both had salads but they wee fresh, crisp and a great portion size. My Cobb salad had tons of chicken. It was awesome. Bill came to $107 for four drinks and two salads. I would definitely go back again and try the rest of the menu as it looked great!",1,,
53,Beth M.,"Midlothian, VA",31,247,528,3.0,10/23/2015,"Close to Bryant Park and the Public library, Madison and Vine is in a good spot. I don't have much to complain about but there wasn't much to rave about. The food was high-end but not large portions or overly delicious (my salad had a lot of what i consider weeds). The menu was limited. The service was ok. The room a little loud. My lunch was all about time visiting with my long-lost friend and, for that, the setting was fine. We were tucked away by the bar and were able to chat for hours. I think it might be a good place for a very small group at the bar.",,,
54,Linnea E.,"San Jose, CA",386,718,162,3.0,7/10/2014,"we wandered past this place and were super hungry.  they have a cute sidewalk seating and open front, so it looked like a good place to stop.  it was ok, but not as good as I had hoped for.drinks:  they do some unusual drinks.  I should have gone with wine.  the cocktail was strong for sure, but didn't taste like anything other than cheap vodka.food:  I had mushroom ravioli.  it is done al dente, more so than I care for.  sauce was lovely.  all in all, a good dish.  I started with a spinach salad.  tasted like it came straight out of a bag.  it was impossible to get past the preservative taste of the spinach.  super boring, didn't even eat much.service:  ups and downs.  he'd go missing for long periods of time, and didn't come back to check on us much.  if he had, I'd have told him the drink sucked.  as it was, i just didn't drink it and eventually was eager to just leave.",,,
55,Sophie C.,"San Francisco, CA",80,206,603,3.0,10/21/2012,"Met up for lunch with a dear friend who I have not seen in two years. This is  a popular spot for the business crowd (everyone is in suits) and offers a pre-fixe lunch menu (choose from 2 appetizers and 4 entrees). Enjoyed the lobster bisque (heartwarming) and the penne bolognese (fulfilling); perfect for the brisk NY autumn. We were seated by the corner window which allowed for sunlight and the privacy to catch up. I was happily full, but was coaxed into having dessert (panna cotta).Bottom line: efficient service, knowledgable staff and good food.",,,
56,Rida M.,"Manhattan, NY",0,16,1,4.0,7/31/2015,"I like this place, I have been there a few times cause I work around the area, I even ordered to go a few times, I love their spinach dip and garlic fries.  The mushroom ravioli is very good also. It is small but very comfortable during lunch with the outside seating. The only reason I gave 4 stars is based on the price and the portions, the fix price lunch portions are pretty small and it is a little expansive.  I never been there for dinner but I would not pick it as a dinner spot because it is small and the location to be sitting outside for dinner is not very attractive.",1,,
57,Rowena Y.,"Brooklyn, NY",478,1158,545,3.0,5/11/2012,"Here are some quick tips: Check-in via Yelp app to get a free cheese platter if you order a bottle of wine bet 3-6pm. Or Check in via four-square to get a free glass of wine IF you become the Mayor. (ha!)While none of the check-in offers really helped me, I still enjoyed their lunch entrees. Their lunch menu varies from fine dining cuisines (i.e.,seafood) to classic comfort foods (i.e., mac n cheese and pulled pork sandwiches). The restaurant tailors to mostly people working around the area especially during the lunch hours. Portion-wise, they are very generous. I ordered a pulled pork sandwich that came with sweet potato fries and in the end, I had to pack it to go. The pulled pork was slathered with BBQ sauce and cole slaw. It was literally stuffed with amazing and delicious goodness. The pork itself was tender and sweet.  It's a little expensive but the amount of food you get makes it pretty reasonable. The service was quick but I also felt they kind of rushed you since this place is a popular lunch spot and tables are a bit limited. If you want a slow and relaxing lunch, you may need to wait later in the afternoon.",,,
58,Rajeeyah S.,"Brooklyn, NY",60,99,95,3.0,6/25/2014,"Pros:Lamb sandwhich with side salad Lamb sand with roasted red peppers and goat cheese(?). The lamb was quite tender and the sandwich had the perfect balance of moisture with the spread which made it soft and easy to eat. Bread wasn't too hard, which I like. I was able to substitute the fries at no extra charge. Cons:I think for the cost of lunch the quality wasn't on par. Lamb sandwich $18. Coworkers turkey club $15.  It was a tasty lunch but the salad was a mixed mesclun salad blend tossed in a balsamic dressing. Simple enough. Also the service was a little slow especially for the lunch hour. It's a small space so I'm not sure why the waiter wasn't a bit more attentive. I will likely try once more though for dinner and wine. Tip:They are mostly reservations I believe for lunch due to the space. If you're doing a walk on come on the earlier side. Non reserved seating was at the bar and outside space only.",,,
59,Shari S.,"Houston, TX",87,313,968,4.0,5/9/2011,"Madison and Vine is a charming little bistro in Midtown East set on the ground floor of the Library Hotel. We had a lovely if pricy alfresco dinner there on a recent May evening. The service was quick and friendly. We shared a cheese plate to start which featured an excellent slab of gorgonzola, as well as very tasty portions of goat and pecorino cheese.  For entrees, I ordered chicken piccatta on a bed of arugula and my husband had grilled shrimp salad, both of which we really enjoyed.  Although we sat outside, our foray to the restroom revealed a dark, romantic interior that would be perfect to visit on a chilly autumn evening curled up with a glass of Zinfandel.",6,3,5
60,Kelly G.,"Throgs Neck, Bronx, NY",210,6,1,3.0,9/14/2015,Pretty Parisian vibe. Love the high ceilings. The food was good but a little dry but I compensated by dipping into the leftover sauce in the plate. I really didn't like that the place was so loud. It was like we were at a club! I was here on a business meeting so I probably wouldn't go again. I just can't stand not being able to hear the person I'm talking to when they're right in front of me.,,,
61,Reesie R.,"Manhattan, NY",43,326,52,1.0,11/13/2013,"Upon entrance, the hostess gave a frigid smile and asked where we wanted to be seated.  We said were stopping in for dessert only, to which she said - ""um, yeah, the bar.""  She then pointed to the bar and went back to her post, obviously bored out of her mind. At the bar we were ignored for about 5 minutes, and then another cold response.  Sure, I might have gotten some drinks but after the cold approach in the very empty bar, we opted to satisfy the sweet tooth and run.  The dessert was nothing worth commenting about. We won't be returning.",,,
62,Emily B.,"Brooklyn, NY",3,21,0,3.0,10/25/2016,"Good service, but the most pathetic Cobb salad I've ever had. A quarter of an avocado, a sad sprinkling of cheese, three small pieces of chicken... for $19. I'd give it another try as my friend's kale Caesar looked decent. But you can get a better Cobb anywhere in Midtown.",,,
63,Roxann S.,"Beverly Hills, CA",0,27,0,1.0,11/19/2015,"I stay at the Library Hotel where this is located and for which it provides room service.  I have had 3 meals from there over the past 3 years and they have all been close to inedible. If i wasn't so tired and so hungry, I would have eaten any.Do yourself a favor and go anywhere else, including a hot dog or halal cart on the street.  Waste of money.",,,
64,Allison H.,"Boca Raton, FL",7,11,7,4.0,8/31/2014,Carlos was filling in as bartender and greeted us warmly. Gave us a taste of the Prosecco before we committed to the bottle. We were thrilled w the Yelp check in comp cheese plate which was plentiful and delicious. We were welcomed back in after the rain outside wouldn't let us leave.,,,
65,Jimena V.,"Astoria, NY",40,278,43,4.0,2/5/2015,Cute little spot in the lobby of the Library Hotel. Perfect for a low key dinner or happy hour drinks. The staff was friendly and attentive. Had the spinach artichoke for app and the lamb chop special. Delicious!!! I took one star off because it was a bit pricey and it had a B rating but other than that I had a great dinner.,1,,
66,Lili K.,"Manhattan, NY",286,2517,159,3.0,9/20/2013,"If you buy any bottle of wine during certain hours (check the yelp check-in), you get their cheese platter for free (worth $18?).  The cheese platter was pretty tasty, there was so much that we took some home!The BLT salad wasn't very good-tasted like some old greens with bacon minus anything else to it.  The burger was good, however, as well as the fries.  You can dine in or outside which is nice!",,,
67,A C.,"Mountain View, CA",73,77,0,3.0,5/24/2015,"Had the salmon chopped salad. Thought it was just fine but nothing extraordinary. My brother had the mac and cheese - tasted a little bit, again nothing amazing. Vibe was quiet which was nice and the small outdoor seating was great given the weather. Would come again during the daytime for some light cocktails and small bite to eat.",,,
68,Giancarlo D.,"Queens, NY",36,127,108,5.0,8/13/2013,"A tad expensive, but it's a block away from grand central Very laid back atmosphere, We got some wine, spinach and artichoke chipThe spinach and artichoke dip was really good. Great service and a great place to grab some appetizers and drinks",,,
69,Andrada Lorena P.,"Allentown, PA",1,5,1,2.0,7/15/2015,"Definitely a ""no no"". We had to ask for bread and it came cold. Slow service. Cobb salad is average",,,
70,Krista D.,"WALL STREET, NY",31,90,0,3.0,7/2/2013,"A tad expensive, but it's a block away from grand central so its understandable Very laid back atmosphere, not that big but it's quaintWe got some wine, spinach and artichoke chip and salads.The salads were huge! The spinach and artichoke dip was really good. Great service and a great place to grab some appetizers and drinks",,,
71,Lauren T.,"Armonk, NY",19,51,0,3.0,10/12/2015,"My mom and I came here yesterday after shopping at Lord & Taylor only a few blocks away. We had a reservation and were promptly seated. It's a small venue with an older/more dated feel to it. The menu seemed somewhat limited but I don't know if that was because they were offering Sunday Brunch. Maybe they have a more extensive menu the rest of the week. Anyway, I had the Madison and Vine salad which was great! Huge chunks of cooked bacon with eggs, sun dried tomatoes and avocado. Very tasty. My mom had their BBQ chicken sandwich with fries which she really enjoyed. We had a bottle of white wine. I have two small complaints. First, they should really offer wines that are maybe less than $45/bottle. I mean that was the least expensive (for white)?!? I guess NYC prices but I would have liked to see something is the high $30 range too. Second, I asked a server for salt which he brought but then 4 minutes later asked if I was done with it and gave it to another table?!? LOL A little odd - do they not have more than one salt shaker?!? Anyway, overall food was good. Did the trick. If you are in the area and want a casual spot, then this fits the bill.",1,,
72,Geraldine D.,"New York, NY",61,76,3,5.0,1/26/2013,"My friend was visiting from Boston and staying at the Library Hotel -- that review will come later, but right now it's time for the food. When I got here, I checked in and saw there was a check in offer (free plate of cheese with a bottle of wine? awesome!). Unfortunately, we didn't buy any wine, but that didn't stop us from having a wonderful experience. As we walked in, we were immediately greeted by the hostess who apologized because there were no window seats. It was 12 degrees Fahrenheit outside, so we were ecstatic that we were sitting as far away from the window as possible. We ordered truffle fries as appetizers and they were AMAZING. I had never had these before and my friend said that it would be an ""experience"" so I went for it. First thought: where have I been all my life? After the fries, my macaroni au gratin came out (yeah, carb overload) and it was awesome. I'm a huge fan of bacon and a giant fan of mac and cheese so the fact that both of these things were in the dish really convinced me. We were here on a Thursday night at around 7 and there were a lot of people, but that didn't stop us from getting really good service. I was very happy with everything and I can't wait to go back!!",,,
73,Wine M.,"New York, NY",2,93,4,1.0,3/24/2014,"Went in for lunch at the bar today.I asked what red wine was open that day that was fresh. I was told that all the wines were opened the night before. You could see multiple bottles of the same wine opened. who knows how long they've been there for. I asked if he could open a fresh bottle as they were probably oxidized. I received a firm surly NO. Nothing could be opened until those had been sold. This is only the second time this has ever happened to me. I started to get up, and the menu was pulled from me.So 1: You couldn't sell me a $15 glass of wine from a bottle that cost you no more than $25.     2: You couldn't profit on the food as well  -I went down the block and ran up a $65 lunch check     3: I won't step foot in again, even though I visit periodically across the street      4: I will tell all the people nearby what happened--so you lose their business       5: And social media postSmart thinking bartender!!! Who P.S. lost  what would've been HIS  $15 tip",2,1,1
74,Pat T.,"堅尼地城, Hong Kong",63,195,35,3.0,3/9/2012,"Good place to stop for drinks after work, especially for those who need to get over to Grand Central. The wine list is decent-- offering some interesting varietals by the glass. We ordered a cheese plate, which was decent (think Brie President and some Milton's crackers)... the Calamari which was actually done well and french fries (think McDonalds fries with some parsley on it). OK, so it is more of a social occasion than the food, but just wanted to give you a heads up. The lady next to us asked us to quiet down, however-- the atmosphere with the after work crowd is rather boisterous... So don't come here to collect your thoughts over a glass of Pinot. VISA/MC/AMEX",2,,
