,er_name,er_location,er_freinds,er_reviews,er_photos,er_rating,er_date,er_text,er_useful,er_funny,er_cool
0,Jolene H.,"New York, NY",7,135,51,4.0,11/14/2018,"I've seen enough to go back, but not enough to go out of my way.  The $18 cheese plate was huge, comprised of standard Brie, Blue, Smoked Gouda, etc. Quantity more than quality for sure. We also had the Rioja by the glass... thrice. And obviously loved it. The host was patient as I tried to find my date (for like an hour). The tables were super tight and very dark. I asked once for a change in seating, as mine was facing the door/freezing air.",,,
1,Christina L.,"New York, NY",39,30,24,1.0,8/19/2018,Worst service ever.  Don't waste your money.  I had wine at the bar and the server never said a word.   This is the worst wine bar in the area.,,,
2,Monnie S.,"Columbus, OH",2,45,68,4.0,10/21/2018,"Trendy restaurant adjacent to the Library Hotel in New York City. I can see the New York Public Library from my table.had a Sunday brunch BAC (Bacon, lettuce and avocado) which was quite tasty. My only complaint would be that the maple bacon was not fried fresh so it was a bit rubbery.  The eggs were fried perfectly and the combination of avocado, gruyere, spur dough, lettuce and micro greens was perfect. The coffee was good but was not as hot as I prefer.",,,
3,Roy H.,"Spring Valley, NY",10,89,210,4.0,5/2/2018,"On the menu it said ""awardWinning"" burger. I tried it and it did not disappoint!  Was not the best burger I've had, but it was very good!!!  The fries were good too, thin and crisp! Very cozy atmosphere in here and friendly, attentive staff.",,,
4,Jeff H.,"San Francisco, CA",577,512,451,5.0,1/15/2018,"During our latest trip to the Big Apple the week leading up to Thanksgiving we decided to walk back to our hotel (Hyatt at Grand Central) after our show in the theater district.  We decided we wanted a nightcap but aren't really fans of the bar at the hotel.  And while we love Campbell Apartment and Raines Law Room, we wanted a quieter place to relax (Campbell gets crowded/noisy) and didn't know if we could get in right away (Raines prefers reservations).   So doing a quick look-up on Yelp while walking, I found M&V to be near the hotel and we decided to give it a shot.We walked in to find a light crowd, warm décor (nice for a cold night), and a friendly staff.  We sat at the bar, though tables were available, and started with a cocktail - a Madison & Vine wine cocktail for my SO and a Barrel Aged Manhattan for myself.  Both were flavorful and well prepared and while drinking and talking we looked at the wine list and menu.  The wine selection was solid with a nice assortment offered by the glass.  We didn't order anything to eat, but saw a few items on the menu that interested me for a future visit.The bartender was friendly and held a nice conversation without being intrusive.  He also told us about the Thanksgiving Lunch (which we planned on coming for but ended up elsewhere) and the bar at the top of the attached hotel (Bookmarks) - it was a separate bar but run by the same company.  Side note, I went up there for a look around and added it to my list of places to try (thus I bookmarked Bookmarks).We moved on to a glass of wine and as mentioned they have a good selection.  I can't remember which ones we ordered but both were quite good.We will definitely be back to try more of the menu.  Maybe start with a cocktail at Bookmarks and then move downstairs to M&V for dinner.",3,1,2
5,Nicole S.,"Blacksburg, VA",101,123,43,5.0,7/21/2018,Laid back. Great for selection on both food and drinks. The tables on the sidewalk are especially lovely in spring.,,,
6,Monica T.,"New York, NY",226,1878,25,4.0,5/9/2018,The grilled chicken here is delicious and we were sitting right near the outside area on a warm day.  It was pretty loud but otherwise the food is really good.  I also shared the meatballs with a friend and have to give those high marks as well.  I'd come back though maybe there's a time of day when it's less loud.,,,1
7,Nancy L.,"New York, NY",0,12,69,4.0,7/2/2018,- such a GREAT part of my birthday  at the bar ( thank you Kevin!) I will be back !! BEAUTIFUL SPACE !!!,,,
8,Denise M.,"Medford, MA",164,370,172,3.0,1/28/2017,"I loved the atmosphere and vibe with the beautiful woodwork throughout the restaurant. The food was given mixed reviews but the wine selection was great. It was early Saturday night without a reservation but we were able to get a seat, not many people at 5:30pm.Checking in on Yelp I was happy to see there was an offer for a free appetizer but the server said they were no longer accepting those offers which I thought odd but we were ordering regardless so just went with the flow. Just be mindful if you check in and they decline to honor the Yelp offer. I don't know why they didn't notify Yelp. We ordered the Artisanal Cheeses with Toasted Croutons, Fig Marmalade and Apricot Jamto share. The accompaniments on the cheese plate were great! If I could remember the cheeses I would share but my memory is fading. My two companions liked the cheese as well. I ordered the Roasted Organic Chicken with Fingerling Potatoes and Shallot Hash with Applewood Smoked Bacon, Wholegrain Mustard Jus. It was at the waiters insistence and I was happy I did. It was good, actually really good. I know the reviews are A-OK but if my companions had been happy with their meals this review would have been given a higher rating.They shared an order of the Pipe Rigate Short Rib Bolognes with San Marzano Tomato, Sheep's Milk Whipped Ricotta, Lemon Zest. They were less than impressed. Much to my disappointment because I wanted to give this a higher rating.It's a great place for a drink or if you are ok with a hit or miss meal then go for it and try your luck. I would return again but doubt my friends would be willing to return. Not with so many options for those who eat gluten.",,,
9,Atheena P.,"Heartland Village, Staten Island, NY",123,9,6,5.0,1/31/2018,"My favorite spot to indulge. The menu is a little pricey, but it's midtown Manhattan so you can't really expect anything to be cheap here. I come here only on special occasions but I always get my favorites. Crab cakes appetizer and a Bloody Mary. And I get great service every time.I brought my grandparents here last time and they loved it too. A great place to go to for any type of crowd.",,,
10,Lisa R.,"Navarre, FL",39,313,181,3.0,2/20/2018,A nice elegant atmosphere. Kind of pricey and there is nothing really spectacular on the menu. We had breakfast there and it was really good but not worth the high price it's the high price.,1,,
11,John D.,"Henderson, NV",138,9,17,5.0,5/15/2018,"Service outstanding, atmosphere superb, great wine selection, food exquisite, drinks are phenomenal.  A must visit while in NYC!",,,
12,Shelley M.,"Gloucester, MA",0,2,0,5.0,11/21/2017,"Stopped in for an early dinner and was delighted with the burger, fries and a big cab.   Definitely a craveable menu item for me.  Enjoy!Service was five star.  Ambience is cozy and hip.  Window tables make for great people watching.",,,
13,Natalie K.,"New York, NY",270,122,1,3.0,5/14/2017,"FYI - the check-in deal (free cheeseboard with purchase of a bottle of wine) is no longer offered, according to the wait staff. A girlfriend and I needed someplace to hold up for an hour or so before checking out the Chihuly exhibit at the NYBG, and Madison & Vine was the only option available near Grand Central. Not many people at the place on a Sat afternoon, so works well if you're looking to chat (which we were). We only had the cheeseboard & a glass of wine each, so can't comment on their food offerings.Two stars off for the following reasons:1. The check-in deal no longer being offered -- we were stoked, then subsequently disappointed, seeing that it was exactly what we wanted (and ended up ordering). 2. No labels or descriptions for the cheeses on the menu or the board itself, nor any provided by the wait staff.",1,,
14,Harriet R.,"Englewood, NJ",8,34,145,4.0,8/18/2017,"Pleasant restaurant. Nice ambiance. Our waiter was great. He was attentive and  accommodating.  My friends enjoyed their meals (Steak Salad and Crab Cakes). We all really enjoyed the Calamari.  My meal was...ok, at best. I had the Kale Ceasar Salad with the Seared Tuna. There was way too much dressing on the salad for my taste. I should have had the dressing on the side because the Kale was limp and greasy, but it tasted like authentic Ceasar dressing (right down to the Anchovies). My side was the Macaroni au Gratin (without the ""crumbs""). It was really good. I washed it all down with two glasses of Laurent Perrier, Brut.",,,
15,Abul R.,"Brooklyn, NY",51,293,148,2.0,12/2/2016,"Over the years I've eaten pretty much every meal here,and there's nothing that sticks out as being memorable or outstanding.The lucky thing for this is that it's located in a relative ghosttown with regards to good food... so we keep going back.Last iteration involved edible mussels and a solid cheese plate and some decent wine.But again... Average at best.",,,
16,Maureen W.,"South Pasadena, CA",722,861,9,4.0,10/20/2016,Great little wine bar with food. Nice selection of worldly wines.  I did not eat but i liked my glass of wine and the ambiance is chic and mellow. They have champagne happy hour which would be lovely with friends.,,,
17,Nora F.,"Sunnyside, NY",80,625,4622,4.0,4/18/2017,"Quiet on weekends! One thing to give away is the truffle salt has done it again! Order that fries with truffle salt. Although you don't eat the fries, you have the salt! You know you can't go wrong with truffle. Since we couldn't order from upstairs Bookmarks (rooftop lounge) we came downstairs here to have a bite. Since I didn't have a lot that evening except the chicken tacos from another bar, I ordered this killer fries (although I hardly eat fries) with that crazy salt and munched on it. I also tried the salad that my friend had. Wow! Both salad and fries were above average. We had Aaron the bartender. Ok, I gave him above average service too because it was late and he didn't mind serving at this late hour. The restaurant was quite empty, only 2 occupied tables plus us at the bar. My friend loved that fries, she ordered twice. She told me about the food here and I thought since she loves food anything goes but not really, the food here is really good. Maybe I'll try other dishes next time and then go upstairs Bookmarks lounge and read. Nice!",,,
18,Michael H.,"Hollywood, FL",18,14,7,2.0,6/12/2017,Coffee was strong and Luke warm for several cupsOrdered eggs Benedict came warm and poached eggs were not running Also ordered frittata the egg was flat with very little veggies or cheese,,,
19,Kerriann G.,"New York, NY",178,93,276,3.0,3/10/2016,"First warm NYC day of the year so I appreciated the outside seating. My friend got the tar tar and I got the crab cakes ( as u can tell, I lived in DC for 7 years and love crab.. In addition I don't eat meat). Both were okay at best-- not spectacular, not horrible. The ambiance was better tan the food, but the service was great and given the weather, you'll love the experience.",,,
20,Priscilla F.,"Hoboken, NJ",7,7,1,2.0,11/17/2016,"I'm being kind with the two stars, the stars are for the food as the cook should get credit. The service is horrible when it comes to the waiter.First: I asked if there's any California Cabernet wine and I quote the waiter ""thats not good wine"" I proceed to say do you have any Napa Valley, Sonoma or Alexander Valley wines and I quote again ""thats not good wine"" I was speechless obviously the staff knows nothing about wine and should be trained not to insult wine connoisseurs when they order. They don't have any California wines by the glass because as the waiter stated more then once ""its not good wine"" I mentioned if they had Simi or Alexander Valley wines he said ""those are not good wines"" obviously has no idea about wine other then what Management must push to sell. Second: I asked if the Sorbet desert comes with the 3 favors and he said no one scoop, so I order the one favor since he assured me its only one scoop for $8, when the desert came I had 3 scoops of the same flavor. I went to this place despite the low stars and bad reviews about the service to give it a chance since it was mid way to the person i was meeting for lunch.Trust and believe the reviews, if you are a wine connoisseur go to a real wine bar where the staff is educated about the wine and where they offer California wine (tasteful wine) and don't criticize what type of wine you drink as bad wine.",,3,1
21,Bill T.,"New York, NY",1325,2208,8237,3.0,5/28/2014,"Cute place with pricey but tasty drinks and a nice menu.  Plus, it apparently makes you look good.Had a date here that was just going to be for a drink but apparently I'm so charming, he wanted to continue our conversation so we ended up getting some food.  We had the charcuterie plate and the cheese plate.  Both were very nice.  Not as good as what I had at Salumeria Rosi Parmacotto  a few weeks ago, but just as pricey.The atmosphere is pleasant, it's not too loud and service was friendly, although not a lot of follow up. Bill for two drinks total, the meat plate and the cheese plate was $67 so this place ain't cheap.  But the lighting must be good and the drinks must be strong because I got a second date out of it, so I'm contributing some of that to Madison & Vine.",,4,1
22,Mina K.,"Brooklyn, Brooklyn, NY",0,4,0,2.0,10/18/2017,"Ambience is great but I won't come here again sometime soon.. Stopped by for drinks and the flute glass had a big crack. I mentioned about that to the bartender and he didn't say a word and just changed the glass. Really? No apology? I was a bartender before and checking glasses before pouring drink is normal routine especially at place like this expensive. Sure, people make mistakes and this kind of thing happens and fine. Just say sorry! Saying sorry to customers when he made mistakes is part of his job.",,1,
23,Merlin C.,"Manhattan, NY",245,569,74,3.0,7/10/2016,"Sorry, but it just wasn't that great. We had a cheese plate (way too much cheese that cuts into your appetite), and I had a burger on ""brioche"" bun that was great but nothing exceptional. I don't agree with people who say the service staff was bad, though. I found them very attentive and friendly, and the food was definitely passable. It just didn't meet P2Q expectations (Price2Quality). Decor does not reverse things enough to provide a mystique that clouds one's judgment.",1,1,1
24,Delsy B.,"Queens, Queens, NY",0,4,0,5.0,7/31/2017,Great food. Can't wait to go back. Steak is phenomenal.  Great personal ambience from the second you walk and a very intimate setting.,,,
25,Greg W.,"Hoboken, NJ",278,622,5,3.0,5/1/2015,"Came here because the bar at the Andaz loves to be closed... Closed all day Sundays, doesn't open until 6pm on Saturday.. ugh..Anyway - Delicious gauge'y priced drinks at Madison & Vine.Came here for a snack and a couple drinks.  Walked out with a 3 figure bill.But while overpriced the drinks were very good and the food was solid.You could do better but you could do worse in the area.",3,1,1
26,David N.,"Brooklyn, NY",123,589,852,3.0,5/5/2015,"This is also a neighborhood I tend to stay far away from. The picking around this part of the city is slim unless you want Irish Pubs, Massage parlours but then that's not really eats I suppose. It was  a dimly lit room with soft music. Easy enough for conversation or romantic dinner depending upon your mood.Madison & Wine looked like comfortable reasonable spot for dinner to celebrate my friend's new luxury apartment in the sky (rental). The clientele looked like a cross between hotel guests who didn't want to venture far, gaggles of girls ready to go party afterwards and locals after work in the neighborhood. We got a table quickly by the friendly host.We started with the warm artichoke and spinach dip with plenty of chips to share. I thought it was pretty good and usually there are never enough chips but in this case it was more than plenty. I like that. I decided to try the meatloaf. It is something I don't make and I don't even remember the last time I had some. Plus it was a chilly night so some comfort food seems about right. My fellow to be New Yorker who still really NJ but hey it's a start got the ravioli. The ravioli was kind of bland seasoning wise, the pasta was a bit firm  but the filling was quite nice. The meatloaf was seasoned well and had a good texture. It was the right pick for the evening.Madison & Wine satisfied the dinner requirement and was an enjoyable meal in a subdue ambiance to enjoy the food and company.",2,,2
27,Tim C.,"Easton, MA",0,4,0,4.0,6/27/2017,"I happened upon this restaurant while looking for a breakfast spot near my hotel. What a great surprise. Excellent, delicious food, great service and some of the best coffee I have had. I will be a repeat customer as I travel here often for business.",,,
28,Katerina G.,"Farmington, CT",18,71,192,4.0,6/14/2016,"Found this restaurant when walking around with coworkers and have been back at least 4 times in the past month. Small restaurant but never had to wait long for a table to open up. I typically get one of the salads, calamari and sometimes sweet potato fries. Everything is always delicious or I wouldn't keep going back. Definitely one of my favorite places to go that is right near my office.",1,,
29,Susan L.,"Columbus, OH",0,5,0,2.0,12/25/2017,"This restaurant is connected to the Library Hotel by a glass door in the lobby of the hotel. It supposedly provides room service but it is closed today, Christmas Day. I don't think that most people should work on Christmas day but the area has only one or two restaurants nearby. I have trouble walking more than a few hundred feet but I would feel silly ordering a cab for the half block or so that would take me to the next closest restaurant, which may or may not be open today, either. That said, I have had two room service orders which have been complicated by erroneous information on the menu and in the hotel info book which states that room service is available every day from 11am to 10:30pm. On the day that I arrived, I called to place a lunch order for delivery at 3:15 pm in accordance with the menu which states that the lunch menu is available until 4pm. I called and after the phone was eventually answered and placed a lunch order. I then received a call from the hotel desk clerk informing that the restaurant was closed for dinner prep and I would not be receiving my food. I eventually received my order by repeatedly pointing out the bad information in two hotel provided sources. It happened again the next day when I tried to use room service for breakfast and went through the same rigamarole. It seems that there is a brunch menu that the hotel had not placed in my room. Today, I followed all the rules only to be told that the restaurant is closed today. I only stay at hotels that have room service available because I have substantial mobility issues. Neither the hotel nor the restaurant provided acceptable service. I had to argue the issue that there were people in the kitchen who could make a hamburger which is on both the lunch and dinner menus. They eventually sent me a raw hamburger (I had requested a     medium fry) between two slices of brioche-style bread. The burger was only mildly warm and the bottom layer of bread had disintegrated due to the bloody meat and cooking liquids. The ""deluxe"" was fresh and plentiful and the fries, also lukewarm, were okay and the dipping sauce was excellent. The eggs benedict that I received the next day was also lukewarm but otherwise nicely cooked and flavorful.   On the whole. my poor experiences were more the hotel's fault but I would have sent back the raw burger if I hadn't been concerned that an annoyed kitchen staff might spit on the second burger because everyone seemed annoyed that I expected the service that the hotel and the restaurant had offered. Nor would I have ordered a second meal from them or counted on eating there this afternoon if I had had an alternative that wouldn't have left me too fatigued to enjoy the shows that I came here to see.",,,
30,Pracheta T.,"Easton, PA",44,661,83,4.0,7/11/2016,"Lovely spot. Stopped here for an afternoon drink while meeting a friend. The openness of the place is what really stood out. On a hot day the breeze could be felt even at the bar and it felt so much more refreshing than sitting in a stale, air conditioned bar. Bartender was great and the wine and beer list was above par.",,,
31,Leana D.,"New York, NY",36,169,121,4.0,5/10/2016,"The Bookmarks rooftop was packed, so we ended up downstairs at Madison & Vine.  We shared a great bottle of prosecco (two actually!) between friends.  Service was friendly and the place was lively.  Definitely a solid happy hour spot for the area.",,,
32,Kirsten H.,"Denver, CO",169,910,757,2.0,3/30/2015,"I've been to Madison and Vine a few times for lunch during the work week. The food is ok, but I have yet to order something I can rave about.The restaurant itself both physically and aesthetically cold. The first time I dined here, I got the chopped salad with chicken. It looked like a pre-packaged salad that you could purchase at a grocery store. I've also tried the grilled chicken paillard, the roasted organic chicken, the turkey club sandwich, and the seasonal vegetables. None of them were bad, but none of them were great. My favorite was the chicken paillard, but that too left something to be desired. I will probably end up returning with colleagues, but if you're looking for an outstanding lunch this is not a place I'd recommend.",,,
33,Wendy K.,"Washington, DC",0,1,0,1.0,11/15/2015,"After an hour, we walked out and will not return.  I cannot comment on the food as we never got any.  We wandered in at about  8pm wanting a light supper.   The restaurant  was not busy only having  a  few  tables filed and we were seated promptly.. They had several wait staff and a hostess. We gave our orderr which was simple..one salmon dinner and. one cheese plate.  The waiter brought over a roll for each of us. My husband and I chatted, a while and about 15 minutes later several food orders came up for other patrons.Several other guests arrived at the restaurant and were seated near us. We continue to chat and started looking up information about the Madison and Vine restaurant iand the Library Hotel while the three waiters continued  chatting together in the corner not once coming by our table. except to seat a new guest and take their orders. Food continued to come out being placed on tables of people who arrived after us.  We called over the hostess because our waiter was deep in conversation with the other waiters.   She requested that our waiter come see us.  Our waiter looked over to us, and seemed  to be discussing our order with the other waiters.  He then went over to the POS system and looked to be ringing in an order.  Finally he came over to us and said it would be iout shortly.  My husband asked to see the manager and told him.. we had been waiting for our food for over 45 minutes and everyone in the restaurant were finishing their meals (more tha one course).....The manager's response when hearing this was a flippant (not anyway any way apologetic) ""sorry guys"".   We come to New York several times a year, stay in nice hotels, eat nice food.  This restaursnt""s treatment  of guests was subpar & is not recommended.",4,,
34,Colleen S.,"Belmar, NJ",0,11,0,2.0,6/26/2016,We were meeting my friends near grand central before heading to a concert. We all wanted to grab an early dinner and they found this place so we met them there. I got the beet salad at $17 with added chicken for an extra $5. There were 4 tiny pieces of beet and the chicken was shaved and more like a garnish. There were about 6 pieces of the thinnest sliced chicken I've ever seen in my life. There was supposed to be a goat cheese cream on the salad and there was the skimpiest schmear of it on my plate. The presentation was lovely but there was no substance and we were famished an hour later. I don't know this neighborhood but it seemed like a total tourist trap to me. The cocktails were good and the service was fine which is the only reason I'm giving any stars at all,,,
35,Tina M.,"San Francisco, CA",13,13,0,1.0,5/12/2016,"Sitting at the table writing this...that's how bad it is. Total bill for 2 ppl is $135, here is what I have issues with: 1. No steak knife with $36 steak2. Multiple requests for things3. Missed waitering 101 - refill water and bread before entree 4. Service didn't give a rats behind5. Food was good...that isn't enough for a better rating 6. Wine cup came out straight from the dishwasher..wet Bottom line, I wouldn't mind this service if I paid half the price. Not a place to have standard expectations of food service.",,,
36,Michael N.,"Arcadia, CA",167,294,147,5.0,12/15/2015,"This place is better than their rating.  We had just about everything on the menu and it was all good.  Service might be a bit slow, but the food was great and we had great time.",,,
