,er_name,er_location,er_freinds,er_reviews,er_photos,er_rating,er_date,er_text,er_useful,er_funny,er_cool
93,Gustavo R. M.,"Ridgewood, NY",128,15,1,4.0,8/11/2014,"Rosie is a phenomenal waitress, first and foremost. Came by myself after a morning walk, searching for someplace new to try. Vicky's happened to be closed, so I walked even further south from my Inwood abode and came upon this place. Got a breakfast special, with fresh-squeezed oj.. Amazing. Green tea came with it and though the western omelette wasn't anything to write home about, they accommodated my paleo needs, substituting home fries and toast for sweet potato fries, which tasted fresh.. Great place to come in for your morning meal, it's worth the walk from my Inwood apartment, that's for sure.",,,
94,Jay H.,"New York, NY",0,7,0,2.0,"5/20/2015
            





Updated review","New ownership, maybe? I'm not sure, but the food seems to be not so good lately. Also, they 'raised prices' without updating their take out menu! The cashier claimed that they had 'new prices' but still gave out the old menus because ""people wanted the phone number."" Definitely not worth 5 stars anymore, now they are just deceptively overcharging for worse food.Anyway, very disappointing, so watch out. They used to be good, but now I have to update my review.",1,,
95,Christine W.,"New York, NY",14,6,3,4.0,7/5/2014,"This is definitely my favorite food spot in the Heights, where I live. It had a cozy diner feel and an expansive menu. My roommate and I went for holiday brunch on the 4th, and they had a special that included juice (or cocktail), coffee, and a meal - for about $15. It doesn't get much better in Manhattan.",,,
96,Anise A.,"New York, NY",1,1,0,4.0,11/9/2015,"Not many options for food in Washington Heights outside of Spanish Food. But for a ""non Spanish food"" restaurant it's not so bad.",,,
97,Lauren N.,"Rockville, MD",7,38,176,3.0,1/19/2014,"I've gone in several times for coffee and lunch. I've sat at a nice big booth doing work on my laptop, and staff refilled my coffee for as long as I was there, which was really nice. Great for lunch specials--soup, salad, and entree for $13 or under. Overpriced for dinner.",,,
98,Paul S.,"New York, NY",183,52,2,4.0,4/18/2013,"We went to Hudson View Restaurant this evening for dinner.  We live in the neighborhood and this was probably our fourth visit.We had the mozzarella sticks as an appetizer.  Quite yummy.I had the chef salad for my entree.  Delicious.  My fiance had the Santorini wrap and enjoyed it.Service was excellent and they were very accommodating when I asked to move to a different table.All in all, recommend!P.S. No actual Hudson view -- but it's a short walk to the view of the Hudson and the George Washington Bridge.",2,,
99,Tamaz L.,"New York, NY",0,2,0,1.0,4/23/2015,"PLEASE READ if you're considering this place. Now, you might not believe my review since I've been here several times. why do I return? Well, because they are just around the corner and I've been giving them the benefit of the doubt, but I'm done.Food - I'm sorry to note this here, but there hasn't been a single visit I made and didn't have diarrhea. Seriously, all of my family ends up with the unpleasant problem (including my toddler), and we are Normal. Taste isn't bad, but is far from being perfect.I truly believe that this place should be closed down, read on for info onSERVICE:Breakfast - to be frank, I've only had breakfast here couple if times, and service is much greater than on later in the day. Kitchen I assume is same, as they never care about personalized orders, there attitude seems to be - ""just take it and eat it (and DON'T enjoy it). They even have a busser, but morning servers do great/fair job.Lunch/Dinner - if you slightly care about yourself, DO NOT GO IN there. This is beyond just service problems. I would close my eyes if it were only that they always forget lemon, or ice don't break ice, don't know the menu, etc. I might not like it, but am not that picky to give 1 star just for that. In addition to having bad service in all sorts way, they just don't care, don't be surprised if you find noodles in your coffee or hair in any dish; but this is my favourite, when we got our deep fried bug with our food and told the server, she replied, and I quote, ""Oh, I'm so sorry, that happens everywhere."" What?! Such a relief.PLEASE, don't go there, there are many other places nearby, and if you stilld do beware fof consequences that last beyond just the duration of your visit.",1,,
100,S R.,"New York, NY",0,7,0,5.0,10/15/2016,Great place. Great food. Nice spot for weekend brunch,,,
101,tyler s.,"Manhattan, NY",23,32,0,5.0,8/18/2013,"I've literally eaten here at least a couple hundred times over the past half decade. Hudson View is my favorite breakfast/brunch place in the city. They have great pancakes and coffee, and everything else I've gotten is solid, especially the penne a la vodka. The service has been consistently good. The managers are real professionals and seem to run a tight ship. If I've ever seen a bad server, they didn't last long.I don't get the people saying it's expensive. Maybe if you're expecting fast food prices? This is Manhattan, so if you can get some eggs and meat with coffee for under $10, you're doing good, right? I can't remember ever paying more than about $13, and that's for the hungry man breakfast.I feel bad for taking so long to write this review. I used to both live and work right around the corner, and I would eat there several times per week. I now live way up in Inwood, as in north of 215. There are quite a few places up here, but I often find myself taking the A train back down to 181 for Hudson View. It and the recent additions like Le Cheile and Saggio have really made 181 a nice little strip for eating out.",,,1
102,M H.,"Manhattan, NY",0,38,0,4.0,6/24/2014,"It's nice to have a diner spot in the heightsThey are consistent, you know exactly what you're getting here food wise. Breakfast all day! And they're always accommodating to larger groups which is nice.",,,
103,Michelle M.,"New York, NY",77,21,2,5.0,8/13/2014,"Challah french toast is to die for. Fairly fast orders. Sandwiches are made with really good meat (like carved turkey from Thanksgiving, not deli meat). Place is clean and they have long hours of operatijon. Love the waitstaff, who are polite and attentive*. ""with the exception of this guy Roman. It's been a long time since we zero-tipped someone, but this guy was the terrible. Not very friendly and very slow to do simple things when he only had 2 tables, and it was only 9p.",,,
104,Donald J.,"New York, NY",0,25,0,5.0,6/19/2016,"I just happened to find this restaurant whole looking for breakfast in Washington Heights  and wow! A better diner I have never found. Fast service, food cooked exactly as I requested, grits (!) and fresh squeezed orange juice. I had to come all the way from Chelsea to find the best. My only  issue is that they don't toast challah",,,
105,Daniel P.,"New York, NY",7,8,6,5.0,3/17/2015,"There's nothing outwardly attractive about the restaurant; there's little attention given to atmosphere or decor. The food was delicious, and perfect for the brunch I was looking for, but, in all honesty, it is hard to mess up French toast, eggs, sausage, and bacon. What really stuck out about Hudson View was the excellent service. Though it was my first time in the restaurant I was greeted like a regular, given attentive and friendly check-ins, and treated to smiles all around by waitstaff that seemed genuinely happy to see me. I'll be returning to this diner.",,1,
106,Yelli M.,"Manhattan, NY",0,12,0,1.0,6/13/2014,Ordered breakfast from this place today. The French toast were horrible and salty. Eggs and sausages and ham seemed like they were cook in a microwave. The cinnamon raisin bagel was stale and you can taste it even though it was supposedly toasted. Extremely horrible! Food used to be ok but now just uneatable!!,3,,
107,Ryun H.,"New York, NY",39,13,3,2.0,11/9/2014,"Went there today with partner, who ordered a bowl of chicken matzo ball soup. When he told the waiter he wanted the chicken matzo ball soup after the waiter listed the soups, the waiter said, ""NO (he raised his voice when he said this), we have chicken noodle, vegetable, and (something, I forget). We also can put matzo ball in the chicken noodle."" Isn't that what my partner said, chicken soup with matzo ball? Anyway, I ordered the turkey sandwich. At $9 it was just bread, lettuce, and turkey. It came with a pickle and slaw. No tomatoes or anything - and turkey was cold. Not sure if it was supposed to be, but the bread was toasted so it was weird eating a cold turkey sandwich with warm bread. I didn't finish it because it was dry and bland.Partner's soup bowl had something caked on it and was way too salty, like something out of a can. He had it taken back, and didn't want it anymore. The waiter came back and said something along the lines of ""I am being honest with you, it was not dirty, that was from the soup, it dried on there from the top line."" Total lie, considering we couldn't scrape it off with our fingernails and it was below the top line of the soup - only after a few sips did we notice it. Even if it was from stock, it clearly wasn't from this batch of soup if it was caked on. The defensiveness he showed was aggravating. He took it off the menu, which we appreciate, but we ended up having to go somewhere else for food anyway. After tax and tip, I spent about $11 for a cold turkey sandwich that I didn't even want to finish. He also never even came by to ask us how it was, so we had to call someone else over to let them know about the soup bowl problem - and it was 3 PM, not that busy with all the staff there.I also saw the waiter shake his head a few times at us when he was on the other side of the restaurant after the soup issue, and heard another woman say, ""Can we get some service? Why is everyone here so grumpy?"" Maybe it was just an off day. Regardless, not a good experience and won't be back.",1,,
108,Ed P.,"New York, NY",23,31,0,3.0,7/4/2012,"I'm so mix-feeling-ed about this place that it's ridiculous.I live locally so I've ordered here on occasion but not because I love it or anything.Things I've liked:eggs are okayfrench toast?oatmealshakes, sometimesThings I would completely avoid:toast: how do you mess up toast? ...how?most sandwiches: bread is generally from the supermarket, and they don't know how sandwiches are supposed to work. pretty synonymous with toast above.fries are really inconsistent. They're usually very busy but generally quick. I think they'd be better if they had a little bit better quality food--I'd wait for it.Wait staff (from my experience) is pretty nice!",2,1,
109,Adam J.,"Aurora, CO",28,3,0,4.0,1/19/2013,Great Food - server was very attentive.Loved seeing the Pride flag outside here in Washington Heights!Thanks you. Till next time.,,,2
110,Elizabeth S.,"New York, NY",242,318,3,3.0,3/30/2014,"Food is OK. Service is OK. Atmosphere is... leaving something to be desired. Small, and certainly a misnomer in the name. For the most part, agree with Peter K's review.",3,1,2
111,Dashiell B.,"New York, NY",42,11,0,3.0,3/20/2015,"Good solid diner. Good food, good portions, friendly service. Salads are big.",,,
112,Adam K.,"New York, NY",9,40,15,2.0,1/20/2015,"I live right across the street from this place and find myself there often, mainly because it was one of the only places around the neighborhood serving a decent breakfast. I found out today that they've gotten rid of their morning specials! NO MORE MORNING SPECIALS?!? I don't know what's happening at the diner recently...maybe someone new in charge, but when you have mediocre food, you have to give people more of an incentive. Two stars for the nice staff and atmosphere. Everything else needs to be worked on.",,,
113,Loui M.,"New York, NY",4,11,2,1.0,8/16/2015,"Went there this afternoon and I won't go back. This is a restaurant but in reality a dinner. The food was horrible but the service from wait staff was great. The biggest drawback is that dude (owner, manager) who greets you with a long face and overlooks at the whole place like a bully. You can sense how tense the staff looks. He just stands there then sits right by customers. It's awful. The dude needs to go hide in the kitchen and hire a friendly host(ess).",2,,
114,Amala S.,"San Diego, CA",108,129,55,1.0,4/13/2014,"Good brunch deal, giant mimosas and big plates...Everything was fine until TWO cocroaches crawled down the side of the wall and customers at the next table warned me in time before it landed on me. A busser quickly killed them both with his wash cloth and I figured he would alert a manager. No further follow up, at all.",2,,
115,Monica H.,"New York, NY",333,554,1808,4.0,12/27/2010,"I like this place! We went last night in the Blizzard of 2010. They were (and always are) open until midnight. Had a tuna melt - not the best by any means but good enough to satisfy the craving in a snow storm. The fries were definitely good, I always order them well done. I love the waitstaff, especially the woman with short brown hair. She's the bomb. She tells it like it is, keeps the hot coffee coming and makes sure the order is how you asked for it.Again, this is by no means comparable with the Red Oak Diner in Fort Lee, NJ but it's the best diner we have up in the Heights and it's walking distance from home so if I can't travel across the GWB for a real diner experience then I'm coming here and I know what to expect.",,,
116,Belinda B.,"Manhattan, NY",0,16,1,4.0,4/12/2015,"Second time at this restaurant, the food was tasy,  and filling the service was friendly.  I would  recommend this place to a friend.It's also very easy to commute to. It's literally right next to the A train.",,,
117,Bryce W.,"Manhattan, NY",32,124,6,4.0,10/12/2014,"This is the sort of simple, wear-pajama-pants-in-at-noon diner that every neighborhood needs. You eat here when you're hungover or you need some greasy food to drunkenly stave off a hangover or you only have $10 on your wallet and you need a burger. The servers are all friendly and the menu is huge. There's a wine selection, which no one ever, ever selects from and they serve beer, which makes more sense. The fries are perfect, so always get the sandwich ""deluxe.""",,1,
118,Jeph A.,"Manhattan, NY",105,18,4,4.0,6/14/2012,"Let it be known that Hudson View Restaurant does not offer a view of the Hudson River! Regardless, if you're in south Inwood and looking for a simple American meal (sandwiches, burgers, etc.), look no further.Situated right outside the southeast exit of the 181st St. A station, this diner is clean and friendly and has a nice ""we love NYC"" vibe to it (there are posters from recent and classic Broadway shows on the walls along with some nice photographs of landmarks like the G.W. bridge, which is right down the street). The staff is usually very relaxed and on-point, and they seem to get along well, which for me is always a plus in diners.The food is nothing out-of-this-world extraordinary based on my experience, but I have nothing negative to say about it. The french fries are always crispy and never too salty, and the dishes are always well-made with fresh ingredients. Their menu is pretty broad, which will certainly keep me coming back!I think their current health rating is still pending, but I wouldn't' be scared by the most recent one (which is a ""C"" from last November, preceded by an ""A"" from a year ago). For a NYC diner, this place is aces.",1,,
119,William C.,"Brooklyn, NY",1037,826,77,4.0,7/1/2012,Great diner in an area that I did not expect it.Service excellent and menu is pretty much diner standard.I ordered a bison burger with one fried egg and avocado on pita bread. topped that off with a baked potato and a cup of hot tea.I was full all night!I'd definitely eat here again.,,,
120,Twombly P.,"London, United Kingdom",0,22,5,3.0,11/30/2014,"Not much competition for brunch in Washington Heights, and it shows here. Perfectly adequate, friendly enough service and reasonably priced. Nothing to excite but equally nothing to regret.",,,
121,Andrea S.,"Tempe, AZ",338,395,103,4.0,7/3/2011,"Ahhh, the local diner. My viewless Hudson View diner. This is a classic diner. When I want an omelette with toast and sausage and a cup of (not the greatest in the world, let's admit) coffee, I come here! I bring my kindle and just chill out for a few hours. A fun activity to do here is to eavesdrop on conversations the little old ladies are having. It's pretty easy, since they're shouting at one another. They talk mostly about their health and the weather. Sometimes they make fantastical trips to midtown to see their doctors. They often go to the hair salon, but their damned stylists never get that blue curl just right.Yes Hudson View, you do me right.",,6,
122,Albert E.,"Brooklyn, NY",59,70,3,2.0,5/7/2013,"I ordered a pizza burger. It came with Cole slaw and pickle. The Cole slaw was actually okay mainly because it was sweet and I like it that way. However, the burger was soo greasy that it went right through the bun. Whole thing turned into a greasy mess. I had to eat it with fork and knife. Don't get burger. That is all I had, maybe other things are good, not the burger. I spent the next 3 hours trying to drink water to keep the oil from the burger down. Felt like a drank a cup of oil.",3,1,1
123,Cole L.,"Manhattan, NY",0,2,0,4.0,1/3/2012,"I live in the neighborhood and have been going to HV for breakfast from the time it opened and am definitely a huge fan.  My usual is the Florentine Eggs Benedict with a side of bagel (instead of the standard toast) and their freshly (when I say freshly I mean FRESHly) squeezed OJ. But, these past two weeks a friend of mine has been in town and we have gone to HV for dinner and I've been beyond pleased.  First, their grilled Norwegian salmon over the house salad was fresh, flavorful, and filling.  Second, who woulda thunk a diner could get beef goulash right? Well HV did!!! I HIGHLY recommend. Definitely ask for some extra bread dip in the sauce at the end. Overall, great diner!!",1,,
124,Yvonne G.,"Manhattan, NY",78,41,4,5.0,4/5/2014,"Good, simple diner food. The place used to be a dump, but they completely gutted the place and remodeled it a few years ago. Good move. The price has gone up because of it, but you're still paying less than down town. They deliver breakfast. Keep this in mind when hungover.",,,
125,Anna C.,"New York, NY",28,18,0,4.0,8/17/2014,"For a neighborhood diner, this place is pretty good. My only complaint is their prices. I feel for the quality of food it's a bit much. Don't get me wrong, the food's decent, but it's not outrageously delicious and for their prices, you'd expect a little more(quality, not quantity). I mostly order in, and they're consistent with their delivery times. Large selection of all diner favorites.",,,
126,Karina U.,"Manhattan, NY",90,20,2,3.0,5/10/2014,Very nice place and friendly staff.  The food is decent for diner food.,,,
127,Rachel M.,"Manhattan, NY",313,57,7,4.0,8/12/2013,Nice diner in Washington Heights.  Good food and decent prices.,1,,
128,Chris R.,"Los Angeles, CA",498,412,97,3.0,5/19/2013,It's alright for bacon and eggs. The Challah French toast is good.  I didn't like that they deep fried the sausage and the bacon -- a lazy and greasy way of cooking food.,1,,1
129,Pedro L.,"New York, NY",0,5,0,5.0,9/2/2014,Amazing place ! I'm 19 lived on this block since then and eaten here since I was a little boy. Breakfast is just amazing their chocolate chip pancakes are to die for.,,,
130,Ariela B.,"Brooklyn, NY",88,293,591,4.0,5/28/2009,"I like diners. They're a good ""default"" place to go if you can't figure out what sort of food mood you're in. Mexican? Eh, not today. Chinese? Not in the mood. Pizza? Trying to lose weight. Ah screw it, let's go to the diner.I'd say Hudson View is a good diner option for the Washington Heights area. Their non-specials are a little pricey compared to other neighborhoods, but then again I'm from Brooklyn - we're kinda spoiled when it comes to cheap diners.Quality-wise, I'm definitely a fan. Their food is good, and pretty consistent from what I've seen so far. The staff is very nice and attentive as well (though the guy who's supposed to refill people's water glasses tends to zone out more often than not).But yeah. Overall? Good food, clean, and conveniently located right off the 181st Street A train entrance. That makes for a good lunch spot in my book.",1,,
131,Anthony M.,"Jersey City, NJ",120,303,149,4.0,2/16/2014,"It's convenient, clean and close to Bway/181 area. I can't speak to brunch or to seamless but I can say that as far as diners go, this place is very decent. The wait staff is especially polite and the food is good. It's a relatively small place but it's on the corner with all glass looking out on Fort Wash and 181 so it doesn't feel claustrophobic. The prices aren't necessarily cheap and I get that people generally expect cheaper for the Heights but I didn't find anything appalling about paying $10-12 for a decent breakfast in NY. A coffee and sandwich from DD will run you $6 easily so don't complain.",,,
132,J R.,"Kennesaw, GA",0,13,1,5.0,8/22/2014,"I order from Hudson all the time and I love it. I've been in several times and the staff is always nice and attentive. The food is great and portions are generous, always my go to when I don't want to cook. Yum!",,,
133,Joe D.,"Roselle Park, NJ",241,25,10,5.0,10/12/2013,A breakfast/brunch diner favorite after church on a New York Sunday.  A favorite of ours.,,,1
134,Kirsten S.,"New York, NY",133,335,1,3.0,4/1/2011,"Really great atmosphere, but unless the food is great I will not give 4 stars.  It's fine.  I just like food THAT much.When you walk in, it's kind of like Denny's... older folks, a quiet atmosphere regardless of how many people are there, etc.Well, my party of 6 changed everything about that.  We were so happy to hear that they could accommodate us with a BYOB deal (thanks to my very convincing colleague), and we took some wine into the restaurant and just ordered food.  They didn't even charge us a corking fee (we were very good customers, though... see the bottom).Food was what you would expect from a place that everyone I know nicknames ""The Diner,"" but the service, while not perfect, was extremely nice.  We had a super-intense but really friendly waitress who recognized some of us from previous meals.  She was extremely accommodating and completely deserved the 45% tip that we gave her, partly for service and partly because everyone put in a little extra (she came back and said a really sincere ""thank you"" after I assume she counted the tip).Fries are medium-thick and perfectly crispy.  They have homemade veggie burgers (which, sadly, I don't like that much compared to a good ole Gardenburger, but some love them).This is one of those restaurants that just exemplifies life's rule: If you are really nice, people will be really nice to you.  I'm a fan.",1,,1
135,Ron E.,"Manhattan, NY",58,79,117,3.0,11/10/2013,"John my friend owns this Diner. My dear friend, I love you like a brother. When I saved you a million$$$$ you loved me too. Come uptown and get out of Chelsea . We need to eat here too!  Please spend more time up here. I promise to visit more often but we need you operating the place! Love You, Ron",,,
136,Keiny H.,"Orlando, FL",45,13,2,4.0,10/7/2012,"In my opinion, I think this is the best local neighborhood diner. I have been here a couple of times at different hours, and I have never been disappointed. The food always tastes good, and the service is quick. The portions are also big. Even their Mimosa and Bloody Mary's at Brunch are pretty good. One of my favorite things to grab is the Delux Turkey Burger which is always good. Not dry or anything. I definitely recommend this place if you live or visiting Washington Heights and want good ol American food like burgers, pancakes, etc...",2,,
137,Laiza M.,"New York, NY",38,26,0,3.0,3/30/2013,"Regular standard diner food, it's usually hit or miss with this place. One day you get an awesome burger, other days you will get a burnt or soggy burger. The vanilla milkshakes are great and the chocolate milkshakes are terrible! When dining -in the  customer service is pretty good but with delivery they sometimes will mess up your order.  My biggest complaint is that it's ridiculously overpriced! Considering their high prices , it's too risky for me to have them often not knowing wether it will be a hit or miss experience .",1,,
138,Andrea F.,"Manhattan, NY",0,9,0,1.0,1/14/2015,"I ordered roast chicken, it was disgusting. Next time, I ordered salmon, smelled fishy. The waiters are nasty and the prices are expensive. On January 14, 2015, my friends were having coffee waiting for dinner, and a roach walked across their table. We're all DONE.",1,,
139,Phin L.,"Washington Heights, Manhattan, NY",0,32,0,2.0,3/26/2015,I'm sorry to say I found the food abysmal. I bought a sausage breakfast muffin or whatever they are called. Fluorescent yellow cheese. Cheap bread. Highly processed meat. I could hardly eat it. Won't be back. It pained me to leave tip. It really did. And this place isn't cheap!,,,
