,er_name,er_location,er_freinds,er_reviews,er_photos,er_rating,er_date,er_text,er_useful,er_funny,er_cool
0,Christina B.,"Manhattan, New York, NY",0,11,5,4.0,11/16/2018,"Two words. Eggs. Benedict. They have one of the best eggs Benedict I've had in the city and I try to always get it if it's on the menu some place else. I've tired the crabby Benedict, the San Paulo Benedict, the Florence benedict. Always delicious always satisfying. They give you a big plate too I usually can't finish the home fries that come with it. My only complaint is the delivery. The price difference is ridiculous your better off just going over there and picking up the food or just eating at the place itself. Well worth the trip!",,,
1,Matt H.,"New York, NY",2,3,0,1.0,11/7/2018,"So yeah, went there and had a very decent meal, one that I appreciated, a sentiment that I felt was reflected in my tip, which was included when paying my bill via credit card. But I guess it wasn't good enough, because my bank statement shows a higher amount charged. Which is, you know, fraud.Point being, if paying by credit card, check your statement afterwards. Or better yet, just don't go there? The food is good but not THAT good.",,,
2,Shanz P.,"Palo Alto, CA",0,1,2,5.0,9/1/2018,Amazing toast sI love e it This place has great food and great drinks everyone is so nice and the toast is real crispy,,1,
3,Ange C.,"Staten Island, NY",166,128,211,4.0,5/20/2018,"Not too far from my friend's place, we decided to get dinner for breakfast because why not? We split the hungry man - French coast, sausage, ham, bacon, two sunny side eggs. It's a lot of food! Nice wait staff. Pretty standard diner- we didn't have to wait too long for our food.",,,
4,Diana A.,"Hialeah, FL",11,73,306,4.0,7/14/2018,"Really cozy and comfortable place to sit down and eat a nice breakfast/brunch. On their Sunday brunch menu they have a specials page that includes some items on the menu with a free mimosa and either a coffee/soda/tea. I ordered the French toast with fried eggs on the side and a slice of ham. My boyfriend got an omelette with ham, hash browns and a side of avocado. Everything was delicious, especially the moist and soft French toast! Very yummy. The waitress wasn't the greatest, she seemed a little frustrated with us and when we got up from our table, she noticed us and not even a ""goodbye, have a great day."" Overall, service wasn't the best, but the food was really good. Would recommend for anybody around the area.",,,
5,Rosemary V.,"Manhattan, NY",245,502,263,3.0,1/16/2018,"This place is down the block from where I live so I have been here a couple of times.Service: It is good, nothing out of this world but good.Food: For the most part this is standard diner food;their french toast is good but the two times I ordered delivery they forgot the maple syrup.  So there goes that.Also, if you order online, it is cheaper through Yelp than through grubhub.",5,3,5
6,Rainier W.,"Manhattan, NY",0,4,1,2.0,8/3/2017,"This place went from one of our neighborhood go-to weekend breakfast spots to fairly useless in the course of a few months.The Monday to Friday service is pretty bad.  Whether this is due to an untrained staff or cluelessness on the part of the manager is unknown.Tables aren't bussed properly or in a timely manner.Customers can choose their own seats, which is great during the slow morning summer traffic, but who is going to sit at a dirty table?With 5 customers seated there was a 20min wait to get menus, water and coffee.  That's a huge problem.The orders were screwed up and never corrected.+ The food was fine.  Huzzah...The bill was wrong and took 5mins to fix.Here is an added bit of fun...their food service grade went from A to ""grade pending"".My advice is to go the Vicky's Diner on 187th.",4,,
7,Sam R.,"Teaneck, NJ",0,2,0,1.0,8/24/2018,"HORRIBLE EXPERIENCE. The manager or owner was a jerk. I was having breakfast with my mother and boyfriend, and he decided to yell and humiliate the chefs right in front of all the customers eating! How rude and disrespectful. I feel as a manager YOU should have taken your employees somewhere else and spoke to them not talk DOWN ON THEM in front of everyone. At the end we were trying to approach the manager to let him know & he just dismissed my mother. If you can't handle customer service close your business or obviously you should hire someone else to do a job that you couldn't do in the first place.",,,
8,Lydia T.,"New York, NY",87,167,90,4.0,3/9/2018,Its a great little corner diner....with HUGE servings of food. Not ALL the foods are hits but their breakfast is 100000% on point. I honestly could live off their omelet meals....like just one meal is enough for me to go the whole day. But that might be because I'm a small 5ft girl.....EITHER WAY.....I love their breakfast,,1,
9,Andrew B.,"Cumberland, RI",16,74,0,2.0,4/24/2017,"The Hudson View offers diner-sized portions of disappointment. From the lack of a view to the quality of the dishes, they leave much to be desired.I've eaten here at least 3 times because it's a convenient and inexpensive restaurant near some family members. They maintain that there are a few worthwhile dishes, but none I've had would so qualify. From greasy and bland omelettes to greasy and bland homefries, few other adjectives suffice. I was not the only member of my group to have this experience.Yet the reason I give this restaurant two stars (instead of one) is that some people I trust say there are some worthwhile dishes, the chocolate cake looks good though I've never tried it, and the service is reasonably friendly and moderately expedient.I highly recommend Le Chéile down the street. It may sound much fancier or seem irksome to pronounce, but the restaurant offers a great brunch menu, good service, and reasonable prices. If it doesn't suit your needs, there are plenty of other solid choices in the immediate vicinity.",2,,1
10,Kevin W.,"Columbia, MD",1,234,4,2.0,10/6/2017,Meh. Dry breakfast sandwich. Only had grape jelly. Omelet was just ok. Turkey sausage is a lot like kielbasa... not super breakfast-y. Portions were big.I can certainly find a better breakfast in NYC for less.,4,,
11,Laura P.,"New York, NY",0,7,0,3.0,7/17/2018,"Pros: Broad menu with many choices, some meals are reliably decent (e.g., chili, spanakopita), and delivery is usually fast and accurate. One of the few places that delivers in the morning.Cons: A lot of the food is bland and uninspiring, and it is overpriced for what you get. I've had a few decent meals here but never a great one, no matter what I ordered. For similar prices you can order from other neighborhood establishments that use fresher ingredients and pack more flavor and care into their food.Overall: Standard diner fare, overpriced, food not terrible but also nothing special.",,,
12,Mark A.,"Manhattan, New York, NY",5,6,4,1.0,10/31/2017,These mozzarella sticks actually look better in the picture than they do in real life they are burned and taste horribleMy cheeseburger was also burned but I threw it away before taking a picture do not eat here this dinner should be shut down  but in their defense it was delivery and did come pretty fast but other then that this place needs to go,2,,
13,Jamie C.,"Boston, MA",265,72,98,5.0,1/17/2018,"Quick, simple, easy breakfast with generous portions conveniently located steps from the subway. Cute, cozy ambience with fresh flowers on the tables. I dined here during a snow storm, so my review may be a bit skewed, but the waiters were very personable and accommodating, and I had a very pleasant meal!",,,
14,Jennifer B.,"New York, NY",31,3,0,3.0,8/21/2018,"At Whole Foods, you can buy a container of Cottage Cheese (Organic, mind you) for $5.99...in fact the average cost for a container of Cottage Cheese is 5 dollars. So I'm just trying to understand the logic in charging $5.25 for a SCOOP of cottage Cheese. The food is good, the service is fine, I just don't understand who did the menu prices. I mean just how big is that scoop? If that scoop can fit into a full sized container then ok...but then its not a scoop its a container of cottage cheese. Baffled.",,1,
15,Courtney J.,"Rosedale, Rosedale, NY",586,6,6,2.0,8/30/2018,"The food at this restaurant arrived cold upon delivery. Everything was bland except the mash potatoes. I asked for a medium steak for my bf and got a well done slab of burger meat. The onion rings that came with the steak were soggy as if they put the food immediately into the container with no down time to release the grease. The turkey burger was supposed to come with ketchup and bbq sauce, but instead it came with NO sauce. I especially asked for no tomato bc I am allergic to them but low and behold, I open a container with GIANT tomatoes and soggy fries. Who puts fries in a container with wet veggies? Now I have to hope I don't die or throw the food away. And I spent almost $50 at their restaurant today. The driver must have wandered around before delivery because the food was cold. The restaurant has a 3 yelp review and I regret giving them a chance. This was the worst food experience ever.",,,
16,Beth-Ellen K.,"New York, NY",84,24,0,1.0,9/1/2018,"Ordered a burger deluxe with grilled onion and mushrooms.  Definitely not worth it.  Meat was dry and tasteless, bun was soggy, cole slaw was spoiled.  Requested extra ketchup and didn't get it.  Money wasted.",,,
17,Jin-Ahé F.,"Paris, France",43,2,0,1.0,2/4/2018,"The service is more or less good but the food is way too expensive for what it is, the home fries taste like if they were in a fridge for a year, the maple syrup was warm, the eggs taste like sponges and the waffles were dry. So unless the bacon and sausages, it was awful.",2,,
18,Andrea L.,"New York, NY",1,8,0,2.0,6/3/2018,"First, let me preface this by saying that I ordered through Seamless.  Seamless gives the customer a place for special instructions - to add something that's not on the menu, for example.So this morning I placed an order for breakfast.  Not sure what kind of NY diner doesn't offer home fries/hash browns on their breakfast menu, but Hudson View Restaurant doesn't.  I added to the instructions that I wanted 2 orders of home fries, and that they could add it to my bill or I would pay cash.  I also indicated that I did NOT want to receive plasticware and ketchup.The food was fine, but apparently the people getting the orders don't know how to read.  We didn't receive our home fries and we did receive a big bunch of plasticware and ketchup.Really annoying.The food is basic diner food, pretty fresh.  However, it's really aggravating that they don't read their incoming orders.",,,
19,Joshua P.,"Leesville, LA",111,1,0,5.0,5/30/2018,"I can not describe how good it was. The onion rings are amazing. The patty melt was good. Everything taste fresh and made in house. The cheesecake was soooo good!I'm very happy with my visit. The waiter is patient and nice. Love the atmosphere. VERY reasonably priced. Daily specials sound amazing. I mean I could go on. Definitely worth the visit. It's probably gonna become my ""i dont want to cook"" spot since its a block from my house.",,,
20,Gris L.,"New York, NY",120,24,0,3.0,5/28/2018,Food quality has gone done. Everytime I order food from here it taste off. I used to love this place and still do because the owners and people are really nice here.,,,
21,Amanda H.,"Bronx, NY",27,2,5,4.0,8/12/2018,This is a small cute restaurant. The waitress was so kind and very attentive even though she had a handful of tables. I will definitely come back to try more.,,,
22,Sarah C.,"New York, NY",0,8,0,4.0,8/4/2018,"This is a neighborhood favorite. Decent omelettes, friendly service on most days, reasonable prices, and convenient location. A good place for brunch.",,,
23,Maggie H.,"Manhattan, NY",12,16,25,2.0,4/20/2017,"I really hate to leave bad reviews but there is nothing worse than spending $21 for a meal and the meal is downright terrible. I had this dish, the salmon steak once at the diner over a year ago and it was delicious! I've since ordered it for delivery several times and each time the salmon is grossly over cooked. With this order the mashed potatoes were completely unseasoned yuk! The cream of mushroom soup that came with the meal had little to no mushrooms and tasted like nothing more than a cup of flavorless cream. On the bright side, their breakfast is decent. For the price, at least 25% higher than the average diner, I'd go elsewhere.",2,,
24,Betty ..,"Manhattan, New York, NY",0,20,3,5.0,4/30/2017,"Perfect diner! I go here all the time. Never have I had an order that was wrong, service is great. I always get a hello and thank you. They have new girls but I'm sure the staff that has been there for a while can train them to be as respectful and happy waiters as the rest are. The space is pretty accommodating, booths and regular tables with chairs. Comfy and is right next to the A train. When I'm running late for dinner or have a girls dinner outting...Hudson View is the place I go to. Restroom are small but always clean. P.S. Love their coffee!!",1,1,
25,Upper West Side R.,"Manhattan, New York, NY",0,6,0,2.0,5/6/2018,"The basics that should be solid at any NYC diner just don't cut it here. The fries taste as if they've been thawing under a heat lamp, and many other items are dry or stale (turkey, sandwich bread, etc.).  In my experience, there has never not been some kind of problem with delivery or getting food to go--missing or mangled items, for instance.  To put this in perspective, the prices here are closer to what you would pay at Katz's than at any of the comparable places in the neighborhood.  And, alas, there is no view of the Hudson.",1,,
26,Megan C.,"New York, NY",76,7,1,2.0,4/20/2018,"I'm not sure what happened to Hudson View. I used to like this place as a decent diner spot in the neighborhood. A couple of days ago my friend and I went for lunch and we both ended up sick afterward. Not sure what it was since we ate different things. The only thing we had in common was iced coffee and the individual creamers, so maybe they were left out or old? Not sure, but the experience made me question coming back.",1,,
27,M D.,"New York, NY",2,44,42,2.0,9/10/2017,"Honesty, the food is merely passable and pricey for what it is. And they don't take American Express. Penny-pinching is admirable, but it definitely shows at this establishment. Sorry to be blunt this way, but I do believe if management doesn't find a way to return better value on the dollar, it's days are numbered as more competition opens.",2,,
28,Jeanne J.,"New York, NY",1,8,0,2.0,2/24/2017,"If there is one thing that really irritates me, it's incompetence. Last Friday, February 17, around 10am, I ordered an omelette with toast and coffee to be delivered to my apartment. Almost an hour later, my delivery arrived: lukewarm omelette, coffee that is not hot, and NO toast. I can't imagine this diner being so busy at 10am on a Friday, that my food would be delivered cold and there would be no toast. Did I miss something? They are a diner. They are supposed to know that omelettes come with toast. All. The. Time. To make matters worse, I called again to ask for my toast to be delivered. No apologies were offered and by the time it arrived another 30 minutes later, I was done eating.It's so sad that this neighborhood has no good diners that one can count on.",3,,
29,Jennifer C.,"Manhattan, NY",89,127,407,5.0,7/30/2016,"This restaurant is really small. Its usually really crowded and the sitting could be a bit uncomfortable. When i do come, I usually get the grilled chicken deluxe. The service and hygiene needs to get better. It's not the worst but it isn't the best.",1,,
30,Fiona M.,"New York, NY",212,7,1,3.0,11/28/2017,"The quality of the food has really gone down over the last year or so, and the prices have gone up. It's not nearly as good quality as it used to be, which is disappointing.",,,
31,Sarah H.,"New York, NY",18,240,4,3.0,8/20/2016,Neighborhood joint. Nothing fancy. Some dishes are questionable but I keep going back because it's in the neighborhood and because they are friendly and seating is ample and service is quick. Anyways. If you live in the area it's an ok choice for when you're super hungry and ramen at 9am sounds like a bad idea.Also. Support your neighborhood businesses people! Go here not IHOP.,,,
32,Calvin L.,"New York, NY",257,124,64,3.0,1/27/2017,"Solid diner food, solid price. If you do any of the breakfast specials you won't need another meal all day. The portions are gratuitous, but not particularly flavorful. Good stuff though if you need food in the neighborhood",1,1,1
33,Just A.,"New York, NY",0,79,0,2.0,"1/18/2017
            





Updated review","I hate to do this - because I like a lot of things about this place. The location and ambiance are great and the service is generally excellent. It's easier to get to for us than most diners and we've eaten here a lot over the years.But the food really is pretty bad - and it's priced as though it should be pretty good. Generally in the past if we stuck to the simplest breakfast options, burgers, or soup of the day it was decent enough, but it's always been a mistake to order anything fancier, and lately even the breakfasts and burgers are kind of lousy. Food seems on the verge of stale - old grease - lukewarm soup - low quality burgers.It's just a shame - cause it could be an awesome diner with just a little bit of attention to quality, but as is I think I just ate my last meal there for a long time.Walk north to Vicky's - an excellent diner (though they close too early) - or go to the Bronx to Tibbet Diner, Riverdale, or even Land and Sea. All far superior to this.Hope they turn it around someday because I like the place and the people. Just not the food... :-(",1,,
34,Chelsie S.,"New York, NY",117,34,2,3.0,9/2/2017,"Great, easy diner. Typical diner menu, quick service (I mean really quick), and we had no trouble getting a table for 7 on a Saturday at prime breakfast hours. We will definitely be going back!",,,
35,Larah J.,"New York, NY",31,21,27,1.0,8/6/2015,"I give zero star to Hudson View Restaurant. The Yelp app doesn't let me so I have to give at least something. I'm sad to give a bad review to a local restaurant, but I have to. Today I went for lunch time. This what happened:1- I ordered a chicken pot pie. Later the lady waitress told me by mistake it was in the menu and that they don't have chicken pot pie. So I was ok with it so I ordered a Veggie Burger instead.2- When the veggie burger came to my table. I saw that had a weird texture and color, so before doing a big bit. I touched it with my fingers and tasted a bit of it OMG!! It was old and acid vegetables. THEY MADE THE VEGGIE PATTY WITH EXTREMELY OLD EXPIRED VEGETABLES!!! I don't know how the waitress knew already because she came to my table and she felt embarrassing and told me ""do you want to order something else instead. "" I already have gastritis if I was gonna eat this burger I could go to emergency room right away. With expired poisoning food :(3- So I ordered a chicken grilled sandwich to give it a 3rd chance now. Meanwhile the entire stuff was starting at me the cooker and the rest of the stuff  like they already knew that they are doing something wrong.4- The grilled chicken came with a burger bun instead the typical sandwich bread. Seems that they just replaced the veggie patty and put the grilled chicken on the same bread. Also the salad was not fresh. The way they cut the vegetables  of the salad looked like if they take old salad from previous customer meals. And put it to the next customer. :(5- when I left the the waitress was feeling so sad and embarrassing  for everything happened. So we talked I asked her "" what happened to this restaurant? before was so good and fresh food""I grew up in this neighborhood and I'm a totally a supporter of local food places. The waitress told me that she is new, and that many customers are telling her the same about the resultant, bad food.6- when I was talking to the waitress the owner got into our conversation. And I told him what just happened and he got mad at me. I asked him ""the chef is new? And he answered me in a bad attitude ""the same chef"" I don't think is the same chef when I was 4 years old.I come here with my grandma and my parents. And I just wanted to tell him to take care of his restaurant because our neighborhood is getting gentrified with new brand chain restaurants. And local (moms & pops) restaurants are getting kick out. If he doesn't change his mind soon his restaurant will have to close and to give that space to IHOP. 7- And last I'm sorry but I will never come back to this restaurant. I'm afraid that I can get sick with expired and used food. I'm going to warn all my friends and family members. Bye bye Hudson View Restaurant :(",9,,
36,Antrica G.,"Monsey, NY",1,13,9,3.0,"4/26/2016
            





Updated review",Food was amazing! Service not so much. We were brought to cups of water one which had something floating in the cup. We ordered two brunch combos. I love a good Mimosa so I was excited the combo came with a choice of two drinks Mimosas being one of them.  My other drink was a coffee the coffee was watered down and not fresh. The mimosa was t that great either. But then the food came!!! And yet there was hope. The food was absolutely amazing. The French toast was perfect! (Get the real maple syrup it's worth the other dollar fifty) The combo came with a option of meat or eggs. My girlfriend and I both went with eggs and ordered two sides of bacon. Not realizing the side of bacon was 6 pieces. We could have shared. But we are both. Don't judge us . Our mean came up to 47 which it totally was not worth. But hey that's apart of dining in New York!!,,,
37,Josmanuel A.,"Washington Heights, Manhattan, NY",143,124,763,4.0,1/28/2016,I went to this restaurant/diner because le cheile was packed. I never regret my decision. This place is quiet and cozy for a couples dinner. I suggest the Hudson view burger if you have a huge appetite. It brings two burgers lol. I recommend the open steak sandwich is delicious. The prices are reasonable and the customer service was great. I suggest to try the red wine Cabernet ..,,,
38,Mabel J.,"New York, NY",104,58,186,2.0,12/7/2016,"Came here to give support to my locals business, after many years in this neighborhood first timer and very disappointed about it . The owner was there that day , screaming and arguing personal matters ( employee - employer ) just in the middle of the restaurant not minding the clients there , he was being very rude and grumpy ! Mistreating the employee he was arguing with ... went to the bathroom it's was super nasty ! And then they started to clean the floor of the restaurant and the smell of the bleach were way to strong , who wanted to eat with that smell .... you go to have a nice meal and relax ended up more stressed out for such a environment .",,,
39,Asta S.,"Boston, MA",22,359,28,3.0,5/20/2017,"I was impressed by the very speedy service at brunch.  I had passed by for years and looked across the street but it always looked busy.  Next time, I will cross and look in on the 181st street side where you can get a better idea of how full they are.  The food was good, although I like my potatoes more crispy than mashed for breakfast.  Good coffee. Slightly overpriced compared to what you get. Next time, I would tell them I don't like my toast buttered.  Would definitely come back if I am hungry and in the area.",,,
40,David J.,"Manhattan, New York, NY",0,10,0,3.0,4/23/2017,"Ok diner in Hudson Heights.  Food is usually passable.  Their soups could usually be a bit hotter.  The diner could use a bit of a renovation. I go here occasionally and it's always what I expect--ok, but nothing more.",,1,
41,Victor L.,"Brooklyn, NY",117,2,0,1.0,8/13/2016,"This is my standard on the weekends.  But today is the last day seeing that their air con has never worked all summer.  Now sitting here sweating while I eat breakfast,  I can even drink coffee it's just to hot in here.  I'm sure I'm not the only customer to leave this place because of the lack of air con inside.  Where's my check, I'm out.",1,,
42,Sierra T.,"Tampa, FL",145,19,9,5.0,5/27/2017,"My favorite restaurant in Washington heights. I come here just for fatima, she is the best server in the world!!!!!!!!!",,,
43,Katherine B.,"Manhattan, NY",0,57,0,4.0,"5/17/2017
            





Updated review",Grilled veggie sandwich is amazing. service is a little indifferent though.,,,
44,Dani H.,"Santa Clarita, CA",468,35,16,5.0,3/28/2017,"Delicious orange juice, coffee, and food all around- wonderful neighborhood coffee shop really close to the subway stations!! 20/10 would recommend.",,,1
45,Susan L.,"New York, NY",179,1921,0,4.0,4/1/2016,"Today I ate lunch at this place with a friend who lives nearby, and it was quite satisfactory.  It's small and we arrived at about 12:30 p.m., but we had no problem finding a table and it was enjoyable sitting by the window.  I ordered one of the lunch specials; a four-vegetable sandwich which came with a generous amount of fries plus cole slaw and a pickle.  The fries were just ""fair"", but everything else was delicious.  Our server was a very pleasant young woman - although I had to ask her twice to bring more napkins - and the busboy was also very pleasant.  Lastly, the restroom was very clean.",1,1,1
