,er_name,er_location,er_freinds,er_reviews,er_photos,er_rating,er_date,er_text,er_useful,er_funny,er_cool
46,Jon L.,"New York, NY",166,449,0,4.0,1/13/2016,"Pretty much the only diner in the area.  It's fine for general diner fare, but is a little pricier than what I'd expect for the quality of food you're getting (given my refined NJ diner tastes).  :)  That being said, I've never had a bad meal here and the staff is always quite attentive with filling water and bringing over the food.  Oh, also somewhat randomly, one of the few places that actually listens to me when I tell them that I don't want my bacon too crispy.  One extra star for that!",2,,
47,Lena H.,"Manhattan, NY",12,9,0,2.0,6/27/2017,I was not satisfied at all with the meal. The meatloaf was dry and overcooked. Totally unacceptable.,1,,
48,Joan W.,"Manhattan, NY",0,11,0,1.0,6/30/2017,"When I moved to the neighborhood in 2009, I ate my celebratory dinner here with friends. Since then I have relied on Hudson View Restaurant when I had a craving for classic diner food. But prices have soared to obscene heights. A plain cheeseburger via Seamless will cost you $10 -- and that's WITHOUT fries. A glass of OJ is $6. Pro tip: Order from Next Door, a real restaurant where the food is much better, the selection is much wider, and the prices are much more reasonable for the value you get.",1,,
49,Weronika K.,"New York, NY",108,4,0,4.0,9/2/2017,My favorite brunch/breakfast spot in the neighborhood (maybe the only one?). Great egg Benedict with smoked salmon and delicious mimosa! Perhaps a tad expensive but still a good deal.,,,
50,Aida R.,"Manhattan, NY",76,36,32,5.0,8/8/2014,Omg the portions are ginormous and the coffee is on point.We were helped immediately and our coffee kept getting refilled! Finally some non expresso coffee in the neighborhood.I regret not stopping by sooner. Liz our waitress was awesome!!!Tip: French toast were sooo good they were like crack!!!!!!!The bathrooms were clean!,1,2,
51,D'Artagnan D.,"New York, NY",0,4,0,5.0,8/5/2017,"Great diner in our neighborhood. Casual good brunch on Saturday. Food and service are excellent. Definitely not fancy, but exactly what you want in a local diner with good food.",,,
52,Rev I.,"San Francisco, CA",202,62,4,5.0,8/26/2015,Excellent food and service !!!Went there for the next day for the same meal. Eggs Benedict with salmon. Yummy !!,1,,
53,Andy G.,"New York, NY",0,11,0,5.0,8/17/2015,"This is a great neighborhood diner/ coffee shop with a friendly wait staff. Food is excellent, prices reasonable. Great menu and they ( staff and management) are both flexible and fast. Definitely recommend it. They are  generally quite busy on weekend mornings but like most very good things, it is worth the wait.PS, they serve wine and beer.",1,,
54,Irena K.,"New York, NY",17,29,3,4.0,11/1/2016,Amazing salads and a quick delivery. The Greek Salad was crispy fresh with lots of feta and anchovies. The bread was still warm and everything was done with attention to detail. The delivery guy got lost but was very responsive and nice about the whole thing. I'm definitely impressed!,,,
55,Tina N.,"Manhattan, NY",5,14,2,2.0,11/28/2016,"You can get a decent breakfast on the weekends, but I will never order anything else from here. The quality has been going downhill for years, while the prices have been going up. The burgers went from decent to disgusting.  Overcooked, now adding cinnamon or some similar spice, dry. They always forget one crucial thing if you order delivery.  The ""cream of.."" soups all taste the same and they are so dense and salty, a gelatinous goo.",,,
56,Suki M.,"New York, NY",9,23,13,3.0,5/2/2015,"uhh yeah so i ordered delivery; hungry man and a milkshake and ill be real honest JIMBOS is better than this place lol.the french toast was cool nothing crazy they're just big , eggs and bacon ehh wasnt like maple bacon or anything my pork sausage was not really cooked.what really got me was my milkshake.. you see my picture right ? idk if you can tell its super pink , it dead looks and taste like strawberry flavoring and its 5.50 ? oh noo lolim not paying $19 again for this i wish i woulda just drove to 207 but the fight is today i have house stuff to do.i promise yall go to jimbos get the same thing and a cherry lemonade instead i bet you and your pockets will love me (:welp, delivery was super fast though lol",2,,
57,MichaelNicole T.,"New York, NY",0,6,4,4.0,2/6/2016,"Went at 4 in the afternoon on a Saturday. It was quiet and the service was quick. The Southwest and Tuscany wraps were prepared fresh and very flavorful. Mimosa was made with fresh squeezed OJ...which makes it difficult to drink a mimosa with all the pulp, but overall it was a good experience. Staff very friendly and attentive.",,,
58,Tae S.,"Manhattan, NY",0,3,2,1.0,12/21/2016,Highly disappointed $20 for food and the only good thing was the $3.25 fountain soda smh can't see myself ever ordering from here again,,,
59,Tina C.,"Queens, NY",1966,4132,9742,4.0,4/16/2012,"My poetry travels has leaked into being an avid musician/band admirer in my circuit for the late nightlife scene.Party of two for breakfast at Hudson View on a rising warm Springing April Sunday morning.  My Challah French Toast with Pork Sausage at $6.65 was mellifluous to my stomach while my delightful good friend indulged on a Turkey Sausage Omelette with potatoes and buttered toast at $9.30.  Both breakfast entrees warmly the heart to deliciously awaken our spirits, respectively, for a new day to be fulfilled.  Service is attentive as the table next to ours accidentally spilled a glass of water, which the wait staff immediately remedy the unfortunate situation for clean up.  This dinning room table space is rather cramped and setting is very homelike feel without the typical carbon copy diner atmosphere.Facility is lacking toilet paper albeit relatively clean state.  Hudson View Restaurant conveniently sits on the corner of the A train.",,,1
60,Drew S.,"Jersey City, NJ",91,171,28,3.0,6/10/2014,"Love this place. Very friendly service, solid diner food. I come here often for both breakfast and dinner. The cake is good as well. Great place to get a ""home-cooked meal"" (pot roast, beef stew, etc.). I'm a fan of the waffle with berries. The fresh-squeezed OJ is lovely. I'll be back here as long as I'm still living in the Heights. They do delivery. It gets crowded-ish around 10am on weekend mornings.",,,
61,David M.,"New York, NY",5,1,0,3.0,3/13/2015,"Food is good here but man, is it expensive $$$$! They overcharge for just about everything here... Orange juice (a glass) costs between $3 and $5.80, depending on what kinda juice you get... Other than the prices, which is a huge deal, this place will consistently call you back to tell you they're out of this, or don't have that.... But will sneak and charge you anyway... Just watch your bill when you eat here.",3,,
62,Amy C.,"Manhattan, NY",0,1,0,2.0,8/1/2016,"I just paid $26 for a salad and two diet cokes. Yeah, definitely won't be doing that again.",,1,
63,Naima W.,"New York, NY",0,4,0,2.0,2/15/2016,"I have taken several visiting guests to Hudson View Restaurant for breakfast, and have been ordering from them for over 10 years. I call them because they offer fresh-squeezed orange juice. But they have messed up my order repeatedly over the years. I usually call to let them know but do not require that someone come back to deliver orange juice or a side dish, especially in bad weather.This morning I ordered 3 scrambled eggs with cheddar and bacon, a short stack, orange juice, and a Pepsi. I received 2 scrambled eggs, but no bacon. The bill was $30.32. They charged $7.45 for the short stack! For two pancakes!!!!When I called and asked why they charged so much, the man told me that there's no short stack on the menu so they charged me for a full order of pancakes. I told him the woman who took my order did not tell me they don't offer short stacks. If she had, I would have told her forget that item. What made me angry is that the man argued with me as if I had made the error. After I became angry, he offered to give me a discount of $2.50 on my next order, which still makes it $5.45 for two pancakes! I told him I would not be ordering from there again.The food at Hudson View is adequate, not great, and is definitely not worth the exorbitant prices they charge. Delivery is convenient, but not if they routinely screw up the order, overcharge customers, and to make matters worse, argue with customers instead of admitting their errors. I'm done with Hudson View for good. Moving forward, I'll stick to VICKY'S DINER at 187th and Fort Washington -- reasonable prices, quick delivery, NO ORDER ERRORS.",4,,
64,Aldo M.,"Manhattan, NY",238,2,6,1.0,6/5/2016,Zero stars. Infuriatingly over priced cheap quality ingredients and slow delivery service. I work too hard for my money to waste it at this establishment.,1,,
65,Amy D.,"Brooklyn, NY",2,26,12,2.0,3/19/2015,"I love their food, but they never fail to screw up an order. I used grubhub so it was in writing, plain as the words in front of them, but they still got it wrong. I clearly wanted extra sauce in the pasta not on the side because they give you almost dry pasta. Look at the picture. Does that look like its in the pasta or on the side? Ugh! Food is 4-5 stars and if I could give a negative for order accuracy and customer service when you call I would give a negative number!",2,,
66,Omar Z.,"New York, NY",45,112,117,3.0,4/25/2015,"Expensive for a local neighborhood diner on the corner of 181st.  Nothing special or spectacular about this place.  It got an overhaul some years back, a new look if you wanna call it that but it's pretty much the same ish.  Diner food with a kick.I can't front, the chicken caesar salad is hella' good.  Huge portion too.  Pretty much the only reason I like this place.",1,,
67,Rebekah E.,"Manhattan, NY",0,1,0,1.0,1/5/2016,"Delivered us a smelly, gray meat corned beef Reuben. Forced a pastrami Reuben on us without offering an apology, refund, or even asking what we'd like as a replacement. Contacted Seamless about the issue who contacted the diner for a refund, the diner got nasty with them, refused a refund, AND said they no longer wanted our business.We've been ordering from them since 2009, and I can say that it has gone downhill and is completely over-priced.",4,,
68,Em P.,"Brooklyn, NY",21,55,113,4.0,6/16/2015,"Went here on a Sunday morning and had a simple breakfast that was composed of 2 scrambled eggs, home fries and toast. Nothing too complicated. But soon after my friend and I left we could not stop talking about the home fries we had both ordered. He got himself a turkey bacon sandwich, which I didn't taste. But I could tell that by the speed he was devouring it he had pretty much no problems with it. I have to admit that once we had our food served to us I took a look at his sandwich and regretted getting an order so...well, plain. But that's the thing: it wasn't. The eggs were on point. The toast was on point (and for those who think it's impossible for diners to mess up toast...that probably means you haven't been to too many diners in the city). But man oh man, those home fries!!! I wouldn't be the first person here on Yelp to declare they've eaten at a lot of diners but in all seriousness this is one of the better ones when it comes to home fries. And this is one of the better ones in the Washington Heights area in general. Service was great. Our waitress was super attentive and sweet. We'll both be coming back.",,,
69,Allison C.,"New York, NY",209,1624,449,3.0,11/14/2012,"I have lived, essentially, across the street from here for 2.5 years and finally went the other night.So I'm a little slow.Something about this restaurant always came off as ""It LOOKS like a diner, but the food will most likely be egregiously expensive,"" which spurred my decisions to go elsewhere in my 'hood. I was somewhat correct in my assumption. Your basic burgers, sandwiches, and wraps served ""deluxe"" are decently priced to perhaps a hair overpriced. ($8 bucks for a burger with the works and fries? I can do that. $13 for a wrap? Not so much.) At least the menu IS expansive, with a full breakfast section and entrees galore.The burgers are tasty, the fries are solid, but the chocolate shake leaves a little bit to be desired, thickness-wise. There are some other item menus I will perhaps, one day, give a whirl.And, sadly, the Hudson River can NOT be seen from this establishment, despite the promising name. However, depending on where you sit, you can get an excellent view of the Chinese restaurant, Starbucks, or the stairs to the A Train!",2,7,
70,Jacob M.,"Philadelphia, PA",275,136,2,2.0,1/3/2015,"This was perhaps the oddest dining experience I have ever had. Since this is one of the very few brunch options in Washington Heights, the boyfriend, a group of our friends, and I decided to check this one out. There was already a line (for brunch in Manhattan - what a surprise!) so we patiently waited. The hostess said it would be 20 minutes which is fine, but she ushered us in to seat us within five minutes. What was truly strange though is that they left us - a group of four - stranded in the middle of this tiny restaurant without a table. We stood awkwardly between an elderly couple and group of three friends enjoying their meals, awaiting to be seated. Two tables opened up but we were told we couldn't sit there because that was for a large group. Fifteen minutes went by and WE WERE STILL STANDING IN THE MIDDLE OF THIS HECTIC, TINY RESTAURANT WITH NOWHERE TO SIT. I don't really care if I have to wait for brunch, but get your act together, management. The older male manager who seemed to be in charge was all but berating his employees and making a mess everywhere without remedying the problems that this restaurant was clearly suffering from.After twenty minutes of standing in the middle of the restaurant, we were told we could sit. We ordered our food, chatted with our very friendly server (who was great), and awaited our meals. We also noted, however, a man slump over and have a seizure at his table without any sort of medical intervention, a two-person table get moved seven times around the restaurant, and three separate vases of flowers get spilled.Our food was great, the portions plentiful and the prices affordable. But management REALLY needs to get itself together. I'm unsure if I can deal with coming to this restaurant again since it was just anxiety attack after anxiety attack in that 7ft by 20ft box.",1,1,
71,Jessica J.,"Austin, TX",2,5,0,3.0,7/27/2015,"I order from here regularly (they deliver!) because the food is good, and the menu has a great selection. However while I'm building my order online I spend most of that time groaning about how expensive it is. I'm usually pretty reasonable about food prices and go out to eat at nice places with probably over-expensive meals a couple times a month. This place just seems excessively expensive. The most basic things (eggs!) are overpriced and they charge you ($2+) to add even the most basic things on to your meal. They just charged me a 35 cent CONTAINER FEE on my last order...........The first few times I ordered from here, it didn't bother me as much as it does now. I may consider not ordering from here much in the future because of the prices. It's ok for every once in a great while though, I guess.",,,
72,Jack W.,"New York, NY",0,3,0,4.0,7/31/2016,"Fantastic little Diner here in the heights. I come here for breakfast about 1-2x/ month and I am always happy leaving full from a hearty meal. The wait staff is professional, and do a good job. I always like to get the omelettes or anything from their breakfast menu. The food is not out of this world but it is hearty and well done.The restaurant is rather small, so be sure to get here before 10:30 on the weekends to avoid the rush.",,,
73,Gerald P.,"New York, NY",0,7,5,2.0,10/9/2014,"Hudson View Restaurant is a glorified diner. And it doesn't do diner well. The Greek diner that was here before it was much better, and much cheaper.They are not good at getting simple dishes like fish & chips right. The fries suck, the burgers suck, and all the food is over priced. With so many restaurants down 181st towards the river there is no reason one should go here, and it's surprising they are still in businesses. I think it's largely people just passing through the neighborhood that don't realize there are better options steps away.",2,,
74,Andrea A.,"Portland, OR",0,30,0,5.0,1/21/2016,"Okay, so...I may have gone on an impromptu trip to NYC. These things happen. You know what else happened? The best Challah French Toast of my life, that's what! And it happened at this very location. My friend (who loves diner food) said it was the best and I thought ""yeah, sure, okay. I live in Portland"" (ugh. I am THAT person. Portland HAS changed me. Don't tell my mom I admitted that). When I took a bit of that French toast though...it changed me. I couldn't even pretend to be listening or participating in the conversation, I had the Lord's work to do.",,1,1
75,Lacey A.,"Manhattan, NY",9,7,0,1.0,12/1/2014,"Been a customer for awhile now. Just called with a question about their Ruben and got hung up on by someone when I told him Russian Dressing and 1000 Island weren't the same thing.Guess I'm not getting a Ruben tonight... Or good customer service either.I'm sure they'll say I was ""difficult"", but I work in the service industry and this was a legitimate question, so screw them. I'll end by saying this: good food, asshole guy on the phone. Will never order from them again for fear of them spitting in it or something else equally as ridiculous.",1,,
76,William P.,"New York, NY",12,24,56,2.0,7/5/2014,"Meh? Food is average. Not sure why I see lines for Sunday brunch. What am I missing? Service is good. Just adjust expectations. Me? As neighborhood person, there are better places nearby.",2,,
77,Hayley P.,"New York, NY",5,30,16,4.0,2/28/2015,"Great breakfasts.  Especially the french toast.  There's tiny hints of sea salt on the toast which always make me come back for more.The service is good, everyone is very nice and accommodating.",,,
78,Amy L.,"Manhattan, NY",224,14,0,5.0,10/31/2015,"Delicious breakfast, friendly quick service. Well worth the short wait for a table; the food comes fast and hot. Crabby Benedict - yum!",1,,
79,Zlatko F.,"New York, NY",20,6,2,5.0,10/30/2015,"It's incredibly hard to find a diner in Washington Heights. This diner is very nice. The staff is friendly. They keep checking on you to refill your water, coffee and drinks. The food is great too. The prices are reasonable too (for NYC). I'm very satisfied with my visit. The only other diner I found in this part of Washington Heights is Reme Food Inc. on 168th street.",1,,
80,Josh G.,"West, Amsterdam, The Netherlands",119,13,19,2.0,"7/27/2014
            





Updated review","So I've reviewed this place in the past due to a nightmare experience ordering breakfast through seamless. But my friends insisted this place was great and I should try dining in. Well I just did and it didn't impress me. I decided to drop in for dinner. I ordered matzoh ball soup, and while the portion was generous, the matzoh ball disintegrated and was bland and tasteless. The soup needed a bunch of salt and pepper to taste halfway decent.I ordered the tuna pita for dinner which was described as tuna and melted American cheese in a pita. It came served with the bland, tasteless tuna served on TOP of an over-toasted pita (not in the pita as described) with a couple slices of American half-melted on top. American cheese melts very easily. The fact that I could see the outline of the individual slices says something... Not great. Won't be back again either for dine-in or ordering.",1,1,
81,Sam S.,"Manhattan, NY",58,131,0,3.0,"2/3/2015
            





Updated review","Delivery service has improved. I have started to order from here again. They still overcook their burgers, with fair regularity, and their coffee can truly awful sometimes (I think they're not cleaning the machines well, or like... really over-brewing grinds during some shifts; it's got a very bitter, acidic quality, without any kind of kick), but the orders aren' botched and they continute to make a mean omelette.",,,
82,Grace B.,"Miami Beach, FL",0,4,0,5.0,5/4/2016,"Very good food and service! I do not understand why some people think this restaurant is pricy.,Honestly the quality of the food, amount and service is very much worth it! Carolina the server was very kind and professional. My family and I, will definitively visit again!",,,
83,Zeynep K.,"New York, NY",47,145,69,1.0,1/2/2014,"I just paid $14 for a slice of spinach pie. I walked in, asked for a slice of pie for take out, they said $14, I asked them to repeat 2 more times, then paid just for the sake of seeing what the pie will look like. Go to 181 Cabrini instead. It is 2 min. walk away, very reasonable prices with delicious offers (had breakfast, brunch, lunch, dinner, late dinner, drinks etc.. there) and you don't feel like crying after paying $14 for a slice of spinach pie. This place stinks. Just get out of this neighborhood and open a place in Soho instead. Hudson View Restaurant, you are not wanted in Hudson Heights. Other facts:1. They do not have fresh bakery items (plastic bagged croissant, which looked a few weeks old)2. During my visit, I watched a waiter cleaning up the table tops with a giant coffee filter. How much dirt that poor thing can pick, really??***Post-spinach pie experience:God bless Tums.",6,2,
84,Peter K.,"Jackson Heights, NY",558,633,2140,2.0,12/21/2013,"It was the best of times, it was the worst of times.Yep, that totally sums up my experiences at Hudson. HV is packed to the brim during peak times. At first glance, HV looks like a local quaint corner joint, sporting both the US and LGBT Pride flags proudly. Qué cute, right? Well, upon closer examination, HV exhibits the same traits as practically every other joint in Washington Heights;1. It is the only place of its kind in the area. (Yep, the only non-Dominican diner in the Heights!) There are really no comparable alternatives;2. It can charge whatever it wants and nickle and dime you for mediocre food because of reason #1; (seriously, almost $7 for two eggs and toast?!)3. It thrives because it has become the go-to place for locals, also because of reason #1.Although I find myself succumbing to reason 3, I do my best to cook myself or steer elsewhere (yass, the A train is right there! use it!).",4,5,2
85,Adam W.,"New York, NY",10,31,3,3.0,8/15/2015,Good waffle breakfast. Took a star off for cleanliness. Glassware and take out containers both had schmutz on them.,1,,
86,Leslie J.,"Inwood, NY",167,179,18,4.0,11/9/2014,"Great service, ok food.I would come back here for sure.  The service is great and I love the location.  The food is just fine and the brunch price is just right!  I really enjoyed my time here last Saturday.  This place is for locals and that is one of my favorite things about living uptown.  There are no tourists to fill up a place and the employees are more patient and kind because we are all working and living together.  I got the Eggs Benedict and they were good but I have to come back and get that french toast.  Can't wait to see you again.",,,
87,Destiny R.,"Manhattan, NY",53,16,2,5.0,4/12/2016,WOW!!! The best LENTIL soup I've ever had unfortunately it's only a wednesday special. But,,,
88,Panos P.,"Chelsea, Manhattan, NY",0,3,8,4.0,12/23/2011,"Visited a friend uptown and met up in this place, it's right above the station anyways...Great French toast and waffle !!Pretty down to earth prices. A great local place  on 181 st !",2,,
89,Kim S.,"Manhattan, NY",45,8,0,4.0,6/12/2015,"Hudson View Restaurant has become my go-to place for breakfast since moving to Hudson Heights six months ago.  Genuine diner food; real breakfast potatoes (not uggy orange pre-fab glop with slimy onions and gross bell peppers that some places try to pass off); cook knows the difference between over easy and over medium, giant Greek-style sausage. excellent diner coffee. Their prices are a little high, but I find it worth if to enjoy food I can trust. Staff is pleasant and accommodating; delivery is surprisingly fast as well.",1,,2
90,Chrissy P.,"Manhattan, NY",1,3,0,5.0,1/1/2014,I've eaten here a few times since moving to the heights and I must say I love this place. I always get the same waitress some how and she's a doll seems to work every shift. And the prices are reasonable for the amount of food you get and always refilling your coffee which i love!Overall great place!,1,,1
91,Erin C.,"Manhattan, NY",52,97,48,4.0,6/14/2015,This is our standby favorite diner in the neighborhood. It serves a typical assortment of diner breakfast selections with a wider choice and better execution than other neighborhood diners. Tasty and solidly satisfying. It is a great option for families with young kids. Service is fast and friendly. We eat here all the time and will keep coming back.,1,,
92,Jamie W.,"Fort Worth, TX",0,115,254,4.0,8/16/2014,"Very friendly staff! Good food, large portions! Get there early... Not many tables! Inexpensive for NYC!!",,,
