,er_name,er_location,er_freinds,er_reviews,er_photos,er_rating,er_date,er_text,er_useful,er_funny,er_cool
37,None Of Your Business B.,"New York, NY",0,14,0,4.0,2/11/2018,"This is definitely my kind of place.Very low-key and unpretentious. It's got a bit of a southern flair, yet ironically enough, in the midst of a big cosmopolitan city on the east cost. I'd say the prices are average. This city is expensive, so anything with 'average' prices in nyc is a steal. This place is it. Lots of soul food, if you're into that. If I ever work up an appetite, I'd love a salad or some sort of veggie-type of plate. I came in for a bloody mary here a few days ago. My one complaint about it is I'm not so sure that they put in enough liquor in it. I wasn't looking, so not sure if they put in anything but the spices. I was very tired that day when I came in, and I would have expected to be even more tired after the drinks but I was not. However, whatever mix they used, plus the flavoring was absolutely wonderful. I like my drinks and food super spicy! This was my request in them making the drink. The staff seem really nice, so I'm sure they'll be happy to honor your request if you desire something a bit more bland.This was a super yummy snack! Thank you!",2,,5
38,Kate M.,"New York, NY",0,46,0,4.0,10/26/2018,"You basically know what type of place this is; a campus spot with burgers, fries, and drinks. It's good at what it does, and it's clean (which I can't say of every campus spot of this type!). In an ""Ask the Community"" Yelp question that another Yelper answered when I went to Mel's page here, someone asked if there were vegan burgers and the answer was ""no, not even vegetarian."" As a vegetarian, I can say that's not true, as every meat burger offering can be substituted for a veggie burger (and it was pretty good!); I'm also sure they remove items like cheese and make it vegan if you asked.",,,
39,Irene H.,"Manhattan, New York, NY",43,26,18,4.0,4/24/2018,"Had an awesome waitress, cool spot to unwind and chill with a friend. Has space, so your able to breathe",,,
40,Danielle H.,"Manhattan, New York, NY",0,2,0,1.0,8/27/2018,"This is the first Yelp review I've ever been compelled to write. I share my review out of a sense of duty to humanity to prevent others from suffering the fate I did at Mel's Burger Bar. My only hope is that out of my suffering will come some good and that you shall avoid my fate.I came for bottomless brunch where I had about 15 drinks and left with no buzz, just a stomach ache. I am convinced that the carafes of mimosas and screwdrivers that they served us were purely orange juice as not one out of the group of 15 of us felt anything at all. In addition to serving us beyond watered down drinks, the food was less than sub par. A friend of mine had ordered the breakfast burrito with no meat, where the waiter proceeded to tell her that the burrito could not be modified as they make them at 6am and continue to re-heat them throughout the day. If you are looking for a fun place to do a bottomless brunch - do not step foot into this bar.",,,
41,Stephen B.,"West Chester, PA",0,24,0,5.0,8/10/2018,"Didn't have huge expectations for a mainstream lunch spot on Broadway, but dang that was some good food!  Started with fried pickles (accompanied with a light sauce) and mac and cheese balls -both were excellent.  We each had a different burger and all were delicious.  I had the ""Hot Mess"" burger and needed a fork and knife to finish it off.  It was full of awesome flavors and had little kick to boot.  We finished up splitting milkshakes (a black and white and a mocha shake).  The mocha shake was exceptional.  The decor is great and the beer selection was fairly diverse (I'm a huge rich a dark beer guy and they had a nice scotch ale).   Sunday night at any restaurant is typically the B team -I'd keep that in mind when reading some of the other reviews.  If my kid ends up at Columbia, I know we have a great lunch spot for the next four years!",,,
42,Megan H.,"Fort Lauderdale, FL",652,20,15,2.0,8/18/2018,Was really disappointed with the service. Came at 4pm and the place was definitely not busy but the wait staff pretty much ignored us. We waited for awhile for our check and eventually had to ask the host to help us wrap up our meal. Food was alright but in the future if I want a burger I'll probably try one of the other places nearby.,,,
43,Chandra P.,"Queens, Queens, NY",108,8,9,5.0,6/21/2018,Ordered the California Burger. The BEST burger I've ever had! Stop reading these reviews. It's amazing. Just go!,1,,
44,Rolanda B.,"Bronx, Bronx, NY",41,139,299,4.0,7/13/2017,"Service was great. Our waiter told us about the special today and described what it was and he also answered all of our questions. Our food was prompt and all the extra things we asked for were delivered quickly too. The food was ok. The fries were really the star of the show. They were hot and well seasoned. The LES Burger was ok. If you're looking for a place in the area to get some good bar food, this is probably it. Also they have a $25 unlimited brunch that includes and entree so I'm curious to see what that's like",,,
45,Magritte C.,"New York, NY",0,79,0,4.0,12/3/2017,A terrific place in the Columbia U area. Great burgers with a solid brunch menu too. Beer selection has a lot of variety and good service too.Recommended! It would be hard not to like this place. Can't wait to try their place on the UES soon.,1,,
46,Andrew D.,"Brooklyn, NY",34,64,156,4.0,7/16/2017,"Lovely burger joint! Very spacious and usually noisy and busy as it's so close to the campus of Colombia University! I've yet to have a solid complaint about this venue! Everyone is very friendly and although the food take half an eon to come out sometimes, the food is good enough to forgive and forget!   I've come here before with my Lady at the time a few times and it hasn't disappointed yet ex per for once there were fries so salty, it would've made the Dead Sea jealous. Jeez! Other than that, I've been yearning to bring my son and younger cousin here all the way from Brooklyn just to experience their awesome fried Oreos and vanilla ice cream! YUM!! My tastebuds always do the Macarena when I insert that stuff into my oral orifice!    They had burgers and fries I believe while I believe I had a salad or something. Either way, we all ate good, leaving behind no bodily parts or limbs to identify. To plainly put it, ""we killed it!"" Great stuff!!",,,
47,L P.,"Manhattan, NY",0,5,0,2.0,7/9/2018,They can't figure out delivery. Loaded delivery guy with more orders than he could manage and 1.5 hrs later our cold fries and wings arrived from 8 blocks away.,,,
48,Paul S.,"New York, NY",128,88,1561,3.0,10/1/2016,"Joined a group of about fifteen people,  we had a separated section for our group in the front of the restaurant. The area right of the entrance was cleared with chairs in a large circle. The staff did not directly interact too much. The decor and signage looked very good. The light did look a little dim but I was closer to the front so it was not a problem for my group.As you enter, there is a bar with booths and tales in the back. This restaurant has been on my radar for a while and I was happy to enjoy a bit. At the bar, I ordered a left hand milk stout. The staff was friendly but it did take quite a long time to get attention.For the food, it was served buffet style. There was quite a lot of food.  We had nachos, chicken wings,  cream spinach dip covered with cheese and fries. I sampled all of the items and everything was tasty. There was nothing that was amazing but it was a solid space.I would like to come back to check one of their burgers which are more creative.",2,,1
49,Allie B.,"New York, NY",0,30,5,3.0,1/4/2018,"This is a really nice place to come to in the summer. I enjoyed my experience having dinner with some Columbia friends.It looks like a restaurant on the outside with outdoor patio but is a sports bar on the inside. Loved the jalapeno burger. The shakes are where it's at. This place has great shakes. The mint oreo was especially good. It's a huge serving and you can't go wrong with mint Oreo ice cream. They offer other flavors as well. The menu offers burgers, fries and many finger foods. They also have a kids menu.Prices are in $$ range.Their waiting service can definitely be improved.Other than that it's a nice place to enjoy a burger with friends but that's about it.",,,
50,Reese E.,"New Braunfels, TX",0,1,0,1.0,9/18/2018,"Went in tonight and was told it was BOGO for current members of the ""brew crew"" (which I have been for 3 years), but was charged for all my drinks since they changed what they view being a member is. When the manager was brought to the table to explain, he just superfluously smiled and said how they would look into the menu to better explain what BOGO means to them. Have gone there often, now will never go back. Well done, Mel's.",,,
51,Emily F.,"Bronx, NY",7,54,7,4.0,1/14/2018,"Overall: Very good deal for Bottomless Brunch. $25 for unlimited drinks and an entree, and most entrees come with fries. Champagne was pretty decent.Cons: Food is greasy and kinda tastes like diner food. It's tasty but quite greasy. So this isn't about getting good food, it's about a cheap bottomless brunch.We got out refills, but we really had to make huge efforts to flag over the waiter. The point of bottomless brunch is that your cup is bottomless.",,,
52,Michelle D.,"Manhattan, New York, NY",38,10,0,5.0,9/12/2018,When I eat here I feel just like Squidward did when he got addicted to krabby patties and ate too many. I just can't get enough! I don't care if the burgers go straight to my hips. YUM. Also they have a really good beer selection.,,,
53,Alexis M.,"Brooklyn, NY",31,279,9054,4.0,2/13/2017,"Mel's Burger Bar is a place that I bookmarked on Yelp sometime last year. Since I was at Barnard College - Columbia University for the Athena Film Festival yesterday, I felt it was the perfect opportunity to go to Mel's Burger Bar for a bite to eat.I went into the place thinking that I was unsure if I wanted a burger and was curious to see what other food options were on their menu. My preference was to be near the bar as I wanted to see the basketball and bowling games that were on the televisions in that area. The bartender was so nice and allowed me to take my time to look at the menu. He kindly informed me that it was still Brunch time. This was great and so I ordered the  Bottomless Brunch -$25 which included the entree and 2 hours of unlimited beverages. I selected the Hangover Breakfast which had pancakes, eggs, bacon, sausage, ham and french fries. Such a spectacular platter which was cooked well and tasted fresh! The bartender made inquiries regularly to see if I needed anything, was attentive and continously filled my glass to the brim with beverages. I was thankful for his kind presence as he exuded excellent customer service. Mel's Burger provided me with a cool, relaxing place to enjoy delicious food.",6,2,7
54,Shannon F.,"Dallas, TX",364,64,70,5.0,10/11/2017,Someday I hope to experience a Mel's beer baptism. This place has great food and an excellent beer menu -- What else could you possibly need?,,,
55,Francisco C.,"Manhattan, NY",0,1,0,1.0,9/7/2018,"Just got dinner here. Ordered the classic medium, that was classic. Ordered the atomic fries, that was garbage in my mouth. Way too spicy and they don't advertise thAt the blue cheese is actually a crappy sauce instead of actual cheese. Misleading.",,,
56,Catherine C.,"Flatiron, Manhattan, NY",378,81,124,4.0,8/21/2018,Their burgers are pretty horrible but the beef over tortilla chips were absolutely great! Would definitely come back just for a beer and chips!,,,
57,B1234 1.,"Manhattan, New York, NY",0,4,0,4.0,9/5/2018,"This is a great local bar. They have a wonderful selection of different beers on top and spiked milkshakes. What's best about this place -- that it has a local flavor. While it's hard to grab a seat when Columbia is in session, it's a standby, local watering hole.",,,
58,Jessie B.,"Queens, NY",215,214,156,5.0,7/4/2016,"Amazing burger and brunch spot in this neighborhood! Lowkey, laid back environment with a full range of bar drinks and delicious burgers. I ordered a Classic Turkey Burger and fries cause I'm boring, but the have some pretty off the wall choices like a burger with mac n cheese and other joices chock full with jalapeños, cheeses, bacon, onion rings, pico de gallo and guac- all for around $12. I recommend the famous Disco Fries or the Parmasesn Jalapeño- delicious full of savory touches.As for brunch (weekends and holidays til' 4) $30 will buy you unlimited Bloody Mary's, Mimosas or Screwdrivers plus and entree (STRAWBERRY CROISSANT FRENCH TOAST IS LIFE). Pretty generous sized drinks and portions too!",,,1
59,Emma B.,"Evanston, IL",425,7,0,4.0,8/21/2018,"The bottomless brunch deal is too good to pass up, and the service was spectacular. My omelette was just okay, but my friend ordered the croissant French toast and loved it. Definitely don't hesitate to order the sweet things here!",,,
60,Ferd M.,"Manhattan, New York, NY",1,2,0,4.0,12/18/2017,"I had dinner and a drink here at Mel's tonight, and I was glad I did. Service was fast and friendly, it was clean, and had great ambiance. I'd eat the ambiance every night if it was orderable. With a spoon. I ordered the sliders and was a little disappointed when they were just placed in front of me (rather than any actual sliding happening) but they were perfectly cooked and tasty so I left it alone. When I first arrived there was a guy waiting for his friend, but he looked a lot like the guy *I* was meeting there so while I sat and waited I had a lot of self doubt about whether or not I remembered what exactly my friend looks like. Turns out my fiend was a few minutes late, and so was his. Main lesson I guess, be careful if you're meeting a friend there. They have other customers who look like your friend. Last: the beer selection was okay, and the whiskey was whiskey. I like that kind of whiskey so I drank it.",,,
61,Mia M.,"Manhattan, NY",308,6,0,5.0,6/4/2018,"Mel's is dope!! Great happy hour deals on wings, beer, and wells! Always treated to very nice servers who are beyond accommodating! Will is the bomb!",,,
62,Theresa Q.,"New York, NY",0,27,0,4.0,8/26/2018,"I stopped by on Sunday for lunch. Atmosphere was pleasant, crowded but not loud. I ordered the Cheeseburger Baby with swiss and cooked medium. Perfectly cooked, tasty and juicy just the way I like it. I also tried the beer battered onion rings. It had a bit more batter than I would have liked. Service was good. Not a long wait for my order. A good experience for my first visit. I would definitely come back for a burger.",,,
63,Tom H.,"Riverdale, Bronx, NY",145,4,0,5.0,8/28/2018,"Epic proportions of booze, unicorns kick ass, and the lyrics to Tiny Dancer",,,
64,Joy W.,"San Jose, CA",215,495,3697,1.0,1/11/2016,"Burger was raw...need I say more?Yeah, let's elaborate, shall we?$9.75 Cheeseburger with lettuce, tomato, pickles, no onions on potato bun. It is basically paying an extra dollar to add cheese. My burger looked like an average, slightly pitiful diner burger. The outside of the patty looked cooked, but as I bit deeper into it, it was very clearly undercooked. At first I just thought it was more rare than I was used to. But there was no way I could finish that, & I always finish my food. The meat did not even come together during the cooking process. It pretty much only had a sear on the outside.$12.50 Dirty Hipster - spinach dip, jack cheese, onion rings on a potato bunMr. Joy's burger was cooked a little bit more, but still somewhat of the same raw meat, which was hidden under a mountain of spinach dip. The spinach dip was so thick and heavy, just too much. Mr. Joy said the fries were good. I guess they were. I'm not a French fry aficionado. $14 Loaded nachos with beef, beans, pico de gallo, sour cream, avocado vinaigrette, cheeseThe nacho plate is massive. It feeds about 2-3 people. Other than its size, I wasn't impressed with the nachos. But for $14, I guess they need to deliver on quantity.Mel's does have a good selection of beer and sells growlers. So that's nice, but I don't drink much at home.I thought the restaurant and service were okay, but I got to give it 1 star for the raw meat. That's a big no-no. I didn't even want to bother asking them to remake it. If they made two raw burgers, I doubt the third one will be much better. I just wanted to get out of there.",3,2,2
65,Sam K.,"Louisville, KY",161,1,0,1.0,6/28/2017,"Heard great things about this place, so we tried takeout about a week ago. My burger was great (they forgot the cheese, but it didn't bother me that much), but my girlfriend's burger came out raw (she ordered it medium...this was a far cry from even medium rare). It happens, I get it. But we called and were promised a refund within two days. A week later (with no refund), we call and the dude is super rude to my girlfriend on the phone, asking her why she didn't bring the raw burger back that same day for a replacement (LOL, because that's totally your first instinct, right?), and says that they don't do refunds. That's also fine - I get it. But why did your other employee promise a refund? After the refund was promised, we were totally cool to go back and try Mel's again, but after this dude was hella rude on the phone? No way. I'd rather get McDouble, at least it's cooked consistently.",2,,1
66,Shantel C.,"Manhattan, New York, NY",23,8,8,3.0,5/23/2018,"I thought I would give this place a try but I was not impressed. The drinks were weak, the burger was just ok. The meat was good quality but nothing to brag about. I fries look better than they are. The food isnt terrible but Ive had better.",,,
67,Darrell L.,"Manhattan, NY",11,36,5,4.0,1/23/2017,"This place came really darn close to getting the coveted 5th star. The only thing that kept them from that was the viewability (is that a word? If not, it is now) of the televisions. You really have to crane your neck in most areas of the restaurant. I understand that my experience may differ from others but my service was outstanding. My bartender, Dan (I believe was his name), was very attentive to my needs. My drink was always full and he made sure to check up in a non-annoying way. The food quality was good as well. I had the wings and the sliders. The wings were like a 6 or 7 probably - far from the best -but the sliders were amazing! This is a burger bar, though, and not a gastropub so why would you come for the wings anyway? Get the burgers! Last was the price. For the area, it is actually a little cheaper than most of the competition. They have amazing deals during sporting events and excellent happy hours/drink specials throughout the week. Awesome!",1,,
68,Diane I.,"New York, NY",33,28,22,4.0,5/17/2018,"Good service, good food, positive experience.  Staff was helpful.  We had lunch after the Columbia University graduation.  Restaurant was packef and staff was able to be efficient and accommodating.  Recommend this restaurant.",,,
69,Chelsea T.,"Patchogue, NY",253,201,1755,3.0,1/3/2016,"Okay, so I would probably give it a 3.5. I loved the experience but the food didn't rock my socks. We had a really comfortable booth for a party of 6. The atmosphere was pretty cool though at times it had a dark and lonely feel. When we first got there at 12 it was pretty empty but slowly filled up. Almost every table had parties with kids. I guess kids love burgers??? Anyway, I came on a groupon deal 2 burgers and 64 oz growler for $29. Pretty good deal. We ordered the cider they had on tap. It was really tasty but I'm under the impression the cider on tap may change often. I ordered the cowboy burger without the mushrooms. Idk. I just wasn't in love with it. I mean it didn't stop me from eating the whole thing lol but I've had similar burgers that were better and cheaper. The bun was also really small (what's up with that?). So no matter how I tried to eat it-it was just messy! Couldn't hold it. Couldn't cut it. Sigh. Trying to cut it-you go right through the paper they serve the burgers on. We all realized we were essentially eating on the table after a point. The fries were pretty good. Not the best-but good! I also like the fact you can substitute any burger for turkey, veggie or chicken! Our Waiter was really good. Efficient, nice, etc. I won't be rushing back! If I do go back, I'd try the veggie or chicken since I wasn't overly impressed with the beef burger.",2,,
70,Hyun-Sook L.,"New York, NY",0,17,0,2.0,4/29/2018,"The onions on the French onion burger were mushy, not caramelized, the juice tasted like something prepared with a powder.The onion rings were mostly batter that absorbed a lot of oil. Only very thin pieces of onion in that greasy batter.Ambience is very loud.",,,
71,Trice B.,"Charlotte, NC",129,190,942,5.0,12/21/2015,"I dream about this place. This part of  Manhattan isn't an area that I frequent at all, but after seeing an Instagram post from foodie extraordinaire, PeepMySneaks, my interest was piqued.Prior to eating at Mel's, my favorite NYC burger crown went to none other than Umami. When my dining partner and I got to Mel's, we were seated quickly in the back near the lighted marquee sign which I thought was awesome. It was kind of dark, which I don't mind at all, just not the best light for taking foodie pics! We ordered the amaaaaazing fried mac and cheese balls. I've had these at a few other restaurants, but there's was hands down the best. The last ball had to be split between my companion and I. No doubt we wanted to be greedy and hog the last one to ourselves, secretly hoping the other would decline the last out of the three. But good manners prevailed, and we shared.We both had the Mac and cheese burger with bacon. It was heaven from the first bite. I had forgotten what Umami was. Fickle burger lover? Or a sucker for macaroni and cheese? Maybe a bit of both. It was juicy, messy, cooked exactly right. I found nirvana in a burger. Every time I visit NYC, I will return.",1,,1
72,Kathy M.,"Manhattan, NY",338,116,122,5.0,11/18/2016,"A must visit for brunch! $25 will get you 2 hours of unlimited booze (bloody mary's, mimosas, and screwdrivers) and a brunch entree. You can switch between any of the drinks during your 2 hours, and they come strong.My friends and I came here on a Sunday morning (around 11:45), and was able to get seated immediately. Our waitress couldn't have been more friendly and accommodating - she didn't rush us at all. Could not speak of Mel's more highly!",2,,1
73,Marlena K.,"Brooklyn, NY",186,506,1253,4.0,12/6/2015,"Mels is my go to place for that comforting burger and LARGE milkshakes.I've been coming here for years and they never have disappointed!!It encompasses that really chill burger joint meets a laid back bar.Bathrooms are CO-ED interesting right? Full service bar if your just looking to grab a drink and watch a game.The ambience is very chill and they have a huge MELS sign lit up with old school bulbs inside. Pretty cool. Staff is really friendly and I have never had a problem with waiting too long for food.There burgers are cooked to order which my preference is usually medium, they don't overcook the burgers, which is surprising because a lot of places do. They have a vast amount of burgers to choose from, and they are a haven for alcoholic and non-alcholic milkshakes. There appetizers are not impressive. In general the nachos and spinach artichoke dip just don't do it. BURGER AND MILKSHAKE.For personal preference I've tried the alcoholic milkshakes and Ive never been a fan of mixing alcohol with my ice-cream ""happy spot"" so I just order non-alcoholic  milkshakes. Ive ordered the alcoholic milkshakes and they are STRONG. It took away from the ice-cream flavor which is when I knew it wasn't for me, but if thats what your looking for...get to drinking!! Milkshakes range from that cookie filled oreo cookies and cream to the milkshake of the month. Cookies and Cream I believe is called the cookie monster..my favorite. They bring it out in a tin can and you pour it into your glass milkshake cup as you watch the chunk of cookies struggle to exit the tin can while you try to scoop it out with your spoon. So delicious.Burgers range from your typical Burger with mac n cheese and bacon, to the simplicity of a regular burger. They have all these different names for these fancy contraptions such as the Cadillac, widowmaker, nurse betty. There all very very yummy!!My favorite is the widowmaker;Mac N cheese, bacon, served on a fluffy potato bun!! I also sometimes enjoy just the classic burger. Any burger here is a good burger. You will not be disappointed.If you order waffle fries. SHARE. They are pretty awesome perfect combination between fluffy and crunchy exterior the only problem is they usually get left behind a lot because of ordering a burger and milkshake, YOU WILL BE STUFFED! Or not?All in all one of my favorite place on the upper west side to grab a burger and milkshake. On a very positive note the burgers are better than five guys across the street and not overly oily.",1,1,1
74,弘樹,"Manhattan, New York, NY",0,1,0,4.0,7/26/2018,This restaurant offer the authentic burgers which taste good. You can enjoy brunch menu only week end.,,,
