,er_name,er_location,er_freinds,er_reviews,er_photos,er_rating,er_date,er_text,er_useful,er_funny,er_cool
145,Nicholas P.,"Manhattan, NY",201,1,0,1.0,10/29/2015,"The truth is, the food is great. The staff is terrible. I went there with a Groupon. It isn't the first time I've used them, and I, naturally, always feel guilty using Groupons in general. Because of this, I asked the waiter if he would look at it before we ordered. He said everything would be fine. We ordered the food. Again, great food. When the bill came, I handed my waiter the phone for the Groupon. It was redeemed and we received a bill for $35. The problem was that the Groupon should have covered everything. No big deal. I asked if they'd take a look.The manager came back and said he'd made a mistake. In fact, the Groupon was only good at another Mel's. He took our bill and came back with one for $60.So, there were three mistakes:1. The waiter didn't review my Groupon after I asked. 2. The Groupon was redeemed with a discount.3. When it was discovered it didn't actually work, we lost the discount and were charged full price, despite having a bill in hand for $35 that we would have gladly paid for the miscommunication. When we asked about this, the manager on staff (Tim, 10/29/15) made us feel like we were the jerks. I'm just a poor guy in New York using Groupons. I don't want to go out and be made to feel awful about myself because of it. Anyone who has worked in a great restaurant will tell you the manager should have just realized the error and charged us the $35. It wasn't an ideal situation, but it was better. Instead, he looked down on us and walked away from the conversation, charging us the full amount.If you want a good burger, there are plenty of great places in New York to get it without dealing with rude service.We won't be back.",7,,1
146,Samantha R.,"Manhattan, NY",442,29,18,4.0,10/28/2015,"Went to Mel's Burger Bar for the first time with really low expectations based on previous reviews. My boyfriend loves Mel's on the West Side so he already had the bar set pretty high.  Real happy I gave this place a shot! It was slightly less crazy compared to Mel's on the West side apparently - but never the less, a pretty chill burger joint to sit, grab a burger and beer. I like to eat a little bit of everything so the Dirty Hipster Burger (sub with Turkey Burger) had my name all over it. It had the most gooey Spin Dip with Jack Cheese and topped with Onion Rings. I hate when you order something totally out of your norm, real unhealthy and unfortunately unsatisfying.. but.. this burger seriously did the job! With a side order of Sweet Potato fries and warm BBQ sauce, I rolled right out the door. Ambiance: Good spot to watch the game and root on your favorite team - we watched the World Series Baseball game, lots of TVs so not really a bad view from any area of the restaurant. Lots of groups and sports fans alike were at the bar, everyone drinking different beers (they have about 50 to choose from). Service: Surprisingly, our waitress was quite young, she was attentive, friendly and energetic.Welcome to the UES Mel's!",4,2,3
147,Sheila D.,"New York, NY",120,10,0,3.0,5/31/2016,"Stopped in for a quick lunch and probably should have gone somewhere else. The place wasn't too busy, we told our waiter we were in a hurry, and we barely made it out in time. Food wise, there are plenty of different types of burgers. I got the classic, which was pretty good but a little pricey. There are so many burger joints nowadays, not to mention in NYC. If you happen to be near Columbia, cool, but otherwise not much to talk about here.",,,
148,Gianni R.,"New York, NY",0,6,8,3.0,6/18/2016,"Burgers were decent, nothing over the top. Good service, but felt like the food wasn't worth it. The burgers could have been a little better or bigger. The buns were the same buns I buy a sandwhich from the deli.",,,
149,Leo L.,"Manhattan, NY",12,112,541,4.0,11/27/2015,"The WTF Burger is pretty good, maybe I'll go to try the beer when I am free.",1,1,1
150,Peggy N.,"Beacon, NY",0,3,0,1.0,4/11/2017,"Arriving one-half hour early for a book reading at a nearby bookstore, I stopped to have a drink at Mel's Burger Bar on a Tuesday evening, April 11th at approximately 7:30 p.m. As soon as I sat down the bartender shoved a menu at me. ""No, I'm just going to have a drink, thank you,"" was my response. I asked for a Grey Goose with a small amount of ice and extra lemon. He brought me my drink which had an over-abundance of ice. ""Please... can you take some of the ice off?"" I asked. Well... Mr. Bartender became a bit huffy, snatched the glass from my hands discarding the ice aggressively into the garbage can, I sat at the end of the bar. He slammed the glass down in front of me and bellowed, ""Are you going to make a tab?"" or something along those lines. I responded well... maybe I'll have a second a drink but I'm not sure yet. The gentleman next to me, who was from Argentina, said, ""I was having a perfectly calm day until now - what's with this waiter? You haven't sat here for two minutes and he's asking for payment?"" The waiter returned after seconds later bellowed louder than the television program, louder than the patrons at the bar, ""Miss, I'm going to need your payment or a credit card, now!"" I was shaken up that I asked to see his manager.  His name I do not recall, but bartender whispered in his ear before he came over to see me.  BOGUS!Well, listen up Mel. This isn't how guests are treated?  I would appreciate an apology and your manager and bartender need to have further training.  They will ruin your business in the end.  I  can't recall his name but based on the timeframe above, you know who was at the helm. I am a female who stopped in for a drink, alone, and was abused by your waiter. I understand the bartender had been working for you a while - he used to have long hair but recently cut it. Maybe he's suffering from a Samson complex - the manager agreed? BUT NOONE DESERVES TO BE DISRESPECTED. My boyfriend wanted to come down to teach him a lesson or two... But I think this Yelp response is enough. Don't you?",,,
151,Tiffanee A.,"East Elmhurst, NY",2,74,19,5.0,6/6/2016,Comfortable and relaxing scene. Staff extremely cordial and polite. The food was delicious. We got the hot mess burger with jalapeño parmesan fries. I  had a pomegranate mimosa and he had a mint Oreo shake. Definitely will be going back!,,,
152,John L.,"Glen Rock, NJ",0,20,0,4.0,4/7/2017,"Good craft beer selection.Good burgers. Didn't go for one of the serious heart attack ones!! Had already filled up on the loaded Nacho's.Only complaint, they need to get better bread rolls. The current ones don't do the burgers justice.Waiter was great!!",,,
153,Jori Rose S.,"Manhattan, NY",168,86,63,5.0,2/7/2016,Best burger joint in the neighborhood! The California burger is my favorite--and this is coming from someone who usually hates red meat. The service is always excellent and the selection of different beer is great. We had a horrible experience at a bar down the block and brought our large party to Mel's. They easily accommodated us and offered excellent service. We can always count on this establishment to provide great food and service!,,,
154,AM W.,"Long Island, NY",4,152,58,3.0,10/17/2015,"Great food-we were a large party and everyone was pleased with their order.  The garlic fries were scrumptious as was my California burger and my daughter's man n cheese.  The service was friendly but a bit slow-had to ask for water refill and utensils but I'll give it a pass because we were a large party.  The bathroom was not impressive and that is a huge turnoff to me-which is why 3 stars instead of 4.  Management must know if it's a busy day-go check the bathrooms, clean nasty stalls and make sure there is tp!  I dont think unisex bathrooms work-ever!I would go back-the food was really great.  But again-clean bathrooms!!!!",2,,
155,Alison F.,"Manhattan, NY",3,13,0,3.0,6/10/2016,"This place has decent burgers, if you can get service. For the second time in the past few months, we were seated by the host and then ignored by the servers for over ten minutes as they waited on tables on either side of us. At the very least they could acknowledge our presence by saying ""be right with you"" if they don't have time to even take a drink order. That being said good burger and beer selection, hit or miss service.",,,
156,Hailey N.,"College Hill, Providence, RI",166,15,19,2.0,11/30/2015,"Despite the good things I've heard about this place, I found the food rather disappointing.I ordered a Cadillac burger and a half and half. The burger was cooked well, but there was barely any mushroom, even though I ordered the mushroom topping. The fries and onion rings, though generous in portion, were really soggy. Overall, the food was underwhelming. Service was good, but I don't think I'll come back again.",1,,
157,Rishi A.,"Washington Heights, Manhattan, NY",6,73,45,4.0,3/16/2016,"Came here after a ski trip with friends. We were a party of 11 and we were seated at the table in the back almost immediately -- this was very convenient. Got the onion rings and disco fries as starters -- absolutely delicious. I got the nurse betty burger with added avocado -- really good, but the patty itself was kind of weird. Made me doubt whether it was actually vegetarian -- it had rice inside it, and the color resembled beef (it was very red - it wasn't a black bean or boca patty). I must say it wasn't my favorite patty but it still wasn't bad. For drinks we got 2 half-gallon growlers - I forget which ones but they were quite good. The service was slow at times but overall was still very good, and our table was very spacious, which is why I give this place 4 stars. I'll definitely come back!",,,
158,Wilkie J.,"Manhattan, NY",2291,456,9244,5.0,5/31/2014,"Now I lay me down to sleep,I pray the Lord my soul to keep.Angels watch me through the night,And wake me with the morning light.Amen.Yes, this is a prayer you will say after eating a great meal from this establishment! Ohhhhh snap, Kiddies, I have bad news, so sit down.I just killed the Hamburglar with a sledgehammer, because he dare to steal my WTF burger. ""Don't you know not to mess with my burger while I sip on some great beer Mel's?!""Mel's Burger is an awesome place to come and spend time with friends! You know, eat, laugh, and eat again. Of course their burgers are the best in the area, so please walk pass McDonalds and treat yourself with one of their awesome burgers right now.  My goodness, I just started to drool while I picture it in my head. Anyway, their draft beers are also something to check out, if you are a beer lover. I love Blue Moon BTW, if you care to spend money on me, there you go. Recommendation:Get the WTF burger and for your drink, the Cookie Monster shake.",5,6,5
159,Allison C.,"New York, NY",209,1624,449,4.0,7/20/2012,"I am surprised at the current three star average based on 165 reviews. REALLY? This is a fantastic joint! Honestly, my only complaint would be the exorbitantly high hamburger prices. They still were not enough to turn me away.This restaurant was on the verge of opening when I moved out of that neighborhood two years ago, and I was always pissed that I wasn't around the corner from it anymore once it did open. However, I was finally able to indulge recently, and I could not have been more pleased.The interior is fantastic and much larger than I expected; I was expecting the dining area to be skinny and straight towards the back. However, there is a surprisingly large rear dining area, a full (and beautifully adorned) bar, and the name ""Mel's"" in bold and shining lights on the extreme rear wall.I gorged myself to the point of nausea with no regrets. The garlic fries were loaded with freshly minced garlic; I was eating occasion full half-cloves with no regrets. I ordered the Dirty Hipster burger: a patty topped with spinach dip, jack cheese, and onion rings on a potato bun. It's an extraordinary combination! How I finished it is still beyond me. I washed it all down with an Original Sin and sank into an expected food coma. Yes, as I mentioned, this is a pricey joint. Even for some of the more absurd toppings, I really can not, personally, justify spending $12.40 on a designer hamburger. However, did I? YES. I did. And I'd probably do it again. Why? Because the Widowmaker (a hamburger covered with mac & cheese and bacon) is calling my name, beckoning me towards an early grave...",1,2,1
160,Dang L.,"Houston, TX",127,113,306,3.0,6/24/2014,"Not the best burger I've ever had, but not the worst either. The burger is actually surprisingly small so don't expect one of those big burgers. I got the ""Hot Mess"" Burger. The buns seem a bit too small and made it appear like you got a big chunk of beef. I felt like they cut up half an onion and put it in my burger. Tasted nothing but the onions. I didn't taste much of the garlic sriracha mayo that was suppose to be in the finishing touch; maybe they should add more of the sauce. As for the ""Parmesan Jalapeño"" fries, they were delicious. Nice and crunchy, not too oily or soggy. But the ketchup had more flavor than the sauce that came with the fries themselves. Overall good meal though. Service wasn't outstanding, had to call the waiter over all the time if we needed something.",2,1,1
161,Ridge C.,"Chattanooga, TN",0,7,1,5.0,5/12/2016,"This was my favorite food stop on my trip to New York. The burgers are excellent, the staff is friendly, and the beer is good. The service was fairly quick and they offer one of the  best craft beer selections that I saw in New York.",,,
162,Stephy G.,"Palisades Park, NJ",97,114,146,2.0,10/11/2015,The location is great. The Resturant itself decor wise looks great. The service is absolutely horrible - I saw my waitress when she took our order and when I was able to track her down for my check. Mind you the place was not even that busy. My table had 3 Cadillac burgers which were decent along with a side of half&half (half fries half rings-rings were pretty good) we had buffalo wings as an appetizer which were a joke for wings - they were so small and skimpy for $12. No one even thought to bring us over plates we had to ask and wait about 15 minutes for someone to relay the message to our waitress. We received two burgers at once and another 25 minutes after.. You would think if you order together your meal will all come together. Overall I most likely will not be coming back.,1,,
163,Jaehee H.,"New York, NY",177,114,0,4.0,11/17/2015,"This is the it-place of Columbia so I had to check it out. It's extremely loud, but the burgers are solid and their beer selection is good.",,,1
164,Jessica C.,"Irvine, CA",42,8,1,3.0,3/22/2016,"The veggie burger is not good. It looks like raw meat, so much so that a friend who also got it had to ask to make sure it was indeed a cooked burger, and vegetarian at that. It seems like a rice burger colored with a tiny bit of beet juice. It completely fell apart and had no texture or flavor. As someone who makes veggie burgers at home with black beans, saltines, and spices, I just don't think it's that hard to make a crispy and tasty veggie pattie. But. The drink selection was fine and the fries were fine. A friend with the gluten free bun said it was very crumbly and fell apart but it seemed like those who got beef patties with regular buns had good experiences. BUT, thumbs up on the gender inclusive bathroom!",,,
165,Julia B.,"Manhattan, NY",132,97,133,4.0,1/16/2016,"I absolutely love a good burger, and this place did not disappoint. We ordered some sides of fries and they are big enough to share with your table. I got the widow maker burger which is covered in Mac and cheese and bacon (not for the faint of heart) and it was AMAZING (other than how messy it was). I also ordered a mint John Daly which was light and refreshing. It's a tad expensive for a burger place though.",,,
166,Ruby S.,"Manhattan, NY",436,173,365,4.0,12/25/2015,"If you love burgers this is the place to go. Mel's Burger Bar located on 110th and Broadway has some of the most unique burger combinations out there. It is on the expensive side, and may not beat Shake Shack, but it comes in a close second with another favorite place of mine known as Brgr. From The Cowboy to Dirty Hipster, you may find it hard to choose which burger to order. I settled on the Hot Mess burger which comes with onions, jalapeno, bacon and cheese with a potato bun. 9 out of 10 juicy burgers!",,,
167,Melany O.,"Everett, MA",0,16,23,4.0,2/21/2017,"Visited NY with my girlfriend and had to check this place out cause, well, it's my name. It was only a couple blocks away too. Very cool and relaxed atmosphere, great beer and nice menu selection. I had the fries that were topped with gravy cheese and scallions. They were delicious. Service was good too.",,,
168,Gece C.,"Bronx, NY",130,39,100,3.0,12/18/2016,Went there last night food was ok . Didn't like the sweet potato fries or the fried ores but the Not your average grilled cheese was good ! The Servicer was nice and friendly .,,,
169,David M.,"Jacksonville, FL",79,270,46,4.0,6/10/2014,"According to my unscientific review, Mel's seems to get a bad rap mostly for the service.  This is sometimes justified, since it's been unfriendly and inattentive on half my visits (including bizarrely slow table turnover during busy times).  But I'm guessing a lot of the negative reviews are payback by hungover Columbia kids who got thrown out by a bouncer the night before (note: if you come to Mel's late, you will encounter drunk Columbia kids).But seriously:- Beer selection: 5/5.  Draft and bottle assortment is outstanding and actually well thought out, something for almost everyone.  Rotating Founders line, Left Hand, 21st Amendment, lots of other good stuff.- Burgers: 4/5.  One of the rare places in the city that actually leaves a burger medium rare if you ask for it.  and there are a bunch of the specialty burgers that are quite tasty (the Broadway, the California, the Cadillac).- Fries: 4/5.  Will sometimes come out a little brown for my taste, but the garlic, the parmesan/jalapeno, and the sweet potato are all delicious.annnnd I haven't tried anything else on the menu really.  Beer, burger, fries, rinse & repeat.  It's a simple formula, consistently well-executed, at a good price.  Plus -- they play great blues/rock at a loud but not overwhelming volume, and the TV placement is solid.  Just maybe be prepared for the occasional rough service experience.",1,,
170,Lauren B.,"Manhattan, NY",0,1,1,1.0,10/5/2015,"Well the cups were filthy, we had no silverware at our table and got no appetizer plates, there were toppings missing from my burger, and the veggie burger looks like a cruel trick because it is visually identical to raw ground beef. But we only saw our waiter 4 times during our visit, the last two of which were him silently tossing the check on our table then snatching the credit card so there was no one to ask about any of it. Or request to get anything we needed.",1,,
171,Tamarik M.,"Manhattan, NY",73,3,0,5.0,8/21/2016,"LOVE this place!!! Burgers, buffalo wings, onions rings are great and reasonably priced, I usually order the Double Double burger and the Parmesan Jalapeno fries! Food is always cooked perfectly and their drinks are absolutely amazing. The interior is big and has plenty of seating. I will definitely keep going back and would suggest this place to all my friends!!!",1,,1
172,Chris W.,"New York, NY",3,27,2,2.0,"10/4/2016
            





Updated review","Pretty damn good burgers. A little pricey, but it's NYC and you get what you pay for. There's a five guys across the street if you're frugal. The sidewalk tables provide a great spot for people watching next to Columbia university. Nice selection of beers on tap and an even larger selection of bottles. Updated: I found myself back again but noticed the prices. The burgers are fair priced for NYC but the fries... $7!  That's stupid. Oh... and an iced tea: $4It's fucking water. This is a way of telling me you don't respect me as a customer. I kicked it back 2 stars for this.",,1,
173,Cat T.,"Honolulu, HI",74,179,132,3.0,9/13/2014,"I LOVE the ambience and interior decor of this burger bar. They did a good job in matching what a burger bar should look and feel like. Also, I appreciate the vast array of beers available. If you're a beer person, you better get your butt here! As for the burger (ordered the cheeseburger) it was okay. Not the best, not the worst. I actually could taste a slight un-freshness to the meat. I ordered 'medium' done but the burger came out to be way more pink then it is. And let me say I'm the type of person that orders 'medium rare' steaks, but decided this is ground up meat which should be cooked a tad bit more.Also the 'half & half' side dish (half fries & onion rings) were ridiculously oily and overcooked. Even though I love fries and I ate them, they were by far the worst fries I've ever had in a burger joint. Overall, I give this place 3.5 stars. I'd go back because its not a bad place to hang out and chill with friends.",,,
174,Zhang X.,"Columbus, OH",1,1,0,3.0,1/10/2017,Fast casual dinner near Columbia University. Burger meat is not bad but sides are frustrating. It's more of a bar than a Burger place.,,,
175,Lazy Lightning L.,"New York, NY",2,17,0,5.0,1/1/2016,"Today was my second visit to Mel's. It's new year's day and we are feeling a bit pasty.  My girlfriend loves a good bloody and they had all the fixings and then some; olives, onions, bacon, an onion ring and a big pepper. It drinks like a meal.The beer selection is great and the burgers were delicious.  Most of all I really loved the refreshing music that was playing.  It was very classic rock leaning with a good variety of artists from older acts like csny to relatively newer bands like blues traveler. They were playing many good obscure songs from a lot of artists.  Good food, good drinks, and we loved the music",,,
176,Scott R.,"WHITE RIV JCT, VT",22,12,1,5.0,4/10/2016,The employee that greeted us at the door was super pleasant and gave us menus and let us ask questions. We told him we were from out of town and he sat us in a great booth. It was a little long for the food but the atmosphere was really good. Our waiter was good about checking in with us. When the food came out it was really good. No complaints and will recommend Mel's to friends.,,,
177,Jess L.,"New Haven, CT",3283,4310,3310,4.0,"1/8/2014
            





Updated review","I've come here a few times since my original review, and I have to say Mel's really does burgers right. If you want something hearty and different, this is the spot. And brisket. Don't come here for fish tacos, though. They were mighty disappointing. And don't necessarily come here looking for any healthy options. The salads (3 options) are basic, and every other sandwich or burger is complex.Still, this spot has grown on me, and I appreciate the kindness of the people who work here.",2,,1
178,Corrine Z.,"Northport, NY",6,22,18,5.0,12/29/2014,"My first time ever giving a place 5 stars. I LOVE Mel's. I've had the brunch which is colossal in portions with super cheap drinks. I've had the burgers which are juicy and creative. The fries are bountiful, delicious, thin and crispy. The beers, over 40 are great and if you don't like yours they'll get you a new one! My favorite stop on the UWS, can't speak highly enough of this place!",,,
179,Jeremy S.,"New York, NY",155,663,13,2.0,11/7/2016,I was craving fries and decided to try this place out. The interior was cozy and the takeout food came quickly. I had the jalapeño Parmesan fries. It was quite pricey at $7.50 but it was a good portion. My main gripe is that the fries weren't crispy at all and the jalapeño is too overpowering. I also didn't feel good at night after this meal and am not planning on coming back.,,,
180,Abi D.,"Melbourne, FL",5,29,15,2.0,7/26/2015,"This restaurant is mediocre, to be honest. I came here today expecting much more from them, and it didn't even come close to meeting my expectations. The Nurse Betty Burger had little to no flavor at all, and was truly a mess. It was described as a burger, but was more of a sandwich with a saddening, falling apart, and extremely greasy veggie patty. Served on a pile of lettuce, it just seemed like a kind of burger that was just thrown together. Additionally, the menu clearly stated that this burger would have sauteed mushrooms on it, and it arrived without any. The only acceptable thing about this restaurant were the fries. I ordered the fresh cut fries. Albeit being on the nearly-oversalted side, they did taste good... Overall I was truly upset to see the quality of food at this restaurant, as it filled me with disappointment.A 2/5 is being generous.",1,,
181,K S.,"Manhattan, NY",5,101,3,5.0,9/6/2014,"LOVE this place!The veggie burger is beet-based and absolutely delicious! Many restaurants serve really crappy frozen veggie patties to suit their vegetarian option, but Mel's gets that that just doesn't cut it. The Nurse Betty is delicious, as are the fries!Great atmosphere, great service. This is one of my new favorite spots!",,,
182,Gabrielle T.,"Washington Heights, Manhattan, NY",39,64,31,5.0,9/24/2015,"YUMMM I love this place!! Great food, nice bartenders, enjoyable atmosphere. They have a ""Brew Crew"" which you can be a member of if you drink all of the 30 beers listed (obviously not in one night). Still working on that, but I like the fun idea!Definitely one of my favorite spots in the area.",,,
