,er_name,er_location,er_freinds,er_reviews,er_photos,er_rating,er_date,er_text,er_useful,er_funny,er_cool
53,Mendy Y.,"Austin, TX",547,534,421,4.0,8/14/2015,Cute alternative to Starbucks (especially when in FiDi). They have a pretty standard selection of drinks with a standout item: the honey lavender latte-must try! There are a few seats scattered by the window but overall not a large space. Sometimes the music can be pretty loud so maybe not the best place for an extended conversation but overall a chill hangout spot with cool vibes!,,,
54,Nomad M.,"New York, NY",125,291,1096,3.0,9/17/2016,"I don't get the hype. Wouldn't call my self a coffee expert but I drank average 4 espresso or latte daily so that ""practice"" could at least lend me some credibility. The latte here is weak, feels like the machine does not have enough pressure for producing high quality shots. Also the almond milk is sweeten and thin. Yes it is cheaper by 50 cents-ish compared to Starbucks or 1 buck less than Colombe, but quality / price ratio is not worthy. Cheaper and independent does not equal to ""better"".",,,
55,Kevin Z.,"New York, NY",140,437,586,4.0,4/13/2014,"This is a tiny small cafe with sitting for about 8 people at max. The list of drink ranges from regular coffee to fancy crafted drinks. Price is reasonably same. The major difference is the cup they use. If you want to drink your stuff in those nice espresso cup sometimes, come here and ask to stay.",,,
56,Leana D.,"New York, NY",36,169,121,4.0,7/30/2015,"I am not a coffee drinker, but their tea, especially ice tea, is awesome.  They also have fantastic chocolate chip cookies and tuna melts!  Love this place.",,,
57,Scott S.,"Short Hills, NJ",4732,707,1335,5.0,7/28/2013,OK I am a huge fan.  I love Intelligentsia coffee and they serve it here.  Large was hot and flavorful but not bitter and for $3 a good deal.  Balthazar pastries an added bonus.  People are nice and its not Starbucks crowded.  Frequent purchase card works for me.  Quiet location and I'm going to be a regular.,2,1,1
58,Boris B.,"Brooklyn, NY",8,10,2,5.0,6/11/2015,"This is my regular coffee place. staff is nicw, cookies are perfectly sized and coffee is great.I've only had the food once or twice but that good each time. Its not a sit down place, its very small, but somehow its comfortable anyway.",1,,
59,A. J.,"Palisades Park, NJ",0,35,21,2.0,3/24/2015,"Ok...everyone who's commenting giving 5 stars obviously is drinking the kool-aid and not the coffee here.  I've been here 3 times because of a coworker's recommendation but this is definitely on a back up list.  Let's break it down to the basics: Coffee: WEAK.  I'm not sure what their trying to accomplish with their brew of coffee....but it was weak, watered down, nothing special here.  It's like starbucks blond but half water added.  I've had keurig coffee that tastes more flavorful and bolder than their coffee.  And they charge $2 for a small cup...go figure.  Americano: They have a special cup for their americano, aka mini cup.  Its slightly bigger than a espresso cup and here's the kicker.....IT'S $3.50!  Whew....i had to really try to enjoy this magical americano where I'm sure they sourced the beans from the deep mountains of Himalaya and had donkeys to carry it back to the port where it was shipped on a sailboat and carried by a bicycle messenger to Fidi.  Kudos to the extra friendly, nirvanaesque, organic staff there for putting their free spirit effort in making my awesome $3.50 americano....I'll take my starbucks venti americano for $3.50 over this mini cup any day.  Even if the coffee beans they use are magical beans.  Latte: Oh yeah, the honey latte that they put pretty little designs into the foam....again, koolaid.  Stop it people.  This is why financial district struggles with the culinary scene, people have money to piss away and have no issues jumping on the bandwagon.  2 stars at best, simply because they're no better than if not worse than your neighborhood cafe but charge a premium for their artsy fartsy facade.",1,5,
60,Yumi M.,"New York, NY",25,62,17,5.0,5/8/2014,A small coffee and almond croissant for $5.54 is pretty good considering how tasty both are. It's the first coffee that I can tolerate drinking black!Now that's amazing!,,,
61,Tolu O.,"Manhattan, NY",16,29,1,5.0,"8/12/2015
            





Updated review",My go to spot for coffee in Fidi !!!! Love the flat white :) Go on thursdays for lentil soup as well - another gem! Thanks guys!,,,
62,Erick I.,"Manhattan, NY",0,4,0,2.0,4/7/2015,"I'm reviewing the location on Chambers St. in Tribeca.  A staff person there is so miserably pretentious and unpleasant that I've come to avoid this otherwise decent place altogether.  Honestly I'm not sure how he manages to keep his job, maybe he's related to the owner or something.  With so many other options for good (better) coffee, why would I want to start my work day dealing with this dude's consistently terrible, snarky attitude?      And as a coffee freak, I can say as a matter of fact that the coffee here is just Ok.  It used to be much better quality in terms of richness, flavor and strength.  (They still brew good beans, just not as strong, probably a bit watered down).  The coffee has certainly gotten worse over time, yet prices are creeping up.  Sure it's still better than Starbucks, of course, but not by much.The food here is good, that's a plus.  Tasty and good quality, with plenty of wholesome, healthy options, including vegetarian options, usually quick service.  This business would earn 3 or 4 stars in my book if they simply got rid of the grumpy, anti-social, scornful, indifferent, aloof and pretentious staff person.",1,,
63,William S.,"New Orleans, LA",430,218,27,4.0,6/27/2016,"Great little café near Wall Street to grab a quick bagel! Limited on its bagel options, but have a myriad of different sandwiches and drinks. The everything bagel with scallion cream cheese was fabulous. Packed with scallions! However, the green tea was awful. The whole drink tasted like a peppermint candy combined with a york patty. Won't be getting that again. Come for the bagels!",,,
64,Renee H.,"New York, NY",2,44,2,5.0,"8/22/2016
            





Updated review","3 years after my first review & this place has only gotten better. Even with the other specialty coffee shops popping up in the Financial District this one is still my favorite, every barista makes a perfect drink and so many of them have been there since the place opened I imagine they have to treat their employees well. Everyone is friendly, and those damn homemade chocolate chip cookies...",,,
65,Katie P.,"Manhattan, NY",23,24,63,4.0,7/24/2015,"Great alternative to the many conventional coffee shops in FiDi. Offers creative and wide variety of teas, coffees, lattes, and other varieties. Good pastry and breakfast selections, and lunch menu. Nice atmosphere. There is a $4.00 minimum credit/debit purchase here, so bring cash if you would like something under that price point.",,,
66,Mags D.,"Miami, FL",9,65,65,5.0,5/18/2016,I loved this little place! It was so cute. They have so much coffee and options and it just taste great. The location is really nice as well. They're interested in the client and my cashier made me die of laughter.,,,
67,Nadege B.,"Montreal, Canada",0,19,0,5.0,7/31/2015,"The best latte in FiDi !!!!Their salads are incredibly generous with tasty ingredients. The goat cheese or blue cheese salads deserve their names, there is cheese indeed ! At 8,50$ its amazing !!!And these place is really friendly :-)",,,
68,Michael C.,"Manhattan, NY",76,957,240,4.0,3/8/2015,"Small little coffee shop, indie-feeling, serving Intelligentsia (from LA) coffee. Blue Spoon is a great small, quick option to the multiple Starbucks littering downtown/FiDi. I'd stop back in for 10-15 to enjoy a morning coffee the next time I'm in the neighborhood. Credit card accepted.",,,
69,Tushar N.,"Brooklyn, NY",476,106,87,5.0,4/27/2015,My go to coffee spot. I go every Friday and occasionally Mondays after flights Great service friendly and love the intelligentsia coffee and bagels.Don't listen to reviews based on one visit. Overall they have good coffee and service. Occasionally they messed up my order but always rectified the issue. I'm sort of a regular now and they got me covered,,,
70,Pam F.,"Jackson Heights, NY",136,165,16,1.0,4/2/2015,"If I could rate this place less than one star, I would. One star is too many for this place.As a first time visitor, I cannot attest for their coffee, but the service SUCKS. There are many places who overcharges for their coffee, but at least those places have acceptable customer service. This place falls short of that, your money is better spent somewhere else.However, if you want to see two yuppies cut you in line as you patiently wait while their equally pretentious cashier people happily lets them do so, this is your coffee shop. Heaven forbid that you say something after the third cut attempt, they will stare at you as if you have two heads.Me: ""So are you going to let everyone cut in front of me?""Cashier girl: ""Oh well, she already bought something so sorry."" Unapologetic of their uppity behavior, still sans caffeine, I brought myself and my wallet to Financier down the block. I was able to purchase a cafe au lait with ease--it was great! If you are seeking Intelligentsia Coffee, there is an outpost at Herald Square. If you want dessert coffee in general, Bluestone and FIKA are nearby. Blue Spoon is expendable. Next office party, I'll stress to my office manager to never order from Blue Spoon and give the business to Financier instead.",,,
71,Esther K.,"New York, NY",203,365,81,5.0,11/24/2014,"I love this coffee shop! They have intelligentsia coffee, which I am a big fan of... AND Balthazar Almond Croissants! Woohoo... my two favorite morning snacks! I haven't had a chance to try out any of their sandwiches or wraps but from what i've seen, they do look really tasty. The staff is really friendly and nice here too! It is a small shop here, so its not one of those coffee places you and just lounge around on your laptop all day but then again, if you are lucky enough to snag a seat... I guess i don't see why not!",1,,1
72,Dan W.,"Long Island City, NY",0,16,3,4.0,10/3/2014,"Great panini - had the roast turnkey with pesto.  Coffee is tasty and the complements (cocoa, cinnamon, etc) are high quality.WIFI is likity split, however its too small to get any work done, despite the music being at a reasonably low level.More of a drink/eat & run spot.",2,,
73,Debra L.,"New York, NY",2,20,1,3.0,8/5/2015,"Don't be fooled by the size of the turkey and brie sandwich. I'm eating mine right now and pulled out enough field greens to makea side salad. I'm still looking for the turkey and the apples are close to non-existent.The sandwich is tasty, but I'm not puzzled by the overloaded greens.",,,
74,Victor W.,"San Francisco, CA",351,781,166,5.0,3/16/2013,Intelligenstia Coffee is served here. Hands down best coffee in the area. Not too much in the way of seating except counter tops and 1 or 2 tables though.,,,
75,Aeeza L.,"Upper East Side, Manhattan, NY",18,90,1976,5.0,10/28/2014,"Honey lavender latte is a must-try. Smoked turkey with Brie, apples, greens and honey mustard is just delicious!",1,,
76,Justin H.,"Manhattan, NY",143,113,1634,4.0,7/23/2014,"It's my first week at my new job in the Financial District and I have been eager to find and try all the hot spots for coffee and food. Let's just say, I wasn't expecting a food mecca in this area, but there are a few great places to check out. I don't drink too much coffee, maybe one cup a day, but when I do drink it, I want the good stuff. Meaning, I'm looking for a hipster/trendy shop where I am most likely going to shell out around $4 for a cold brew. Not a Starbucks or Dunkin, and especially not the crappy java from the work cafeteria.As I ventured out this morning looking for a caffeine boost, I opened up Yelp to see what was around. Unfortunately, my phone service is absolutely terrible around my office so I went for a short walk hoping to run into a decent place. Luckily, I ran into Blue Spoon (which is literally steps away from my office). Their outdoor sign enticed me as I read that they brew Intelligentsia coffee and offer breads and pastries from Balthazar and Ceci-Cela. I was immediately greeted with a smile at the counter and surprisingly there was no line. It's summer so I went for a cold brew ($4) and picked up a fresh piece of fruit, although I was extremely tempted to try the delicious looking pastries and bread from Balthazar and Ceci-Cela. I'm happy to have this place right around the corner from my office. I'm glad I ran into it when I did, otherwise I would be still walking all the way to Hudson Eats at Brookfield Place to grab a Stumptown cold brew from Black Seed.",1,3,1
77,M-l L.,"Hamburg, Germany",2,8,1,2.0,11/18/2015,The iced coffee was colored water and the muffin with raisin was dry. No good start in the morning for almost 8 dollars!,1,,
78,James R.,"Brooklyn, NY",0,5,1,2.0,5/17/2016,"Incredibly disrespectful staff (long hair guy) at the register. Came by with a few co-workers and was unnecessarily rushed to order while looking at menu (""NEXT?! NEXT??"") -- there was no one else behind us by the way. While ordering and asking for clarification on coffee cup sizing, I get a self-righteous hipster eye-roll for asking why the medium says large on the display case. Seems like a valid question buddy, and I asked very nicely. Won't be coming back here, I'll stick with Bluestone Lane on Broad St. where I won't have to deal with snide and angsty kid-adults",,,
79,Alexandra C.,"New York, NY",858,1985,61,5.0,11/9/2012,"Pretty tiny shop with excellent goods.  Good coffee and Ceci-Cela chocolate croissants and Balthazar almond croissant... No need to go to Soho anymore.   Also the best toasted/buttered bagel I have ever come close to having downtown.This place is a huge plus for the FiDi area.  Only problem - it is right next door so I will probably gain 10 pounds from the place.Friendly staff, not a long wait... Take a visit here.. You won't be disappointed.  There are a lot less of us working downtown here now  - those of us left need to support the downtown businesses!",,1,1
80,Elise P.,"New York, NY",73,22,3,4.0,9/23/2014,"I love their intelligentsia coffee! This place is always packed in the mornings but their staff are friendly and work quickly to get you a well made drink.The espresso drinks are fantastic. The milk is foamed just right and they do a wonderful soy latte as well. I often get their oatmeal, which is prepared without milk (great for those who are lactose intolerant), and to which you can add toppings like: walnuts, bananas, apples, and cinnamon. Their regular brew coffee is good, but not something I crave. The pastries are ok, but not exceptional.",1,,
81,Jane K.,"Seattle, WA",305,61,17,5.0,3/8/2015,"Many other reviewers have already called out the honey lavender latte, which is what I order 95% of the time I frequent Blue Spoon for my much-needed pick-me-up on days I just don't want to head to my 9 to 5 (because I know it's going to be more like 9 to 7). It's amazing, but their other coffee drinks and breakfast items are great as well.Highly recommend Blue Spoon if all you know if is the Starbucks right next door.",,,
82,Ariel A.,"Woodside, NY",145,93,0,1.0,2/4/2016,"This business won't go under because it's in one of the busiest Manhattan neighborhoods. However, my breakfast was so terrible that I will never be back. How do you screw up a bagel and cream cheese and how can green tea taste this bad? I'm very disappointed. Yuck.",,,
83,Elaine P.,"Baltimore, MD",97,62,87,3.0,2/20/2016,"Got a flat white, it was ok.  The coffee was a bit bitter and the OJ seemed processed. Not very impressed:",,,
84,Alyssa S.,"Long Beach, NY",40,50,26,4.0,1/22/2016,"Seriously good cold brew! Convenient location for people who work in that area of FiDi, and a much better alternative to other unnamed coffee establishments. Their oatmeal with different toppings is also nice. They have a nice little selection of pastries. Service is super quick, although usually not the friendliest.",,,
85,Warren D.,"San Francisco, CA",0,52,0,5.0,5/24/2016,"Best cappuccino I've had since leaving Sydney, so I'll give it 5 stars. As you may know Australia has amazing coffee!",,,
86,Omar J.,"Brooklyn, NY",553,25,3,5.0,12/30/2015,"I have to say, I've been to a lot of coffee spots.. This has to be one of the best ones hands down. It has the small privately owned coffee shop feel to it. The workers were very nice",,,
87,Cindy G.,"Los Angeles, CA",401,624,178,4.0,6/1/2015,"Tiny hole in the wall location in Fidi, that serves Intelligentsia Black Cat coffee. This syrupy and sweet espresso blend is a delightful way to get your caffeine fix.",4,2,3
88,Melissa M.,"New York, NY",22,32,4,5.0,2/1/2014,"Coming from someone who lives in the neighborhood and has conducted a good deal of research on coffee places in FiDi, trust me when I say that this place is worth your time and money. If you find yourself veering toward Starbucks across the street, STOP! Slap yourself on the wrist, turn around, and go to Blue Spoon.Their prices are pretty standard for coffee in the city, but you get a waaaaaay better product than any of the giant chains and they have some pretty decent little snacks too. I've yet to try any of their sando's/ bigger plates, so I'll write a follow-up review for that.Otherwise: great product (latte- two thumbs up), tasty pastries, cute & simple decor, and friendly service. The only downside is that the place is a little too small (line can easily build-up out the door).Final vote: top 3 coffee places in FiDi.",2,,
89,Tran B.,"Secaucus, NJ",17,37,5,4.0,7/28/2015,"Blue spoon offers great bagels and awesome coffee at a good price. I go here for my everything bagel with cream cheese, toasted and their honey lavender coffee is great! It cost about the same price as any other bagel and coffee shop in the city but you get more for your buck instead of those stale bagels you get from other morning places. They also serve lunch food too!",1,,
90,Clare C.,"PECK SLIP, NY",168,8,1,1.0,8/8/2015,"I don't know why this place had such good reviews, I guess it was for the lunch. Definitely not for the latte or breakfast! I got 2 oatmeals and 2 lattes for over 20$ and they both are terrible. The lattes are extremely weak I think she forgot to put the espresso in it, tastes like warm milk.... I will not be coming here again.",1,,
91,Ben B.,"Brooklyn, NY",6,24,0,5.0,4/10/2014,"I'll tell you all what I told who I presume to be two managers of this place (they're always there) this morning: I love this place. I usually make coffee at home, but when I don't have the time, or if I am craving an awesome bagel with my coffee, I come here on my way to the office. The drip coffee is outstanding -- Intelligentsia -- and the bagels, pastries, and muffins are very good. I don't drink lattes and such, but they seem to be made with the utmost care. The employees nearly always have smiles on their faces, and their enthusiasm for serving top-notch coffee and morning vittles is infectious. The soundtrack is usually really good, low-key indie rock, which suits me just fine.If you go to the Starbucks across the street, you are either A) a fool; B) extremely lazy; or C) don't know what good coffee is. A little slice of soul in an otherwise soulless area of New York.",1,,
92,Thomas B.,"Washington Heights, Manhattan, NY",85,11,7,4.0,1/4/2016,"I am a coffee snob. Been looking for good coffee in FiNiDi for a while. Glad to find a spot with fresh roasted beans (from Sight Glass). The espresso shot was pulled a bit hot, but the taste came through nicely. Cool little space. Very little seating.",,,
93,Zack W.,"Westerly, RI",354,6,1,5.0,1/6/2017,"Cold brew is rocket fuel. Come for the cold brew, stay for the homemade cookies. Please open up on weekends.",,,
94,Mariya E.,"Orange County, CA",20,109,14,5.0,10/28/2014,"My favorite coffee place in the FiDi. I was here on a business trip and made an almost daily trek to Blue Spoon Coffee for my morning pick me up. While there I also tried 3 other coffee places in the area, but this was hands down the best. They make a terrific cappuccino which never requires sugar. Milk was steamed to perfection and the coffee not a bit bitter or over roasted. The baristas and cashiers were pleasant and efficient. On a side note - I got that special honey lavender latte that others may have mentioned but I found it overly sweet. Stick to the traditional stuff and you won't be disappointed.",,,
95,Shelby J.,"Irvine, CA",33,3,14,4.0,12/17/2013,"Stumbled upon this place near my dorm room! I recommend the white chocolate mocha, it was to die for! I also got an oatmeal with brown sugar and walnuts which was also really delicious! The customer service was great, they were super friendly and I will definitely come back! Best oatmeal in FiDi!",1,1,1
96,Kate M.,"New York, NY",0,221,0,5.0,3/4/2015,"A hidden gem of the Financial District, for sure! I discovered this place because I frequented the nail place next door, and I'm so glad I did. Their staff is unbelievably friendly, especially for New York, and all of their food is incredibly fresh, healthy and tasty. My go-to was the caprese sandwich, and sometimes I treated myself to a cookie, and neither ever disappointed. I do wish they had more seating, though, so I could go there with friends instead of just picking up and bringing back to the office. I do not miss working in that area, but I do miss Blue Spoon! (I am sad I never tried their coffee, it always looked/smelled amazing.)",,,
97,Meryam B.,"New York, NY",366,337,12,5.0,5/16/2014,"I'm a fan of Intelligentsia coffee, so that alone earns this place three stars. The fourth is for good baristas that can make a creamy cup of latte using almond milk. It is however, on the pricey side.",,,
98,Katie K.,"San Francisco, CA",352,341,151,5.0,11/14/2013,"This is a great Coffee Shop. For so many reasons. Ready, Set, Go:1. Top notch bagels and pastries2. Hilarious Staff3. A super awesome ""This is a Window"" sign so you don't smack your face into a glass wall4. Rewards Program5. It's not a big box place, you see where your money goes6. It's called Blue Spoon7. Quick 8. Close to a ton of offices and subway stations9. Need to get to 1010. The prices aren't out of this worldIf you need a place to go for a quick bite for breakfast, a snack, or even lunch - Blue Spoon should be your go to. It has that hipster ""I'm buying coffee but I'm revolting from society by avoiding starbucks"" vibe which I dig.",1,,
99,Zuhra A.,"Financial District, Manhattan, NY",6,8,2,5.0,11/4/2014,I love this little place. Cookies and coffee were really good. I have to avoid it if not I'll buy all the cookies and croissants. Dominique Ansle almond croissants are great.,,,
100,Christopher C.,"Denver, CO",425,1544,295,4.0,3/20/2014,"I must say i'm not a fan of intelligentsia coffee, it's too light and acidic for me, but this place does have the best I have had. I have been wanting to come here for a while and i finally made it. The space is tiny and I probably should have got a treat but didn't. This place is a great alternative to starbucks.",,,
101,Angela C.,"New York, NY",0,4,1,1.0,9/9/2013,"BLUE SPOON SUPPORT PRICE GOUGINGI love intelligentsia coffee, but I am not a believer of charging $2 extra for adding milk in a larger cup. They refused to charge me for an iced espresso when I asked for them to put it into a larger cup (vs. the miniature cup used for just espresso shots) so i can add a little milk to it myself. They told me ""That is an iced latte"". Even Financier lets me do this. I give them a year.",1,1,
102,Leila G.,"Financial District, Manhattan, NY",459,298,60,5.0,8/27/2015,"Great coffee and great staff! Found this place on yelp because I wanted to check out more cafes in the area. They had a funny tip jar, which for some reason always gets me. I had a good conversation with the cashier about music. Overall very pleasant experience.",,,
