,er_name,er_location,er_freinds,er_reviews,er_photos,er_rating,er_date,er_text,er_useful,er_funny,er_cool
103,Samantha M.,"Westchester County, NY",55,39,9,4.0,5/15/2013,"With so many lunch options around my office, I tend to be overwhelmed by the choices rather than adventurous and find myself gravitating towards the same soup-and-salad joints. Blue Spoon could be grouped into this category, but this little cafe is certainly one of the best ones in the area.I went to the William St location after it was recommended to me by a coworker, and I am glad that I did. They have a wide selection of coffees and teas, and since the skies started dumping buckets of water down when I was about a block away, a hot drink was just what I needed. I had the Moroccan mint tea and it was just fantastic. It was hard to choose from all of the tasty lunch options on the menu but the pleasant guy behind the counter made some helpful suggestions and was patient while I stood around trying to decide. I got the goat cheese panini and was incredibly pleased with my decision. The bread was toasty and crunchy on the outside and chewy on the inside. The balsamic vinegar was perfectly proportioned over the cheese, roasted peppers, and basil (rather than drenched in it like I've found at many other restaurants) so the bread didn't get soggy.The atmosphere of Blue Spoon added to my reasons to return. It's corner location and walls of windows provide the perfect venue to people watch. It's also quiet and cozy, and since the the sidewalks were pretty empty during the downpour I appreciated the peaceful surroundings to hang out and read for a bit while I waited for the rain to let up. It was the perfect place to grab a quick bite, but I have a feeling the staff wouldn't mind if you stayed a bit longer. Now that the weather's warming up again I think I'll return and try one of their iced drink options.",2,,
104,Ingemann N.,"Manhattan, NY",13,146,19,4.0,1/2/2015,"Great tasting coffee and pastries from my two favorite bakeries downtown, Balthazar and Cici-Cela, so what can go wrong? Their cold-drip coffee is awesome in the summer time. However, they are on the expensive side (hence 4 instead of 5 stars) so get their 'frequent buyer' card, and don't count on getting a place to sit as this place is tiny and cramped. I do get a kick out of following their daily pool going on with the tip buckets.",2,,1
105,Hilary P.,"Brooklyn, NY",344,361,12,4.0,4/9/2013,"Their chai latte tasted a little weird (coworkers agreed) but the Intelligentsia coffee is spot on. They have some great sweet snacks (apparently from Balthazar, oooh). The staff manages to be both friendly and competent. It's a small spot, so get yours to go and be glad you escaped the line for Financier and the neverending wait for your incorrectly made drink with a hilariously inaccurate name on it at Starbucks. I predict a lot of cold brew iced coffees from here in my future.$5 credit card minimum!",1,,
106,Lauren R.,"Washington, DC",0,20,4,3.0,9/13/2016,"not my favorite soy latte, but might just be my taste. It tasted fairly weak to me.",,,
107,Mike S.,"Brooklyn, NY",0,15,0,5.0,8/14/2015,Coffee is great- cold brew is much better than that green place you usually go to- and the people working here are top notch,,,
108,Brittany P.,"New York, NY",137,86,2,5.0,7/15/2015,"Got a cappuccino here this morning.  Beautiful and delicious.  Pastries looked great, seating is limited and the only thing that would make this spot more attractive would be wifi.",,,
109,Shuchi M.,"New York, NY",32,80,19,4.0,10/1/2013,"Love love love this place. I am there everyday, literally.A small place full of regulars and curious newbies where the staff is pleasant as a warm autumn day. Ah, bliss. From a creamy warm latte to the gooey goodness of crisp panini and bagels, this place is my go-to for all meals in the FiDi. And the best part - they're darn good about customizations! Go once, and you'll go again. Promise.",,,
110,Carol H.,"Boerum Hill, NY",246,256,63,4.0,8/13/2013,"Only tried their coffee. Decent cup, but it was $2 for a small coffee.Place gets packed during lunch time. And there's only a narrow space with 3 tiny tables & a couple stools by the window.So be willing to stand in a cramped space while ordering & waiting for your order.",,,
111,Michael B.,"New York, NY",224,16,0,5.0,10/2/2015,"Their coffee is pretty great and they have a large selection of warm and cold beverages.  They also have awesome chocolate chip cookies which is nice.  Their breakfast bagels are also good and very filling.  Unfortunately, they don't have chicken or any kind of meat in their lunch sandwiches which is upsetting but I do recommend them and visit for morning coffee.",,,
112,Lisa D.,"Brooklyn, NY",770,623,1083,5.0,8/21/2012,"Illy coffee (served at four Financier and two Manon outposts) is no longer the only decent coffee brand name in Fidi, as Intelligentsia has arrived on the scene via the nicely appointed Blue Spoon. The prices here for smooth, strong, high quality Intelligentsia coffee and tea are also lower than at many competing shops, including those offering inferior product.  Neatly arrayed fresh pastries from Balthazar and Ceci-Cela are enticing in their display case, and gourmet lunch items are  also available. All sandwiches are served on crusty Balthazar Ciabatta bread, and the roasted turkey sandwich with mixed greens and plum tomato was very fresh and generous in size for the price. Service is very efficient--there is none of the line out the door business from the Cedar Street Financier or tomfoolery among baristas at other chains.",5,1,2
113,Beini S.,"Berkeley, CA",109,134,17,4.0,8/12/2013,"Intelligentsia coffee. Quick service. Docked a star because the lox on the bagel wasn't very fresh, but the bagel itself was perfection. Would come back, just don't get the lox bagel.",,,
114,Keyla G.,"Brooklyn, NY",0,37,39,4.0,6/8/2015,"Great ice coffee, awesome pastries. The girl at the country was nice too. The syrup sweetener tasted a little funny.",,,
115,Franklin B.,"Queens, NY",105,31,10,5.0,7/25/2012,"Freshly brewed Intelligentsia coffee and pastries shipped straight from Balthazar Bakery, all for very reasonable, non-hipster pricing. Friendly baristas who know their drinks and make the effort to create a genuine coffee-shop atmosphere (incl. free Wi-Fi).Now that Blue Spoon has joined the coffee lineup in FiDi, among the overbrewed Financiers and overpriced Starbucks, this is a clear win for the neighborhood. Early-bird prediction: In less than one month, this place will have lines out the door everyday from 8am to 10am and then again at 2pm for those who suffer from lunch comas. You've been warned, office drones and laptop-lugging members of Occupy, so get here ASAP.",5,2,2
116,Serena M.,"Brooklyn, NY",0,2,0,5.0,7/19/2016,"Blue Spoon brews some of the best coffee in the area, but this review is about the salads. ""THE SALADS?! FROM A COOL COFFEE SHOP IN THE FIDI!?"" Don't ask questions, guys. Just trust me. Their garden salad is 2-3 days worth of lunches and comes packed with hummus, fresh, leafy greens, chickpeas, red onion and other delectable veggie gems. If you're looking for a healthy, budget-friendly option for lunch in the FiDI, look no further my friends!",,,
117,Shing Yiing O.,"Manhattan, NY",384,624,603,5.0,7/31/2012,"YES!!! I am so glad that Blue Spoon is finally open at FIDI!!!! I have been waiting for quite some time.. Looking at their website saying that ""it's coming""!!! What I love?- near my place- near my working place- BEST COFFEE in FIDI- AWESOME COFFEE & BALTHAZAR PASTRIES!!!Dislike??- currently nothing.. Perhaps I hope that they have 12oz cappuccino instead of 8oz..I ordered cappuccino and an almond croissant.. TRUST ME.. Once you have cappuccino at Blue Spoon.. none of the coffee shop in FiDI can beats them.. YES... and they even have art in their coffee... YEAH!!!Oh no.. Time to say good bye to Starbucks and financier coffee..",3,,1
118,Kathy c.,"Manhattan, NY",6,76,24,4.0,5/19/2016,Honey lavender latte is a nice change up of drinks to my regular coffees/lattes.  It's a bit sweet but felt like a nice treat to the end of my day. Fast service and several seats make it a nice place to take a break in the area.,,,
119,Olivia L.,"Manhattan, NY",13,16,16,4.0,8/14/2012,"Finally, somewhere besides Starbucks, DD, and Financier for coffee near work.PROS: They have 2 counters, so their lines move quickly. They serve Intelligentsia coffee, Balthazar pastries, and H&H bagels. CONS: Going from the counter to the milk/sugar station, holding a cup of hot coffee without a cup lid or sleeve is a disaster waiting to happen.",2,,
120,Sonia V.,"Los Angeles, CA",16,178,10,4.0,8/22/2014,"Have lived here for the past year but never really noticed this place until I saw I had the Tribeca location bookmarked...now why would I go to Tribeca when I can just cross the street?  :-). Per reviews, got a honey lavender latte (decaf) and a cranberry Balthazar scone. The latte was delicious! You can taste the lavender and honey, very balanced. However the actual coffee flavor is weak. I took the scone home and toasted and buttered it (because duh) and it was good albeit a leeeetllleee too hard for my taste. But I can't wait to go back and get another latte! Would like to try the regular caffeinated one and see if that makes a difference.",1,1,1
121,Brian B.,"Brooklyn, NY",13,6,0,5.0,4/26/2015,"Perfect coffee, great friendly staff, and the most shazammed music playlist on Wall Street. Blue Horseshoe loves Anacott Steel.",,,
122,Amanda B.,"Manhattan, NY",163,3,0,1.0,7/14/2016,"I'm not typically one to write bad reviews, but this was too ridiculous not to. I came in here one afternoon, which I used to do at least once a week. This is the first time the tall boy with the pony tail rung me up. I was shocked how rude he was. He didn't want to give me the time to think about my lunch order and make sure it was what I wanted (constantly yelling ""next! NEXT!?"" and then when I got up to the register, I asked him his opinion on if the other sandwiches were better and he couldn't seem more uninterested if he tried. Might as well just close the store doors and put a sign up saying ""only come in if you already know what you want."" Ridiculous. Will never be coming back here.",,,
123,Ryan B.,"Brooklyn, New York, NY",2,11,0,2.0,4/14/2015,Pastries are great and service is friendly but the iced coffee is practically a joke. They serve Intelligentsia but it's nothing like what you get at an actually Intelligentsia shop. It's extremely weak/watery so you'd be better off going somewhere else in the neighborhood.,,,
124,K. C.,"New York, NY",4,34,4,3.0,6/1/2015,"This is a small coffee shop, but they do have some seating... just no wi-fi. The latte's are pretty good- and they do offer a few seasonal flavors like pumpkin spice, etc.",,,
125,Stasiak B.,"Manhattan, NY",4,24,1,5.0,8/1/2012,"YES also so glad they opened in FID!!!  I used to work around the corner from the Chambers location and then we moved south and Blue Spoon followed me!Can't say enough good things about this place, everything on the menu is good and I've ordered just about everything.  I usually go for a for a half sandwich and soup combo.  They use really good bread, everything tastes fresh and doesn't have a strange preservative aftertaste like most other soup/sandwich shops in NYC.   Soups rotate, ask for the chicken and rice soup, so good and sometimes not on the menu ; ).  The owner is incredibly nice and down to earth and at her business.  Same great friendly employees have been there for years, says a lot about a business if you ask me.I don't drink coffee, but everyone I bring there says it rocks.",1,1,
126,Helen L.,"Manhattan, NY",1,19,9,4.0,4/24/2015,"Fantastic latte & teas, esp lavender flavor. Probably one of the best places for coffee in FiDi area. The seating area is small, but most of the customers here grab & go, so I haven't had an issue w/ seating.",,,
127,Chels G.,"Manhattan, NY",78,86,46,3.0,2/21/2013,"Intelligentia coffee with soy milk: not bad, not great. Small place, normal priced.",,,
128,Joy C.,"Fort Worth, TX",20,79,289,5.0,8/14/2014,Best coffee in the Wall Street area. Especially the cold brew ice coffee! They use intelligentsia beans. Delicious! Way better than Starbucks on the other corner. Once you try really good coffee you can never go back. They even have a punch card so you get a free coffee after purchasing 10. I'm so glad they started to open on Saturdays. Now if only they were open on Sundays!,1,,
129,Tiana V.,"Manhattan, NY",1,17,0,1.0,5/14/2015,"It is with a heavy heart that I give a negative review to such a highly rated place. Based on the other reviews here, I'm sincerely hoping that my case is a very rare occasion. My mistake was ordering a salad from a coffee shop, because I got food poisoning. I know it was the salad by process of elimination. I hadn't eaten anything before it, and I started feeling ill shortly after eating it. Dear Blue Spoon, please, please, please be sure to properly wash, handle and store all of your salad ingredients. Please make sure you have trustworthy employees who will diligently follow food safety regulations. I am truly sorry to leave a negative review (see all my other reviews) but as a customer, I felt the need to inform my fellow customers.  Note: there is no restroom or wifi.",,,
130,Henry Y.,"New York, NY",374,758,1,3.0,3/25/2015,"The coffee is great. It's solid. We actually tried the lavender cappuccino and thought it was definitely interesting. What bothers me about this place is that they always seem to be out of food, as in pastries. Even at 1pm or so, their entire stock of food selection was gone, and that's just a little bit disappointing. If it sells out like this every day then uh... I suggest you guys restock more often.",,,
131,Katherine M.,"New York, NY",0,3,0,4.0,5/8/2016,Blue Spoon has become my favorite coffee spot. I used to get Starbucks everyday but I converted to Blue Spoon a few months ago. It's always fresh and hot. The scones are from Balthazar and I've become addicted. The only negatives are they're closed on Sunday and the service could be a bit friendlier.,,,
132,Rob S.,"Hoboken, NJ",1,39,4,5.0,8/1/2012,"They brew intelligentsia coffee....enough said.Great location a few minutes walk from my work. Great prices on Balthazar Bakery pastries. Panini are actually grilled until melted unlike many places around.Employees at both locations have been great. Coffee is one of the best around, this coming from a drip coffee snob with a french press and a pour over in my office for my coffee. They also sell their custom blend of intelligentsia which is great and no shipping charges like when I usually order beans from intelligentsia.Tip there is only one door. Over by the condiment bar, its a window not a door FYI",,,1
133,Maxim T.,"New York, NY",0,6,2,1.0,2/10/2015,"Sandwiches are good, not excellent though, at least they were. But taking into consideration the way they treat customers, especially for delivery - it is unthinkable! Very very bad! Shame! I used to order sandwiches from them, and got them delivered in the very recent past, and they suddenly changed their policy. I wonder why? I am just few blocks away. It is a bright example of declining quality of service in NYC! Sad! I guess guys became to fat...Sorry.",,,
134,Warren C.,"New York, NY",64,83,0,5.0,3/30/2014,Delicious chai latte and oatmeal. Nice place to grab a quick breakfast and eat at the window-side counter alone or with a friend. The pastries look delicious as well. Good neighborhood spot.,1,,
135,Chris H.,"Chicago, IL",52,220,7,4.0,3/13/2013,"This place survived Sandy, so that is a big win already. Pleasant and calm cafe in FiDi. Smallish space with a couple tables and bar seating. $2 for a regular small coffee. They also have sandwiches and paninis, etc. Apparently, they serve Balthazar pastries, but that has no significance for me.  I would go back.",,,
136,Jenny L.,"New York, NY",141,74,2,3.0,9/13/2014,My life was ruined when I asked for a toasted bagel and got a cold non toasted bagel in return.,,,
137,Tila R.,"New York, NY",1,6,0,4.0,2/18/2015,The staff here are awesome! Place is comfy and everything is delicious.  The coffee is a bit pricey but so good it's worth it. Live the lattes !,,,
138,Spencer S.,"Beacon, NY",96,19,0,5.0,8/28/2012,"YEAH. Thank you to this place for finally freeing me from the oppressive, disgusting, industrial coffee of the chain across the street when I go away from the desk for coffee (and from the equally gross K-Cup machine in my office...).In my heart, having lived out in PDX for a bit, I'm always a little weirdly slighted when a place chooses to serve Intelligentsia over Stumptown, but you know what? It's still awesome coffee, and it's SO much better than the other options around here.The pastries are all awesome, and I highly suggest going for the everything bagel with tomato and cream cheese in the morning (toasted, of course).Oh, and their tip jars are awesome/brilliant.",,,
139,brb b.,"Brooklyn, NY",0,154,0,3.0,10/2/2015,"Something is up with this place.  I ordered the panini version of a ham sandwich, which is about 50 cents more than the regular version, but when I got back to my office the sandwich was cold.  It wasn't bad but also didn't stand out for me.",,,
140,Misti G.,"Manhattan, NY",7,53,53,4.0,9/11/2014,Great house blend.  Almost fruity. Great little shop! They also have Guatemalan coffee slow drip!!!! A must try.,,,
141,Allie C.,"New York, NY",7,22,1,5.0,7/3/2014,"Nice staff. Good coffee. Love their oatmeal but they always run out too early. I have tried almost all of their panini and sandwiches, every single one of them is delicious. I especially like the Black Forest ham panini and the turkey pesto panini. They get busy around lunch time but you can call in to make your order in advance. I like their half panini and soup combo, and their homemade chocolate chip cookies.",,,
142,FoodLover Z.,"Chicago, IL",0,162,0,4.0,4/1/2015,"Blue Spoon does have good coffee, which might be the best in FiDi. But it's certainly not the best in NYC, not even close. Four stars for friendly people and good vibe, even though the coffee was just about OK.",1,,
143,Aleksandra C.,"Woodbridge Township, NJ",13,56,13,5.0,5/1/2014,Awesome coffee shop. Tried the goat cheese panini and it was delicious. Bread was great and had the perfect crunch. Balsamic dressing and red onions were a nice touch. No stinky onion breath since they are pickled (it seemed). Worth a visit!,,,
144,Jimmy I.,"Brooklyn, NY",3,124,0,4.0,"8/4/2015
            





Updated review",Downgrading a star for the often cramped space. Still a strong place to grab a well-made espresso / latte etc. in the Financial District.,,,
145,Anna W.,"Brooklyn, NY",47,143,4,5.0,11/22/2013,"Love this place! It makes me want to take the C train even though it's a further walk to work just so I can stop here and get that delicious Intelligentsia coffee and Balthazar almond croissant, from the attractive and charming young hipsters. There are tons of coffee options in the area, but this one definitely stands out and seems the most out of place for the financial district. And the coffee absolutely makes my morning.",,,
146,Adria C.,"New York, NY",72,221,33,4.0,12/6/2013,"This shop is cuter than the location on Chambers, but just as small. I think the baristas are kinda rude, but they make a mean mocha.  As for other bites, their baked goods are fine...and they even offer hot (not instant) oatmeal in the mornings.",,,
147,Nicholas C.,"New York, NY",0,23,0,4.0,9/5/2014,I've been here a few times. The staff is friendly. The chocolate chip cookies are the best coffee shop snacks around. The coffee is very good though today's tasted a bit burnt so they don't get that 5th star that might have been theirs.,,,
148,Jane R.,"Brooklyn, NY",749,559,71,5.0,"10/11/2012
            





Updated review",Now I've had their bagels and cream cheese. Not as large as other straight up bagel places but still delicious. I got a bagel toasted with cream cheese and a medium coffee this morning for $4.95. Yum.  I've had their roast beef sandwich for lunch as well - lots of beef and cheese and lots fresh veggies. Great place for great coffee and great food - wish it was closer to my office.,4,3,4
149,Alex E.,"New York, NY",56,106,6,4.0,8/5/2013,Really really tastey drip coffee and bagels -- I dont get anything else here so there's not much more to say.. Counter service is friendly and quick. Price is A-OK. Wish it was comfier to sit and sip but for a small place in a crowded area that's pretty understandable,,,
150,Jeanette L.,"Manhattan, NY",13,258,19,4.0,7/25/2013,"Awesome almond croissant. Also good chocolate and plain, too.",,,
151,Nicole F.,"New York, NY",352,246,17,5.0,6/4/2013,It always confuses me when coffee shops try to bake their own goods for the sake of saying they're homemade. I say let the experts do their thing and focus on the coffee! Such is the case at Blue Spoon Cafe. They have croissants from Ceci Cela (voted NYC's best croissant) and other baked goods from Balthazar. The coffee is wonderful - I had a cortado and the friendly barista put a heart design in it. Get the coffee card - 10 drinks gets you a free one.,,,
152,Philip P.,"JACKSON HTS, NY",4,14,0,5.0,1/3/2013,"I've been going to Blue Spoon since the first shop opened on Chambers...I had been looking for good soup in the Financial District or City Center for months, with no luck.  Every place served bland watered down junk or saltwater with food coloring. This place has the goods. Amazing soups, hearty and tasty. The vibe is also very nice, cozy and friendly. Go.",1,,
153,Jennifer J.,"San Francisco, CA",426,204,161,5.0,1/13/2013,"Kinda pricey, $4.50 for coffee. But once you go blue spoon, you won't go back",,,1
154,Nitza V.,"Miami, FL",1,2,0,5.0,1/21/2014,"Love this place. Service is wonderful, sandwiches are some of the best and the coffee what can I say...the best coffee anywhere. Wish they had a location in Miami  I would never look at Sbux again",,,
155,Kathleen H.,"Financial District, Manhattan, NY",44,377,12,5.0,3/14/2013,"Excellent coffee, rapid service, minimal time between ordering, paying, and sipping your well-made Intelligentsia espresso/cortado/cappuccino. I'm definitely a fan of this place!",,,
156,Victoria M.,"Los Angeles, CA",3,18,2,5.0,6/14/2013,"Grabbed a cortado and a mozarella panini. The panini was bomb - great bread (Balthazar bakery), fresh basil, loaded with tons of cheese! Cortado was great! If I'm paying four bucks for coffee, I better get some foam art and Blue Spoon delivers!",,,
157,Geraldine K.,"New York, NY",162,483,0,4.0,12/7/2012,"Great alternative to the Financier cafes that dominate nearby.  It's small and cozy, but still good for conversation.  Friendly service.",,,
158,Aislinn L.,"Elmhurst, NY",28,20,1,4.0,5/20/2013,"It's about a 15 minute walk from my office to Blue Spoon but I'll make it about once a week because their iced lattes are so damn delicious. My co-worker got me hooked on their sandwiches - my go to is now a fresh basil, mozzarella and tomato panini with chipotle mayo. Staff is friendly and knowledgeable!",,,
159,Karin A.,"Vienna, Austria",39,235,28,2.0,11/8/2012,"Na, sorry that I have to give this place only 2 stars,... Its a very nice though very small place and the sandwiches look and smell great, haven't had one so can't say if they are any good. We only had coffee and a hot chocolate,... Both of whoch were,... Well, I put it politley, not good, I had 2 sips and threw itaway, it was soooooo sweet and tasted sooooo artificial,... :( guess us Austrians are spoilt when it comes to coffee,...",,,
160,Tom J.,"New York, NY",0,8,0,5.0,6/11/2013,"If you are serious about your espresso based drinks then this is the best place downtown, it's really one of three good places . They brew intelligentsia, make good coffee, the people are friendly and they play good music. It feels like it belongs in a cooler part of the city and so it is something of an oasis in the financial district. Highly recommended for proper coffee (not giant corporate brands)",,,
161,Ben H.,"Mount Vernon, NY",58,42,2,2.0,6/28/2013,"Terrible coffee made from great beans.This has all of the signatures of a great coffee shop. Intelligentsia, La Marzocco machine, pour overs, cold brew. Unfortunately it fails on all fronts. The pourouver was served almost cold and the cortado was bitter and served with tepid tap water in a warm gibraltar. Still have to walk all the way to Kaffe 1668 for a decent cup of coffee. The financial district doesn't seem important enough to open anything good. Stay clear of this place",,,
162,Ron P.,"Manhattan, NY",42,51,2,4.0,1/17/2013,"Great coffee, served just like it should be!",,,
163,Marina I.,"Rockville, MD",0,20,1,5.0,10/27/2014,"AMAZING coffee!  It was so good, upon finishing my latte, I got another one.  I never do that!  I rarely rave about a coffee shop but this was too good!",,,
164,BillC C.,"Monmouth County, NJ",0,84,0,5.0,"5/14/2014
            





Updated review","Been there a bunch of times so far, and it's very consistently awesome. Upping the stars, what a great find!!!!",,,
