,er_name,er_location,er_freinds,er_reviews,er_photos,er_rating,er_date,er_text,er_useful,er_funny,er_cool
0,Ronni S.,"Whitehouse Station, NJ",0,82,19,5.0,10/16/2018,"This is a great wine bar (with a few beers). Nice ambience and Patrick, the bartender, was excellent. He gave us some good recommendations on wines to try. Overall, I'd highly recommend checking out this place with friends or a date.",,,
1,Caroline H.,"Manhattan, NY",181,153,145,4.0,12/5/2017,I like the vibe here - and the wine!  The bartender recommended a great chardonnay.  Seems like a good date spot.  I wish I'd discovered Vanguard sooner!,,,
2,Zehra M.,"New York, NY",138,98,157,4.0,4/8/2018,Incredibly classy wine bar on the UWS. My friends and I were looking for a place for a drink after seeing a ballet performance at the Lincoln Center - this place was perfect. We got a bottle of wine with some tartines and they were delicious.,,,
3,Miranda L.,"New York, NY",26,2,0,5.0,10/2/2018,I have lived in the area for the last few years and have regularly come to the bar and brought numerous coworkers and friends for drinks. I work at Lincoln Center and have often referred friends and patrons to this location. It is so nice to see the same faces behind the bar from week to week! I know that regardless of when I drop by I will have a warm and knowledgeable person to interact with and send me in the right direction in regard to wine selections. I am thrilled to have this spot in the neighborhood. Isabel and Jim are total highlights!! Isabel always knows what to suggest that I will absolutely love.,,,
4,Jonathan A.,"New York, NY",0,34,5,4.0,8/19/2018,I love this little gem. Decent wine selection. Great finger foods. Quiet atmosphere. Good service.,,,
5,Jin C.,"New York, NY",37,1049,242,3.0,1/21/2017,"I like this wine bar. It's classy, quiet, and chill for a date or for classy friends hanging out. You can sit at the bar, at tables, on cushiony booth type seats. I also really enjoyed the combo meat and cheese plate; there are two small loaves of warm baguette and about four different kinds of cheeses (Parmesan, Brie, blue, and maybe Roquefort?) and about six different kinds of meats with mustard and apricot jelly.I will give you a warning though: if you sit at the bar and the seductive blonde bartender offers you olives oh-so-casually, know that they aren't complimentary - they set you back a cool $7 - and I don't even like olives. I hate them. So yeah. Don't get scammed like I did.",1,2,
6,Alex A.,"New York, NY",2,20,0,1.0,7/12/2018,"I wish this was a better wine bar...this neighborhood can definitely use one. They do carry a nice Sanserre but unfortunately their food sucks. The pita chips are greasy, thick and too salty. The hummus looks as if it wasn't blended enough and someone forgot to use spices. The flatbreads are tiny squares of saltine crackers (maybe a little thicker) with shredded cheese on it. It crumbled when I bit into it. Did I mention they don't have table service? So if you want to order your food or a drink you have to leave your table and go to the bar which I wouldn't mind if the bartenders had better attitudes. If your thinking of going here, don't.",,,
7,Tara S.,"Astoria, Queens, NY",62,303,270,4.0,5/3/2017,"Located a few blocks from my workplace. My volunteer group had chosen this as our meeting location. I was skeptical but happy due to the distance to my workplace lol. The staff were friendly. It's it a wine bar. Cheese and wine - don't expect much more. For what they do they are a solid choice. The one bathroom alone impressed me with the decor. Great selection of wine with different price ranges. I saw a happy hour sign for $30 bottles(not sure which ones). Solid, chic and chill wine spot.",1,,
8,Tom M.,"New York, NY",13,53,15,4.0,7/25/2017,I really like so much about this place.Very good wine and always a few good happy hour specials including entire bottles of wine.Excellent little tartines and toasts as well. The quality is definitely a step up.Also very nice décor and very cool how they always have classic old movies playing.Well done!,,,
9,Logan J.,"Boston, MA",156,313,424,5.0,3/20/2015,"This place is an amazing hidden gem.  I came here one night with a friend after we exhausted the area looking for a place to grab a glass of wine.  There are tons of other local spots to grab a glass of wine, but we wanted to go somewhere that wasn't too loud to catch up.  Neither of us had been to this place, but based on reviews, we thought it sounded like what we were looking for, and we were so happy we tried it!The space is perfectly arranged with a large wraparound bar in the middle, small tables when you walk in, and larger tables off to both sides of the bar.  They have added a lot of cool touches to the space and decor to add to atmosphere like vintage posters on the walls.  Unlike some other places in the area, it didn't seem pretentious at all; it was a great casual place to meet a friend.We ended up getting a few small plates and glasses of wine.  The small plates are a perfect size for a snack, and the prices for wine were reasonable (most were $11-13).  We were completely happy with our decision to come here and will hopefully be making it a regular spot to return to!",2,,
10,Nick G.,"South Pointe, FL",111,21,2,4.0,10/1/2017,Guys please update the hours. On Sundays they work only until midnight. Not until 2.00am as it's said on here.,,,
11,Ashley A.,"Brooklyn, Brooklyn, NY",0,24,0,4.0,4/29/2018,Nice and usually quiet wine bar. They have a good selection of wines and few small plate food options-would highly recommend the goat cheese flatbread. My only complaint is that you have to get up and order at the bar. But overall it's a very cute place and I will definitely be coming back!,,,
12,Taylor G.,"New York, NY",299,106,37,2.0,12/21/2016,"I went here with high expectations on a chilly night, and though the wine selection was great, I found service to be slow, and our waitress/bartender were rude. Not going to be coming back any time soon, which is a shame since I would love to find a good spot near Lincoln Center...",,,
13,Leslie C.,"Aptos, CA",51,26,0,5.0,5/15/2017,"Comfortable, low-key and friendly wine bar! Sat and chatted at the bar; bartender Maarine had some terrific wine recommendations and we will definitely come back when next in the neighborhood!",1,,
14,Emily F.,"San Francisco, CA",198,64,15,5.0,12/9/2014,"An ideal date spot with a unique menu and wonderful service. I came here for a date on a Friday night and the place was far emptier than I expected. The vibe is intimate, but more laid back than other wine bars I have been to in the city (a good thing). You order at the bar and the bartender brought our bottle to us and made several great recommendations in terms of what we should drink next and which food items would work best for the two of us to share. We are looking forward to coming back!",2,,
15,Denise F.,"Los Angeles, CA",76,123,17,3.0,11/15/2015,"Fun decor and perfect layout for groups, dates or just dinner.  The space has a long bar and moderately priced cocktails for the area. Unfortunately during my last visit we had an incredibly grumpy bartendar, but! Dont let that deter you from this great neughborhood bar.",2,,
16,Alexa S.,"New York, NY",738,187,194,5.0,12/2/2015,"I went to Vanguard Wine Bar one night with a friend and loved it! It's a cute little spot that's kind of hidden. I had passed it many times until I finally decided that I wanted to try it out. I went on a rainy Saturday night and it was a little busier than I thought it would be. The bartender was really sweet and helped me and my friend pick out the right wine. I ended up going with the Barrymore, to my surprise this wine is actually made by Drew Barrymore and it was quite delicious. We didn't try any of the appetizers, but they looked great! As soon as I walked in, I immediately thought this would be the perfect date spot. it's cute and cozy and a great atmosphere to have a great conversation! Looking forward to visiting again.",1,1,
17,Dave F.,"Hoboken, NJ",417,624,1367,4.0,5/19/2013,"On the TV above the bar they had Midnight in Paris playing. So fitting... When you walk into the bar you feel like you are transported back to the 1940's in Paris from the music to the subway tiles on the wall. It is both romantic and lively, in a mature sort of way that doesn't exist anywhere else in Gramercy. They have a nice wine selection with glasses around $10 and bottles in the $40 range. If you need a great post date spot for a drink and are tying to impress your date, come here.",,,
18,Elle D.,"Manhattan, NY",84,130,23,4.0,3/31/2014,"Met up with an old friend here and had a wonderful time! The noise level is reasonable for having a conversation, and there are plenty tables and bar seating to accommodate its mid-week crowd.  The bar tender was very knowledgeable and friendly. She made several great suggestions. I just wish they had a happy hour so I could try more of their wines! The meat and cheese platter was also delicious, with a nice selection of cheeses. I would absolutely recommend this place for a casual get together or a first-date!",1,,
19,Ali C.,"New York, NY",91,414,2,4.0,4/2/2015,"Cool spot in an area I wouldn't necessarily consider ""cool."" It's in no man's area of Murray Hill (meaning 30th and 2nd). It kind of popped up out of nowhere on the street!  I was meeting someone at 7 and usually, wine bars attract a pretty big crowd by then. To my surprise, there were ample tables and even a few bar seats left! A few glasses of wine later, we were chatting it up with Isabelle the bartender who was AWESOME. The crowd was an older crowd, older meaning near 30 and over which is a-ok with me. My one complaint would probably be the food. It's not really event a complaint. It was good, not great. I got the mushroom, ricotta and truffle flatbread. It was SUPER small and the flatbread was more like a cracker. Either way, I'd absolutely be back!",2,,1
20,Christine L.,"West Palm Beach, FL",447,584,714,5.0,10/25/2013,"I've walked past this place a million times because I live right next door - and although I've peeked into the window a bunch, the inside is not what I expected from looking in from the outside.  It's very intimate inside and has a neighborhood feel.  Great bar seating and also high tops that are like little coves with pillows.  It was a perfect date spot for me.  When they're not busy the bartender will come around to the tables, but for the most part you order up front at the bar (both drinks and food).  I'd come here again - likely when they are serving their $30 bottles.",1,,
21,Tara S.,"Providence, RI",0,13,0,5.0,1/21/2017,"This wine bar is the best kept secret in murray hill! Great wine and small plates and the atmosphere is awesome, felt like I could be in Paris...can't wait to come back!",1,,1
22,Michael O.,"Manhattan, NY",199,13,8,5.0,5/24/2016,Best first date/date spot in nyc. Big bar to sit at incase you don't like the awkwardness of sitting at a table(although they have that too) oldies playing on the tv (but my type of oldies like casino or goodfellas)and light classic jazz music in the background. Not much more you can ask for. The apps are pretty damn good too.,1,,
23,E V.,"San Dimas, CA",0,20,5,5.0,9/24/2016,"Visiting New York from California. Stopped into Vanguard for some wine. Great ambiance and great wine. Kurt was behind the bar pouring the wine .. He knows his stuff and he was great .  They have small plates to go with your wine . The hummus and charcuterie plates are perfect pairing with the wines. Great wine selection, great atmosphere and great service. We will be back next time we visit New York and hope Kurt is behind the bar!",,,
24,Leilani L.,"New York, NY",24,88,38,4.0,2/15/2015,"The only reason why I took off a star is because there is no happy hour. I love the decor with the subway tiles, the brick walls, the pretty chandeliers etc. There's a great wine list, good seating, and friendly bartenders. Now, if only they had a happy hour...",1,,1
25,Julia V.,"Manhattan, NY",356,143,74,4.0,1/5/2015,"I haven't tried the food here, but the wine list is amazing. It has great varieties of everything from bubbly to red, and I was personally surprised of their variety of Old World wines (especially the GSM blend, which I highly recommend.) The ambience is dim lit and romantic, with vintage posters all over the walls and an old movie playing in the background. I especially love it as a stopover after a movie in the movie theatre next door.The bartender there is also very friendly, letting us sample wines that we have never tried before. Glasses range from $10 to $17, so it can be pricey. However, it is a very non-pretentious and enjoyable post-date location overall.",1,,1
26,Andrew B.,"New York, NY",2,66,3,5.0,11/10/2015,"The Vanguard wine bar is a place you go to explore quality wines at reasonable prices.  The head bartender, Isabel, is knowledgeable about everything they have and can match a wine to your palette just by asking a few questions.  Other wine bars tend towards popular labels, often serving unbalanced, highly acidic, or immature wines.  Vanguard, on the other hand, has a robust selection of French and American wines that range from the familiar (California Merlot) to the bold (Bordeaux Medoc) the pleasantly surprising (Upstate NY Riesling).  The menu also offers a nice selection of flatbreads, salads, and other snack which you can enjoy with whatever wine Isabel picks out for you.",2,,
27,Chelsea C.,"Manhattan, NY",357,14,0,5.0,8/24/2016,"Jason is probably the best bartender of all time. Lovely man. Incredibly knowledgeable, knows everyone in the industry! My boyfriend and I had the most fantastic time learning about wine and the restaurant world. We saw him the next day and met up at Root and Bone!! He bought us biscuits!! Such a lovely and wonderful man. We will certainly be coming back to see Jason!!",,,
28,Flo K.,"Downtown Ann Arbor, Detroit, MI",1,6,0,5.0,7/6/2015,"I love this wine bar. Definitely the best place to have aperitif in the neighborhood. Never overcrowded, lovely ambiance with old movies playing on the tv, a fantastic wine selection and knowledgeable staff. I'm still dreaming of the $10 Pinot blanc from Alsace! I'd love it even more if they had outdoor space! Get on it, y'all!",1,,
29,Cyrus P.,"New York, NY",841,876,530,3.0,1/21/2013,"Someone else said on one of their reviews here: ""Wine bar for beginners"", and I think I would have to agree some. Let me start off with my rating.  I gave Vanguard Wine Bar 3 stars when I could have easily given them 2 and I would like to have given them 5. Firstly, this place is beautifully made.  The ambiance is as top notch, if not better, than any of the other wine bars in the city.  The decor, the marble counter, the symmetry everywhere, and the touches of retro and classic feels everywhere.  The fact that they were playing black and white films on the center screen behind the bar also added a major plus, and the music selections are on point, which means that they were carefully curated for the ambiance.  The speakers are well placed and almost hidden so you can't see them, which I love.  Almost all the fine details of the physical and sonic aesthetics of Vanguard were very well handled. Now we get to the cons.  The wine selections seem to have no real meaning.  It's almost as if they chose some of whatever list the distributor gave them.  The price points are a little high for the area and for the actual wine selections.  The food being cooked sometimes lets off unpleasant aromas into the entire place which can be a real turn off.  The bartenders, as my lady friend mentioned, did not fit the look and feel of the place.  Vanguard could be great, it could be chic and fashionably, and it could easily be ""Thee Winebar"" to go to in NYC, but it falls short on some of the very details that matter the most.  Overall, it's a beautiful place to check out, the lighting is perfect, the music soooo good, and the vibe is nice, so give it a try for sure.  I was pleasantly surprised to see such a place in this neighborhood.",3,,
30,Grant C.,"New York, NY",94,451,206,3.0,1/6/2013,"Nice looking place, and nice guys working here, but I felt like it is kind of a wine bar for beginners. If you don't know much about wine the menu is arranged into categories, something like ""big and bold"" or ""fruity."" I tried a few of the reds and wasn't too impressed with any of them; did better with the whites. Still, a nice addition to this sad stretch of dive bars. I'll be back to see how it comes along.P.S.: Sad to see the number of shill reviews that have posted since my visit here.",3,,
31,Laurent B.,"Upper West Side, Manhattan, NY",2,7,1,1.0,11/21/2014,"Why treating customers like shit as if they are responsible for wanting to leave after waiting 1 hour for a cheese plate!?I have come to this place a couple of time. Usually it's fine, not wonderful but ok and close to my place. Tonight I came after having a cocktail in another bar. I wanted some wine and food (it was 8:30pm). We arrived, seated on our own and ordered a glass of wine, a cheese plate and a flat bread.we waited an hour drinking our wine but as you can imagine after an hour, we were hungry! We were sitting in front of the cook so we knew what he was doing. Didn't know when our order would even start I asked the waitress that seems to be the owner the check saying its been too long. She was pissed even though the cook had not even start our food (and we knew it) and left the check without saying a word. ""Sorry we were busy"" would have been enough (we saw the poor cook on its own doing his best but when its crowded it's crowded...). No she just considered us as shit because I asked the check for what we got served AND they hadn't even started the food for us... And btw, a cheese plate do not take that long to prepare...I came a few time before and of course the owner wasn't the very best welcomer but damn, are customer just nothing that you don't even apologies when things go wrong because of you!?!Food looked good but never tasted. Cheese plate pricey for what they serve. Wine ok but expensive for what it is.Avoid this place and her, that's probably for the best!",3,,
32,Christine S.,"Manhattan, NY",46,165,2,4.0,3/28/2013,"Some people on here have called this a wine bar for beginners, but really, who cares.   Wine snobs can go flock somewhere else if you don't like it. Leave it for the rest of us who just want to enjoy some good wine with some good company. I've been to Vanguard 3 times, and with each time, I like it even more. It's quaint with a warm interior filled with vintage decorations and they even play old movies on a screen behind the bar. And don't even get me started on the bathroom. Probably the NICEST bar bathroom I've ever been in. Don't believe me? Give it a go. They have a decent amount of wines and some small plates, too. I've heard the food is fantastic, but I can't vouch for it personally because I haven't tried it yet. I do, however, like the wine. And from the looks of it, everyone else in the place likes the wine, too.The staff is really helpful and extremely nice. They even dress the ""vintage"" part. Really seals the deal on the time era they are trying to go for. The prices are pretty average as far as glasses of wine go in the city.I'll definitely be coming back here soon for an after-work drink..or three.",1,,1
33,Alexandra M.,"Manhattan, NY",172,99,61,4.0,3/2/2015,Great for a date night. The only problem is that the place is a little small but that's also part of it's charm.,1,,
34,R L.,"New York, NY",154,459,19,4.0,5/20/2013,"Not bad.  Went with my girlfriends before a movie one evening....they were doing $30 bottles of wine, so we got a sparkling Rose and enjoyed at the front table.  The wine was GREAT.  The decor and the ambiance so very European and old school, it was just perfect.  My type of place.  I cannot give it five stars because the help was SLOW and I mean SLOW.  They just didn't move and we were grabbing a quick drink before the movie, so we needed service to be a little speedy.  Also, the glasses were dirty also.... :( To get $30 bottles in a cute place...with great ambiance is totally worth it.",1,,
35,Amit K.,"Clifton, NJ",2,736,0,4.0,9/4/2013,A wine bar with some food. Reminds you of France. The place isn't that big but good date place. Very friendly bartender who will help you choose your wine.,,,
36,Will W.,"Manhattan, NY",221,13,0,5.0,1/25/2015,"I love finding the smaller bars that I have a quiet and sophisticated theme to them. This bar is one of those. The ambiance is not too loud, but not so quiet that you have to speak in whispered voices. The wine menu is designed for the casual drinker (separated by how it sits in the mouth rather than type), but a great variety to keep an experienced drinker entertained. The little bites are perfect; don't expect to fill up on the food here.Great date spot, and a great place to go when you don't expect to be out drinking too late.",1,,
37,Thanh T.,"San Diego, CA",661,242,375,5.0,7/11/2013,Came here on my last night in NY! Antonnio was amazing! He was so nice and helpful! My friend and I are kind of wine noobs. And he was really great about helping us find a nice wine to try! Definitely made my last night even better! Loved the vibe of the place and met some really nice people! It's definitely a nice chill place to come unwind and relax. Also that meat and cheese platter was delicious...but that might have been the wine talking  :),,,
38,Rita M.,"New York, NY",3,47,1,5.0,5/11/2013,"My favorite place in the area to relax and unwind after a day's work, or just on the weekend when I feel like grabbing a drink with someone near my place and catching up. Beautiful, beautiful interior (even the bathroom is gorgeous -- how many bars can say that?!) and solid wine and food, every time. Unlike some of the other reviews, I happen to think the wine selection here is interesting and sophisticated, and at a decent price. Now, I wouldn't call myself a snob or a connoisseur (I might hate myself if I did), but I've tried some really good stuff here, and have never been disappointed by the selections or suggestions by the staff. Even though this is a wine bar though, I think I come just as much for the food. The tartines they have are SO good, and not expensive for what you get. Try the white bean and kale one.... oh man I wish I had some of that right now. The charcuterie and cheese plate is expensive, but worth it if you're in the mood to splurge. It's sinful. Best bar in the area, in my opinion. Oh, and the music is also amazing. Perfect for a date or low-key evening with anyone.",,1,
39,rebecca d.,"New York, NY",22,96,0,4.0,9/23/2014,"I really like the Vanguard, having visited a few times.  To echo others, it has a welcome, intimate and relaxed atmosphere, and the bartenders are very friendly and lack any pretentious.  The owner is a doll.  It's a gem of a wine bar in a location that generally lacks this type of joint.",1,,
40,Maxine G.,"Manhattan, NY",0,5,0,4.0,3/19/2016,Went last night with a girlfriend after a disappointing experience at another enoteca. The wine list is great and the atmosphere very casual and low key for a Friday night. I'm sold!,,,
41,Danni L.,"Brooklyn, NY",52,47,1,4.0,12/21/2014,"Saturday night, slightly tipsy, walked into this bar before movie. It was not too crowded or too empty, the lights are dim and the conversation just the right volume. Ordered a bottle of Syrah, caviar trio, and cheese plate. Now we are half drunk. The TV was playing Amelie, which is my favorite movie. The caviar trio was much smaller than I expected, but the cheese plate was good portioned. None of the foods were too advanced, just basic and ok. What made me like this place is not the food, but the just right atmosphere, the friendly bartenders, and the nice wine. They don't have too extensive a collection on wine, but got most of the basics and I agree it is more of a beginner wine bar. Will I come back? Maybe. If I happen to be in the area and want to stay in somewhere pleasant and quiet.",,,
42,Andrea M.,"Manhattan, NY",0,2,0,1.0,8/8/2014,"Very small selection of mediocre, overpriced wines. It's actually laughable to call this place a wine bar - more suitable to liken it to a hotel minibar.",,1,
43,Sara W.,"Murray Hill, Manhattan, NY",101,187,14,5.0,4/7/2014,"This place is charming, intimate and not pretentious which can often happen at an NYC wine bar.  The bar tender is friendly and helpful in guiding you to select a wine.  He'll give you tastes until you find your perfect glass!  I've never had a probably finding a seat and it's not too loud or crowded.  No drink specials, but it's not too expensive--they also have kir royales for $10 which I'm a big fan of!",1,,
44,Junot F.,"New York, NY",265,167,22,5.0,3/25/2013,"Went to Vanguard for a quick snack and a glass of wine before going to the movies last night.  Food, ambiance and service were top notch.  We just had the meat and cheese platter, which was delicious, but also saw what some others had ordered and looked great.  The wine selection is nice too.   The service was great.  Very warm and friendly gentleman behind the bar.  Definitely will be our new pre-theater spot.  Can't wait to go back!",3,1,1
45,Hannah B.,"Brooklyn, NY",24,34,16,5.0,3/8/2013,"Wonderful winebar with great wines and delightful atmosphere. Lovely low lighting, unobstrusive music, lots of seating. Perfect date spot or to meet up with girlfriends.",2,,1
