,er_name,er_location,er_freinds,er_reviews,er_photos,er_rating,er_date,er_text,er_useful,er_funny,er_cool
46,Cheryl h.,"Manhattan, NY",7,1,0,4.0,1/19/2013,"I've had two great experiences here both on weekend nights, sitting in the only open seat at the counter.I was first brought there by a friend, and I thought... really? a wine bar in that neighborhood? I was more than pleasantly surprised. The staff was super welcoming, and introduced themselves by name and were attentive throughout. We asks lots of questions and I was pleased with their recommendations.The food is quite good as well. Try the white bean hummus. Surprisingly delicious for hummus! They also have some nice flat bread 'pizzas' -- ingredients all fresh and a nice light pairing with a glass of wine. I'm definitely putting it on my rotation. I'm looking forward to hitting it up on a weekday night, bringing some work colleagues and seeing what the after work vibe is like.",2,,
47,Hudson C.,"Manhattan, NY",33,41,0,5.0,11/15/2013,Needed a mellow post-movie spot in unfamiliar neighborhood and this place didn't disappoint. Kyle behind the bar made the night a lot of fun and facilitated a great buzz. Will definitely be back again,,,
48,Emily L.,"Manhattan, NY",8,45,0,4.0,9/29/2013,"We stopped here for a glass of wine about 30 mins before our scheduled movie at AMC. I loved the atmosphere - the lightning, music, rustic looking tables.  This would be a great date night spot.It would be nice to have a wine at the $9 price point - all of the glasses were $10+. Also, my boyfriend had a lot of sediment in the bottom of his glass because the bartender finished off a bottle she was using.  We would have said something but were late for our movie. All in all, I would definitely come back!",,,
49,Milena T.,"Manhattan, NY",6,22,0,4.0,8/3/2013,"Went here for the first time last week after work - very nice place, cozy interior, clean bathroom. Had two glasses of white wine and one rose - 4 stars since i think they are a little bit pricey and also no selection of rose wines, only one choice in fact. But overall a great place and would definitely come back.",,,
50,Seth T.,"Financial District, Manhattan, NY",47,65,4,3.0,7/19/2013,"I've been eager to check this place out since it opened months ago.  Very small staff consisting of the owner (it looked like) and 1 chef behind the counter.  You have to order everything at the bar and bring it back to your table.   The place was decently crowded and had a great atmosphere when I arrived at 9 PM.  Drinks were the average price for a glass of wine.  It happened to be one of the hottest days of the summer, but all things considered it definitely could have been cooler inside.  I will definitely go back though to try the food.  I wouldn't travel far to go here, but if you live in the neighborhood definitely worth trying.",,,
51,Brendan C.,"Manhattan, NY",0,1,0,4.0,1/18/2013,"Great new addition to the neighborhood!Food:  Small plates- I had the hummus and a couple of the tartines.  I thought all were very good and pretty cheap (all three under $10)Wine:  Nice selection, reasonable bottle prices.  The pour was definitely a little light when we ordered by the glass though so stick to wine by the bottle.Overall a really nice spot.  Good ambiance, friendly staff.  I will definitely be back",1,,
52,Josh S.,"Manhattan, NY",0,4,0,5.0,10/5/2013,"Great atmosphere, cool decor. Close to the Kips Bay AMC movie theater. Perfect for a date. Very romantical. If you happen to be in the area this wine bar is the one to go to. Feels like your in West Village.",,,
53,Mikka S.,"Millburn, NJ",0,14,0,5.0,4/28/2014,"A lovely place with a modest, unpretentious menu.  Caviar and Chenin Blanc ... yes.  Isabel is a beauty as well!",1,,1
54,Said D.,"Manhattan, NY",0,31,0,5.0,2/2/2015,Love everything about this place. The decor is perfect. Wine list is interesting and unique. The teeny tiny kitchen shells out excellent small plates that work well for groups or just a snack between glasses...or bottles of wine. Just go. It's perfect. And bonus is no frat kiddos from the neighborhood.,,,
55,Kale H.,"Manhattan, NY",264,75,9,5.0,11/19/2014,"Every time we pass by this bar my boyfriend always has to point at it and say, ""Look, your favourite wine bar!"" I've only been here once, but it was love at first sight. We came on a Sunday night after a movie and the vibe was absolutely perfect. Dimly lit, just the way I like it, and so, so chill. No one was really there except four other couples, so it was quiet. The decor makes everything feel so homey! The bartender seemed out of place because she was just too chill and was in very casual clothing, but I honestly liked it because I didn't feel the need to sound or look better just because I was in a wine bar, unlike other wine bars I go to. She let us taste the wine we chose and waited for our approval before giving us a glass. We ordered some meats and cheeses which were delicious but quite pricey compared to other places I've been to. Nevertheless, I cannot wait for another chance to come again. Gorgeous place, and not pretentious at all.",,,
56,Susan A.,"Hoboken, NJ",2,85,0,3.0,12/16/2014,"The good news: beautiful space, lighting, and noise level.  We ordered the meat and cheese platter that was very good and reasonably priced.  There was a good choice of small plates to choice from also.  An interesting wine list but maybe I caught the bartender on a bad day for the service.  From the description of the wines the one I liked the best was $17 dollars.  A bit much.  I asked the bartender if she could recommend a similar wine but not at that cost.  When the bill arrived it was $16.00 a glass.  Really?  I would have left a better tip if she was more thoughtful.  This type of service turns me off on returning.",,,
57,Lauren H.,"New York, NY",0,1,0,5.0,2/2/2013,"I went to Vanguard last night (Friday) with a friend of mine after work and we had a great time. We were early enough to get a seat at the bar and we got to talk with the knowledgeable and attentive bartender Kyle. I particularly liked how how the layout of the wine menu is made into taste categories as i don't know my wine regions very well but I do know what I like to drink! We had some food too and we particularly loved the hummus and the sauteed kale, roasted garlic and ricotta tartine, so delicious!The Decor is beautifully done along with the lighting which sets the mood perfectly, it's a great place to relax with friends and an excellent date spot too.I would highly recommend this wine bar to anyone wanting to enjoy a night out with a glass of wine (or two!) in a great environment with excellent service. We traveled down from the UES just to try it out and would do it again in a heartbeat! Planning our next trip already!",,,
58,Marytere B.,"Manhattan, NY",8,6,0,5.0,1/14/2013,"Neighborhood Gem!This place is like an oasis in the desert! After blocks of nothing you find this beautiful wine bar. My mouth waters just thinking about their small plates. They have amazing open-faced tapas. The bread/toast is perfect and it is topped with different delicious selections. The shrimp and the mushroom ones are must-haves! Literally, the best shrimp I've ever had.  Unfortunately, they were the only plates I had. I can't wait to try more food and wine off their innovative menu. Love the creative way the wine is presented! It makes ordering a wine I've never heard of easy because the categories and descriptions tell me exactly what I want to know. The menu was my sommelier that night!  This place is the perfect date spot but somehow it is also the perfect girls night out spot.  Oh, and the service was exceptional-Impressive considering they had been open about a week when I went.",4,,
59,Magdilena L.,"Manhattan, NY",0,6,0,5.0,1/14/2013,I live in the neighborhood (Kip's Bay) and visited this place last week with my boyfriend before going to a movie. We had such a good time that we came back over the weekend with friends. The service was attentive and the menu choices/prices were great! This is exactly what we need in this neighborhood.,2,,
60,Shitake B.,"Manhattan, NY",0,1,0,2.0,1/9/2013,"If this place is to survive and thrive they need to resolve a couple of things. First, if you are going to charge $13 for a glass of Beaulieu or Bonnaventure please have it served in a proper wine glass and please please give the customer the proper pour. The Bar tender and Management need to reevaluate the profit margins in a bottle of wine and understand that if you want repeat business the customer needs to feel that they are being served the proper amount. If not, this place will find it's 12 year lease an albatross. If you are looking for a place that will leave you thirsty and hungry, this is the place. Very disappointing considering that this would be a great neighborhood find. Would love to return, great looking place. I hope they improve the menu and correct its pours.",1,2,
61,Serg M.,"Manhattan, NY",0,31,0,5.0,5/29/2014,Such a sexy place. Nice cozy place with pillows at your table. Perfectly lit and great wine selection. Their small plates menu is good too. Great place for a date,,,
62,Daniel O.,"Annapolis, MD",3,90,1,3.0,9/14/2013,"The atmosphere, wine, and food were all good, but the prices are high and the portions are tiny. A good place for a quick drink, but not if you're hungry. Unless the prices fall or the portions expand, I wouldn't go back.",,,
63,Nellie P.,"Manhattan, NY",0,3,0,5.0,1/14/2013,"Love, love, love this place!! First, its absolutely gorgeous and you feel immediately ""at home"" upon entering. Second, the wine list is amazing and very easy to follow. Third, the staff is wonderful, very friendly and very knowledgeable. I will definitely be going back VERY soon. Thanks for adding this gem to an otherwise lackluster area!",1,,
64,Sarah D.,"Brooklyn, NY",49,8,0,5.0,1/14/2013,"Vanguard Wine Bar is an amazing addition to the Kip's Bay neighborhood.  Whether you are heading to a movie and need a snack and a wine, having drinks with friends or having a romantic evening with your significant other, this is the place to do it!  The wine list is very well thought out and the choices are fun and interesting. The pricing is outstanding and the ambiance is stunning.  The staff is warm and friendly and the food by Soa Davies is delicious and perfectly portioned and pairs wonderfully with the list.  I can't wait to go back!  Cheers to the owner for doing a fantastic job!!!",1,,
65,Beth C.,"Manhattan, NY",0,8,0,2.0,1/26/2013,Went last night.  Great vibe but agree with other review that the  pour is light when you order by the glass.   $12.00 for a quarter glass of wine is unacceptable.,,,
66,Jill W.,"Manhattan, NY",0,14,1,2.0,7/25/2014,good spot but wish bartenders looked at customers,,,
