,er_name,er_location,er_freinds,er_reviews,er_photos,er_rating,er_date,er_text,er_useful,er_funny,er_cool
40,Paul Y.,"New York, NY",504,131,117,4.0,6/29/2016,"---Ambiance (4/5)---For a small shop in St. Marks, this shop keeps relatively clean and always has an open seating area if you just need a break in the back. It's a little cramped when you're trying to get your drink and someone else is waiting in the isle or trying to get to the front/back, the drinks are good enough to wait.---Food (N/A)---I really wish they had some type of food here. ---Drink (5/5)---The drinks here are actually better than most Boba (Bubble Tea for you non Boba-ers) shop, and frankly, I do enjoy nearly all their drinks here. My favorite is actually their grapefruit yakult with coconut jelly. Their regular Caramel Milk Tea with bubbles is alittle sweet so i make sure to keep it at about 50% sugar and 50% ice, but even that gets alittle too sweet. If you want boba, get the jasmine Milk Tea 50% sugar with Boba. It's not overwhelmingly sweet and they base it with a tasty jasmine tea so its very enjoyable.",2,1,2
41,Timothy B.,"New York, NY",0,4,0,1.0,4/24/2017,"Was there yesterday. The guy named ""Sun""had a major attitude problem and took wrong orders! I'm gonna ask all my friends in the hood not to come to this place! There are other better boba places nearby! Rude, rude, rude staff!!!",1,,
42,Jean Claire G.,"Queens, NY",775,429,1999,4.0,11/22/2015,This is my spot everytime I wait for my friends before dinner around st marks area. This place have chairs & tables that you can enjoy your bubble tea & chill. I always get the regular bubble tea or the taro milk tea. The hot one is good for winter too. Price is reasonable for $3 medium drink.,,,
43,Veg A.,"Manhattan, NY",0,4,0,2.0,3/31/2017,"On maps it says the shop is open between 11:00 AM - 11:00 PM (Sunday, Monday, Tuesday, Wednesday, Thursday) and 11:00 AM - 1:00 AM (Friday & Saturday) but the store closed 5minutes before 12:00 AM on Friday. *Please fix this error. I traveled for an hour in the rain because I needed a bubble tea fix and was very disappointed.*",,1,
44,Sonya L.,"Los Feliz, Los Angeles, CA",248,87,2435,5.0,2/20/2015,"YAY! One of my favorite go-to tea chains now has a home in the East Village. That makes a total of 10 CoCo locations in New York. Woot woot!I nearly tripped on the pavement speed walking past this CoCo, while on the way to the subway. I always assumed there were only a few shops available in California. Well, now I know. (And you too.) Thank heavens!Your typical CoCo always smells of fresh citrus the moment you walk inside. Staff is always friendly and helpful with the many drink options. I stick to my favorite, which is the Jasmine Milk Tea with coconut jelly. No boba added and always in a large. Mmm, perfection! Tastes exactly the same but the only difference here is the price (more expensive in NYC) and they don't offer or honor any stamp cards. Bummer. Forget Starbucks and go to CoCo instead Yelpers! ;)",6,4,5
45,Anna L.,"East Village, Manhattan, NY",2305,212,646,4.0,9/13/2015,"I like the honey melon thing! Also 3 guys is great, pudding, grass jelly. Normal price of like 3.50$ for medium.Great spacing spacious just to chill out with friends. There is charger outlet too!Fire up to like group of 6-8.Many different flavors, I like cocos same as Kung fu!",,,
46,Virginia Y.,"San Francisco, CA",1614,1444,4566,4.0,3/31/2015,"With so many bubble tea joints in East Village, you can imagine how cutthroat competition can be. I've had my share of bubble tea at Saint Alp's, Tkettle and Kung Fu tea. In terms of taste, CoCo is comparable to Kung Fu Tea. I had the passion fruit passion fruit green tea with sago. The drink was refreshing and not overly sweet, I wasn't a big fan of the sago though I think I'll stick to my usual herbal pudding or tapioca. Like most places CoCo gives you an option for how much ice you want and how much sugar you want. I like that they offer seating unlike Saint Alp's and Tkettle where it's only reserved for dine in customers. This forces people to get tea to go rather than sit in. But not at CoCo, their sleek and modern interior welcomes you and allows you to enjoy your drinks at your own pace rather than walking and drinking at the same time. Prices are slightly cheaper compared to everywhere else, I like that they offer a monthly special where you can get 2 featured medium drinks for $4.95. This might be my new go to spot for bubble tea spot if I'm around East Village.",2,,
47,Rosa C.,"New York, NY",70,301,102,5.0,8/31/2015,"I love that CoCo is open late. We were in the area and I was craving boba, and none of the boba shops were open (I'm looking at you, KungFu and TKettle). But CoCo saved that day (or night), at 1AM. The regular milk tea is perfect. I usually get 70% sweet at KungFu, and I forgot to customize the sweetness level at CoCo, but I didn't find it overtly sweet. So maybe CoCo's milk tea is not as sweet as KungFu's? The tapioca bubbles are perfect at CoCo- just enough chewiness with a bit of sweetness. I will definitely be back at CoCo for more bubble tea! Oh, and I think they have a $7 or $8 minimum for credit card charges.",,,
48,Nithi S.,"New York, NY",234,1,0,5.0,12/4/2017,the only place i've ever liked bubble tea .... only thing that's annoying is the credit card minimum :/,,,
49,Sally R.,"New York, NY",251,147,362,4.0,6/29/2015,"I can't believe I haven't written a review for Coco's yet. This is my favorite bubble tea spot. I ONLY drink bubble tea from here, even though they have competitors Kung Fu Tea and TKettle across the street. I've tried a few of their drinks that didn't wow me. I'm not a fan of the fruit teas, personally, but my friend really likes the grapefruit yakult. I tell myself to try new drinks but I always end up getting my fave - the pudding milk tea. People get weirded out by the pudding but it's SO GOOD. I don't like tapioca in general so I get the pudding. I used to come here every week, but I've managed to cut it down to every two weeks 4 stars instead of 5 (but more like 4.5 stars) because their staff is really inconsistent in terms of service. I know Asian people are generally rude so I expect it, but still...some are nicer than others. I also wish they had a stamp card!",,,1
50,Umar T.,"New York, NY",201,111,324,4.0,8/1/2016,Bubble tea is delicious and even more so in slush form - especially when it's 90+ degrees out. A friend and I went here for a casual bubble tea in the evening. CoCo has a fun atmosphere and is a great place to go by yourself or with a group. The Passion Fruit + Mango bubble tea was on point. My only suggestion would be to ask for a little bit less than the normal amount of tapioca because there was a bit too much boba than I needed and the syrup from the tapioca cut through the drink a bit much. Overall great place!,,,
51,Michelle T.,"New York, NY",349,1105,1096,4.0,9/25/2013,"They just opened so they have two Grand Opening specials with $2.50 Mango Bubble Tea and $3.00 Milk Bubble Tea. The staff here are really nice and very willing to explain any drinks to you if you're unsure about it. We had the large Cream Black Tea for $4.00, which is just about the same price as Kung Fu Tea. The Cream Black Tea is basically black tea with whipped cream on top. They make the whipped cream on premise so you know it's fresh! I really liked my tea - it was something new that I had never had before and it tasted really great. The cream helped cut the bitterness of the otherwise unsweetened black tea. Nom!",1,,
52,Amy Y.,"New York, NY",176,122,320,5.0,7/13/2016,"Quick, refreshing, and superrrrrr yummy!! :D My favorites are the Mango Green tea with coconut jelly and the matcha smoothie with red beans :)",,,
53,Theresa L.,"Brooklyn, NY",9,147,110,4.0,9/23/2016,Glass jelly milk tea. Not a bad place to chill and grab and drink. They have a seating area in the back.,,,
54,Jei C.,"Brooklyn, NY",94,129,8,5.0,4/15/2016,"One word for the bubble tea: perfection! Literally every week I have bubble tea from here. My favs in this order, passion fruit green tea, mango green tea, and grapefruit green tea all with tapioca, coconut jelly, aloe Vera jelly, and lychee jelly. Friggin yum!",1,,
55,Amy K.,"Brooklyn, NY",95,76,192,5.0,3/6/2016,Great place to get some drinks!  The prices are decent and there's little to no wait. My favorite is the hot jasmine milk tea. It leaves you with a cozy and snuggly feeling and has just the right amount of sweetness. Definitely recommend checking this place out!,1,,
56,Richard A.,"Manhattan, NY",0,3,0,4.0,4/14/2017,Hours have changed! They are open until midnight on Fridays and Saturdays. They are no longer open until 1 am.,,,
57,Tiff H.,"Dunwoody, GA",1140,1666,6936,3.0,12/10/2014,"After a full meal at TKettle where we had forgone their drinks, we stopped at CoCo, a popular bubble milk tea chain in Taiwan. Obviously not the same pricing strategy as Taiwan. Milk teas with one topping are about $3.50 for a small, which seems fair. As you get into other teas and slushies, prices rise dramatically into the $5+ range.I ordered a jasmine milk tea with tapioca and my sister ordered a Tapioca milk tea. I love when they use the automatic shaker to shake the teas, as it makes the milk foamy and rich. After we got our drinks, we luckily squeezed at a small empty table, which happened to be the only empty table left in the back room. There is limited seating, and if there's a big group occupying two-ish tables, you may be left standing. However, large groups equal large sound and it was so noisy that we could barely stand it, and had to leave even before finishing our drinks.Nothing extraordinary, although I am sure there are even more expensive bubble tea joints in the area.",1,1,
58,Ron L.,"New York, NY",1080,409,2175,5.0,8/19/2014,"They've got a repertoire of bubble tea drinks just like the other Coco locations in NY in this multi national chain. As always, the staff are competent and helpful in picking out a drink that matches my mood.I'd picked out a large passionfruit green tea with not only bubbles (tapioca), but also rainbow jelly (50¢ extra for each).  I didn't care... I wanted a PARTY in my mouth! It certainly hit the spot after a hefty meal on West Village.Although I didn't get a chance to enjoy it in-store, I did notice they've got enough seating further in the back with contemporary lighting befitting the St Marks vibe compared to the other bright stark colors of their other stores.In the St. Mark's area, I'd put them on par with St. Alps in terms of overall experience, above the rest of the competition.",3,1,4
59,Ching H.,"Philadelphia, PA",906,264,744,5.0,11/21/2014,"LATE NIGHT BOBA CRAVING??????????? HAVE NO FEAR...IT'S OPEN UNTIL 1AM......IT'S OPEN UNTIL 1AM.....IT'S OPEN UNTIL 1AM.....IT'S OPEN UNTIL 1AM.....My friend and I had a boba craving at 11PM, and so finally at 12 we left our hotel and ventured over to COCO in St. Marks.I got the honey lemon aloe vera, and I am craving this drink right now! It tastes so good, I got it with coconut jelly which was kind of overkill because the aloe chunks and coconut jelly were super filling, almost too filling, and then my mouth got tired from chewing all the jellies. The taro slush with boba was equally delish, and I'm just so glad that there's a place that's open until 1AM, where most boba places closed at around 9 or 10 in the city. SPEAKING OF WHICH, we rolled into kung fu around 12:40 and they said they were closed for the evening, even though their closing time was 1AM, so I'm glad COCO was ultra reliable and didn't close up early. THANK YOU BOBA GODS.",1,,1
60,Abelle N.,"New York, NY",553,1099,516,4.0,8/1/2014,Whoooohoooo...love the fact there is four locations for coco in New York City!! This one might be the smallest coco out of all the locations but for me I'm glad there's still a coco...The multiple options of toppings are great...the toppings i usually get are... tapioca...pudding... glass jelly....red bean=] I believe this place is starting to become popular here recently due to the amount of people coming here... theres four bubble tea places around this area and instead of going to the other places which has lesser people they choose coco... It's been around for a looong while as I remember...I wonder what makes it quite trendy here lately? But I suggest you try.... They are good....My favorite one is the mango slush and three guys and possibly other tea flavored types...I've got to still try the others! ^___^,3,1,2
61,Jessie Y.,"New York, NY",235,210,215,5.0,2/12/2015,my favorite bubble tea chain!I always get the fresh milk with pudding and grass jelly. soooo good. their regular bubble tea is of course amazing as well. I really like that they use lactose free milk as I am lactose intolerant.,,,
62,Steph V.,"San Jose, CA",122,356,34,3.0,8/26/2014,"I love that New York City has a CoCo! I live in Los Angeles, and CoCo is my go-to boba place since it's close by. As always, it's pretty darn good. The milk tea tastes the same in New York City as it does in LA. The pudding is really my favorite in the drinks. Their boba (or bubbles as they call it on the East Coast) is consistently chewy, too. The fruit teas are also yummy. Definitely refreshing and light.",1,,1
63,Kristina L.,"New York, NY",987,506,1239,5.0,12/20/2014,"My go to boba spot since Chinatown is too far or I'm just being lazy... usually I get 4 drinks when I go here, 1 for now and the rest for later. I guess you can call it an addiction.This place is my top place for a boba run, best tasting milk tea with a great balance of tea and milk. Honestly I don't get the boba at any boba place, but they make it great here, chewy and not too tough. Usually I add aloe to my drinks for a great extra taste, but if you fancy something else, they have many options to choose from. My favorite drinks from here are:1) Jasmin milk tea + Aloe - no ice, this tea off sets the sweetness, so no need to adjust the percent.2) Coco milk tea - 70% sugar and no ice, trust me on the 70%, it can get pretty sweet.3) Yakult mango or green tea 4) Matcha green tea with puddingExtras:AloeBobaMixed jelly Coconut jellyPuddingAnd MORE!Overall: Although it may be a chain, its worth every penny and one of the bast priced!",,,1
64,Anderson C.,"Queens, NY",1075,656,866,4.0,4/16/2014,"Wow.  Their bubbles are on point.  What a pleasant surprise.This is not what I expected in a submerged first floor entrance of this East Village bubble tea shop.I've known the name for quite a while and had some of their bubbles before but not to the extent of these.Yes, they are still a choking hazard if you swallow them too quickly.But these bubbles are comparable to some of the handful of bubble tea places that I rave about.Located across from $1 pizza slices (2 Bros; shameful plug-in) which makes a quick, cheap lunch well worth the trip to drunk, I mean East Village.There are other food options in the area if you are not a fan of dollar slices but there aren't many bubble tea shops other than this one.Price Point?Same or similar to all other bubble tea shops in NYC.$5-$6.Take your bubble tea cravings here if you don't feel like trekking to Queens or Chinatown or if you are just in the area in general.Good Stuff.",3,,
65,Laura G.,"New York, NY",166,187,32,4.0,8/11/2015,"This is a great bubble tea place and perhaps the best in the area. Their taro is great! Very sweet, just the way I like it. The plain milk tea is also very flavorful and another great option. Unfortunately, they don't do soy milk here so if you're lactose intolerant there are a lot of things you can't have. The taro slushie does not contain milk- as a lactose intolerant fan of taro, I'm dying to try this next! The bubbles are very fresh! There is a lot of seating and the location is very clean.",2,,
66,Jenny S.,"Pasadena, CA",2102,2513,6849,4.0,2/4/2014,"another tea shop from Overseas that is popping up everywhere, even in California!!i used to think CoCo was too sweet but their 70% or 30% sweetness options solved that problem!! you can also customize the amount of ice/toppings in your drink---two ladies (70% sugar, less ice, & less toppings): perfect sweetness!! i enjoyed the grass jelly & egg pudding with their milk teaa good amount of seating in the back BUT the chairs & benches are hard so it's not the ideal spot for hours of studyingNOTE: there were awkward periods of no music..  but most of the time the workers were on top of it!",3,3,3
67,Jen L.,"New York, NY",19,187,16,3.0,1/2/2017,"This place has a much larger seating area in the back than another nearby boba tea place. The place just smells bad and the seating area isn't cleaned as often as it should be so it gives me pause to come to this place. Otherwise, the bubble tea is pretty good and service is on point. Maybe just take out instead of staying in.",,,
68,Kitty L.,"Brooklyn, NY",12,10,206,5.0,11/5/2013,"The best thing about this store isn't the drinks (although I am enjoying my 2 Ladies right now), IT'S THE SEAT I'M SITTING ON RIGHT NOW. It's all the way in the back, on the bench seats, and I'm pretty sure there's a heater right under it. It's the perfect butt warmer after a long cold day of strolling through NYC. I never want to leave.Anyway, I'm glad they opened a Coco here. There's already one in Chinatown, might as well expand and share thy delicious bubble tea drinks with everyone. Funny thing - the workers were arguing over how to make my friend's Taro Slush. How many workers does it take to make a blended beverage?Well, I'm giving this store a 5 star rating, 90% of the reason being this seat. The other 10% is because I really really like coffee jelly and pudding. Good job, Coco!",1,8,1
69,Vi N.,"Manhattan, NY",374,237,1002,4.0,10/26/2013,"Yay! Finally a legit boba spot in St Marks (sorry T Kettle)!! Huge menu. Lots of options to choose from. Also lots of ""add-ins"" to choose from. You can customize your ice and sugar level! So necessary these days!!I ordered the jasmine milk tea since it was a flavor I can't normally get when I go to Kung Fu Tea. The drink itself was good. The boba consistency was mediocre. Price is slightly cheaper than T Kettle (across the street) and menu is a lot bigger. I've been to Coco in other countries, I was so happy when I passed by one in my own city!",3,1,3
70,Dan K.,"New York, NY",221,365,24,3.0,10/26/2014,"I don't go too cray for boba or bubble yea or whatever y'all call it here. It's just okay, but I do say that coco's probably has the best drinks in this sphere of dranks! Y'all feel what I'm saying? The price is reasonable and the taste is good. Coco's is a little too sweet depending on the location doe. This location is conveniently in st marks and has a decent amount of seating which is dopeness.",,,
71,Karen X.,"New York, NY",216,189,172,4.0,10/25/2014,"Delicious bubble tea that is great any time of the day. If you're having dinner near St. Marks and the line for dessert at Spot is too long, this is a great alternative! It's perfect for a post-dinner drink during any time of year because the bubble tea comes hot or cold. It's also fun for a mid-afternoon drink. Regardless, love this place and would come here when I'm in the area! The only problem is that there are so many other great food and dessert places around St. Marks its definitely hard to choose!",,,
72,Starr C.,"McLean, VA",132,305,428,4.0,10/1/2013,"Stopped by for a quick bubble tea fix. I ordered a regular 3 Guys (and was harassed about ""wanting 3 guys hyuk hyuk hyuk"" ugh). Regular iced milk tea with tapioca pearls, pudding (whaaat), and grass jelly. I wasn't really sure what to expect with the pudding exactly, but it was basically a little gelatinous yummy, the same consistency of the grass jelly they put in.SUPER TASTY. The grass jelly and ""pudding"" took this bubble tea to the next level. I really liked it. Dang. So good.",2,2,2
73,Victoria L.,"New York, NY",148,142,218,4.0,6/22/2015,"One of my favorite bubble tea spots, and in my opinion the best option on Saint Marks. The pudding milk tea here is to die for and they have really innovative drinks. The 3 guys drink is also delicious if you're looking to go all out: bubbles, pudding, and herbal jelly. The trifecta. I recommend adjusting the sugar levels: I've found 30% sugar still tastes amazing. The one thing Kung Fu Tea probably does better is the taro flavor and the slushes. Tea Kettle isn't even in the equation. Note that there is a 5 dollar card minimum. Who isn't in love with the coco?",1,1,
74,Allene T.,"Manhattan, NY",2142,1291,3204,3.0,8/31/2014,"50 cents off with check in on Facebook, Twitter, and Instagram.  I used to frequent the Coco in Midtown East when I worked over there.  This location is new.My friend and I got the fresh grapefruit green tea with coconut jelly (lychee, same thing) and aloe.  This ran $5.50 for a medium (smallest size) which is quite crazy if you ask me, especially when theres [better] places such as Kung Fu Tea across the street.  Since when did St. Marks become battle of the bubble teas?Anyhow, the drink was on the sweeter side, though I'm sure you can adjust your sweetness.  I liked the slight tanginess of the fresh grapefruit juice and the tea was just strong enough.  However, I can't digest or justify the drink being $5.50....",,,
75,Ruby K.,"Upper East Side, Manhattan, NY",325,286,132,5.0,9/23/2015,"coco's is the best! i always come here after i get dinner at Udon West (even though my stomach is about to pop open). I get the milk tea with pudding, or green milk tea with grass jelly and bubbles. ask for less ice and 70% sugar. there's seating in the back. they take credit cards, 5$ limit. yeap thats pretty much it",,,
76,Hao L.,"Manhattan, NY",3,5,1,2.0,12/9/2016,Milk tea is very good. However the person who takes our order named Cindy is extremely rude. When I ordered she almost yelling at us. Not gonna back for this kind of service.,,,
77,Rebecca F.,"Manhattan, NY",221,8,0,4.0,1/31/2016,"I love bubble tea and have had a lot of it, so I have pretty high standards, and let me tell you that CoCo's is THE BEST!!!. The price is pretty average for Manhattan Bubble Tea, but it is so good. They have all the trimmings and options you can imagine. They take credit card for $5 or more orders. There is ample seating inside, very cozy and relaxed, i highly recommend.",,,
78,Alexander L.,"Brooklyn, NY",342,384,79,4.0,4/3/2014,"I was surprised how much I liked this place. GF wanted to check it out so I went with her while waiting on some friends. We enjoy Kung-Fu tea, but this place has a slightly different (refreshing) take on the old bubble/milk tea thing.Next time we're in the St. Marks area, we'll most than likely make this our go to stop.",,,1
79,Christina Z.,"New York, NY",947,368,367,4.0,6/18/2014,"For some reason my sweet tooth has been dwindling...now I only order Coco Green Tea w/ Tapioca, 50% sugar, no iceIt's a perfect balance of the bitter green tea and sweet boba, though~",,,
80,Wendy G.,"Minato, Japan",240,722,1237,3.0,11/10/2013,"The tapioca may never be as good as Kung fu tea, but at least it's wayyyy better than the T Kettle across the street. And it's conveniently located.Two stars missing come from: 1) the tapioca was not exactly chewy enough (major reason I always state Kung Fu tea is the best of the best when it comes to the highest quality of bubble tea 2) the hot drink is not really hot, only slightly warm... It was a pitiful experience. I'm still holding the faith- hope next time it would be better!!",1,,
81,Biru S.,"Mamaroneck, NY",320,658,142,5.0,5/18/2014,I had the coco bubble tea and my wife had the jasmine bubble tea. They don't overdo the ice like many places and they shake up the drinks right before they serve them up. The flavors were great and the tapioca pearls didn't stick to each other. This is our new favorite spot.,,,
82,Dylan C.,"Brooklyn, NY",17,23,9,5.0,10/31/2015,"It was my first time to go there because I heard about they have a Buy One Get One Free promotion today.  I paid for one of the 3guys, then I got two.  Yeah!!!!  In addition,  they are so nice.",,,
83,Patricia M.,"Seattle, WA",210,140,885,5.0,6/19/2014,"This is my go-to bubble tea shop! I knew it was good because they have stores all over Taipei, Taiwan!Pros:- So many different choices and they all sounds delicious! (They even have yakult drinks and pudding!)- Friendly service- They allow people to bring food from other places to eat there. (My friend and I brought Xi'an Famous Foods and ate it here with our yummy bubble tea)- Ample seating (never had to wait for a seat) - Have a clean restroomCons:- They play the music a bit too loud for my liking Been here 5+ times and have been happy with the service and drinks every time.",,,
84,Eric T.,"Kuala Lumpur, Malaysia",62,110,95,4.0,8/2/2015,"If you like BoBa, Coco has by far the best tapioca bubbles. Personally, I think its smooth, chewy texture stands out amongst other BoBa alternatives. It's also slightly cheaper than other bubble tea places. The only thing bad about Coco is their tea really sweet, so ask for less sugar!",,,
85,Claire M.,"Palo Alto, CA",45,12,1,1.0,4/19/2015,"Only went here twice in the beginning of the year, but after that, ****I got a fraudulent charge on a day I absolutely didn't go there.**** My bank tried to call them but they hung up. I would definitely not recommend paying with card, I don't even remember if the tea is good but this should be a cash only purchase if you really need to buy.",1,,
