,er_name,er_location,er_freinds,er_reviews,er_photos,er_rating,er_date,er_text,er_useful,er_funny,er_cool
41,Erika L.,"Manhattan, NY",462,4,0,5.0,2/23/2018,"My favorite spot in Murray Hill. I'm always looking for an excuse to go. It's small and quaint, and a great place to go and unwind. And, I have not been disappointed by any of the dishes. I highly recommend the shrooms flatbread, seared artichoke, and the chili glazed bacon jerky!",,,
42,Emily K.,"Philadelphia, PA",0,7,1,5.0,7/31/2017,"This is my go too wine bar that's a little hidden gem in my neighborhood! Outstanding food and service. It is my local spot with wonderful wines, food and good vibes!",,,
43,Nicole L.,"San Diego, CA",1,30,16,5.0,5/20/2017,Walk in. Tell Jason you are hungry and let him do the rest! No words can describe the food experience when Jason cooks! Enjoy!,,,
44,Emily C.,"Dallas, TX",0,24,9,5.0,12/5/2017,"I absolutely love this place. It's a small spot, but that means major quality control. The result - fantastic food. I always lean toward the specials because the owner/chef really knows his stuff. Never had a disappointing meal here.",,,
45,Pat H.,"Dorchester, Boston, MA",64,67,8,5.0,5/29/2016,"Tucked away on 33rd, Pino is a gem.I went on a date there the other night and the whole experience was lovely. Great wine options that were not over priced.The food was the real winner. Everything we had was amazing. We ordered a bunch of apps and eat one was great. The meat tray was my favorite. I've never met a chef so passionate about his food. He works his tail off and the results are amazing.The spot can get tight so if this is you destination be prepared for close quarters, but I totally recommend it if you are a group of 2 (maybe 3). Great for dates.",1,,
46,Kristen M.,"New York, NY",97,10,4,5.0,5/6/2017,Great food! The Shrooms flat bread pizza was delicious and we really enjoyed the truffled turkey meatballs. Great choice for late night tapas.,,,
47,Tina V.,"Yonkers, NY",0,16,1,4.0,5/27/2017,Nice and laid back place. Had wine and the meat and cheese platter. I would definitely go back.,,,
48,Alina P.,"Forest Hills, NY",0,38,0,2.0,9/25/2017,"This is not for a group,  this is not for tourists, this is not for someone who expects a hospitable host, this is not for someone who is hungry.  Tinyyyyy place for tinnnyyyyy plates that are not exceptional enough to deal with the lack of space, the absurd amount of attitude and sarcasm from the owner/chef/waiter and his partner, and absurd check. My scallops were burnt on one side and gritty on the other, couldn't tell if it were remnants of the blow torch used on everything on the menu or a poorly cleaned grill. 2 points for the exceptional resling...I'll buy the bottle online and enjoy it in the comfort of my home. Soooooooooooooooo many more delicious options steps away.",,,
49,Lisa H.,"Brooklyn, NY",563,289,5111,2.0,1/10/2016,"My expectations for Pino was high, but I was let down by their small overpriced portions. We ordered the turkey meatballs, brussels and tuna tar tare. The turkey meatballs were flavorful but didn't knock my socks off. The brussels were overcooked and soggy. The tuna tar tare wasn't citrusy enough and the few chips they provided was stale. We ordered these 3 items along with 2 glasses of wine and our bill came to be almost $90 with tip.. definitely not worth it.",2,,
50,Sadia H.,"Wilkes-Barre, PA",188,34,3,5.0,3/4/2017,"Really enjoyed this place, went there pretty late and the staff was nice enough to still take our food orders. The atmosphere was chill and the music was good and not too loud that we could still hear each other. The figjam pizza was delicious, the sweet jam and the tangy blue cheese was a really nice combo. Would go back again!",,,
51,G M.,"Woodside, NY",1,54,42,5.0,3/10/2016,"Very cool place. The bartender was friendly and the chef- owner very accommodating. Great for couples as the place is not very big.  The kitchen is right there in front of you and the chef cooks everything in plain sight.  The menu is small yet creative.  Ask about the specials for more substantial choices.  Now about the food.  We each had the NY Strip, pepper crusted and grilled to absolute perfection. Did I mention cooked to perfect temperature.  In my opinion, the steaks had the taste and texture equivalent to a Prime Steak.  Better than many of the Fancy well known Steak Houses at 1/2 the price. EXCELLENT.   We also shared the grilled artichoke salad and had some great wine.  Overall, a cool little place with great good.  My new place for a great steak.  Hopefully the steak becomes a regular menu item.",,,
52,Andrea R.,"Manhattan, NY",0,7,0,5.0,6/10/2016,"I agree with other reviews! This is a hidden gem! It gets very crowded some nights but the wine is delicious and the food is amazing. The service is unique as the chef himself brought over our dishes once they were prepared. I was torn when writing a review for this place because I think it deserves to be successful, but I don't want to give away how wonderful this place is!The only downside (but not worth taking away a star), is that it got a little too noisy in there for my taste.Do yourself a favor and give this place a try!",,,
53,Anthea K.,"Mt Vernon, NY",18,10,6,5.0,12/10/2016,"My job had our holiday party here and everything was amazingggg!! Jason, the owner and the most amazing chef kept our bellies and spirits happy all evening. He made the most amazing brownies... I almost proposed! His take on a Philadelphia roll was so absolute delicious!! I could go on and on! Run do not walk to Pino and get the best food and service around Manhattan.",,,
54,Sarah J.,"Manhattan, New York, NY",39,1,0,2.0,2/8/2017,"This place has a cool vibe, but they won't let you sit down unless you order a full meal, and it's ""intimate"" to say the least. My husband and I went in for a drink and some apps, and the bar was totally full (people standing too), but there was a wall of empty tables. The two guys working there were both incredible rude and one pointed at a single stool for the two of us. It was a Wednesday night... if they can afford to turn away business, bully for them. But why be dicks about it? We left.",,,
55,Kate B.,"Manhattan, NY",84,37,8,3.0,8/4/2015,"I was a little disappointed when coming here Saturday night. I am a relentless review-er and rely on my fellow Yelpers.My boyfriend and I met another couple we know here Saturday night. I think the bartender and the chef were fill ins, as the bartender said he was filling in and didn't know anything about wine. Which might not be the best guy filling in....We ordered a few glasses of wine each, but he couldn't tell us much about them. We also ordered food, meatballs, scallops and flatbreads. The food took a really really long time. There is only one chef and it's a small prep area. Although the restaurant itself is like 6-7 tables, so very small. We noted that it seemed others were concerned about how long it was taking to get food etc.Food arrived, it was okay. It was good. Nothing stellar or what the reviews previously gave an impression of. We will come back and try to see if we just came on an off night. A tad expensive for having spent $200 on wine and mediocre food",2,,
56,Tom K.,"San Francisco, CA",0,16,0,3.0,4/9/2017,"Most of their reds are rated 85-87 on WS, which is pretty low. Whether you trust WS or not, it strikes me that all of their red wines fall into that range, despite some of the bottles selling for $25 retail (others as low as $8). I didn't come here I just reviewed the wine list and then decided not to go. Leaving 3 stars so as to not bash a place I haven't gone to.",1,,
57,Tracy L.,"NEWBURY PARK, CA",2,15,6,5.0,10/20/2016,Wine and grilled artichoke salad were great!  Jay was very attentive.  Nice ambience :),,,
58,Aaron R.,"Manhattan, NY",1,19,6,5.0,1/14/2017,Awesome spot.  Great date place for wine and food.  Chef/owner was super friendly and made sure we left full.,,,
59,Jon S.,"Stockholm, Sweden",280,12,0,5.0,1/7/2017,Love this little wine bar next to my house. Had several appetizer and some really good red wines. The owner was giving us good service and made us feel at home. Place is small and gets packed so be on time. Not sure if you can make a reservation.,,,
60,Amy H.,"Auburn, WA",394,7,15,5.0,5/25/2016,"My husband and I were visiting NYC for the first time three weeks ago to celebrate our 30th Wedding anniversary.  After spending the afternoon visiting the Empire State Building we wanted to get off the beaten path and enjoy a glass (or two) of wine and an appetizer.  I googled wine bars within walking distance of the Empire State building and had the GREAT luck of deciding on Pino Wine Bar.  WOW!  JB, our bartender was fabulous and made us feel like regulars.  He even recommended some fabulous places to visit, which we did, and it made our trip truly unforgettable.  During our time at Pino JB's friends came in with whom we also visited.  The wine was wonderful, the appetizers SCRUMPTIOUS and very affordable; but the staff and people were second to none.  We took pictures with them because we will always remember JB, the food, wine and friends.",2,,
61,Nellie T.,"Washington, DC",8,26,14,5.0,5/7/2015,"Adorable and cozy atmosphere, super friendly staff, and the food is amazing! They always give you great wine suggestions! Perfect place to hang out and unwind with a friend or two!",1,1,
62,Crystal A.,"Manhattan, NY",11,9,0,4.0,9/3/2016,"Generous pours and a nice play list accompanied this small spot with really good food. Unfortunately, I believe the food is a tad overpriced, but it hadn't stopped me from going back!",,,
63,Francis S.,"Manhattan, New York, NY",0,1,0,5.0,6/9/2017,"If you're looking for good drinks,  great food made with love you can taste, this is a place you should find yourself in. Happy hour drink prices are great too! From a huge foodie this place is second to none for wine bars. I come here weekly now, sometimes twice a week.",,,
64,Dani C.,"Brooklyn, NY",12,13,18,5.0,8/19/2015,"Stopped in last Wednesday for a glass of Sangria after work... Loved it! Nice portion size with a bit of a kick to it.. Just what I was looking for. Great set up and run by two awesome guys... The chef was hilarious... Definitely a place worth finding and checking out, this is now my go to for a bite and a glass after work.",,,
65,Alexander M.,"Staten Island, NY",214,5,2,5.0,5/2/2017,"The food is amazing, great service, and great vibes. If you are on a date this is a go to cozy place.",,,
66,Jenn P.,"Manhattan, NY",75,16,0,5.0,11/10/2016,A gem! Pure and simple gem! Jason is an amazing and the food was fabulous! Jay was a fabulous bartender and helpful with wine pairing. It's cozy so get here early as this is a spot you don't want to miss out on!,,,
67,Megan S.,"Seattle, WA",1,9,2,5.0,3/27/2015,"Great time at Pino tonight. The chef and bartender were so warm and welcoming. They give really personalized attention, even when it's sooo busy!I'm going to think about that bacon in my dreams. Thanks for recommending it!",1,,
68,Joe C.,"Staten Island, NY",8,14,0,5.0,6/8/2016,"The ambience is great, the vibe is chill. The food is delicious and the Playlist is on point. A great spot to hit after work..",,,
69,Derek K.,"Manhattan, NY",335,85,280,5.0,10/12/2015,Oh I love this place they have the best Malbec ever amazing I love coming to this spot with friends it's so cozy an comfortable an I love coming here my heart and soul loves red wine it's so yummy,,,
70,Richa T.,"Hicksville, NY",259,49,0,5.0,4/20/2016,"Great service, cute spot, and delicious food! Loved the artichoke starter and shrooms pizza.  Will def be back!",,,
71,Trace F.,"Pleasantville, NY",0,1,0,5.0,10/30/2014,"A trendy spot in Murray hill? No way!? You gotta check this place out! We started with a delicious bottle of wine recommended by the hostess, and we knew it was going to be a good night. Behold! The special dish of the night (gnocchi with lobster and shrimp...wowza) was the cherry on top of the already existing menu items. The truffle turkey meatballs speak for themselves (AMAZE) and the brussel sprouts on the side was the perfect compliment to our meal. The flatbreads were flying out of the kitchen like hot cakes. You do the math. The open kitchen made you feel like you were cooking with Chef Jason as he joyously prepared the meals and sang along to the catchy tunes playing. The mood lighting made it a romantic space yet was the perfect environment for catching up with my gal pal. Oh, I will be back! Murray hill, game on.",3,1,1
72,Kala W.,"Pittsford, NY",0,7,0,5.0,8/22/2016,"If you're looking for an intimate spot to bring a date for a drink or two, here it is! We stopped in, looking for a place where we could actually hear each other talk. The dimly lit atomosphere provides for the perfect one on one setting. Loved the wine and have to thank them for the birthday chocolate mousse we received. Absolutely incredible.",,,
73,Aimee X.,"New York, NY",435,85,156,4.0,11/5/2015,I stopped by this unassuming little wine bar after work one day and was pleasantly surprised by the amazing food! The chef was so friendly and recommended this steak special that was mind-blowingly good. It probably also helped that I basically downed an entire bottle of sparkly rose by myself beforehand. The steak was cooked to a perfect medium rare with a nice seared outside. The sauce that it was served with was heavenly as well. I can't wait to be back to try more from the menu!,2,1,1
74,Donna M.,"New York, NY",96,82,52,5.0,12/5/2014,"What a charming, cozy place to enjoy a midweek meal after a movie.Flat breads were delicious!",1,,
75,Ashley A.,"Brooklyn, NY",111,71,5,5.0,10/22/2014,"Obsessed with this place! Met a friend for a glass of wine and stumbled upon this hidden gem!  Not only was the wine great (I highly recommend the Malbec), but the food was phenomenal. We weren't even sure we were going to eat anything but we couldn't resist when we saw and smelled everything. We started with a cheese plate and some delicious prosciutto - such a great deal - you get a decent amount and it's high-quality stuff :) Then we had the brussel sprouts and the special - the Kobe beef meatballs. I am STILL dreaming about those (dear Jason, please make those a regular item!!) The place is cool because you watch Jason (the chef/owner) cook right in front of you and everything is cooked to perfection. We thought we were done, but we saw someone order an incredible crab mac and cheese and we couldn't resist. it was perfect. Everything was so flavorful and fresh - we'll definitely be back. Such a cozy little intimate spot - great for chilly fall or winter nights. I can't wait to go back and try all the different flatbreads and these crab cakes that I keep reading so much about!",2,,
76,Rob B.,"Flatiron, Manhattan, NY",0,8,4,5.0,4/6/2016,"Tiny but just big enough. Great bar. Expect to meet someone. New York. Eclectic. Small but thoughtful wine selection. Taste a couple before you decide. Sit a while.  Move over so others can crowd into the bar. Meet someone else. Order one thing (mozzarella with tomato and basil pesto and a crazy delicious white balsamic concoction; one good choice among many). Compliment the chef. He's right there, cooking in plain sight. Two guys run the whole place on a busy night. Then order something else. If the special is filet mignon then order that. The bartender may guess how you like it. Been there just once but I will fight you for what I now hope becomes my regular seat in the corner by the window. Enjoy.",,,
77,Sue O.,"Saddle Brook, NJ",34,63,14,5.0,6/24/2014,"La-la-la-LOVE this place! It was actually by serendipity that I found Pino because it is easy to miss. It is literally a hole in the wall, but I mean that in the best way possible.  Something about the quaintness and simplicity of it made me want to check it out. Dani the hostess/waitress/somm/whatever else is so personable and friendly.  On my first visit, I was sold on the white sangria (and I am not an easy sell on white sangria-at all). It was light and refreshing without being overly sugary sweet or puckery. The turkey meatballs are my favorite so far but I still have some venturing to do. The buffalo mozzarella salad is amazing! Ask if they have any specials- I was pleasantly surprised w a tuna tartar dish not on the menu. This is probably a spot reserved for date night or where to bring a girl friend who just got dumped and needs some consoling, or just catching up-not a double date or party/dinner place. Really intimate vibe. It is my belief that anyone who doesn't like this place is a lame, sad, lonely person who doesn't understand the concept of a wine bar.",3,,2
78,Jennifer C.,"Manhattan, NY",193,327,14,4.0,12/5/2014,"Yayyy for an awesome winebar in Murray Hill!The food was fantastic - We had a cheese plate (truffle ricotta rocked my socks), the Short Rib pizza (completely amazing) and the scallops (over creme fraiche and black caviar).  The wine was also delish.Service was great (we sat at the bar and the chef was very friendly, warm and welcoming).Cozy Ambiance.I cannot wait to go back!",,,1
79,Jinny J.,"Ann Arbor, MI",15,125,0,4.0,12/17/2015,NIce little oasis in the middle of Murray Hill where sports bars clutter the streets.. Its a little tiny and its gets loud. No happy hour but always friendly service.,,,
80,Kelly T.,"Manhattan, NY",512,84,0,5.0,1/2/2017,"Delicious food, great drinks, great menu and nice waiters. Cute atmosphere. Good for date night (too small for a first date though) Highly recommend this place!",,,
81,Gita S.,"Manhattan, NY",0,4,1,5.0,5/13/2016,Love this place. It's a gem in the neighborhood with friendly bartenders and some delicious food. Perfect date night or catch up with friends kinda spot!,,,
82,Mary W.,"New York, NY",106,169,42,4.0,11/17/2015,"It's amazing that they can make as delicious food as they do on just a skillet, oven, microwave and some small gas stoves!",,,
83,John H.,"Auburn, WA",0,3,0,5.0,4/30/2016,"We were looking for a relaxing glass of wine after a long day.  JB made an excellent chardonnay recommendation. Tried the grilled artichoke app with shaved fennel, out of this world match. Was more than usual expected. The service and style was superb.  The atmosphere is so friendly. I wish this place was in Seattle.   We had delicious drinks and food. A must visit.",,,
84,Vicky V.,"New York, NY",8,104,53,1.0,3/21/2014,"Sucks! You can't eat here . The food is crazy expensive for no reason, like brussel sprouts like 4 pieces @10? Are they crazy??? No salt was added to anything. Come here for wine but don't eat. Music is too loud sucks.",3,1,
85,Tela G.,"Queens, NY",1,20,22,4.0,1/14/2016,"Visited with my boyfriend on a whem and had and outstanding evening. The food was super yummy we had the scallops. Flatbread with steak and a few other appetizers and everything was extra delicious. The waiter was cool and the chef who operates as a one man show was a pleasure. It a very small place that can get crowded fast but the staff is cool, wine is good and food is fulfilling. Pretty much all you need to have a good night out. I highly recommend a visit. Enjoy!",,,
86,Sean S.,"Yonkers, NY",161,3,0,5.0,1/6/2016,"This is my 3rd ever review!!!!!!Chef J and Jason are the best at what they do. While chef is preparing a Fiesta of oral orgasms for your mouth while cracking jokes, Jason is picking you the perfect wine to compliment your food choice. I am not going to recommend anything in particular but just tell you to leave the decisions up to them. Whatever the special is that day pick it!! They make you feel at home with their amazing soundtrack and amazing personalities. If you never experience the wonder of pino then you haven't lived. Enjoy and your welcome!!!",,,
87,Rosio Y.,"Mount Hope, NY",85,61,118,4.0,9/13/2014,"Great bites and even better atmosphere, the Sangria is infused with different species and you can't just have 1. Pino is a wonderful tapas bar in Murray Hill.",,,
88,Laura M.,"Manhattan, NY",0,1,0,5.0,3/30/2015,"We are so thrilled to have discovered Pino.  It's a weekly staple for me and my husband as well as many of our friends.  The food is all delicious and has unique combinations that make it stand out from other wine bars.  The wine selection is varied and changes regularly so there's always some new to try.The service is also excellent.  The bartender/waitress is very attentive, knowledgable about the full menu and friendly.  The chef is great as well and always makes you feel welcome and he prepares the delicious food.",5,,
89,Peter Y.,"Bellevue, WA",132,18,1,5.0,7/9/2015,"Pino is tucked away on 33rd between 3rd and Lexington but is worth it once you find this cozy wine bar and bistro.  The wines don't disappoint nor do their other beverages; however, it is their great food and eclectic menu that will keep you drinking the night away even more amongst friends.",,1,
90,Donna R.,"Kelowna, Canada",0,2,0,5.0,1/12/2016,"Had the absolute pleasure of finding this wine bar tonight. Very intimate and relaxed setting. Jason's food is every bit as good and impressive as the reviews I read in advance, (especially given the diminutive, but so cosy, space available to him in which to provide his magic).  My husband had the steak (very tasty), our friend had the scallops (amazing!) and I had crab cakes and beet salad (Fab).  Because I had read on here about the maple bacon jerky, we had to give it a try. AMAZING.  Front of the house, JP, recommended terrific wines for us and our water glass was never below a sip for the entire evening, proving just how attentive the service is. We had an amazing evening here and would recommend it to anyone looking for a relaxed vibe with terrific, personal service.",,,
91,Tessa L.,"Charlotte, NC",1,7,0,5.0,12/1/2016,Love this place!  Super cozy and cute!  The staff is awesome- super friendly and attentive. Also-  great cheese choices!  Delicious!!,,,
92,Sarah E.,"Murray Hill, Manhattan, NY",0,3,0,5.0,8/3/2014,"This place is a little hidden treasure: their food is phenomenal, the atmosphere is great and the drinks are delicious! You can't go wrong with the mushroom flat bread or turkey meatballs...and don't forget the homemade chocolate mousse to top off the night - highly recommend giving it a try, you won't regret it!!",,,
93,Zeinab S.,"Manhattan, NY",26,9,0,5.0,4/28/2015,"Great food, great ambience, and very friendly staff! Highly recommended for all you Murray Hill locals!!",1,,
94,Lyndsay H.,"Miami, FL",0,8,0,5.0,6/9/2015,In an area of douchey college bars. This spot is a gem. Octopus and meatballs on fleek. Jason is literally the dude from the big lebowski but with culinary skills.,,1,
95,Vlad B.,"St Catharines, Canada",6,19,5,5.0,7/23/2015,"Great ambience...yummy food and wine...and the owner is pretty cool. Nice selection of music, too! A must-go-to place in Murray Hill!",,,
96,Russ S.,"Buffalo, NY",24,30,16,5.0,6/22/2015,"Excellent bar, cosy, tastefully decorated, friendly staff. I love the outside seating option!",,,
97,Stacy Y.,"JACKSON HTS, NY",144,83,266,4.0,5/23/2015,"Came here on Weds night with a friend of mine based on her suggestion. We ordered a bottle of Tempranillo, very well priced. We also ordered the turkey meatballs and the traditional flat bread. The food was very well made and tasty but pretty costly for what was presented. The chef was very accommodating, he went around to all the tables and made jokes and chatted. Overall, very lively place and I would definitely come again.",,,
98,Zachary V.,"Manhattan, NY",0,6,1,3.0,11/4/2015,"I was so hopeful for Pino as I have to walk past it everyday on my walk to work. The bartender was a little rude...or at least had a tough personality. Additionally, the $$ (two dollar sign yelp grading) is a little deceiving. My friend and I got two drinks - and after tip - it cost us a little over $30. I still love the atmosphere though; the bar is super cute! Still worth grabbing a glass of ""pino"" with a friend.",,,
99,Shannon P.,"Henderson, NV",27,50,0,5.0,5/25/2015,"My last nite in the city, I'm looking for just the place to hit the spot. I absolutely found it. I had the special which was a filet mignon with a truffle essence and perfect mashed potatoes. Five stars. The chef is clearly innovative and has the talent and vision of an amazing chef that adores the culinary experience. Perfect spot in murray hill. When the chef tells you ""welcome to my living room"" you know he has the passion of giving you the best food, as it should be. So happy right now. Don't want this nite to end  :)",,,
100,Joelle B.,"Houston, TX",23,55,1,4.0,4/19/2015,"I wandered into this place based on reviews and proximity, and am glad I did.  The bartender intelligently helped me find the right wine for me, and the food was great- I had the griddles octopus - which was properly cleaned and NOT overcooked, and the shrooms flatbread, with nice fresh ricotta.  If I lived in this area this would definitely be in my rotation.",,,
101,Mary M.,"New York, NY",369,4,1,5.0,8/6/2015,"This restaurant is the greatest. Every time I come here I am greeted by the best staff including Jason, Jay, and McClain. They not only provide the best service and suggestions but they socialize and hang out with the customers. Some must haves are the steak and flatbreads. Everything is cooked behind the bar with home made ingredients.",,,
