,er_name,er_location,er_freinds,er_reviews,er_photos,er_rating,er_date,er_text,er_useful,er_funny,er_cool
0,Henry T.,"New York, NY",305,668,1934,5.0,10/5/2018,"I paid a visit here once evening because I was craving bubble tea for the longest time. I was originally planning to go to KFT across the street but after hearing that they were out of tapioca, I paid a visit here. I arrived 20 minutes prior to closing, so shout outs to CoCo for still having tapioca! I ordered a large jasmine milk tea with 30% sugar and ice with pudding and tapioca. Everything was prepared efficiently and the one girl who took my order and made my drink was extremely friendly. The store was empty aside from one other party when I came and was it kept clean. The tapioca was nice and soft and slightly sweetened, while the egg pudding was also delicious. The jasmine milk tea had a nice slight hint of jasmine to it, without being too overwhelming. Overall, I'd highly recommend CoCo whenever you're in the area and craving a bubble tea. I think this just be my new go-to spot over Kung Fu Tea now.",2,,
1,Ruwan J.,"New York, NY",376,677,30522,4.0,8/30/2018,"casual grab-n-go Boba tea place with seating, located on St. Marks Place.narrow space. modern/ish interior + exposed brick. there's seating sectioned off in the back. space is air-conditioned and brightly lit.variety of teas: milk teas to fruit teas to smoothies and more. add-ons like Boba  (tapioca balls), jellies, red beans, etc. are extra ($.50). medium and large are the standard sizes for pretty much everything ($4-$6 price range + tax). you select your sweetness level here like other Taiwanese-styled tea places. the fruit teas err on the sweeter side, of course.i typically get the the Mango Green Tea: decently caffeinated AND solid flavor.  it's a good portable dessert drink--refreshing treat.  i grab-n-go and don't stick around. the place gets super busy when NYU/Cooper Union students are out and about or extremely warm days.service is solid. though lines can build bc there's typically only one employee working the register and making teas when I've been there.drops mic cuz i got my grip-n-sipi outzzz",12,9,11
2,Joshua D.,"Liverpool, NY",323,399,1039,4.0,7/29/2018,"I have to give CoCo some credit.  In the city where bubble tea places are absolutely everywhere, they definitely stand out.  From really tasty flavors to having a really cute look,  they know how to keep you coming back for more.  They aren't my favor bubble tea place, but they are definitely ranked pretty high on the list.  The prices are about the same between them and all of the competition in the area as well. This location on St.Marks is extremely convenient due to the fact there are so many places there that have wait times.  I often get on the wait list at a nearby restaurant, then come here and relax with a drink until it gets time to go eat. As for flavors. You can get everything from your standard milk tea to all sorts of fruit teas as well. I do recommend coming here if your in the area.",3,,1
3,Liz S.,"New York, NY",792,698,1550,2.0,7/11/2018,"Came here largely because Kung Fu and other drink spots on St. Mark's were super crowded on a hot Sunday afternoon.Although CoCo had a shorter line, it ended up taking about five minutes to order and another five to get my drink. They only had one person working both the cash register and the drink making-- what? She did a great job but they need more people staffed.Interior is your standard corporate fare, but unpleasantly, the climate control wasn't working properly and it was quite warm inside. I wouldn't want to hang around here.I had one of the cheaper drinks, which ended up being around $5 after tax and tip. Chocolate milk tea sounded appropriately indulgent, but I definitely shouldn't have skimped on the sugar-- at 50%, it was super bitter and artificial-tasting. What's worse was that the powder wasn't all mixed up, so I kept drinking clumps even after I tried to mix it around.Boba isn't my usual bag, but I've had enough in NYC and Houston that this stood out as a disappointment to me.",3,,1
4,Joy H.,"Toronto, Canada",14,92,298,5.0,4/30/2018,"CoCo has really consistent drinks, even across countries!We ordered a pearl milk tea and passionfruit tea with tapioca. Both drinks tasted like the same CoCo from back home in Toronto, which was nice. They are also generous with their tapioca!The staff there were also really nice, although soft spoken. The drinks were made pretty fast on the lazy Sunday afternoon we were there, there was only one other customer already inside when we arrived.CoCo is a really reliable franchise to get bubble tea. Their prices are pretty decent and their custard jelly option is pretty neat too.",,,
5,Yang X.,"New York, NY",460,208,196,4.0,1/8/2018,Value: 8/10Experience: 8/10Taste: 8/10Fast service with good seating and good selection of bubble teas.Value: I got the medium 2 Ladies for $4. It was definitely fair price for what I got. Actually a bit cheaper than other bubble tea places like KFT I think.Experience: The service was super fast and the seating was plentiful. Probably got my drink in under 3 minutes. The bathroom was out of service though.Taste: The tea was mild and not too sweet. I got the warm tea by the tea was sitting out for a bit so it was just warm. It didn't bother me but know that your hot drink might not be piping hot.,1,,
6,Irene L.,"Manhattan, New York, NY",115,97,171,2.0,6/6/2018,"This does not compare to the coco fresh overseas in China. First they do not have loyalty cards and no check in offers. The ones in China taste very fresh and has a lot of pudding and bubbles. Over here there's less. I order the 3 guys large and it was almost $7. It has bubbles, pudding and grass jelly. It was okay. Nothing compare to the one I had it China. The area was spacious but the back smells like cigarette smoke.",,,
7,Hannah H.,"Alexandria, VA",485,3957,29995,3.0,7/23/2017,"CoCo started out in Dansui, and its menu offers milk teas, fresh milk, chocolate beverages, fresh fruit teas, tea lattes, yakult, tea machciator, and slush & smoothies.  The hubs and I stopped by to order some drinks - we tried the Fresh Lemonade and the Grapefruit Green Tea, both with no toppings/bubbles.  The Fresh Lemonade was pretty refreshing, as it had a nice tartness to it; the Grapefruit Green Tea, on the other hand, didn't taste good, as while it had bits of grapefruit flesh throughout, the combination with the green tea didn't work, making it more of bitter drink.There are only about 4 tables, and a waiting bench in front of the pick-up area.  For those who need to use the restroom, it's unisex and locked, and you need to get a key from one of the employees.This isn't a place to do any work, as the volume is extremely high.+Fresh Lemonade drinks+unisex restrooms - requires a key",4,2,4
8,Bowie W.,"Boston, MA",561,103,160,3.0,8/29/2017,"Pros:- Good place to sit and study or chat with a friend. There's more seating than I'd expect from a boba place and it isn't usually crowded- It isn't the best boba I've ever had, but it wasn't the worst eitherCons:- Like most boba place, this places uses artificial flavoring and depending on what kind of drink you get, it can be very noticeableSpecifics:- Grapefruit Green Tea = Very strong grapefruit flavor and not too sugary. Perfect for a hot summer day.- 2 Ladies = The milk was very creamy and the tea taste was distinct. Did not order this myself since my friend chose it but after trying it I would",1,,1
9,Mehrnaz H.,"Cupertino, CA",76,473,889,4.0,7/24/2017,"Stumbled across this tea shop late at night, they were out of lemon so we couldn't try the lemon drinks that we had hoped for...Their teas are mixed with fresh juice and it gives it a great fresh feeling on a hot night!! Loved the ratio of tea to juice and it was a very pleasant drink. Will definitely come back and try again when then have lemons",1,,
10,Young Y.,"Boston, MA",76,291,157,4.0,7/22/2018,I had their traditional milk tea and it was fine. If I am in the area I will get it again but I don't think I'd go out of my way to go to this place over others.,1,,
11,Catherina L.,"New York, NY",662,95,195,2.0,8/24/2017,"Do not get bubble tea here―there are plenty of other better shops literally a few doors down or across the street. I got the taro slush and it was so bad I didn't even bother taking a picture or finishing the drink (threw more than half of it away). You could tell from the first sip that the flavor was soo artificial and extremely sweet. The tapioca itself was also gritty and weirdly chewy. I can't really speak for other flavors, but do not under any circumstances get the taro slush.Besides that, the service was really nice and and inside is cute and clean. But the flavor of the bubble tea I got was so repulsive it didn't really matter. Sad to say I won't come back any time soon :/",,1,
12,Bunny M.,"Reno, NV",16,41,28,4.0,6/23/2017,"It wasn't too busy here on a Thursday night, so placing and getting my order in approx 5 minutes is a definite plus. I got a medium classic milk tea with reg sugar, less ice and enjoyed it. They're not stingy with the pearls and the beverage to pearls ratio balances out, yay!The pricing isn't too bad since they don't charge tax (or tax is already included, I can't tell), I only paid $3.75 for my drink. The only thing I found off was that the pearls were smaller than what I was used to and that there was no music playing. The place is clean and there's seating further in the back as well as a bathroom. I would come back here to try different flavors but it's pretty average IMO. It's got pretty hefty competition since three other boba places occupy the same block as CoCo.Tip: there's a minimum purchase of $5 (I think) to use a card.",1,1,3
13,Michael C.,"Orlando, FL",570,260,844,2.0,11/20/2017,"Don't get the boba here; it's a disappointment of Coco. Having spent a lot of time in Coco's birthplace of Taiwan I was super excited to see it back here in the States. Unfortunately I wasn't impressed by the level of Boba at this Coco. First of all Coco is supposed to be a place to get cheap but consistent boba. Price is average at around $5 for a regular sized drink. I ordered a warm san xiongi (three kingdoms - boba, grass jelly, egg pudding) and was really disappointed by how lukewarm the drink was. Nothing like the boba I had in Taiwan - it was especially chewy nor especially sweet. Finally the seated area was fairly dirty with napkins and drink straws on the floor. They really need to do a better job about keeping this place clean. Will not come again.",3,3,3
14,Linda T.,"Houston, TX",15,80,126,5.0,3/2/2018,We don't have CoCo in Houston and I became a fan of CoCo when I went to Taiwan. So.. of course I had to get my milk tea fix while I was in NY. They did not disappoint!,,,
15,Danielle W.,"New York, NY",111,96,112,4.0,11/29/2016,"One of my go-to bubble tea shops in the East Village. I prefer it over some of the other bubble tea places nearby. It's open late, until 1 AM, on Fridays and Saturdays which is super convenient. There's also a few tables and seats inside towards the back. The service is very fast. They've always gotten my teas right, even when I mass order drinks for friends. They also take credit card (minimum of $5)! I really enjoy their Three Guys (milk tea with tapioca, grass jelly, and pudding) and Jasmine Milk Tea, which both come in cold and hot versions. My favorite topping is the lychee jelly!",1,1,
16,Jess D.,"Woodbridge Township, NJ",301,401,2408,4.0,4/4/2017,With a million different bubble tea places out there this one was pretty good . My kids are Addicts when it comes to these places and they gave .,6,5,3
17,Lissett A.,"Arlington, VA",3,2,0,1.0,9/13/2018,the gentleman behind the bar said something in his language to the girl working with him. they both looked at me then started laughing.,,,
18,Kate J.,"New York, NY",425,427,234,4.0,6/30/2018,I was impressed with my experience here. The green tea with tapioca I had tasted very refreshing and sweet. I was a big fan. The space is also very relaxing and there's a lot of places to sit. I'd come back for sure.,,,
19,Denise F.,"East Village, Manhattan, NY",192,16,5,4.0,8/10/2017,"I came here thinking that I would do some work on my laptop since previous Yelpers said they had wifi. Sadly this place no longer has wifi. :-( FYII got a medium classic milk tea with pearls. A bit too sweet for me, but I forgot to ask them to lessen the sugar. Other than that, it's delicious! Clean place, lots of seating in the back. Smells sweetly of milk tea, that might be an issue for some but I don't mind it at all.Music is Top 40, or something. Popular music.",,,
20,Kate S.,"New York, NY",76,679,3070,3.0,2/27/2017,"As far as bubble tea places go, this place was just okay. It's a bit more pricey for sure. My large passionfruit with bubbles was $5.50, and my friend's large passionfruit with bubbles and pudding was $6. Normally I can get a large for less than $5. And I'm glad I asked for only 50% sugar because otherwise it's deathly sweet. My friend tried the normal sugar one and she drank some of it and then asked for some water, but the person behind the counter wasn't very accommodating because he only filled the cup just a little bit.",1,,
21,Jessica W.,"Houston, TX",198,519,9,4.0,3/16/2017,"waah!! during my trip to new york i couldn't believe I was seeing a CoCo (i've only seen them overseas!) so obviously i had to stop by and visit. I ordered the typical jasmine milk tea with boba, but hot because it was FREEZING outside. the boba was chewy enough to hold up to the heat of the milk tea. i asked for a little less sweet, and it was perfect!staff wasn't super friendly but they answered questions if necessary.you need a key for the bathroom! its also an insanely small bathroom haha.",,1,
22,Jean W.,"Somerville, NJ",73,92,300,4.0,2/26/2017,Bubble Tea!!!!Black Tea Lemonade Please!Service was quick! Place is small.You pay at the entrance and tunnel in. Which means everyone who orders after you is closer to the exitThis is just something I'm noticing if reversed could help their line more smoothly. As an overweight american I didn't feel comfortable sliding pass the seated patrons to go to the bathroom. Oh! There's seating in the back. About ten seats.Bubble Tea was good.,,,2
23,Livvie L.,"Mountain View, CA",11,90,136,3.0,3/26/2017,"I got an Okinawa black sugar latte with tapioca and 50% sugar. The boba was a bit on the hard side, a bit harder than PaTea, and I tend to prefer my boba a bit on the softer side. It was decent tasting overall -- it tasted pretty much like milk with black sugar, which makes sense because that's exactly what it was. But this was nothing special.",,,
24,Han C.,"New York, NY",151,397,80,5.0,11/19/2016,"Coco is probably my favorite bubble tea chain in the city - the most consistent in quality and flavor. What I particularly love about the St. Mark's location is how hot they actually serve hot bubble tea here. Most places will give you a borderline lukewarm cup when you order hot bubble tea, but this location wants you to give you third-degree burns to suck up that juicy, soft little bubble, and I LOVE IT. Perfect for drinking bubble tea on a cold, wintry day. I always get classic bubble tea, and it's the best!",2,1,2
25,Jihan N.,"London, United Kingdom",74,44,34,3.0,9/23/2017,Menu selection has lots of options..im not a frequent Bubble Tea drinker but I like to try different options. I like the menu because it breaks down all your options even you would rather have fruit instead of the balls lol,,,
26,Liz T.,"New York, NY",507,165,124,5.0,11/26/2016,"This is my go-to place for any milk tea in New York City. In my opinion, it beats out the Kung Fu tea across the street. I always get pudding milk tea when I'm craving something more rich. The tea is not too sweet and the pudding is always the right texture. When I want something refreshing, I go for the mango yakult. There is plenty of seating and outlets to charge your laptop or phone. There is a credit card minimum of $5.",1,1,1
27,Justin P.,"Silver Spring, MD",112,285,602,5.0,3/20/2016,Ran into this place by accident but ended up ordering bubble tea from this place (since I'm Asian). It was actually pretty good and the taste was fresh. I couldn't complain about anything.Restaurant is a bit small but it's very nice place to try.,,,1
28,Sunny D.,"MASPETH, NY",139,21,3,1.0,2/27/2018,If you don't want to throw up in your mouth avoid this place at all cost! The drinks here tastes like dog shit garbage. All the Chinese employees here seems like they hate their life working here.,,,
29,Tessa D.,"Back Bay, Boston, MA",270,237,584,3.0,7/27/2016,"I really like bubble tea but I find that a lot of places don't do it right. Sometimes the boba are undercooked, or there's too much ice, or they add too much sweetener. Luckily Coco's is a pretty solid boba spot. I stopped in with a friend after an evening of ramen and was pleasantly surprised by this boba haven hiding in the mess that is Astor Place. We both got the standard bubble tea and despite our order taking a little too long I was pleased with the experience. You could taste the flavor of the tea, they hadn't tried to hide it with milk and sugar. I think I'd have to try more of their offerings to really fall in love, but I definitely will be coming back.",2,,1
30,Jinny T.,"Jersey City, NJ",218,244,5042,4.0,9/8/2016,The grapefruit green tea is my fav! It's not too sweet and the fruity flavor is very refreshing. I feel the drink size is smaller that before (?).We sat at the table at the back for a little bit. It's a good place to hang out and chat!,1,,
31,Ranie D.,"Manhattan, NY",64,30,2,1.0,1/6/2017,"Extremely rude staff! I tried to buy a bubble tea for $3.25 and I only had a credit card on me. The cashier girl told me with an attitude that there's a $5 minimum - I said I don't have anything on me besides a credit card (some places would just swipe it since it's not a big deal) but this girl just looked at me with disdain and said ""sorry"". I really wanted bubble tea so I went to grab my wallet from the car. I came back (as I go through the door I hear her talk shit about me in Chinese), I ignored it and ordered the same thing and handed her a $50 (I only had $50s on me). She looks at me with disdain again and said we don't accept $50s and said ""there's a sign"". First of all what type of cheap business are you running in St. Marks Manhatten that you need $5 minimums on credit cards and don't accept bills over $20?? This is not flushing or Chinatown - this is St. Marks.  Second - I probably would have bought something else to meet the $5 minimum if it wasn't for the uber rude staff with an attitude - please learn some customer service!  I went to Kung Fu across the street and they happily accepted my $50 with no issues. I definitely won't be coming to this CoCo in St Marks again.",1,1,1
32,Akela P.,"Washington, DC",1,11,10,5.0,6/17/2016,"OMG! Now when I say I LOVE BOBA, you need to check this cute and tasty place out!I saw many people walking by with Boba as I had my mind on it the entire time prior to and during lunch. My prayers were so close to being answered. The one person I was eager enough to ask because the color combination seemed to be transparent to flavors. Boy! Was I wrong. It was SO MUCH BETTER than what it looked like, not to mention the condensed milk to top off the matcha  KUDOS! Best decision of the day, after not enjoying my food from The Bao (don't go!) IF you do, make sure to stop by Coco Tea to wash out all the badness LOLI'll be back for more Coco Tea! :)",,1,
33,Andrei L.,"Long Island, NY",46,164,344,4.0,2/25/2016,"I got Bubble Tea here last weekend while walking down St. Marks.  I got the small plain green tea with Tapioca - $3.50 total.  I have to say it was very good.  The tea was sweet, but not sickeningly sweet.  The best part was the texture of the bubbles.  They were firm and chewy, not flimsy and flabby like Chattime.  Price was alright - not cheap but not egregiously expensive.  I think I'd rate it 5 stars if it was a dollar cheaper at $2.50.  Definitely one of the better Bubble Tea places.",1,1,1
34,Adelina M.,"Pittsburgh, PA",390,303,676,5.0,12/17/2015,"OK let me put it out there, again. I love me some bubble tea. Double the bubble is the only way to go. I love cold iced tea with some tapioca pearls, some jelly, or some crema. Now, crema is this delish topping of just salted whipped milk or something like that. It is both sweet and salty at the same time and goes SO WELL with an iced glass of tea. It is my jam. I found out about this when I was recently in San Fran. Unfortunately, no where in the 'burgh has this tasty topping. I keep looking but have not found it at all.Imagine my surprise when I am in NYC and I see crema on the menu. I busted out with a loud, ""hell yes!!!"" surprising both the cashier and my friends and then proceeded with a little dance/song that I made up right on the spot. Yes, I was that excited.  And yes, I was that embarrassing. Granted this was the same day as the NYC Santa-Con so maybe I wasn't the most obnoxious person to come into their place of business. Or at least I hope....I ordered the salty cream black tea. Damn...it hit the spot. This was almost like the first experience back in San Fran. The one in San Fran had a sweeter aftertaste but this one was still pretty good. They also had bubbles. Oh yea, that is why we went here! The other two places on the block RAN OUT OF BUBBLES. How do you have a bubble tea place and run out of the bubbles....The tea was brewed very well and did not have a bitter taste to it. Sometimes those late night orders have the aftertaste of the day mixed into them. This one tasted fresh. SO FRESH. I loved it. I enjoyed it the entire time trying to find a cab and in the subway home when the cabs failed. I am so happy that luck brought us to this joint. This tea place will now be on my list of places to go when I am in NYC. It has the tea I crave but on the closer coast!!",2,2,1
35,Wendy L.,"Flushing, Queens, NY",8,152,830,1.0,6/28/2017,"The workers were really confusing. I asked for a bubble tea they told me they were sold out of ""it"". They told me they had no more bubbles. So they said I can get something else (showing me the toppings). I said you guys have tapioca (because it was the same thing as bubbles. They said yes u can order something else. So I thought they were just out of milk tea. So I asked again if they had tapioca. And then they said yes. I'm like confused at this point so I ordered jasmine bubble tea and out. And just jasmine milk tea. I said I asked for bubbles they said were sold out of it...........",1,,
36,Jeanne K.,"Potomac, MD",99,195,316,4.0,11/3/2014,"I was about to to go kungfu tea across the street because I heard a lot about it, but they didn't have pudding so I ran back to coco. I've been to coco a lot in Beijing, but this was the first time I saw it in the US. I got the regular milk tea with pudding. They don't show that you can change the sugar level, but they do. You just have to let the cashier know. Whenever I try a new place, I always get the milk tea to gauge how good they are. So the milk tea here is pretty solid and I enjoyed the pudding. They gave me a lot of pudding so I was a happy camper! I was too full to ask for bubbles, so I can't comment on how those are. On the sugar aspect, I got 70% sweetness but I may go for 50-60% next time, as I like my milk tea a little less sweet. A lot of places just pack in the sugar to satisfy the American customers, so be careful if you're like me!Other than milk tea, they have a bunch of other flavors to try. They also have a lot of topping options other than just the bubbles, pudding, and jelly.",1,,1
37,Paul B.,"Brooklyn, NY",53,184,163,4.0,2/12/2016,"Ah, boba... er, bubble tea.Since I moved out here I'd been looking for a boba shop to quench my homesick thirst. It's definitely hard to beat the Sharetea's oolong milk tea back in California, but if I could find some good brown sugar milk tea then all will be well.Luckily, a meal at The Bao called for a quick drink at Coco, which was just a short walk away. Lo and behold, they have brown sugar milk tea! It's one I highly recommend! It's not too sweet; it's just right. When I go back, I definitely gotta try the brandy milk tea they've been advertising.",,,
38,Justine S.,"Annandale, VA",356,306,549,4.0,1/20/2015,"If you are on the hunt for sweet milk tea, this is the place to go!! I love going here when I'm in the dessert mood, it satisfies my craving! Their regular milk tea, caramel milk tea, and black tea macchiato are some of my favorite options--each is delicious with a very creamy consistency. They also offer regular teas/juices/coffee/etc. They have specials on the monitor so be on the lookout!You can customize the sweetness and amount of ice. You also can add extras such as pudding, sago, grass jelly, tapioca, etc. Quick service and there is plenty of seating! Very modern and clean interior.(If you want stronger and/or more traditional milk tea I would look elsewhere, the tea flavor can somewhat get lost in the milk and sugar.)",,,
39,Winnie M.,"New York, NY",292,19,194,5.0,3/20/2016,"I am a bubble tea addict & my recent obsession is Cocos, especially the St.Marks location!!It is a great place to study, with lots of seating available, outlets and wifi. Credit card minimum is $5 which isn't bad at all compared to other places with a higher minimum. My all time favorites are their Pudding Milk Tea or Mango Yakult with coconut jelly.I come in at least once a week and it is definitely worth it!",,,
