,er_name,er_location,er_freinds,er_reviews,er_photos,er_rating,er_date,er_text,er_useful,er_funny,er_cool
142,Evan P.,"New York, NY",20,27,7,5.0,11/17/2015,"Easily a top 5 meal in NYC. Food, cocktails, service, and ambiance all top notch. Ambiance is great. The Clocktower is located in the former executive office suite for MetLife. Love the separate dining rooms and bar area. Cocktails are magnificent and creative. American Cereal Killer (Michter's, Cheerios Milk, Madagascan Vanilla syrup and bitters) is unlike any cocktail ever had, and that doesn't even include the fact that it's served in a glass milk carton.  Great presentation and tastes even better.Meal was impeccable. For starters, wife and I split the poached and smoked salmon and the mac 'n cheese.  Salmon was a beautiful piece of fish. Great smokiness paired perfectly with grapes, walnut and celeriac.  Mac 'n cheese was the most elevated Mac 'n cheese you'll find. Thick cut pasta, creamy cheese, mushrooms and ox cheek. Delish. Oh, and the IPA Beer bread - insanely good.For mains, we split the venison and the duck. Can't say I eat venison often, but this was far and away the best I've had. Perfectly cooked. The spiced plum sauce was delicious, and all paired perfectly with the cabbage and carrots. The granola balls were a tad tough on the teeth, but once cracked open, added another layer of texture and complexity to the dish.  The duck was also perfectly cooked and the sauce l'orange, turnips, fennel and endive all came together wonderfully.For dessert, had the chocolate mousse. Very, very good. And oh, that Cold Fashioned cocktail. Cold brewed coffee and bourbon - heavenly.Service was fantastic. Warm, friendly, not overly formal. Can't wait to go back!",2,,1
143,Nikai M.,"Manhattan, New York, NY",1,28,4,4.0,9/16/2017,"Decent place to impress a client or a dinner date. Located at the podium levels of the Edition Hotel, the Clocktower is connected to the hotel lobby, lounge and the cocktail parlor. The interior breathes old school American college club atmosphere. The food is impressive but not memorable. I keep on coming back for a drink but not so much for food.",,,
144,William W.,"East Rockaway, NY",1,5,0,5.0,12/12/2016,Wonderful food and service. We celebrated our anniversary here and could not have been happier. As jaded New Yorkers we appreciated the quality without the pompous behavior too often seen these days. Foie gras and crab appetizers followed by sharing the NY strip and a nice salad. Compliments to the sommelier for pairing a wonderful Bordeaux. When we sat down we were given a glass of champagne to celebrate our 33 rd. Very nice on their part. Cocktails were generous not a tightly titrated measured excuse of a drink. Efficient service and good food. We will be back.,1,,
145,Seema G.,"Woodmere, NY",10,35,20,5.0,10/21/2015,"Sexy Trendy Delicious...Clocktower promises a delightful evening. Reservations were pretty straightforward minus the typical NYC ""new restaurant drama"". Conveniently located with minimal parking hassles. The interior surprised us with cozy nooks fireplaces, two large candlelit bar areas and a pool room. The speciality cocktails -food-dessert was all very good. They did run out of the roast and duck...which is not so unusual for a new restaurant on a Sunday night.  The tart was big enough for four. We would have skipped dessert for the delicious short bread cookies and hand rolled caramel toffee served with the check.Overall...Clocktower currently ranks amongst New Yorks best restaurants.",2,,2
146,John C.,"Manhattan, NY",0,9,0,5.0,2/19/2018,A very nice bar with excellent drinks.  Great ambiance.  A wonderful hidden gem in the neighborhood.,,,
147,Hana G.,"New York, NY",1,19,4,3.0,8/7/2017,"Went for brunch on a Sunday. The decor was nice with high ceilings and interesting art work. The service was pretty good, but the food was just okay.  The hostess gave us a cocktail menu, but our server refused to serve us cocktails because he didn't know that the nyc alcohol law changed from noon to 10am. I didn't want to argue or wait, so I let it go. The food was a bit salty for my taste. Overall, I would say this place is 3.5 stars.",,,
148,Kelly R.,"Riverhead, NY",2,8,39,4.0,8/18/2017,"The clocktower is one of the hidden restaurant in the flatiron district, located in the second floor of the edition hotel. As a first timer to the restaurant, I thought the main cafe in the lobby of the hotel was the restaurant itself, which it wasn't... it was up the spiral staircase on the second floor of the building. So do ask for directions when you are in there. I check out the restaurant for restaurant week (summer 17'); for my pick I had the shellfish  linguini, the main cod, and the peach eton. The shellfish linguini was one of the best appetizer as if it were served in a different restaurant, the appetizer can be an entre by it self. The main cod was cooked with perfection, with mussel mainstrone, olive tapenade, and purple artichokes. Peach eton on the other hand was a disappointment as it was overly sweet, the dish over load in sugar.",,,
149,Brittany F.,"Los Angeles, CA",4580,1590,1642,4.0,7/10/2015,"This is an ""in"" restaurant in NYC right now. The Edition hotel recently opened and The Clocktower is the perfect excuse to swing by and check out the new digs. Most of the restaurant kept the original decor of the building and it gives the impression that the restaurant has been there for decades. The food was surprisingly good. We shared several things to start. The memorable items were the spring leaf salad  and the steak tartare. I did not love the Alaskan king Crab. I ordered the Colorado lamb for my main and while it was good, I was a little surprised at the smaller size of the racks, especially since they were from Colorado. Service was friendly and efficient and the highlight of the meal was at the end when they brought a tin with shortbread and toffee!! I would return just for these sweet bites!",19,18,19
150,Roxana F.,"New York, NY",70,204,21,5.0,12/13/2015,"Love this place. Great cocktails, beautiful rooms, pool table, delicious food. Skip the awful bar on the ground floor and make your way up to Clocktower, and you won't be disappointed.",,,
151,Sasha B.,"Manhattan, NY",191,898,45,5.0,12/6/2015,"Had an amazing experience this evening. We ordered the burger and the venison. After we ordered, the hostess informed us an unfortunate incident in the kitchen meant we would have to choose an alternative, and we ordered the duck. It did not disappoint. They told us they would take care of us, so we assumed we would get a round of drinks or an entree on the house, but they comped the entire meal. Impeccable, friendly service!The ipa bread is addictive and delicious - great wines by the glass.",,,
152,Benjamin K.,"New York, NY",13,338,459,4.0,11/30/2015,"Good food:went for the pigeon pie w/ foie gras and the sweatbreads. Loved the space and the pool table. Expensive - but with the service et all., was worth it. Don't forget to order the pistachio soufflé for dessert.",,,
153,Danielle M.,"New York, NY",388,497,41,4.0,7/29/2015,"The BF & I had dinner last week at The Clocktower, an ultra-cool restaurant with a great & unique ambiance.  While waiting for our table, we enjoyed nice cocktails at the bar while people-watching (they even have a pool table!).  Their warm, crispy bread loaves are outstanding.  A perfect crunchy crust with a hot, soft doughy center - it was so good we asked for another loaf!  I had the Big Eye Tuna Tataki for my appetizer and the Long Island Duck for my main.  The BF had the Steak Tartare for his appetizer and the Rabbit & Foie Gras as his main.  We enjoyed all of our plates; however I think he would have opted for a different main entrée.  We also had ordered a side of French fries (which they had forgotten at first) - served thick/English-style cut.  We decided to skip out on dessert, but they had brought some lovely mini complimentary treats (brittle, salted caramels, & shortbread cookies).  Although I don't need to come back to The Clocktower for more than another drink, I am glad I was able have that dining experience!",2,,3
154,David H.,"Fort Lauderdale, FL",921,34,0,5.0,12/29/2017,Superb! Every item was perfectly executed and everyone in our group throughly enjoyed our evening from start to finish ! The Staff were excellent and very accommodating!,,,
155,Hamilton Y.,"Manhattan, NY",4,51,2,4.0,12/9/2016,"Clocktower was a pretty good experience and my rating is closer to 4.5 stars than 5. I tried the American Cereal Killer cocktail which was interesting but I didn't love. It wasn't that far from milk with a shot of bourbon was pretty expensive.I really didn't enjoy the pressed chicken appetizer. The pickled veggies on the side I thought were too hard and too sour. They were likely there to help cut the richness of the foie, but I ended up just avoiding them. It came with garlic bread and the chicken also had cobnuts so texture wise there was too much hard and crunchy. The main however was phenomenal. I had the cote de boeuf and shared with one other person and it was definitely more than enough food. Perfect medium rare with a bone marrow gravy that was incredibly decadent. The greenbeans were cooked to perfection too though I'm not sure the foie gras cubes tossed in brought anything to the dish. I love gratin as well so that was a great addition.I ended the meal with the pistachio souffle and it was definitely worth the wait. Relatively soft and light with the chocolate ice cream melting down the center it was a great finisher that I would love to have again.Service was on point though the lay out of the restaurant is a bit labyrinthine. Multiple people finishing their meals at the same time is a bit annoying though as the coat check is behind the maitre'd which is in between a bunch of fairly narrow hallways.",,,
156,Mark M.,"Roslyn, NY",37,93,155,5.0,9/12/2015,"So, I read a lot of reviews and had somewhat high expectations going in, so already that is a recipe for disappointment. But none the less, I was still blown away.  This is only my second 5 star rating for a restaurant. The restaurant is on the second floor above the lobby of the hip Edition Hotel, so we entered the building to a cool lobby bar scene before heading up the spiral staircase to the restaurant. The second floor is the former executive floor for the Metropolitan CEO back from the Mad Med era with beautiful dark wood detail and fireplaces in several rooms, all with hundreds of nouveau framed photographs to bring it to modern hip.    Our night started with a few signature drinks at the bar. I had the Cold Fashioned which was an interesting adaptation of an old fashioned with coffee and really good. My wife and friend had the Cobblerplolitan, which tasted nothing like a traditional Cosmo, but was delish.  We were seated and given the obligatory bread, and while the bread was good ( way better than average)  the butter was like a drug.  I could not get enough.  We ordered an assortment of appetizers and main courses and every dish delivered.  Of course we tried tar tar, how could we not, and as reported, it was excellent. For a main, I had the lamb chops which were tender and had an excellent sauce.  My buddy got the burger ( I was a little jealous) and reported it was one on the best 5 burgers he had ever had.  I got a taste of the fries, and despite some negative reviews, we all thought they were great.  Moving on to desert, we ordered the apple tarte tatin and it was amazing.  We were all served an individual portion of vanilla ice cream to go along.  There was not a bite left, I made sure of that.  And then, of course, the cookies that were served at the end. This is a nice touch, even if they are just ok, but the shortbread cookies melted in your mouth....and the caramel / toffee candies with sea salt ( I am guessing) were amazing.   And finally, not that some will think it is s big deal, the coffee was amazing, even for a Starbucks snob like me.  So often restaurants fail here and at such a critical part of the meal. As far as service goes, it does not get much better.  Bryn, who is also a sommelier in training, was engaging and at our beckon call, and made some excellent recommendations.  As a plus, we were by chance seated next to an A-list celeb, so that put a little icing on an already legendary night.  I have to come back, if for nothing else, to try that burger.  It is a bit pricy, especially the cocktails, but you are getting what you pay for, unlike so many overpriced average hip but not-so-hip places. Come and enjoy!!!!",1,,
157,Ken S.,"Manhattan, NY",481,584,4462,4.0,7/28/2015,"KenScale: 8.5/10British cuisine has always been neglected in the gastronomic world, falling way behind French, Spanish and Italian counterparts in the rankings of European cuisine. I've never heard about people going to London for culinary journey, and I haven't seen any place in NYC that really shows what British cuisine is all about. That changed recently when acclaimed English chef Jason Atherton formed a partnership with a famed restrauteur Stephen Starr to open The Clocktower inside the chic Edition hotel. I was overall very pleased with the dining experience on a recent Friday night. There is nothing fussy about the food at The Clocktower. They seem somewhat predictable if you just skim through the menu. The level of execution and balance of flavor and texture of most dishes, however, were on a very high level. I could eat lobster with shaved fennel, mussel and apple salad every day for my meal. Lobster was perfectly cooked with crunchy texture to my delight, and the unexpected combination with apple salad worked quite nicely. While I was expecting a bit more spice from North African spiced Colorado lamb, it still was a perfectly cooked lamb dish that wasn't overpowering in seasoning to my liking. Some dishes fell somewhat flat. I was puzzled why uni risotto with peekytoe crab tasted a bit on the sour side, and thought it would've been a perfect dish if not for that sour seasoning. Braised halibut was perfectly cooked and created intense flavor with pink peppercorn sauce. I did like the spicy kick from the sauce, but felt the seasoning could've still been toned down a bit. Both desserts that I tried, on the other hand, were marvelous. I've never had pistachio-flavored soufflé before, and the combination of the soufflé with chocolate ice cream was pure bliss, with silky smooth texture of warm soufflé working wonders with the cold sensation of ice cream. ""Strawberries and cream"" dessert that consisted of vanilla custard, olive oil cake and verjus sorbet was also quite delightful with its elegant flavor without being too sweet. The Clocktower is one of the hottest spots these days (not just for food but for its throwback-style décor that would make for a hip and pleasant dining experience), so make sure to book early. I loved the classy yet energetic vibe coming from the restaurant. The restaurant has full bar menu (with some creative cocktails coming from the bar area next to the dining space). The Clocktower is a welcome addition to the New York dining scene with its introduction to what sophisticated British cuisine would look like.",2,,
158,J C.,"New York, NY",156,25,54,5.0,1/5/2017,Wonderful setting for a long overdue catch up lunch. Love the cozy fireplace. Was a stark contrast to the gloomy weather outside. Very inviting. Beautiful red roses at every table and delicious crispy hot bread with amazing sea salt butter. The tartare was beautiful and tasted just as good. Burger was very decadent and chips were lovely and quite filling. Fish and chips may have been the unexpected star. Lightly breaded and fried and served on a gorgeous pea tendril mash. Service was great and I will be returning quite soon.,,,
159,Nomad M.,"New York, NY",125,291,1096,4.0,6/9/2015,"It is amazing all around, from services, decor to food.Why it is not 5 stars? creativity.Came here on a Monday night and the bar is bustling. Very good sign. A mix crowd from out-of-towners staying at the Eition Hotel to finance guys working in the hood. Dining room is gorgeous. Main dinning room has enormous Victorian-style fireplaces and walls covered with 500 black and white photos of the city and iconic New Yorkers. It is perfect setup for a first date or a business dinner. To start, I went with the American Cereal Killer. An innocent looking drink with a deadly punch! Made of Mitcher's whiskey.\, cheerios milk, Madagascan vanilla syrup , angostura bitter, served in a cute milk carton. It is easy to sip at first and potent after taste. Not a girly drink and I love it! Onto the food. We got the uni risotto with peekytoe crab, bottarga and zesty yuzu peel. It is creamy and savory , the citrus flavor from yuzu really stands out and a good contrast. But somehow not as harmonious as I hope. Prob better decorated with nori instead?Come along the risotto, roasted diver scallops, ragout of line caught squid, crepe , bacon in celery root purée. It is savory tho a tad too salty to my taste. The scallops are perfectly cooked, soft and juicy.Again, not bottom-shaking but it is well executed. Fave tonight! Long Island duck, sauce l'orange with fennel, endive and salt baked turnips . It is amazing. The bird is cooked medium rare while the skin is crisp, the muscle is juicy and scrumptious. The sauce is fragrant and just the right sweetness and consistency. The turnips are the best part which soaked up the #duck juice and sauce. Beautiful presentation. Service is attentive and each dish was introduced in details. That's what fine dining should be.Considering my office is close by, I will stop by every now and then, even just for drinks.",3,1,2
160,Ben D.,"South Orange, NJ",74,203,1310,5.0,7/18/2015,"Fantastic food in a sophisticated setting.  The 'cold fashioned' bourbon cocktail eases you into this place and gets you ready. Food wise, the steak tartare topped with roasted bone marrow is a great way to start.  And the dry aged burger topped with cheese, pickles, onion and Churchill sauce is the ultimate adult Big Mac.",1,1,1
161,Lenny H.,"New York, NY",12,25,210,5.0,5/16/2015,"Came on the opening night.  Ambience, service and food are all amazing.  The cocktails are creative,  nice and more importantly, taste great.  We were seated in the American Room.  Started with the American Cereal Killer cocktail which is Bullet Burbon and milk and Give Peas A Chance cocktail.Starters were Steak Tartare...probably one of the best I have had in a long time and Uni Risotto. Main was Pork Belly and Bone Marrow as well as Cornish Fish Stew. We will definitely return!",4,1,1
162,Roni J.,"Manhattan, NY",60,92,201,3.0,7/19/2016,"This is a restaurant that makes you feel cool and in the know but also a little foolish for liking it's silly gimmicks and paying ridiculous prices for certain dishes/drinks. You walk in to the lobby area with music pulsating from the  multiple dining rooms and bar areas.  The host/hostess were very chic but friendly and we were seated quickly.  I ordered the the gin cured salmon and filet mignon.  The salmon was an unexpected, 2 inch high mini block (I'm used to sliced) and was paired with an iced tea.  The salmon cut beautifully- almost like a terrine or foi gras but the texture was mealy and off- putting.  In addition the flavor was two mild (apparently gin curing doesn't add a whole lot of flavor) and some fishiness came through.  The tea was refreshing and a great palate cleanser but otherwise didn't add much.The filet mignon was cooked perfectly and was wonderfully tender but was served on a wooden board next to an empty dinner plate (with a skull design).  What was the point?  I moved the meat onto my plate and they took the board away.  My partner ordered the chicken Kiev that was brought table side in a wooden drawer.  The server opened the drawer and took out the piece of chicken.  Is this some historical reference or a warming technique?  Kind of perplexing and cool but then we wondered what the point of this was, other than some indulgent showmanship.  We order the dessert for 2- a tartartine for $25.  It was very tasty but $25 for an apple dessert?  The other desserts were all$15.  Our check was almost $400 for 2 people with 2 courses each, a shared dessert and a couple of drinks.  The service was pretty good and mostly consistent.I will go back but will walk, not run.",1,,
163,Cindy S.,"Manhattan, NY",0,3,0,5.0,12/25/2017,"The atmosphere, food, service and wine were all amazing.  It was such a great dining experience.  Everyone was so knowledgeable and generous with their time.  You can not help but have an amazing meal.  We did not feel rushed and every recommendation was better than the next.  Go hungry so you have room for it all- apps, entree and dessert!  I'll be back soon for sure!",,,
164,Dan B.,"Manhattan, NY",610,475,311,5.0,7/8/2015,Came by here for happy hour with my fiancé.  The place smells like someone overdosed on Jo Malone oil diffusers and I love it.  The crowd is trendy and well polished so to speak. I grabbed a couch near the fireplace that fits two and ordered a few cocktails. She had the rose wine and I had a cocktail that had ginger but I cant remember the name.  I will definitely be returning back here to try the restaurant out.,1,,
165,Ira A.,"Boca Raton, FL",0,14,0,3.0,1/1/2018,"I've heard a lot about this restaurant so I tried it for dinner with a client.  Maybe I'm missing something, but I am not sure what the fuss is all about ... The food was good, the service efficient and friendly in a NY sort of way. The menu is interesting but sort of all over the place. But the restaurant was crowded and very noisy. For the price I've had much better in NYC.",,,
166,Lisa C.,"New York, NY",236,268,129,4.0,8/31/2015,"My friend surprised me by taking me here for my birthday dinner. I've secretly been wanting to come here for brunch so brownie points for him for picking this place. Let me start off with the decor: This lovely restaurant is located in the Edition hotel on the 2nd floor. I love restaurants that have that dark, woody atmosphere-such a mysterious vibe. They have several rooms all named after different colors- or so my dinner companion informed me. Not sure if it's true since I didn't go exploring. Now onto the food- we started with the scallops and the steak tartar. His scallops were really yummy, I wish I'd gotten it. The tartar to me was so so. I've definitely had better. He got a gigantic roast for his entree and I stuck with the salmon. Both had good flavors. He noticed that the chef left off the mashed potatoes from his dish. The waiter took care of that and gave him a separate side of mashed potatoes. We shared the apple tart for dessert. It was HUGE. I wish it came with a larger ice cream portion though. I'm definitely coming back here for brunch though. It's what I've been craving for this entire time.",,,
167,Amanda M.,"Bronx, NY",109,82,6,5.0,2/6/2017,"I absolutely love this restaurant! The decor is so chic and cool, the service was excellent and the food was fantastic. The flavors they pair together on the menu seems crazy at first, but it comes out delicious. And their sticky toffee pudding was the best I ever had. I'm also in love with one of their special cocktails, Los Pollos Hermanos - Gus would be so proud.",3,,1
168,Sheila C.,"Manhattan, NY",143,211,44,5.0,4/5/2016,"FIVE STARS FOR THE BREAD.My favorite thing is when a restaurant has really solid bread for the table.It's a whole wheat sourdough that comes warm (ours was actually PIPING hot) with a side of butter.  Not only is it plenty for two people, they asked use TWICE if we wanted more bread.  Crazy self control on my part that I denied it twice.  If they asked one more time I might have said yes.  I had the chicken kiev which is I think fried with panko on the outside.  (It doesn't take like a greasy fried chicken though)  When you cut open the chicken buttery juice come pouring out...not sure if they stick a chunk of butter in there before frying but it is seriously decadent.  I can't even remember the sides that were on my dish, but I cleaned my plate, didn't leave a single thing behind.My boyfriend had an equally pleasing experience with his choice which was a the halibut.  Halibut is one of our favorite fish and it's hard to find in NY so he had to get it.  His came with some sort of carrot puree?  and some other delicious veggies.  There was nothing left on his plate either.  He did leave some mushrooms behind that I was more than happy to take for him.Dessert looked amazing but just couldn't possibly do it.  I secretly knew they would give us cookie with our check so I was looking forward to that. There were two buttery shortbreads, some brittle and some sort of caramel.....We had everything and left a couple tiny pieces of brittle behind.  It was a pleasant palete pleaser! NOTE: we tried making reservations on open table and they only had an opening for 8:30-9PM on a Sunday but were able to get in at 7-7:30 by calling them.  They tried to make it sound like it was be difficult but we were seating in one of the rooms with only one other table taken.",3,1,1
