,er_name,er_location,er_freinds,er_reviews,er_photos,er_rating,er_date,er_text,er_useful,er_funny,er_cool
35,Nargus H.,"Manhattan, NY",0,5,1,5.0,4/8/2018,"I have lived in NYC for 12 years. I spent 7 years in Hell's Kitchen and my go to bar was Lansdowne Road. When I moved to UWS I had to find a place to fill the void and, let's be honest, West End Hall trumps anything LR ever was (sorry, Lansdowne). This bar is as amazing as it gets and most of that is attributable to its manager and the staff he manages. The music, food, drinks, staff, and entire set-up are great. I usually go there Sundays, specifically for the 90s rock/alt/grunge playlist (it is phenom), and occasionally on Fridays and have never been let down!!!",1,,
36,Denisa R.,"New York, NY",968,596,357,4.0,7/13/2017,"I had no idea there was a beer garden hidden away near Columbia University.I came here recently to meet a friend for happy hour and I took advantage of the special pricing. They had a nice selection of beers and they had a lovely grapefruit beer, which I really enjoyed. My friend and I enjoyed our drinks in their outdoors area where there are a few tables and games available to patrons. The only downside is, if you are sitting in the back, you have to go back to the bar each time to order your drinks.Would I go back? Absolutely!",5,,4
37,Sherwin G.,"Manhattan, New York, NY",11,2,0,4.0,6/6/2018,Kinda waiting for a moment but the bartender took care of me brought water that really help without me asking so really good service from Jr,,,
38,Zoid V.,"Brooklyn, NY",156,35,5,1.0,7/25/2017,Just now the 2 beverages I ordered:1.  Beer tasted like vinegarThey drained the whole thing once they confirmed it was indeed sour. 2. Beer was flat. Confirmed. And after 5 minutes of ignoring me I left. Could have been an excellent bar considering its location.  Also what's up with the obviously underage girls?,1,,
39,Lauren C.,"Manhattan, New York, NY",185,64,62,1.0,"12/12/2017
            





Updated review","I used to really enjoy this place. Their prices have spiked so I haven't been much in the last couple months. Saw an Instagram promoting their half off tacos for Tuesday. Walked in and sat down, asked the waitress (who previously ignored me when I tried to get her attention TWICE and we sat there for 15 mins waiting for water / menus) and she scoffed at me and said I was at the wrong place. Showed her the post and she asked one other worker who said ""I don't know"" and she turned around and said it was next Tuesday... but it's posted every Tuesday on instagram. She came back once throughout the whole night despite me trying to get her attention and was consistently rude. Got nachos to split with a friend and they were all burned around the entire plate.",2,,
40,Matt C.,"Williamsburg, NY",0,5,0,5.0,5/1/2018,"I live in the area and this is one of my favorite spots to grab a burger and a beer.  The food is good, they have 20 beers on tap, and a lovely beer garden in the back.",,,
41,Cyrus P.,"New York, NY",841,876,530,4.0,1/10/2017,Fan. Golden-fried and super crispy tater tots with sriracha mayo.Pulled pork won tons.Mad Elf beer. Winning.Good service at the bar. Nice vibe. Beautifully done.,,,2
42,Terrance C.,"Manhattan, NY",2,72,242,1.0,1/25/2017,"I wanted to try a new place in my area, I was here back in August. I ordered a bacon cheddar cheeseburger and fries. They didn't have a good selection of beer, I drink cider. The food was expensive and not what is was made out to be. That burger should not cost more than $5. I do want to go back to try the wings. A couple was sitting across from me having some, I think I made a mistake. I love bacon cheddar cheeseburgers and When I want wings over a burger there is a problem. The place is actually nice and the decor is good.",,,
43,T. H.,"Riverdale, Bronx, NY",1,9,0,1.0,9/27/2018,"This place looks nice, me and my boyfriend came in excited to try it out. So we headed to the back to go outside and a waitress comes up behind us as we were WALKING (I just want to emphasize that because we were moving, not loitering taking up space, i was following his lead, walking down the hallway to go outside, normal stuff) anyways this waitress comes up behind us and literally says with the nastiest attitude ""YOU GUYS GOTTA MOVE"". For starters an excuse me would suffice. Also.. it was a Thursday at 6pm the place was not at ALL crowded, she was walking around stressed like she was a bartender at the 40/40 club on a Friday. Clearly she needs some training if she's that flustered to serve three tables. We looked around outside after that, and she glared at us multiple times outside... then back inside as we were leaving... not quite sure who peed in her orange juice this morning but an attitude like that will ruin a beautiful business. We didn't even bother getting a table and spending our money, I would never pay to get that treatment.",,,
44,Seref H.,"Manhattan, New York, NY",0,1,0,5.0,4/9/2018,"I've been coming here for sometime now and have always enjoyed the vibe and drinks, especially on Sundays when there is a solid roll of 90's rock playing. I felt compelled to write a review after a recent visit. The staff are always accommodating, the manager is AMAZING, and the energy is always good.Recently, a disgruntled gaggle of 40 something year old parents decided to bring a small wagon-load of children to a bar for lunch and began complaining about service and music volume. The foppery of this sad group (kids excluded) was screaming out in testament of what had likely been weeks of apartment imprisonment being taken out on the venue's staff. West End, keep doing your thing, we'll keep coming back. Peeps with kids, please join but don't ruin the vibe, it's a BAR.",,,
45,James D.,"Manhattan, NY",1,39,0,3.0,4/25/2018,It's ok. Sometimes the music drowns  out the conversation. And sometimes the bartenders are preoccupied with whatever to give you a second look.  But during off hours it is worth a visit.,,,
46,Carmen W.,"New York, NY",126,220,179,2.0,9/9/2016,Food is meh. Burgers are dry and fries are soggy. I've gone here twice and both times the burgers are super dry and super salty.,6,5,5
47,Dominek T.,"New York, NY",537,331,539,3.0,9/10/2015,"So we were meeting a friend on the UWS and she recommended we try this beer garden establishment.  Our friend told us this was restaurant or underneath new management .   From the outside it has a very inviting appearance.  Very open space, community tables, and outdoor seating.  We were able to seat ourselves and selected the outdoor table and it was only three of us including myself.  It took a while for someone to acknowledge or even bring us water.  But I assumed it was because they allow people to seat themselves.  Once our server came over to us he realized we didn't have water he pretty much passed the buck and let us know someone forgot to do their job.  We ordered drinks and one thing I did LOVE is that they have my fav grapefruit beer and he recommended doing a vodka bomb with it.  WHICH I LOVED and had three of them during the duration of the time being there.  We also ordered food as well.  I ordered the quesadilla which was decent but the guac it came with is what sold me on it.   My friend order the burger and she said she enjoyed it but nothing special.  Our server wasn't super knowledgeable about the menu but tried to play it off like they change the menu alot.So you are probably saying why would I only give this place 3 stars?????Well our server pretty much disappeared after a certain time and we always had someone NEW at our table like every 10-15 minute clearing our table. Like literally every 10-15 mins.  I almost felt like we were being rushed out  Like someone would come over and take like one or two items at a time.  New servers were at our table and I almost thought our server must have left for the day.  I think they need to work on communicating among their staff a tad bit moreI am going to give this place one more try in hopes that the service is better next time....maybe.",3,2,2
48,Greg C.,"Atlanta, GA",356,94,153,5.0,4/27/2017,"West End Hall is one of the best places to go to in the UWS now that the weather is getting warmer. Their spacious beer garden and great happy hour deals (draft beers and appetizers) make for an ideal place to go after work or classes. I was also pleasantly surprised that they have such a nice selection of happy hour beers. I was able to get two draft beers, one order of beef sliders (2 burgers), and an order of tater tots for $20. Overall, extremely affordable and awesome place to enjoy the weather with friends.",1,1,1
49,Lucy C.,"New York, NY",120,101,23,5.0,12/29/2017,"I was here last week meeting up with an old college friend of mine and this place was really nice and cozy. It has a biergarten in the back and has the same vibe inside as well. It is a nice place for a group outing as they have huge benches that are great for even 20 people or more. They have speciality beers and their pitches are old school style. I had their chicken sliders that are on the appetizer and it was so good. The beer, atmosphere, and service was great and the place was clean. This is a great place to check out in the Upper West Side. Will definitely come back and maybe try their burgers and donuts!",,,
50,French Foodie P.,"Manhattan, NY",1,58,175,4.0,8/12/2017,Excellent food. Excellent service. Cool relaxed vibe. Great presentation for food. Everything tastes fresh and cooked to order. Burger was juicy. Hand cut fries crispy to perfection. Draft beer recommended by bartender was delicious and cold. Very happy. Will be back.,,,
51,Em G.,"New York, NY",12,38,0,3.0,"4/17/2017
            





Updated review","Pros: It's my local. It's got a pretty decent beer selection. It's showing the Stanley Cup playoffs. Cons: I always forget how fucking slow service is here. ""Please seat yourself,"" the sign says, so I did, and eighteen minutes later nobody's been by to give me a menu. I mean, they're always nice and cheerful, and it's Monday night, but com on. It's not even half-full right now.",1,,1
52,JJ G.,"New York, NY",10,24,1,3.0,1/7/2018,"Pros:+ Good beer+ Big TV's+ Big Tables/Benches+ Board gamesCons:- NO HEAT / Heat not sufficient as of 1/7- Food menu is small- Service is slow at times (they are apologetic when it is)There's not many good sports bars in the area and this one has potential, but I can't help but to expect more out of this place.",,,
53,Maryann J.,"Manhattan, NY",0,15,0,1.0,11/3/2017,"Not the Happy Hour you would expect. Consider this one the UNHappyHour!! Terrible service, inexperienced bartenders and so so food. Brought some family for Happy Hour and a bite to eat. Had to flag down the bartender to order drinks, ordered food but they lost the first order, had to order again. We were going to stay and order more drinks and food but could not get the bartenders attention as they stand together at the far end of the bar talking amongst themselves. There are so many other places in the neighborhood with better service, food and drinks. This is one to avoid.",1,,
54,Leonard L.,"TriBeCa, Manhattan, NY",759,1415,4087,3.0,9/11/2015,"West End HallNY: Manhattan Valley2pm Sunday 7th September 2015Three StarsThis was the 2nd Official stop on the Ben's Bday Bash. The place was rather empty. We sat a picnic table for 8 people. The waiter took a while to greet us and get our drinks.  I had the refreshing Schöfferhofer Hefeweizen & Grapefruit non-beer.  It has a 2.5% ABV, a crisp fruit taste, sweet malty finish, and the perfect summer drink.  After downing this, I had the Brugse Zot, which is a Belgian Pale Ale with a heartier 6.00% ABV. It was hazy amber color with notes of lemon, spice, and low carbonation. We had some appetizers.  The Buffalo Cauliflower with Hot Sauce and Bleu Cheese sounded interesting but was very mediocre.  The Corn Fritters were crunchy and tasty.  The Loaded Fries were by far the best thing here. The freshly cut potatoes were fried to crispy perfection. Then they were loaded up with fresh tomatoes, spicy-ish Chorizo, creamy Queso Fresco, Sriracha, and a Sunny Side Up Egg. The combination was splendidly decadent. I ordered a Med-Rare Burger as well.  The bun was a generic but fluffy. The burger was cooked medium. It was juicy, fatty, and packed well.  The Thick Maple bacon was as sweet as advertised.  The shredded lettuce was delightful because it has this nostalgic Burger King feel to it.  Plus it captures more mayo within its folds.  The Tomato was wedge cut which was a novel but makes sense since the tomato was fresh on the softer side.  The red onions were thinly cut. The cheddar was super melted. The Burger was filling and good.Overall, I liked the place but the slower service and lack of value puts this place in the three star range.",,,1
55,Nate C.,"Manhattan, NY",12,211,7,5.0,7/16/2016,"Well heck I've been here 4 times now and they've all been great. Let's take a journey back in time and recount the experiences.1. Ate some tiny tacos for lunch downtown and was hungry by the time I got back uptown so I decided to have some wings. They were hefty and loaded with sauce, I respect that.2. Late night cocktails. Super chill vibes all around, great variety of drinks to choose from.3. Watched some of the home run derby, explored the beer list and demolished the bacon cheeseburger. Thick cut bacon and a juicy burger. Great selection of beer too.4. Brunch-got the huevos rancheros and sat in the garden area out back. Huevos were phenom and I hear the fish tacos are great too. The garden looks like a fun place to hang out at night too. I can confidently say this place in consistently good across the board.",,1,
56,Daphnée H.,"East Meadow, NY",3,56,70,4.0,10/19/2017,It was my first time. Went we a few coworkers. The place is clean. I like the open atmosphere. We ordered from the happy our menu. Food was good. We had the wings and burgers and chicken sliders. I will definitely return. It's a great spot to hang out after work for light meal and drinks.,,,
57,Kimberly R.,"Manhattan, NY",75,12,12,4.0,9/3/2017,"Great after work place, especially during the warm weather days. The beer garden out back is such a awesome surprise. Happy Hour specials are cheap!! Totally recommend.",,1,
58,Diana N.,"Saint Louis, MO",37,34,0,2.0,4/25/2018,Very average place; service was sub par - I was lectured multiple times by the server that the checks were split. Server failed to check on us (and we were a large crowd) and take orders despite not being occupied with anything else. Main reason to go there is affordability.,,,
59,Joshua B.,"Brooklyn, NY",2,37,1,2.0,10/7/2017,"Crap food, crap wings and over priced drinks - I wouldn't go here again, but gave it a chance in spite of former reviews.",,,
60,Julia B.,"San Francisco, CA",114,1,0,4.0,5/28/2018,Really great place to eat for a quick meal. Had the shrimp tacos and they were delicious!,,,
61,Nigel T.,"Brooklyn, NY",19,205,1,5.0,3/24/2017,I rarely find myself on the way upper west side these days. But I ducked into this place and was impressed by their beer selection. I got quite merry on some brew called Raging Bitch. This was ironic given the fact I used to live across the street with my ex wife.I had the wings and they were perfect. Highly recommend this place for a casual bite and pint.,,,
62,Crystal M.,"Soundview, Bronx, NY",0,30,29,3.0,10/16/2016,"Tried this place for the first time yesterday.  It was Ok.7 for decor. Really specious place, mid lighting.  6 for customer service. So u walk in and it's kinda confusing because they don't have a hostess. You're free for choose any table and grab your own menu on the way in. When we walked in we kinda stood there and a guy in the back said, sit anywhere u like. Which we did then I realized the menus were in a box by the door.  Ok so I go back and get them.... We were served water and told our waitress would b here shortly. Hmmm... She kinda took a long time and wasn't the most outgoing or friendly person. Either way she was effective10 for the food!!!! I had the south of the boarder burger. It was awesome.  Cooked to perfection. And the draft beer was a good compliment too.",,,
63,Al F.,"Bronx, NY",8,5,9,3.0,11/26/2017,"This is a good place to watch some sports with family and or friends. Only problem I would say is after ordering food and a drink, the waitress began to continuously ask if we wanted the check as I we had a time frame to enjoy our stay. Please fix this WEH",,,
64,Dan L.,"Stamford, CT",265,30,8,1.0,7/8/2017,I came here on a Saturday night in July with a lot of friends. The weather was beautiful and would have stayed longer. The bar in the garden wasn't open so we were forced to go inside to order food and drink. The indoor bar was very crowded and there was only one bar tender that wasn't very good at his job or friendly.,1,,
65,Carmen P.,"Jamaica, NY",0,15,2,3.0,9/4/2017,The food was ok. The sliders were not very good. The service was slow.  The waiter and waitress were indifferent and aloof. I will not be returning.,,,
66,Ally J.,"Brooklyn, NY",58,15,1,1.0,11/7/2016,"So...I went to West End Hall this week for a World Series viewing party.Not just any game. GAME 7 OF THE CUBS-INDIANS WORLD SERIES...possibly the most historic one in my lifetime...and the staff stopped serving drinks BEFORE the 9th inning.This was bad enough, but then a little after midnight, during one of the most exciting innings of all time (the game was tied in the 10th), the staff turned the lights up and tried to get us to leave. Wtf!! It wasn't like we were hanging around after the game. This was literally in the middle of the game!!Listen if you as a bar don't want to stay until the end of a World Series game, and provide drinks during it that's totally fine. But HOW ARE YOU GOING TO HOST A WORLD SERIES VIEWING AND THEN CUT OFF ALL SERVICE AND TRY TO GET US TO LEAVE MID-GAME?!The beer selection is pretty good. If the food had been great, I'd have thrown in an extra star, but unfortunately that was mediocre. I had a soggy burger and weird fries.Lame all around. Service was friendly but super slow too (as in it took them 20 minutes to bring me a beer glass.) You can do much better than this place.",3,,1
67,Ashante D.,"New York, NY",107,37,62,5.0,7/1/2017,"Very good happy hour, sweet and attentive staff and delicious food! Love the back yard area and the large sized games! Had loads of fun for a corporate event. Will definitely be back on my on accord to enjoy this place.",,,1
68,Daniel C.,"New York, NY",1,3,0,5.0,5/2/2017,"I was desperately searching for a place to have a special celebration recently on the UWS when I stumbled onto the West End Hall on yelp.  One phone call to Christina later and I was sold.  She could not have been more welcoming and helpful and instantly made arrangements for me to bring my group in this past Sunday (30 people, no small gathering).  The day of everything was ready ahead of time for us and service was outstanding. Every one in my group left full and tipsy and incredibly happy. We didn't even get to enjoy the garden since it was a bit cool but couldn't have asked for more from what was available inside. A wonderful time and I'm truly grateful. Can't wait to return!",2,1,
69,Kanika H.,"New York, NY",74,195,6,1.0,9/19/2016,"I made reservations for Sunday brunch with my meetup group.  The reservations and confirmation were easy peasy...My group begins to arrive for brunch, and this triology of hot mess occurs:- Firstly, we were told that West End Hall doesn't do separate checks, which is ridiculous considering the size of our group.  Some of us were paying with cards, others cash and since we were a meetup group, there would be people who would be arriving late/leaving early.  I asked if perhaps some of us can order at the bar so they can have their own tabs.  Their response: ""No, if you order at the bar, you have to eat at the bar.""  Only...at the end to find out that save two other guests and myself (who shared one tab because we were the first to arrive), they did separate checks for everyone else.  This was never communicated to me @ all.- The staff are the most clueless I've ever seen...every time I ask a question, even if it's a simplified inquiry (ie- ""Does this place have a hostess?  I didn't see one at the front door.""), I get a deer-in-headlight stare before they respond ""I don't know.  Let me ask my manager"" or a rather curt reply. Really now? -_-- The place is OVERRUN WITH LOUD, OBNOXIOUS CHILDREN!  They were so noisy that my group could barely carry a conversation.  If I wanted to be surrounded by that many kids, I'd dine @ Chuck E. Cheese or McDonald's...not a bloody beer garden!The food wasn't bad, as was the mimosas (which aren't bottomless, but still pretty inexpensive @ $5/pop).  But considering that one experience, I definitely would not come back here again, which is a shame because I wanted to try the truffle burger.",4,4,
70,Molly T.,"New York, NY",860,443,1415,4.0,8/15/2015,"When I heard that Five Lamps had closed, I wasn't upset in the slightest. Sub-par drinks, sub-par service, all together underwhelming. When I heard its reincarnation was a bright, lively beer hall, I was wary but couldn't keep my curiosity at bay. After visiting West End Hall on Friday, I can happily say that in this case, the second time's the charm.So I came here with a friend at around 8:30 on Friday. It was fairly full but still a decent amount of seating to choose from (you seat yourself here). This place does a great job with maximizing space--large tables and plenty of 'em. There's a friendly vibe here that I didn't get from Five Lamps. Light-washed wood, large, simplistic/industrial-looking light fixtures and communal drinking/dining style make this place wonderfully inviting.Because this place classifies itself as a beer hall, I might as well give a little synopsis of my beer drinking experience. I have to say, I was quite pleased with the menu. My experience may be different from that of many others though, because they currently have two Belgian triples on tap--which happens to be my favorite kind of beer. If that wasn't enough, they're also offering my favorite stout. I was happy to find that I hadn't tried either of the Belgian triples in my short time as a beer drinker, so I opted for the Tripel Karmeliet, which was full bodied without being too heavy. I will say that it took a questionably long time for us to receive our drinks, but it could have been worse.The fare here, as one would imagine, is upscale bar food. The entire menu looks so good that choosing what we wanted was a somewhat laborious process. We scanned and re-scanned the menu until we finally just decided that our hunger trumped our indecision....okay actually that was just my friend. I had to ask the waiter. I ended up ordering the fish tacos which were really really tasty. I don't think I was hungry enough to clean my plate, but I still did. Nothing particularly fancy about them--just grilled mahi mahi, some kind of slaw and chipotle mayo (one of the best food inventions to date--up there with bacon and every kind of cheese). But I'd absolutely recommend. My friend ordered one of their fancy schmancy hot dogs, which she scarfed down quickly as well--safe to say we were pleased. Lastly, we had an awesome waiter. He actually took a seat at our table to chat with us about beer, food, life, why bars close at 2am in other cities...you get the point. Other than our first round of drinks, everything was served and cleared efficiently. The UWS was desperate for a beer garden (the only place around the area with a comparable selection of beer is George Keeley's) and it finally got one!",8,4,5
71,Tener H.,"Yonkers, NY",192,124,143,5.0,9/12/2015,"Absolutely LOVED this place! Very random place for a beer hall, but apparently its where all the 20-30 year old on the upper upper west side congregate.Very large tables, there are tables on the sidewalk and a large courtyard in the back. Its very loud, but hey its a beer hall.They have happy hour Mon-Fri until 7pm. 5 beers are $5, and also their buffalo wings, buffalo cauliflower, meatballs, and pork wontons.1. Their buffalo wings were AWESOME. 5/5. they were very crispy and juicy and just the right amount of heat!2. The Buffalo cauliflowers were dissapointing. 2/5. they were breaded and there wasn't much buffalo sauce. Its just...if you're getting cauliflower as an app...it shouldn't be so fried, kinda defeats the purpose.3. The pork wontons were so so. 3/5. They were fried wonton skins with pulled pork, some bbq sauce and a slaw on top. I wish there was more sauce4. Thai Mussels -4/5. pretty good, The sizes of the mussels varied greatly. some of the mussels were large and juicy and some were tiny. The flavor was good, and the toasted crispy bread they paired it with was perfect5. Southwest burger. Very very juicy with great guacamole. The siesta fries were very crispy (at least double fried) with salsa. 6. The hungarian bratwurst was GREAT. really good value at $8. It also came with 2 sides we got to choose from and came in cute little jars. The pickled onions had great flavor7. Grapefruit beer. at 2.5% is perfect for girls who don't like beer. It was sweet and fruity, with just a hint of beer taste. loved it8. Palm beer. pale ale with a light flavor and very little bitterness.definitely will be back!!!!!",2,,
72,Daniel S.,"Manhattan, NY",4,28,0,2.0,11/18/2017,"The beer selection is reasonable, but there are places with better selection in the area. The food was... fine. The nachos were good. The chicken sliders and pretzel were abjectly terrible. The music was absurdly loud. The service was slow and generally shitty.",1,,
