,er_name,er_location,er_freinds,er_reviews,er_photos,er_rating,er_date,er_text,er_useful,er_funny,er_cool
149,Darlene M.,"St Petersburg, FL",5,5,0,5.0,4/23/2016,While in NYC had the pleasure of a new experience..an indoor and outdoor styled brewery with yummie foods! My fav was the maple crusted bacon on a stick...got to try the Buffalo cauliflower and the chicken lollipop which was also delicious! My friends had the chix burger and a hamburger which they too loved. Endless beer choices that apparently change daily and my favorite side bar was the free foosball table! I will be back to this little piece of heaven any time I am in the NYC...a must try!!!,,,
150,Erin H.,"Manhattan, NY",0,2,0,1.0,11/5/2016,"There is a lot to want to like about West End Hall - great beer selection (if it's stocked), a decent menu, a nice look, comfortable bar stools, big tvs, outdoor seating areas - however, each time we've come to this place the service has been a disaster, the food is just mediocre, and half of the beers are not available. This place is not worth your time.",1,,
151,Alyshia G.,"Manhattan, NY",0,6,0,2.0,8/23/2015,"My husband and I are on a constant search for a regular bar. We like going out for drinks in the neighborhood at least once a week, and once we find a place we like, we'll go in the winter, spring, summer and fall for years. When our favorite local place closed recently (Lura), we began our search yet again. We've tried a few places and haven't quite found the right combination of a place that's nice to look at, comfortable, not too loud or quiet,  friendly and with good drinks.West End Hall seemed like it might be a good option. The inside and outside are lovely, and at least now while the Columbia students are still away, the crowd seems pretty mellow and not too obnoxious. We ordered the delicious sounding Sweet Collaboration cocktail from the menu, because, tequila. It tasted fairly nice, but didn't seem to have any tequila. When we ordered a second round, we mentioned something and the waiter came back with drinks he assured us had double the tequila. When we went home, 4 drinks at $12 a pop later, we were still stone cold sober. Probably the wine and beer can't be diluted and are great- the list looks great- but don't order the cocktails if what you're looking for is a cocktail.",2,,
152,Ky T.,"Chicago, IL",0,4,0,5.0,11/21/2016,"Love this neighborhood beer hall- never crazy crowded, but fun vibe. Also, to top it off, great selection of board games and lifesize jenga on the patio!",,,1
153,Scott H.,"New York, NY",3,19,0,5.0,8/30/2015,"When I asked if they had a deck of cards, the manager said ""no, but I'll go get one."" He literally when to Duane Reade and got a deck of cards. Beer was awesome, service was awesome. Loved this place.",1,1,1
154,Derek W.,"Manhattan, NY",140,4,0,5.0,"4/28/2016
            





Updated review","Came in for my friend's birthday party last night and had a fun time! Giant Jenga is a must play here. Julie was our waitress, she was great and had no problem splitting the checks for us. Will be back!",,,
155,Christine P.,"Saint Petersburg, FL",0,1,0,5.0,4/27/2016,"Awesome place to hang out with good friends, enjoy a beer, and eat delicious food. Actually, right now, the buffalo cauliflower is calling my name, seeya internet!",,,
156,Jason L.,"Conshohocken, PA",9,3,0,1.0,8/30/2015,"Great beer and drink selection. Good food selection but small portions. Service was horrendous, prepare to wave down the servers for every time you need anything. They came by every 30 min.",1,,
157,Thomas W.,"Paris, France",1,1,0,1.0,7/20/2016,"Good experience, until the waiter lost my credit card on his way back to my table and swore it wasn't his fault (he even implied it was my fault). No sign of goodwill or any gesture from the manager either. Few days later I discovered that, without informing me or my consent, they tipped themselves, as I left without the check knowing that prior to that I've cancelled my credit card. Short message for the waiter: a customer found my card on the floor next to the payment device and contacted me. Definitely your fault mate.",1,1,
158,Matthew A.,"New York, NY",0,10,0,3.0,8/15/2015,"I'm a little split on the review of this restaurant. Starting with the positives, the food was pretty good. We had an assortment of different foods but I would say our favorite part was the mussels - you can't find them in many places around Columbia and they were excellent. I've seen a few reviews mentioning the burgers but if that's what you're looking for then  go four blocks north to Mel's burger bar. My biggest problem with west side hall was that we kept seeing cockroaches around the restaurant. Yes, they are open to the sidewalk but I have never seen cockroaches in any other restaurant regardless of their seating arrangement so it was pretty disturbing. It's also slightly worrying because this restaurants predecessor had problems with rats before.",1,,
159,Brooks C.,"Manhattan, NY",327,1,0,5.0,4/28/2016,"Came by with some friends for trivia night and had a really great time. The truffle fries are nuts good, and of course the beer is awesome. And then when I dropped by another night I got to try a few that were new to the rotation, which was cool too. I can't remember one of the servers' names I had, but the second one I remember was Julia. She was prompt and friendly - that kind of restaurant experience where it's kind of like, they always show up right when you need them. Overall - all about it!",,,
160,Kelsey H.,"New York, NY",134,41,0,2.0,7/23/2015,"I was eager to try West End Hall since it opened a few weeks ago. Unfortunately, I left disappointed. I expected a vibe similar to Bernheim and Schwartz up the street. West End hall, however, was much louder, with over 5 TVs placed closely together. I struggled to hear my partner across the (communal) table. Look, I don't like communal tables-never have, probably never will. I particularly hated West End Hall's tables because rather than at least give diners individual seats, they have wooden benches to share. Do you know how hard it is to get up from a bench when wearing a dress/skirt? I sadly now do. On the night my partner and I had dinner, they had no hostess on staff. A server told us to seat at a middle table, but didn't walk us there or provide menus. Eventually, we requested menus from a busy bus boy who only gave us one to share (I will say that the bus boys/food runners were really buzzing around, and this is not exactly ""their job""). After that, service only went downhill.  It took around 15 minutes for a server to come over to us and take our order, who then explained that she thought someone else had already come over. Whatever. I was too hungry to leave at this point and just wanted some food. Because my boyfriend was still full from his late lunch, we chose to only share an order of sliders and the crab and corn fritters, with the option to order more food later if needed. Each dish was $14-while I think this is a little steep for 3 sliders, it was actually insulting for 5 small fritters. Our server never came back except to clear plates when we were finished. The food was fine. The sliders were solid sliders, but had no special standout--the cheese was tasteless, the patty didn't burst with flavor, and I don't think there was any interesting sauce (if there was, it failed to do its job). Although I was still hungry after finishing up, I chose to leave rather than give West End Hall more of my money. I've had off nights at Bernheim and Schwartz too, but their food (and service) is decidedly better (try B&S's fried pickles! So good!)",1,,
161,Rachel R.,"Manhattan, NY",111,166,11,5.0,6/15/2015,"Was very disappointed to find out that Five Lamps Tavern had closed. I knew something was going in to replace it, but I wasn't sure what to expect. The night this place opened, I went with my roommate to grab some drinks and test it out. We had such a good time! It looks very similar to Five Lamps but the decor is a little more updated - looks more like a beer hall, which according to our waitress is what they were going for! That brings me to our waitress - she was awesome! So friendly. She mentioned they would be offering outdoor seating come July. They also have a beer garden out back! I'm a big cider drinker and they only had one option - Unoriginal, but it was fantastic! Can't wait to come back here... Seek it out if you haven't already!",1,,
162,Vicki S.,"Atlantic Highlands, NJ",1,31,1,4.0,11/14/2015,Had a great mini-reunion of friends there recently. The service was fast and friendly and the prices for wine and beer were reasonable and there was a good selection. Loved the Buffalo Cauliflower appetizer.  Look forward also to summer and sitting out the garden.,,,
163,Jessica N.,"Upper East Side, Manhattan, NY",0,5,0,5.0,6/23/2015,"Met some friends here for dinner and drinks last Thursday night and I will definitely be back! Awesome beer selection, delicious food, attentive staff and all around great atmosphere. We sat inside, but next time I will definitely take advantage of their patio. I highly recommend the truffle burger, the schnitzel, and the green bean cocktail. I am looking forward to sampling more of their menu on my next visit! Great place for groups and/or dates. I can't wait to check out what else this place has to offer!",1,,
164,Nelson M.,"Manhattan, NY",50,1,0,3.0,6/20/2015,"After a long day of work on Friday ,June 19,2015. I decided to go have a late dinner at the last minute at West End Hall. The place looks so Cool. They have done a good job. I sat at the bar and the bartender name Greg took my order. My drink was a Radeberger Pilsne 16OZ and I decided to have the Grilled chicken dish.The place was not too crowed . After 20 minutes  I ask the bartender where is my food. He went to check and told me that just wait 2 more minutes when those 2 minutes became another 15 minutes when my food Finally arrived. Very disappointed with the waiting time for my food.They Apologize for the inconvenience and  the beer was in the house when I got my bill .Its a Cool place to hang out with your friends.They also did a good job with the beer garden too. I will give them another chance but this time I am not sitting at the bar.",,1,
165,Miguel E.,"New York, NY",9,7,2,5.0,8/26/2015,"Food is great! Beer selection is also amazing, be sure to ask for bottled beer menu as well. Soon as you walk into the place the ambiance is great, cool, calm and chilled. Waitresses are extremely friendly. Did I mention their food is great? Be sure to try their Thai Mussels! Wonderful experiences and will definitely visit often...",,,
166,Dolly V.,"Manhattan, NY",12,65,2,2.0,8/2/2015,"The decor is nice however, the food was not good.  Do not get the mussels, after the fifth bite of sand I gave up and stopped eating.  Most of them didn't even look open.  Their fried cauliflower app. as well as chorizo with a fried egg on time sounded good however, it was just plain and greasy.",,,
167,Maria S.,"Manhattan, NY",264,2,1,3.0,11/27/2016,"I do come here regularly, as I live in the neighborhood. Three stars for food and drinks hands down. It is always consistent and never disappoints. Fish and shrimp tacos will forever be my favorite on the menu. The missing stars goes for service. Unfortunately, every single time I go I always know I will be waiting at the end for the bill or for someone to swing by the table - 10 + min sometimes. In the end I resort to going up to the bar to finalize the bill. Other than slow service it is a great casual atmosphere.",,,
168,Brittany M.,"Manhattan, NY",0,2,0,3.0,9/5/2015,"My husband is a beer enthusiast. We'd been to West End Hall for beers and ordered some fries since we had already had dinner. Great beer selection, prices (for beer) reasonable and good fries. So we thought we'd try it for dinner one night...bad idea. $45 for 1 beer, 1 soda, 1 quesadilla with pulled pork ($16!!) in mini version, 1 sausage and order of fries. Everything was incredibly good except we left still hungry and stopped to get a slice of pizza on the way home.The staff is great - friendly and attentive. Although, no one there seemed to have any knowledge of college football. I would def good back and bring friends but just for brews and grab an app. Then go get a real dinner some where else.",,,
169,deirdre s.,"New York, NY",120,19,3,1.0,1/29/2017,"We LOVED this restaurant when it first opened. But now we will never eat their food again. We ordered takeout through Seamless last night, and our meals were inedible.  The fish tacos were made with spoiled mahi-mahi. The chef doused them in salt and lemon to hide the rancid taste and smell.  My husband's burger, which was supposed to be well done came bloody and half cooked. The Ceasar salad also tasted off. We asked for a refund from Seamless, but the restaurant denied our request. We tried calling the restaurant, but no one picked up the phone. We feel ripped off. We were great customers who have left great reviews for this restaurant in the past!  I went to seamless and added up how much we spent at this restaurant over the last year, and the number is in the high hundreds. NEVER again West End Hall! We are telling everyone we know not to eat at your restaurant. Heck, I am so mad I plan on hanging signs all over the neighborhood!",1,,
170,Seth G.,"Manhattan, NY",197,34,0,3.0,"9/30/2015
            





Updated review","Now that they have a happy hour, it's a much better deal. The outdoor garden is one of the nicest in the area.",,,
171,Tiffany M.,"Manhattan, NY",4,66,0,4.0,7/14/2015,"Good happy hour, yummy fries! Beer was delicious as well. Thought the kielbase was a tad bit overpriced for the size and no side. Nice new establishment with outdoor space.",,,
172,tim c.,"San Diego, CA",34,3,0,5.0,7/30/2015,"Fabulous place, really delicious food, and great service. Beautiful garden outside, lovely contrast to the bar atmosphere...this place you can eat outside or inside and have a good time",,,
173,Deb M.,"Monroe, CT",0,11,8,5.0,10/6/2016,"We visited our daughter and her husband on the UWS and we took the family to this beer hall after checking Yelp. We didn't go outside to the beer garden, but stayed inside.  Great beer choices and typical bar food.  We had the big pretzel, nachos, sliders, fries and bacon cheeseburger, all satisfying.  Prices are average for NYC but it's a very comfortable place.  Accommodating to families with kids (before 9 PM) Very clean bathrooms downstairs.  Parties of 6 or more are given their check with a Service Charge.  It's stated on their menus, so no surprises.  We had fantastic, responsive service from our waitress.  A foosball table entertained the kids.  We purchased a Yelp deal, but there was some confusion on how it was dealt with.  Yelp and West End Hall made good.  We are looking forward to going back when we visit UWS again.",,,
174,Pan D.,"Manhattan, NY",0,63,0,4.0,9/27/2015,"Very impressed with this place. Excellent management, great service, yummy food. Board games are available, which is on point. Awesome overall chill spot for game day or game night.",,,
175,Keith S.,"New York, NY",50,7,0,3.0,8/4/2015,A little disappointing.  The burger was over cooked and under truffeled.  The fries were a bit soggy and also under tuffeled.  That's not what you want for a $17 burger and fries.  The atmosphere is nice so hopefully they will get the food right.,,,
176,A J.,"New York, NY",2,22,0,3.0,8/1/2015,It's a nice addition to the neighborhood but service is slow and they kept running out of the good beers on tap.,,,
177,Christopher F.,"Manhattan, NY",0,6,1,2.0,9/19/2015,"Avoid the Groupon! My husband and I had a Groupon for $60 worth of food and drink. The fine print said the drinks had to be $7 or less. Surprise #1: the menu had exactly one drink less than $7. Surprise #2: that drink, normally $6.50, was on the Happy Hour special for the evening, so it was ineligible for the Groupon for that particular night since Happy Hour drinks were also verboten. So, we could not use the Groupon for any drinks.So, we had to order a lot of food. The $14 corn fritters: a rip-off. Five small fritters, tasted like they came from a freezer. Cheese fries: soggy. $11 German pretzel: delicious. Pork Sliders: meh. Hungarian sausage: pretty good.The beer, especially the chocolate egg cream one, was stellar. The good news: the neighborhood has no place like this. If you go all the way to the back, there's a hidden outdoor German beer garden with big umbrellas and communal tables-- a really cool space. The bad news: terrible service. Our meal took three hours, with five different waiters rotating around and frequently bringing us other people's drinks and food while rarely refilling our water. They were pleasant but frazzled and confused. When the bill came, it had food on it we hadn't ordered or eaten and they hadn't taken off the Groupon. They were nice about straightening out the bill.If we go back, we'll just have a beer and a pretzel and will make sure we have a lot of time to spare... and no Groupon.",,,
178,Shona M.,"San Francisco, CA",0,5,0,5.0,8/29/2015,"Amazing service, delicious food and a great selection of beers. Found this place completely by chance while walking around the UWS and sat down as they have a nice outdoor area, the staff was helpful and super friendly, they served us food even though the kitchen was about to close, and it was fantastic. The mussels were fresh and their sauce was fragrant and creamy, the burger was cooked to perfection, and the fries were chunky and flavourful. Highly recommend!",,,
179,Coleman H.,"Manhattan, NY",0,3,0,1.0,2/17/2016,"Came here for the late night happy hour- made it the best place in town, but they stopped the late night happy hour.  Lost my business in this area, sadly",,1,
180,Brett C.,"Manhattan, NY",0,15,1,1.0,8/13/2016,"Wow.  Never again.  I live in the neighborhood and had been to this place about two dozen times.  The food and beer selection are great.  Service has always been a little touch and go.  So today I was enjoying brunch when a child's bday party started. Fine, it's the UWS, people have kids and their bday parties at restaurants.  But then the kids' entertainment started, which consisted of drums and tambourines and made the place awful for everyone else there.  Have a big party, make your money.  Ok, I'm really fine about that.  When you're pushing the tables aside for some children's bizzaro drum circle and ruining the brunch of everyone else (a bunch of people left the bar when this started), you're dead to me.",,,
181,Ted L.,"Manhattan, NY",0,16,0,3.0,6/19/2016,"Good list of beers, good atmosphere, good bar food.  The only problem?  They really, REALLY need to step up the service.  It's almost impossible to get anyone's attention when you want to order something.  If they take care of that, I'll most certainly go more often.",,,
182,Gabriela B.,"Manhattan, NY",4,18,4,2.0,8/8/2015,"The environment is nice, with outdoor sitting and a beer garden, but the food is just really dissapointing, both in quality and in quantity, and very much overpriced. I've been there twice and am certainly never going again.",,,
183,When K.,"Manhattan, NY",0,8,0,3.0,8/7/2015,"While we didn't love this, we'll definitely be back to give it another shot. I've read a lot of dissatisfied customers in regards to Five Lamps, but I always thought the place was okay and in a great location. So when West End opened I was happy to see the location re-utilized with a beautiful new interior.The beer garden out back is definitely a selling point, and the menu has some really yummy options. Unfortunately, the outdoor seating up front closes really early (rumor has it noise complaints sunk Five Lamps, so I wonder if these things are related).We had the food here for brunch, and everything was just okay. The Sriracha fries with the egg on top actually had what looked to be pico de gallo on top, which was pretty flavorless and made everything soggy. The drinks were pretty light on the alcohol and as I've read in other reviews, service was really, really slow even though we were one of only three tables for the majority of brunch (we got there early, right at 11).But the cauliflower app and the truffle burger and fries was really tasty, and because we didn't get a chance to sample the full beer menu we'll be back to give it another shot. This restaurant is really new, so I hope it has a chance to work out all the kinks. And add Sriracha to their Sriracha fries!",,,
184,Joseph R.,"Englewood, NJ",1,11,2,5.0,7/6/2015,"Ok, Munich meets New York.  Octoberfest in July!  Over 100 different beers, authentic beer garden in the middle of NYC AND sausage from around the world!  Really?  Are you freakin kidding me?  I think I've died and found heaven.  Seriously a very cool place with a great vibe.  Big screen for sporting events, and friendly, attentive service.  A ""go to"" place.",,,
185,Jake M.,"Brooklyn, NY",0,6,0,1.0,11/7/2015,"I've been three times and every time the beers get more expensive and the service gets worse. $10 for 12 oz pours of mediocre beers have become the norm. Last night will be the last time I go. Waited over an hour for just wings and it wasn't even that busy. Waiter blamed the kitchen when he clearly forgot to put the order in. Nothing was comped. Looks like people are catching on to this failure of an ""beer hall."" I'll be happy to see it go out of business in 2016.",1,,
186,Betsy F.,"Manhattan, NY",0,18,0,2.0,2/9/2017,"It is a pleasant space with communal and smaller tables. If you go for the first time, you don't know you seat yourself and have to get your own menu. You also don't know you have to flag down a waiter or waitress every single time. My husband went to the bar finally to order drinks, which sent the waitress running to our table. When our drinks came, we said we would like to order. So the bar hop takes our order without writing it down. I knew we were in trouble. I had clearly said, ""Caesar salad to start"" but it came with the burgers. I said we didn't want it with dinner and they were gracious about taking it away and crediting us. We had to flag the waitress for each beer order and for the check. The burgers were fine. Nothing special and not close to how good Toast burgers were before they suddenly closed recently. Other customers looked pretty happy, but frankly we wished we had gone to the Abbey Pub where they actually look happy you have come. We may give it another try to see if this was just a bad night but everything needs to be better.",,,
187,J L.,"New York, NY",0,6,0,1.0,9/6/2015,So bad. The food and service was awful. Not much more to say. Very disappointing. Go for the beer but nothing else. Even the cheesy pretzel was awful- how could you mess that up? I've had better food at TGIFriday's.,1,,
188,Paige P.,"Elmont, NY",0,3,1,5.0,4/24/2016,"I've been to west end hall a few times and it's a great experience over all. My server Julia was extremely knowledgeable of all of the beers that are constantly changing which if I do say so is any beer geek's dream. On top of the impressive beer selection the food is amazing. If you know what's good for you, you'll get the buffalo cauliflower",,,
189,S K.,"Bronx, NY",0,4,0,5.0,9/15/2015,"Had a great time here! I sat at the bar and Dan had really good recommendations. 1. The truffle burger was SPOT ON! 2. The beer selection is outstanding! Chocolate Egg Cream Stout and the Baha Hoodie were sooo good. I am so happy there is a rotating craft beer bar in the neighborhood. In the middle of the night, they finished one of the beers they had and replaced it with another one. So Awesome!!! I love beer and I'm always looking for a place that has something new on. Definitely will come back!",1,,
190,Christie D.,"Chappaqua, NY",0,3,1,5.0,2/24/2016,"Big space, great for groups, lots of TVs and large beer selection. Wednesday night trivia @ 8pm is awesome - $50 and $25 rewards.",,,
191,Kathryn L.,"St. Augustine, FL",0,6,0,5.0,3/2/2016,"Great place for a large group, or a small gathering.  Unique garden setting in the back!  The food is excellent, not your ordinary fare.  Large selection of beer and a full bar as well.  This is the kind of place that you could go to alone and find people to hang out with...the main hall tables are long and makes it easy to meet people.",,,
192,Tony S.,"Bronx, NY",0,23,0,1.0,7/25/2015,"Great ambience. However, service is slow, some beers were out of stock and the beer that I was served was warm. Oh, the rum punch tasted like a 5 year old made it.",1,,
193,Lee B.,"Manhattan, NY",14,15,0,5.0,11/25/2015,This place rocks.  Great outdoor patio area in the back.  Great decor.  Excellent hot dogs.  Great fries.  I saw Kristaps Porzingis in here last time I came.  So it gets 5 stars just for that.,,,
194,Grace K.,"WHITESTONE, NY",190,70,0,4.0,11/25/2015,"Nice ambiance with a rustic feel with the wooden chairs/seats. Got the seasonal beer - pumpkin, which was delicious. The appetizers were good, nothing remarkable but tasty.",,,
195,Angela D.,"Manhattan, NY",0,7,0,1.0,7/21/2015,"Come on, how can you charge $12 for a lonely little sausage that's basically a plain old hot dog? You could have thrown in a potato -- or something! The $14 hamburger was small and not to order (ordered medium rare, got overly well done). The truffle burger was small but good OK at $17 (!!!!) and if you want the cabbage instead of the fries, they charge another $2. So basically the hamburger was $19. Go to Mel's for a good burger. Go to the guy on the corner for a good hot dog. Don't come here for food. The beer was good though so if you want a biergarten, noisy, cheerful, and want to drink lots of beer, then fine.  I left this place wanting to go out for dinner somewhere.",1,,
