,er_name,er_location,er_freinds,er_reviews,er_photos,er_rating,er_date,er_text,er_useful,er_funny,er_cool
0,Melissa V.,"New York, NY",693,138,516,4.0,10/26/2018,Perfect place for drinks with a big group! I came down here with some of my friends from Columbia and I really appreciated how conducive this environment was to large gatherings. They had a lot of indoor picnic style tables and cheap happy hour drinks. You get the perks of affordability in a really upscale looking place. I would recommend the grapefruit IPA ($5 during HH) and the pretzels - the cheese sauce was pretty bomb.,,,
1,Randy C.,"Woodinville, WA",60,418,62,1.0,11/9/2018,"Worst service I've ever had! As a matter of fact, we coined a new phrase, ""west ended"" as in, boy that service was bad, but at least we weren't ""west ended""! Sunday night, after waiting 20 minutes for our ""server"" to saunter by we ordered, sliders, pretzel, and tots. Tots came out 1st, quick and hot. 20 minutes later the pretzel comes out, not so hot but whatever. After another 20 minutes our server tells us the sliders are on the way. 10 minutes later, from my table, I order a pizza from Mama's too, we cancel the sliders, ask Mr Happy for the tab and go get our pizza.Walking by 2 days later in the morning, I see a 1/2 open box of ""fresh"" pretzels sitting outside the door. SEE PHOTO!Hard pass!!",,,
2,Steve A.,"Hilliard, OH",852,1390,1959,3.0,10/15/2018,West End Hall has an excellent selection of beer. It probably has the best selection on the Upper West Side. There's lots of local breweries on tap. Prices aren't too outrageous. The craft beers are priced comparatively well. I had a Five Boroughs Hoppy Ale. It's not overwhelmingly hoppy. This is about $7 for a pint. It's pretty crisp and tastes clean. There are also local selections from around the city including Brooklyn Brewery and Coney Island. As for the food it's just typical stuff you can get from a bar. Skip it. It might be the best bar in this area of Broadway. It has the biggest beer selection. The bar also has lots of TVs.,,,
3,Danny H.,"New York, NY",0,9,0,3.0,9/7/2018,"I've been to the West End Hall maybe 3 or 4 times. They have a good selection of beer on tap and a limited menu consisting mostly of burgers, sandwiches, salads, and appetizers. Burgers are juicy and tasty, but there's no information about where the meat comes from so my guess is it's industrially grown feedlot beef.On most occasions, I've found the music and overall sound level to be oppressively loud, making it hard to talk. At least in the evening in the summer, this place is very much a party scene.I saw the Mexico-Germany game of the 2018 World Cup at this sports bar and was very disappointed. The TVs are big and numerous but relatively low quality. All the indoor seating is on benches at long tables, which means there's not much you can do to adjust your seat if you don't happen to be directly facing a screen. That means that the odds of having to watch in a twisted position are pretty high.The staff is hit or miss.",2,,
4,Scott B.,"New York, NY",8,171,204,5.0,3/8/2018,"Beer garden style picnic table seating with lots of beers to choose from. The food was really good. They have an outdoor area but it wasn't​ open when I​ went in the winter.Tried the wings and nachos. Wings were nice and big and had a great flavor. We did half of the two current flavor available, buffalo and bbq. Came with a giant boat of ranch which is worth a star all on its own in NYC.The nachos we more than enough for 4 people and held their own with all the toppings. Served on a sheet pan so you know there's​ a lot.19 taps of beer and 10+ bottles​ and cans so there is a brew for anyone.Can't wait to roll through​ during the summer and check out the outside. Tons of TV's for sports viewing. A must stop for beer gardens in NYC.",,,
5,Mar R.,"Manhattan, NY",0,49,3,2.0,11/18/2018,"Food was ok. Service was bad. We were one of the only tables in there and the waiter was not attentive. We had 4 empty water pitchers and it took several minutes to get his attention. They charged a 20%tip because we were a large group, least they could do was come by.",,,
6,Holly S.,"Riverdale, Bronx, NY",110,160,116,4.0,6/20/2018,"My boyfriend and I went for happy hour and early dinner and we had a good time. The burgers are super cheap ($9-11 plus $2 for fries, sweet potato fries, or tots) and the veggie burger I had was actually the best I've ever tasted. It fell apart easily but was so delicious I didn't even mind. The sweet potato fries were awesome too.They have a rotating selection of about 20 beers on tap and the variety is great... everything from IPAs to stouts to sour beer. There is a selection of beers available for $5 during happy hour (3-7pm weekdays) plus some house wine and well drink specials as well. Service at the tables could have been better but I'll be back nonetheless.",,,
7,Michele B.,"San Antonio, TX",305,128,372,3.0,1/13/2018,"Location: West End is located off of 106th and Broadway. It has a large open area suitable for many people and has a pretty chill, laid back vibe. They've got board games to play at request, so my friends and I had a connect four tournament. There are tons of flat screens, so we were able to watch the football games anywhere we were located in West End. Service: When we first sat down, no one came to greet or acknowledge any of the tables we were at. We did come in a fairly large group, but we sat waiting for someone to come by for well over 20 minutes. Many of the people I came with ended up going to the bar to order their drinks. We didn't get water until we had been there for 30-45 minutes. We were there to socialize with one another so we took care of what we needed at the bar. Because I was quite hungry, I asked a waiter if he could come and take our order. He said we needed to go to the bar because he can't split checks, which is fine but I would have loved to know that way beforehand. The service took this place down a notch, but I was still really excited to try the food. Food: We ordered the American burger with fries, cauliflower buffalo wings, a quesadilla, and nachos. Unfortunately, I was only able to get pictures of the quesadilla and cauliflower wings (pictured below). The nachos were a huge portion and was tasty. The portion could definitely serve 2 for a light meal. The nachos are topped with melted cheese, black beans, guacamole, and jalapeños. The burger definitely left something to be desired. It was overdone, overly charred, and had zero flavor. I was only able to eat a few bites. Which is really unfortunate because burgers are my jam. The fries were fantastic, though. As for the cauliflower wings, they were tasty. They didn't have any distinguishing features or anything of that sort. The quesadilla also was standard. It didn't have anything to remember. It was bland, but it did its job. All in all, I gave West End 3 stars for the overall experience.",,,
8,James C.,"New York, NY",0,16,11,2.0,9/23/2018,"One of my favorite places to go because of atmosphere and the wait staff.  However, management has let this place go with the quality of the televisions and projectors. Hard to call yourself a sports bar when every tv is a different color. Hope to see improvement.",,,
9,Justin R.,"New York, NY",308,17,1,3.0,8/23/2018,"I've always wanted to go here cause it's fairly new, there's not a lot of great food around, and looks like a nice hang from the outside.  Here are my thoughts.  Food- I got fish tacos.  BANGIN!   My gf got a burger.  GREAT!Drinks- a beer place.  Good selection.  If you like beer you'll like it.  Service.l-  they were super nice and the hostess even let me put my bike inside.   But..... took too long to take order and bring it out.  Ambiance- here's the bad news.   Music is god awful and LOUD!  Like the worst pop song put to a loud techno remix.  Everyone in the place is yelling over the music.  I literally won't go here cause of loud BS in my ear.   I'm not asking for Mozart.   Just sayin.  Pick something a little ummmm. Better.  Or at least keep it down.",,,
10,Lamarr H.,"Fresh Meadows, Queens, NY",1,61,52,3.0,8/25/2017,"I give them a B-, what saved them was the outlets hidden behind the seats against the wall, the really cool ambience, childhood games(battleship, connect four etc) and the music and crowd was really nice..Food: was great!! I ordered Buffalo cauliflower, angus sliders, dynamite tots. The best thing was the Buffalo cauliflower, everything was good but nothing out the ordinary. Tip: 3-7 weekdays these items are $5 and they have select Beer/Wine and all well drinks for $5. Awesome deal!! Service: the time was about 5pm, it was slow and picked up a little on the outdoor area, but they are slow to acknowledge people and come to tables. The food came out fast though :-) also, overall I feel the staff need more training and better awareness as servers and bar staff-- there should never be a person sitting with a empty beer class at your bar while you chat up what seemed like regulars, you should always have your bar on lock; especially when you're not having any type of rush. Speaking of said behavior, the Dominican looking guy basically stayed planted at this one couples bar slot and passively ignored other patrons til he couldn't lol it's so unprofessional. The staff wandered around and you couldn't seem to get their attention forever and didn't know what their role was-- It was so frustrating. You also should never have time to text and chuckle by the register while you have folks seated and at the door looking for service. -_-  I understand being a laidback bar, but service and sales is what keeps you open, right?",2,,1
11,Claire B.,"Manhattan, NY",34,103,18,3.0,10/17/2018,"No WiFi and TVs were too loud to have a conversation inside. Points for serving food late night but the food is very typical sports bar fare (heavy and lacking in flavor...I had the fried buffalo cauliflower which was drenched in the buffalo sauce, I could barely taste anything but spice).",,,
12,Jen N.,"Manhattan, New York, NY",254,9,3,3.0,9/8/2018,"Grabbed breakfast with a friend, the place was relatively empty but the service was extremely slow from getting our order in to recovering our food and our check. The staff was kind though.",,,
13,Jolene H.,"New York, NY",7,135,51,4.0,2/10/2018,"Happy to live across the street! But wouldn't go out of my way for the place. I've been a few times, with friends, to watch a game and drink. Love the open area with community-styled seating and the buzz of chatter. Feels like a non-intimidating version of a cafeteria! Ordered pickup through Eat24 a few hours ago. Cheeseburger and bacon burger, both rare, both with fries (only $2 extra!). I called 30 minutes after ordering to check and see if it was time to brave the cold for our burgs. The first employee I inquired with had no idea what my order was and abruptly passed me on to another employee, who was just as uninformed. Apparently, West End no longer accepts orders using Eat24. I'll just call this an unfortunate oversight - by more than one party. Still, the manager, Carlos, was kind enough to rush my order as a courtesy. It was ready within 15 minutes. Cheers! The burgers were both very well-executed. Cooked perfectly rare, very thick, and had a nice spice to the seasoning. The buns were thin and squishy, which I prefer, but can appreciate that some like those fluffy or heartier sorts. Fries were a hit as well! Crispy but not oily. On the thicker side and rustic, with the potato-peel on and heavy seasoning. I really liked that they were long (perfect for dipping). Not blown away by the meal, but certainly pleased. Will definitely run across the street sometime soon for another round.",3,,8
14,Mardory V.,"New York, NY",452,484,1951,3.0,6/24/2017,"For the first time in a long time my group and I received decent service here.  Three out of ten times that I have ended up here the service was unbearably slow and not at all friendly.  I am extremely glad to see a ton of diverse (and New) employees who were a huge improvement to prior experiences.  This time around we were actually able to enjoy ourselves and focus on the purpose of our get together despite the rainy, gloomy weather.The decor is rustic and their backyard patio is very comfortable, welcoming and makes you feel at ease.  The patio also hosts its own bar (although not always open), as well as games like shuffleboard and giant Jenga. However, table service in this area was the weakest link so sit in this area when not in a rush. The place and the restrooms are well maintained and clean.Notable mentions in regards to the food are: the fried cauliflower, truffle french fries, vegetable quesadillas, BBQ/hot wings and their sliders/cheeseburgers.  Their food is pretty solid but it plays second fiddle to the large selection of beers and cocktails.  While the bar doesn't specialize in any liquor, it certainly has a decent amount of selections available.If service were up to this level each and every time, this place can easily reach its potential.  It seems there is a new manager in charge, and this has definitely made an excellent difference.  I am glad that they improved in order for me to finally be able to write a positive review.",13,5,9
15,Sarah S.,"New York, NY",20,21,0,5.0,7/1/2018,"My go to sports bar with tons of large TVs and projector screens to watch the game. Great atmosphere, food, and beer selection. Communal seating means you might even make a new friend :)My favorites are the fried chicken sliders (get buffalo not bbq) and shrimp tacos.",,,1
16,Judy J.,"Manhattan Valley, Manhattan, NY",1,1,0,1.0,10/5/2018,"I want to like this place. I really, really do. But- every single time I come here the service is horrible. I live around the corner on 104st so this could become a neighborhood bar.  Every single time I come here it is no leas than a 15-20 min wait to find a server and then endless time to get a drink. Get it together already.  So annoying.",,,
17,Josie J.,"Manhattan, New York, NY",215,22,29,2.0,6/25/2018,"Came here with a group as a farewell happy hour for a colleague. The music was nice but The service was beyond terrible because the waitress was completely unprofessional. It took her about half an hour to bring one drink. When she finally comes back to our table she says, ""sorry, I was using the bathroom"" as she hands us the wings and the drink. That's enough for me to not come back to this place at all.",,1,
18,Dave H.,"Manhattan, NY",0,6,0,2.0,10/31/2018,This bar frequently closes before the hours listed on their website (listed as closing @ 2am Fri-Sat). I've arrived 3 separate times between 12am-1am on those days and they are closed. The last time they rudely locked the door in our face without addressing our group while we were approaching the door.  Update your website maybe? Not that hard.,,,
19,Brittany J.,"New York, NY",0,5,1,3.0,7/5/2018,"Food is good and the space is pretty good as well. Big open space with lots of tvs. Great place to watch sports and they play all the games. The prices aren't terrible for a beer garden in manhattan. The outdoor games are cool as well.The only negative thing here is the service. The staff is young and clueless. I was given 3 different answers, by 3 different people.They charged someone else's tab on my CC and when confronted I was ignored. (Definitely bring cash to this place and don't pay with CC)",,,
20,Andy D.,"New York, NY",16,42,1,1.0,4/1/2018,"We came in... three parents and our four kids... 4pm on Easter Sunday. We sit in the front at one of the communal tables. My friend asks one of the servers if she would mind lowering the music a touch (it was blasting lame 90s hard rock). She kindly lowered it. Then things got weird. The ""manager"" marches over to the music system and cranks it back up. He comes over to our table and asks us if we still want to order. We ask him about the volume... and he starts to get visibly angry - like aggressive - and says ""those two in the corner like hard rock and this is a bar."" They were both on their laptop. He said ""I can't make everyone happy and if I turn it down those two will be upset...what am I supposed to do""... blah blah blah. What a joke. To the owners - this is the UWS. Know your lane and appreciate the neighborhood where you operate. You could crush it... but you aren't...  and at this rate you'll end up like your predecessor in no time. Good luck.",1,,
21,Samanyha O.,"Beverly Hills, CA",480,130,2,4.0,9/29/2017,"This place is super cute and very close to my apartment so coming here was a pleasure. The back patio is where the party is at. The beer selection is nice and the wait staff was attentive and quick with serving us. We ordered the Teriyaki wings, sliders, and large pretzel. The pretzel and wi ha we're awesome but the sliders were lackluster and I probably wouldn't order them again. I am excited to come back and explore both the beer and food menu more!",,,
22,Shannon C.,"New York, NY",4,40,3,3.0,4/7/2018,"Food is pretty good, but some things are overpriced. (The $14 Cobb salad, for example, is about a 5:1 ratio of romaine lettuce to toppings -- although shame on me for ordering a salad at a bar). A cheeseburger and fries is $12, though, and pretty tasty. Also, the music is WAY too loud! Fun atmosphere for a bar but not so much for dinner. They have board games! And 90s pop music. It's cool if you don't mind the noise.Minus a couple points also for mistakes in the order. But again, it's a bar mostly! Don't let the number of low tables fool you.",,,
23,Josmariel S.,"New York, NY",0,10,3,5.0,10/7/2018,"Came here for brunch today with a couple of friends and family. I've been to this place many times and I have to say that today was the best experience I've had. We absolutely loved our waiter Keith. He was very attentive and knew what he was doing. He recommended a vegetarian dish for my friend that she absolutely loved. He found a beer for my mom who usually doesn't like the taste of beer. He was just great. I'm not sure when he started working here since I don't recall seeing him before, but I am definitely coming back and sitting with him again.",,,
24,Claudia M.,"Danvers, MA",87,25,34,1.0,6/22/2017,The truffle fries taste like shit. Beers good but food isn't.Great place to watch a game. TVs surround the walls. Got nachos once they were good but I was starving immediately after taking last bite,2,2,
25,Giuliano D.,"New York, NY",86,7,3,1.0,6/2/2018,"Wwst end hall is such a horrible bar in terms of lack of respect and service. My friend were about to go inside to get drinks today at 1:00am (a group of Hispanics) but the waiter(or the manager which he called himself, but i doubt he was) told us that they were closed and no longer serving. However, a group of white people came in and sat down at the tables and got drinks. We argued with the waiter and he told us if we dont like it, we can get the fuck out and he doesnt wamt our money. That man was a rude individual and had total lack of srespect. I am never coming back here.",2,,
26,Monique R.,"Brooklyn, NY",899,907,538,4.0,11/15/2017,"Was in the area meeting a friend for happy hour and the pub we were at was not up to snuff so thanks to the handy Yelp App, we found this place had an early happy hour and was very close to where we already were.The happy hour menu had $5 apps and $5 drinks. An extensive beer menu had us all starting with beers. I had the schofferhofer (grapefruit) beer which was nice followed by a mule which tasted like gingerale (not a bad thing) and then when we were looking to up the ante, we asked what well vodka was being offered for the night. Due to a surplus in their stock, they were serving top shelf vodka for well vodka prices. Our hearts soared and we began ordering doubles with happy hour slated to end in an hour. The downside however, was our drinks took a very long time to come out.The food came out at lightning speed. We pretty much ordered everything on the menu. The chips and guac were just okay- I would probably not order them again. The Fried Chicken sliders were great with a soft bun, hot sauce and cole slaw. The bourbon wings were my favorite. The monster fries were awesome. The burger was not terrible. Overall, this was a great place to end up on a random friday evening. Its way off the beaten path for me but if i am ever in the neighborhood again, i will be making a visit.",6,,4
27,Prashant S.,"Manhattan, New York, NY",17,2,0,1.0,9/24/2018,"Waiters were rude and disinterested. Our table was uneven and we asked for it to be straightened and the waitress basically washed her hands off the problem and suggested we fix it. After going under the table and struggling to fix it, we moved to another table. In hindsight, we should have moved to another bar. I simply don't appreciate it when waiters show un uncaring attitude. Really unfortunate, because the drinks and food were good.",,,
28,Jasmine L.,"New York, NY",41,84,252,3.0,5/11/2017,"Love the cute beer garden (with giant Jenga & giant Connect 4) in the back! Food-wise, everything was really good BUT a little bit overpriced in my opinion. However, some deals were great (like 3 tacos & a margarita for $20). Definitely get the tater tots with the Sriracha mayo if you come here (and like all the ingredients in what I just named). The sauces are to die for.Docked a star because of the poor staffing. Our poor waiter was swamped with tables. This is something the manager should definitely look to improve on.",1,1,
29,Simon D.,"Washington, DC",177,15,0,1.0,5/8/2018,I payed 15 dollars for a cocktail (immune booster) with no alcohol in it. Shame on me I guess? Service was bad too.,1,1,
30,Ian L.,"San Francisco, CA",0,25,0,1.0,5/5/2018,"Read about the poor service, and we still went ... To experience the crap service. And it's true.. it's definitely piss poor service.  The table next to us waited 20 minutes and walked out ... We had ordered drinks at that point.. got them 20 -30 min later .. with no apologies. They were losing customers left and right.. and it didn't phase them. We had to ask for utensils, water .. it wasn't even busy when we were there .. done. I have nothing else to say. Come here if you want your time wasted.",1,,
31,M J.,"Manhattan, NY",0,7,18,2.0,5/5/2018,"West End Hall seems like great place to watch a game and connect with friends. However, upon my first visit I was extremely disappointed with the service I received. After seating ourselves, it took over 15 min for a waitress to arrive and take our order. Because we were watching the game, we didn't allow that to bother us too much. When we received our food, it was cold. The waitress (while having somewhat of an attitude) was open to my feedback about my food and had one item remade. To make matters worse, I had also ordered a beer which arrived well after I received my food. The service was so poor that other patrons we outright complaining in the establishment. While we did not complain, we elected to give feedback in the form of a very poor tip! My advice: Stick to drinking at the bar only! Skip out on the poor food and service!",1,,
32,Kerry M.,"Town of Babylon, Long Island, NY",125,4,3,5.0,6/23/2018,Really nice bar. Backyard was closed but looking forward to checking it out when it's open!,,,
33,Theo M.,"Manhattan, NY",2,78,0,5.0,1/19/2018,This place is really good. I normally go every Thursday for happy hour and I am somewhat of a regular at this place. The prices are affordable and on the menu it says what beers and wines are part of happy hour with a green dot.  It is not far from my house and it is a good addition to the neighborhood.  Reggie is attentive and he is my favorite bartender (and the only one that I know of at the place!!). The atmosphere is fun and they have sports on the TV.,,,
34,Sid G.,"Manhattan, NY",1,9,1,1.0,2/21/2018,"If I could give this place -100 stars it would be tonight! I meet my girlfriend after work for happy hour, all is good bartender/waitress are great. After ordering multiple appetizers & drinks the bartender never lifts our menus (because we have ordered several items & still have our drinks at the bar) when in walks an employee of the bar with two female friends... he sits them at the bar next to us, goes behind the bar... removes the Menus from IN FRONT of us ( there were more menus on the other side of the bar ) and places them infront of HIS friends. I tell him "" how do you know if we have ordered?"" he ignores me and smerks. I let the bartender know, he agreed it was wrong. I let the waitress know, she said it wasn't surprising of this employee. I call for the manager and he basically says "" if you didn't like it leave"".... I ask the manager ""This is your response"" he says ""YES"" & asks me forcefully to exit ""His"" restaurant. No apology, no ""what can I do to make this better..."" It was a THUGGED way of handling a situation at as they advertise... an ""upscale"" establishment. So far as being ""chest bumped"" with the street cred slogan ""Whatchu' wanna do"" Lol! Manager trying to be a tough guy when he could have fixed things with asking his bartender & waitress if they had witness what I had explained. I have been here several times because the evening bartender (Reggie) is great... but tonight was my last time at this whole! You don't take menus from one table and put on another because they are your friends... its like taking forks & knives off one and giving to another because you assumed we've eaten already. We had been ordering for 3 hours, dude... YOU JUST WALKED IN! Manager and this worker need to be CHECKED! we wont be back!",7,1,
