,er_name,er_location,er_freinds,er_reviews,er_photos,er_rating,er_date,er_text,er_useful,er_funny,er_cool
116,Bella M.,"Houston, TX",56,38,28,5.0,12/14/2013,"It always strikes me how many whiners there are in the world, especially here on yelp.  ""I didn't like this. I didn't like that. They LOOKED AT ME FUNNY!! "" Well, boo-freaking-hoo people. Get over yourselves and toughen up a little. What an entitled world we are becoming. A business has one hair out of place and it's ""NO SOUP FOR YOU....ONE STAR!!!!""This is a fantastic little gem in the heart of midtown and anyone who is visiting owes it to themselves to try to stop here for coffee, breakfast, lunch, whatever. It's absolutely fantastic and the family who runs it (for over 38 years, it started off as a bakery) is delightful. If you are tired of paying $20-$30 for a continental breakfast at your Midtown hotel, then take a little spin around the corner (7th and 55th) and grab a delicious bite. The prices are fantastic, the food is made fresh daily and very authentic and you will leave with a happy, warm and full belly and a smile on your face. We love to get their quiche for breakfast. It's fantastic, just rich, creamy, light and fluffy, but nicely filling. For lunch, try one of their paninis and definitely have some homemade soup. The vegetable is like my Grandmother used to make...just fantastic and tasty and perfect for a light lunch on a cold day. The owner chatted with us today and was so sweet and gracious, and made sure we loved our meal and even brought us a few melt-in-your-mouth Greek cookies to finish our meal, on the house. What a wonderful touch....Tables are small, but it's cozy and wonderful and although people have complained about a lack of space, again, get over it. The food and service MORE than make up for any space issues. Good food (for a good price) is a GOOD THING. Ignore the whining nay-sayers because frankly, they will find fault anywhere they go. Eat here. You will love it and tell your friends about it, and you will DEFINITELY be a customer for life.Yes, it's that good. Oh, and be sure to get a Fluffy's red coffee mug while you're there (which entitles you to a free cup of Joe). I love my mug and start my morning every day with a little cup of Fluffy's!",6,2,2
117,Jeff S.,"Weldon Spring, MO",170,142,35,3.0,9/12/2014,"Had a good breakfast.  The seating is very limited, so probably better if you are taking and running if you have more than a couple of people.  The people behind the counter were very kind and provided a few doughnuts for the kids while they were waiting for their food to be prepared.  Good place; good value; good service.",,,
118,Jon J.,"Omaha, NE",3,40,9,5.0,11/21/2015,"Just happened to stop by here while walking around and grabbed a cannoli, was very impressed. Stopped by on my way back out of town and picked up few more to take back with me. Very tasty.",,,
119,Gia P.,"Manhattan, NY",186,26,7,1.0,11/27/2014,"This review is for delivery only. I ordered an omelette through Grubhub at around 11:20 am  and received a message that my food is going to be ready in an hour at 12:20-12:30pm. The place is literally 3 blocks away from my location. However, after it's been an hour and a half (12:50pm) I called the restaurant and the guy on the phone said that  ""it's Thanksgiving and he has 100 people in front of him"" and that they will have to ""remake"" my order. After I tried to get an answer on what does he mean by ""remake"" , if it has or hasn't been made yet, he would only say ""I have 100 people in front of me"". Well, I'm really sorry about that? And then he finally said that it hasn't been made yet.I work in the same industry for years. I understand that you can get slammed. I understand that it's a holiday and you're busy. It happens. But you can't just assume that people wouldn't have a problem waiting for delivery for 2 hrs ( best case scenario, taking into consideration that they still would have to cook and deliver it after 1,5 hrs. What if I didn't call?). If you're busy or the kitchen is busy you have to be considerate enough to at least call and let the customer know that there will be a delay and if they are okay with that. People understand. Or you can say ""unfortunately at this time we can't make your order, sorry about that"". No big deal. I would order from somewhere else or went somewhere else to get food and wouldn't have to wait for so long for nothing.",,,
120,Tanya A.,"Durham, NC",272,415,3,3.0,"10/21/2011
            





Updated review","I have not had any of the baked goods, so I cannot judge based on that. I have, however, had their pizza and falafel. The pizza was not good by any means, and the falafel was decent. Let it be known that though the food is below average, Fluffy's is CHEAP comparatively, especially for it's location. I stayed at a hotel close by for a week, and Fluffy's was a great, affordable option.",,22,
121,Trev C.,"Scottsdale, AZ",0,20,0,5.0,8/1/2016,"Found this gem while walking to Central Park. The owner is one of the nicest people you will meet. When he found out we were visiting from Arizona, he gave all three of our kids a giant black and white cookie. They were on the house. Pizza was great, and the prices were reasonable. Will go again next time I'm in New York.",1,,
122,Brianne E.,"Phoenix, AZ",0,10,0,2.0,12/6/2016,"Despite advertising online and on all of the menus that there are gluten free pancakes and French toast available, I was told they were all out of gluten free options except bagels. I opted for a quinoa bowl with no eggs, which left him grumbling something at me and then saying, ok, fine. Overall, service was rude and unhelpful and gluten free was the whole reason I walked to Fluffys, so big fail all around.",,,
123,oktay d.,"Brooklyn, NY",13,19,9,1.0,10/14/2015,"$9.80 for egg cheese turkey at 9am. I wouldn't mind if it was good but it was disgusting and ended up throwing it away. Coffee was horrible too, STAY AWAY",,,
124,Nicole C.,"Manhattan, NY",0,1,0,5.0,7/27/2016,I have never not enjoyed an experience at Fluffy's. The owner is the kindest man I have ever met and shows genuine care for his customers enjoyment and wellbeing. I've recommended it to anyone looking for good food at a great price.,1,,
125,Clyde B.,"Matthews, NC",0,21,0,1.0,7/25/2016,Dirty place. Tasteless food. Pastries should be called pasties because they taste worse then  paste. Any other neighborhood place or food truck is a little better.,,1,
126,Tina C.,"Queens, NY",1966,4132,9742,4.0,"7/16/2009
            





Updated review",After eating two lemons for rejections in a span of two days I so needed comfort food.  Since there were no Crumbs in the nearby vincity of my workplace Fluffy's for sweets during my lunch break works for me.At $4.00 per cupcake it was certainly no Crumbs standards but came close.  Fluffly's is revamping their take-out menus but is one of the very few bakeries that offer business cards.,2,1,2
127,Lucy Y.,"Los Angeles, CA",197,1454,6235,3.0,5/13/2011,"Fast and hot snacky to take back to our hotel:Chicken Quesadilla ($7.57), loaded with white meat chicken and cheese, with sour cream and salsa.  Comes w/veggies, if desired.   Kinda hard to do a quesadilla wrong, but it wasn't the greatest - friendly service though, and close to our hotel.My niece was happy!",7,5,9
128,Paul M.,"Lutherville, MD",4,7,0,5.0,9/20/2015,"My favorite breakfast in the city! Been coming here ever since I was little everytime we visit Manhattan and I have to stop and have a cinnamon raisin bagel w/ cream cheese and a french toast. The coffee is excellent as are all their desserts. If you are in the area, either staying or passing through, be sure to stop in for some great breakfast food!",,,
129,Joanna M.,"London, United Kingdom",0,10,0,2.0,12/9/2014,"Disappointing. I had waffles and Bacon, these were not made fresh and were warmed up in the microwave which dried them out! Bacon must have been cooked 3 hours earlier so stiff and dry! Coffee not great, milky and not so flavourful and way too hot! The cafe is very small and you feel as though you have to rush down your food, I had indigestion I ate so fast just to get out of there! Staff were friendly that's the only good point! Don't waste your money.I just wanted to add that even though I was eating in the cafe we were given paper plates and plastic cutlery!",,,
130,Jaime T.,"Aliso Viejo, CA",38,327,203,4.0,8/1/2015,"We stayed at the Sheraton, but chose to come here for breakfast. Food is cooked to order, and pick up up is fast. There's a lot of patronage, but people in NY don't leisurely eat like they do in Cali. They eat and go, so there is always a place to sit. The food is good, the place is memorable.",,,
131,Cat M.,"Gaithersburg, MD",1,19,0,4.0,6/10/2013,"We ended up at Fluffy's when the prices at Ben Ash made us fall over...$25 for a sandwich COMEON. The decent prices is what drew us in, but I was very happy with our meal. The cream of mushroom soup was delish . The small was pretty large and I shared with my son.My husband had a turkey cobb wrap, he was still talking about it hours later. I had a turkey sandwich - which again was pretty decent. The spicy mayo they provide has a little kick, but not spicey. My son is a pastaholic, and he had a fresh made alfredo with bacon and mushrooms (the pasta came from the fridge, but the rest was made to order right there and you can pick 3 add ins and its no more for the 6.95- he ate it all, he NEVER eats it all. We shared this with an older lady there - and she just lit up. The cheapest pasta dish at Ben Ash was $20.We didn't try the desserts - so I can't vote on them. I would go back in a heartbeat. Was it the BEST meal I ever had  - no, Was it decent, good food at good prices in Midtown - yes, yes it was.",2,,
132,Diana L.,"Houston, TX",0,1,0,5.0,9/27/2015,"Came here for breakfast because our hotel was right around the block. The food was fresh, delicious, and so reasonablyPriced. Also, while this was not our first time in the city, the owner did not know that so gave us tips on price gauging and watching our purses. He was very friendly. Great place!!",,,
133,Wellington J.,"Torrance, CA",18,115,4,4.0,6/26/2015,Our family has eaten here twice for lunch. Quite leisurely. Large selection for custom salads and pastas. Large variety of sandwiches on many types of bread. Very quick. The cashier even gave us free donuts both times!! Very tasty food!!,,,
134,John E.,"Encinitas, CA",8,100,3,5.0,2/19/2014,"I've had my share of cookies, but fluffy's makes the best Black and white I've ever had...It taste like a fresh doughnut meets a sugar cookie combined into one awesome treat...plus their de-caf coffee was a nice treat at 12:00AM",,,
135,Michelle S.,"Portland, OR",1,42,0,5.0,12/26/2013,"I don't get the low reviews. Our hotel across the street didn't have any cheap food to offer so we came here every day for breakfast. Coffee- good and a lot cheaper than the boring Starbucks and pricy Patisserie place next door. Bagels- what you would expect from New York. Omg, the cream cheese had fresh vegetables and green onion options. sandwiches- made fresh to order. cheap and fresh tastingDesserts- go for a famous black/white or cannoli.",,,
136,Meg D.,"Clark, NJ",0,11,0,4.0,12/1/2016,"Breakfast sandwhiches are great--the eggs are always fresh.  You do need to ask them to toast the bagels/rolls, but it's so much better that way! Donuts are good, but the croissants are not.",,,
137,Emily K.,"Brisbane, Australia",3,22,0,2.0,7/16/2013,"Don't know why this place is getting 4/5 stars. Nothing really special here.Guy who served me was lovely, lady who took my money was rude. She got angry at me because I didn't know the difference between a small and large container (both looked exactly the same, one was slightly taller than the other. I was expecting a smaller one). I also asked her why there was toast on my tray and she yelled ""It goes with that!"" and pointed at my dish. I wasn't expecting toast with my meal, which is why I was questioning it just in case I added it by accident.Definitely not going back.",1,,
138,Ronson O.,"Kapolei, HI",21,12,2,4.0,3/8/2014,"I would have given them 5 stars but they forgot to pack one of my pizzas in my bag, so I had to come back down from my hotel room to fetch it. But on the bright side, the nice lady at the counter did give me a couple of free drinks to say sorry. We went there after a knicks game since we were staying in Manhattan for one night and it happened to be right across the street from our hotel. The employees were very friendly and the restaurant was clean. They had a little bit of everything; from pastries to pizzas and even salads too. Great pit stop on a cold new york night!",,,
139,Mike O.,"Honolulu, HI",1622,471,2320,4.0,4/23/2013,"After the opera, I was so hungry.  This was the only place open around our hotel.  I ate a prosciutto and mozzarella.  I have to admit it was pretty damn good.  Lace with sweet red peppers and spicy mayo sauce and cure my hunger real good.",,,3
140,Kimberly G.,"Glenolden, PA",1,25,0,5.0,10/12/2016,"Fantastic food! I've had coffee, salads, smoothies, pastries, etc. All have been great. When I stay in the area, I usually go to Fluffy's a couple of times a day! Service is good, and people are pretty friendly, too.",,,
141,Andy O.,"Arlington, MA",0,89,0,4.0,10/2/2015,"Had breakfast there a couple times. The food is not memorable, but is good for the price, which is amazingly low for Manhatten. The fruit cup was fresh and tasty.",,,
142,John A.,"Woodside, NY",0,2,0,5.0,9/21/2016,"Great place! Food was awesome and service is great! If they mess up they don't argue or fight, they over-correct their mistake!!! Definitely recommend.",,,
143,Brandon V.,"ASTORIA, NY",374,55,1,1.0,5/10/2013,"Skip the pastries, unless you like gritty, $5 brownies that taste like table sugar. I understand everything in Midtown is overpriced, that's not what bothers me, I'm just exasperated that it all SUCKS, too. You cannot find a good pastry anywhere near here.I would have no problem paying that much for a brownie if it even tasted like a MEDIOCRE brownie, much less this. This? This wasn't a brownie. This was pure baker's chocolate whipped together with the tears of tortured kittens.",,2,
144,Sarah A.,"Philadelphia, PA",22,270,62,4.0,6/16/2013,"Take-out breakfast in bed: delicious Greek omelet and potatoes with white, buttered toast. Black tea = Lipton (not my preferred tea, but perfectly adequate). The only con would be that I didn't love the sausage patty: next time, bacon!",,,
145,Brian P.,"Chicago, IL",79,63,13,2.0,3/22/2013,MEH.possibly the worst carrot cake i've ever had. but the coffee made it bearable.,,1,
146,thomas p.,"Walnut Creek, CA",1,35,3,4.0,4/9/2015,"Great place for breakfast, tasty and served up quick, in generous proportions.  Ate here 3 times in my last New York stay and the food was always hot and consistent.  Recommendation to fellow West Coasters, give up your line politeness and go straight to the man behind the grill and order your food.  By the time you get to the line at the register your food will be ready.Complaints? Weak coffee, but there's a Starbucks across the street.",,,
147,Wendy S.,"Ogden, UT",0,15,3,3.0,4/24/2015,"Cheesecake is good and has better price than next door.  I ate dinner there once, having stir fry   You can pick you base, add a certain number of toss ins such as veggies and pick your sauce.  Meat is a few dollars more. They were out of my first three choices of sauces so I defaulted to safe and picked teriyaki.  It was not that great at all and got so bland half way through that I didn't finish it.  They had many other deli choices such as sandwiches.  They looked ok but tired from hanging out in the case all day.",,,
148,Ben S.,"Quasqueton, IA",35,40,0,4.0,9/9/2014,"We stayed nearby and discovered this little midtown gem by accident.  Being tourists, the staff was very patient and let us take our time to decide what we were going to get.  We made Fluffy's our regular go to spot for a snack after a theater production or ball game.  The sweet treats are delicious, particularly the cinnamon muffins!  If you're in the area, it's definitely worth a look.",1,,
149,M W.,"Jersey City, NJ",0,3,0,1.0,3/24/2016,"Horrible experience and bland food. The staff behind the counter were extremely pushy to get the order going, which I would understand if there had been a long line but there was no one else at the counter. They didn't have a lot of the ingredients listed on the menu and when I asked to add an item to my quinoa bowl while it was still on the frying pan, the staff was annoyed with me, acted as if i were inconveniencing him and then proceeded to outright not add the item. I was tempted to walk out with the food still on the stove.",,,
150,Frank M.,"League City, TX",11,8,7,1.0,6/14/2014,"Don't visit here for baked goods unless you want at least week old, dry product. There are other places close by that are much better.",1,1,
151,Mark C.,"Astoria, NY",0,7,2,2.0,4/17/2015,Ordered simple breakfast order. Totally screwed up- items wrong or missing.  Need to make sure person taking orders has a understanding of the English language before picking up the phone!,,,
152,Tracy M.,"American Canyon, CA",0,17,7,5.0,12/18/2015,"We ordered for delivery at 1:40, and received the food at like 2.  Fast delivery, really great food.  The ham and cheese croissant is amazing, tuna sandwich is just a good solid tuna.",,,
153,Cheryl S.,"Bayville, NY",1,6,0,5.0,3/15/2015,"5 Stars with an A rating. This is a hidden gem.  Food is healthy and tasty.  Service was excellent.  Prices were right on.  We came upon it after trying to find a reasonable place to eat with the kids.  The food was fresh and the kids had the pasta and loved it.  We ate the quinoa bowl which was delicious. We enjoy a little dessert with coffee and it was equally as good. If your tired of the Starbucks, Chipolte etc try it you won't be disappointed.  We will be back !",,,
154,Ger R.,"Burlington, VT",1,17,1,5.0,11/15/2014,In town and found this gem of a place. Good food and excellent service...and if you play the game 'The Long Dark' you'll know why we bought a mug.,,,
155,Samantha S.,"Houston, TX",121,159,19,2.0,6/12/2012,"I stopped in for coffee and a muffin for breakfast.  The coffee was fine; the muffin was dry and kind of flavorless.  With so many choices in the area, in the future I would probably walk right past Fluffy's and pick another café.(On a side note, I would like to add that my inner Gabriel Iglesias fan got a private chuckle out of the name of this place.)",,,
156,Tony L.,"Manhattan, NY",617,635,594,3.0,8/27/2009,"This place isn't spectacular...it is serviceable. Okay wraps, mediocre pizza and so-so desserts. It isn't as expensive as the nearby Carnegy Deli...but the quality suffers with the lower prices. I wouldn't go for much more than a grab-and-go wrap or pressed sandwich.",3,,
157,Amy B.,"San Francisco, CA",1,20,3,5.0,5/22/2014,"I was genuinely impressed with this place. At first glance it may just look like another hole in the wall breakfast joint, but from the moment we walked in, my expectations were immediately exceeded. We were sat and greeted by the manager, who was very nice and explained how ordering works (it's not a table service restaurant). Our food was ready quickly, even though they were very busy and it was some of the best I've had! I had a meat lovers omelette and my friend had a variety of things, but she said the donut was fabulous. The manager came to check on us during our meal and wanted to be sure that we were completely satisfied with our food. I would recommend this place and it's the cheapest, best tasting breakfast you'll find in mid-town.",,,
158,Amanda J.,"Jacksonville, FL",74,115,441,4.0,6/22/2013,"Next to my hotel. Very friendly and convenient. Never had  undercooked eggs til here though. The sweets and prices ,and coffee made them worth stopping in almost every day of the week I was there.",2,1,2
159,R V.,"Queens, NY",14,93,191,4.0,1/29/2012,"There's no reason their donuts should be as good as they are. I downed a simple chocolate frosted alongside a selection of Donut Plant's finest... and it wiped the floor with those gimmicky Planties. Their raised donuts are soft and rich, yet have the structural integrity to withstand being scooped up in tissue paper and rammed into a paper bag. The frosting was sweet, chololately and soft enough to smear, but not so gooey that it rubbed off all over the bag and tissue paper. They may not be donut specialists, but they get all the basics right.",,,
160,Ann P.,"Vestal, NY",1,9,0,4.0,12/6/2015,"Great for breakfast - 5 of us for $37, everyone got exactly what they wanted and we even had a table on Sunday morning. Owner was very friendly!",,,
161,Jordan M.,"Desert Shadow Condominiums, AZ",36,10,2,5.0,5/14/2014,"I was walking around near Central Park looking for a sandwich shop and walked into fluffys cafe with an appetite. I ordered one of the panini's and not sure what was in it. But it was soooo good. I will for surely be visiting this little cafe again. They had seating to sit at, they had a good selection, and prices were good. Didn't feel like spending too much but got a full meal for $8. Not to shabby for downtown NYC. The staff was friendly as well.",,,
162,Chuck H.,"Hartsdale, NY",0,42,17,4.0,9/26/2014,This is a great comfy destination for coffee and a strong WIFI signal. I have not eaten here. All I wanted was a nice hazelnut iced coffee for a decent price ($2.25) and a decent WIFI signal. Boom! Great spot to chill and do work on your laptop or tablet or phone.,,,
163,Marina A.,"Manhattan, NY",37,13,0,3.0,9/26/2011,"I was walking up 7th Avenue on a beautiful summer afternoon and I had a sudden urge for a New York cheesecake. The craving was probably initiated by the rows of cakes and other goodies perfectly displayed on the front window of Fluffy's bakery. Although I just had a heavy lunch, I could not resist the cheesecake calling my name. It is my serious weakness.The price for one slice of any of their cakes was more than what I was carrying (I had $4.37) and it nearly dashed my hopes of enjoying my favorite treat. After five minutes of debating with myself, I decided to pull out the credit card, ordered a slice, and ran back to my office. I sneaked the cake to my desk past all the vulchers in the accounting department and stuffed my face with the cake. Much to my chagrin, the cheesecake was not that good. It was spongy and soft. So disappointed.This review applies only to their cakes and pastries. I haven't had the chance to try their food.",,1,
164,Atif I.,"New York, NY",177,641,1730,2.0,11/16/2006,"I believe that one should consider all relevant facts and then form an opinion, and so when I came across the first review of this place - the cynic in me said, can't be! Best desserts in New York? Fuhgeddaboutit! But then, I will always give yelp's reviews the benefit of the doubt and cast cynicism aside - so I thought be bold, try the place, maybe I had missed out on and passed by this gem while traipsing around the city.It's a standard deli - with a very cheerful and friendly staff. I wasn't here for salad or sandwich, so I looked around the dessert offerings - pretty standard as you would find in any deli - be it Food Merchants / Cafe Metro...By now I was committed to sample the goodies and so ordered the Mudpie cake with Cappuccino - The rating is for the Capuccino and service, or it would have been lower.As they teach in behavior and management classes: Satisfaction = Outcome - Expectation. If my expectations had been lower, I may have been satisfied!But, this is an opinion of one - as yet, I am in the minority here. The brownies indeed did look fresh. As the place isn't far from where I work, I may be back to sample them. But, it's still hazardous to predict a better rating.",2,3,2
165,Izzat A.,"Arlington, VA",17,1471,12,3.0,2/22/2011,Went here late at night to get a drink and dessert. I ended up getting a Reeses Peanut Buttercup brownie. I was really excited about it because peanut butter cups are my weakness but the brownie didn't end up being that good. It was around $3 for the brownie and $1.25 for the drink which I thought was reasonable. I can't speak about their food but their selection of desserts was pretty good. Hopefully they were just having an off night.,1,,
166,John T.,"Hummelstown, PA",0,8,0,5.0,6/3/2014,"What a pleasant surprise this was.We were staying at a hotel just off 7th Avenue, and went for a walk to look for a quick breakfast bite.Walked up 7th Avenue.. and found Fluffy's.What a great place... service was exceptional.   So many incredible things to choose from, from a simple breakfast sandwich to amazing bagels, cookies, all kinds of good stuff.It had been some time since I had a NYC ""Black and White"" cookie... and we took some with us.Amazing.Stop by this place..... it is worth it, and is a nice alternative to a lot of the tourist traps that are in midtown.    You can feed your family a nice meal for a very reasonable price.",,,
167,Hunny P.,"Erial, NJ",4,312,392,4.0,7/1/2013,"Ordered the everything bagel with veggie cream cheese and a coffee. Everything was good. However, I expected something better than what I can get in NJ & it was exactly the same.",,,
