,er_name,er_location,er_freinds,er_reviews,er_photos,er_rating,er_date,er_text,er_useful,er_funny,er_cool
0,Nancy T.,"Wilmington, DE",58,145,1232,4.0,6/15/2018,"Nothing too fancy but its 24/7 and was open for me when my sweet tooth was aching. We stopped by here after dinner to get some sweets to bring back to our hotel room. They also have pizza and sandwiches/wraps. We got a slice of cheesecake w/strawberries & a giant chocolate chip cookie. Nothing special, the cookie was a bit ""firm"" but the cheese cake was good. Service was fast and friendly, was clean inside. They had a wide variety of sweets from cakes to cookies, donuts, cheese cake and fruit tarts and more. There were about 2 groups of other patrons dining in. and 1 or 2 people in and out. So this place seems pretty steady to me. If around and craving stuff late night again I will def return if in town.",,,3
1,Joyce R.,"Tulsa, OK",29,192,407,3.0,11/4/2018,"Hungry roaming near hotel in Manhattan.  Hubby wanted a slice and here we were. Open 24 hrs. Discount to Mount Sinai employees. Reviews are so mixed. We were fine. Grabbed drinks and a couple slices at window. Pleasant employees. Immediately fulfilled my glass/ice request. The pizza was fine. I've had better white. Needed more garlic imho. Place seems really small but people get packed in. Family atmosphere. Locals galore. Then hubby asked if I wanted a cannoli.  Big mistake. I luv cannoli. But this shell was cold, soggy with flavorless filling. Very reasonably priced: $6 for ham/Swiss on croissant, waffles & pancakes $7; scallion bagel $3.75; burger $8, or cheeseburger on brioche $9. Slices of cheesecake $6. You get the idea. With bountiful choices.",,,
2,Stephanny P.,"Elizabeth, NJ",0,2,1,3.0,10/23/2018,This is the type of place you find yourself in at 2 am after a night of partying when nothing else is open. The guys were very friendly and service was quick. Their menu looks good and its pretty cheap. We tried their pepperoni and cheese pizzas. They were okay... I mean... pizza is good no matter how crappy it is. But it tastes like every other crappy pizza you get at those Pizza & Fried Chicken places in Jersey. I would like to stop by again but this time I'll make sure to pick something else from the menu.,,,
3,Monique L.,"Irvine, CA",0,11,0,2.0,7/28/2018,Came here because I was craving for Pancakes.So I ordered the Pancakes and added the strawberries because why not.Then I decided to Order the Chai. They kept asking if I wanted chai latte? I said yes. And specifically said small. The order came out to be almost $14z. What the heck?! I saw that they charged me for a large Cappuccino which is like almost $2 more than Chai and  on top of that he charged me for the almond milk - which I know it's normal! But GeeZ!Anyways it tasted bad so don't order that. Pancake yeah skip that too . They also give you a bad pancake syrup and strawberries are not fresh. I think they are the frozen ones. I honestly don't know what the deal is with the cashier. Why are you charging more than you are supposed to. I even addressed to him that he charged me more and he said no and I was like whatever but I shouldn't have left that passedThe Manager was nice but this problem need to be fixed,1,,1
4,Diamond H.,"Oakland Chinatown, Oakland, CA",368,22,8,1.0,11/11/2018,"Gluten free pizza is garbage. The crust is like a soft cracker. GF folks dont come here, this is the worst GF pizza i have ever had",,,
5,Lauren D.,"Gainesville, FL",3,6,0,5.0,11/12/2018,Amazing! Gave us free cookies for being so kind  definitely a great place to come to for breakfast if you're in NYC!,,,
6,Cindy I.,"West Orange, NJ",0,2,2,3.0,9/13/2018,I was looking for something quick and yummy and my friend recommended this place I had a tuna melt and it was good I give it only three stars because the lady at the cashier I was told her name is Ruth was extremely rude ! She was annoyed that I told her that the piece of cheesecake wasn't the one I asked her.. she brought out the whole tray of cheesecake slices and slammed it out the counter and tossed the original slice in the garbage I didn't appreciate her attitude. Other than that the place was cool.,2,,
7,Veronica M.,"Kihei, HI",4,45,3,3.0,10/27/2018,"I got a #4 here which is the breakfast wrap and you get to choose 3 veggies + a cheese. I got spinach, mushrooms, and tomatoes and provolone. It was EXTREMELY bland. I also specifically asked for a wheat wrap and received a white wrap. It literally tasted like I was eating a plain tortilla. Pretty tasteless. The pancakes looked great and prices were reasonable, but I feel like I don't have a good reason to go back.",,,
8,Peter M.,"Alexandria, VA",118,458,201,5.0,3/28/2018,"Bottom line: One of the Best breakfast spots in NYC near Central Park.YELP ELITE  ALERT: I posted a check in, and the owner/Manager immediately came over to say hello and hoped we liked the meal. She gave us a short history of Fluffy's Donuts, and how they moved to their current location- and ""OMG"" - NYC SHOP RENT COST PER MONTH!!! (Yeah, I left a nice tip after I heard that!) She then went and helped others dining, and generally tidied up. She had that ""NYC Soul"" to her, which included a smile and a guarded happiness inside. If you get approached- say you appreciate her coming over! We did!More story: We came up for a visit to NYC to catch a show on Broadway, and we're staying near Central Park. A fellow foodie friend in DC (Thanks Beth!) recommended Fluffy's after asking where she had been. This classic deli style storefront has foodie ambassador written all over it. Inside, short order cooks whip up everything you could want in a meal within minutes. Seating is fast turnover, and there is ample rail seating if you are by yourself. (10% discount for student and medical staff!) Highly recommend breakfast here, because the food quality is very good and farm fresh to the counter. Plenty of to go items and fast snacks too.For me, I ordered a egg white omelette with veggies (darn diet!) that was one of the best I've ever had. Got the platter with home fries (cubed fried potatoes with onions and pepper) and thick toast - which are worth the carbs and odd shekel. Latte with almond milk was pretty good too. Wife had pancake & eggs, daughter had a NYC bagel and both were happy. Tried a small bite of pancake - and definitely ones from scratch with a welcomed hint of corn to them. Kid (8+) friendly. Definitely on my list to revisit. Price: For downtown NYC - ""fo-geht"" about it. Worth it. Go, eat, soak it in. Watch people. Definitely a good student drop in spot.",1,,2
9,Christopher T.,"Simi Valley, CA",0,9,3,5.0,6/11/2018,"This is my second meal here at Fluffy's in New York. The first time I got the Philly Cheese steak and it was phenomenal. It was a great sized serving and the flavor was delicious. The owner spent some time talking to us and recommending food and telling us about some things we should do and try in New York.My friends and I thoroughly enjoyed our meal so we decided to come back for breakfast today. The owner was here again so I decided to ask him what he suggested for breakfast. His suggestion was either #8 (French toast with bacon and fresh fruit) or the California breakfast burrito. There was 4 of us so we got 2 CA breakfast burritos, 1 #8, and 1 #5 (2 eggs with toast, home fries, and bacon/sausage/ham).The food was amazing. The serving size wasn't massive, but it was definitely filling. You could tell the food was cooked with quality ingredients. The owner was awesome, he sat down and chatted with us and really made the experience. If you are thinking of coming to Fluffy's, it shouldn't be a question, 10/10 recommend.",,,
10,Howie K.,"Albuquerque, NM",4168,1331,4551,4.0,1/4/2018,"Dear Fluffy's,It may be a few years until we return, but when we do, I'd like to make a request: don't tell my daughter about the Black & White cookie.First of all, we were really impressed by your overall menu selections, nice job. It wasn't so long ago that corner diners and delis in NYC only offered grease for breakfast, lunch and dinner; you guys are a true exception, providing plenty of healthy green options, like salads and quinoa bowls and tasty veggie sammies. Of course, in the end, the tourist got the best of me and I shoveled a slice of pepperoni and sausage down my throat but, hey, I felt better knowing I had options. But getting back to that request. So when we first sat down, this nice woman -- I'm assuming she was an owner -- walked over and handed my daughter a frosted donut with sprinkles, saying ""Eat your lunch and you may have this for dessert."" Look, I'm generally Scrooge about strangers pushing sugar on my kid, but that move, it warmed my heart. And then a few minutes later, this nice man -- again, assuming he's an owner -- came by and handed my kid a Black & White cookie, a big one. At this point my kid was just ecstatic: sugary treats for two solid days! I told her I would save her cookie so she could eat it tomorrow.As soon as that kid left my sight, I ate the Black & White cookie.My kid totally forgot all about it.Don't remind her.It was absolutely delightful, by the way.Sincerely, A Guilty Dad",8,11,6
11,Carman 2.,"South Austin, Austin, TX",0,7,2,3.0,11/9/2018,Service was good food was decent if you wanna try something local in New York you should go here.,,,
12,Gregory C.,"Holliswood, Queens, NY",0,977,1135,2.0,9/14/2018,"Located near the local hospital,  the place is open 24/7. Was  accompanying a co-worker to the emergency room, and needed a cup of joe. Got it here. Very bitter coffee. Ugh.",,,
13,Scarlet E.,"New York, NY",0,4,2,1.0,5/29/2018,"Disgusting! The worst chicken wrap that I've ever eaten!! $14 bucks for a wrap and oj.Let's start with the wrap, I asked for white cheese and got an overwhelming amount of yellow American cheese. I also asked for a warm wrap and got a cold one. How gross is cold chicken. Just wondering if he made it to his liking since he made it however he wanted to.The freshly squeezed orange juice was def over priced Tropicana with pulp! If I can give this place negative stars I will!",,1,
14,Imade O.,"Valley Stream, NY",0,4,0,5.0,10/24/2018,Owner was phenomenal checking in and also informing us to use identification for a discount,,,
15,Kaitlyn F.,"New York, NY",252,42,43,5.0,5/20/2018,"This is my all time favorite spot to order lunch while at work. It is centered perfectly between both my offices, and I pretty much order form there every Thursday. There are so many options to choose from so there is really something for everyone to enjoy. It is also great for catering. My team has ordered for large meetings, and the portions are huge, delicious, and the service always delivers.I usually get the grilled chicken sandwich. It comes with chipotle aioli that is to die for. They also give you a side of chips that you can dip in the aioli. I'd seriously put that aioli on a shoe and eat it. The chicken is perfectly grilled and pairs nicely with the aioli. The sandwich is huge and is served on a hamburger-ish type bun. It is not too much bread, but enough to keep everything together.  I have also gotten wraps and salads from here as well. They will pretty much make anything that you request and it always ends up being delicious. The prices are reasonable and the service is quick. You do have the option to sit and eat or take out. I usually take out, but I have sat inside as well. I always leave here extreme satisfied, and will be back next Thursday :)",,,
16,Muhammad A.,"Westborough, MA",3,32,31,5.0,4/21/2018,"Very good place for quick breakfast. The food is good and the prices are cheap. You can get a custom omelette for $9.Pizza is so good. The slice is big and filling. They are very fast making the food, so if you're in a hurry you should come here.I like the view to the street and we enjoyed the hospitality of the staff.",,,
17,Monica B.,"New York, NY",62,139,217,4.0,7/2/2017,"Soooooo many options! Desserts, coffee, smoothie, sandwiches, pasta, pizza, gluten free and more-Everything is as good as it looksThe 24oz smoothies are great for sharing. We had the exotic blast-peach, apricot, pear. With our smoothie we chose a healthy meal: red and white quinoa bowl with 3 toss ins and vegetarian avocado sandwich. All for $26 and tip.",4,2,2
18,Justin M.,"Brooklyn, NY",272,14,6,1.0,4/27/2018,"The stir-fry is basically soup, but instead of broth, they use sweet and sour sauce. I thought this would be a light option with rice and kale but my three options -- baby corn, mushrooms and broccoli -- are completely submerged in the sauce. It's disgusting.",,,
19,Tim C.,"Islip, NY",63,8,0,1.0,8/22/2018,Never got to order. All Spanish employees that chose to take the Spanish customers in line behind me. When I asked if I was standing in the wrong spot to pay (I was at the register) they didn't answer me. Not sure why. All I wanted was a coffee and the water I had already taken from the refrigerator. Absolutely disgusting that they would treat me this way.,,,
20,Guy H.,"Dallas, TX",3903,740,1842,3.0,6/15/2017,"Not bad when you have walked around NYC for the last five hours!  Seriously the pizza is above average, fast and friendly service and a place to sit and watch the world parade by on the sidewalk.",2,1,1
21,Dessy I.,"Miami, FL",30,88,58,3.0,1/30/2018,"Stopped in here with the family on Christmas Day. Thankfully they were open and service was fast, friendly staff. We did all order egg and cheese sandwiches and sadly the eggs were not fully cooked, well at least mines was not. Also, got a chocolate muffin which was pretty good. As far as pricing, it was reasonable. Nice little spot but extremely packed so there was nowhere to sit which was an inconvenience but hey, it's NY so it was expected. Overall, it was okay.",,,
22,Maddie M.,"Livonia, MI",0,2,0,5.0,9/3/2018,Super fast and super good! Just a small place so not a lot of seats but people come and go pretty fast.,,,1
23,Bill C.,"West Des Moines, IA",1,6,0,5.0,10/13/2017,"I was there this morning for a fast breakfast.Nice vibe nice people.Fast,good,the guy who was cleaning the tables was very efficient and polite.The cashier cute and smiling.The cook quick and productive.Nice place to be for a bite before work.Highly recommended.",1,,1
24,Dan R.,"Manhattan, New York, NY",186,2,0,5.0,4/29/2018,"This is the best deli/diner to live next to. The food is always so delicious, quick, and fairly priced. The portions are large and the cooks always deliver an appetizing and tasty meal.The service is also fantastic and the seating area is becomes bigger than it appears. A wonderful family style restaurant!",1,,
25,Nick V.,"Colorado Springs, CO",29,102,35,3.0,12/10/2017,"Good place to grab a quick bite. Stopped in here on the way to the Lincoln Center. It was packed even at a random time of day. The pizza was tasty but greasy. Good selection of drinks. Fast and efficient. Surprising awesomely low prices. It is not the best pizza in NYC, not even close. But it doesn't pretend to be. It is quick cheap eats to satisfy a craving of the now and it fulfills that purpose. I would not seek this place out to eat here, but if on the way past it again we get hungry, I would stop in and get something.The desserts looked fantastic but I didn't get to sample any. I may try one of those next time...",,,
26,Richard K.,"Denver, CO",4,27,3,5.0,3/25/2018,"Five stars for excellent comfort food, on-the-go food, and inexpensive carbs!  I eat here often when I am in the area since the food is reliable and hits the spot.  It is not gourmet, but it is satisfying.  The staff are friendly and efficient.  The environment is busy, but clean and comfortable.",1,,
27,Michael D.,"Manhattan, New York, NY",261,2,0,1.0,6/30/2018,"I've come here quite a few times and the food is pretty good. However, the lady who works the register on Saturday mornings is extremely rude and unwelcoming. Today my partner and I had an awful experience with her. We ordered 35 dollars worth of food and then we paid with a credit card. We then decided we wanted to add strawberries to our order, we told her and she said ""ugh, okay that will be 2.5 extra,"" in a very grumpy way. We handed her the credit card and she pointed to the ""5 dollar minimum"" sign after we already spent 35 bucks there.  I have never had this happen to me anywhere in New York before, this is extremely inappropriate. I also find her attitude to be very different from the other workers there. There is a manger there who always checks on the customers and he is so sweet. I'm not really sure why this woman works there if she hates her job so much.",2,,
28,Memorable T.,"Elmhurst, NY",0,152,0,3.0,2/4/2018,"This cafe offers the following: pizzas, pasta, salad, sandwiches, breakfast foods, and coffee/desserts. I have tried their pizzas and bagels. The taste is okay, but nothing special.It is just convenient and that is pretty much it...It is not cheap though...",1,,
29,Lisa N.,"Reston, VA",0,3,0,5.0,8/18/2018,"We stopped in because of the convenient location and ordered sandwiches to go for our hotel room. What a great discovery! Sandwiches were great, black and white cookies just what we needed after a long day of touring. Decided to give the breakfast a try the next morning- the perfect diner experience! Fluffy pancakes, gooey French toast, fresh fruit, quick service, and a window spot to watch the hustle and bustle of the neighborhood! Wishing we had a local diner like this back home!",,,
30,Tiffany D.,"Atascadero, CA",168,15,1,5.0,3/5/2018,INCREDIBLE service from the owner! The food was incredible was well but he really made the experience great. He brought us free dessert and made us feel so welcome.,,,
31,Rhonda A.,"Edmonton, Canada",19,34,26,5.0,8/1/2017,"Great place for lunch.   Salads, rice bowls, sandwiches, panini, and great cheesesteaks.  Small seating area.   Very reasonably price.    Service is top notcj",,,
32,Nick M.,"NY, NY",101,3,0,5.0,8/2/2018,Excellent customer service every time I stop by!! Owner is very involved with customer service and always makes sure you have a good experience,,,
33,M L.,"Bothell, WA",0,3,0,5.0,7/30/2018,"Good breakfasts, bagel, and cannoli.  Staff was friendly. Reasonable value.   Much more that looked good, but was already full!",,,
34,Jenni O.,"Brodnax, VA",0,7,3,4.0,4/7/2018,This place has been our go to for breakfast and late night pizza!!   Cook to order breakfast.   Fresh ingredients.   Avocado in their burritos is the best.    We even had them delivery today for breakfast to our hotel.   Pizza at night is just as good.  Very fresh.  Lots of options.   Can't go wrong here.   They also have a good selection of deserts and muffins.   Cheesecake was very good as well.,,,
35,Jason R.,"Templeton, CA",0,1,0,5.0,3/5/2018,This place has excellent service the owner is one of the nicest people I've ever met thank you!,,,
36,Joseph M.,"Boca Raton, FL",0,2,0,5.0,3/18/2018,"One amazing little deli With some of the best chicken noodle soup I have ever had. Very good pizza, excellent desserts. I was in New York for a three night stay and came here four times. Quick service, very friendly.",,,
37,Andy L.,"Earth City, MO",76,1,0,5.0,7/15/2018,"Owner met us on the sidewalk after a bike ride in Central Park. Great pizza and pasta and the famous black and white cookies. Quick, friendly, and tasty. Will definitely go back again!",,,
38,Andy A A.,"San Fernando, CA",0,18,1,5.0,11/14/2017,"Coming from LA it is always a treat when you go somewhere and the food is great, fast, and at a good price. This place is awesome! Has it all. I highly recommend it if you are anywhere near.",1,,
39,Kate H.,"New York, NY",73,57,31,4.0,6/30/2017,"A terrific place for a quick, filling breakfast in midtown. Prices are good, food is tasty, and portions are reasonably sized compared to other delis in the area. I ordered an omelette with potatoes and toast, while my husband had a huge plate of challah toast with berries. The whole meal came in for less than $15, and we were full until dinner time. There is also a full pastry case here with lots of desserts, if you're looking for something on the go.Coffee was just okay, like much standard deli fare. Would recommend going elsewhere for your caffeine fix, if taste is your goal.",,,
40,Tiffany H.,"Sand Springs, OK",0,4,0,5.0,6/26/2018,This was right on the corner from our hotel and we visited here daily.  The food was good and the service was always fast.  It was inexpensive in comparison to most NYC places and the portions were huge.,,,
41,Debi R.,"Pollock Pines, CA",0,3,0,4.0,7/15/2018,"Stopped by sunday morning for a quick breakfast. Service was good, quick, to the point. Pancakes were fresh and hot off the griddle. Coffee was excellent. We also had a breakfast burrito and doughnut. Both were good.",,,
42,Joseph F.,"New York, NY",140,204,438,4.0,5/1/2017,"For a quick egg, cheese and avocado it was perfect.Not the most dressed up deli/cafe/pizzeria in NY, but it got the job done and they gave me a lot of avocado.",,,
43,Gwen T.,"Manhattan, New York, NY",9,3,2,1.0,"7/20/2017
            





Updated review","It was my first time to be here and i was so disappointed. I got a crispy chicken cutlets burger but they cheated on my bill, they charged me extra over $1 for another meal and they didn't give me the receipt until I asked for it. The staff wasn't nice as well.The sandwich was good but I recommend that you should pay attention to the price when you pay for it",,,
44,Suzanne S.,"Canyon Lake, TX",1,8,0,1.0,12/16/2017,"I ordered the cheeseburger and fries on seamless. The cheeseburger was a frozen dried out gross patty with translate lettuce. I ate some because I was starving and paid $15 for it, its been 24 hrs and I still feel like a lead is stuck in my stomach. Never again",,,
45,Courtney A.,"Sarasota, FL",1,12,1,1.0,3/24/2018,Frozen pizza is quicker and isn't 8 hours old- nooooooooooo to this place- I live next door. I always refused to eat anything besides pizza. I'm sick from being served pizza from the AM. Won't go back even for a desperate slice.,1,,
46,Brooke N.,"Manhattan, New York, NY",0,19,3,5.0,7/15/2017,"We went here at least one time a day when visiting!  They have everything you could ever imagine and then some. Fast, friendly service!!",,,
47,Alicia R.,"Manhattan, New York, NY",15,1,0,1.0,3/30/2018,The food is good but the staff are rude.   I will never eat from here because their customer service,1,,
48,Ding E.,"Manhattan, New York, NY",0,1,0,5.0,6/15/2018,Great pizza with amazing costumer service. Family had pizza and I had the Quinoa Bowls. A lot of options and cooked perfectly. Will visit again when I return to NYC. The manager was also very helpful to our family about first time visitors to the city. Thank you!!,,,
49,Matt D.,"New York, NY",8,6,33,5.0,5/5/2017,"Clean, fast, nice staff, convenient location (2 mins) from Columbus Circle. You can even stay there and eat. They have everything you find in a normal corner deli in Manhattan. They also have a bathroom.",,,
50,John G.,"Manhattan, New York, NY",0,11,0,5.0,5/31/2018,"I always order to go and they never miss an order. Very accurate and the food tastes great. I highly  recommend. I have tried the pizza, paninis, stir fry and pasta. Never been disappointed.",,,
51,Rebekka G.,"Las Vegas, NV",163,8,1,5.0,11/4/2017,"My group and I happened to stumble across this place while walking around in NY, just from outside we could immediately see how tasty the food appeared while looking in from the window. We decided to walk in and we were not disappointed! We all enjoyed our breakfast and were surprised at the options for those with gluten allergies. While there was a bit of a line, we did not have to wait long for our food and we were lucky to find a table because people do grab them quick",,,
52,J I.,"Brooklyn, NY",11,42,9,5.0,2/16/2017,"Today was my first time here. The General manager and staff were so kind to my friends and I. I got Penne with basil pesto, sun dried tomatoes, grilled shrimp. Cooked fresh and so amazingly good! If you're a student or performer in the area you get ten percent off too! Definitely come to Fluffy's!",,,
53,Rinda P.,"Tulsa, OK",91,23,2,5.0,9/9/2017,"Very small cafe but great food and large selection. Some of their items can be custom made such as stir frys, salads, or burgers. Great pricing. Lacks good friendly service. But overall pleased by this meal outing. Will come back.",,,
54,Ryan G.,"Queens, Queens, NY",0,4,0,1.0,10/25/2017,They do accept card although their machine was not working when I was there. I went to their ATM to get cash and it charged me without dispensing any cash. When I asked to see a manager they said he was outside on the phone smoking a cigarette.,,,
55,Christopher K.,"Glendale, CA",10,128,314,1.0,12/25/2017,Was a really cold night and needed some tea. The only place open that was close by was Fluffy's. Came for some tea and what I got in return was being charged Starbucks prices and Lukewarm water. Not sure how you mess up tea. I did not try any of the baked goods or sandwiches on display but they all looked old.,1,,
