,er_name,er_location,er_freinds,er_reviews,er_photos,er_rating,er_date,er_text,er_useful,er_funny,er_cool
56,J. Lee K.,"New York, NY",3,11,1,5.0,2/12/2017,"What an unexpected deli/cafe experience...personal, kind, abundant service!! I'm definitely not needy when it comes to a quick meal, all I require is the correct order and hopefully not waiting too long. However this morning I popped into Fluffy's after the gym and was hoping for breakfast but realized I was too late in the day. Instead, I selected one of their quinoa bowls (mixed in broccoli, kidney beans, walnuts and a sesame ginger sauce) and was so incredibly happy as I was eating it. Delicious, fresh ingredients.I also ordered a coffee with soy milk, more because I like the taste and not because I'm lactose intolerant. They had run out of soy milk at the counter, but someone left to find more that had recently been delivered. I was happy to wait or swap for cream, nibbling on my food but the manager (owner?) Spiro rushed over and offered a free bottle of water while I waited. I declined, as I had my own bottle, but thought that was very kind. He also hand delivered my coffee once it was ready, and suggested I make use of the free condiments to add more flavor up my dish. I have eaten in a lot of delis and restaurants in the city and have never felt more at home in a place before. I will definitely be coming back!",,,
57,Candice C.,"Joint Base Andrews, MD",107,38,72,3.0,11/13/2016,"If you in that "" I need some good New York pizza"" I wouldn't say this is the place but it's definitely a standard fulfillment If you're hungry looking for a quick bite. They server a wide variety of vegetarian friendly entrees. I went there looking for a slice and I was not amazed but satisfied. It's open 24 hours and delivery is free so that's a plus !",1,,
58,Cheyenne B.,"White Plains, MD",0,5,0,4.0,8/4/2017,Nice!Clean!& Fast! The food is good(Not the best) but if you're in a hurry and hungry looking for a nice quick bite then this is the place to go!,,,
59,Pete K.,"San Francisco, CA",2,32,1,1.0,10/29/2016,"Bad stale food, confused staff, the cashiers and cooks didn't even know what some of the menu items were (e.g., breakfast pizza). I ordered a breakfast croissant - I got a cold stale croissant, cold slice of stale cheese, and a hot tasteless egg.A street vendor would have been better.",1,,
60,Emily S.,"Houston, TX",55,82,7,3.0,6/27/2017,Food was meh.. nothing memorable. The service was the same. Typical NYC deli/bagel shop with pizza. I ate here a few times as it was next to the Hudson Hotel that I stayed at while in Manhattan.,,,
61,Matt K.,"New York, NY",263,93,22,4.0,6/26/2016,"To preface, Fluffy's is your standard, very crowded midtown cafe swarming with tourists (this place is steps from Carnegie Hall, Times Square, and Central Park).  That said, the food here  is shockingly incredible (particularly the breakfast specials) and more than worth the commotion.  As someone who lived half a block from Fluffy's for two years, there is something about the way they make french toast (and I can't figure out what it is) that makes their french toast some of the best in Manhattan.  The custom pasta option menu is also a favorite, with nearly every type of pasta, sauce, and add-in imaginable.  Outside of the bakery items (which Midtown cafes have a tendency to excessively markup), most of the menu items are very attractively priced (with most of the breakfast and dinner items anywhere from $5-8 dollars).  Service is fast and friendly.  Definitely swing by if you're in the area (and don't forget to try the French Toast).",5,,1
62,michael t.,"Elmhurst, NY",0,24,17,2.0,7/31/2016,Just ordered pancake roll-ups with strawberries and blueberries. It looked beautiful when i got them but the strawberries were disgustingly  over riped! Didnt bother eating them.,1,1,
63,Chi O.,"San Diego, CA",455,12,0,5.0,12/9/2016,"Great place for a quick, yummy lunch with great service!This place had some of the kindest people you will find in New York. While I was here the girl behind the counter told me about their discount for students and employees in the area and gave it to me and my friend even though we didn't have our IDs on us. The owner came by and checked in on us as well, to ask if we were alright and offer us free black and white cookies to compliment our meal.As for the food, it was also pretty great! I had 2 slices of pizza which were better-than-most for a place like this, and my friend got a salad which she also really enjoyed. Their salad bar had a lot of options as well and was very well stocked. Their broad menu of options means that anyone you come with will find something tasty and fast to eat!",,,
64,Jasmin I.,"Miami Lakes, FL",3,2,2,5.0,6/5/2017,"Best damn breakfast! Good food, efficient, and the owner is a gem. Excellent hospitality! Highly recommend this place. And they also offer a student discount :-)",,,
65,Sumon A.,"Reston, VA",1,27,4,5.0,11/25/2017,Best New York Style Pizza that you will find. Try the margarita pizza or the white pizza. They were some of the best pizzas I've ever had.,,,
66,Deb W.,"Long Beach, CA",44,40,17,4.0,5/24/2017,"A wonderful little place to enjoy real New York life, I think.  (I was a visitor)  The manager was super nice and attentive and the food was great and it was a bustling little café with lots of choices!   loved it.",,,
67,Jane M.,"Morris County, NJ",146,372,219,3.0,3/26/2016,My daughter is new to the neighborhood and we needed a quick bite while moving her into her new apartment. The chicken Parmesan sandwich was delicious. It's our first visit and it was take out bur we are looking forward to trying other menu items.,2,2,1
68,Carlos A.,"New York, NY",24,7,0,5.0,5/17/2017,"The spot to go for a quick lunch during my break at Fordham, and they offer student discount!",,,
69,Vinni J.,"Bethesda, MD",0,27,0,5.0,4/16/2017,Had breakfast there and it was really good. French toast and waffles were made quickly and were tasty. It's busy here but the staff move folks quickly. Great desserts on display. Reasonable prices!,,,
70,Ellen D.,"New York, NY",118,5,0,5.0,5/22/2017,"A midtown deli with a soul! What was most striking to me was how kind and pleasant the staff was. The menu is extensive with some gluten free options as well (why I ended up there). They have gf pancakes, bagels (Udi's) and can make any sandwich with gf bread. My rice bowl would have been a little better if not served so piping hot and if the rice wasn't cooked as long, but otherwise a great experience!",,,
71,Nicole F.,"Manhattan, NY",902,19,0,5.0,5/14/2017,"One of the best pizza spots in Manhattan! Must try the bacon and pepperoni slice. Absolutely delicious. The deli sandwiches are also amazing. My personal favorite and weekly go-to is the Prosciutto Mozzarella. But above all, Fluffys has some of the BEST cheesecake I have ever tried, along with amazing cannolis. Prices are just a little higher than I'd like, but it's worth it.",,,
72,greg w.,"New York, NY",16,412,1,2.0,9/11/2017,Really overpriced for and not that great!  8.93 for an omelet and no sides.  This place is a bodega...,,,
73,Lori C.,"Bellingham, MA",119,4,1,5.0,3/9/2017,"Great lunch with new friends and old!!!  Great selections!! Awesome Staff & Owner, will definitely go back next time in NYC!!!",,,
74,Michele C.,"West Pennant Hills, Australia",0,5,0,5.0,3/30/2017,"Very happy with our meal at Fluffy's. Both the 18"" cheese pizza and 12"" gluten free pizza were delicious. Total cost $40. Staff were very friendly, tables were clean and we look forward to our next visit to Fluffy's. Note re gluten free: we are not highly sensitive to gluten so can't attest to whether their is risk of cross contamination.",,,
75,Estefanía L.,"Orlando, FL",132,290,348,5.0,10/18/2014,"*** Please disregard all bad reviews!! ***I have traveled several times to NYC over the years and never leave without stopping here once, twice, or--if possible--three times. Their salads made to order and quinoa/brown rice bowls are phenomenal. Service is always great. From the moment you walk in, they are greeting you with kindness. I also love their yogurt and fruit parfaits that they make everyday fresh (as all their food is).Although I am unfamiliar with their pastries (I do not eat sugar or flour) but have been given great reports by good friends and family that have accompanied me to Fluffy's since I cannot let them miss out on this hidden gem.If you live here and have not stopped here, WHAT ARE YOU WAITING FOR? And, if you are visiting, DO NOT MISS IT!!! You will not regret it.",6,,1
76,Marian A.,"Toronto, Canada",0,16,3,5.0,3/16/2017,"My friends and I were visiting NYC and got stuck in the city during the ""snow day"". We were staying by a hotel near Fluffys but had walked by it several times during our stay. We decided to stop by for brunch on the day of the snow day and I'm so glad we did! First off they were open despite the weather and all of the employees were so nice! I ordered a slice of pepperoni and sausage pizza as well as a vanilla donut. Both items were so good and filling! We also had the chance to meet the owner who shared with us how he got to own the shop. He was so kind, he even gave us free cookies. I enjoyed my meal and great customer service so much that I went there again for more pizza the next day lol I had the BBQ chicken pizza and the pepperoni with sausage again. I recommend you all visit fluffy's when you're NYC regardless of where in the city you're staying. Well worth it.",,,
77,L K.,"Brooklyn, NY",3,43,2,3.0,8/18/2017,"Fluffy's will definitely be my go-to place for affordable good food.  what a find in that neighborhood.  It's ""atmosphere"" is it's lack of ""atmosphere"".  Bright glaring lights, small, odd shaped.  But quite decent salads, pizza ok, and the deserts do look tempting.  This place is a win.  I suspect Fluffy's get's crowded during peak times, and when the bars close.  See you there!",,,
78,Miguel O.,"Miami, FL",179,1,0,4.0,4/12/2017,I had a chicken chipotle panini and it was so delicious and toasty and the baked ziti pizza is amazing!!!!,,,
79,Melissa P.,"New York, NY",1,14,0,2.0,4/11/2017,"Don't think I would ever go back to this place. Ordering here is a mission. No organization, staff is all over the place, manager or owner is rude. I got a crispy chicken cutlet sandwich and it was pre-made heated up, so it soggy. Save yourself the stress and go somewhere else.",,,
80,Mateo V.,"Manhattan, NY",0,2,0,3.0,3/11/2017,I Love their Buffalo Chicken Pizza but not a fan of their pancakes especially the price is too much just for two pancakes.,,,
81,Michelle h.,"Frederick, MD",36,48,56,5.0,11/14/2015,Great spot for lunch! Feta pie was great! Make you own salad. Fantastic baked goods! Stumbled by and so glad we decided to stop. Friendly staff and fast service!!,1,,
82,April M.,"Henderson, NV",0,11,0,4.0,9/14/2015,"Enjoyed breakfast here two days in a row, under $20, our previous breakfast was $60 w/tip! First day, we both had a hot ham/Swiss croissant, it was the bomb. My husband just had a coffee and I had a double chocolate frappe. Let me just say the next day, I had a LARGE double chocolate frappe, yes it was that good. I'm sureI'll have one more of those before we leave!!!",1,,1
83,Kaitie M.,"Manhattan, NY",159,5,0,5.0,1/31/2017,"I ate in Fluffy's yesterday, which I think might be under new management? It used to be good before but my meal was delicious. The manager came and offered us a discount for our next trip and at the end, gave us a free cookie. Highly recommend!",,,
84,Dana A.,"Brooklyn, NY",101,8,3,4.0,6/7/2015,"You can make up your own pasta, salad etc or you can get something pre made. The food is prepared in plain view. The service was excellent. The food was tasty and even to much to finish. Worth a visit if you are on the go in the Central Park area",2,1,2
85,Andy M.,"Myrtle Beach, SC",222,25,3,5.0,12/18/2016,Good tasting food. Tried breakfast and lunch. VERY reasonable prices and friendly staff. Great place to stop in and take a break or refuel. Get the breakfast platter for the great potatoes. Yum!!,,,
86,Ellen S.,"Stamford, CT",0,5,0,5.0,7/19/2017,Nice surprise! They have quinoa and stir fry bowls made to order. Along with deli sandwiches and pizza. Great for a quick bite! It was a hot day in the city and the owner came by and gave us free water bottles and asked how everything tasted. He came back around to ask where we were from and what brought us to the neighborhood that day. Super friendly for NYC!,,,
87,Atifa R.,"Mississauga, Canada",1,27,1,1.0,8/20/2016,Horrible horrible customer service.Food is extremely overhyped - we got 5 different meals and all were blah.  The food didn't sit well with a few of us. Would never go back - mostly bc of the horrible service,1,,
88,Ellyce B.,"Bakersfield, CA",0,49,30,5.0,8/6/2016,Visited this great pizza spot after exploring Central Park in May. Delicious New York style pizza by the slice and good selection of desserts. Excellent Tiramisu. Owner was on site and fun to talk to. Highly recommend!,1,,
89,Gary C.,"Brooklyn, Brooklyn, NY",102,1,0,5.0,2/3/2017,Very welcoming environment. The manager walks around to ensure your food and experience is great. Wide variety of food. Burgers are delicious!,,,
90,Heather H.,"Manhattan, NY",1,53,0,1.0,10/12/2016,"HORRIBLE!!!!!!! Seemed like a standard sandwich and salad place. Whoa was I wrong. Over priced ($15 for a salad)- RUDE, staff who got my salad order wrong and than proceeded to charge me for toss-ins I never received. Not even close to fresh with wilted and slimy lettuce in my salad. When I asked for not slimy lettuce I was scolded. Bottom line -Don't waste your money here!!!!",,,
91,Angel C.,"Newtown, PA",29,108,30,3.0,4/17/2017,"The lady who answered the phone was not very friendly. She didn't listen to me completely cause she was rushed and wrote down the wrong address. 40 minutes pass, she calls me and asks why didn't I answer the door? Umm, I'm here? No one knocked on the door.. I said so you have the right address.. I'm at this hotel, tower A.. She says you never said tower A! I said wo wo.. I did try to tell you just like I'm trying to tell you now but you're talking over me, not listening! Now do you want me to meet him in the lobby? She says OK, and hangs up on me. (Only in NY!) I think he went all the way back to the pizza place cause it took forever and he finally called my phone but he was at the WRONG hotel... Ugh... I text him the address and he arrives shortly after. The food was a lil cold, obviously.. but, it was still good cause we were very hungry. My advice is to have milkshakes, fried pickles  and sweet potato fries on the menu. And take your time on the phone, so you don't waste time delivering the food.",,,
92,Keith N.,"Austin, TX",0,3,0,5.0,7/16/2016,Stepped in to the place for a late lunch after a busy morning and had some great slices of pizza.  There was a great selection and the people there were super friendly and helpful.  I left my camera there by accident for about ten minutes and they had it for me behind the counter nice and safe.  Its not too far from the subway stop at Columbus Circle but just far enough away to not be over crowded.  Definitely recommend!,1,,
93,Merissa M.,"Woodmere, NY",1,3,0,5.0,5/7/2017,"Their pizza is New York Pizza. Anyone who is looking for a legit NYC slice, a late night bite or just some great food - come to fluffies. They know their stuff",,,
94,Steven H.,"Franklin, TN",6,13,0,5.0,6/9/2016,"Fluffys is back and better than ever. Great cheeseburger, pizza by the slice, and fantastic salad bar. Desserts are the same as always, meaning excellent. Same friendly service, always going the extra mile, with the extra smile. The walk over to 58th and 9th is worth it!",1,,
95,Shayla O.,"Latham, NY",0,1,0,5.0,6/19/2017,"Fast, friendly service. Employees and owner are all very attentive. Definitely recommend the penne vodka. Better prices than many other lunch places in the area",,,
96,Lesley L.,"Orlando, FL",47,66,8,5.0,3/28/2015,We found fluffy's 8 yrs ago. We had walked out of the big dollar deli across the street and we were looking for something good to eat. We found fluffy's and we ate several times that trip. We even ate thanksgiving dinner with them.  It is a family owned businesses with a big heart. So when I booked our hotel for this trip I looked for something close to fluffy's...true story. Our first stop today was fluffy's. They have up dated but still the same great food at a good price. Not many places in NYC you can buy a bottle of water for $1.50. I can't wait to see what soup you have tonight.,2,,
97,David F.,"Corona, CA",29,22,5,5.0,5/15/2016,"Pizza is much better than I expected it to be. It tastes like a typical NY slice, very greasy and cheesy. Slices are a bit small, but it's still worth the price",1,,
98,Andrea C.,"Naugatuck, CT",24,33,13,3.0,6/5/2015,"Came here for breakfast while working in the city because it was right around the corner from our hotel. Had a simple wrap for breakfast which was good and the prices were very reasonable. Also, they had lots of yummy looking desserts but wasn't trying any for breakfast.Very friendly staff and food was quick to come out! If you are on the go and just need something quick- check this place out.",,,1
99,Jacqueline O.,"San Antonio, TX",33,4,0,5.0,9/12/2016,"I got an omlette and my husband got the pancake roll and all of it was awesome! Not to mention the customer service is flawless. Seriously, the manager gave me a bottle of water because he didn't want me drinking tap water; so nice. Also, service was fast and fresh. We will come back for sure.",,,
100,Dana C.,"Eastchester, NY",2,38,6,2.0,11/8/2015,"Only flaw with the falafel is the falafel...Amid the deli's, pubs and fast food offerings for a quick bite in the City Center area, this vegan was happy to see that Fluffy's offered a falafel wrap (or platter). As soon as I saw the falafel balls being taken out of the microwave, my expectations dropped to the floor.Really, nuked falafel I the middle of NYC? Shame on you.The reason for the 2 stars, instead of one, is for the traditional grilled pita and very fresh veggies. Those ingredients with the tahini sauce is the way to go if you find yourself here. Just remember to skip the falafel.",,,
101,Cece Y.,"San Francisco, CA",2,726,711,3.0,1/21/2015,"Casual spot with standard deli fare:  bagels, pastries, yogurt, salads, sandwiches, pizza, etc.  I strongly prefer the quality of Starbucks and Tisserie across the street, but this place didn't have a line.  Now accepting payment via LevelUp.Plain Bagel w/ Lowfat Cream Cheese Schmear: $1.91",1,,1
102,Eric G.,"Lawrenceville, GA",59,21,1,4.0,9/30/2016,"Absolutely love this place for the Mississippi mud pies they I can't find in North Carolina. They do have a great variety of pastries/desserts, have not tried the pizza so I can't help you there.",,,
103,Megan L.,"Fox Lake, IL",0,3,0,5.0,3/27/2017,"SUCH A GREAT PLACE! They are super fast and super delicious, and the customer satisfactory is at the al prime high. You can really tell they want their customers to enjoy their meal. The owner came and even brought us water and asked how our meal was. Very happy with this and the pizza was fantastic! Coming from Chicago I was excited to try the New York pizza! Very great impression!",,,
104,George C.,"New York, NY",0,7750,14306,3.0,2/7/2015,"Standard midtown food/mess hall trying to be trendy*, so I went with chips. Can see this joint being a nightmare when there's an actual rush, as the 4 staffers behind the counter couldn't even handle the 4 of us on line.*Their LevelUp receipt has a huge image boasting ""BROWN RICE & QUINOA BOWLS Try our Organic and Gluten-Free HIGH PROTEIN SUPERFOOD""Transaction Amount $2.00Credit Applied -- $2.00Total Spent $0.00",1,,
105,Christina L.,"West Roxbury, MA",28,26,4,3.0,2/28/2016,"It was fine. My boyfriend and I wanted a sweet dessert and we came upon Fluffy's. I got a strawberry shortcake which was pretty soggy and my boyfriend got a couple of cannoli's which he said were fine. The atmosphere was more hole-in-the-wall New York City deli and less like a bakery, aside from the glass case. I probably would be afraid to try their cheesecake.",,1,
106,Ron K.,"BAYSIDE, NY",0,13,2,4.0,2/25/2017,Great to see an attentive owner checking in on the customers. The food was good for a typical get anything type cafe. I rarely write about restaurants but I'm happy with the owners customer service,,,
107,Sharon G.,"Miami, FL",18,100,142,5.0,1/16/2015,Amazing food. Always fresh. The pancakes are delicious. We always come here when we're in the city for vacation. The service has gotten way better. Friendly faces.,,,
108,Carissa L.,"Philadelphia, PA",82,316,5,4.0,10/8/2012,"Two and a half stars?  Seriously?  This place is worth more than that, from what I've seen so far.I (unfortunately) work across the street.  Fluffy's is usually a convenient place to get coffee in the morning for at LEAST $.25 less than the other delis.  However, I must say, the food I've tried isn't half bad.  Awhile back I had a grilled cheese and some soup and the price was better than anywhere else in the neighborhood.  Today, after a fruitless search for vegetable soup (this was the fourth place I tried), I found that Fluffy's had cream of mushroom (close enough).  It was DELICIOUS.  It almost tasted like there was butter in it or something - whatever the ingredients were, they were comforting to my sickly little body.  The soup comes with a free piece of roll, too - all for $4.08.  Lastly, their 'small' soup is larger than any I've seen around here.I'm pretty sure some of the 1-star reviews are from trolls (for example I've never seen a roach in here or any other signs of a dirty atmosphere)...so...don't knock this place until you've tried it.",1,,
109,Armita P.,"San Diego, CA",30,21,6,5.0,6/27/2012,"Every summer my family and I make a trip to NYC and every morning during our stay we have breakfast at Fluffy's (we may be addicted, as we book our hotels within walking distance). I've got another NYC trip coming up next week so naturally, last night, I dreamt about my mornings at Fluffy's. I guess there isn't anything subliminal about that. My sisters devoured their waffles with strawberries, bananas and whipped cream. My father stuck to his morning routine, bagels with cream cheese and a hot Celestial tea (some earl grey flavor that it seems only Fluffy's carries), all while stealing bites from my sister's waffles. My mother savored every bit of her cheese and broccoli quiche (her favorite) while I stuck to my egg-white ""Healthy Omelet"" as they've branded it. Despite this all being in my dream, this hardly strays from reality. The food, especially breakfast, is delicious and delightful, made fresh right as you order it. The staff is always friendly. One morning they really spoiled us and gave us some complimentary pastries that we had no idea where we're going to fit in our stomachs. Last summer, they knew my father had been hunting for that Celestial tea and gave him a box to take home with him (should have seen him at home, like a kid on Christmas morning, every morning). They're always fun to chat with and despite how busy it can get in their little bakery during the morning commuter hours, they're always on top of things. Fluffy's is a spot I wouldn't pass up. As long as we visit The Big Apple, we'll keep coming back.Side note: Last year, I bought a Fluffy's mug, which unfortunately didn't make it in one piece on the trip home. Good thing we're going back :)",3,2,2
110,Dee B.,"Elk Grove, CA",0,19,2,5.0,3/10/2017,I love this place. Service was great food was good. We tried Buffalo pizza and pep and sausage. Good good good. !!!! Nice visit to NY our first stop!!,,,
111,Josh C.,"Pittsburgh, PA",56,238,3,4.0,9/1/2012,"My wife and in-laws stayed in New York for 4 nights, we ate at Fluffy's for breakfast 2 of those days and were not disappointed.  The staff at Fluffy's was friendly and quick.  The food is very cheap for Manhattan standards and good.  No complaints about service, cleanliness, or food.  Too bad it's so small.",1,,
112,Wilver C.,"Melrose Park, IL",0,5,0,4.0,2/24/2017,I was in NYC for a few days and was looking for a good place to eat breakfast/lunch that wouldn't make a huge dent in my pocket. Fluffys was right by our hotel and we decided to give it a try. The food was extremely good. It's open late so it allowed for me to be able to get a snack in the middle of the night after returning to the hotel and then breakfast the next morning. Large variety of food which is great since they have things for everyone. Quick service. The only thing is it is pretty small and in the morning it was fairly full.,,,
113,Diana T.,"Locust Valley, NY",146,3,22,5.0,3/15/2015,"Delicious, great price especially in the city.. A grade on window.. Owner so sweet and generous.. Glad I chose to eat here with my children.. So much healthy foods to choose from I will be sure to come back next time I'm in the city..",,,
114,Kim B.,"New York, NY",85,45,10,4.0,6/25/2014,"This place is pretty solid.Fluffy's Cafe & Bakery has one of the very best Italian Hero Sandwich I've ever had. This place is an absolute gem! Favorite Tuscan Melt Panini and Italian Hero Sandwich. My brother and I usually share the sandwiches with each other... not this time, I had no plans of sharing. It was too good. The staff are so sweet and helpful. Very nice people. Keep up the good work.",1,,
115,S S.,"Houston, TX",21,19,1,4.0,12/24/2014,"Food was not bad! I ordered a bowl of oatmeal, gluten free waffles, Spanish omelette and a cafe au lait. I must say for a little hole in the wall this place is awesome. Close to the hotel. Good food. Cons: very small. No smiling faces.",,,
