,er_name,er_location,er_freinds,er_reviews,er_photos,er_rating,er_date,er_text,er_useful,er_funny,er_cool
0,Adam W.,"Rockville, MD",194,3,0.0,5.0,8/18/2018,"Don't let the name fool you - while it does have the look and feel of a neighborhood dive bar, the drinks, food and staff are of the highest quality! I love the rotating beer selections on draft, a good mix of local craft brews and popular beers from throughout the US and Europe. Additionally, their whisky selections are top notch and extensive. That said, they never come across as pretentious, so if you just want a Coors Light and a shot of Jim Beam, they can do that too. Many of the staff have worked their for years and have a good rapport with the local customers, so visiting Dive Bar always feels welcoming. I especially enjoy chatting with Meg, whose bubbly energy is infectious no matter how many shifts she has worked that week. And she has an adorable habit of laughing at everything I say, even when I'm not intentionally trying to be funny.",,,
1,michael s.,"Seattle, WA",360,4,3,5.0,7/15/2018,Love this bar!!! The Sunday night crew is the best. I love Sunday funday with the best bartenders on the upper west. Dee and Lauren rock the bar and make a mean drink. And fucking hilarious! Our server was amazing. Thanks Norma!!!! Food is great! Drinks are awesome. What more can you ask for?!? Check this place out if you're in the hood!,,,1
2,Addison B.,"Manhattan, NY",1,6,0,3.0,11/14/2018,Good place to drink. Huge selection of beers and high ABVs at good prices. Food sucks though.,,,
3,Will V.,"Harlem, Manhattan, NY",0,2,1,1.0,11/6/2018,"Dive Bar is a great neighborhood bar/restaurant but who breads buffalo wings and puts some type of marinara sauce on them. Those are NOT buffalo wings!! Where's the ""Frank's""?¿?",1,,
4,Jack K.,"Denver, CO",149,166,13,5.0,10/13/2018,"A great dive bar for the upper west side. The day I visited there were no less than 50 NY firefighters in the bar after some kind of ceremony, and they still managed to get me a drink promptly. A great place to visit after walking the park.",,,
5,Matthew S.,"Manhattan, NY",0,3,0,5.0,11/13/2018,"So I have been here a bunch of times and the most recent time was marathon Sunday after I ran the marathon. I can not tell you how great everything was. The food was, and always is, fantastic. We had the Beth Beyer, which is an Eggplant Parm sandwich, a bunch of wings (sauce on the side!), a pretzel bread Caprese (my favorite dish of theirs). This is not your average ""bar food"". I have heard from a friend of mine who goes there often that the owner locally sources most of his food...bread from local bakers, fresh vegetables, etc. So Marathon Sunday...the thing that I love most about this place is the atmosphere and the warmth and how amazing the staff is. We walked in with our marathon medals on and the bartender, Althea, started clapping for us. The whole place erupted into applause and cheers and it wasn't just for us: Every time someone walked in who it looked like they had run the marathon, everyone in the place gave them a big applause. The Dive Bar is a place with great food, an incredible beer and liquor selection, a warm and loving feel, and a staff who will treat you like they have known you for years, even if it's your first time stopping in. Check it out.",,,
6,Nikki R.,"Jeffersonville, IN",81,70,423,3.0,6/2/2018,"This place was recommended by a local, so of course we went! We arrived around 1:00 am on a Friday night. The ambiance is more like a sports bar and grill, but still cool. The mozzarella sticks were great, the onion rings were not. The prices were reasonable, but our server may have had a long day, she was not the best. Would I return? Probably not. Would I recommend? Sure, for a late night on the Upper Westside.",1,,1
7,Deby B.,"Manhattan, NY",721,29,4,5.0,10/29/2018,"Yes. Yes. Yes. 1) Great servers! You know when you want them to be your friends? Yeah-they're like that high quality. 2) Yummy food! Like the kind that you WANT to eat rather than have to eat because you're there watching the game. *Dive Bar salad was great! * Boneless wings a yes. *Burger was devoured. 3) Beer list had 5 Belgian beers! Aka the beer list was deep! As someone famous once said, ""I'll be back.""",,,
8,Joseph S.,"Chicago, IL",172,182,235,4.0,5/6/2018,"Cool bar, cheap drinks, not bad service, sports game playing on tv.Just don't order the absinthe drink. I don't know what it is, but not absinthe for sure !",,,
9,Jacky C.,"Manhattan, New York, NY",144,270,122,4.0,2/3/2018,"Pretty damn good place to catch your NFL Sunday football as they have all of the games playing on the many screens setup along the bar/restaurant.The beer selections that they have is a little overwhelming, but there's definitely something for everyone! The lobster mac and cheese is amazing here and would be something I would get again when I come here to watch another major sporting event. The other food items on the menu? You're going to have to hit Control (Command for Mac users) F and find what you're looking for.",6,5,6
10,Trace L.,"Broken Arrow, OK",1,25,3,4.0,10/22/2018,"Place is an amazing dive bar! The drinks are awesome. Strong, and the people who serve them are always quick. I come here usually once every two weeks with some friends and I love it. The place is a lot of fun and the atmosphere is pretty cool",,,
11,Krista J.,"Brooklyn, NY",732,1177,35,4.0,2/21/2018,"Dive Bar lives up to its name, but in the best possible way. It is unpretentious, comfortable, and has great food! I loved our server, Olivia, who took great care of us all night. Go early to get a good spot, especially on Trivia Night. This was one of the most efficient bar trivias I've ever experienced, and though we didn't win, we really enjoyed it. Eat the Chicken Tenders and Dive Fries (they're just regular fries, but they're delicious with a beer).",1,,2
12,Shannon H.,"Apex, NC",0,4,3,4.0,10/15/2018,"Great little bar. Issac is awesome! Good music playing, good food and casual atmosphere. Get Dee to make you an infused vodka shot- better for you than flavored liquor and so good! Come check it out!",,,
13,Dillan S.,"Norfolk, VA",302,2,0,5.0,8/1/2018,"I give this bar 5 stars for many reasons. One the food is stellar. The drinks are always very strong, and who doesn't want a strong drink after the amount of money you spend on the city for a cocktail. There draft beer list is amazing and has a ton of options. The atmosphere of the bar is great and don't even get me started on the staff. The staff is unbelievably kind and generous and they are always keeping an eye out to make sure you aren't waiting too long. Jessie is the best if you are going to this bar for the first time and have her as a server you won't be disappointed! I recommend this bar to anyone that wants a chill place to get a drink and meet really kind people and just enjoy yourself! They are also very accommodating to large groups!",,,
14,Simon B.,"Washington, DC",124,513,325,3.0,8/29/2017,"It's exactly as advertised - a dive bar. Nothing more, nothing less. At 5pm, I came in to a sticky floor (how that is possible this early is a mistery), a rude woman chatting her sex problems on the phone the bar, and a disinterested bartender. I tried the poutine, which was fine. I'm not super picky about poutine, the French Canadian dish that is taking gastropub over, with the delicious combination of fries, cheddar cheese curds, and gravy. The gravy was thick enough to help make the cheese melt, and the portion of cheese was good. It would have been a legit poutine back home in Quebec, if it had the squeeky curds. I'd order it again. With that being said, I really don't see a reason to go back unless I'm in the area (i.e., within one block) and have a serious poutine craving.",2,3,
15,Angela L.,"New York, NY",289,221,186,5.0,4/18/2018,"Five stars for a great beer selection and big food portions. I ordered the pumpkin cider and the cat fish tacos and I was not disappointed. The pumpkin cider is from Warwick, New York and it was very delicious perfectly flavored. The cat fish tacos were very filling. It was two tacos but that was actually enough because it had so many peppers onions and fish within it, plus it comes with a side of beans, mango and cilantro. I didn't have any sliders but I saw a couple come out and of course if you order sliders, you arent looking for a big meal. However, the sliders look to me like they had a good amount of ingredients within them. I came here to watch a hockey game and I loved the environment. So many TVs playing all the sports going on and there was someone watching each game. I would definitely come back here. Bartenders are awesome people too.",,,
16,Gregg Vance E.,"New York, NY",8,3,2,5.0,3/28/2018,"Neighborhood bar never really meant much to me til I moved to the upper west side.  The Dive Bar (a funny take on the obvious and then the not so obvious nautical theme) is really down home, feels like you belong and within minutes everyone does indeed know your name kinda place. Can't beat the beer & whiskey selection and I also haven't found a more friendly wait staff around.  Within a short time you'll feel like family too!",1,,
17,Steve M.,"Palo Alto, CA",107,19,16,5.0,7/16/2018,"Incredible place. Friendly bartenders, plenty of seating, low key, great conversation, great beer selection and great vibes. Gotta give props to Norma and Lauren for being incredible bartenders and taking care of us on a late Sunday night.",1,,1
18,Paul R.,"Manhattan, NY",1,1,0,5.0,9/23/2018,"Probably my favorite neighborhood bar in NY.  It's been years since I lived in the UWS, yet I still find myself here at least once a month for Tuesday night trivia or Sunday football.  The daft list is extensive and always features a handful of local IPAs from the likes of Other Half, Industrial Arts, and Barrier.  Food is top-notch bar grub and the blackened salmon sandwich is reliably fantastic.  Look out for Olivia and Sarah -- two gems behind the bar -- and keep an eye on the specials list for occasional curveballs like cricket tacos.",,,
19,Mike C.,"New York, NY",8,10,0,1.0,10/21/2017,"DISRESPECTFUL STAFF - KICKED US OUT FOR NOT DRINKING ALCOHOLI wish I could give this place a negative review.  My wife and I were just kicked out of the Dive Bar by the male bartender for not drinking alcohol. We went there to watch Game 7 of the yanks game (diehard yankee fans).  We waiting a bit for a seat, then we sat down at the end of the bar and ordered and paid for seltzers.  The bartender asked us if we were drinking...I advised him no we were not drinking alcohol (because my wife may be pregnant) and he had told us ""I have paying customers and if you aren't drinking leave.""  Regardless of pregnancy or not, it's COMPLETELY WRONG to kick someone out for not drinking alcohol.  We will NEVER go back there again...what a heartless way to treat people.",4,6,
20,Merlin C.,"Manhattan, NY",245,569,74,4.0,6/11/2017,"Dive Bar is honesty in advertising. The restroom is an all-senses horror show, and that's the only detail you need to hear.Lucky for you, inattention to basic sanitary soundness and internal decor means no extra cost on the bill. And they don't hold back on the resources that matter at a DIVE BAR: lots of televisions for professional sports and appropriate gastropub food for it, delivered efficiently even during high-stakes games where the place is pack.Crowd enthusiasm is infectious and where you want to be for big-time events.",,1,
21,Randall R.,"Manhattan, New York, NY",223,2,0,5.0,7/19/2018,"I absolutely love this bar. They have a great variety of drinks, and the atmosphere is fantastic.  They have a great juke and a ton of tv's that cover everything. Always get the Randall sliders you will NOT  be disappointed.  Delicious pulled pork!!!! The bartenders are absolutely brilliant, friendly, and always attentive to you. I have had a great time with Randall, Nick, Maggie, and Megan!  They always take great care of you.  Come join me!",,,
22,May L.,"Manhattan, NY",0,6,0,4.0,9/15/2018,I'm impressed with the great bar menu including single malt scotch n beer selection even the food was impressive. I guess I have to be a regular now.,,,
23,Dominik D.,"Staten Island, NY",191,2087,4895,5.0,11/30/2017,I really enjoyed their Beth Beyer Sandwich (fried eggplant) and they had a decent Gose beer. I recommend their spicy chicken soup also.,,,
24,Brian C.,"Austin, TX",43,20,2,5.0,11/16/2017,"I can't say enough about this watering hole.  Dive Bar is the kind of BAR (restaurant), that makes you want to open a bar.It is perfectly sized and populated with locals and visitors alike.The staff is has friendly as can be, and know their beer selection well...every recommendation was spot on.  Also got to me Lee (the owner)...and if you are lucky to chat with him...you will quickly realize you chose the right place.The bottom line is...Dive Bar is an awesome stop for a cold one...and if you are hungry, their Sliders are tasty and the Sweet Potato Potato Chips are freaking amazing.Oh yeah...did I mention they have great BEER! This will be a must stop every time we visit NYC.",,,1
25,Claire A.,"Fort Thomas, KY",265,55,47,4.0,11/22/2017,Our waitress was so nice! It was pretty crowded for a residential bar on a Monday night. Quick service. Decent prices. But nothing too special. They have a full menu with a late kitchen,,,
26,C M.,"Manhattan, NY",1,6,0,5.0,"9/16/2018
            





Updated review","Wow. So I went away to a different state for a few months. Came here with a bunch of friends. Wasn't sure if people would remember me. It was crowded and didn't expect much, but found dive bar took exceptional care of my whole crew. We had a server named Deirdre, who is Irish (always a plus) who made great drinks and never broke a sweat, made me feel like I was right back home. I think she might be my new favorite bartender here and I definitely know dive bar is my permanent home bar.",,,
27,Cecilia J.,"Manhattan, NY",115,1,0,4.0,6/9/2018,"One of my favorite places on the UWS, mostly because they got me hooked on the Vegetarian Reuben (and I'm a carnivore!). Now they sell cupcakes for dessert, too! By the way, if you're lucky enough to get served by Sherwin, he'll make sure you have a good time and enjoy your food/dessert. NOTE TO SHERWIN'S BOSS: My husband and I believe that Sherwin totally deserves a cut of of the dessert proceeds. Do the right thing.",,,
28,Chris C.,"Manhattan, New York, NY",0,1,1,5.0,8/2/2017,"Dive Bar is an affordable neighborhood bar in a great location. Drinks are cheap and it's usually crowded during prime times, but thanks to an attentive staff you'll never find yourself without a drink in your hand if you want one.Dive Bar is really good at being a no frills bar. Portion sizes and options are great and affordable, and they have some killer deals on their menu (See Randall's Sliders and the perpetual mussel specials). Drink selection is great with a specialty in scotch, and it's got a standard, yet hefty happy hour from 4-7 on weekdays.This bar has a great vibe with people from all ages making this their regular spot, and the staff is the best. Howie brings the energy and has me laughing out loud at least a couple of times during his shifts. I could and should go on and on- Cate, Olivia, Brittany, etc. They're all sweethearts.Trivia Tuesdays are... humbling to say the least, but if you're looking for a place to meet the locals, watch sports, or just generally burn a couple of hours without burning a hole in your wallet this is it.",,,
29,Emily W.,"Brooklyn, NY",69,28,115,5.0,4/13/2018,"I come here 4-5 times a year and it's great! Huge beer selection, great bar food pickins', plus awesome staff. Shout out to Erin who is amazing and gives her all. Her innuendos were on point!",1,,
30,Nina G.,"Manhattan, New York, NY",128,1,0,1.0,9/17/2018,"Terrible experience with one of the bartenders! We live a block away and me and my husband usually come over for drinks until tonight when I brought a friend over who recently moved into the neighborhood and was refused service by a extremely rude bartender who literally said ""your eyes look glossy so I refuse to serve you cause you are drunk"" I will be following up with a manger of this place but regardless of the outcome you have lost my business.",,,
31,Cassandra Z.,"Upper East Side, Manhattan, NY",0,14,0,2.0,9/4/2017,"We went here for dinner tonight. It was decently busy; the poor waitresses seemed overwhelmed. We had to wait 10 minutes before they took our beer order, at which point we also put in an order for fried pickles. The pickles were amazing, but they took about 15 minutes to come out.For my entree I ordered the Pretzel Ruben special (a Ruben on pretzel bread.) I literally could taste nothing but pretzel, even when I took the sandwich apart. The Russian dressing was 100% flavorless. The pastrami was chewy, fatty, and bland. The sauerkraut tasted of nothing but salt. I wanted to tell the waitress this, but she didn't even ask how the food was. We sat there waiting for her or check on us and she never did; when she did come back it was just to clear our plates. The waitress was really nice so I don't want to blame her. The beers were great (they have a ton on tap, which is great) but the service was lacking and the food was extremely disappointing. We'd come back for beer but I won't eat here again.",1,,
32,Jas C.,"Manhattan, NY",31,34,19,5.0,"4/12/2017
            





Updated review","With great comfort food and drinks, this dive bar is better with company. The food options are great, servings are more than enough, and they have a lot of different foods to offer. It's great for lunch, happy hour, late night, etc. They have a variety of beers and food. It's a cute spot for food and drinks.",,,
33,Angelino P.,"Manhattan, New York, NY",0,2,0,5.0,6/3/2018,"Lauren and Deirdre are the best bartentenders there, they are attentative and always welcome questions and make the best drinks !",,,
34,J.C. T.,"McKinney, TX",177,127,86,3.0,4/29/2016,"Stopped by here while my lady was shopping one day, killed some time and had a few brews at the bar before moving to a table. This place is OK. It's not terrible, but nothing really made me think ""wow, I'd come back here."" The interior is fine, it's kind of a nice place purposely made to look like a dive. Not bad per se, but as a connoisseur of dives, I've seen much better (worse?). The bartender was just kind of there. She didn't really say much, or smile, just took my drink order and gave me a menu. The beer menu, however was good, with tons of choices. When my lady finished shopping, she met me at the bar and we moved to a table. I will say our table service experience was better and our server deserves 5 stars. She had the entire floor and was busy, but was hustling and was friendly and nice. She also checked in with us from time to time and even though things took a little longer due to how busy it was, we knew she was present. When the food came out, only one plate arrived, so we were stuck in that awkward phase where one person has their food and one doesn't. Overall I would say this place is an average bar in New York. I wouldn't say NOT to go here, but I also wouldn't say to expect above-average service (which for NYC, average service is below average), and with hundreds of places to choose from, I don't know why you would....",,1,2
35,Anikki F.,"Manhattan, NY",0,1,0,5.0,5/8/2018,"No joke. Jason hit us with some bomb trivia. We had no idea it was going on. Boy, was it fun. We lost. Did absolutely terrible. It was still fun. His current events were so current I had only seen the headlines once and had already forgot them. LeBron is an animal!",,,
36,Megan L.,"Hoboken, NJ",0,1,0,5.0,8/21/2018,"i love this bar! I've been coming here for years. The beer selection is amazing and if you like whiskey this is the place for you! They have a huge list. I also really like the staff here. They make you feel welcome and they go out of their way to make you happy. I really like the tuesday night crew. I think it's Nick, Olivia, Sarah and Meg. Hard workers. They also have a great lunch deal if you work in the area and have a lunch break you should definitely go in and check it out. The day bartender Tommy is quiet but he is fast and never lets you sit with an empty pint!",,,
37,Olivia W.,"Manhattan, NY",78,34,27,1.0,5/27/2018,"Most bizarre and awful service ever experienced. It started out great! My friend and I got a table on a busy Memorial day Sunday night and promptly recieved our beers and placed our food orders. The food came out and it was pretty great!  I had the Shaksuku(?) and my friend had the poutine. Delicious! This is the end of the good stuff. Our 1st waitress, a  beautiful and aloof Irish woman abandoned us after she delivered our food. She never came back again. The entire waitstaff (3 waitresses) went MIA when some ""famous"" guy (her words...apparently he was in Star Trek many moons ago) came in and they started taking photos and shots with him. Our 1st waitress was now behind the bar so we grabbed another waitress (#2) as she passed and ask her for our check. #2 walked by 15 minutes later and asked if we received our check yet, and we told her we hadn't but we'd VERY much like to pay it as soon as possible. We gave her our cards before we'd recieved our tab and asked her to simply split the bill evenly to speed up the process. When she returned, she had inexplicably overcharged us by $10 and blamed the mistake in waitress #1.  When we caught the error waitress #2 thanked us for finding it and went back to adjust our bill accordingly. While we were waiting for our new receipts #2 came back to bizarrely tell us that waitress #1 had left off the tax (because she ""thought we were cool."" Her words, not mine) I want to pay tax...I want to pay everything I owe. I simply want my bill to reflect what I order. Waitress#2  apologizes profusely for mistakes and delays and offers to buy my friend and I shots. I say, ""ok, great."" Hoping to put the past behind us. I say ""how about a vodka, lemon something, like a lemon drop?"" Waitress#2 comes back with 1 shot... There are two of us...1 vodka shot with a lemon wedge. Huh? But... what? After 35 minutes of trying to pay a bill, we finally signed our receipts, left the bar, and called cabs. As I was outside waiting for the cab, the waitress #2 runs outside and down to the corner of the street yelling after me, to tell me I forgotten to sign my check. I was almost positive I signed it, but followed her inside and back behind the bar anyways, where she and her cohort had spread out seven or eight receipts they were fiercely perusing. After standing around waiting to sign anything (literally I would have signed anything by that point to get out of there) waitress #2 has a sharp exchange with a new waitress (#3), finds my signed reciept still sitting on the table where I left it, apologizes again, and I leave. Too weird. Why Dive Bar, why?",1,1,1
38,Vanessa L.,"New York, NY",110,2,0,1.0,7/19/2018,"The hostess was so rude, this place is awful, not nice at all.. It's good for take out, the staff is very rude.",,,
39,Jen N.,"New City, NY",0,13,0,5.0,1/19/2018,Place is amazing Pub food done well Beer selection is stellar Menu is diverseWings fantastic Down to earth crowd,,,
40,Eric S.,"Santa Monica, CA",43,4,0,5.0,1/12/2018,"There probably aren't enough good things to be said about the atmosphere and staff at Dive Bar. While they are all fantastic, Olivia is just a dynamo. Her efficiency behind the bar is unparalleled and her boisterous personality sets the bar aglow. Being in her presence is equivalent to a master class in improv comedy, and man... that voice. She doesn't like to brag about her karaoke skills, but they are titanic. That's beside the point. She's the shining star on a team that is hall of fame caliber.",,,
41,Don H.,"Oviedo, FL",16,3,0,5.0,2/24/2018,"Awesome bar, awesome staff and the pastrami sandwich was to die for.  I'm moving upstairs!",,,
42,K. B.,"New York, NY",4,70,0,5.0,6/6/2018,"Really friendly servers, nice drinks and good food. Super relaxed environment that isn't too loud! Definitely going back.",,,
43,Amanda S.,"Brandon, FL",0,8,2,5.0,11/2/2017,"This is my favorite little gem in the UWS, or all of Manhattan, really. The food is great and the bartenders are better. I've spent three weeks each month for the last three months this summer and fall in NYC for work and have spent my Sundays watching football at this place. Sarah, Olivia, Jessie, and Theresa are the usual bartenders on Sundays for the day games and they are AWESOME!!! They have always made me feel welcome and are just all around pleasant and engaging in conversation. Get the Mussels Special. $16 for a pot of steamed mussels (in hoegaarden with onions), a plate of fries, and a pint (bud light, Stella Artois, or Hoegaarden). That's a steal anywhere in the city. Also, the Poutine is to die for, for a whopping $11! I'm gonna miss this place when I head back to home sweet home as I live out of state. Farewell Dive Bar! Until we meet again.",1,,
