,er_name,er_location,er_freinds,er_reviews,er_photos,er_rating,er_date,er_text,er_useful,er_funny,er_cool
44,Robert C.,"New York, NY",84,64,46,1.0,11/14/2017,"I have just called to place a $30 take out order for me and my wife. The phone was answered by a very polite bartender. When I told her i want to order delivery, she asked me to hold for a minute and then told me this (not realizing I have been a chef for well over 30 years and I live around the corner from Dive Bar), they are too busy right now for me to place an order. She suggested I call back in an hour. We ended out conversation with me making a comment that as a chef, i would never turn away business. Benn going here on and off for years. No a regular but i do spend money thee. I guess it never occurred for her to let me speak to a manager or just place the order and i would have waited. The younger restaurant generation, what can i say.",,1,
45,Greg S.,"Manhattan, New York, NY",0,15,0,4.0,3/5/2018,"Good food. cool memorabilia and awesome fish tank in the front. Amazing mussels. Good beer on tap. Plenty of old world characters in and out of those doors. I hear the owner is taking over the old Amsterdam Tavern in 106 and Amsterdam, if so, good! Love this place, including the baby dive in broadway. Great places.",,,
46,Scott W.,"San Francisco, CA",45,1,0,5.0,2/14/2018,"In New York for the first time. Awesome bar!! Of all the places we visited, this was the most memorable. Good drinks but more importantly, Howie the bartender was extremely friendly and fun to chat with. Will definitely be back. If you're in town, come here and ask for Howie!!",,,
47,Sean M.,"San Francisco, CA",9,116,0,5.0,1/17/2018,"Great neighborhood bar!!  From the inside this bar looks like it could have been anywhere around the world.  Just a simple friendly neighborhood hang out with ZERO presumptuousness.   Everyone was having a great time, and folks seemed generally happy and friendly.  Surprisingly extensive menu.  The bartenders Howie and Mimi were also great and also seemed to be enjoying themselves which was nice.  It was a great mix of people; different races, ages, gay/straight, etc.  Glad to see the owner calling out the ridiculous haters on Yelp....reminds me why I love NY.",,,
48,Peter L.,"Walnut Hill, Philadelphia, PA",201,1,0,5.0,7/3/2018,"Awesome time here. The waitress Jesse is the best....picked 8 different beers in 2 $12 flights for us. Most were wonderfully tasty. Get the zombie beer they make in the BK...it was an IPA that goes down like a bottle of cold Poland Springs water. Would definitely come back and indulge in some nachos and happy hour festivities!!!! Oh yeah, I almost forgot about the curved fish tank that is staring you in the face when you walk in. This place brought me ALL the vibes.",,,
49,Diamond G.,"New York, NY",336,143,2045,5.0,9/10/2016,"I'm not sure why i haven't been to this bar sooner as I'm always in this area. We stopped by for a few drinks Friday evening and decided to sit outside, The menu looked great and I can't wait to return and have some food.Our drinks weren't as strong as they should have been but the service was great so I have no problem returning",,,
50,Robert S.,"Bronx, NY",0,5,1,5.0,1/12/2018,"Managers or staff definitely wasn't "" terds"" when I went there great spot. Came here for the holidays. Bartenders we're very nice, (Jess ) I believe. Met my boy from the Bronx here chopped it up had a great time. Will definitely be back next time I'm back in ny. PS stop complaining about dive bars smh.",,,
51,anna m.,"New York, NY",0,62,1,4.0,4/26/2018,Dive bar NOT great drinks * service * food def a keeper ! Burger and mussels a must. Bread please for mussels.,,,
52,Katie S.,"Santa Rosa, CA",539,6,0,5.0,7/24/2017,"Fun atmosphere, personable, attentive servers& tenders, cool layout( loved the fish tanks) A bit over priced, but overall loved this place!!",,,
53,MandA R.,"Woodbridge Township, NJ",197,1052,2826,3.0,4/9/2016,"Lobster mac n cheese!!!Came here after exploring Central Park and we were hungry. The lobster mac n cheese was perfect. So delicious! We also ordered the hummus plate and the wings. The hummus was flavorless and the wings were rubbery, but this place earns 3 stars anyway because of the happy hour specials, beer selection, overall atmosphere, and bartender attentiveness. The food was subpar, but hear me out.A server apparently didn't show up for his/her shift and the place was short staffed. This place was packed to the brim. We sat at the bar and watched the bartenders juggle tables and the bar, all while keeping a smile on their faces and making it work. I respected that. These bartenders and servers were hustling to make up for the missing server, yet we never had to wait too long for another beer. I was impressed by this and feel that it needs to be noted in this review. The happy hour special for beer was that $6 pints were $4, and $7 pints were $5. So if you want the HH special, be sure to order a $6-7 PINT. M ordered another beer served in another type glass so he didn't get the HH special. When HH ended, it was time for us to move on and bar hop down to Penn Station. We'd come back for HH in the future, but probably would hold off on eating.",2,2,3
54,Jennifer W.,"Manhattan, NY",90,1,0,5.0,11/7/2017,Dive bar is great! Howie's the best bartender! Fun taste test with the beers...great personality....lots of laughs. I've been a bartender for many years so it's not often I give props to bartenders. Definitely go check it out some time.,,,
55,Molly T.,"New York, NY",860,443,1415,4.0,3/23/2015,"I'm always surprised by how much I like this place! I've lived in Manhattan Valley and Morninside Heights areas since moving to New York, and the bar selection up - at least if you want to have even a moderately positive experience - is grim. So this place is truly a breath of fresh air. I've been here on a number of occasions and it's always a different experience. On weeknights it's not hard to find a seat, but most recently I went on a Friday night around 8:30/9 and it was absolutely packed. I can only speak to the whiskeys and beer here - but both have yet to disappoint. My one complaint about last Friday is that my rye came in a tiny, warm glass. Firstly: I don't want a warm glass. I tend to like my rye neat or with one or two ice cubes, but I'm actually glad I got it on the rocks on this particular occasion. Otherwise, it probably would have been warm. And for a place with a fairly extensive whiskey/scotch selection I'd hope to get something at least resembling a whiskey glass. This is just a minor complaint though. Also - they gave us straws with our rye. Who drinks straight liquor with a straw? I suppose that's just their thing, but still a tad weird. So other than the small/warm glass with a straw to boot, I'd still give the drinks a solid four stars. They have Templeton, so can't knock them too much. Ambiance is great. The name of this place might drive people away (or, alternatively, attract a ""divey"" crowd, whatever that means), but this place isn't what I'd call a true dive bar. It's a great neighborhood hangout type of place. Good for small groups and great music. There was actually a group of maybe 10 people having a party with a buffet when I went on Friday. I wouldn't have taken note of this if they weren't all in pirate attire (not a typo...). I love that this is an option in my neighborhood. I'd like to avoid Columbia bars at all costs if I want to stay local, so this is a much better alternative.",1,1,1
56,Bill B.,"Scotch Plains, NJ",0,22,0,5.0,11/29/2017,"Gotta give Dive Bar 5 stars.  Here's why.....*  outstanding selection of Scotch and Bourbon*.  goose island bourbon stout on tap.  *.  friendly neighborhood crowd*.  Cate the bartender is awesome *.  Bar sliders were greatFirst time there yesterday afternoon, looked like the only bar in the area, figured I'd just stop in for a beer and move on....ended up staying for hours.  Highly recommend.  p.s.  it's not a ""dive""",,,
57,Edilson r.,"Manhattan, NY",4,9,98,5.0,"8/11/2016
            





Updated review","Amazing Dive Bar, I frequent this place for five years and I really enjoy everything, service, food, atmosphere, specials  beer and food!! You guys do a great job, my last food experience was the salmon tostada, simply to die for, Jessie the waitress recommended, it was delicious!!!What a damn good sandwich!!Smoked Smoked Sword Fish Reuben, ""OUT OF THIS WORLD!!!!""",,,
58,Reg B.,"Cork, Republic of Ireland",95,584,75,5.0,2/23/2017,"A NYC classic, first visited in 2004 and it hasn't changed much in all those years! Good beers and a decent bar menu... had the cheese burger and shared a few edamame! Excellent... this bar is just set up to keep you here all day... I wasn't complaining... the perfect neighbourhood bar... don't ever change",,,
59,Isabella C.,"Las Vegas, NV",152,6,2,5.0,10/19/2017,"They have SUCH an amazing craft beer selection. Their food menu is incredible. Some of my favorites are- poutine, Kentucky bourbon wings, mozzarella sticks, and their mussels are to die for. The bartenders are always very knowledgeable and friendly. I love this place, I take everyone I know here!",,,
60,Nish S.,"Birmingham, MI",157,162,2212,5.0,3/28/2016,"What a gem!!!! You know the only reason I delayed coming here is bec I live right by it!!! On st patrick's when I came home dead tired and craving a chill beer, my hubbie n mw decided to check this place out. It looks much much smaller from outside. Decent seating space. Nice cozy atmosphere and absolutely amazing drinks!! Loved the beer collection. Live music was a definite add on. Couldnt have imagined a better place for st patty's.",,,
61,Evelyn O.,"Bronx, NY",25,68,148,5.0,8/4/2017,Well what can i said it is really busy but a good environment. I came across after an appointment. I will defenely will be back. I had some good French fries,,,
62,Maria E.,"Miami, FL",43,30,21,2.0,2/4/2017,"I went here because I was visiting with a friend and we stay near here so we just walk there. The place look good on the oust side and inside it's was late like 9pm, a few people only two waitress. We order three burgers and some drinks,To be honest the service wasn't good this girl didn't seem interfere in serving us, and the food it was kinda old.",,,
63,Eugy M.,"Inwood, Manhattan, NY",5,25,23,4.0,5/4/2016,"This place is really awesome and it has a pretty cool beer listing for a dive bar. I've known about this place for a while (I grew up in the neighborhood) but I never tried it out. I am so happy that I did!! It's so cute and cozy. Firstly, the atmosphere is my kind of chill. I love the songs in the jukebox, the bartenders are super friendly and it's an over all pretty laid back scene here. IT GETS CROWDED AFTER 6pm! The only thing I had off the menu were the nachos  and they were pretty good. I did see that there's a lobster Mac and Cheese that's super special so I'll def be coming back to try that and give some other beers a go.If you are looking for a upw neighborhood jewel this is it!!!!",,,
64,Joni T.,"New Orleans, LA",0,2,0,5.0,7/26/2017,"Bar with beyond bar food! The alcohol service is great, but the food y'all, the food! As a tourist in NYC, finding all these choices at a great price that taste good is a prize. My group had salads, the sliders, & the shakshuka. Go thirsty & hungry. Althea will take care of you.",,,
65,David G.,"New York, NY",2,3,0,5.0,7/25/2017,"Looking for a friendly neighborhood bar having just moved into the area and hit the jackpot. Great pub food, fun, friendly, grown up atmosphere, and great service. Go on a night when Howie is behind the bar, he's got a great, low key, charismatic vibe that suits the place, the neighborhood, and New York. Loved it and I'll be back.",,,
66,Jessica P.,"Calgary, Canada",145,58,24,5.0,11/7/2016,"Awesome beer selection! The lobster mac n cheese is pretty good too. Any beer geek would be happy here, and I'm only sad that we discovered this place on our last night in NYC.",,,
67,S. G.,"Manhattan, NY",0,5,0,5.0,4/9/2016,OMG....... Where can I start..... Have the best waitress named Jesse..... Had the best food ... I ate an Althea Blackened salmon sandwich....please note the sandwich is named after one of the best bartenders at the bar.. Nevertheless everyone that is staffed at the Dive bar are great. The prices are fair for New York City  lifestyle. That atmosphere is cozy it make you feel like if you're a local. The place has 16th TV so your cant miss any play or score of any sport team that is playing that night. Before I forget the beer selection is great....If I can give more than five stars I will.....,,,
68,Stephen M.,"Rowlett, TX",39,16,0,5.0,7/3/2017,"Great beer selection and very friendly bar staff.  The beer selection rotates fairly regularly so there's always something for everyone.  The food is actually really really good too!  There's a crowd pretty often which makes for a fun time.  I recommend any of the pretzel sliders, but you really can't go wrong anywhere.",,,
69,Sadie F.,"Cambridge, MA",619,1,0,5.0,8/15/2017,"Erin, Olivia and Teresa have been absolute rockstars this entire summer. I am from the area and came home for the summer and was so pleasantly surprised to be welcomed back to a dive bar with interesting, funny, smart, attentive, and knowledgeable ladies working. They have truly made this place a home for me and my friends this summer. I know I am speaking for myself (sadie) zac, and colin when I say you have the best staff a bar could ever ask for. A million stars forever",,,
70,Jacob W.,"Washington, DC",2,5,0,5.0,6/1/2017,"We just watched game one of the 2k17 NBA finals. While the Cavs lost, the atmosphere was great (read: good number of Cav fans)! Our host Howie looked after us when we needed it most, early on in the 3rd quarter. Looking forward to game two!",,,
71,Meghan M.,"Rochester, MN",0,2,0,5.0,3/7/2017,"We have been here for a week now in New York and this has been the best place we have visited. The bartender/waiter, Howie is hilarious and makes you feel so welcome! Plus the food is good and not a bad price which is even better for a college kid.",2,,
72,Matt C.,"Hoboken, NJ",306,1,0,5.0,5/30/2017,"Dive bar is awesome. Howie took care of us. That guy is hysterical. Great wings, great beer, great service. I wouldn't go anywhere else in this neighborhood.",,,
73,Kenneth G.,"Queens, NY",0,2,0,5.0,12/24/2017,"Pathetic policy of forcing pregnant women to order alcoholic beverages or be tossed out. Put a sign on door telling customers they must order 1 drink every 15 minutes or out! Owner Lee defends this policy, Pathetic. Your in the hospitality business and this is NOT hospitable! Sorry but I'm not coming back. Plenty of other watering holes that don't force pregnant women to drink the water! Shame on u Lee!",,,
74,Daniel S.,"Manhattan, NY",4,28,0,4.0,11/18/2017,"Solid beer selection. Surprisingly good whiskey selection. Food is neither here nor there. Nothing has been great, but nothing has been outright bad either. Solid number of TVs that frequently have baseball on them. Every once in a while they will be understaffed during a rush, but the service is generally reasonable. It's a comfortable place that is what it says it is.",,,
75,Nate C.,"Manhattan, NY",12,211,7,3.0,7/9/2016,"A bit of a misleading name. The term Dive Bar implies that the setting is going to look less than desirable, and that it may be a destination for those looking to drink cheap beer in the dark. This is in no way a dive bar, it's a sports bar. It's a decent bar with good lighting, tons of TVs, a solid beer list and general bar food. If you are looking for a bar with bar food this is your spot. If you're looking for a dimly lit joint with an old bartender who loves to say ""back in my day.."" This is not your spot.",,,
76,Christie M.,"Manhattan, NY",292,16,29,5.0,6/27/2017,"I like the hidden nook up the stairs and all the decorations all over the bar. I love that they have trivia, and that you can buy craft beers to take home. Always open and reliable. Great for a neighborhood bar",,,
77,Caroline D.,"Brooklyn, NY",654,430,26,4.0,4/9/2016,"Stopped in for a short hang - I'm rarely in this hood, but if I am, this bar is pretty cool. Sometimes on the weekends it gets a tad rowdy, but what bar doesn't? There are quite a few beers on draught, but the real impressive selection are the scotches and whiskeys. I highly recommend trying something different if you see it on the long menu. It doesn't really live up to its ""dive bar"" standards in this way. Staff is friendly and fast. They also have half pints, which is good if you're only having a quick one. Affordable for the neighborhood.",1,,1
78,Samantha H.,"New York, NY",0,5,0,5.0,6/5/2017,Dive bar is a classic uws establishment I've been coming to for years. I hadn't been in a while but played tennis in Central Park tonight. We had such an amazing evening. We tried 3 beers each and Howie took care of us (and had great menu suggestions!). Thanks Dive Bar!,,,
79,Ashley F.,"Manhattan, NY",0,2,0,5.0,11/23/2016,"Great atmosphere, great beer list and seriously good food! Trivia is Tuesday, be ready for competition. Everything is very reasonably priced, especially for the quality and location. Run, don't walk.",,,
80,Ivana P.,"New York, NY",66,56,21,4.0,1/29/2016,"Came to Dive Bar with a group of co-workers on a Friday after work. The menu contains a cool selection of ""divey"" food (Burgers, wings, etc) as well as a nice selection of salads, subs, and a few Middle Eastern dishes. I tried both the regular buffalo, and the bourbon wings. My favorite were the regular wings because they are breaded with flour, and extra crunchy! They also have a semi-sweet(?) taste to them. Hard to describe, but they are de-lish! Our server Caitlin was amazing! Very friendly and attentive. She even suggested a few cupcakes for us to try! The cheesecake, and the carrot cupcakes were to die for! Dive Bar doesn't sell popular favorites such as Blue Moon, or Angry Orchard, but they make up for that with varieties like Duvel, Red Stripe, and alcoholic ginger beer!I will definitely be returning to Dive sometime in the near future!",2,1,
81,Katie M.,"Austin, TX",0,31,9,5.0,4/16/2017,"Howie the bartender is seriously so welcoming and lovely! This is a fun yet classy dive bar that my roommate and I stumbled upon. Amazing staff, solid prices!! Thank you Howie!",,,
82,Alex C.,"San Francisco, CA",37,31,9,5.0,3/5/2017,"Very decent drinks (alcohol wise), great selection of beers and whiskeys, free Wi-Fi and reasonable prices - what else does one need to spend some quality time?!",,,
83,Arturo C.,"El Paso, TX",37,66,20,2.0,1/12/2016,"I'm a lover of dive bars, especially when you have as good a list of draft beers as this bar had. BUT, what I absolutely despise is an attempt to incorporate food on your menu that you have no idea how to properly cook. Yes, you're probably thinking, well why were you eating at dive bars anyway?! But you'd be surprised at the amount of good food I've had at establishments like these.Anyhow, my complaints are: 1) After self-proclaiming on your menu that you ""love mussels,"" you do them no justice. All you did was steam them in water with chopped onions, thus rendering them flavorless. Can ya at least throw some salt or garlic in the water... something?! 2) If you really loved mussels, you would know how to clean them. I got through half of the pot and gave up. Every time I chewed on a mussel, It was like I put a spoonful of sand in my mouth. Disgusting. 3) Your veggie sandwich was missing half of the veggies it was supposed to have, and the paper-thin fried eggplant was barely noticeable. So basically what you gave me was a loaf of flavorless bread. Thanks.",1,3,1
84,Marci A.,"Manhattan, NY",55,317,179,3.0,4/21/2016,"The name says it all, this is a dive bar for sure with the dice bar food to compliment it. I went for happy hr but their selection isn't too extensive so I basically had beer, fries and wings. My friend had house wine and guacamole. I wasn't impressed but the weather was nice and we got to sit outside. P.S: the service is super SLOW because there's only one bartender running the entire place!",,,
85,Sloane E.,"Manhattan, NY",23,2,0,5.0,4/17/2017,"I love this place!!! We come here every Friday but most recently strolled in on a Monday evening. The food, staff and music are great. Best wings in town with a welcoming atmosphere. Extensive selection of beers with a twist on your typical bar food. Highly recommended. Always an amazing time at the Dive Bar!!!!! Feels like home.",,,
86,Jeanie W.,"Manhattan, New York, NY",66,1,0,5.0,4/13/2017,"This my favorite local hangout when I'm in the city.  The food is awesome (try the wings, mussels and mac 'n cheese).  The best bartenders and wait staff and most fun party place imaginable.  Love everything about this place and have been a loyal regular for over 15 years.  Doesn't get any more special than this!  Thank you, Lee for the consistency and great food and drink.",,,
87,Tara J.,"Manhattan, NY",45,6,4,5.0,3/17/2017,"If you are looking for your ""Cheers"" Bar, look no further than Dive 96. Although I live in Inwood, this place is my home bar due to no small part because of  Howie Kaye. Coming in on Monday nights after an extremely stressful day at the hospital I work is instantly brightened by Howie's warm greeting, quick and easy smile,  and even quicker Vodka Soda (he always remembers my drink which is wonderful when your neurons are fried!).  The menu is good and diverse and Howie's and mine conversations between him attending efficiently to not only a full bar but also packed restaurant really helps reset my day.  Wanna go where everyone knows your name?  Check out Howie on Mondays at 96!",,,
88,Chris B.,"Manhattan, NY",61,4,3,5.0,"4/11/2017
            





Updated review","I eat and drink here regularly and everything is really good but I realized my prior review was outdated. I'm keeping the 5 star rating, but I'd be lying if I said it was not at least partly based on the memory of the Belgian Thai Wings which left the menu. If anyone has had them, you know what I'm talking about. As I sit here in the office thinking its probably too late for coffee and yet too early to drink, I still hold onto the lingering hope that one day, maybe, somehow I will see those wings again and everything in life will be better again... sigh...tear... crying Jordan face.",,,
89,Chris B.,"Manhattan, NY",604,26,14,5.0,10/2/2016,Food is amazing. Drinks are awesome. Thanks Ryan. Sam is the sweetest server and is truly hilarious. Had a great time this evening and will be back.,,,
90,Steve S.,"Manhattan, NY",3,4,0,4.0,12/20/2016,"Been coming here for years of friendship , wings, hummus plate and BEER! Oh, did i mention the BEER? The UWS version of Cheers! You make friends and see them here again. Eclectic group of people reflecting the folks on the UWS! Don't miss the lunch specials! Good service!",1,,
91,Anna L.,"Aarhus, Denmark",804,298,15,4.0,11/18/2016,"This place has an awesome nook upstairs where you can look over the bar and still watch the sports. This is one of my cousins' favorite bars because the beer list is always pretty good (usually something belgian on tap). Also, I really like how it is called dive bar. If you say you're going to dive bar, and people are from the area, they know what you're talking about. Bathroom is decently clean for a ""dive bar."" This is really a neighborhood bar that you just go to when you want to watch the game after work or on the weekends. Not too hectic.",2,,
92,Rebecca G.,"Manhattan, NY",58,723,45,4.0,2/10/2015,"A couple of friends and I made our way here after a Sunday afternoon of indoor soccer and almost immediately, I was a fan.Ordering the draft cider to drink, it later paired well with an order of the poutine, which we all shared, and five buffalo wings. The poutine, while smaller than anticipated, was definitely the highlight of our meal. I had wanted to try it for some time, and Dive Bar proved the perfect place to do so! The fries, delicious by themselves, were topped with a tasty vegetarian gravy- and smothered in cheese curd. Still hungry, my friends shared an Italian-style club sandwich, accompanied by more fries, and I had the five buffalo wings. The wings were just okay; both the sauce and the chicken tasted a little off.All in all though, Dive Bar is a solid neighborhood option!",,,
93,Mon-Cheri H.,"Scottsdale, AZ",88,119,183,5.0,3/14/2016,"A really great Little dive bar, great people, really fun to just hangout here oh and a great place to meet new people or just chill by yourself.",,,
94,Nick V.,"Absecon, NJ",304,103,20,4.0,1/15/2017,"Poutine! I loved this place it was warm, comfortable, friendly and I really enjoyed the Poutine! we met some friends here and made new friends. Great hang.....",,,
95,Caitlin F.,"Manhattan, NY",1,27,0,5.0,8/21/2017,"Oh yay! I love Dive Bar. I'm from Colorado and it feels like a west/Midwest vibe. Helpful, laid back, good beer. Haven't tried the food. It's just easy and fun and great for a casual date!",,,
96,Nathan M.,"Garden Prairie, IL",0,5,0,5.0,3/12/2017,Great times. This is a first time for my buds and I. We just got to New York. Dive bar was recommended to us and we were greated and taken care of by Howie. Great beers. Great food and great times!,,,
97,Zach H.,"Manhattan, New York, NY",59,4,1,5.0,3/7/2017,"One of the best bars in the city! This place offers a  laid back atmosphere with affordable drinks and amazing pub food! More than that, the staff is incredibly fun/friendly (looking at you Howie!) I brought a bunch of my friends to this bar who were visiting New York for the first time, and after going out every night for a week all over the city, each of them told me it was their favorite bar that we visited!",,,
