,er_name,er_location,er_freinds,er_reviews,er_photos,er_rating,er_date,er_text,er_useful,er_funny,er_cool
41,Rick W.,"New York, NY",12,128,4,3.0,5/28/2012,"I like Reade Street Pub -- it's a standard, no-frills neighborhood bar that has decent tavern fare, cold beer and, at times, it can be crowded.  In my honest opinion, it's not in the same league at Walker's, but that doesn't mean it isn't a fine establishment.  WYSIWYG...  it's a locals place -- and that's nice for the neighborhood.  I particularly like their chili and they make a good burger as well.A very dear friend of mine was once taken here on a date.  She needed to go there because it was ""A Very Special Place"", according to her suitor...  a statement that she still laughs about to this day.  Reade Street Pub is just an OK place -- but ""Special"" it ain't, that's for certain.",,,
42,George L.,"Brooklyn, NY",1,27,0,4.0,1/27/2014,"Great old-fashioned NYC bar, the kind of place that used to be so common around NYC but is now almost extinct. Nice long bar with well spaced bar stools, a lot of tables, most or all of which are filled at night, very decent pub grub, and reasonable neighborhood prices. What more could you want?My friends and I have been meeting here every few weeks for years now, and we very much look forward to each get-together. We tend to go for the nachos and chicken wings and we always think they are among the best pub grub around. (WARNING: Thursday nights seem to have been reserved for the student body of NY Law College, located nearby. On Thursday nights it can get very hectic and very loud, too much for our taste, so that is the one night we avoid.)This is the kind of place that you won't know how much you'll miss until it's gone (hopefully never). It's a great place to sip the beverage of your choice and nibble on some decent bar food. Probably not worth going out of your way, but if you're in the 'hood, definitely stop in and enjoy.",,,1
43,Patricia H.,"New York, NY",72,97,190,4.0,6/21/2011,"Although it's a bit of a trek for me to get to the Reade Street Pub, I do enjoy myself every time I go here. Reade Street is as low key as it gets. No pretentious bouncer to deny you entry. No cover charge. No bridge and tunnel intruders. None of that is allowed here. Just good drinks and a casual ambiance. It's never overly crowded which is a nice departure from....any other bar in NYC. Once you sit down you're quickly acknowledged. When you're a regular here the chill bartenders usually ask if you want the usual, which is always nice. The drinks here are easy on the wallet.The patrons are always friendly and have no problem rubbing elbows and starting conversations with you.Good choice if you want to go off the beaten path.",1,,2
44,andy t.,"New York, NY",258,439,33,3.0,12/30/2010,"If I llved in Tribeca, I'd be proud to call this place my neighborhood pub. Popped in for a Guinness the other night on my way to Bouley and this place did the job. The bartender, a native of Cali, even comped me a free beer when he mistakenly gave me a pint instead of a mug. Nice touch. Reade Street Pub is the kind of place where you can rub elbows with the local cops and firemen. It's old school. And another stop on my quest to hit every bar in NYC.",4,2,4
45,Johnny J.,"New York, NY",0,5,2,5.0,10/13/2014,"Haven't been here in years. Not since it was McGoverns. Now that was a TriBeCa bar! Sawdust on the floor and dogs at your feet. If you got tired of Morgan's (it became Katie O'Tooles and a couple of other things in the 80's and I notice the awning in the yelp pics says Morgan's, has it never been changed?) you came here. Michael Hickey who tended bar was an institution himself. I only hope it can live up to its past.",,,
46,M D.,"New York, NY",74,38,14,5.0,1/18/2011,"Sadly, I am no longer a resident of TriBeCa.  I moved above 14th Street in 2007.  Yet, I find myself here at least once a week, and often much more.  Still.  In 2011.It's my Cheers, and all of the good things Yelpers have said about it are true.Drinks - strong and cheap.  Service - excellent.  Ambiance - what you'd expect in a ""pub"", no pretense at all.  Staff - ridiculously cool and friendly.  Food - very good, especially the burger and the cream of broccoli soup.  Oh yes, the Nachos.Go there more than twice and there is a good chance you will know the names of the staff, and they will know yours and what you drink.It's that cool and they're that good.I love you, Reade Street.",2,1,1
47,J M.,"New York, NY",0,8,0,5.0,8/17/2015,"Best neighborhood pub!  Loaded fries, a cold beer, and Chris Decker on the guitar = perfect evening.",,,
48,Kenny K.,"Brooklyn, NY",129,53,53,5.0,9/19/2013,Reade St Pub is consistently great. Love their house amber beer on tap and the food is better than your average bar food. Servers are always pleasant and conversational. Went in on a Saturday morning for some mimosas and the older man behind the bar was great. You have to love a guy who works part time as a bartender well into retirement on a Saturday morning.,,,
49,J. K.,"Brooklyn, NY",120,335,55,4.0,4/20/2013,"It's not a dive bar, really, and it's not an Irish pub.  It is just a good old-fashioned American watering hole with tons of regulars.  This is one of the reasons I feel as if TriBeCa is an actual neighborhood with a small-town feel.  I have not had the food, but have had some excellent Stellas poured by Josh, the charismatic and down-to-earth bartender.  I knocked some back with Ladder 1 and subsequently made friends with a gladiator as well.  (I am not joking.  Some guy whose job it is to be a gladiator walked in after his gladiator shift was over.)  It's a nice place.  It's REAL.  Josh told  me that it was the first bar to re-open after 9/11.  I back it.  And they also have a model train running on a constant loop through the bar.  I will have to try their food next time.",,,1
50,V J.,"New York, NY",89,346,120,4.0,2/22/2010,"* The real deal here is to get the 9$ pitcher of dark Reade Street Ale. The pitcher fills about 3-3.5 glasses, bringing the cost-per-pint to merely about 3 bucks. Its really a good deal for this neighborhood which is house to many pricey establishments. * It also offers typical pub food menu like fries, burgers, nachos etc.* The bartenders are cheerful and can engage and entertain you with the light casual conversations. Else, you can also watch some sports on its TV's. * Overall, a warm friendly bar, I really look forward to coming here frequently.",4,1,3
51,Charlie M.,"Floral Park, NY",1,44,0,4.0,4/22/2015,Nice to see a real local pub in trendy Tribeca.   Beers are a very good price.  Also a decent selection of bottle beers and drafts.  Food looked like typical pub food.  Very down to Earth bar staff.,,,
52,Martin W.,"Manhattan, NY",0,6,0,1.0,2/28/2015,The food sucks.  The cook has no idea what good food tastes like.  He must count on the clients being so drunk they cannot taste the bad food.  He cannot even make a good hamburger.,,,
53,Alex G.,"Manhattan, NY",0,10,3,1.0,7/16/2014,By far the worst meal i've had in the 3 years I lived in NYC. I was starving all day and only got through 1/4 of the burger before giving up. My friend couldn't finish her food either. Never again!,1,,
54,Benjamin S.,"Manhattan, NY",77,7,0,1.0,1/17/2014,Went here to meet old coworkers for lunch on a Friday. The place was mostly empty. The four of us ordered sandwiches. After 45 minutes and no sign of our food or the waitress we walked out.  Never coming back.,2,,
55,Gaby O.,"San Jose, CA",0,4,0,5.0,6/28/2012,"We got to NY after a looooooong flight from san Francisco last Thursday... it was like 119 degrees hot and had no idea where to go after checking in at the hotel. We walked down the street and there it was... The Place we called HOME during our stay in the city. The people form that place made the difference. From the waiter, to the bartenders (Poster Guy) and not to mention the guitarist, Chris,  playing the best music (Jealousy from Gim Blossoms will never be the same after listening Chris playing it).The Nachos, the burgers and the cheese stake  were delicious and the drinks were perfect! The prices were awesome too! We went back every single night before going back to the hotel and it was like getting home!When we FINALLY said goodbye it felt like we were leaving the house of this very cool uncle! We miss you guys! Gabriella and Crazy Friends!",,,1
56,Amanda B.,"Woodbridge, NJ",28,58,23,3.0,8/4/2012,I was here on a Thursday afternoon and it was just ok. A bit of a dive bar but the beer was cold and service was good.,,,
57,Justin P.,"Richmond, VA",172,136,6,3.0,3/18/2009,"This is my go-to pub in TriBeCa, especially on Mondays-Wednesdays when the pub is almost empty  Both the food and beer options are reasonably priced, the decor is decent and the bar is walking distance from my apartment. I definitely recommend ordering a cheeseburger here, which is quite delicious. The service is usually on-point and friendly. Each person who tended to my table did a good job. Overall, if one either lives in TriBeCa or happens to be in the neighborhood, I do recommend going to this pub, at least between M-W,  for a nice and relaxing evening filled with beers, food and good conversation.",4,,3
58,karen b.,"Astoria, Queens, NY",8,31,21,3.0,3/15/2011,"The bacon blue cheese burger is great and the Reade Street Ale is great but the place gets super packed at happy hour time and the space is a bit awkward. I have been at many a happy hour here and haven't even been able to get to the other side of the bar. It's great if you are going with a smaller group, but still a solid choice for unpretentious and decent pub grub in the Tribeca area.",3,,1
59,V W.,"New York, NY",6,153,0,3.0,1/2/2010,"A nice casual bar. Their beer selection was fairly limited, but their prices including their own ale for $9 for a pitcher (yes!) are a bargain.The crowd was surprisingly nice on the cold January Saturday. I don't get their infatuation with hats from NYPD, NY State Police and even ATF (the same group that is regulating your alcohol) and I personally prefer not to have televisions all over a bar, but overall it's a nice place.",,,
60,Dave P.,"WALL STREET, NY",11,17,0,4.0,7/30/2007,This local spot is a master of under-promising and over-delivering.  It is a perfect spot to enjoy some classic bar food like the amazing Reade Burger and Nachos.  They have good beers on a tap and will let you park yourself at a table to enjoy an entire football game.  This is my go-to spot for Monday Night Football games.The only reason for a 4 star rating is the lack of top quality TV screens.  There is one out-dated LCD screen in the back and a few old tubes sprinkled around.  The food and fun atmosphere more then make up for that though.,4,,2
61,John Z.,"Philadelphia, PA",21,140,21,4.0,9/25/2008,"You get  a real nice mix of people here. From blue collar construction guys to white collar office people and all the randoms in between. I ended up in some drawn out conversation with a drunk woman and her friend and we shared some wings. Good times. This is the kind of place you can make ""your bar."" This bar also confirms my opinion that everyone looks good in Christmas tree lighting.",2,4,
62,Mickey M.,"Jackson Heights, Queens, NY",272,683,43,4.0,1/27/2009,One of the best burgers in NYC. Good beer choices. Fair prices. I love going to the Reade Street Pub!,1,,
63,Andy D.,"Manhattan, NY",3,37,0,1.0,9/30/2010,"Sucks balls. The only thing worse than the food was the service. I wanted to send my food back, but I couldn't find a waitress to do so.",2,2,
64,Marisa B.,"Chicago, IL",30,105,20,3.0,4/20/2007,"Went here with some friends to watch March Madness last month.  Yes, it is bar food, but guess what -- IT'S A BAR!!  Burgers were perfectly done and actually looked handmade (as opposed to the frozen patty you get at some places), juicy and thick.  Fries were almost too crispy, but I like them that way.  Beers were cold and kept coming with a smile.  Props to the one and only waitress in the place - she kept the beers filled and was fast with the food, despite the lack of waitstaff.Update: $8 pitchers of Bud Light!!!  Yes, I know it's Bud Lite.  BUT IT'S EIGHT DOLLARS!  Love this place.  Love it.",1,,1
65,Rick L.,"Woodinville, WA",1,67,4,3.0,1/23/2012,Awesome hummus plate. This is an older pub with locals and old timers...thankfully not for tourists.,,,
66,Victor L.,"Brooklyn, NY",188,1057,14,4.0,4/6/2007,"The pub food here is fantastic, the burger is one of the best I've had in the city. The drinks are ridiculously cheap (we're talking under 4), and the bartenders friendly. Definitely a great place to go to if you're into pub grub and a couple drinks after work, a solid old wood bar to kick back and get casual.They have some new flatscreen HD TVs, and now, it's a great place to quietly watch the games because no matter what, this area of town is never going to get that crowded, especially since the pub itself is against type compared to the upscale restaurants and lounges. It's a well lit bar with plenty of photos of times gone by, and the bartenders are fairly chatty and attentive. It's one of those places where the winter chill will cause you to look inside from the window and see that the normal lighting is fairly inviting.",1,,
67,Jennifer Y.,"New York, NY",184,618,2,3.0,4/1/2009,"Meh. I can't think of anything great to say yet can't think of anything horrible either.  It's okay.  The only times I've been here Reade Street has been one of the only open options.Decor is average, drinks are cheap, food n/a.Overall, not a bad place to hang and watch a game on tv.",,,
68,Noname N.,"Brooklyn, NY",1,60,0,4.0,8/19/2013,"Good unpretentious bar, not too expensive. Perfect for Tribeca - where there are not many reasonable options - home of $8 beers (Walker's tavern used to be a good choice - alas no more). Reade Street's house beer Is surprisingly tasty  and well priced. Food was quite food. Would go back if in the area.",,,
69,Mordicai C.,"Brooklyn, NY",39,268,0,3.0,12/12/2010,"I know nothing about Tribeca, so when our plans changed at the last minute & my friend & I had to find a new place to eat, we were rudderless.  Wandering around, we found this place & it was fine, just fine.  The Big Reade burger is pretty massive-- that was my chow down; the hummus plate was actually pretty good, too.  The biggest perk this place has going for it is that they have paper placemats with crayons.  I am basically an eight year old.",,1,
70,Erika G.,"New York, NY",58,94,0,3.0,1/24/2010,"$5 for bottled & beers on tap but they have a good selection (and some domestics are $4). Pretty typical assortment of pub food items.. sliders, jalapeno poppers and a HUMMUS PLATTER! Nothing like good ol' blended chickpeas to keep it healthy (the platter comes w warm pita olives, cucumbers and tomatoes!). Points for being able to draw on the tables with crayons.",2,1,2
71,Juliette S.,"Maplewood, NJ",79,26,0,4.0,2/26/2013,"Fun place to go to meet up with friends.  It may be a little hard to get seats, but that's probably the same with most places!  The prices are relatively cheap - $5-6 a beer and when I went on a Thursday night, there was live music which was fun.  It was loud, but I was still able to have great conversations with my friends.  If you are looking for a laid back kind of night, I would recommend this place.  However, it is not a fancy place, so no need to dress up.",,,
72,lauren n.,"New York, NY",6,10,0,3.0,5/19/2011,Very chill and comfortable place. the food is OK but very good portion size. the only problem is the very slow service-- very very slow service. but the drinks are well priced and they have TVs all over the place playing all the exciting games. not stuffy at all! great for groups!,,,
73,Jared H.,"Manhattan, NY",0,46,12,5.0,1/8/2010,"Reade Street, how do I love thee- let me count the ways. Reade St. is my consistent go-to place when I have friends in town. Decor is unpretentious and authentic -- relics of the neighborhood and past/present patrons. Reade Street ale is something special. For $9 a pitcher, you get way more than your money's worth. I wouldn't recommend asking for anything other than Reade St Ale or you're likely to get a dirty look. And with good reason. The menu is solid pub food. I've had most of the appetizers at some point and can recommend them all. Just make sure you allow sufficient cooling time for the Jalapeno poppers, as they resemble little hand-grenades of mouth-scalding goodness. The spaghetti is surprisingly well-cooked. I regularly watch football and hockey games on the various tv's, and the staff is pretty receptive if you want to watch a specific game. Some tv's are better quality than others, but thats a minor point.The crowd varies widely: ATF agents, law clerks, bank analysts and locals all make regular appearances.From time to time, there is a guitarist who performs @ night. Not sure of the exact schedule but he's always entertaining and the crowd near the bar gets pretty into it.",1,,
74,Broke-Ass Stuart S.,"San Francisco, CA",575,69,3,3.0,5/13/2008,"This place doesn't lie; it is a pub and it is on Reade Street.  A mug of Bud is $3, a pint is $4 and the crowd is exactly what you'd expect it to be: after work people, locals, and the random, fat, 50 year old drunk guy who tells you how much he likes your hat and how many ""bitches he's got right now"" (you know who you are).  Actually this place is exactly what you'd expect in all regards.  They just aren't big on surprises I guess.",3,3,3
75,Dee T.,"Royal Oak, MI",76,572,23,4.0,10/27/2009,"The definition of a classic neighborhood pub, watering hole, joint. Love the bartenders. Love the puke green-blue hue from the tellies and the lighting. Love the prices.Haven't tried the food and don't think I ever shall, but if it's good, well that's just the icing.",,,
76,Meagen B.,"New York, NY",13,35,7,5.0,1/17/2010,"This is a great pub in Tribeca. Live music on Thursday nights is always fun. They have typical pub food which I love . The prices for food and drinks were cheap, the waitresses were good, and you can draw on the tables.",,,
77,Ted L.,"New York, NY",162,255,0,4.0,3/19/2009,"$9 for a pitcher of the house beer, which is actually a pretty good dark ale. A good find in an expensive neighborhood.",1,,
78,Tom D.,"San Jose, CA",0,107,7,4.0,5/1/2011,This place is solid. Nice bartender and helpful waitress for a an afternoon lunch in Tribeca. They make you feel at home like a pub should. The food was good. The Reade Street Ale was _pretty_ good.,1,,
79,Rebecca D.,"Brooklyn, NY",44,175,0,4.0,2/25/2008,"big cheap drinks!  cocktails in pint glasses!  chalkboards in the bathroom!  reasonably yummy food!  great place for big groups.  and best of all.....paper tablecloths and CRAYONS!!!!slow table service, though.",1,,1
80,Geraldine K.,"New York, NY",162,483,0,3.0,1/6/2009,"I've had my fair share of happy hours at Reade St Pub with coworkers. This is the place to be if you have an urgent need to unwind on a budget. There is nothing attractive about Reade St except for the happy hour drinks, so the company you are with better be good.  If you get a chance to glance around the room, you will see the locals, random old guys, and other like-minded groups convening for a drink or two.  FYI: This is Tribeca's local pub, if you ever need to get to one.",1,,
81,Adrienne B.,"New York, NY",40,322,5,4.0,4/22/2006,Seems like a fun neighborhood bar.  Went there once when I was visiting NYC.  I would definintely go back.  My boyfriend goes frequently with friends and enjoys it.  The pitchers are cheap and GOOD!,1,,
82,Mark A.,"Chicago, IL",8,69,5,4.0,7/14/2007,"I am always surprised when people slam a pub for not being more trendy or more like a lounge.  I love pubs because they don't try to be more than they should be.  A pub should be dark, slightly grungy with fresh beer on tap and great bar food.  Nice service is a plus but sometimes surly waitresses just add to the atmosphere.  Reade Street lives up to that promise.  The burgers are really juicy and good and the beer is fresh, not skunky.  They have the requisite TVs everywhere to watch the game, which makes this a good spot for Sunday afternoon football.  Good stuff.",1,,
83,Lacy G.,"New York, NY",6,33,0,3.0,6/8/2009,"I drop in here occasionally after work or for a quick lunch. Free wifi which is cool. Pretty good bar food. Very friendly, older bartender, named Mike, during lunch time - he's adorable. The female bartender, not so nice... Ever. Free wifi here!",,,
84,JJ R.,"New York, NY",1,110,5,4.0,4/15/2010,"After living in the neighborhood for many years, somewhere along the line, this place became my ""go to"". Other bars have come and gone but Reade Street will always be there. I've been critical of the food and maybe the service in the past but it really is the place where I've grown the most comfortable. I don't come here for special occasions but it's the perfect bar for all the other days that are not.",1,,
85,Jaze Z.,"Brooklyn, NY",1,77,21,4.0,7/26/2008,"Love the Reade St pub. I work in the area and find myself there at least once a week after a long day's work. They don't rip you on price of drinks, the bartenders are friendly, you get a mix of area professionals, and locals, young and mature. Try a pint of the Reade St. ale, it's delicious, they should bottle this stuff and sell it. The food is decent, but the best part about the place is that it doesn't have attitude. Come in have a beer, chat it up with the bartenders (they don't forget you), toss a buck into the jukebox, sit back, and order more.",,,
86,courtney T.,"New York, NY",2,8,0,2.0,3/4/2011,"Great Guinness. Horrible food. Drink here, but don't waste any of your calories on solid sustenance at this establishment.",,,
87,Chinku G.,"Hicksville, NY",21,541,0,4.0,1/15/2006,"Its bar food. For bar food, it was REALLY good. The Reade Street Salad was Great and our burgers and Fries were cooked perfectly. The service was very friendly. Our waitress/bartender was very warm and engaging. It was a great place just to hang and drink a beer.",,,
