,er_name,er_location,er_freinds,er_reviews,er_photos,er_rating,er_date,er_text,er_useful,er_funny,er_cool
85,Kelli S.,"New York, NY",324,46,8,4.0,4/4/2009,"I've only been here once for drinks and a grilled cheese which both suited me fine at that moment, but Beau goes here all the time.  He has been a huge fan since it's former East 4th Street days in the late 90's.  This is what he has to say:Great wing and beer specials.  Good variety of beer.  Plenty of televisions.  Nice friendly service.  Dart league night is obnoxious.  Anyone who plays the buck hunter game needs to be jettisoned from the planet.  Otherwise, it's a good place to go.",,,
86,Evan O.,"Manhattan, NY",0,6,0,5.0,8/30/2011,"Fantastic little bar. Waitress was friendly, plenty of seating for a group. Amazing deals on wings (which they're capable of making genuinely scorching) and competitive beer deals. I definitely plan to go back! My only complaint is that the TVs and music were a little too loud.",,,
87,Ryan S.,"Manhattan, NY",0,3,0,5.0,8/7/2011,"It was a seasonably warm Sunday in July of 2011.  My roommate Devin just got home from a Wedding in Buffalo, NY- it was his cousins wedding.  Carl was in town too, he's my other roommate.  Our friend Colin, who currently lives in Union, NJ was here with his girlfriend Siobhan- they love wings!!!  Christiana was here too, shes our friend from Buffalo, NY.  After a long day of watching Bravo's new hit series, ""Flipping Out"" we decided to get some ding dongs (wings).  They were great; Siobhan ordered them Hot-BBQ, she made up the recipe in her head right then and there- they obliged.  She used to work at Duffs, so she knows her wings, let me tell you.Anyways, the wings were fantastic!",,,
88,anri i.,"Brooklyn, NY",51,77,0,4.0,9/11/2008,"I kind of love this place. It's low key, has really good burbon wings, and artichoke dip. It's a treat to just sit outside and eat wings and other appetizers while drinking cheap beer during happy hour specials. It's definitely somewhere I hang out before I go to a bar...Go there if you're in the mood for typical bar food with friends.",,,
89,Ryan J.,"Troy, MI",23,82,8,3.0,8/19/2010,"One of those not cheap dive bars. It was fun and everything, but could use a little price deflation to join the ranks of the ""go to"" places.",,,
90,Gabriel D.,"San Francisco, CA",255,134,0,4.0,12/1/2006,"Apparently this used to be a dive bar under another name.  Then one day they painted a fish on the window and everything changed.  Beers and appetizers are reasonably priced, they've got TVs, but not so many that you'll be overwhelmed by frat boys, and lots ot tables and space.",2,,3
91,Paul C.,"New York, NY",77,441,352,3.0,5/14/2009,"Nice bar, I had not noticed it for a long time, cute staff and reasonable beer selection and prices. Nothing special to bring me back however.",,,1
92,Emily A.,"New York, NY",30,54,2,2.0,6/3/2007,"Just as an honest, divey bar, this place would be fine. Not great, but fine. Very fratty, watchin' the game vibe.  But they're trying to be a little fancier than a dive, and they fail: the food was really not good, and I left a little annoyed because their burger is boldly named ""NYC'S BEST BURGER!"" on the menu, and the best you could say about the burger was that it was inoffensive. Not even close to delicious, let alone NYC's best.",1,1,2
93,Melanie C.,"San Francisco, CA",78,194,0,3.0,2/22/2009,"my friends and i walked across the street to stillwater after it looked like kgb bar was having some sort of performance going on. the girls who work here are incredibly cute and friendly asian girls (just like me! ahahaha) and right when we walked in, they grabbed more stools to put around a table for my friends and i. the music was some jazz mixed in with the specials and we all know how i love the specials!BUT THEN.this middle aged woman brought it upon herself to spend massive amounts of money on the jukebox. and what did she pick? let me tell you, it was a total assault on the ears for the rest of the time that i was there. linkin park, saliva, white zombie, marilyn manson, crazytown, stone temple pilots, metallica, she wants revenge....you get the picture. terrible music that i thought was left within the suburbs of america. and with every single song that came on, we all collectively groaned and talked shit about the music and prayed the michael jackson songs we put a $1 in for would help alleviate the pain our ears were being subjected to. sadly, her playlist was way too long and we never got to hear the MJ songs.c'mon lady. you're at a bar in manhattan, not some dive bar in jersey.  spare us of the torture you put us through. THEN, during the last 15 minutes we where there, it somehow got massively crowded. the bar was relatively not that full when we were there. but like 40 people showed up out of NOWHERE and crowded into the bar. major hint for us to get out and seek shelter elsewhere. however, the bathrooms were clean and the girls who work there were on top of it, never rude, and extremely nice.",1,,
94,Aaron C.,"New York, NY",1,22,1,4.0,1/7/2010,Amazing wings.  Not too crowded.  Good drink specials.  Perfect for Sunday,,,
95,Will B.,"New York, NY",5,23,0,4.0,1/14/2010,"Nice bar, cool atmosphere.  On Tuesdays and Wednesdays they have Yuengling and Goose Island for $3.50 and on Thursdays they have $4 Absolute mix drinks.  And they have a pool table.  I was there on a Wednesday and it was not too crowded but not dead at all.  Not bad!",,,
96,merisa t.,"La Jolla, CA",77,209,2,3.0,2/8/2009,"I like this place.  It is a total dive, but everyone is friendly and it is affordable.  Can't be beat - for the neighborhood.  Not a place to go out of the way for....but if you are in the area, or meeting a large group of friends - it is perfect!",,,
97,Joe V.,"Canton, MI",50,415,2,4.0,5/10/2008,"Quality bar. It is a good place to watch sports, it has good bar food, it has Buckhunter, bowling, megatouch, a juke box and a pool table. The pool table is a bit cramped by the walls, but it makes it interesting. The bartenders are friendly and attentive, but the waitstaff can be a little inattentive if there is a big party in the 2nd room. No bells and whistles, but a great place to grab some drinks.",,,
98,Jessica A.,"Brooklyn, NY",85,181,0,4.0,1/20/2008,Solid EV dive but not so divey. Not too crowded on Sat night and highly accomodating to very late night drunken Buck Hunting shot taking jukebox playing pool sharking dirty fun. Solid.,,,
99,Jennifer S.,"Brooklyn, NY",0,1,0,5.0,11/23/2008,This bar rocks we went for Halloween and a couple of other times. Always fun! Great beers on tap can't vouch for food cause we only drank:)Great people never too crowded...owner always makes sure you've got a beer in your hand-super cool!Definitely will be back!,,,
100,Megan Z.,"Morgantown, WV",0,1,0,5.0,9/7/2008,"You need to go here on Sunday or Monday (prefferably during happy hour) and order the burbon wings.  They are $3.50 on these days and always AMAZING.. meat fall off the bone, oh my they are the best a chicken can be!  seriously!  and with $3.00 drafts during happy hour. . you can be poor and drunk and full on yumminess for cheap.  GO THERE!  maybe there is nothing else spectacular about here, but believe me the wings are enough.",,,
101,Jason F.,"New York, NY",14,41,0,4.0,3/30/2009,"being new to NYC didnt realize you have to make reservations to watch march madness, which to me is completely out of hand. being turned down at 2 bars, stumbled across this place. great service, many beers on tap, tons of tv and very accomodating. will watch all my college games there going forward.",,1,
102,Sasha H.,"New York, NY",34,575,0,2.0,7/27/2008,is it possible to employ such a terrible bar tender? he delivered some of the worst drinks i have ever tasted and even managed to screw up patron shots by putting salt on the limes.,1,,1
103,Muppet A.,"New York, NY",48,82,5,3.0,7/11/2008,"Good dive bar for cheap beers and friendly service. Well-situated for people-watching and street seating. The selection wasn't beyond the expected, but $3 for a low-key beer before a show across the street sounds just fine to me.",1,,
