,er_name,er_location,er_freinds,er_reviews,er_photos,er_rating,er_date,er_text,er_useful,er_funny,er_cool
44,Jorge O.,"México, D.F., Mexico",116,182,220,4.0,7/2/2014,"Awesome find!I was looking for a place near me where I coul dwatch a game AND have a decent lunch. I used to do all this in another place nearby but recently they changed their menu and don't offer many vegetarian options any longer... Anyway, I'm glad I found Stillwater because they have a pretty good, inexpensive veggie burger, and it's a great place to watch a match.The bar half has the most TVs and tall tables. Seems ideal for drinking, snacking, and watching sports. The restaurantish half has regular tables and waiter service. It's clean, well lit, and has enough TVs as well. The service was very fast and I was happy to discover they had awesome draft beer specials that day.They have different drink specials every day actually, which is great. There's also an outside seating area so this place really has a bit of everything that's good in a city bar/restaurant! (I'm not sure if they do coffee but that would be even better).I need to come by more and if my experience is consistent I shall give the 5th star.",,,
45,Joseph P.,"Manhattan, NY",2,45,7,3.0,9/14/2015,"Went to Stillwater for the Oklahoma St. football game.  This is a great place to watch the OSU games.  We were just here for drinks so I can't review the food.  I had the Cowboy which is a Bud and a whisky shot for $7, which isn't too shabby.  Someone else at the tab had the lime/vodka drink, which was pretty nasty due to the liquid that they use for the lime flavoring.  They would be better off just using natural lime juice.",,,
46,Katie S.,"New York, NY",0,1,0,1.0,6/15/2015,"If you have low expectations, love to eat shitty food, and are expecting to be immobile for an entire day afterwards, then eat here! My friend and I ordered delivery from Stillwater because it seemed to have pretty good options. That was NOT the case, however, when we received our meal. I got a salad, which could have been better if I'd ordered it from McDonalds. I also got ""pasta with marinara sauce"" aka macaroni and cheese with KETCHUP MIXED IN. And don't worry... that's not all folks! My friend got a chicken sandwich that gave her FOOD POISONING the next day. Fucking food poisoning, people! The food is so bad that I decided to actually write this review, which is seriously saying something. In the wise words of Avril Lavigne, ""Why'd you have to go and make me so constipated?""*Drops the Mic*",,,
47,Lani Y.,"Rego Park, NY",66,85,132,4.0,6/30/2012,"It was incredibly empty at 2:00pm on Saturday, but the $5.00 mimosas called to me and I answered!My friends and I came here for a meeting and found it to be a great little rough around the edges bar and restaurant. Our waitress was awesome and kept our drinks refilled, and although we only ordered appetizers, what we got was simple and tasty.It is a great place to go to if you are going to see a show at La Mama or the New York Theater Workshop. The prices are good and the location is great ^_^",1,,
48,Nina S.,"Hoboken, NJ",3,51,19,4.0,9/13/2014,"Simple bar, nicely located, not expensive, acceptable choice of draft beers. Staff is very nice",,,
49,K L.,"Flushing, NY",83,42,1,5.0,12/8/2011,"It's been a while since I've been here on a weekend night, so I can really only comment on their weeknight happy hours.But you know what? They're awesome. This is a chill place to get together with friends just to catch up and have a beer. Their food is decent too. The service can get kind of loopy sometimes, but that's not what I come here for.  It's an all-around good neighborhood bar with great drink deals, good food, decent music, and always an interesting sports game on.",1,,
50,Tina D.,"Brooklyn, NY",107,147,13,1.0,1/16/2012,"We stopped by for a drink and a snack while having a night out.The drink was alright; overpriced in my book. And our snack, nachos, were pretty disgusting. The waitress also failed to check up on us, as she was being hit on by another patron.I wouldn't stop by this establishment again. Poor foor & poor service.",,1,
51,w k.,"Los Angeles, CA",0,7,0,1.0,10/5/2013,"Don't go here, even if you're an OSU fan.  Beer tastes like taps haven't been cleaned ever and seemed like our mere presence at the bar was an inconvenience to the servers.",1,1,
52,Kassy M.,"San Diego, CA",260,1352,639,3.0,4/29/2012,"Atmosphere: Divey bar with a decent amount of space. They have the bar area, and the dining area with seats and tables. We were there on a Sunday night around 10pm so I have no idea what it's like on a Friday or Saturday night. For some reason, all the TVs were not working.Mac & Cheese: Pretty decent! I had pretty low expectations but this side dish got the job done. It comes in a cute ceramic bowl and there's more mac & cheese in there than it appears. I've definitely gotten way less for $5.Fries: Decent as well. Very thick and rather soft.Service: Our waitress was friendly and accommodating. However, she did forget to give us utensils and napkins when she served us our food...but I'm going to let it slide because she had to deal with eight hungry Brooklynites.They have crazy drink deals that start at 11am but I can't remember the details.",,,
53,Jason G.,"Brooklyn, NY",405,1096,89,4.0,9/25/2011,"I was surprised by this bar. While it's not my style (it's a sports bar) I find it meritorious on numerous levels.1) No less than 4 types of wings on the menu2) A really sophisticated advanced jukebox machine3) Not crazy crowded on Saturday night, yet in the EV4) A well-arranged system of TVs covering football games from many regions of this nationI could see myself coming back.",1,,
54,T L.,"New York, NY",5,94,74,1.0,7/13/2014,"Really want to like this place but struggling to find many good points today.  First it's crazy hot in here. Sweat rolling down your face hot. No AC? It's 84 out now and with the 40 or so people here, it has to be heated up to 90+. The bathrooms smell like a port-a-john-- from outside the bathroom. Water and pieces of food left on tables, dirty napkins on the floor...waitstaff clearly doesn't care. Two of the waitresses reek of body odor...ugh, no thanks on whatever you're serving. I've honestly been more comfortable and smelled similar odors on a crowded subway in the heat of summer.  At halftime, it was no mystery that half the bar left. Won't try this again until its cold outside. And even then its a stretch. If you don't mind a dirty hole in the wall place-- and I like those too sometimes-- this place will fit the bill, but have a plan B.",,,
55,That ronald T.,"Manhattan, NY",104,132,0,2.0,12/3/2011,The only thing that prevents me from giving this 1 star is that some of the food is decent.Not all of it.  Just tasted a burger here and it was horrendous.  But the wings are good.And the staff is lame.  Any bar where I order 8 PBRs and the bar tender does not comp me at least 1 beer sucks.  Especially when the bar tender is a hipster bearded dood.  There is nothing worse than being disrespected by a bearded hipster dood.Take away Buck Hunter and this bar would go out of business.,,1,
56,Casey W.,"New York, NY",544,577,36,4.0,2/11/2008,- neighborhood watering hole- great place to go after catching a play at any of the theatres on the block- low key- recommend chicken quesadillas,4,2,2
57,Taneesha C.,"KNICKERBOCKER, NY",8,136,6,3.0,2/16/2014,"I live around the corner and pass this place all the time. Decided to come in for some wings and beer! The wings were nothing special but their mac and cheese was heavenly delicious! Pretty straight forward bar with taps, and TV's. Looks like they have some great happy hour deals and specials every day!  I will be going back. I ordered the wings with kick ass sauce, they tasted a little old. I wish I would have doubled up on the mac, I will try it with the chili next time.",,,
58,Sylwia W.,"Brooklyn, NY",32,155,44,3.0,9/17/2008,"One of my friends was raving about the bourbon chicken wings and the half-price-wings Monday special, so we decided to come here for some dinner before Gossip Girl (best show ever). For a bar, it's really roomy inside, and decorated very much like a local bar should be: chalkboards, traffic lights, beer signs, and flat-screen TVs all tuned to some incarnation of ESPN on the walls.I wanted to love this place, mostly because it's always exciting to find a new place that takes chicken wings as seriously as I do. And indeed the wings were good; as my friend promised, they ""fall right off the bone"" and are surprisingly tangy-sweet. I don't know if they necessarily pair up well with bleu cheese, but the fries are definitely a required add-on. Of course, the wings would have tasted even better if they hadn't gotten cold while our waitress completely messed up our order. We wanted two baskets of fries and three of wings...so she brought us three of fries and two of wings. Um. And she got two of us the wrong drinks. She seemed nice enough about it, until we realized that the reason we weren't seeing her was not because she was busy with other patrons but because she was hanging out behind the bar. When I go back, I'll try the regular wings, and hopefully the service will be better so I can maybe add on another star.Bathroom Grade: N/A. ...aaaaand, I'll try the bathroom.",2,1,1
59,Thu V.,"New York, NY",105,117,0,4.0,6/16/2010,"we serendipitously came upon this place (yay! I used my word of the day in a sentence! and 6 syllables at that!) when dempsey's pub was overcrowded with drunken USA soccer fans looking to get on ESPN tv during the game.. it was noon, no one was in the bar, and we thought, SCORE!  we have this place to ourselves to enjoy the world cup!  we ""velvet-roped"" off (and by that, i mean, i manhandled anyone who tried to steal our barstools) our corner of the bar in front of the TV next to the pool table and near the toilets - seriously, i had PRIME REAL ESTATE.. and boy, were we lucky to get there then, because this place ended up getting all the backwash from dempsey's around the corner!$10 pitchers of beer were flowing nonstop, but if you were one of the unlucky to come late, they ran out of pitchers.. so that's kind of a boo for them, but a yay for us!  i'm guessing this place usually never handles a crowd that big... food-wise, was greasy, good pub fare.. if you serve disco fries, i'm all over you!  and stillwater served them, full of cheesy, gravied goodness (now i'm just making up my own words) - i had 2 orders!!  wings were SPICY HOT and we really felt the heat since the A/C was lacking in a packed room of sweaty soccer fans - again, i think they never expect a large crowd so on a normal day, i'm sure their A/C works fine and dandy..anyways, US tied England - USA! USA! USA!   after 12 ptichers of beer, 2 orders of disco fries, 2 orders of wings, and chicken fingers, between the 6 of us plus tip, it came out to only $27 each!  SCORE!!!  for cheap, greasy, alcohol buzz.... or maybe i should say GOOOOOOOAAAAAAAAAAAAAAAAAAALLLL!",8,9,8
60,Michelle K.,"Manhattan, NY",4,6,0,1.0,2/3/2014,"Ordered food here on Super Bowl Sunday via Seamless.  They confirmed the order about 15 minutes after it was placed, and gave us a delivery estimate of 90 - 105 minutes.  No problem, it's Super Bowl Sunday - we get it - they're packed.  However, after 3.5 hours, the food still hasn't shown up, and they seem to have taken their phone off the hook so we can't even cancel our order.  We get it, it's a busy day, but turn off Seamless if you can't handle the order flow.  And once you do, don't take your phone off the hook so that people can't cancel their orders once you can't meet the delivery times that you promised them.   Pretty lame.",,,
61,James F.,"North Attleborough, MA",14,279,6,4.0,12/24/2010,"Here recently with a party of 6-7.  I'm not from the area, but was in town visiting a group of friends, and this was our after-dinner drinking stop.Having recently finished off a monster of a meal, eating was not a part of the evening for most of us (two late-joiners did order some apps, which were good, not great).Beers selection was adequate - not a 'brag about the taps' type of place, but they had things from off the beaten path.  We had a good laugh when half the table ordered a local brewery's fall seasonal, received the beer and tasted it, enjoyed it, and the found out that it was a different local brewery's winter seasonal (we kept on ordering it, although we referred to it as 'mystery beer')Service was quite friendly and attentive - we joked about our 'dueling waitresses' as it seemed that they were competing with eachother to take our next order.Our party also had an 'aha' moment (followed by a ""wow we're dumb for not realizing this earlier"" moment) when someone put together the name of the bar, the orange walls, and the OSU (Oklahoma State) logo sprinkled about - not sure how many patrons realize that Stillwater is a reference to Stillwater, OK.",1,,
62,Whitney H.,"Savannah, GA",1,2,0,5.0,11/16/2013,Excellent place for drinks and game time action.  Ask for Joe!! He's excellent. Offered us the best drinks in NYC.,,,
63,Maggie M.,"Houston, TX",6,63,6,3.0,10/2/2012,"Great place for before and after the comedy club across the street. Big Buck hunter adds to the fun, if you get the gun that works.",,1,
64,Matt P.,"New York, NY",12,21,3,4.0,3/28/2013,Best chili I've had in NYC. Bourbon wings are delicious. Fun waitress.,,,
65,Chris H.,"Chicago, IL",52,220,7,3.0,4/4/2011,"Nothing particularly special, but a totally adequate sports bar. It has decent prices ($5 a beer or so) and gave me an insane pour on a whiskey. A little plain in terms of decor (I know its a sports bar, but it stood out). More of a standing bar, than a sitting one.Has darts, a pool table, Buck Hunter, and an electronic jukebox.Also has a restaurant attached to it, but I didn't try it.",,,
66,Katey G.,"Astoria, Queens, NY",55,414,15,3.0,4/19/2010,"Your basic borderline divey-sports-like bar.Come to play pool, weird ""Kill Animals, like lizards!"" games or watch some TV. Enough places to sit, dim enough to make everyone look attractive. The staff was friendly when I was there and I never wanted for alcohol. Really, what else can you ask from a bar like this?",,1,1
67,andy t.,"New York, NY",258,439,33,3.0,4/4/2012,"Stillwater was the surprise winner of my recent Final Four Bar Crawl. I had never heard of this place before, but La Cheeka and I stumbled in here to catch the opening tip. We both thought the place was cozy and unpretentious, though neither of us were bowled over by the warmth of the bartenders. The crowd was chill and enjoying the various diversions such as darts and Buck Hunter. My only real criticism of Stillwater is this: If you are going to call yourself an expat Oklahoma State bar, then where is the hanging jersey of former Cowboy great Barry Sanders? I mean, you gotta at least have that, right?",,1,
68,Gardener P.,"New York, NY",3,40,0,1.0,9/27/2009,"For a Saturday night, it wasn't too crowded, but then again maybe that's because the waitress refused to turn up the jutebox after we put ten bucks in it,  because ""the lady upstairs calls the cops if we get too loud.""Or maybe it was because there were toddlers running around the BAR at 10PM b/c Mom and Dad don't want to give up their social life. So, the bar allows for a 4 and 5 year old to run around the pool table while the waitress trips around and over them carrying $2 can's of PBR and watered down Blue Moon with a lemon wedge instead of orange. (I'm a beer snob, this angers me)When someone would get up to use the bathroom, she continually asked if she could take their stall for another party.Interrupted us at least three times to offer us free beer she accidentally put on someone else's tab, then got insulted when we said no thank you.The bathrooms were small and smelled, covered in toilet paper and writing on the walls and mirrors and doors.The front of the bar where we sat has an open bay window, which all of the customers continually stood in front of to smoke cigarettes, which meant all the smoke came inside the bar.  Just as I was about to ask the waitress to say something, she went outside to join them.Definitely not a place I will be returning to any time soon.",2,,
69,Ricky T.,"Manhattan, NY",24,6,0,5.0,9/9/2011,Went here to watch the OSU Football game last week.  The side room where a lot of OSU Alums were sitting was a little small for the amount of people we had and very warm but they opened the whole bar to watching the game which was great.  Pitchers of beer were $10 and Joe's Fries were great!  I had a great time seeing all the orange and OSU shirts in NYC and will def be back to Stillwater Bar.,2,,1
70,Ali C.,"Nashville, TN",230,345,4,4.0,10/16/2012,"Matthew is an awesome bartender. Just had a beer and pickle back, but both were fine!",,,
71,Mike B.,"FOREST HILLS, NY",184,1504,174,4.0,"2/15/2010
            





Updated review","after a bit of a hiatus for a few months from going here, I made my triumphant return for the 21st birthday of our department's intern.thank you Stillwater, for your inexpensive beer and shots made sure that a good night was had...I think.also, I refuse to apologize for eating the french fries that some hipsters ordered.",,,
72,Dan F.,"Manhattan, NY",187,257,70,4.0,"11/8/2009
            





Updated review",Tried it out again...both the Bourbon wings (the ones that literally..drop off the bone) and the buffalo.  Big score on the buffalo.  I like them a bit better.  The bourbon I will say was better than before...very good flavor.  Just not a huge fan of the texture.  Sunday is a good day to go where beer is $3 and wings are half off.Will be here again.,,,1
73,Rob N.,"New York, NY",366,51,46,2.0,2/12/2008,"I wish Stillwater were better than it is because I work across the street, a lot.  But it is not. I have been to Stillwater more than I would have liked to, so maybe I am holding a gruge of some sort.  I would say that it has okay food and cheap beers, but the food is not great or exciting (more passable and greasy)  and the crowd can be a bit annoying.  The waitstaff is nice and I have friends who like to play the buckhunter that is there.  With a large group it can be nice to sit at the tables in the room beside the bar. It is just too bad that the bar is so otherwise unremarkable.  There is outdoor seating during the early part of the night when it is nice out, too. I will be back, but not because I am counting the moments I am away, only due to its proximity to where I have to work...",3,1,1
74,Patricia H.,"Brooklyn, NY",34,17,0,3.0,11/5/2008,"I work at Kaplan, which is a block away from Stillwater.  When I first started I found out that the bar had half-priced wings on Sundays and Mondays.  I've been hooked ever since.  The wings are just the right flavor and hotness.  I always get medium because that's all I can stand.  Their hottest sauce really is very hot.  Be warned!  Stillwater has a pool table, and it's fairly easy to get it if you go during the week.  New York bar favorite Buck Hunter is also present, along with some other bowling game (which I've never seen people play....).  The beer is good and the service is good.  If you want to watch a game on a Sunday, they'll change the channel on the big screen if you ask nicely.It's not the world's most exciting bar, but it's comfortable and makes a great local hangout for after work.",2,2,2
75,Cat M.,"Manhattan, NY",118,78,8,4.0,1/27/2009,"I used to come here when it was known as the 4th Street Bar, and I haven't been here lately.When I was in college I would visit at least twice a week for the weekday specials.I'm not a big fan of the late-night/weekend crowds/frat boys. If you want a good deal, go for mid-day happy hour from 11AM-7PM for the $3 pints and the quiet atmosphere (and Buck Hunter!!). Also, best potato skins I have ever had.Bartenders are super friendly and if you are a regular, they'll give you a few drinks on the house. Waitresses can be a little ditzy, but are also very friendly.",1,1,1
76,Aly W.,"Brooklyn, NY",390,261,0,4.0,4/22/2007,"Remember duck hut?Well, there is a similar game at this bar...involving elk. (Yes, elk massacring does bother me a bit..being I am so intimately involved with the species...but the digital realm provided for a fun time.)Delicious cocktails, reasonably priced, and fun, laid back scene.",2,,2
77,Kristin M.,"Manhattan, NY",22,67,9,4.0,4/22/2012,"Really great service, and very reasonable prices.  Chill atmosphere, and accommodating our group was no problem at all.  The food isn't great, and the beer list is nothing to write home about, but it was such a comfortable place that I'm sure I'll be back.",,,
78,Victor L.,"Brooklyn, NY",188,1057,14,4.0,5/5/2007,"Gabe's right, this used to be just called the East 4th Street bar, it was kind of divey, but it was one of my favorite places to go for a 4 dollar Coors Light. The bar was awkward, but the tables were a good place to sit down with a group. Loved the staff there, they were always really friendly. They had pool and whatnot. It was a solid investment of your clams to go and drink. In fact, I'm going to go so far as to say its one of the best no frills bars in the area, and there are some really decent bars in the EV.I haven't been to the new Stillwater, but judging from passing by, it looks fairly the same, done up a little bit, but I'm sure its just as good. The layout is fine, because you have the bar on one side and the tables are separate in the second part of the room so you don't have spacing problems.",2,,1
79,Tim A.,"Long Beach, CA",31,150,46,4.0,5/31/2009,"That McSorely's was sorely over-rated.... This place was chill-ax!  Bartender was super nice.  Beer good.  Pool table great: I  came back from 0-2 to win best-of-five!!  Can't wait to come back and have some late-night grub. Anyway, great place to relax with friends. Reasonable prices, good music, great staff.",,,
80,Derek I.,"Hoboken, NJ",142,65,4,2.0,8/4/2009,"Went about 1 - 2 months ago.  Nice bar.  For a Saturday night, it wasn't too crowded.  Quaint atmosphere.  Good drink selection.  Definitely a good place to bring friends for drinks or pool.The food on the other hand was nothing to be desired.  I was really in the mood for a burger that night , an behold there is a burger on their menu, which I ordered.  The burger lacked any flavor whatsoever, and was quite tough.  The fries were tasty though.  I heard all my friends had good food, so maybe I was unlucky with the chef this time.Would like to give it 2.5 stars, but alas there is no half star increment.  As such, I give a 1 for their bad ""NYC Best Burger"", but a 3-4 for the atmosphere.  Perhaps I will go again with friends, get something different and re-update this review.",,,
81,Hideki K.,"New York, NY",741,1080,310,4.0,8/18/2010,"Stillwater has great wings, especially for a bar!",1,,1
82,Evan M.,"Half Moon Bay, CA",3,26,4,1.0,8/18/2011,"hey everyone listen up this place SUCKS. the service is the worst. we sat down, didn't get menus and a meal that should have taken 30-45 minutes TOPS took 2 hours because the service was so slow. I spent a lot of time sitting and waiting. Besides that, the night i went their credit card machine was broken but they neglected to tell me that till i spent more money then i had cash. so then i considered the $2.00 service charge i spent at the ATM across the street as a reasonable tip for my experience at this horrible place. NEVER GOING BACK, EVER! and my advice is if you haven't been their yet don't go it's 3.5 stars on yelp and a 100% on urban spoon so don't be fooled, it blows!almost forgot, my waitress had facial hair and was disgusting... made me wanna throw up everything i ate. not good for the food business.",,,
83,Kimberly F.,"Brooklyn, NY",174,431,25,3.0,11/1/2008,"I really liked this place until the owner got all up in my friends face, for banging on the bathroom door to hard. ""Really dude? Really, we just dropped about $200 bucks in your bar!""I really liked everything about this bar, the bartender, who was cute,sweet and fast as hell! Great music, crowd, and just a chill place to hang. The food smelled amazing, i would have gonna back if it wasn't for the crazy ass owner who i feel might have been drunk, screaming in my friends face, as she coward in her cat costume. Not a cool way to start Halloween night.",,,1
84,Tara L.,"Jackson Heights, Queens, NY",158,586,17,4.0,2/26/2011,"Oh Stillwater, my old friend. It was nice to be back after an extended hiatus after overdosing on too many of your foods. This is one of my dad's favorite bars to eat and watch sports at. We were starving last night after driving my dad in from his adventures with us in Queens. A philly cheesesteak sandwich for me hit the spot. My dad enjoyed his catfish po' boy with tomato slices instead of fries. He usually gets the triple grilled cheese with bacon and tomato but he's trying to eat slightly more healthy...but that didn't stop him from stealing lots of my fries. Eric got a shrimp basket which was good except we forgot that they are ALWAYS out of cocktail sauce. We started out with the sausage chili appetizer which is always good but seemed smaller than previously.The waitstaff seems to have changed since I was last in and that's a good thing since many of the waitresses in the past seemed to barely be able to breathe without thinking really deeply about it. I LOVE that they always have beer specials even if it's Bud or Bud Light. The $3.50 beer for last night was Goose Island IPA and a pint of that is always welcome.",,,
