,er_name,er_location,er_freinds,er_reviews,er_photos,er_rating,er_date,er_text,er_useful,er_funny,er_cool
0,Jonathan S.,"Litchfield, Litchfield, CT",0,2,0.0,5.0,10/12/2018,"Great spot for a quick snack or a longer event. Loved it! I was here for a buddies wedding a few weeks ago, and loved it so much I came back for a few classes and dinner. 100% recommend!",,,
1,Jennifer M.,"Bethesda, MD",227,145,1177,5.0,2/21/2018,They have so much room to cater to almost every event. They offer cooking classes and I believe a cocktail making class. The food is great too. The place is super cute and very inviting. They sell cute things too like cookbooks.,,,
2,Sam S.,"Brooklyn, NY",11,29,1,1.0,8/22/2018,Stepped in for coffee and with the worst attitude i was ever given by a store associate was told they were closed. The barista was a male with glasses. Get your customer relations in check. A simple sorry were closed isn't hard.,,,
3,Doug M.,"Snoqualmie, WA",128,34,22,5.0,3/27/2018,"What a phenomenal night! I was visiting NYC from Tucson, AZ and decided a cooking class would be a great option for dinner! We loved the watch & learn and the hands-on aspects of the class, made even better with snacks and wine! Our chef was very clear in making a complex dish seem easy and I left with the confidence to make Veal Osso Buco myself at home! I also now (finally!) have the perfect excuse to buy a large Le Creuset dutch oven... something I've trying to justify purchasing to myself for a long time.Don't think twice about Haven's Kitchen - sign up for a class and have fun! It's awesome for date night and would work well for groups too. So fun.",2,,
4,Stephanie A.,"Brooklyn, NY",1398,568,597,5.0,11/22/2016,"I was able to take a cooking class here thru Wall Street Journal Plus and loved it! The class started at promptly 5pm and was approximately 2.5 hours long. As soon as we stored our belongings away we were greeted with wine in hand... yea this is already starting off well. Most people had red or white but I actually opted for a craft beer/wine creation that they had which was amazing!The main chef Alexis Delaney was phenomenal. She was friendly, bubbly and great with instruction. We initiated around the main stove introducing ourselves before we headed over to our stations to slice and dice. This was a Thanksgiving inspired menu as it is that time of year. This class was 100% hands on. No cookbooks just simple instruction. The entire time we were cooking someone was going around refilling our wine glasses as well. Our menu consisted of the following:Stuffed pumpkins with wild rice, sausage, pecans and cranberryPotato & celery root pureeMushroom gravy sauceBrussel sprouts with chestnut & pomegranateChicory Salad with fennel, apple & blue cheesePear tarte tatin for dessertEverything we made was literally superb. I want to start taking cooking classes regularly so that I can cook with this amount of flavor, it was amazing. After enjoying cooking and mingling we all sat down for a family style dinner to eat all of the decadent things that we had made. The class was 12 people including myself so it was very intimate. This class was super fun and if you have the opportunity to take a cooking class here I would highly recommend it! I am making two of these dishes for my family this Thanksgiving!",13,5,10
5,Tiff C.,"Queens, NY",109,702,905,5.0,6/25/2016,"Loved this class!  Amazing instructor and staff/helpers. David was so entertaining and engaging, making jokes, keeping everyone's interest. He was patient and friendly, answering questions throughout his demonstrations. We really learned a lot in such a short amount of time. We learned how to butcher two fishes --  a large fluke and a branzino. With the fluke, we worked in small groups of 4. With the branzino, there was enough for everyone to butcher one individually, which was nice. It really forced you to focus and practice what you literally just learned. The fluke was easier, a bigger filet, which we chopped and used in a delicious citrusy ceviche. The Branzino was harder and a lot of people butchered it poorly. It was smaller, and had pin bones that you had to carefully tweeze out. We cooked that one in parchment paper, in the oven, with a variety of flavoring -- salt, herbs, veggies, olive oil. The next dish was a deliciously rich brown buttered branzino. It had some acidity and saltiness that rounded out everything. While some students made the buttered branzino, David helped a cluster of other students with shucking oysters. It was pretty hard, but everyone had so much fun doing it. When everything was done, we sat at the long table to eat, with our wine glasses (felt so grown up!). Then we enjoyed all our work! It was light, refreshing, and paired perfectly with a simple salad. After we were done eating, we got a tour of the place, going upstairs to the other entertaining rooms. beautiful place, elegant and mature in terms of their decor. Black and white paint, tiling, wooden flours, sturdy wood dining tables, and super clean/somewhat spacious bathrooms. And side note, the paper towels in the bathroom are super thick! It was basically the same as the ones I got at Bliss Spa. A winner in my book! I also have to give a shout out to David's helper, Jerome, who was a butcher and was very knowledgeable and patient as he walked around overseeing our work. I accidentally skinned my knuckle, and he quickly stepped in to help. I wish both David and Jerome taught more classes personally, because I would definitely take them! Overall, this establishment is so welcoming. My husband and I came a bit early and inquired about the class. The guy manning the treats/drinks said we could wait, they were still setting up, and asked if we wanted anything. This is a place you want to come back to, because they appreciate and value you as a customer.",4,1,2
6,Mary T.,"New York, NY",6,13,1,5.0,12/21/2017,"What a find! I have always passed by thinking this was just a cooking school, but the cafe is fantastic. The Kale Caesar Salad was delicious. The atmosphere is super chill, especially for this busy neighborhood. A great alternative to the crazy busy bakery down the street.",,,
7,Jennifer M.,"Brooklyn, NY",1,4,0,5.0,6/7/2018,"Where to even begin with this review, except by saying there aren't enough characters to even describe how much we love every detail about HK. The venue is so romantic, intimate and personal and from the initial meeting to the day of, we always felt like it was being planned and coordinated by our closest friends. The entire staff pays attention to every single detail and truly wants to know how to make your day everything you imagined and then deliver just that and more. We worked with the culinary team to create a custom menu and even had signature cocktails that were created based on some of our favorite drinks. The communication with Halle during the planning stages made this bride, a Type A planner feel very relaxed. By the day of, I knew everything was going to be taken care of and I didn't have to worry about a thing. Halle helped us with decisions that we didn't even know we had to make and made everything fun along the way. Then the day of arrives and every single detail came out better than expected, a complete dream come true. Irit was with me every step of the way on that day of, from keeping me company when everyone else was walking down the aisle to even offering to assist a bride in need of an extra hand in the restroom : ).  The food and drinks flowed seamlessly, our friends and family still talk about our meal and then dance party that ensued into the night. We've only been married for 2.5 years and we already want to renew our vows, just so we can get married all over again at Haven's Kitchen.",,,
8,Michelle L.,"New York, NY",869,559,1913,4.0,3/9/2016,"As Maid of Honor to one of my best friends (shoutout to Valerie G!!) in the world, I couldn't turn down the offer to attend a flower bouquet making class that was being hosted at Haven's Kitchen. Using her powers of deal finding, she was able to get us in at a steep discount through Gilt. My first impression of Haven's kitchen was that it was adorable. The front of the place is a cute café and in the back and up the stairs, there is space for events such as cooking classes, hosting parties, and in our case, a bouquet class that included appetizers and unlimited Prosecco in Punch form. Delicious! We were on the third floor and the space was definitely great for hosting a party for a semi-big group. The whole place had an eloquent rusticness to it. The class itself was nice and informative but I think just the whole vibe of the place and the service was top notch. I also would like to point out that their food was amazing. My friend was so impressed. She was saying that she would have definitely considered using them as caterer if she didn't already have choosen one. I couldn't disagree with her as everything was so yummy. We were served little cute fried rice balls, curry chicken wrapped with lettuce bibs, short ribs empanadas, mini crab cakes and a toastini. Everything was high quality, fresh tasting and full of flavor. They constantly ensured there was enough food going around which is always appreciated in events like this as people snatch up the food as quickly as it comes out. Overall, two thumbs up!",9,3,8
9,Nicole I.,"New York, NY",1,49,0,5.0,1/31/2018,"Super cute little cafe in a cooking school. Great for lunch, and not as crowded as everything else (although there's still a line). I especially love the simplicity of the menu: there's a rotating selection of 2 soups, 2 salads, 2 sandwiches. You can get a combo of any two. So that's 30 different lunch options! And the ingredients are fresh and the food is innovative without being too weird for a simple lunch.",,,
10,Lucy C.,"New York, NY",131,1173,43,3.0,7/5/2017,"Good coffee but baked goods, specifically chocolate coconut cookie, not so great. Lots of milk options including oat milk, cute space with good number of seats, and cooking classes in the back. Lots going on here though, I'll be back.",,,
11,Erin F.,"Bedford Stuyvesant, Brooklyn, NY",180,8,2,5.0,10/31/2017,My fav new lunch spot. soup & sandwich deal is crazy delicious.  Love a tasty lunch that is well-sourced.  Way big yum!!,,,
12,Sally O.,"Whitesboro, NY",11,15,0,5.0,11/5/2017,Awesome event !    Cooking class great staff /chefs. Excellent and plentiful wine.   Laughs and learning. I will make every dish again.  I loved it all!    It was a gift evening from my niece.  I look forward doing the whole thing again.  Thank you Tarik and Zoe,,,
13,Sebastian K.,"New York, NY",41,373,0,5.0,7/13/2016,Beautiful coffee shop!! Everything is excellent here from the coffee to the decor and how they serve you the drinks.I had an iced decaf americano with almond milk and it was served in a mason jar which keeps the coldness of the drink instead of a plastic cup which I find not welcoming at all to have a coffee.I didn't taste their pastries but I bet they are awesome too. You can see the staff cooking and preparing food on the back.Just beautiful!,,,
14,Nancy R.,"New York, NY",176,87,119,5.0,12/12/2016,"Such a cute coffee shop!! One of those place you want to take pictures of, especially the bathroom!!I came here for a private event in the back kitchen which was incredible bc the whole thing is so open and you can see the chefs prepare everything. I had to come back the next day and get the full Haven's Kitchen experience bc the decor was so cute that I knew it had to be good. Sure enough a cozy warm vibe during the day. People are working on laptops but its very quiet and not so packed that you can't find a seat. I just got a latte and relaxed with my thoughts for 15 bc living in NY we forget about that sometimes. I def want to come back and try their lunch. If you're looking for a cute coffee place with a low-key coffee/bite/study/work situation this is your place.",3,,1
15,Ellen S.,"Gibsonia, PA",0,10,0,5.0,8/15/2017,"We held our daughter's wedding here in May.  They did an amazing job with everything!! Suzanne and Halle were great to work with.  Suzanne was organized, efficient and very reassuring during the entire planning process.  The venue itself is beautiful and created a very intimate atmosphere for the wedding.  The food was delicious and they had no problem accommodating our guests that needed gluten free or vegan diets.Thank you Haven's Kitchen for some great memories!",,,
16,Monica C.,"New York, NY",23,79,459,4.0,9/30/2016,"This is a charming little space that was a former carriage house, then a Japanese furniture store before it was turned into a cafe and cooking school  The coffee in the café was good although the low back seats were a bit uncomfortable . I really enjoyed the cooking class.  The instructor was a guest and the featured ingredient was fermented vegetables from a local farm.  The class was excellent- the instructor explained everything step by step and the students worked together and then sat down afterwards for a delightful dinner together.  I just wish they would have had all the students wash their hands before food preparation.",1,2,1
17,Brian S.,"Manhattan, New York, NY",120,84,7,5.0,2/10/2016,"My wife thought we should come here and take a class. She believed I would enjoy getting out of the house, drinking wine, chatting with people and cooking things. The teacher Syd was lovely. She made sure I had wine from the get-go. Very important.The class was centered around ramps season. Until that time I was unaware there were vegetables called ramps and I certainly didn't know they had a season.  Ramps are delicious garlic-like things. You can, I came to learn, make all sorts of amazing dishes with them. I love ramps, and I long for their season to return. That's not a statement I would have ever made before this class.The revelations kept coming too: I've been using a knife improperly my entire life. Kosher salt is actually dramatically different than regular salt. There is a professional way to pinch salt.Also, the wine kept coming. Very important.The class had several women. I remember thinking that if I were single I would take classes here. And download Tinder.Everyone gets assigned tasks. Chopping things. Stirring things. Mixing things. Separating yolks. We all had purpose in our lives. FOR ONCE.I was assigned with another guy, Ben, to the Baby Artichoke Fryer task force. Our mission? Cut baby artichokes just right, lightly batter them and give them a little fry. Ben and I had a good system going. We bonded. Just two manly guys working as a manly team to make artichokes not be raw anymore. Comrades-in-artichokes. I imagine it's the same kind of connection a man makes with another man in combat, except your life isn't on the line because you're delicately frying vegetables.In the end, it all came together and we sat down to a big, delicious, socially engaging ramps-infused feast. With wine. Very important.We've since been back for a second class from the Murray's Cheese people. It was fantastic.I see there's a third class on the horizon because my wife and I share not only joint banking accounts but joint iPhone calendars. That's love.",2,16,3
18,Ellen L.,"KNICKERBOCKER, NY",10,74,2,5.0,12/26/2016,"Where do I even begin? Halle, Bryn, Irit and Chef David are all just outstanding. My husband and I held our surprise wedding here earlier this month and planned it all in under 3 months. Halle was an absolute pleasure to work with and gave us the timeline that we needed to stick to. My husband and I were pretty lacksadasical with our planning and had some pretty crazy scheduling conflicts leading up to our wedding day so we really appreciated Halle keeping us on task and checking in with us to make the various decisions. Halle also brought in her expertise to help us make some of the decisions that we really didn't know/care that much about (like what color/texture linens..??). She also used some tricks to help us stick with our budget which we also really really appreciated. The day before our wedding, we met with Halle, Bryn and Irit when we dropped off all our decorations and supplies. During the planning, we communicated primarily with Halle but when we met for the rehearsal, it was clear that Bryn and Irit had both been looped in to all the details (our candy bar, tea for our parents, surprise party, etc) On the actual day, Irit and Bryn were total rockstars in making sure the wedding went smoothly. They were on hand for the setup and kept an eye on the flow of food and drink throughout the night. Bryn was also my signal girl when it came time for my processional.  After the wedding, the HK team meticulously packed away all our gifts and decorations back in the bins and got it ready for us to pick up during the week. TLDR: the HK team is a true gem and I would recommend anyone to hold their event here. Separately, their coffee is bomb. so basically, there really isn't anything they can't do.",2,,
19,Dimitri S.,"New York, NY",61,229,333,5.0,2/12/2017,"Great place to take a cooking class. The kitchen is large enough for a group of up to 12 to participate and gather around the island space. We learned how to make Coq Au Vin and our chef instructor and hosts were terrific. The wine was flowing, overnight for the chicken and during the class for the participants. The three course meal was delicious. They also have two larger event spaces above the floor with kitchen. Looking forward to taking another class in the coming months. Book early as the classes fill up.",,,
20,Haven B.,"Manhattan, NY",0,16,10,4.0,12/3/2016,"We enjoyed our class, noddles around the world. It was intimate (10-12 people) with lots of hands on instruction. We had a great meal with wine throughout and learned a few new transferable tricks (i.e. knife skills). Our biggest complaint was that we didn't eat until over 2 hours into the class (9pm for a weekday evening class).  It",1,,
21,Jasmine W.,"Brooklyn, Brooklyn, NY",0,70,2,4.0,10/28/2016,I've come here for lunch a few times. They always have vegetarian options. I also did a cooking class (pasta making); it was amazing! Would definitely recommend for the class.,,,
22,jordan s.,"Manhattan, NY",4,36,1,5.0,6/23/2016,"I did a vegetarian cooking class here with my wife and mom. The whole experience from start to finish was fantastic. It was a laid back atmosphere with wine served throughout, no pressure on how to make the different dishes, help from the team and the menu (and later the meal) were delicious. I'm not a vegetarian and actually love eating meat, this simply happened to be the only class that fit our schedules, wasn't booked and was best suited for my wife's dietary restrictions. I was a bit nervous that the menu would be gross and it would be an unpleasant experience. It wound up being great which I imagine all their different classes/meals are so I wouldn't worry about which one you choose. I would 100% recommend going here and one final pro tip- if you like granola, they sell their own custom homemade granola in the store and its incredible. Buy some as a parting souvenir!",1,,1
23,Dana C.,"Eastchester, NY",2,38,6,2.0,1/15/2015,"Cooking ClassI Instructor is good, resulting food was terrible.Having read some very good reviews about the cooking classes at Haven's Kitchen, combined with my eating style of very fresh and healthy food, I was really excited to take a class called ""California Cooking for New York Seasons"".I really liked the way Chef Sydney Wilcox had the class structured, she gave guidance, but the participants were the ones who really prepared the food. She would stop at various points and give us pointers about different knife skills, why a dish is prepared this way, and that anchovies lose their fishy flavor when cooked (NOT TRUE!).The food included Bagna Cauda (this is the dish that reeked on anchovies - sorry I detest them), which I found inedible, although it looked great. There was also aroasted vegetable salad with a stinky-feet kind of cheese, which I also found inedible. There were pan roasted starchy vegetables (potatoes, jerusalem artichokes) that were bland, a chicken that was dry-marinated with herbs and rubbed down with duck fat that had absolutely no taste (how on earth was that possible?). Last and least, a lemon pudding cake that was so cloyingly sweet it could have put the most hearty of people into a sugar coma - but not in a good way.Although I would not recommend this class, especially if you are looking forward to eating the fruits of your labor.",2,,
24,Elizabeth L.,"New York, NY",232,801,242,5.0,10/28/2012,"Passed by this place a couple times now, and finally went in. Their brownies are remarkably good! I'm usually really skeptical of brownies, but the ones here have a perfect consistency of fudge. I also hear from my boyfriend that the coffee's really good. Haven's Kitchen is also an event space, and they have cooking and baking classes monthly. Will have to check those out too!",4,,
25,Marlos C.,"Edmonton, Canada",44,5,0,3.0,6/10/2016,"The food is ok, but there are not many options. You always have 6 options, 2 soups, 2 salads, and 2 sandwiches. I'd go back, but it is not my preferred restaurant in NYC. The staff is nice and they are quick.",,,
26,Samuel B.,"New York, NY",0,45,0,1.0,9/4/2015,"My spouse and I recently took a knife skills course here. It was advertised as a class where we would learn knife techniques, as well as be provided with a full meal - neither of which happened. We stood around a cramped space and were ""taught"" how to cut vegetables at a level pretty much prepared for a new born chimpanzee. The ""meal"" that was subsequently provided consisted of the uncooked vegetables we just hacked, and a few chickens that the 12 dirty-handed patrons had just mauled before being dumped into a bucket. We left $90 lighter, completely bored, and very hungry.",4,,1
27,Jessica H.,"New York, NY",16,47,5,1.0,7/13/2015,"I'm still in planning stages of my wedding, but I'm flummoxed by how I was treated by their events coordinator. I'm not much of an party planner and don't really know how to throw a wedding. So far this fact has not been much of a deterrent in my search for a venue... Most coordinators sit down and go over their pricing structure and options and discuss your taste and expectations, making the process very clear. This wasn't the case at Haven's Kitchen. First red flag was my email attempting to confirm an appointment time got lost in the coordinator's inbox, so I had to wait an additional week to see the space. Second red flag was upon arriving early, she admitted it worked great because she had accidentally double-booked my appointment, so there was time for me to see the space before the next people. She then rushed us upstairs to look at the ceremony space with a, ""well, this is it"" attitude. She honestly gave me a sense that she'd rather not plan my particular wedding... Explaining very little and very tersely. She seemed to expect that I command the process, but as I said previously, I dont really know what I'm doing and I wouldn't know where to start, I can't be the only bride without an idea of how to throw a wedding. Any questions I asked were answered brusquely, as if I should know the answers. I asked to confirm that extra things were included... tables, chairs, silverware, linens... Instead of confirming she decided to go the negative route, ""We don't have linens."" Great, okay, thanks, I was just listing possible items, but everything else? ""Yes"". K. I ended it there, but it would have been nice to have that line of questioning led by her instead... The types of tables they provide, their set-ups, etc. The area described to me as the place where the bridal party can lounge/briefly escape (living room, not bridal suite) is behind clear glass. I asked if people tend to cover the glass, for privacy. A reasonable question, I'd think, but no. Everyone leaves it open. Honestly, what if someone wanted privacy, do they seriously lack the lateral thinking required to imagine the space with a removable drape? Why does this suggestion ring as a ridiculous concept to the ears of their coordinator?To be honest, it wasn't her actual words or responses, but rather her demeanor. My friend that came with me picked up on this as well. When she asked whether the space provided wifi, the coordinator bluntly asked ""Why?"" You could read that and think a person is not being rude when they ask this simple question, but the delivery was so blunt that I was taken aback. I decided that even if I loved the space (it was fine, reasonably priced) I really did not want to entrust this person to the coordination of my ceremony and reception. I didn't want to feel dumb for asking a question that might have an obvious answer or sound like a silly suggestion. I want to work with people who are happy and excited to work with me. Halle just came off unprofessional, which is surprising considering her impressive resume. I initially chalked it up to inexperience, but that's not the case. I could list the awkward moments, but the whole experience was awkward overall... Random questions about my dress/bustle, the suggestion that I check out their Pinterest, instead of actually having photos on hand to show people...  I dunno. There was no clear intention she wanted any part in my wedding or interest in my business, so I decided not to waste either of our time and cut the appointment short. Let's face it, this is NY, wedding venues are not suffering for work, but honest to God, I will never recommend this place based on this experience. I really should have just left it at the forgotten email.",17,,
