,er_name,er_location,er_freinds,er_reviews,er_photos,er_rating,er_date,er_text,er_useful,er_funny,er_cool
28,Jennifer N.,"New York, NY",617,100,180,3.0,1/23/2015,"I came here for a warm drink so this review has nothing to do with their cooking class and the bazillion of other things they offer here.The place is BEAUTIFULLY decorated. I'm in love. Everything is so simple yet sophisticated. There is a giant menu with a ton of drinks and pastries to choose from. There were plenty of seats open but the place definitely wasn't empty. Besides drinks and pastries, they also sell snacks, quirky objects, and other things across from the register.The barista was really friendly and I ordered my go-to, a chai latte. As great as this place sounds, my trip ended poorly when I took my first sip of my drink. Maybe the barista thought I said a latte or maybe she had an off-day because my chai latte wasn't spicy enough to be a proper chai latte. For $4.50 for a small cup, I'm not impressed. Haven's Kitchen's cafe is a chill place to be that is spacious that serves a variety of drinks and pastries. If I'm in the area again, I'll definitely pop in but will have to try another drink.",,1,
29,Chicken H.,"Indianapolis, IN",1,16,3,4.0,3/18/2016,"Nice atmosphere. Decent food! A pleasant place to stop by for lunch. Corned beef sammich and citrus salad, root beer. I'll be sure to return",,,
30,Frank M.,"Greenwich Village, Manhattan, NY",25,40,40,5.0,11/26/2014,"Love this place, cute and cosy! Attentive relaxed service! Delicious food and great coffee, all with a smile! Worth visiting when ones in the area!!",1,,
31,Karen C.,"Manhattan, NY",45,37,1,5.0,11/24/2013,"Almost hate to write a review about this place since every local has a cafe they want to keep for themselves.Nonetheless! I know about havens kitchen as a cafe more than a cooking space (although I can attest that the decor is very sweet- think modern practicality with small touches of DIY quirk).I love their products, coffees and teas. This is an affordable cafe with high quality beans and leaves. My favorite is the rooibos tea, which has a citrusy note that I haven't tasted with other rooibos teas.It's a great place to read or do work (free wifi). The restaurant also has a great vision of being a community space and uniting local farmers with local consumers with sustainable crops. How can you beat that?",5,1,1
32,Andy L.,"New York, NY",31,20,4,2.0,7/16/2013,"My fiancé and I were all set to put a deposit down for our wedding at Haven's Kitchen when we learned that it would cost us nearly 3x what we had been quoted. Not only were the food and beverage prices higher, but the venue rental, which had been quoted at $5K, was actually $15K. If the cafe on the bottom floor was left open the cost could drop down to $9K. I researched over 30 wedding venues in Manhattan and the venue rental price makes Haven's Kitchen easily one of the most expensive places in Manhattan to have an event. Additionally, we had been told that the venue rental cost was inclusive of rentals and flowers for the space. Neither of these things turned out to be true. Yes, the furniture and whatnot that they do have is included, but it is not enough to have an event for the full 100 people that the space fits. The cost of flowers is not at all included. They will provide the arrangements, but you will be paying for them. My fiancé said that she would never try on a wedding dress that she couldn't afford because she didn't want to fall in love with something she couldn't have and that's unfortunately just the experience we had with Haven's Kitchen. We loved the venue but wasted time visiting and discussing a place that was absolutely not in our price range, even though we had been told it was, and were left feeling disappointed, frustrated, and lied to. If you have $50K to spend on venue, food and beverage alone, than buy all means visit Haven's Kitchen, but if you have a more moderate budget than don't bother, because they cannot accommodate you.",18,1,
33,Evelyn L.,"New York, NY",77,150,7,5.0,4/14/2014,"I've been here twice for two completely different events on different floors. Both were really well planned and enjoyable.My first time at Haven's, I was here was for a fashion launch party in the event space on the top floor. The space was bright and airy, with more than enough space for ~50 guest to wander and browse through racks of pretty clothing. I imagine this place would also be a nice location for a medium sized wedding (~100 people). Haven provided pastries and champagne for the launch party. Although I can't give them credit for the bubblies, the dessert, I assume, came from their kitchen and tasted heavenly.The second time we actually got to take a private cooking lesson in the kitchen/dining area on the ground floor. We made sunchoke soup, fennel and citrus salad, roasted beets, skirt steak and lemon tart. Chef David patiently demonstrated each step and carefully supervised us to make sure no one messed up too badly. Despite being cooked by a bunch of finance dudes and their tipsy spouses, the food actually came out tasting quite good. If you're looking to have an office social event, I highly recommend Haven's cooking classes - it sure beats awkwardly shifting your feet as you make small talk with your fiance's colleague's wife at some random restaurant.",1,,1
34,Minty M.,"Manhattan, NY",0,208,16,4.0,"9/15/2015
            





Updated review","Really, really good iced cappuccino. Hand-frothed milk and smooth coffee. The soups, sandwiches, and desserts are good. The artisanal atmosphere gives the impression of healthy foods, but they're not really. White flour, a lot of butter...natural maybe. I wish they'd expand their menu options.",,1,
35,Amanda T.,"Manhattan, NY",0,2,0,5.0,12/3/2015,This has been my special place to go for a great cappuccino and the best cake in town. The lemon poppy seed and iced ginger cake were my favourites until the unbelievably delectable iced donut appeared on my last visit! All the staff are friendly even at its busiest times but a special mention to Alison who always remembered me and ask what cake will I be trying today. So sad to be leaving my favourite coffee spot in NYC!,,,
36,Mrs P.,"Manhattan, NY",0,6,0,5.0,3/24/2015,"We just had our sons wedding for 22 guests at Havens Kitchen and it was a pleasure from start to finish. With only 6 weeks to plan Havens Kitchen staff made us feel confident that they could make the day run with ease and they did. Halle and Bryn made us welcome and there was excellent communication at every turn  with ourselves and our vendors.We held the ceremony and had the dinner and dancing in the third floor loft venue. The room is real NYC downtown loft style bright and light just ready to be customized with personal touches and bright flowers.  Meal service was impeccable and cocktails delicious, the Hemingway Daiquiri was a big hit. The photos from the day say it all lots of happy faces!",3,,
37,Jean H.,"New York, NY",122,465,13,4.0,6/30/2013,"Came here twice, once to scope out the space for something wedding related, and again for a fundraiser. As a Chinese American person.... this place is waay too small for a wedding of Chinese proportions*. My guest list was about to burst at the 200 guest** seams and this lovely place can accomodate... 70? I was still hoping i'd be an alright size for my wedding rehearsal dinner.The fundraiser was amazing. the food.... i am still dreaming about it. You will be very delighted with this space as you will not need to do much decorating at all and the food is a delight.*** --------*Just think about China's population pre-State-imposed family planning.... yeah, there is no state-imposed family planning here in America.... well, we're just like down n' dirty rabbits**I ultimately didn't get married, but I guarantee if I ever go down that route again.... I very well may return here as I will def. not be hosting a Kardashian sized wedding! *** quality here, not quantity or size. its how you use it, folks, not the size.",1,4,1
38,Kimberlee V.,"New York, NY",19,40,12,4.0,7/18/2013,Super cute place tucked away from 6th Ave. Ordered a muffin and lemonade. Both were delicious. Wish there was more on the baked good menu. Went at 11 o'clock so perhaps they were all sold out from the morning? I used a FourSquare deal where you get a large drink for the price of a small. It had a grade pending in the window but it seemed very clean from the front. A nice table in the back to work on your laptop. Otherwise high bar stools in the front. Definitely recommend if you're in the area!,1,,
39,Benji S.,"Brooklyn, NY",1,17,0,5.0,5/29/2012,"I had a Saturday night engagement party here, and I could not give this place a more glowing review! NY is amazing for our hidden gems, and Haven's Kitchen is one of the rare establishments that really make NYC an even better place to live.Service: Incredible! Rather than treating you like a customer, they treat you like a friend throwing a party. The whole party planning process was incredibly easy, as their coordinator took care of everything and was really great about communicating with us. They took time to get to know us and make sure the party suited our tastes. You and all your guests will be talking about how wonderful these people are for days. Food: Amazing! I often wonder why a catered event can't serve top quality food.  Haven's Kitchen made me realize that all of the caterer's food I have previously eaten was just subpar. The food surprises and excites! The wines and cocktails are also fabulous. Decor: This place is bad ass. It feels chic and hip, but also inviting and cozy like you're at home. Check out photos on the internet.Price: For what it is, the price is reasonable. They do not nickel and dime you and they go out of their way to please. They provide you with a cool space, incredible service and amazing food. Nothing really high class is cheap in this city, and you get value for your money here.",7,,
40,Julian P.,"Brooklyn, NY",17,18,0,5.0,4/3/2014,"My husband and I had our wedding ceremony, reception, and dinner all in Haven's Kitchen second-floor space. (They also have a delightful café on the first floor, a spacious open kitchen for cooking classes, and a larger third-floor space for bigger events.)The space itself is beautiful - simple but elegant. They're happy to spice it up for those who want to add design elements, but we liked it as it was and only asked for a few minor changes. We loved the reclaimed wood tables and the exposed brick walls.Halle and the rest of the venue staff couldn't have been more helpful or gracious. They accommodated all of our requests, and asked the right questions to make sure nothing was left out. They put together a fabulous menu based on a conversation about our likes and dislikes, and helped us plan out a schedule for the evening that helped us all stay organized without making us feel like we were sticking to a hard plan.On the big day, they gave us full run of the space a couple hours early for pictures, accommodated last-minute changes and requests, and served up some of the most delicious food and cocktails that I've had in a long time.I can't recommend them highly enough. If you're planning a small wedding or some other kind of party or function, you won't go wrong with Haven's Kitchen.",5,,
41,Mary H.,"Manhattan, NY",43,10,0,2.0,1/10/2014,"It's a beautiful space, but don't book an event here.I booked our company's holiday party at HK. Despite making it very clear that we had vegan/vegetarian staff and needed a full dinner set up (and, moreover, having the staff agree to separate meat from vegetables and have areas for seating), the planners did the exact opposite of what was agreed on.What's worse is, when I expressed my frustration, they gave me an attitude about it and gave a measly $300 discount off of a party that cost thousands of dollars. Terrible attitudes and service.",7,,1
42,Crystal W.,"New York, NY",46,165,25,3.0,8/9/2014,"I usually just come for a coffee, which is a bit pricey compared to all the other options in the area, but I like to visit just because the space is so damned pretty and they serve La Colombe and yummy baked goods. It's a nice place to stop off and have a chat with a friend for an office break. Curious about their cooking classes as well.",1,,
43,Asta S.,"Boston, MA",22,359,28,5.0,11/23/2014,"Came here for an event and EVERYTHING I tasted was amazing - the charcuterie included pate and terrine, somethign that looked like brie, but tasted myuch better, as well as something called D'Artagnan. They also had braised short ribs which were AMAZING.  Lovely setting, hope to come back soon!",,,
44,Sophia D.,"New York, NY",0,1,0,5.0,12/12/2013,"Cooking Class Review and Event ReviewHand's down, the best cooking class in NYC. Here is what you need to know.  The instructors are good. If you can, take a class led by Chef David Mawhinney. Look him up, this guy's got chops. He is the head chef at Haven's, and has experience working at some of the best restaurants in the city (i.e. Per Se). Even if you know a lot about food and cooking already, you will still learn from Chef Mawhinney. He is exceptional at making novice cooks comfortable, but also gives skilled cooks plenty to put in their pocket. He teaches advanced technique, and not just recipes. Classes are small, you drink wine, and you cook with premium ingredients: locally sourced, farm to table kind of stuff. Really this is less of a class and more like a super fun night out. One class I went to had 8 people in it, the other 10. The night starts with a little wine, and soon you get down to hands on cooking. When it is all done, you sit down at a lovely dining table and enjoy the fruits of your labor. It is a proper meal, at a proper table, with proper cutlery, and cloth napkins. I have taken two cooking classes here. The first was a Chinese dumplings class, and the second was a Thanksgiving turkey class. Both were amazing. We actually ate a whole Thanksgiving dinner with turkey, stuffing, cranberry, salad, and gravy. Since we all practiced trussing on our own individual chickens, we each had a whole roast chicken to take home with us, along with some other leftovers. Did I mention you cook with premium ingredients? That chicken was crazy good. I went by myself the first time and brought a friend the second time. Both experiences were great. It is a brilliant place to take a date. Gentleman, if you want to impress, take her here.  I found out about Haven's Kitchen because I went to a wedding reception that was held there. Some other Yelper on here is griping about the fact that he could not afford to have his wedding at Haven's, and he is trying to blame the venue for that. I can't afford to eat at Per Se, but I am not about to harangue Thomas Keller. All I know is the wedding that I went to was one of the best I have ever been to. The venue is far from boring: there are different levels with different moods and cool cocktail bar. The food was outstanding, and of high quality. The service was impeccable. It was a pretty worldly guest list, and no one left unimpressed.",3,1,
45,Tory E.,"New York, NY",0,4,1,5.0,1/13/2015,"Had so much fun at the pasta making class, and the simple seasonal suppers class!",,,
46,Tim W.,"Manhattan, NY",119,528,359,3.0,2/7/2012,"This is a new mutli purpose cute little spot in the Chelsea area.  In the front there is a fine goods grocery with beautiful pastas, sauces, salts/pepper/spices, along with some local cheeses and little treasures to decorate with from flowers to linens and glassware.  In the midpoint there is a coffee bar serving La Colombe coffee, in the rear and upstairs are kitchens for cooking classes that seem to be based on the season.  When i was in, there was Valentines day cookie making!  The space is beautiful, the staff is warm, and overall you'll feel quite special sipping a coffee leaning against the giant marble slab hi table.",1,,1
47,Chris D.,"Financial District, NY",0,32,5,4.0,4/15/2014,"Popped in for a quick weekday lunch and it was delish! A friend and I shared the white bean salad and the spinach and artichoke grilled cheese. Couldn't fault anything and will definitely be back. Price was reasonable for the area/quality.I was eyeing up the cookies, so next time those are top of my list!",1,,
48,Chau M.,"Brooklyn, NY",390,78,2,5.0,11/7/2013,This place is incredible. First off- the service is great- Alison and the head chef David were awesome. We had a whiskey tasting here for some clients and the event was so much fun and educational. The food and venue were absolutely lovely. I definitely recommend coming here for any private events. I've heard there's a tequila class as well so definitely will be visiting here again soon!,1,,1
49,Alice E.,"Brooklyn, NY",484,787,1,4.0,11/7/2013,"Some of the best chocolate chip cookies in NYC, great cooking classes and awesome kitchen stuff.  You are gonna want everything here!",1,,
50,Laura I.,"New York, NY",138,140,90,5.0,5/31/2013,"I came here for a private party and was very impressed. The food was delicious and the specialty cocktails were amazing and unique. They closed down the whole space for the event which was located on the 2nd floor. The decor was super cute and they seem pretty flexible in arranging things to fit your party needs. This space also seems perfect for a bridal shower, rehearsal dinner, or engagement party.",2,,1
51,Julie K.,"West Islip, NY",0,5,0,4.0,7/1/2014,"Haven's Kitchen is one of my favorite ""hidden gems"" in NYC. The lunch specials are great for a quick lunch-on-the go although it can be a little pricey. The lunch special is $11 for a choice of 2 options (salad/soup/sandwich). The menu changes weekly and they always offer Meatless Mondays options. The menu is always in season and local - fresh grilled asparagus and hard boiled egg grilled cheese, chilled zucchini soup, heirloom Tomato, mozzarella, Basil Pesto, maldon salt sandwich, etc. SO good. While the savory foods are out of this world - the sea salt chocolate chip cookies are why I really frequent Haven's Kitchen. You have to try them!! The decor is so cute and such a great place to hang out - rustic with white subway tile. They have great cooking classes and options for groups too!",,,
52,Ethan F.,"New York, NY",0,51,0,2.0,2/23/2015,"I don't mind paying $11 for a sandwich although I do expect it to both taste good and fill me up. I  was here a few days ago and got the chicken sandwich with smoked gouda and jalapenos. It certainly sounded delicious. As I ate it, though, it became pretty apparent that there was likely no more than 1/2 ounce of chicken in the sandwich which is really just pathetic. I know that Haven's Kitchen markets itself as an upscale cafe with high quality food, etc but WTF? 1/2 ounce of chicken in an $11 chicken sandwich is just insulting. After finishing the ""sandwich"", I left Haven's Kitchen and had to find another place to eat lunch.",1,,1
53,Glenda F.,"New York, NY",9,3,0,5.0,1/28/2013,"Beautiful event space upstairs! It's rare to find such a cool, well-sized space for events in the city with great service, yummy food, superb wine and chic decor. Had our company holiday party here and was very impressed.",2,,
54,Karolina H.,"Tolland, CT",0,7,8,4.0,10/4/2013,"We just stop by for a quick snack. The place is a cool combo of a small store with coffee shop and cooking classes. Try sea salt chocolate cookies, they are amazing!",,,
55,John B.,"New York, NY",4804,651,196,3.0,2/21/2012,"I was heading west on 17th Street to the Barney's Warehouse sale when I passed by, walked in and checked out Haven's Kitchen. What a delightful spot and because I was about to brave the BWS, got a smartly pulled espresso to give myself a mid-afternoon energy boost before heading into the depths of hell further up the street in search of a 'bargain.' Who know, maybe the espresso worked because I found an Armani black label sport coat for $150. Yes, it was a steal and this place is a treasure.",4,2,3
56,Kim D.,"Williston, VT",2,46,2,4.0,3/1/2013,"This place is darling and while a bit precious, still a very nice place for excellent scones and properly served tea. Cooking classes, event space, specialty shop- a unique business combination and  a good rest stop for foodies on a NYC walk.",,,
57,Meghan B.,"Manhattan, NY",0,16,0,5.0,3/28/2012,"I love this spot! The staff is friendly and helpful, the good are local and the coffee is delicious! It's a little more $$ than I like to spend in the AM on my coffee, but totally worth the price - plus, the fellow who works in the mornings always remembers my order! I'm looking forward to taking cooking/baking classes with them soon!",2,,
58,Ana M.,"San Diego, CA",98,244,315,4.0,3/1/2012,"We stumbled upon this jewel by accident and glad we did. We were visiting the city and decided to turn down a street which led us to this place. It's darling inside! We had coffee and looked around at all the cute nicknacks they sell. I saw they offer cooking classes, which I would love to take if I lived in the city.",1,1,1
59,Meg S.,"New York, NY",0,3,1,5.0,"1/14/2015
            





Updated review",Took a tamale making class. Fantastic! couldn't have been a better experience. I will definitely return.,,,
60,C W.,"San Francisco, CA",3,2,0,5.0,10/14/2014,"Absolutely LOVE this place! Came to a cooking class, excellent instruction, super low-key and fun.  The ambience is so pleasant and cozy, you know the owner/designer put a lot of thought into creating a venue that feels personal and feels like home.",,,
61,John C.,"Manhattan, NY",46,9,9,5.0,3/11/2012,"Wonderful interactive spot where you can enjoy excellence in teas, coffees, ingredients for home cooking & cooking courses. This place makes my neighborhood feel like a neighborhood. You can tell they made a good impression on me... Thanks!",1,,
62,Megan E.,"Indianapolis, IN",118,7,0,5.0,6/12/2014,"Such a great experience. The staff was very communicative leading up to the event, the space was perfect for our group, the food both healthy and AMAZING, and the chef was extremely talented but with no sign of arrogance or impatience. I would highly recommend HK.",,,
63,Susan F.,"New York, NY",0,2,0,4.0,3/19/2012,"This past weekend, I took a Baking course at Haven's Kitchen and I was prompted to write my first review on Yelp since I had such a good experience. The course was three hours long and attracted an eclectic and fun group of people. We rapidly zipped through 7-8 baking basics such as pie crust, cream puff pastry, ganache, caramel, lemon curd, etc.  There were both demonstrations by the instructor, who was good, and ""hands on"".  Haven's Kitchen is a delightful setting, much better equipped than a lot of cooking class kitchens like ICE.  All in all, it was a really fun experience.  And at the end, we ate our home-made eclairs, cream puffs, and truffles at a french country farm house table.  And their mission is admirable--to educate people about tasty sustainable fare.  There are lots of other options available--someone in the class had been to Sangria and Tapas and liked it very much...",,,
