,er_name,er_location,er_freinds,er_reviews,er_photos,er_rating,er_date,er_text,er_useful,er_funny,er_cool
53,S F.,"New York, NY",0,13,1,4.0,7/30/2016,"Good local spot for breakfast or lunch. The made to order omelettes come with potatoes and are quite good. You can pick any cheese and veggie combination. They have WiFi which is a plus. I'm not a fan of the TV but I'm sure other people love it! Super nice staff, the service is fast. You can call in advance to order which is convenient.",,,
54,Briana M.,"New York, NY",1,9,4,1.0,10/11/2015,"I ordered a bacon,egg & cheese sandwich for my BF and specifically noted 3 eggs. When the food arrived, the sandwich was not made with 3 eggs, meaning my request was completely ignored. I ordered the 2 eggs meal which comes with home fries, a choice of meat and toast. My eggs tasted like water was added to the mixture and I was given a sausage patty instead of sausage links like I had expected. Overall it was not what I expected based of the great reviews I read. Not ordering from here again.",2,,1
55,Lauren A.,"Staten Island, NY",0,1,0,3.0,10/5/2015,The customer service is excellent here. My work is just a few blocks away and I come to Brother's every morning for coffee and eat here on my lunch break. Wonderful place to sit down and relax.,1,,1
56,Maria H.,"New York, NY",0,1,1,1.0,9/12/2015,I am very disappointed with this establishment. Eating there delicious breakfast for a whole month when they first open I decided to take a break. Today I go and ordered Chicken Tenders with French Fries... How hard would that be?? To my disgrace I could not believe what I was given. My fries looked and tasted like scrap and the chicken had so more breading than chicken. I march right over to them and explained to them how i felt. Right away the owners mom buds in and says why I accepted the food? Hello how was I suppose to know what I was getting.. Her food looked delicious and tasty and we ordered at the same time. Why because she is the owners mom? You lost a customer.,1,,
57,Juliet H.,"South Orange, NJ",65,82,26,3.0,9/30/2015,"I come here when I am craving something sweet since it's close to home but I will not go out of the way for it.  I have had cupcakes, bars, cookies, cakes and a quesadilla one time and everything is just okay. Nothing stands out and I end up getting annoyed by the staff who know nothing about the baked goods or what they are. My question: ""Is that a lemon tart?"" Her response, ""something like that.""  I don't really have high expectations for most places in this neighborhood so this spot is just another place for when I am too lazy to venture further than two blocks from my apartment.",,,
58,Andrew M.,"New York, NY",0,2,0,5.0,6/13/2015,Great addition to the neighborhood. I've stopped in several times and it has always been a pleasant experience. The staff is wonderful and the food is delicious.,1,,1
59,Lena P.,"Manhattan, NY",11,52,94,1.0,8/24/2015,"This place is cute and looks clean.. And that's why I kept coming here for my pick up lunches. It's just 2 blocks away from us and I could be eating here everyday since I eat out a lot. But many things here don't make sense and never have I gotten a right order from them. It feels like they are ''playing restaurant'' in here and when there is an issue there is never a manager to talk to, even his/hers NAME is a very private information.I usually get an egg whites wrap which it's supposed to come with cheese and vegetables. I get home and it's missing my vegetables. Funny thing I was trying to eat healthy, and this was just full of melted bland cheese in a wrap with very little egg whites in it. And because it's so small I usually get a salad too. Everything comes in small sizes. You look at their menu and you think wow !! food is not very expensive here, but then you get it and it's the smallest sandwich or salad you will see. With the price you pay for the few pieces of veggies to put on your salad it adds up and it's not so cheap anymore. Not to mention the tiny container with dressing for salad that only covers three of my spinach leaves. When I asked for extra dressing I was charged for it, and when I got home there was no dressing whatsoever in my to go order. Not even the one I PAID for. One star for the wi-fi. The staff in the front are nice but that doesn't fix my order. ''Sorry'' it's all you will get and another messed up tiny wrap or salad with missing ingredients that they charge extra for.This was my last attempt of another chance given to this place. Since all I end up with every time I come here is a major frustration in the middle of my day off, I will avoid this place and check out the new ones in the neighborhood. There are plenty other options around to waste your money on nonsense !!",,,
60,Rebecca R.,"Brooklyn, NY",2,10,0,4.0,9/22/2015,I always order from this place the food is good and I especially like their fries. The only thing annoying is sometimes the delivery guy comes straight to my door and others he makes me come downstairs to get it. But overall the food is great and offers a nice selection.,,,
61,Venessa F.,"Manhattan, NY",0,7,0,3.0,9/26/2016,"I've been a fan of this establishment since it opened, however lately the quality of the food and the workers has decreased. Chicken burrito barely has chicken, chicken soup is mostly broth and vegetables, pancakes are undercooked and bacon is so burnt it's not edible.  Gave an order to one of the young ladies, my order was very clear and specific. It was still given to me wrong- not once but twice. If I do continue to make purchases at this bakery, I'll keep it to the simple stuff.",,,
62,Gabriela A.,"Manhattan, NY",0,6,3,1.0,7/23/2015,BEWARE EVERYONE! The baked goods from this place was absolutely disgusting. It tastes as if it was really old and the cheesecake was really hard. I almost vomited from how gross it was. I am never ordering from this place again!,,,
63,A B.,"Manhattan, NY",0,5,0,3.0,4/28/2016,"It's great to finally have a clean, decent cafe in this area, but I really wish they had ready made sandwiches and other things that you can just pay for and leave. They have some ready made items, but it's only things like yogurt/fruit. If you want a sandwich or salad you have to order it, and they can be very slow. Kind of annoying when you just want to quickly grab some lunch on your way to work in the morning.",,,
64,R W.,"New York, NY",0,4,0,5.0,7/4/2015,"I ordered delivery. The salad was fresh and delicious, the panini was great, and the desserts were amazing.",1,,1
65,M C.,"Manhattan, NY",0,6,0,5.0,6/21/2015,"Fresh made cookies are delicious! I've had several different items, salad, sandwich, bagel, and the food is consistently yummy? Great addition to the neighbor.",1,,1
